score	file	line	text	context
6	048.避免阴茎在窃听.txt	113	为什么要偕老？一起老了有什么值得称道？同步之趣有时不在同代，而在隔代又隔代，为什么祖孙之间的画面别有情趣？岂不正因为他们隔了时代？祖孙之间还不够切题，还是男女之间才正点。歌德八十开外与十八岁少女的恋情，正是一个焦点。十八岁谁要同八十岁偕老？那只同步，只是在时间上同步关系，但不是偕老关系，以老为焦点看八十开外的歌德，你显然弄错了切入点。	“为什么要偕老？一起老了有什么值得称道？同步之趣有时不在同代，而在隔代又隔代，为什么祖孙之间的画面别有情趣？岂不正因为他们隔了时代？祖孙之间还不够切题，还是男女之间才正点。歌德八十开外与十八岁少女的恋情，正是一个焦点。十八岁谁要同八十岁偕老？那只同步，只是在时间上同步关系，但不是偕老关系，以老为焦点看八十开外的歌德，你显然弄错了切入点。”
5	048.避免阴茎在窃听.txt	115	那十八岁是歌德当年情人的女儿。	“那十八岁是歌德当年情人的女儿。”
3	048.避免阴茎在窃听.txt	117	情人使你岁月老去，情人的女儿却使你时光倒流，情人的女儿的女儿，却使你倒流又倒流。因为孙女十七八岁，高中女生。	“情人使你岁月老去，情人的女儿却使你时光倒流，情人的女儿的女儿，却使你倒流又倒流。因为孙女十七八岁，高中女生。”
3	048.避免阴茎在窃听.txt	119	坦白说，看来可爱的高中女生，对你只是玩物——友善关系的玩物，本质的确是玩物，因为她的肉身使你快乐，至于灵性方面，她没有什么，却使你有什么。由于在她肉身上的搂抱啃咬，你有了灵性的泉源，她没有减少，可是你却加多了。如果她有减少的话，应该只是减少了一小段最好的青春，她在精神上被‘采补’的比肉体还多。是不是？我这里用了‘采补’两个字，我给传统用法加上新的意义。	“坦白说，看来可爱的高中女生，对你只是玩物——友善关系的玩物，本质的确是玩物，因为她的肉身使你快乐，至于灵性方面，她没有什么，却使你有什么。由于在她肉身上的搂抱啃咬，你有了灵性的泉源，她没有减少，可是你却加多了。如果她有减少的话，应该只是减少了一小段最好的青春，她在精神上被‘采补’的比肉体还多。是不是？我这里用了‘采补’两个字，我给传统用法加上新的意义。”
3	048.避免阴茎在窃听.txt	121	谁说年经是只被年轻人挥霍的？我的信仰是：How to get the most out of 17？我的信仰是：I have taken more good from 17 than 17 has taken from me.听来很自私其实我给了十七岁新的世界，我并没亏待十七岁。	“谁说年经是只被年轻人挥霍的？我的信仰是：How to get the most out of 17？我的信仰是：I have taken more good from 17 than 17 has taken from me.听来很自私其实我给了十七岁新的世界，我并没亏待十七岁。”
3	048.避免阴茎在窃听.txt	123	你满口十七岁、十七岁，你了解了多少十七岁？你不知道的他们太多了太多了。他们永远比大人想像的坏、比笨人想像的聪明、比男人想像的持久、比女人想像得毒辣、比张惠妹想像的更会鬼叫、比中央标准局想像的更没水准、比生理卫生老师想像的更多的毛。你六十七岁，自以为是，想玩十七岁，你知道多少十七岁！	“你满口十七岁、十七岁，你了解了多少十七岁？你不知道的他们太多了太多了。他们永远比大人想像的坏、比笨人想像的聪明、比男人想像的持久、比女人想像得毒辣、比张惠妹想像的更会鬼叫、比中央标准局想像的更没水准、比生理卫生老师想像的更多的毛。你六十七岁，自以为是，想玩十七岁，你知道多少十七岁！”
3	048.避免阴茎在窃听.txt	127	她几岁？	“她几岁？”
5	048.避免阴茎在窃听.txt	131	如果事过境迁，你怎么定位她？	“如果事过境迁，你怎么定位她？”
3	048.避免阴茎在窃听.txt	135	你不要神气，你可能爱上她。但别忘了，十七岁的魅力增加是几何级数、心眼增加是代数级数、男朋友增加是三角级数到十角（decagon）级数、道德增加是负数。她出现了，会破坏你的一切。	“你不要神气，你可能爱上她。但别忘了，十七岁的魅力增加是几何级数、心眼增加是代数级数、男朋友增加是三角级数到十角（decagon）级数、道德增加是负数。她出现了，会破坏你的一切。”
5	048.避免阴茎在窃听.txt	139	你搞幻想症、白日梦、意淫之类，是不是？	“你搞幻想症、白日梦、意淫之类，是不是？”
3	048.避免阴茎在窃听.txt	143	看来好像只有你懂虚拟？	“看来好像只有你懂虚拟？”
4	048.避免阴茎在窃听.txt	145	用渊博与雅致做界线，的确，只有我懂。	“用渊博与雅致做界线，的确，只有我懂。”
4	048.避免阴茎在窃听.txt	177	满意，祝你顺利。	“满意，祝你顺利。”
4	048.避免阴茎在窃听.txt	179	胜什么利！我全听到了！胜利的不是你们‘形而上’、胜利的是我，大大大阴茎！	“胜什么利！我全听到了！胜利的不是你们‘形而上’、胜利的是我，大大大阴茎！”第三者声音插进来了。
3	048.避免阴茎在窃听.txt	181	糟糕！还是被它窃听到了！	“糟糕！还是被它窃听到了！”
3	048.避免阴茎在窃听.txt	183	糟糕！这大家伙阴魂不散！	“糟糕！这大家伙阴魂不散！”
4	049.模特儿第N+1次.txt	7	我理解你和我的关系，一如你声明在先的，我只是你的模特儿，不是别的。	“我理解你和我的关系，一如你声明在先的，我只是你的模特儿，不是别的。”
4	049.模特儿第N+1次.txt	9	你好聪明，你理解得很准确。	“你好聪明，你理解得很准确。”
5	049.模特儿第N+1次.txt	11	如果你有女朋友呢，会不会像你的模特儿一样？	“如果你有女朋友呢，会不会像你的模特儿一样？”
4	049.模特儿第N+1次.txt	13	如果有，造型像我的模特儿，我会感谢上帝。	“如果有，造型像我的模特儿，我会感谢上帝。”
3	049.模特儿第N+1次.txt	15	十七岁？	“十七岁？”
5	049.模特儿第N+1次.txt	19	如果十七岁过了，十八岁怎么办？	“如果十七岁过了，十八岁怎么办？”
6	049.模特儿第N+1次.txt	21	你知道中文词汇里有一个词儿叫‘弃妇’，就是被遗弃的妻子。如果十七岁过了，十八岁就会变成‘弃女朋友’。	“你知道中文词汇里有一个词儿叫‘弃妇’，就是被遗弃的妻子。如果十七岁过了，十八岁就会变成‘弃女朋友’。”
4	049.模特儿第N+1次.txt	23	你真强势，你不要十八岁的女朋友。	“你真强势，你不要十八岁的女朋友。”
4	049.模特儿第N+1次.txt	25	反正我十七岁的也没有，当然可以说大话。	“反正我十七岁的也没有，当然可以说大话。”
5	049.模特儿第N+1次.txt	27	你的模特儿十七岁过了，十八岁怎么办？	“你的模特儿十七岁过了，十八岁怎么办？”
4	049.模特儿第N+1次.txt	31	照这样看来，也许我不该活过十七岁。	“照这样看来，也许我不该活过十七岁。”
4	049.模特儿第N+1次.txt	33	话好像不能这么说，至少不能这么悲观的说。	“话好像不能这么说，至少不能这么悲观的说。”
5	049.模特儿第N+1次.txt	35	还悲观吗？十八岁就失了业，来日方长，还不悲观吗？	“还悲观吗？十八岁就失了业，来日方长，还不悲观吗？”
4	049.模特儿第N+1次.txt	37	悲观的该是我吧？请你记得我的年纪。我死的机率超高，这个房间，很快就变成纪念馆了。	“悲观的该是我吧？请你记得我的年纪。我死的机率超高，这个房间，很快就变成纪念馆了。”
4	049.模特儿第N+1次.txt	39	如果你死了，我还是失业了。	“如果你死了，我还是失业了。”
4	049.模特儿第N+1次.txt	41	所以呀，你要珍惜目前的以模特儿为业的机会，好好‘演出’。	“所以呀，你要珍惜目前的以模特儿为业的机会，好好‘演出’。”
3	049.模特儿第N+1次.txt	47	我可以做你十七岁的情人吗？	“我可以做你十七岁的情人吗？”
3	049.模特儿第N+1次.txt	49	好像不可以。你忘了我们约定过，你只是我的‘模特儿’，或者说‘演员’，一切都是‘演出’的。	“好像不可以。你忘了我们约定过，你只是我的‘模特儿’，或者说‘演员’，一切都是‘演出’的。”
3	049.模特儿第N+1次.txt	51	不是真的？	“不是真的？”
3	049.模特儿第N+1次.txt	53	‘演出’得入戏、逼真，也是真的。真有两种，第一种是原来就真、第二种是弄假成真。其实呀，第二种比第一种有时更真得比真还真。	“‘演出’得入戏、逼真，也是真的。真有两种，第一种是原来就真、第二种是弄假成真。其实呀，第二种比第一种有时更真得比真还真。”
3	049.模特儿第N+1次.txt	55	什么叫比真还真？	“什么叫比真还真？”
4	049.模特儿第N+1次.txt	57	假得比真还精彩，就是比真还真。	“假得比真还精彩，就是比真还真。”
3	049.模特儿第N+1次.txt	59	我比真还真吗？	“我比真还真吗？”
3	049.模特儿第N+1次.txt	63	那十八岁还要走吗？	“那十八岁还要走吗？”
7	049.模特儿第N+1次.txt	65	我从没说过你十八岁你走，我是说你十八岁我走。	“我从没说过你十八岁你走，我是说你十八岁我走。”
5	049.模特儿第N+1次.txt	71	那这房子、这漂亮的房子怎么办？	“那这房子、这漂亮的房子怎么办？”
3	049.模特儿第N+1次.txt	75	你不回来了？	“你不回来了？”
4	049.模特儿第N+1次.txt	81	先喊‘有鬼’，再喊‘有贼’。	“先喊‘有鬼’，再喊‘有贼’。”
3	049.模特儿第N+1次.txt	85	但我不是鬼也不是贼。所以啊，你请来张天师，我不是鬼；你叫来警察，我不是贼。他们都不能抓我。	“但我不是鬼也不是贼。所以啊，你请来张天师，我不是鬼；你叫来警察，我不是贼。他们都不能抓我。”
3	049.模特儿第N+1次.txt	87	谁要他们抓你？我自己包办了。你若是鬼，我就是抓鬼的警察；你若是贼，我就是抓贼的张天师。	“谁要他们抓你？我自己包办了。你若是鬼，我就是抓鬼的警察；你若是贼，我就是抓贼的张天师。”
5	049.模特儿第N+1次.txt	89	你的角色全错乱了，不是吗？	“你的角色全错乱了，不是吗？”
4	049.模特儿第N+1次.txt	91	是错乱了，因为被一个十八岁的不速之客，不论是鬼是贼，给迷住了。	“是错乱了，因为被一个十八岁的不速之客，不论是鬼是贼，给迷住了。”
3	049.模特儿第N+1次.txt	93	十八岁你也接受吗？	“十八岁你也接受吗？”
4	049.模特儿第N+1次.txt	95	应该接受你的十八岁。并且，那时候我无法先问你的年纪。	“应该接受你的十八岁。并且，那时候我无法先问你的年纪。”
3	049.模特儿第N+1次.txt	97	你要先怎么办？	“你要先怎么办？”
4	049.模特儿第N+1次.txt	99	我要先强奸你，除了强奸，别无他途。	“我要先强奸你，除了强奸，别无他途。”
4	049.模特儿第N+1次.txt	101	强奸了十八岁，十八岁已成年，法律上对你有利。	“强奸了十八岁，十八岁已成年，法律上对你有利。”
4	049.模特儿第N+1次.txt	103	可是，强奸了鬼是不犯法的。	“可是，强奸了鬼是不犯法的。”
3	049.模特儿第N+1次.txt	105	强奸了贼呢？	“强奸了贼呢？”
4	049.模特儿第N+1次.txt	107	强奸罪是三年以上的罪，窃盗罪是五年以下。如果窃盗犯聪明，她不会告强奸犯。	“强奸罪是三年以上的罪，窃盗罪是五年以下。如果窃盗犯聪明，她不会告强奸犯。”
3	049.模特儿第N+1次.txt	109	那贼怎么办？	“那贼怎么办？”
4	049.模特儿第N+1次.txt	111	办法很多，就是半夜三更不要乱跑，免得被白白强奸。	“办法很多，就是半夜三更不要乱跑，免得被白白强奸。”
3	049.模特儿第N+1次.txt	113	那多划不来？	“那多划不来？”
6	049.模特儿第N+1次.txt	115	的确有一点，唯一的办法是你享受那一次被强奸。像爱尔兰诗人叶慈（W. Yeast）那首《丽达与天鹅》（Leda and the Swan）所描写的天神宙斯（Zeus）强奸斯巴达王丁大留斯（Tyndareus）的妻子丽达那一幕，最后叶慈用的是her loosening thighs的造句，loosening是主动的现在分词，而不用被动的loosened，被强奸后来，被动的大腿主动的放松了。	“的确有一点，唯一的办法是你享受那一次被强奸。像爱尔兰诗人叶慈（W. Yeast）那首《丽达与天鹅》（Leda and the Swan）所描写的天神宙斯（Zeus）强奸斯巴达王丁大留斯（Tyndareus）的妻子丽达那一幕，最后叶慈用的是her loosening thighs的造句，loosening是主动的现在分词，而不用被动的loosened，被强奸...
3	049.模特儿第N+1次.txt	117	你是说那时有人喜欢被强奸？	“你是说那时有人喜欢被强奸？”
3	049.模特儿第N+1次.txt	121	你是那种强奸犯吗？	“你是那种强奸犯吗？”
4	049.模特儿第N+1次.txt	123	对别人，我不是；对可爱的你，就很难说。	“对别人，我不是；对可爱的你，就很难说。”
8	049.模特儿第N+1次.txt	125	如果，我不合叶慈诗中的文法呢？	“如果，我不合叶慈诗中的文法呢？”
3	049.模特儿第N+1次.txt	129	你是不是还喜欢十八岁以后的我？	“你是不是还喜欢十八岁以后的我？”
5	049.模特儿第N+1次.txt	133	十八岁，就绝对不要？	“十八岁，就绝对不要？”
5	049.模特儿第N+1次.txt	139	你爱上一个贼头贼脑的，你的审美眼光岂不有点怪异？	“你爱上一个贼头贼脑的，你的审美眼光岂不有点怪异？”
4	049.模特儿第N+1次.txt	141	为了避免怪异，所以要截止到十七岁最后一天。	“为了避免怪异，所以要截止到十七岁最后一天。”
5	049.模特儿第N+1次.txt	147	我怀疑我十八岁会在这房里做小偷，因为，因为，我会有十八岁吗？	“那我只好自己十八岁了。”她坐下来。“可是，”她望着我，隐含着什么，“我怀疑我十八岁会在这房里做小偷，因为，因为，我会有十八岁吗？”
4	049.模特儿第N+1次.txt	147	可是，	“那我只好自己十八岁了。”她坐下来。“可是，”她望着我，隐含着什么，“我怀疑我十八岁会在这房里做小偷，因为，因为，我会有十八岁吗？”
3	049.模特儿第N+1次.txt	149	我会有六十八岁吗？	“我会有六十八岁吗？”
3	049.模特儿第N+1次.txt	151	我是说，如果，十七岁这么重要，也许该冻结十七岁、永远十七岁、死在十七岁。如果，只是假设，如果我死了，你会‘伤逝’吗？	“我是说，如果，十七岁这么重要，也许该冻结十七岁、永远十七岁、死在十七岁。如果，只是假设，如果我死了，你会‘伤逝’吗？”
3	049.模特儿第N+1次.txt	161	那个钟——那个钟声，她生时常常听到、日日夜夜听到的、庄严而喜欢听到的，余音犹在。如今，却无情的离开了她，那年华如斯的她、那出色如斯的她、那美好如斯的她。	“我来翻译。”我说。“那个钟——那个钟声，她生时常常听到、日日夜夜听到的、庄严而喜欢听到的，余音犹在。如今，却无情的离开了她，那年华如斯的她、那出色如斯的她、那美好如斯的她。”
3	049.模特儿第N+1次.txt	165	我跟不上专家，但专家也跟不上我。像我把so young, so beautiful, so good翻成年华如斯、出色如斯、美好如斯，专家们就跟不上。如斯有中文里‘逝者如斯’的暗嵌，专家们恐怕更翻译不出来了。	“我跟不上专家，但专家也跟不上我。像我把so young, so beautiful, so good翻成年华如斯、出色如斯、美好如斯，专家们就跟不上。如斯有中文里‘逝者如斯’的暗嵌，专家们恐怕更翻译不出来了。”
4	049.模特儿第N+1次.txt	167	如果‘伤逝’是这种规格的，为什么要反对？	“如果‘伤逝’是这种规格的，为什么要反对？”
3	049.模特儿第N+1次.txt	169	也不是反对，只觉得应该不老套而已。人生要雨后斜阳，泪眼问花是不够的，还应该跟着笑脸上床。更重要的是，笑脸上床是没有过去式的，也不止于现在式，笑脸上床是一本tense（时态）错乱的方法，它帮聪明人除去了时间因素的折磨。	“也不是反对，只觉得应该不老套而已。人生要雨后斜阳，泪眼问花是不够的，还应该跟着笑脸上床。更重要的是，笑脸上床是没有过去式的，也不止于现在式，笑脸上床是一本tense（时态）错乱的方法，它帮聪明人除去了时间因素的折磨。”
4	049.模特儿第N+1次.txt	171	你把死亡陈述得好有彩色，看来死亡好像也值得珍惜。	“你把死亡陈述得好有彩色，看来死亡好像也值得珍惜。”
3	049.模特儿第N+1次.txt	195	‘死亡面具’，它多么有反科技的意义。科技在为生者留副，复制人身；但‘死亡面具’却为死者加持，复制死相。死者的本尊必将腐朽，但面具不会，复本保存了原版，有了复本，令人想像往生。	“‘死亡面具’，它多么有反科技的意义。科技在为生者留副，复制人身；但‘死亡面具’却为死者加持，复制死相。死者的本尊必将腐朽，但面具不会，复本保存了原版，有了复本，令人想像往生。”
4	049.模特儿第N+1次.txt	197	如果我死了，你会做我的‘死亡面具’吗？	“如果我死了，你会做我的‘死亡面具’吗？”朱仑又出了奇想。
3	049.模特儿第N+1次.txt	199	看到比面具更真实的，在死亡中，我要先享有它，而不是先面具它。如果真有那种境界，我一定在模糊中享有着你，你美丽的死相。	“看到比面具更真实的，在死亡中，我要先享有它，而不是先面具它。如果真有那种境界，我一定在模糊中享有着你，你美丽的死相。”
3	049.模特儿第N+1次.txt	201	我想，人有泄天机的本领，最后应该表现在泄漏自己的死期上。人的死期，也算天机的一种。人该有这种本领，像某些动物一样，自知死期。报上说一家老人院里养了一只花猫，这猫有灵异现象，它守在那位老人身边，迟迟不肯离去，这老人就死了。我想我梦到那只猫。	“我想，人有泄天机的本领，最后应该表现在泄漏自己的死期上。人的死期，也算天机的一种。人该有这种本领，像某些动物一样，自知死期。报上说一家老人院里养了一只花猫，这猫有灵异现象，它守在那位老人身边，迟迟不肯离去，这老人就死了。我想我梦到那只猫。”
3	049.模特儿第N+1次.txt	203	我的朱仑有点胡思乱想，你还没资格见到那只猫，因为你不够老。你要先梦到老人才行。梦到老人还不够，老人正在梦狮子。	“我的朱仑有点胡思乱想，你还没资格见到那只猫，因为你不够老。你要先梦到老人才行。梦到老人还不够，老人正在梦狮子。”
3	049.模特儿第N+1次.txt	207	人有本领知道自己的死期。那不是见到猫，而是拿起枪。自杀者最知道自己的死期，比上帝还早知道。当然碰到狮子，也可以知道死期了，效果和枪一样好。	“人有本领知道自己的死期。那不是见到猫，而是拿起枪。自杀者最知道自己的死期，比上帝还早知道。当然碰到狮子，也可以知道死期了，效果和枪一样好。”
4	049.模特儿第N+1次.txt	209	如果我先死了，你在‘磺溪大厦’、我们的‘磺溪大厦’想我吗？	“如果我先死了，你在‘磺溪大厦’、我们的‘磺溪大厦’想我吗？”
4	049.模特儿第N+1次.txt	211	我不相信那种如果。别忘了我大你多少岁。你可以在许多方面抢先，但死就轮不到你抢了。	“我不相信那种如果。别忘了我大你多少岁。你可以在许多方面抢先，但死就轮不到你抢了。”
4	049.模特儿第N+1次.txt	213	我只是说‘如果’，如果我先死了，你会在这屋里想我吗？	“我只是说‘如果’，如果我先死了，你会在这屋里想我吗？”
4	049.模特儿第N+1次.txt	215	当然会。重要的是快乐的想、没有感伤的想。正面的想、没有负面情绪的想。	“当然会。重要的是快乐的想、没有感伤的想。正面的想、没有负面情绪的想。”
3	049.模特儿第N+1次.txt	217	你不难过吗？	“你不难过吗？”
3	049.模特儿第N+1次.txt	219	我不认为难过是一种快乐的、正面的情绪，我不喜欢它。我会朝‘莫忘欢乐时’那种倾向，倾听你那不朽的叫床。并且，谁能预知死后怎样呢？想想英国文学家哈代吧，他三十四岁和他前妻结婚，婚后三十八年，前妻死了，他又再婚，再婚后十四年他死了，死时八十八岁。他被英国女王下令国葬在西敏寺，他的身体，虽然照着女王的意思，但他的心脏，却给挖了出来，埋在他家乡的前妻的坟墓里，这不是身首异处，而是身心两分，多么多情动人的故事呀。	“我不认为难过是一种快乐的、正面的情绪，我不喜欢它。我会朝‘莫忘欢乐时’那种倾向，倾听你那不朽的叫床。并且，谁能预知死后怎样呢？想想英国文学家哈代吧，他三十四岁和他前妻结婚，婚后三十八年，前妻死了，他又再婚，再婚后十四年他死了，死时八十八岁。他被英国女王下令国葬在西敏寺，他的身体，虽然照着女王的意思，但他的心脏，却给挖了出来，埋在他家乡的前妻的坟墓里，这不是...
5	049.模特儿第N+1次.txt	221	那你呢？如果我先死了，你后死，你埋在哪儿呢？	“那你呢？如果我先死了，你后死，你埋在哪儿呢？”
3	049.模特儿第N+1次.txt	223	我……我？我有尸可埋吗？	“我……我？我有尸可埋吗？”我笑着，有点无奈。“我死后完全捐给台大医学院了，我可算是尸骨无存了。就算存了一副骨架子，与人骷髅相见，我还是无骨可埋了。”
3	049.模特儿第N+1次.txt	223	我死后完全捐给台大医学院了，我可算是尸骨无存了。就算存了一副骨架子，与人骷髅相见，我还是无骨可埋了。	“我……我？我有尸可埋吗？”我笑着，有点无奈。“我死后完全捐给台大医学院了，我可算是尸骨无存了。就算存了一副骨架子，与人骷髅相见，我还是无骨可埋了。”
4	049.模特儿第N+1次.txt	225	你死后捐出尸体，你真前进。	“你死后捐出尸体，你真前进。”
4	049.模特儿第N+1次.txt	229	你呢？你死了，处理你的尸体，还有‘骷髅相见’等问题，是不是？	“你呢？你死了，处理你的尸体，还有‘骷髅相见’等问题，是不是？”
3	049.模特儿第N+1次.txt	231	我提供给学医的学生们‘大体解剖’后，并约好，解剖后剩下的skeleton、骨骼，要制成标本，永远挂在医学院的骨科，使恨我入骨的人，永远可以看到。	“我提供给学医的学生们‘大体解剖’后，并约好，解剖后剩下的skeleton、骨骼，要制成标本，永远挂在医学院的骨科，使恨我入骨的人，永远可以看到。”
3	049.模特儿第N+1次.txt	233	如果不恨你入骨的呢？	“如果不恨你入骨的呢？”
3	049.模特儿第N+1次.txt	237	英文有a skeleton at the feast 的典故，叫作‘宴席上的骷髅’，起源自古埃及人在重大宴席上，都要当众摆上一具骷髅，提醒人们居安思危、存不忘亡。也许，你的骷髅不该只放在台大医学院，该巡回展示，在宴会中巡回展示，学古埃及人。	“英文有a skeleton at the feast 的典故，叫作‘宴席上的骷髅’，起源自古埃及人在重大宴席上，都要当众摆上一具骷髅，提醒人们居安思危、存不忘亡。也许，你的骷髅不该只放在台大医学院，该巡回展示，在宴会中巡回展示，学古埃及人。”
3	049.模特儿第N+1次.txt	239	干嘛？别忘了英文中a skeleton at the feast.的另一意思就是扫兴，His presence at the feast(party) was a skeleton at the feast.死了还这样闹人，不恨我入骨了也要重新考虑了。	“干嘛？别忘了英文中a skeleton at the feast.的另一意思就是扫兴，His presence at the feast(party) was a skeleton at the feast.死了还这样闹人，不恨我入骨了也要重新考虑了。”
4	049.模特儿第N+1次.txt	241	听起来，有点羡慕你死后还这么有骨气，可惜的是，我恐怕看不到了。	“听起来，有点羡慕你死后还这么有骨气，可惜的是，我恐怕看不到了。”
