file	line	matched_quote	previous_id	previous_book	previous_source	context
001.快看《独白下的传统》.txt	5	寿比南山	LACTDB-019	传统下的独白	005.一封神气的情书.txt:41-41	中国人不了解中国。为什么？中国太难了解了。中国是一个庞然大物，在世界古国中，它是唯一香火不断的金身。巴比伦古国、埃及古国，早就亡于波斯；印度古国，早就亡于回回。只有中国寿比南山，没有间断。没有间断，就有累积。有累积，就愈累积愈多，就愈难了解。
001.快看《独白下的传统》.txt	61	庸德之行，庸言之谨	LAFLZ-027	李敖风流自传	085.“大人格”.txt:3-3	中国知识分子是中国最可耻的一个阶级。这个阶级夹在统治者和老百姓之间，上下其手。他们之中不是没有特立独行的好货，可是只占千万分之一，其他都是“小人儒”。庸德之行，庸言之谨，读书不化，守旧而顽固。中国知识分子坚守他们在统治者和老百姓中间的夹层地位，误尽苍生。当特立独行的王安石搞变法，想直接受惠于老百姓的时候，文彦博站出来向皇帝说话了，他说：“陛下是同士大夫治天下，不是同老百姓治天下。”王安石想越过这批拦路虎，可是他碰到了绊脚石。
001.快看《独白下的传统》.txt	103	寿比南山	LACTDB-019	传统下的独白	005.一封神气的情书.txt:41-41	精神分析学家看病的时候，必须使病人回忆过去；思想家、批评家、哲学家、历史家面对中国这个庞然大物，也必须如此。中国是一个充满了万年、千年、百年、几十年和十几年大量传统的民族，寿比南山。南山本是传统细壤所积，不了解钙层土（pedocals）和淋余土（pedalfers）的人，不了解土壤；不了解中国“钙层传统”和“淋余传统”的人，又怎么了解中国？
003.避讳——“非常不敢说”.txt	53	冲冠一怒为红颜	LACTDB-071	传统下的独白	013.长袍心理学.txt:27-27	清朝初年，一个“冲冠一怒为红颜”的将军吴三桂，他在中国西南称王，为了避讳，特地把西南的“桂林”，改为“建林”。又因为他那被李自成杀掉的父亲叫“吴襄”，所以也得找个地方来做避讳的对象。找来找去，找到个湖北的襄阳，于是就飞镖直奔襄阳，改名叫汉南府。
012.女性——牌坊要大，金莲要小.txt	63	不入虎穴，焉得虎子	LAZHYH-045	李敖自传与回忆	005.“北土非吾愿，东林怀我师”.txt:493-493	在汉朝的时候，有一个女人叫班昭，她的丈夫姓曹，所以她又被叫做“曹大家”（“家”在这里念做“姑”），她有两个有名的哥哥：一个是写《汉书》的班固；一个是出使西域“不入虎穴，焉得虎子”的班超。这位妹妹，实在是个莫名其妙的女人，她若不莫名其妙，她不会写一部叫做《女诫》的书，这部书，是女人写来教人如何压迫女人的，你说莫名其妙不莫名其妙？
012.女性——牌坊要大，金莲要小.txt	63	不入虎穴，焉得虎子	LAMR-029	李敖回忆录	009.山居（1961-1962·26到27岁）.txt:169-169	在汉朝的时候，有一个女人叫班昭，她的丈夫姓曹，所以她又被叫做“曹大家”（“家”在这里念做“姑”），她有两个有名的哥哥：一个是写《汉书》的班固；一个是出使西域“不入虎穴，焉得虎子”的班超。这位妹妹，实在是个莫名其妙的女人，她若不莫名其妙，她不会写一部叫做《女诫》的书，这部书，是女人写来教人如何压迫女人的，你说莫名其妙不莫名其妙？
012.女性——牌坊要大，金莲要小.txt	63	不入虎穴，焉得虎子	LAFLZ-050	李敖风流自传	185.我就上了“贼船”.txt:3-3	在汉朝的时候，有一个女人叫班昭，她的丈夫姓曹，所以她又被叫做“曹大家”（“家”在这里念做“姑”），她有两个有名的哥哥：一个是写《汉书》的班固；一个是出使西域“不入虎穴，焉得虎子”的班超。这位妹妹，实在是个莫名其妙的女人，她若不莫名其妙，她不会写一部叫做《女诫》的书，这部书，是女人写来教人如何压迫女人的，你说莫名其妙不莫名其妙？
016.中国民族“性”.txt	47	以其髀加妾之身	LAKYEC-057	李敖快意恩仇录	019.宣淫纪.txt:125-125	妾事先王也，先王以其髀加妾之身，妾困不支也；尽置其身妾之上，而妾弗重也。何也？以其少有利焉。今佐韩，兵不众粮不多，则不足以救韩。夫救韩之危，日费千金，独不可使妾少有利焉？