score	file	line	text	context
3	002.真实的历史·素朴的记录（杨尔琳）.txt	17	天才	除此之外，在个性上、人格上或做人做事的原则上，他另有吸引人之处。他待人非常热心、诚恳、大方，反过来说就是不冷漠、不虚伪、不小气，可以这么说，这就注定成功的当了一名小排长。这里不妨稍对大方解释一下：来台湾后，他没有一天不受穷困折磨，但是从未显露寒酸、计算之相；朋友相处，付钱次数最多的应该是他。他率直、有担当、能为他人着想，这也就贏得了士兵与官长的敬重与照顾，所...
4	003.可爱的家伙（刘耀祖）.txt	9	不，是一位老女人，就是我母亲。	有一次队中讨论会时，李敖的讲题是“万华宝斗里的经济价值”。才子满肚子学问，讲得有条有理又有趣。其次是打野外，行军途中，旁边有队友问他：“李敖你最近有没有女朋友写信给你？”答：“有一位。”问：“是不是以前的那位？”答：“不，是一位老女人，就是我母亲。”
3	003.可爱的家伙（刘耀祖）.txt	9	李敖你最近有没有女朋友写信给你？	有一次队中讨论会时，李敖的讲题是“万华宝斗里的经济价值”。才子满肚子学问，讲得有条有理又有趣。其次是打野外，行军途中，旁边有队友问他：“李敖你最近有没有女朋友写信给你？”答：“有一位。”问：“是不是以前的那位？”答：“不，是一位老女人，就是我母亲。”
3	003.可爱的家伙（刘耀祖）.txt	9	是不是以前的那位？	有一次队中讨论会时，李敖的讲题是“万华宝斗里的经济价值”。才子满肚子学问，讲得有条有理又有趣。其次是打野外，行军途中，旁边有队友问他：“李敖你最近有没有女朋友写信给你？”答：“有一位。”问：“是不是以前的那位？”答：“不，是一位老女人，就是我母亲。”
4	003.可爱的家伙（刘耀祖）.txt	11	若阵亡，臭袜子送给队长，骨灰送给女朋友植玫瑰花。	最后是步校要结训时要每位队员写遗书留在步校，当时李敖写的是：“若阵亡，臭袜子送给队长，骨灰送给女朋友植玫瑰花。”
4	004.写序，不能也不会（施珂）.txt	3	写序，不能也不会。	敖之的《一个预备军官的日记》快出版了，要我写序。我说：“写序，不能也不会。”敖之说：“大家都写了，就差你了。”
4	004.写序，不能也不会（施珂）.txt	3	大家都写了，就差你了。	敖之的《一个预备军官的日记》快出版了，要我写序。我说：“写序，不能也不会。”敖之说：“大家都写了，就差你了。”
4	004.写序，不能也不会（施珂）.txt	7	守纪律，爱武器。	师长是汪敬熙，训话不离两个主题：“守纪律，爱武器。”上校而具儒将之风，一口北京话，真想跟他拉个老乡。
5	006.《预官日记》序（陶英惠）.txt	7	名满天下，谤亦随之	第九队中藏龙卧虎，共有一百一十四条好汉，在预八期是大大有名的。上述“罢吃”风波就是一个例子。三十多年来，众好汉各奔前程，从那本泛黄的同学录中，可以找到很多出类拔萃的人物，如丁邦新兄，由于在学术上的贡献，于1986年当选为中央研究院人文组院士，现在美国讲学；王德毅兄为台大名教授，著作等身，是研究宋史的权威学者；刘玉春兄则是一位成功的教育家，现任台北市最有名的建...
3	006.《预官日记》序（陶英惠）.txt	9	特立独行	我与敖之兄系台大历史系同窗，他是有名的才子，经常跷课，在校时难得碰到一次面，更少交谈。没想到在步校又与他同队，每天却是形影不离，因为军中与大学不同，他是无法“跷操”的。他在步校的趣事和糗事真是太多了，我无胆秉笔直书，以免构成“诽谤”后对簿公堂。不料他当时留有日记，而且还要印出来公之于世，在我来说真是求之不得。因为从他的日记中，可以像进入时光隧道一样，看看他当...
7	007.《一个预备军官的日记》引言.txt	7	凡曾判处七年以上有期徒刑者禁服兵役，称为禁役。	我虽然以老大自居，可是官方显然不承认，因为他们把我“开除军籍”了。我在1972年以叛乱罪被判十年，1975年又被改判八年半。按《兵役法》第5条：“凡曾判处七年以上有期徒刑者禁服兵役，称为禁役。”从此我就失掉服兵役的“义务”（美国说法）或权利（苏联说法）了！
3	007.《一个预备军官的日记》引言.txt	7	开除军籍	我虽然以老大自居，可是官方显然不承认，因为他们把我“开除军籍”了。我在1972年以叛乱罪被判十年，1975年又被改判八年半。按《兵役法》第5条：“凡曾判处七年以上有期徒刑者禁服兵役，称为禁役。”从此我就失掉服兵役的“义务”（美国说法）或权利（苏联说法）了！
3	007.《一个预备军官的日记》引言.txt	7	义务	我虽然以老大自居，可是官方显然不承认，因为他们把我“开除军籍”了。我在1972年以叛乱罪被判十年，1975年又被改判八年半。按《兵役法》第5条：“凡曾判处七年以上有期徒刑者禁服兵役，称为禁役。”从此我就失掉服兵役的“义务”（美国说法）或权利（苏联说法）了！
3	007.《一个预备军官的日记》引言.txt	9	高等学府	我在军中共待了一年半，一年半从戎投笔的生涯，在我生命里掺进了新的酵素。这种生涯使我在突然间远离了学院、远离了书卷、远离了跟民间脱节的一群。在军队生活里，我接触到中国民间质朴与纯真的一面，而这些质朴与纯真，在我出身的“高等学府”里，早已是教科书上的名词。因为不是国民党党员，我在野战部队中吃过一般预备军官不太容易吃到的苦，这些折磨，更凝固了我个人的思想与悍气。我...
4	008.横槊集·1959年9月.txt	41	努力过新生活，很卖力。	四、给启庆信：“努力过新生活，很卖力。”
4	008.横槊集·1959年9月.txt	95	台上演戏，台下演戏。	七、夜话剧，逃到福利社大吃牛肉面，撒野尿，与景、白谈，不料队伍已开回，归队装拉稀，摸肚而入队，众为我捏汗。今日人多谓我会演戏，裤带歪，手抚肚，腰弯，说话无力。“台上演戏，台下演戏。”
4	008.横槊集·1959年9月.txt	215	心情欠佳	军中已十日，一直可说积极愉快，目前最心折的人是海明威，我买了一本何欣写的《海明威创作论》，读之颇快，我喜欢他那几次参加战斗，追求死的精神与勇迈，因此在军中生活，我的态度与看法殊迥异于一般人，我觉得这不是虚度日子，这是最好的一种磨炼与生活。因此我在这儿实在可说很愉快。我并非完全忘怀了过去，在休憩和疲惫之余，我也偶然想起往日的欢乐日子与忧郁的岁月，可是它们已经不...
3	008.横槊集·1959年9月.txt	215	自诩铁汉	军中已十日，一直可说积极愉快，目前最心折的人是海明威，我买了一本何欣写的《海明威创作论》，读之颇快，我喜欢他那几次参加战斗，追求死的精神与勇迈，因此在军中生活，我的态度与看法殊迥异于一般人，我觉得这不是虚度日子，这是最好的一种磨炼与生活。因此我在这儿实在可说很愉快。我并非完全忘怀了过去，在休憩和疲惫之余，我也偶然想起往日的欢乐日子与忧郁的岁月，可是它们已经不...
3	008.横槊集·1959年9月.txt	215	本质上的改变	军中已十日，一直可说积极愉快，目前最心折的人是海明威，我买了一本何欣写的《海明威创作论》，读之颇快，我喜欢他那几次参加战斗，追求死的精神与勇迈，因此在军中生活，我的态度与看法殊迥异于一般人，我觉得这不是虚度日子，这是最好的一种磨炼与生活。因此我在这儿实在可说很愉快。我并非完全忘怀了过去，在休憩和疲惫之余，我也偶然想起往日的欢乐日子与忧郁的岁月，可是它们已经不...
3	008.横槊集·1959年9月.txt	215	旧影子	军中已十日，一直可说积极愉快，目前最心折的人是海明威，我买了一本何欣写的《海明威创作论》，读之颇快，我喜欢他那几次参加战斗，追求死的精神与勇迈，因此在军中生活，我的态度与看法殊迥异于一般人，我觉得这不是虚度日子，这是最好的一种磨炼与生活。因此我在这儿实在可说很愉快。我并非完全忘怀了过去，在休憩和疲惫之余，我也偶然想起往日的欢乐日子与忧郁的岁月，可是它们已经不...
3	008.横槊集·1959年9月.txt	251	不戴眼镜更显得阴险了！	三、晚饭前维信说我：“不戴眼镜更显得阴险了！”他们向明日履新的罗区队长说我“坏话”，罗区队长言：“李敖不要栽在我手里！”
3	008.横槊集·1959年9月.txt	251	李敖不要栽在我手里！	三、晚饭前维信说我：“不戴眼镜更显得阴险了！”他们向明日履新的罗区队长说我“坏话”，罗区队长言：“李敖不要栽在我手里！”
4	008.横槊集·1959年9月.txt	279	适去，夫子顺也。	操练归来，在报上看到了这个不幸的消息，我真不知道我能说些什么？四年前，我有过和你一样的遭遇、一样的心情，因而我清楚的知道赶紧培养一种内心的达观该是多么必要的事！“适去，夫子顺也。”想想庄子中的老故事，也许对幽明永隔的生者与死者都是好的。
3	008.横槊集·1959年9月.txt	307	越级报告	五、夜又大闹，指导员说他笑死了。为了老三事，告状于副队长与指导员。“越级报告”云乎哉！副队长说：“不要紧。”
4	008.横槊集·1959年9月.txt	311	看到你，什么痛苦都飞了。	七、晚点名时，刘耀祖对我说：“看到你，什么痛苦都飞了。”
4	008.横槊集·1959年9月.txt	323	李敖对人最慷慨、最够朋友。	五、清泉言：“李敖对人最慷慨、最够朋友。”
4	008.横槊集·1959年9月.txt	379	我佩服李敖，他有时极为认真。	八、午后徒步至七一四高地上“地图阅读野外实施”课，旋即分组实地按图索“骥”，我与清茂、仁甦一组，找地八处，翻山越岭，穿草由径，看山、看水、看牛、看原野，听枪声。“偷”喝汽水、“偷”吃香蕉（区队长不准者），非常开畅愉快，且不觉得疲倦，五时半方归。队长言昨日听我在厕所中言女朋友事，又指手画脚的。归途中丁向荣未赶返，欲纠众同喊之，时清茂言：“我佩服李敖，他有时极为...
4	008.横槊集·1959年9月.txt	387	一秒钟、两秒钟、三秒钟，是教官。	“一秒钟、两秒钟、三秒钟，是教官。”
4	008.横槊集·1959年9月.txt	391	大家都面露微笑，而你的微笑最标准的。	郑清茂说：“大家都面露微笑，而你的微笑最标准的。”我言撞车一次才好，郑仁甦言我为“亡命徒”。
3	008.横槊集·1959年9月.txt	457	你很棒嘛！	五、向队长示右臂肌肉，队长言：“你很棒嘛！”
4	008.横槊集·1959年9月.txt	469	别人认为不值得认真的你认真，这就是我佩服你的地方。	一、M1步枪讲习整日。郑又言：“别人认为不值得认真的你认真，这就是我佩服你的地方。”
4	008.横槊集·1959年9月.txt	539	大地之子	一、上午赴七一四高地下侧挖防空洞，工作颇勤，维信言：“李敖可有灵感了。”左手三小指间为利草所伤，汗泥满身、满鞋。“大地之子”云乎哉？挖洞时忽然想起我的无数代前的老祖宗挖洞时的那副尊容，不禁失笑。写原野笔记，极爱自然，颇能较深的领味Walden作者的心情。尤其那一排细松路，最凉最幽最美。人多叫苦，殊不能迎接生活者也。精神极为振奋愉快。荷锄归时，默诵渊明之诗。
5	008.横槊集·1959年9月.txt	569	不要太介意人世间这些小挫折，坚强一点，做一个再蹶再起、卷土重来的英雄	十二、夜给至正一信，勉其“不要太介意人世间这些小挫折，坚强一点，做一个再蹶再起、卷土重来的英雄”！
4	008.横槊集·1959年9月.txt	597	老乡：谢谢，请不要再客气。十七号敬礼。	十一、“老乡：谢谢，请不要再客气。十七号敬礼。”我觉得这些小人物实在可爱，象山之言甚是。堂堂地地做人也者，多为这些抱关击柝者也。
3	008.横槊集·1959年9月.txt	601	这么个走法？	十三、晚饭出，二区队长言我：“这么个走法？”吾阔步横行故也。
4	008.横槊集·1959年9月.txt	631	李敖，来，我请你抽支烟。	二、晨M1射击预习中副队长：“李敖，来，我请你抽支烟。”
4	008.横槊集·1959年9月.txt	653	将来做总统，先取消军训。	七、十四队自我介绍，一个人说：“将来做总统，先取消军训。”
3	009.横槊集、插羽集·1959年10月.txt	9	七一四高地附近要图	三、午后赴七一四高地作“要图绘制”，举目四望，环山水之中，以此高点为最，远风吹来，舒畅已极。与队长、马、刘区队长小谈。作“七一四高地附近要图”。
3	009.横槊集、插羽集·1959年10月.txt	19	统御征侯	四、归又作一诗于“统御征侯”课上：
4	009.横槊集、插羽集·1959年10月.txt	43	李敖，请你走好一点。	五、赖区队附：“李敖，请你走好一点。”
7	009.横槊集、插羽集·1959年10月.txt	49	李敖站在那里，瘦瘦高高的，像联军统帅。	八、“李敖站在那里，瘦瘦高高的，像联军统帅。”
5	009.横槊集、插羽集·1959年10月.txt	53	多少天了，你好像沉默了！	十、孙玉华言：“多少天了，你好像沉默了！”
5	009.横槊集、插羽集·1959年10月.txt	55	今晚怎么没有听到你讲话。	十一、晚会平剧《对金瓶》，甚厌烦、甚倦，马区队长找我：“今晚怎么没有听到你讲话。”写二诗，记昨夜摸桩事:
8	009.横槊集、插羽集·1959年10月.txt	119	研讨革命理论，建立中心思想	三、第一次专题讨论的题目是“接受预备军官训练应有的认识与努力”，提纲原订四点，我准备就第（二）点——“预备军官训练的内容和重点”中的第一项——“研讨革命理论，建立中心思想” 一段说几句话：——“由六条口号说起”。以记录及时间不够，我没有发言。
5	009.横槊集、插羽集·1959年10月.txt	119	接受预备军官训练应有的认识与努力	三、第一次专题讨论的题目是“接受预备军官训练应有的认识与努力”，提纲原订四点，我准备就第（二）点——“预备军官训练的内容和重点”中的第一项——“研讨革命理论，建立中心思想” 一段说几句话：——“由六条口号说起”。以记录及时间不够，我没有发言。
5	009.横槊集、插羽集·1959年10月.txt	119	预备军官训练的内容和重点	三、第一次专题讨论的题目是“接受预备军官训练应有的认识与努力”，提纲原订四点，我准备就第（二）点——“预备军官训练的内容和重点”中的第一项——“研讨革命理论，建立中心思想” 一段说几句话：——“由六条口号说起”。以记录及时间不够，我没有发言。
3	009.横槊集、插羽集·1959年10月.txt	119	由六条口号说起	三、第一次专题讨论的题目是“接受预备军官训练应有的认识与努力”，提纲原订四点，我准备就第（二）点——“预备军官训练的内容和重点”中的第一项——“研讨革命理论，建立中心思想” 一段说几句话：——“由六条口号说起”。以记录及时间不够，我没有发言。
3	009.横槊集、插羽集·1959年10月.txt	123	废话说什么！	五、我：“废话说什么！”朱维信：“不说废话说什么？”
3	009.横槊集、插羽集·1959年10月.txt	123	不说废话说什么？	五、我：“废话说什么！”朱维信：“不说废话说什么？”
5	009.横槊集、插羽集·1959年10月.txt	141	本来无事只畏扰，扰者才吏非庸人！	十、午后只好自己洗鞋。“本来无事只畏扰，扰者才吏非庸人！”
6	009.横槊集、插羽集·1959年10月.txt	147	你的饭碗被抢去了！	十三、归在室中谈，鲍明钦言我真可爱、真有趣。女人一定爱我。义务代六十号站卫兵，彼可去看电影也。与队长小谈，刘区队长检查信，我笑谓指导员曰：“你的饭碗被抢去了！”队长莞尔。小丁来，颇可怜，欲归之意甚浓而未得也。夜比别人晚洗澡，绍辉一同，与副队长小谈。后打手电偷写此日记。今日凉而舒适，卧床上极安逸。
4	009.横槊集、插羽集·1959年10月.txt	161	大便诗人	五、仁甦言我的诗“全是屎尿”，又言我是“大便诗人”。宏谋言“满篇油水”。
4	009.横槊集、插羽集·1959年10月.txt	161	满篇油水	五、仁甦言我的诗“全是屎尿”，又言我是“大便诗人”。宏谋言“满篇油水”。
3	009.横槊集、插羽集·1959年10月.txt	161	全是屎尿	五、仁甦言我的诗“全是屎尿”，又言我是“大便诗人”。宏谋言“满篇油水”。
5	009.横槊集、插羽集·1959年10月.txt	177	你大概关照过了，不许他们乱骂我了！	十二、在群言我们M1步枪放得比台中受训者好，棉被叠得好，并且挨骂多，队长问我挨骂几次了？我笑言：“你大概关照过了，不许他们乱骂我了！”众大笑。
5	009.横槊集、插羽集·1959年10月.txt	181	先闹几天，创下招牌，就不须再闹了	十四、人多言我忽沉默了，或谓我乃是“先闹几天，创下招牌，就不须再闹了”！语谑而酷近理。
6	009.横槊集、插羽集·1959年10月.txt	229	土劲都出来了！	二一、晚唱歌，马区队长真好玩：休止符叫做圈，歌词忘矣。英惠言：“土劲都出来了！”
3	009.横槊集、插羽集·1959年10月.txt	235	他们配我说么？	二、对许多事我不爱置喙表示意见，我心里有时想：“他们配我说么？”“他们值得我去表示意见么？”
3	009.横槊集、插羽集·1959年10月.txt	235	他们值得我去表示意见么？	二、对许多事我不爱置喙表示意见，我心里有时想：“他们配我说么？”“他们值得我去表示意见么？”
8	009.横槊集、插羽集·1959年10月.txt	509	早睡早起，一日三餐	一口连吃三碗饭。（近来饭量颇好，“早睡早起，一日三餐”云乎哉？）
3	009.横槊集、插羽集·1959年10月.txt	539	你很着重回忆啊！	七、维信问我写什么？“你很着重回忆啊！”我的意思是许多事本来是没有多大意义的，可是它们消磨了你一天的青春，把它们简单记下来，留给回忆，也许就是它们的意义了。
6	009.横槊集、插羽集·1959年10月.txt	541	又作歪诗了！	八、仁甦见我躺在床上，说：“又作歪诗了！”是呀！歪诗如下：
3	009.横槊集、插羽集·1959年10月.txt	553	李敖的小说还没有写完呀！	九、宋：“李敖的小说还没有写完呀！”
5	009.横槊集、插羽集·1959年10月.txt	569	整天老看你写，写什么？	十三、我之笔勤实为一最为人所不及之长处，孙玉华：“整天老看你写，写什么？”
5	009.横槊集、插羽集·1959年10月.txt	655	花开今已结成果，富贵荣华终到老；君子小人相会合，万事清吉莫烦恼	四、在校中吃过午饭后，与尔琳、天中、定远赴高雄。先逛西子湾（坐四路车），看海色天光，登锈铁台远眺。游泳的很少，有二女郎，一穿黑衣者卷裙入水，状颇不恶。徒步归，经一小土庙，登而知其为“十八爷公祠”，民国三十五年建，旁有二树，一名“古松公”，一名“古松妈”。抽一签，颇有哲味，亦颇如目前写照（“花开今已结成果，富贵荣华终到老；君子小人相会合，万事清吉莫烦恼”）。后...
7	009.横槊集、插羽集·1959年10月.txt	705	影术优美，妙笔生花，诚佳作也。	四、晚饭后参观“陆军进步展览”等，试戴将官及伞兵帽，颇好玩。一画有人题俗话：“影术优美，妙笔生花，诚佳作也。”一君于其下书“不错也”，甚发噱。防弹背心每件美金二百五十元，“金马前线有发”，台湾国语矣。图书馆中有万有文库及《拜伦传》等书，他日当详访之。
3	009.横槊集、插羽集·1959年10月.txt	705	陆军进步展览	四、晚饭后参观“陆军进步展览”等，试戴将官及伞兵帽，颇好玩。一画有人题俗话：“影术优美，妙笔生花，诚佳作也。”一君于其下书“不错也”，甚发噱。防弹背心每件美金二百五十元，“金马前线有发”，台湾国语矣。图书馆中有万有文库及《拜伦传》等书，他日当详访之。
3	009.横槊集、插羽集·1959年10月.txt	705	不错也	四、晚饭后参观“陆军进步展览”等，试戴将官及伞兵帽，颇好玩。一画有人题俗话：“影术优美，妙笔生花，诚佳作也。”一君于其下书“不错也”，甚发噱。防弹背心每件美金二百五十元，“金马前线有发”，台湾国语矣。图书馆中有万有文库及《拜伦传》等书，他日当详访之。
3	009.横槊集、插羽集·1959年10月.txt	705	金马前线有发	四、晚饭后参观“陆军进步展览”等，试戴将官及伞兵帽，颇好玩。一画有人题俗话：“影术优美，妙笔生花，诚佳作也。”一君于其下书“不错也”，甚发噱。防弹背心每件美金二百五十元，“金马前线有发”，台湾国语矣。图书馆中有万有文库及《拜伦传》等书，他日当详访之。
4	009.横槊集、插羽集·1959年10月.txt	711	我看你这个人大而化之，其实你很精密。	二、靶场中指导员言：“我看你这个人大而化之，其实你很精密。”
7	009.横槊集、插羽集·1959年10月.txt	729	多读一句是一句，多学一字是一字。	二、靶场教室集合皆能小读，甚好，当更进一步紧扣着自己、督促着自己。——“多读一句是一句，多学一字是一字。”
6	009.横槊集、插羽集·1959年10月.txt	837	思想没有问题吧？	五、指导员自清茂手中接过我的日记，清茂指以(67)(68)二诗。指导员读至“多嘴山人”处笑着给我一拳。我问他：“思想没有问题吧？”
4	009.横槊集、插羽集·1959年10月.txt	837	多嘴山人	五、指导员自清茂手中接过我的日记，清茂指以(67)(68)二诗。指导员读至“多嘴山人”处笑着给我一拳。我问他：“思想没有问题吧？”
3	009.横槊集、插羽集·1959年10月.txt	851	作诗全是怪腔调	三、郑清茂昨言我“作诗全是怪腔调”，今诗以记之。清茂为胡适译日人论禅宗文字，甚矣，大学者治学之易也。
4	009.横槊集、插羽集·1959年10月.txt	873	女人吗？我喜欢年轻的，因为她们给人一种青春的感觉。	六、美国近日连死名人，马龙奥兰沙死于前，14日埃洛弗林又死，16日马歇尔又死。埃洛弗林死前犹与一十七岁少女在一起，自谓：“女人吗？我喜欢年轻的，因为她们给人一种青春的感觉。”1942、1951皆以强奸罪被控，1959在古巴与卡斯特罗并肩作战。自传今秋出版。其妻以二十五元之棺葬之，而十七岁之少女却订了一个一千元之棺材。三怪癖：冒险、女人、诉讼（多逃税、欠债、赡...
3	009.横槊集、插羽集·1959年10月.txt	907	找寻自己潜在的另一面！	四十二天军营的生活与海明威的影响，使我颇想修正我的“零标尺”。多少年来，我只在书本上做人而未在行动上做人，历史系的书呆生活我愈来愈厌倦，我幸亏没考研究所，我现在才感到，那根本不是我去埋首的地方！我现在正努力听你的劝告——“找寻自己潜在的另一面！”希望不久能有点收获与结论。
4	009.横槊集、插羽集·1959年10月.txt	919	可爱的恶棍	十五、白天整天未外出，晚饭后即去陈家，思为陈购一镜框。与陈先生谈译诗，谈天说地，品茗看书，5:30—8:45甚欢，介绍周正见面。见到黄立三的两个小孪生妹妹甚可爱；大妹妹教小学亦有忠琳之风韵，唯在室内外望，甚不能清楚。唯已有点爱她了。在陈家读报，补抄有关Eirol Elynn史料，今天才算大略了解一个“可爱的恶棍”，其自传因出版商要求删数段不予同意以致未能出版...
8	009.横槊集、插羽集·1959年10月.txt	935	李敖愈做愈坏，一句好话也不讲，这样怎么行？	五、上午戏指导员，其言其弟尿床，我言其尿白的其弟尿黄的，他说：“李敖这东西是个枭鸟，不像话。”我又以“于内科”讥之，盖以队长管外表而指导员司思想（内在的）也。下午校长阅兵后指导员说（因我坐在钢盔上）：“李敖愈做愈坏，一句好话也不讲，这样怎么行？”
