score	file	line	text	context
7	034.没有大忏悔，只有大遮盖.txt	3	遥爱云水秀，初疑路不同，安知清流转，偶与前山通。	陶百川、徐复观这些帮国民党做恶的杂碎，他们做恶后到了台湾，偷洗血手，冒充清流，这一自我清洗的小动作是可以理解的，但是素来清白的党外人士却还帮他们清洗，反而奉他们为清流，这就不可以理解了。事实上，这种人首先该做的，是公开的、诚意的向我们大忏悔，以示诚意。但他们没有大忏悔，只有大遮盖。这种态度，是最没有诚意的态度，反证了他们只是欺骗我们罢了。王维的诗说：“遥爱云...
7	035.三百六十的数字观.txt	3	杭州三百六十行，各有市语。	田汝成《游览志余》说：“杭州三百六十行，各有市语。”所谓“三百六十”，在中国文献中，从《礼记》开始，常常运用。《淮南子》中有“三百六十节”；苏轼诗中有“三百六十寺”；施肩吾诗中有“三百六十日”……这种描写方法，不外是表示数目很多。用三百六十来称呼各行各业，是明朝开始的。事实当然不是三百六十行，也不止三百六十行。（1984年12月16日）
3	035.三百六十的数字观.txt	3	三百六十	田汝成《游览志余》说：“杭州三百六十行，各有市语。”所谓“三百六十”，在中国文献中，从《礼记》开始，常常运用。《淮南子》中有“三百六十节”；苏轼诗中有“三百六十寺”；施肩吾诗中有“三百六十日”……这种描写方法，不外是表示数目很多。用三百六十来称呼各行各业，是明朝开始的。事实当然不是三百六十行，也不止三百六十行。（1984年12月16日）
3	035.三百六十的数字观.txt	3	三百六十节	田汝成《游览志余》说：“杭州三百六十行，各有市语。”所谓“三百六十”，在中国文献中，从《礼记》开始，常常运用。《淮南子》中有“三百六十节”；苏轼诗中有“三百六十寺”；施肩吾诗中有“三百六十日”……这种描写方法，不外是表示数目很多。用三百六十来称呼各行各业，是明朝开始的。事实当然不是三百六十行，也不止三百六十行。（1984年12月16日）
3	035.三百六十的数字观.txt	3	三百六十寺	田汝成《游览志余》说：“杭州三百六十行，各有市语。”所谓“三百六十”，在中国文献中，从《礼记》开始，常常运用。《淮南子》中有“三百六十节”；苏轼诗中有“三百六十寺”；施肩吾诗中有“三百六十日”……这种描写方法，不外是表示数目很多。用三百六十来称呼各行各业，是明朝开始的。事实当然不是三百六十行，也不止三百六十行。（1984年12月16日）
3	035.三百六十的数字观.txt	3	三百六十日	田汝成《游览志余》说：“杭州三百六十行，各有市语。”所谓“三百六十”，在中国文献中，从《礼记》开始，常常运用。《淮南子》中有“三百六十节”；苏轼诗中有“三百六十寺”；施肩吾诗中有“三百六十日”……这种描写方法，不外是表示数目很多。用三百六十来称呼各行各业，是明朝开始的。事实当然不是三百六十行，也不止三百六十行。（1984年12月16日）
7	037.批蒋通电出土.txt	7	对蒋先生肆意诋毁，措词极为激越。我们现在读了那篇电文，犹不禁痛愤其狂悖无状	这一通电的事，在《蒋总统秘录》第七册中记其原委说：“国庆节的10月10日，宋哲元、石敬亭等二十七人联名通电反抗中央，反对编遣国军；此时，他们的首领冯玉祥还闲居在山西省的五台阎锡山处，当然他和这些作乱的部属是有着联系的。……国民政府立即于11日下令将宋、石等人免职拿办，并决定武力讨伐的方针。”这一通电，《传记文学》中除了有“对蒋先生肆意诋毁，措词极为激越。我们...
6	037.批蒋通电出土.txt	7	国庆节的10月10日，宋哲元、石敬亭等二十七人联名通电反抗中央，反对编遣国军；此时，他们的首领冯玉祥还闲居在山西省的五台阎锡山处，当然他和这些作乱的部属是有着联系的。……国民政府立即于11日下令将宋、石等人免职拿办，并决定武力讨伐的方针。	这一通电的事，在《蒋总统秘录》第七册中记其原委说：“国庆节的10月10日，宋哲元、石敬亭等二十七人联名通电反抗中央，反对编遣国军；此时，他们的首领冯玉祥还闲居在山西省的五台阎锡山处，当然他和这些作乱的部属是有着联系的。……国民政府立即于11日下令将宋、石等人免职拿办，并决定武力讨伐的方针。”这一通电，《传记文学》中除了有“对蒋先生肆意诋毁，措词极为激越。我们...
4	038.下跪得太早了一点.txt	5	你喜欢跟人下跪吗？如果你不喜欢，陈鼓应会喜欢吗？如果陈鼓应果真跪地求饶，那一定有他不能承受的心理和生理的压力，我们应该同情被压迫者，还是应该同情压迫人的人？	1973年，陈鼓应和我，还有几个台大学生被警总约谈，由阎振兴校长保释出来。后传出陈鼓应在警总跪地求饶之说，故有青年以鄙夷的口气问我此事是否确实。在警总，我和陈鼓应是隔离审讯的，彼此情况根本不知道。故我只得反问那位青年：“你喜欢跟人下跪吗？如果你不喜欢，陈鼓应会喜欢吗？如果陈鼓应果真跪地求饶，那一定有他不能承受的心理和生理的压力，我们应该同情被压迫者，还是应该...
5	038.下跪得太早了一点.txt	7	别打我，你们要我说什么我就说什么！	这一辩解，很令我们开眼界。只是陈鼓应他们只不过在警总待了一夜，就放出来了，这么短的时间里就传出这种事，似乎跪地求饶得太早了些、似乎太没种了一点。听说他们有人在进门前就高举双手，大喊：“别打我，你们要我说什么我就说什么！”这种人，其种在水平以下，实开警总人犯洋相之新纪录。我们当然“应该同情被压迫者”，但是他们实在也该像样的撑一撑吧？（1984年12月17日）
5	040.国民党谄洋鬼而祭之.txt	11	非其鬼而祭之，谄也	《礼记·曲礼》有“非其所祭而祭之”的话；《论语·为政》有“非其鬼而祭之，谄也”的话，其此之谓乎？（1985年2月2日）
8	041.中人的歧路.txt	7	穷则为小人，泰则为君子	在我看了这个岛上的许多“中人”（所谓自由人士、学者专家）以后，我真的相信他们真是“穷则为小人，泰则为君子”的货色了，只可惜他们老是“小人固穷”，所以老是给老K做狗，君子之泰，总是不见了！（1985年2月11日）
4	041.中人的歧路.txt	7	小人固穷	在我看了这个岛上的许多“中人”（所谓自由人士、学者专家）以后，我真的相信他们真是“穷则为小人，泰则为君子”的货色了，只可惜他们老是“小人固穷”，所以老是给老K做狗，君子之泰，总是不见了！（1985年2月11日）
3	041.中人的歧路.txt	7	中人	在我看了这个岛上的许多“中人”（所谓自由人士、学者专家）以后，我真的相信他们真是“穷则为小人，泰则为君子”的货色了，只可惜他们老是“小人固穷”，所以老是给老K做狗，君子之泰，总是不见了！（1985年2月11日）
3	042.那时你在哪里？.txt	3	批评不如参与，党外的担子，全体党外都有义务来挑。如果嫌挑担子的人姿势不美，有大肩膀的人，应该站出来说：‘我来挑。’	前进被诬诽谤案，在蔡仁坚等被判刑后，林正杰忽然大做其秀，跑到台北地检处“自首”，说责任在他，与蔡仁坚等无涉。我奇怪，既然责任在他，为什么在蔡仁坚他们被审多次时他不露面？那时他是不是意在要人顶罪、被国民党“宰白鸭”？他在《挑担者言》中说：“批评不如参与，党外的担子，全体党外都有义务来挑。如果嫌挑担子的人姿势不美，有大肩膀的人，应该站出来说：‘我来挑。’”如今我...
6	043.张春男的卓见.txt	7	国民党同路人与党友	张春男的看法是很敏锐的。我总觉得，这是一个中国人有史以来最没有是非大义的岛，到处是伪君子和乡愿、到处是伪君子和乡愿、到处是伪君子和乡愿，过去虽然黑暗，但阉党是阉党、清流是清流，两者一下一上，有云泥之判；现在阉党固然仍为阉党，而所谓清流者，却是一个又一个“准阉党”，两者不相上下，而云即是泥。滑稽的是，勾结“国民党同路人与党友”的党外老小政客，居然还无耻的指责别...
4	043.张春男的卓见.txt	7	汉唐以来所未有也	张春男的看法是很敏锐的。我总觉得，这是一个中国人有史以来最没有是非大义的岛，到处是伪君子和乡愿、到处是伪君子和乡愿、到处是伪君子和乡愿，过去虽然黑暗，但阉党是阉党、清流是清流，两者一下一上，有云泥之判；现在阉党固然仍为阉党，而所谓清流者，却是一个又一个“准阉党”，两者不相上下，而云即是泥。滑稽的是，勾结“国民党同路人与党友”的党外老小政客，居然还无耻的指责别...
3	043.张春男的卓见.txt	7	恶势力	张春男的看法是很敏锐的。我总觉得，这是一个中国人有史以来最没有是非大义的岛，到处是伪君子和乡愿、到处是伪君子和乡愿、到处是伪君子和乡愿，过去虽然黑暗，但阉党是阉党、清流是清流，两者一下一上，有云泥之判；现在阉党固然仍为阉党，而所谓清流者，却是一个又一个“准阉党”，两者不相上下，而云即是泥。滑稽的是，勾结“国民党同路人与党友”的党外老小政客，居然还无耻的指责别...
7	045.中国的游记.txt	3	有体国经野之心，然后可以登山临水。	顾炎武说：“有体国经野之心，然后可以登山临水。”一山一水，凡夫俗子去了看了，只是去过看过而已，至多在树皮上石块上刻了“某某到此一游”而已，不能再有任何意义。可是一山一水，若被有心人去过看过，结果就不相同。有心人常把山水之乐得之心而寓之文，这类文字，就是所谓“游记”。
3	045.中国的游记.txt	3	某某到此一游	顾炎武说：“有体国经野之心，然后可以登山临水。”一山一水，凡夫俗子去了看了，只是去过看过而已，至多在树皮上石块上刻了“某某到此一游”而已，不能再有任何意义。可是一山一水，若被有心人去过看过，结果就不相同。有心人常把山水之乐得之心而寓之文，这类文字，就是所谓“游记”。
3	046.沙门岛与魔鬼岛.txt	5	沙门岛旧属有定额，过额则取一人投之海中。神宗时，马默守登州，建言今后溢额，乞选年深自至配所不作过人，移登州。上深然之。即谓可着为定制。	《水浒》等说部，每言刺配沙门岛。按沙门岛在山东登州，距海岸数十里，其岛如纱帽形，今又呼为纱帽岛。土地卤斥，不生草木。王定国《甲申杂录》：“沙门岛旧属有定额，过额则取一人投之海中。神宗时，马默守登州，建言今后溢额，乞选年深自至配所不作过人，移登州。上深然之。即谓可着为定制。”是刺配至此者，亦有军牢约束也。
4	049.拒见林希翎.txt	3	李敖说，你来台湾干吗？你不该来台湾的，来台湾多少会被国民党利用。	登恩4号请晚饭，说林希翎想约席中一谈，如不能去，林希翎饭后想来拜访。我都谢绝了。我告诉登恩，可转告林希翎：“李敖说，你来台湾干吗？你不该来台湾的，来台湾多少会被国民党利用。”今天登恩转告：“林希翎回话说：我来台湾干吗？我来看李敖啊！”（1985年10月13日）
3	049.拒见林希翎.txt	3	林希翎回话说：我来台湾干吗？我来看李敖啊！	登恩4号请晚饭，说林希翎想约席中一谈，如不能去，林希翎饭后想来拜访。我都谢绝了。我告诉登恩，可转告林希翎：“李敖说，你来台湾干吗？你不该来台湾的，来台湾多少会被国民党利用。”今天登恩转告：“林希翎回话说：我来台湾干吗？我来看李敖啊！”（1985年10月13日）
6	051.在天使一边.txt	3	The question is this：Is man an ape or an angel？ I， my lord， am on the side of the angels．	迪斯累里1864年演说，有名言曰：“The question is this：Is man an ape or an angel？ I， my lord， am on the side of the angels．”（问题是：人是猴子呢？还是天使？我主啊！我是在天使一边的。）其言甚辩，但也颇为自许。其实自己在天使一边，并非就不成问题。撒旦（Satan）就是被...
5	052.只证明你们更残忍而已.txt	3	如此，以后谁肯为总统做事！	中华民国总统袁世凯，通过情报首长、特务头子赵秉钧，找黑社会头子应桂馨暗杀宋教仁。事成后，又越过赵秉钧，直接派人杀应桂馨灭口。赵秉钧气不过，打电话给总统说：“如此，以后谁肯为总统做事！”
6	053.又是露奶头问题.txt	3	我写这封信，并不是反对贵党第一党报登裸照，正相反的，我是赞成登裸照的，我始终相信，一代尤物，把她的裸体流传古今，雅俗共赏，亦大佳事，人人都愿意看，看了皆大欢喜，又假道学个什么？可叹的是假道学的是你们，你们订了‘三点不露’的标准，自己又不能遵守，因此特写此信，请局长先生明告取舍，俾使小民知所进止，在未蒙明告惩办《中央日报》前，吾侪小民，自当援例刊出着蝉透之衫、露峰起之奶的裸女照片，以为跟进。	去年1月19日我写信给国民党新闻局长张京育，说：“在贵局迭次‘扫黄’行动中，揭橥的标准是‘三点不露’，就是刊出的图片上，不得露出女人的两个奶头和阴部，凡露奶头和阴部者，皆在取缔之列、法办之列。虽然如此，藐视贵局规定而大露特露者，贵党主持之报纸固优为之。即以1984年2月21日到22日短短两日间为例，2月21日，《中国时报》刊出裸女图、同一天《新生报》刊出裸女...
6	053.又是露奶头问题.txt	3	是他们的传播媒体，却照样露峰起之奶不绝。即以今天（1985年12月24日）《民族晚报》为例，他们不但登出巴黎“滚马俱乐部	去年1月19日我写信给国民党新闻局长张京育，说：“在贵局迭次‘扫黄’行动中，揭橥的标准是‘三点不露’，就是刊出的图片上，不得露出女人的两个奶头和阴部，凡露奶头和阴部者，皆在取缔之列、法办之列。虽然如此，藐视贵局规定而大露特露者，贵党主持之报纸固优为之。即以1984年2月21日到22日短短两日间为例，2月21日，《中国时报》刊出裸女图、同一天《新生报》刊出裸女...
4	054.你的小留学生呢？.txt	3	小留学生	国民党驻美黑代表钱复，1月7日报告，谈到“小留学生”的问题。他指出：我们在美国的小留学生，人数一万以上，他们虽是中国人，但中国语文教育基础不足，又因护照过期，要升大学也成了问题，最严重的是隔离父母，缺乏家庭教育，影响人格的发展，个人又无法照顾自己生活，滋生了许多问题。将孩子过早送到外国的父母，实在对不起孩子云云。但是，1983年1月4日，钱复上任登机前，却明...
7	056.黄石城的马屁经.txt	5	一言以为天下法，一行以为天下则。	首先，就蒋总统经国先生的人格事功而言，他是一位卫道者，古人说：“一言以为天下法，一行以为天下则。”经国先生的确做到了；在思想上，他手著的《荒漠甘泉》中那种悲天悯人，先天下之忧而忧，后天下之乐而乐的胸襟怀抱可以看出；在行为上，他在大陆时期担任专员“江西剿共”，以及“上海打虎”，名噪一时；来台后担任行政院长期间为国筹谋十大建设，剑及履及亲临深山旷野慰问工作人员，...
4	056.黄石城的马屁经.txt	5	江西剿共	首先，就蒋总统经国先生的人格事功而言，他是一位卫道者，古人说：“一言以为天下法，一行以为天下则。”经国先生的确做到了；在思想上，他手著的《荒漠甘泉》中那种悲天悯人，先天下之忧而忧，后天下之乐而乐的胸襟怀抱可以看出；在行为上，他在大陆时期担任专员“江西剿共”，以及“上海打虎”，名噪一时；来台后担任行政院长期间为国筹谋十大建设，剑及履及亲临深山旷野慰问工作人员，...
4	056.黄石城的马屁经.txt	5	上海打虎	首先，就蒋总统经国先生的人格事功而言，他是一位卫道者，古人说：“一言以为天下法，一行以为天下则。”经国先生的确做到了；在思想上，他手著的《荒漠甘泉》中那种悲天悯人，先天下之忧而忧，后天下之乐而乐的胸襟怀抱可以看出；在行为上，他在大陆时期担任专员“江西剿共”，以及“上海打虎”，名噪一时；来台后担任行政院长期间为国筹谋十大建设，剑及履及亲临深山旷野慰问工作人员，...
7	057.匡复起点搬家了，重建基地动摇了.txt	3	匡复中华的起点，重建民国的基地。	今天《新生报》登：为了配合台北市区铁路地下化施工，位于东隧道上方的“国父史迹纪念馆”，订明（1986）年1月起拆移，由于该馆为国父在台有关史迹唯一保存完整之房舍，施工单位在原馆北端，将依原形状、建材予以复建。全部迁建复原工作，预定1986年12月完成。国父史迹馆位于台北市北平西路与中山北路交会处，与救国团青年服务社房舍比邻相接，原系日本旅舍“梅屋敷”旧址，国...
4	057.匡复起点搬家了，重建基地动摇了.txt	3	国父史迹纪念馆	今天《新生报》登：为了配合台北市区铁路地下化施工，位于东隧道上方的“国父史迹纪念馆”，订明（1986）年1月起拆移，由于该馆为国父在台有关史迹唯一保存完整之房舍，施工单位在原馆北端，将依原形状、建材予以复建。全部迁建复原工作，预定1986年12月完成。国父史迹馆位于台北市北平西路与中山北路交会处，与救国团青年服务社房舍比邻相接，原系日本旅舍“梅屋敷”旧址，国...
3	057.匡复起点搬家了，重建基地动摇了.txt	3	建党六十年纪念	今天《新生报》登：为了配合台北市区铁路地下化施工，位于东隧道上方的“国父史迹纪念馆”，订明（1986）年1月起拆移，由于该馆为国父在台有关史迹唯一保存完整之房舍，施工单位在原馆北端，将依原形状、建材予以复建。全部迁建复原工作，预定1986年12月完成。国父史迹馆位于台北市北平西路与中山北路交会处，与救国团青年服务社房舍比邻相接，原系日本旅舍“梅屋敷”旧址，国...
5	058.李敖的鸡巴有远见.txt	3	岁月如矢，革命未成	当年（1964）小文在美国出生的时候，陈鼓应跟人说：“李敖这个女儿在美国出生，就是美国人了，李敖的目的，是二十多年后，可以以‘美国人的爸爸’身分去美国。”这话传到我耳里，我开玩笑说：“李敖这么有远见吗？有本领把计划定到二十年后吗？二十年太长了吧？变化太多了吧？我靠小文去美国，还不如靠老蒋回大陆也！”如今，“岁月如矢，革命未成”，二十多年一晃就过去了，靠老蒋回...
4	058.李敖的鸡巴有远见.txt	3	李敖这么有远见吗？有本领把计划定到二十年后吗？二十年太长了吧？变化太多了吧？我靠小文去美国，还不如靠老蒋回大陆也！	当年（1964）小文在美国出生的时候，陈鼓应跟人说：“李敖这个女儿在美国出生，就是美国人了，李敖的目的，是二十多年后，可以以‘美国人的爸爸’身分去美国。”这话传到我耳里，我开玩笑说：“李敖这么有远见吗？有本领把计划定到二十年后吗？二十年太长了吧？变化太多了吧？我靠小文去美国，还不如靠老蒋回大陆也！”如今，“岁月如矢，革命未成”，二十多年一晃就过去了，靠老蒋回...
3	058.李敖的鸡巴有远见.txt	3	李敖这个女儿在美国出生，就是美国人了，李敖的目的，是二十多年后，可以以‘美国人的爸爸’身分去美国。	当年（1964）小文在美国出生的时候，陈鼓应跟人说：“李敖这个女儿在美国出生，就是美国人了，李敖的目的，是二十多年后，可以以‘美国人的爸爸’身分去美国。”这话传到我耳里，我开玩笑说：“李敖这么有远见吗？有本领把计划定到二十年后吗？二十年太长了吧？变化太多了吧？我靠小文去美国，还不如靠老蒋回大陆也！”如今，“岁月如矢，革命未成”，二十多年一晃就过去了，靠老蒋回...
5	059.尤清明于责人、昧于知己.txt	3	身份、地位	邱连辉竞选屏东县长失败，不甘寂寞之余，高速投靠国民党，竟出任省政府顾问兼诉愿委员会主任委员。1月17日《八十年代》登出尤清谈话，尤清说，事先他劝阻邱连辉，理由有二：“第一点，选举的失败不值得灰心，因为以他一人的力量与国民党对抗自然是处于劣势。第二点，依他的身分、地位‘管’邱创焕是绰绰有余，何必屈就邱创焕之下呢？”尤清的话，都言之成理、都没有错。但是，令人不解...
3	059.尤清明于责人、昧于知己.txt	3	第一点，选举的失败不值得灰心，因为以他一人的力量与国民党对抗自然是处于劣势。第二点，依他的身分、地位‘管’邱创焕是绰绰有余，何必屈就邱创焕之下呢？	邱连辉竞选屏东县长失败，不甘寂寞之余，高速投靠国民党，竟出任省政府顾问兼诉愿委员会主任委员。1月17日《八十年代》登出尤清谈话，尤清说，事先他劝阻邱连辉，理由有二：“第一点，选举的失败不值得灰心，因为以他一人的力量与国民党对抗自然是处于劣势。第二点，依他的身分、地位‘管’邱创焕是绰绰有余，何必屈就邱创焕之下呢？”尤清的话，都言之成理、都没有错。但是，令人不解...
4	060.辜振甫出丑记.txt	5	痛不欲生	舒尔兹的“中堂脾气”台北也领略过。今春台北工商界巨子辜振甫专程来华府，为争取美国支持中华民国加入太平洋社区组织奔走，事后，舒尔兹曾在国务院设宴，款待一些热心推动这一组织的各国知名之士，辜振甫与舒尔兹同席。宴会进行中，舒尔兹特请外国客人们即席致词。轮到辜氏讲话时，辜氏本于爱国热忱、做点国民外交的心理，希望美国供应高性能战机给台湾，岂知舒尔兹一听此话勃然大怒，立...
3	060.辜振甫出丑记.txt	5	中堂脾气	舒尔兹的“中堂脾气”台北也领略过。今春台北工商界巨子辜振甫专程来华府，为争取美国支持中华民国加入太平洋社区组织奔走，事后，舒尔兹曾在国务院设宴，款待一些热心推动这一组织的各国知名之士，辜振甫与舒尔兹同席。宴会进行中，舒尔兹特请外国客人们即席致词。轮到辜氏讲话时，辜氏本于爱国热忱、做点国民外交的心理，希望美国供应高性能战机给台湾，岂知舒尔兹一听此话勃然大怒，立...
4	060.辜振甫出丑记.txt	7	国民外交官	辜振甫也、钱复也，他们真可恨、可耻、又可怜！其实话说回来，老美国务卿实在是错怪了这位国民党中常委。舒尔兹不知道，辜振甫的即席致词，根本不是说给华府的舒尔兹听的，乃是说给台北的蒋经国听的。这个情况，一如当年国民党外交部长魏道明在联大演说，当时大会主席赶魏道明下台，魏道明仍不肯下台，还是要说个没完，原因无他，要说给在台北的蒋介石听耳！——洋人的智能毕竟比国民党正...
4	061.橘皮何辜？.txt	3	中华民国	初一午间华视新闻，国民党竟利用独占的传播媒体，提倡迷信，访问起当代“妖僧”林云来！林云说，“中华民国”国运已经否极泰来，“中华民国”的气非常兴旺，现在走泰来的运，大陆则是乌云蔽日。大家接祥气、除晦气的方法，初一、十五晚上子时（11至1点）以十五分钟时间，用九片新鲜橘子皮，剪成圈形，扔到每个主要房间去。……接着他以指上手势为蒋经国祈福。——一派迷信的妖妄之行，...
5	063.打官司的成与败.txt	3	成固欣然，败亦可喜	我在国民党统治之下，一直是以“成固欣然，败亦可喜”的心态打官司的。我反正站在正义的一边，法官苟有异数，同我一边，是谓“欣然”；法官同流合污，不同我一边，但他们的判决书可以被我遗臭万年，留为历史活证，这也不错，是谓“可喜”。（1986年2月12日）
