score	file	line	text	context
4	003.9月21日神州文化之旅第三天.txt	31	你太可恶了。如果我是你太太，我就弄杯毒药给你。	自由主义的另外一个部分就是我们人民和政府的关系。第一个关系是政府这么坏，我不要活了，我“嗝儿”了。屈原就是，政府不好，我嗝了。（笑声）辛亥革命以前的杨笃生在英国跳海，就是我不要活了。最有名的一个英国的故事，一位英国的议员叫Aster，这个女的跟另外一个议员，有名的丘吉尔吵架。Aster说：“你太可恶了。如果我是你太太，我就弄杯毒药给你。”丘吉尔说：“如果我是...
4	003.9月21日神州文化之旅第三天.txt	31	如果我是你丈夫，这毒药我就喝。	自由主义的另外一个部分就是我们人民和政府的关系。第一个关系是政府这么坏，我不要活了，我“嗝儿”了。屈原就是，政府不好，我嗝了。（笑声）辛亥革命以前的杨笃生在英国跳海，就是我不要活了。最有名的一个英国的故事，一位英国的议员叫Aster，这个女的跟另外一个议员，有名的丘吉尔吵架。Aster说：“你太可恶了。如果我是你太太，我就弄杯毒药给你。”丘吉尔说：“如果我是...
8	003.9月21日神州文化之旅第三天.txt	35	我是林云，我不在家	第三个是“嘚儿”了。有一个台湾人，他住在北京很久，住在雍和宫附近，讲了一口京片子。他到北京大学来作客，副校长他们也照应过他，叫作林云。你给他通电话，他的答录机说“我是林云，我不在家”，等会儿这个答录机“嘚”一响，就开始录音，你要告诉我的话，你就把它录进去。什么叫“嘚”了，就是你找不到我了，我猫起来了。中国的标准里面，是做隐士，藏起来了。（笑声）诸葛亮不就是“...
5	003.9月21日神州文化之旅第三天.txt	57	庙小妖风大，池浅王八多	当年马寅初在北大干了九年校务长，在国民党时代被软禁。后来又做北大的校长，本来一开始和毛泽东关系很好，但是为了人口问题，闹翻了。马寅初认为中国人这样生下去，国家的财政都要被吃掉。毛主席说，人多没关系，人多好办事情。结果毛主席赢了，大家去斗马寅初，一路斗到马寅初的床头都贴上大字报。可是马寅初说我不在乎，我要干到死，我要孤军奋战。结果他没死，他活到100岁，别人都...
3	003.9月21日神州文化之旅第三天.txt	63	立法委员	今天我做个样板给大家看：我捐了35万块人民币给胡先生，要求给胡适在北大立个铜像。就是告诉大家，当年我们那样子打击胡适思想，其实胡适思想是最温和的，对我们是有利的。现在我们开始知道了，立个铜像给他。当年胡适在我穷困的时候送过1000块钱给我，我今天用了35万人民币，相当于150万台币，相当于1500倍来还胡先生这个人情，大家知道吗？你们是这种人吗？你们不是。你...
4	003.9月21日神州文化之旅第三天.txt	77	今夜扁舟来诀汝	李敖：屈原就属于我对政府不满，我“嗝儿”了的典型。我认为那是弱者的表达，现在的人要用清醒的、理性的并且快乐一点的表达。让我最后讲一个例子给大家。王安石做官的时候，他的小女儿在他任上死了。他临走时，划个小船，到坟上给他的小女儿say goodbye。后来写了一首诗“今夜扁舟来诀汝”，今天晚上，我坐了小船来跟你说再见；“此生从此各西东”，从此我们见不到面了，再也...
4	003.9月21日神州文化之旅第三天.txt	77	此生从此各西东	李敖：屈原就属于我对政府不满，我“嗝儿”了的典型。我认为那是弱者的表达，现在的人要用清醒的、理性的并且快乐一点的表达。让我最后讲一个例子给大家。王安石做官的时候，他的小女儿在他任上死了。他临走时，划个小船，到坟上给他的小女儿say goodbye。后来写了一首诗“今夜扁舟来诀汝”，今天晚上，我坐了小船来跟你说再见；“此生从此各西东”，从此我们见不到面了，再也...
7	003.9月21日神州文化之旅第三天.txt	79	天上明月光，疑是地上霜。举头望明月，低头思故乡	唐朝人写诗，写四万首，几乎有一半是“天上明月光，疑是地上霜。举头望明月，低头思故乡”。为什么思故乡呢？因为故乡太遥远了。我在台北有言在先，我这次回来，不是怀乡，没有乡愁；不是近乡，没有情怯；不是还乡，没有衣锦；不是林黛玉，没有眼泪。为什么我要这样？好像我没有乡愁，不是的。因为实在不该有乡愁，这是个错误的情绪。屈原是个错误的情绪，他对政府是个错误的态度。我希望...
5	003.9月21日神州文化之旅第三天.txt	87	字比我想象中小些，碑文不清	北大图书馆古籍部的胡先生称，李敖在到来前，点名要看“常丑奴墓志”的拓本。墓志本身是明代出土的，拓本是清初的。“这个拓本知道的人很少，存世更少。”胡先生称，这个拓本被单列在一条长桌上，是唯一一件享受特殊待遇的展品。李敖对此看得很仔细，称“字比我想象中小些，碑文不清”。他还特别关注了拓本上张伯英的字，赞扬其字“大气”。
4	003.9月21日神州文化之旅第三天.txt	87	这个拓本知道的人很少，存世更少。	北大图书馆古籍部的胡先生称，李敖在到来前，点名要看“常丑奴墓志”的拓本。墓志本身是明代出土的，拓本是清初的。“这个拓本知道的人很少，存世更少。”胡先生称，这个拓本被单列在一条长桌上，是唯一一件享受特殊待遇的展品。李敖对此看得很仔细，称“字比我想象中小些，碑文不清”。他还特别关注了拓本上张伯英的字，赞扬其字“大气”。
3	003.9月21日神州文化之旅第三天.txt	91	独立	胡适是现代诗人、文史学家、五四文学革命的倡导者。1946年9月接任北大校长。同年，在北大新学期开学典礼的讲演中，胡适要求学生做一个能独立研究，独立思想的人。胡适说，我为什么希望且要求你们是“独立”二字，而不是自由思想、自由研究的“自由”二字呢？要知道自由是对外面束缚而言，不受外面势力的限制与压迫，这一向正是北大的精神，而你们现在大抵已经获得了并做到了。而“独...
3	003.9月21日神州文化之旅第三天.txt	91	自由	胡适是现代诗人、文史学家、五四文学革命的倡导者。1946年9月接任北大校长。同年，在北大新学期开学典礼的讲演中，胡适要求学生做一个能独立研究，独立思想的人。胡适说，我为什么希望且要求你们是“独立”二字，而不是自由思想、自由研究的“自由”二字呢？要知道自由是对外面束缚而言，不受外面势力的限制与压迫，这一向正是北大的精神，而你们现在大抵已经获得了并做到了。而“独...
4	003.9月21日神州文化之旅第三天.txt	111	人书俱老	参观结束，北大图书馆以馆赠和个人赠送的名义，赠给李敖三件礼物。北大图书馆戴馆长此前曾宣布会送一件珍贵礼物。昨天，这件神秘礼物揭开谜底，戴馆长代表图书馆赠给李敖一件用镜框封存的胡适手迹的复制品。此外，李敖还获赠一本《北京大学图书馆藏历代金石拓本菁华》。第三份礼物是图书馆的师女士个人制作的剪纸艺术《雄鸡图》。李敖则为北大图书馆题词：“人书俱老”。“人书俱老”出自...
5	003.9月21日神州文化之旅第三天.txt	129	五十年来五百年内白话文第一二三	4月10日的生日一过，我就15岁了。前几个月发烧发得昏天黑地，但我又是个不能没事干的人，就把妈妈刚买的《李敖回忆录》和《北京法源寺》看完了，觉得很不错。《李敖回忆录》写马占山一段，我觉得好，念给妈妈听，还没念完就哭了。您的文章字字都喊在我心里，所谓“五十年来五百年内白话文第一二三”之说看来是实事求是！我在书的目录一页曾写下这样的感言：
4	003.9月21日神州文化之旅第三天.txt	143	爱的教育	考试作文培训出来的，都是冷冰冰的字句与冷冰冰的人，没有感表，没有感情！这是多么可怕的呀！生病后，我偶然参加了一次题名为“爱的教育”的作文比赛，那时我身体极差，心想自己写作这么好，没参加过比赛怪可惜，也不知道别人的写作程度怎样，抱着这种态度，我往他们的邮箱里石沉大海地发了两篇，有一篇得了个三等奖，奖品是获奖作文集成的一本书。遍视全书，那些作文是怎样表现“爱的教...
5	003.9月21日神州文化之旅第三天.txt	147	讲述自己人生中的潮汐与浪涛，与海底中蕴藏的珍珠	老师给我毕业卷子做，语文作文的题目是“讲述自己人生中的潮汐与浪涛，与海底中蕴藏的珍珠”。我是正好经历丰富，有可写的，我的一个文学好友写了一场足球比赛，那就是他们人生中的跌宕起伏。
5	003.9月21日神州文化之旅第三天.txt	165	李敖不是天才，是才子	子尤得的病是一种罕见的恶性肿瘤。可是，小小年纪，逢此劫难，竟能泰然处之。这种从容、勇敢和强悍，倒颇有李敖之风。不过，子尤评价李大师却是“李敖不是天才，是才子”，因为“天才是不关注外部事务，李敖太关注外部事务了，光打官司就打了好多次”。以爱不爱“打官司”评价“天才”与否，可谓耳目一新。子尤的狷狂也不落李敖之后，他说：“我只是欣赏李敖，不崇拜他。我不随便崇拜人”...
5	003.9月21日神州文化之旅第三天.txt	165	天才是不关注外部事务，李敖太关注外部事务了，光打官司就打了好多次	子尤得的病是一种罕见的恶性肿瘤。可是，小小年纪，逢此劫难，竟能泰然处之。这种从容、勇敢和强悍，倒颇有李敖之风。不过，子尤评价李大师却是“李敖不是天才，是才子”，因为“天才是不关注外部事务，李敖太关注外部事务了，光打官司就打了好多次”。以爱不爱“打官司”评价“天才”与否，可谓耳目一新。子尤的狷狂也不落李敖之后，他说：“我只是欣赏李敖，不崇拜他。我不随便崇拜人”...
4	003.9月21日神州文化之旅第三天.txt	165	我只是欣赏李敖，不崇拜他。我不随便崇拜人	子尤得的病是一种罕见的恶性肿瘤。可是，小小年纪，逢此劫难，竟能泰然处之。这种从容、勇敢和强悍，倒颇有李敖之风。不过，子尤评价李大师却是“李敖不是天才，是才子”，因为“天才是不关注外部事务，李敖太关注外部事务了，光打官司就打了好多次”。以爱不爱“打官司”评价“天才”与否，可谓耳目一新。子尤的狷狂也不落李敖之后，他说：“我只是欣赏李敖，不崇拜他。我不随便崇拜人”...
4	003.9月21日神州文化之旅第三天.txt	165	20世纪出生的天才作家里，女的只有一个，张爱玲；男的就是我，子尤。	子尤得的病是一种罕见的恶性肿瘤。可是，小小年纪，逢此劫难，竟能泰然处之。这种从容、勇敢和强悍，倒颇有李敖之风。不过，子尤评价李大师却是“李敖不是天才，是才子”，因为“天才是不关注外部事务，李敖太关注外部事务了，光打官司就打了好多次”。以爱不爱“打官司”评价“天才”与否，可谓耳目一新。子尤的狷狂也不落李敖之后，他说：“我只是欣赏李敖，不崇拜他。我不随便崇拜人”...
7	003.9月21日神州文化之旅第三天.txt	171	看来要著作等身，我比你要困难些。	李敖第一句话便惊叹：“我想到你这么高。”子尤答道：“看来要著作等身，我比你要困难些。”李笑道：“那武大郎岂不最容易了？”
6	003.9月21日神州文化之旅第三天.txt	171	那武大郎岂不最容易了？	李敖第一句话便惊叹：“我想到你这么高。”子尤答道：“看来要著作等身，我比你要困难些。”李笑道：“那武大郎岂不最容易了？”
5	003.9月21日神州文化之旅第三天.txt	173	目有余子，尤其是你	李敖拿出自己写的一本书《教育与脸谱》送给子尤。并在上面写了八个字“目有余子，尤其是你”，将子尤的名字嵌进去。“余子”之意是指还不到服兵役年龄的年轻人。但是，在围棋术语里，如果在围棋计算胜负的填满计点法里，有“余子”则为负方。
7	003.9月21日神州文化之旅第三天.txt	175	你也曾青春似我，我也会快意如你。谁敢说虽千万人吾往矣，谁又将两亿年握在手里。	子尤回赠李敖一本他8岁到15岁的作品集《谁的青春有我狂》。在扉页上，子尤以诗赠李敖：“你也曾青春似我，我也会快意如你。谁敢说虽千万人吾往矣，谁又将两亿年握在手里。”
4	003.9月21日神州文化之旅第三天.txt	177	在我个年龄，我已经超过你了，因为我得的病比你多。	子尤说：“在我个年龄，我已经超过你了，因为我得的病比你多。”李敖答：“你对疾病的态度很了不起，这胜过很多人。”子尤掀开自己上身的衣服，让李敖看自己因治病留下的伤疤，李敖笑答：你是肚脐眼儿以上有伤疤，从肚脐眼儿以下我就接上去了。
4	003.9月21日神州文化之旅第三天.txt	177	你对疾病的态度很了不起，这胜过很多人。	子尤说：“在我个年龄，我已经超过你了，因为我得的病比你多。”李敖答：“你对疾病的态度很了不起，这胜过很多人。”子尤掀开自己上身的衣服，让李敖看自己因治病留下的伤疤，李敖笑答：你是肚脐眼儿以上有伤疤，从肚脐眼儿以下我就接上去了。
4	003.9月21日神州文化之旅第三天.txt	179	我以前已经恐惧过了，现在不会了。	李敖知道在化疗病人的房中不能久留，待了不到十分钟就要走。子尤的妈妈说，子尤还有一个重要的问题要问你。但是，老先生却脚不停步地出去了。而子尤则坐在轮椅上去送别。在电梯里，子尤“重要”的问题终于有时间问了出来，“你惧怕死亡吗？”李敖答：“我以前已经恐惧过了，现在不会了。”
3	003.9月21日神州文化之旅第三天.txt	179	你惧怕死亡吗？	李敖知道在化疗病人的房中不能久留，待了不到十分钟就要走。子尤的妈妈说，子尤还有一个重要的问题要问你。但是，老先生却脚不停步地出去了。而子尤则坐在轮椅上去送别。在电梯里，子尤“重要”的问题终于有时间问了出来，“你惧怕死亡吗？”李敖答：“我以前已经恐惧过了，现在不会了。”
5	003.9月21日神州文化之旅第三天.txt	181	你为什么要来到这个世界上	中午12时许，李敖走出了子尤的病房。母亲柳红推着轮椅上的子尤送到楼门口。子尤从椅上站起来，附到李敖的耳边说了句什么。李敖微笑着作了回，一老一小就此话别。事后，子尤告诉记者，他当时问李敖“你为什么要来到这个世界上”，李敖的回答是：“这个问题恐怕只有我的爸爸和妈妈才能回答。”
4	003.9月21日神州文化之旅第三天.txt	181	这个问题恐怕只有我的爸爸和妈妈才能回答。	中午12时许，李敖走出了子尤的病房。母亲柳红推着轮椅上的子尤送到楼门口。子尤从椅上站起来，附到李敖的耳边说了句什么。李敖微笑着作了回，一老一小就此话别。事后，子尤告诉记者，他当时问李敖“你为什么要来到这个世界上”，李敖的回答是：“这个问题恐怕只有我的爸爸和妈妈才能回答。”
3	003.9月21日神州文化之旅第三天.txt	183	十五岁的子尤是否超过了你？你认为他的才华吗？	而李敖事后接受采访时，有记者问及“十五岁的子尤是否超过了你？你认为他的才华吗？”李敖微微一笑，并不正面回答。他说，我这个人对文字非常敏感，感觉特别好，是不是好的文字，我一眼就能看出来。
3	003.9月21日神州文化之旅第三天.txt	187	从来没有去过这个地方，为什么没有去过能把这个小说写得神龙活现，这就是文学家嘛，就干这个的。	“从来没有去过这个地方，为什么没有去过能把这个小说写得神龙活现，这就是文学家嘛，就干这个的。”李敖自称第一流的文学家，虽然从未亲身到过北京法源寺，却以法源寺为背景写出一部长篇历史小说《北京法源寺》。这本以清末戊戌变法为主题的小说为李敖带来了诺贝尔文学奖提名，更成为海峡两岸的畅销作品。
4	003.9月21日神州文化之旅第三天.txt	189	我笔下的法源寺比较清静，现在这里太乱了。	9月21日下午三点半，李敖来到位于北京西城区牛街附近的法源寺参观。本想偷偷摸摸地看看，了却多年夙愿，却不想庙里庙外早已挤满了争睹大师“本尊”的民众，全程参观路线被围得水泄不通。李敖笑说：“我笔下的法源寺比较清静，现在这里太乱了。”
7	003.9月21日神州文化之旅第三天.txt	191	我知道，我自己对佛教来说其实是邪门歪道的。	中国佛学院常务副院长、法源寺方丈圣辉和尚率众僧侣在门前迎候，先将李敖请到会客厅，圣辉方丈递给李敖一杯清茶说，君子之交淡如水，我们出家人就用这杯水来迎接你。李敖的开场白却是“语不惊人死不休”，第一句便说道：“我知道，我自己对佛教来说其实是邪门歪道的。”
4	003.9月21日神州文化之旅第三天.txt	191	语不惊人死不休	中国佛学院常务副院长、法源寺方丈圣辉和尚率众僧侣在门前迎候，先将李敖请到会客厅，圣辉方丈递给李敖一杯清茶说，君子之交淡如水，我们出家人就用这杯水来迎接你。李敖的开场白却是“语不惊人死不休”，第一句便说道：“我知道，我自己对佛教来说其实是邪门歪道的。”
4	003.9月21日神州文化之旅第三天.txt	195	云麾将军碑	悯忠寺必有悯忠台。台基高1米多，周围护以砖栏，殿堂建于台上。此殿结构独特，外墙以十二柱为架，室内以十二柱支撑，式样与故宫御花园万春亭相同。这里保存着法源寺的历代石刻、经幢等，以唐《无垢净光宝塔颂》《悯忠寺藏舍利记》《承进为荐福禅师造陀罗尼经幢》，辽代的《燕京大悯忠寺菩萨地宫舍利函记》最为珍贵。殿外山墙还嵌有清代翁方钢复制的唐“云麾将军碑”残柱基，另有《法源八...
7	003.9月21日神州文化之旅第三天.txt	199	八国联军打到北京时，恭亲王的家人就暂时躲到这里。	在唐朝史思明雕刻的石碑前，李敖说：“八国联军打到北京时，恭亲王的家人就暂时躲到这里。”谈及小说与实景的不同，李敖感慨，做学问是可以不到当地也能了解很多东西的，但今天到了法源寺，还是和小说中有许多不同，很多资料里有的文物都看不到了。
5	003.9月21日神州文化之旅第三天.txt	201	法海真源，尽在于斯	李敖参观了寺里各种各样的佛像。最为神奇的一个佛像是明代“千手观音”，有四、五十公分高，据说佛像的一只手上会往下滴水，被善男信女称为“圣露”。在藏经阁，李敖参观了一些珍贵的佛法典籍，参观北京最大的一尊卧佛。圆持大师代表法源寺和中国佛教图书文物馆将一大捆书赠送给了李敖。这是乾隆皇帝时编制的《满蒙汉藏合璧大藏全咒》，共8册88卷，多达一千多万字。圆持大师说，这套书...
5	003.9月21日神州文化之旅第三天.txt	201	勿我两忘，人书俱老	李敖参观了寺里各种各样的佛像。最为神奇的一个佛像是明代“千手观音”，有四、五十公分高，据说佛像的一只手上会往下滴水，被善男信女称为“圣露”。在藏经阁，李敖参观了一些珍贵的佛法典籍，参观北京最大的一尊卧佛。圆持大师代表法源寺和中国佛教图书文物馆将一大捆书赠送给了李敖。这是乾隆皇帝时编制的《满蒙汉藏合璧大藏全咒》，共8册88卷，多达一千多万字。圆持大师说，这套书...
7	003.9月21日神州文化之旅第三天.txt	203	我扫了大家的兴，可是不扫这个兴，也就不叫我了。	李敖在法源寺参观了一个多小时。临走前，圣辉方丈请李敖到佛学院礼堂讲话。中国佛学院是以培养僧才为目标的中国高等佛教学校，1956年在法源寺创办，第一任院长是喜饶嘉措大师。来自全国的约150名僧人正在这里研修佛法。圣辉方丈向僧人们介绍说，李敖先生虽然从来没到过法源寺，却用文学家的神来之笔写出了法源寺，所以李敖先生的前世可能是个和尚。李敖一笑，说出的却是一番“无神...
3	003.9月21日神州文化之旅第三天.txt	213	最好是好的敌人。	耽误的原因其实不全在时间不够，而是我心理上的一个求全故障。伏尔泰（Voltaire）说过一句话：“最好是好的敌人。”（Lemieuxestl’ennemidubien. The best is the enemy of the good.）正因为我要写得“最好”，结果连“好”都踌躇下笔了。
4	003.9月21日神州文化之旅第三天.txt	221	中有苦心而不能显	《北京法源寺》中的史事，都以历史考证做底子，它的精确度，远在历史教授们之上（例如张灏写《烈士精神与批判意识》，作者俨然谭嗣同专家，但书中一开头就说谭嗣同活了三十六年，事实上，谭嗣同生在一八六五，死在一八九八，何来三十六年）。在做好历史考证后，尽量删去历史中的伪作（例如根据王照《小航文存》和唐才质《戊戌闻见录》，谭嗣同在狱中，不可能再写信给康、梁），而存真实。...
4	003.9月21日神州文化之旅第三天.txt	221	中有调剂而人不知	《北京法源寺》中的史事，都以历史考证做底子，它的精确度，远在历史教授们之上（例如张灏写《烈士精神与批判意识》，作者俨然谭嗣同专家，但书中一开头就说谭嗣同活了三十六年，事实上，谭嗣同生在一八六五，死在一八九八，何来三十六年）。在做好历史考证后，尽量删去历史中的伪作（例如根据王照《小航文存》和唐才质《戊戌闻见录》，谭嗣同在狱中，不可能再写信给康、梁），而存真实。...
3	003.9月21日神州文化之旅第三天.txt	221	去留肝胆两昆仑	《北京法源寺》中的史事，都以历史考证做底子，它的精确度，远在历史教授们之上（例如张灏写《烈士精神与批判意识》，作者俨然谭嗣同专家，但书中一开头就说谭嗣同活了三十六年，事实上，谭嗣同生在一八六五，死在一八九八，何来三十六年）。在做好历史考证后，尽量删去历史中的伪作（例如根据王照《小航文存》和唐才质《戊戌闻见录》，谭嗣同在狱中，不可能再写信给康、梁），而存真实。...
3	003.9月21日神州文化之旅第三天.txt	221	亲赴法源寺访袁	《北京法源寺》中的史事，都以历史考证做底子，它的精确度，远在历史教授们之上（例如张灏写《烈士精神与批判意识》，作者俨然谭嗣同专家，但书中一开头就说谭嗣同活了三十六年，事实上，谭嗣同生在一八六五，死在一八九八，何来三十六年）。在做好历史考证后，尽量删去历史中的伪作（例如根据王照《小航文存》和唐才质《戊戌闻见录》，谭嗣同在狱中，不可能再写信给康、梁），而存真实。...
3	003.9月21日神州文化之旅第三天.txt	221	那一大排方形木窗	《北京法源寺》中的史事，都以历史考证做底子，它的精确度，远在历史教授们之上（例如张灏写《烈士精神与批判意识》，作者俨然谭嗣同专家，但书中一开头就说谭嗣同活了三十六年，事实上，谭嗣同生在一八六五，死在一八九八，何来三十六年）。在做好历史考证后，尽量删去历史中的伪作（例如根据王照《小航文存》和唐才质《戊戌闻见录》，谭嗣同在狱中，不可能再写信给康、梁），而存真实。...
3	004.9月22日神州文化之旅第四天.txt	7	在录制现场，李敖变成了一个喜剧、娱乐人物，尽管锋芒不断出现，但极少提及敏感字眼，一改往日狂妄作风，变化得令人诧异不已。	现场的媒体记者则认为：“在录制现场，李敖变成了一个喜剧、娱乐人物，尽管锋芒不断出现，但极少提及敏感字眼，一改往日狂妄作风，变化得令人诧异不已。”“一向喜欢张扬个性，屁股像着火的李敖，刚进录音棚面部表情有些紧张，自始至终他一直很规矩，多半时间是两腿分开，将双手放在膝盖上。”
