file	line	text	context
023.“遗教”梦碎.txt	3	行政院副院长、各部会首长及不管部会之政务委员，由行政院院长提请总统任命之。	《中华民国宪法》劈头就说“依据孙中山先生创立中华民国之遗教”，“制定本宪法”，但是搬出“本宪法”与遗教一对照，便发现抵触丛生。乍看起来，定章分节，全是遗教的外壳，从第3章国民大会，到第11章地方制度，无一不《五权宪法》也；但实际上，从第3章国民大会起，就大干一票，只师遗教之词、而不师其意了。第25条先打了国民大会职权的折扣、第27条又剥夺了国民大会一大部分政权、第28条、第29条使国大代表6年开会一次，无从行使政权、参与中央政事。到了第4章总统，从第35条到第52条，共有18条，但是除了第44条总统得召集各院院长会商解决争执外，其他17条，全部与遗教不相干。第5章至第9章五院出现了，在行政院部分，第55条：“行政院院长由总统提名，经立法院同意任命之。”但按《五权宪法》，任命五院院长之同意权，在国民大会，根本不在立法院或其他各院；第56条：“行政院副院长、各部会首长及不管部会之政务委员，由行政院院长提请总统任命之。”但按《建国大纲...
023.“遗教”梦碎.txt	3	行政院依左列规定，对立法院负责。	《中华民国宪法》劈头就说“依据孙中山先生创立中华民国之遗教”，“制定本宪法”，但是搬出“本宪法”与遗教一对照，便发现抵触丛生。乍看起来，定章分节，全是遗教的外壳，从第3章国民大会，到第11章地方制度，无一不《五权宪法》也；但实际上，从第3章国民大会起，就大干一票，只师遗教之词、而不师其意了。第25条先打了国民大会职权的折扣、第27条又剥夺了国民大会一大部分政权、第28条、第29条使国大代表6年开会一次，无从行使政权、参与中央政事。到了第4章总统，从第35条到第52条，共有18条，但是除了第44条总统得召集各院院长会商解决争执外，其他17条，全部与遗教不相干。第5章至第9章五院出现了，在行政院部分，第55条：“行政院院长由总统提名，经立法院同意任命之。”但按《五权宪法》，任命五院院长之同意权，在国民大会，根本不在立法院或其他各院；第56条：“行政院副院长、各部会首长及不管部会之政务委员，由行政院院长提请总统任命之。”但按《建国大纲...
023.“遗教”梦碎.txt	3	立法委员不得兼任官吏	《中华民国宪法》劈头就说“依据孙中山先生创立中华民国之遗教”，“制定本宪法”，但是搬出“本宪法”与遗教一对照，便发现抵触丛生。乍看起来，定章分节，全是遗教的外壳，从第3章国民大会，到第11章地方制度，无一不《五权宪法》也；但实际上，从第3章国民大会起，就大干一票，只师遗教之词、而不师其意了。第25条先打了国民大会职权的折扣、第27条又剥夺了国民大会一大部分政权、第28条、第29条使国大代表6年开会一次，无从行使政权、参与中央政事。到了第4章总统，从第35条到第52条，共有18条，但是除了第44条总统得召集各院院长会商解决争执外，其他17条，全部与遗教不相干。第5章至第9章五院出现了，在行政院部分，第55条：“行政院院长由总统提名，经立法院同意任命之。”但按《五权宪法》，任命五院院长之同意权，在国民大会，根本不在立法院或其他各院；第56条：“行政院副院长、各部会首长及不管部会之政务委员，由行政院院长提请总统任命之。”但按《建国大纲...
023.“遗教”梦碎.txt	3	永矢咸遵	《中华民国宪法》劈头就说“依据孙中山先生创立中华民国之遗教”，“制定本宪法”，但是搬出“本宪法”与遗教一对照，便发现抵触丛生。乍看起来，定章分节，全是遗教的外壳，从第3章国民大会，到第11章地方制度，无一不《五权宪法》也；但实际上，从第3章国民大会起，就大干一票，只师遗教之词、而不师其意了。第25条先打了国民大会职权的折扣、第27条又剥夺了国民大会一大部分政权、第28条、第29条使国大代表6年开会一次，无从行使政权、参与中央政事。到了第4章总统，从第35条到第52条，共有18条，但是除了第44条总统得召集各院院长会商解决争执外，其他17条，全部与遗教不相干。第5章至第9章五院出现了，在行政院部分，第55条：“行政院院长由总统提名，经立法院同意任命之。”但按《五权宪法》，任命五院院长之同意权，在国民大会，根本不在立法院或其他各院；第56条：“行政院副院长、各部会首长及不管部会之政务委员，由行政院院长提请总统任命之。”但按《建国大纲...
024.“政体”梦碎.txt	21	内阁制	牺牲“内阁制”来夺权，此道不止国民党的李登辉，也不止于民进党的邱义仁。所谓《宪法》学者李鸿禧之流，皆曲学阿世，露出了尾巴，这个岛大法荡然，正坐此辈。拿“总统制”、“内阁制”的“政体”开玩笑，祸延子孙矣。
024.“政体”梦碎.txt	21	总统制	牺牲“内阁制”来夺权，此道不止国民党的李登辉，也不止于民进党的邱义仁。所谓《宪法》学者李鸿禧之流，皆曲学阿世，露出了尾巴，这个岛大法荡然，正坐此辈。拿“总统制”、“内阁制”的“政体”开玩笑，祸延子孙矣。
024.“政体”梦碎.txt	21	政体	牺牲“内阁制”来夺权，此道不止国民党的李登辉，也不止于民进党的邱义仁。所谓《宪法》学者李鸿禧之流，皆曲学阿世，露出了尾巴，这个岛大法荡然，正坐此辈。拿“总统制”、“内阁制”的“政体”开玩笑，祸延子孙矣。
025.“民主”梦碎.txt	7	反革命	民进党在政党属性上，我们看来看去，看不出它的“反革命”反在哪里。党章也、党旗也、党徽也、中央党部也、县市党部也、乡镇市区党部也、特种党部也、中央执委会也、党主席也、中央执行委员也、中央常务执行委员也、中央评委会也、中央评议委员也、中央常务评议委员也、入党介绍人也、填表也、宣誓也、缴纳党费也、颁发党证也、全国党员代表大会也、县市党员大会也、乡镇市区党员大会也、中央党部秘书长副秘书长也、本党内规也、纪律及仲裁也、警告也、公开谴责也、留党察看也、开除党籍（除名）也……种种种种，无一不是乙式政党的模子，并且青出于蓝之。试看英美式民主政党政治中，参加政党，乃人民参政权的一种，任何政党无权限制人民加入它，但民进党入党条件却门槛在兹：入党要党中大亨介绍、工作委员引进，久而久之，其结果可想而知，一方面陷入封闭性而不能成其大，一方面助长山头性、人头性而适见其小。美国人想要成为民主党员或共和党员或其他党党员，只消有同一政治理想，就可以自认是哪党党员...
025.“民主”梦碎.txt	7	我欲党，斯党至矣！	民进党在政党属性上，我们看来看去，看不出它的“反革命”反在哪里。党章也、党旗也、党徽也、中央党部也、县市党部也、乡镇市区党部也、特种党部也、中央执委会也、党主席也、中央执行委员也、中央常务执行委员也、中央评委会也、中央评议委员也、中央常务评议委员也、入党介绍人也、填表也、宣誓也、缴纳党费也、颁发党证也、全国党员代表大会也、县市党员大会也、乡镇市区党员大会也、中央党部秘书长副秘书长也、本党内规也、纪律及仲裁也、警告也、公开谴责也、留党察看也、开除党籍（除名）也……种种种种，无一不是乙式政党的模子，并且青出于蓝之。试看英美式民主政党政治中，参加政党，乃人民参政权的一种，任何政党无权限制人民加入它，但民进党入党条件却门槛在兹：入党要党中大亨介绍、工作委员引进，久而久之，其结果可想而知，一方面陷入封闭性而不能成其大，一方面助长山头性、人头性而适见其小。美国人想要成为民主党员或共和党员或其他党党员，只消有同一政治理想，就可以自认是哪党党员...
026.“党争”梦碎.txt	23	周朝的天下是800年，国民党至少要掌握政权1000年！	民进党占了大便宜。原来国民党大员戴传贤，早在1944年就说过：“周朝的天下是800年，国民党至少要掌握政权1000年！”人们虽已等了七八十年、五六十年、三四十年，可是用1000年一减，即使寿比800岁的彭祖、寿比930岁的亚当（Adam）、寿比950岁的拉麦（Lamech）、寿比969岁的玛士撒拉（Methuselah），也还是空等一场，到头来还是要听《秋水伊人》之歌，与国民党周旋不已！
027.民进党为国民党护航的一个例子.txt	15	豺狼当道，安问狐狸？	李委员敖：主席、各位列席官员、各位同仁。本席要先向主席表达我的基本立场。中国有一句古话：“豺狼当道，安问狐狸？”真正的大问题没有解决，解决小问题是没有意义的。我讲过，为什么卖房子、卖地，基本上就是为了军购。因为钱不够，要把钱给美国人。基本问题在这个地方。基本问题不解决，预算统统冻结。我要逐条反对，统统反对！
028.“脱党”梦碎.txt	15	汉奸	唐纵仍劝我归队！临行时又重复的加上一句。但我一直不肯填表，不料唐纵叫人找到中日文化经济协会干事刘子英，暗中替我填表送去了……刘子英填表我并不知道，迨接到党部通知谓我之归队已奉总裁核准，嘱我去领新党证，我相应不理，未去领党证。不料，《自由中国》半月刊于四十三年12月16日出版的一期上，登载了余燕人等一篇《抢救教育危机》的读者投书，指责今日中学生负担太重，因为读课外的东西太多了，如《三民主义》、《总理遗教》、《总统训词》，青年救国团发下来的必读的各种小册子，还加上救国团随时指定的各种活动，使学生疲于奔命，希望教育当局减少学生的课外作业和课外活动……该读者投书发表后的12月，即民国四十三年12月28日，由蒋中正所主持的《宣传会报》上，曾和汪精卫在对日抗战时期做过“汉奸”的陶希圣（现任国民党中央委员兼立法院委员）竟挑剔的说：“《自由中国》杂志越来越不像话了，现在连学校里读《三民主义》、《总理遗教》和《总统训词》都要反对！”蒋中正一闻此言...
028.“脱党”梦碎.txt	15	《自由中国》杂志越来越不像话了，现在连学校里读《三民主义》、《总理遗教》和《总统训词》都要反对！	唐纵仍劝我归队！临行时又重复的加上一句。但我一直不肯填表，不料唐纵叫人找到中日文化经济协会干事刘子英，暗中替我填表送去了……刘子英填表我并不知道，迨接到党部通知谓我之归队已奉总裁核准，嘱我去领新党证，我相应不理，未去领党证。不料，《自由中国》半月刊于四十三年12月16日出版的一期上，登载了余燕人等一篇《抢救教育危机》的读者投书，指责今日中学生负担太重，因为读课外的东西太多了，如《三民主义》、《总理遗教》、《总统训词》，青年救国团发下来的必读的各种小册子，还加上救国团随时指定的各种活动，使学生疲于奔命，希望教育当局减少学生的课外作业和课外活动……该读者投书发表后的12月，即民国四十三年12月28日，由蒋中正所主持的《宣传会报》上，曾和汪精卫在对日抗战时期做过“汉奸”的陶希圣（现任国民党中央委员兼立法院委员）竟挑剔的说：“《自由中国》杂志越来越不像话了，现在连学校里读《三民主义》、《总理遗教》和《总统训词》都要反对！”蒋中正一闻此言...
028.“脱党”梦碎.txt	15	开除雷震党籍	唐纵仍劝我归队！临行时又重复的加上一句。但我一直不肯填表，不料唐纵叫人找到中日文化经济协会干事刘子英，暗中替我填表送去了……刘子英填表我并不知道，迨接到党部通知谓我之归队已奉总裁核准，嘱我去领新党证，我相应不理，未去领党证。不料，《自由中国》半月刊于四十三年12月16日出版的一期上，登载了余燕人等一篇《抢救教育危机》的读者投书，指责今日中学生负担太重，因为读课外的东西太多了，如《三民主义》、《总理遗教》、《总统训词》，青年救国团发下来的必读的各种小册子，还加上救国团随时指定的各种活动，使学生疲于奔命，希望教育当局减少学生的课外作业和课外活动……该读者投书发表后的12月，即民国四十三年12月28日，由蒋中正所主持的《宣传会报》上，曾和汪精卫在对日抗战时期做过“汉奸”的陶希圣（现任国民党中央委员兼立法院委员）竟挑剔的说：“《自由中国》杂志越来越不像话了，现在连学校里读《三民主义》、《总理遗教》和《总统训词》都要反对！”蒋中正一闻此言...
028.“脱党”梦碎.txt	15	雷震还未登记	唐纵仍劝我归队！临行时又重复的加上一句。但我一直不肯填表，不料唐纵叫人找到中日文化经济协会干事刘子英，暗中替我填表送去了……刘子英填表我并不知道，迨接到党部通知谓我之归队已奉总裁核准，嘱我去领新党证，我相应不理，未去领党证。不料，《自由中国》半月刊于四十三年12月16日出版的一期上，登载了余燕人等一篇《抢救教育危机》的读者投书，指责今日中学生负担太重，因为读课外的东西太多了，如《三民主义》、《总理遗教》、《总统训词》，青年救国团发下来的必读的各种小册子，还加上救国团随时指定的各种活动，使学生疲于奔命，希望教育当局减少学生的课外作业和课外活动……该读者投书发表后的12月，即民国四十三年12月28日，由蒋中正所主持的《宣传会报》上，曾和汪精卫在对日抗战时期做过“汉奸”的陶希圣（现任国民党中央委员兼立法院委员）竟挑剔的说：“《自由中国》杂志越来越不像话了，现在连学校里读《三民主义》、《总理遗教》和《总统训词》都要反对！”蒋中正一闻此言...
028.“脱党”梦碎.txt	15	未登记也要开除	唐纵仍劝我归队！临行时又重复的加上一句。但我一直不肯填表，不料唐纵叫人找到中日文化经济协会干事刘子英，暗中替我填表送去了……刘子英填表我并不知道，迨接到党部通知谓我之归队已奉总裁核准，嘱我去领新党证，我相应不理，未去领党证。不料，《自由中国》半月刊于四十三年12月16日出版的一期上，登载了余燕人等一篇《抢救教育危机》的读者投书，指责今日中学生负担太重，因为读课外的东西太多了，如《三民主义》、《总理遗教》、《总统训词》，青年救国团发下来的必读的各种小册子，还加上救国团随时指定的各种活动，使学生疲于奔命，希望教育当局减少学生的课外作业和课外活动……该读者投书发表后的12月，即民国四十三年12月28日，由蒋中正所主持的《宣传会报》上，曾和汪精卫在对日抗战时期做过“汉奸”的陶希圣（现任国民党中央委员兼立法院委员）竟挑剔的说：“《自由中国》杂志越来越不像话了，现在连学校里读《三民主义》、《总理遗教》和《总统训词》都要反对！”蒋中正一闻此言...
028.“脱党”梦碎.txt	15	注销	唐纵仍劝我归队！临行时又重复的加上一句。但我一直不肯填表，不料唐纵叫人找到中日文化经济协会干事刘子英，暗中替我填表送去了……刘子英填表我并不知道，迨接到党部通知谓我之归队已奉总裁核准，嘱我去领新党证，我相应不理，未去领党证。不料，《自由中国》半月刊于四十三年12月16日出版的一期上，登载了余燕人等一篇《抢救教育危机》的读者投书，指责今日中学生负担太重，因为读课外的东西太多了，如《三民主义》、《总理遗教》、《总统训词》，青年救国团发下来的必读的各种小册子，还加上救国团随时指定的各种活动，使学生疲于奔命，希望教育当局减少学生的课外作业和课外活动……该读者投书发表后的12月，即民国四十三年12月28日，由蒋中正所主持的《宣传会报》上，曾和汪精卫在对日抗战时期做过“汉奸”的陶希圣（现任国民党中央委员兼立法院委员）竟挑剔的说：“《自由中国》杂志越来越不像话了，现在连学校里读《三民主义》、《总理遗教》和《总统训词》都要反对！”蒋中正一闻此言...
029.“书呆子”梦碎.txt	3	联共	国民党喜欢吃豆腐，明明是“联共”却美其名曰“容共”，全名“联俄容共”。在国民党“联俄容共”的3年里（1924至1927），他们一起建立了一党独大，也建立了一党独大的党化军队。当时的密切情形，我引1950年10月19日国民党《中央日报》自己招承的译文为例：
029.“书呆子”梦碎.txt	3	容共	国民党喜欢吃豆腐，明明是“联共”却美其名曰“容共”，全名“联俄容共”。在国民党“联俄容共”的3年里（1924至1927），他们一起建立了一党独大，也建立了一党独大的党化军队。当时的密切情形，我引1950年10月19日国民党《中央日报》自己招承的译文为例：
029.“书呆子”梦碎.txt	3	联俄容共	国民党喜欢吃豆腐，明明是“联共”却美其名曰“容共”，全名“联俄容共”。在国民党“联俄容共”的3年里（1924至1927），他们一起建立了一党独大，也建立了一党独大的党化军队。当时的密切情形，我引1950年10月19日国民党《中央日报》自己招承的译文为例：
029.“书呆子”梦碎.txt	15	为中国建立一个不靠武装的第二大政党	胡适的“为中国建立一个不靠武装的第二大政党”的劝告，共产党是听不进去也不相信的，他们说他们若没有“这几条烂枪”，他们早就被国民党打得稀巴烂了，国民党是不允许他们“和平奋斗”的。说的确是实情。胡适后来回忆这封电报，自嘲的说：“在理想主义澎湃的那些日子里，我跟国内政治和国际政治的生手们同样的天真……竟天真到打了一封长的电报到重庆，以便转交给我从前的学生毛泽东！”最后胡适清楚知道，在国民党统治之下，美国杰斐逊（节福生）路线或英国工党路线，是绝对不可能的，“和平奋斗”的政党政治，在中国毕竟是教科书上的词汇！
029.“书呆子”梦碎.txt	15	这几条烂枪	胡适的“为中国建立一个不靠武装的第二大政党”的劝告，共产党是听不进去也不相信的，他们说他们若没有“这几条烂枪”，他们早就被国民党打得稀巴烂了，国民党是不允许他们“和平奋斗”的。说的确是实情。胡适后来回忆这封电报，自嘲的说：“在理想主义澎湃的那些日子里，我跟国内政治和国际政治的生手们同样的天真……竟天真到打了一封长的电报到重庆，以便转交给我从前的学生毛泽东！”最后胡适清楚知道，在国民党统治之下，美国杰斐逊（节福生）路线或英国工党路线，是绝对不可能的，“和平奋斗”的政党政治，在中国毕竟是教科书上的词汇！
029.“书呆子”梦碎.txt	15	和平奋斗	胡适的“为中国建立一个不靠武装的第二大政党”的劝告，共产党是听不进去也不相信的，他们说他们若没有“这几条烂枪”，他们早就被国民党打得稀巴烂了，国民党是不允许他们“和平奋斗”的。说的确是实情。胡适后来回忆这封电报，自嘲的说：“在理想主义澎湃的那些日子里，我跟国内政治和国际政治的生手们同样的天真……竟天真到打了一封长的电报到重庆，以便转交给我从前的学生毛泽东！”最后胡适清楚知道，在国民党统治之下，美国杰斐逊（节福生）路线或英国工党路线，是绝对不可能的，“和平奋斗”的政党政治，在中国毕竟是教科书上的词汇！
029.“书呆子”梦碎.txt	15	在理想主义澎湃的那些日子里，我跟国内政治和国际政治的生手们同样的天真……竟天真到打了一封长的电报到重庆，以便转交给我从前的学生毛泽东！	胡适的“为中国建立一个不靠武装的第二大政党”的劝告，共产党是听不进去也不相信的，他们说他们若没有“这几条烂枪”，他们早就被国民党打得稀巴烂了，国民党是不允许他们“和平奋斗”的。说的确是实情。胡适后来回忆这封电报，自嘲的说：“在理想主义澎湃的那些日子里，我跟国内政治和国际政治的生手们同样的天真……竟天真到打了一封长的电报到重庆，以便转交给我从前的学生毛泽东！”最后胡适清楚知道，在国民党统治之下，美国杰斐逊（节福生）路线或英国工党路线，是绝对不可能的，“和平奋斗”的政党政治，在中国毕竟是教科书上的词汇！
030.“大儒”也梦碎.txt	9	文字收功日，千秋革命潮	马君武诗说“文字收功日，千秋革命潮”，但在《自由中国》杂志上，我看不到。在《自由中国》后，我也办过杂志，但究竟影响了谁？看来看去，原来答案是我自己。我深切感到“文字收功”的局限，“反革命”（这里不遵守国共的狭义用法）的势力太大了，最后最突出的，只是“与朝廷争胜”的那股精神而已。是精神胜利，其他的赢面，毕竟又迟缓又可怜。
030.“大儒”也梦碎.txt	9	文字收功	马君武诗说“文字收功日，千秋革命潮”，但在《自由中国》杂志上，我看不到。在《自由中国》后，我也办过杂志，但究竟影响了谁？看来看去，原来答案是我自己。我深切感到“文字收功”的局限，“反革命”（这里不遵守国共的狭义用法）的势力太大了，最后最突出的，只是“与朝廷争胜”的那股精神而已。是精神胜利，其他的赢面，毕竟又迟缓又可怜。
030.“大儒”也梦碎.txt	9	反革命	马君武诗说“文字收功日，千秋革命潮”，但在《自由中国》杂志上，我看不到。在《自由中国》后，我也办过杂志，但究竟影响了谁？看来看去，原来答案是我自己。我深切感到“文字收功”的局限，“反革命”（这里不遵守国共的狭义用法）的势力太大了，最后最突出的，只是“与朝廷争胜”的那股精神而已。是精神胜利，其他的赢面，毕竟又迟缓又可怜。
030.“大儒”也梦碎.txt	9	与朝廷争胜	马君武诗说“文字收功日，千秋革命潮”，但在《自由中国》杂志上，我看不到。在《自由中国》后，我也办过杂志，但究竟影响了谁？看来看去，原来答案是我自己。我深切感到“文字收功”的局限，“反革命”（这里不遵守国共的狭义用法）的势力太大了，最后最突出的，只是“与朝廷争胜”的那股精神而已。是精神胜利，其他的赢面，毕竟又迟缓又可怜。
030.“大儒”也梦碎.txt	11	匹夫而为百世师、一言而为天下法	胡适在《自由中国》茶话会上致词说：我们不要妄自菲薄，我们也是有权有势的人，只是那种权势不是世俗的武力与财力。他的观点令人心神一畅。但是，毕竟时代已变得越来越不“匹夫而为百世师、一言而为天下法”了。蒋廷黻预告说：他们那一代的知识分子是中国有影响力的最后一代知识分子。从许多面上观察，蒋廷黻说得也是。知识分子的确越来越小化、越专家化了。这个世界已经罕见“大儒”了、已经浪淘尽千古风流“大儒”了。
030.“大儒”也梦碎.txt	11	大儒	胡适在《自由中国》茶话会上致词说：我们不要妄自菲薄，我们也是有权有势的人，只是那种权势不是世俗的武力与财力。他的观点令人心神一畅。但是，毕竟时代已变得越来越不“匹夫而为百世师、一言而为天下法”了。蒋廷黻预告说：他们那一代的知识分子是中国有影响力的最后一代知识分子。从许多面上观察，蒋廷黻说得也是。知识分子的确越来越小化、越专家化了。这个世界已经罕见“大儒”了、已经浪淘尽千古风流“大儒”了。
