file	line	context
001.“缇萦救父”表示了什么？.txt	19	缇萦的故事，最早记在《史记》。《史记》第一百零五卷叫《扁鹊仓公列传》，是在牢里度过悲惨世界的司马迁，专为两个名医写的传。扁鹊被人嫉妒，死于非命；仓公就是淳于意。司马迁看到这些第一流人才在乱世的命运，最后写下这样的感慨：
001.“缇萦救父”表示了什么？.txt	21	太史公曰：女无美恶，居宫见妒；士无贤不肖，入朝见疑。故扁鹊以其技见殃；仓公乃匿迹自隐而当刑。缇萦通尺牍，父得以后宁。故老子曰：“美好者，不祥之器。”岂谓扁鹊等邪？若仓公者，可谓近之矣！
001.“缇萦救父”表示了什么？.txt	23	在这里，《史记》作者进一步告诉我们，淳于意想在乱世里“匿迹自隐”而不可得，最后还是在劫难逃，被捉进官里，要受“肉刑”。
001.“缇萦救父”表示了什么？.txt	29	在上面大分类以外，有一种叫“身体刑”或“体刑”或“肉刑”的，在摩登的法律条文中是禁止了，虽然事实上，全世界许多极权国家还日新月异的流行着。这里说日新月异，是说极权国家虽然在自由思想上大落其伍，但在专制道具上却超越前进，并且完全合乎最新的“科学方法”。从希特勒式的招供药丸，到斯大林式的浑身通电，这是古人们再也发明不出来的科学花样。何况还有现代的内科医生一旁伺候，保证可使任何人死去活来到极限境界而不致暴毙，这比古人修理专家动辄使人死去而不能活来的笨手笨脚，的确高明万分。何况“科学方法”还有不落痕迹的妙用，用之则行，舍之则藏，干净利落，证据完全没有，煞是厉害。《孟子》里说“威武不能屈”，《正气歌》里说“鼎镬甘如饴”，但把孟夫子交给希特勒、文天祥交给斯大林，老希老斯祭起“科学方法”修理老孟老文，不但文天祥可以把知道的都说出来，孟夫子还可以把不知道的也都说出来，外加检举文天祥是蒙古间谍！
001.“缇萦救父”表示了什么？.txt	35	除了杀头以外，其他的死法就开始耍花样。像“枭首”（头挂高竿。传说是黄帝对付蚩尤的方法，资格自然最老。也是《法门寺》刘瑾的方法）、像“腰斩”（拦腰一刀。受刑人要“解衣伏质”，质是大铁砧，上面有铡刀，类似法国的断头台。但该叫断腰台。汉朝张苍被腰斩，解衣露出一身白肉，人人看了，觉得可惜）、像“磔”（大卸八块至N块。裂其肢体而杀之，伍子胥的死法）、像“车裂”（五马分尸。秦始皇对付妈妈情夫的方法、商鞅的死法）、像“凌迟”（杀千刀，千刀万剐。《水浒传》王婆的死法、袁崇焕的死法）……这些还算是法有明文的。至于法律以外的，那就更千奇百怪，像“烹”、“镬烹”、“大镬”、“肆”、“醢”、“菹醢”、“焚如”、“笞杀”、“棒杀”、“鞭杀”、“长锯”、“剉碓”、“污潴”、“枭菹”、“脔噉”、“殊死”、“凿颠”、“囊扑”、“投高崖”、“射鬼箭”、“生瘗”、“炮掷”、“支解”，“锁头拉死”等等等等，无法无天，写也写不完。
001.“缇萦救父”表示了什么？.txt	43	但肉刑本身也有做老大的时候，那就是单独的“墨”、“劓”、“刖”、“宫”。五刑里面，“墨”刑是最轻的一种。墨刑是在受刑人脸上割出剌出字来，然后在伤口上揉进颜料，颜料是黑色的，所以叫做“墨”，也叫“黥”。它的作业，很像文身。墨刑最早说是蚩尤发明的，后来虞舜把它确定，放在五刑之首。它在古书中经常见到。在《庄子》里面，甚至编成故事，洗耳的许由挖苦意而子说：“唐尧既然用仁义给你施了墨刑，用是非给你施了劓刑，你怎么还能自在逍遥呢？”最后意而子说：“怎么知道老天爷不把我墨刑的伤、劓刑的伤补好呢？”可见墨刑已用到哲学的讨论上面。由于在古书中一再出现，可以想见它的普遍性、它的源远流长。
001.“缇萦救父”表示了什么？.txt	45	照《书经》的说法，统治者有错，下面人不能帮忙改正，要用墨刑来罚，这是一个有趣的标准，等于是专罚扶同为恶的小人的。其实这只是乌托邦的法律，若真的实行起来，任何统治者都要被脸上有字的人包围了。但在其他方面，墨刑在古代，动不动就来一下，是可以确信的。所谓“墨罪五百”，所谓“墨罚之属千”，都是明证。大将军英布年轻时就被墨刑过，大家都叫他“黥布”，墨刑的名流中，他考第一。秦朝太子犯了法，商鞅歉难把字刻在太子脸上，结果“黥其师”，老师倒了霉。
001.“缇萦救父”表示了什么？.txt	47	“劓”刑是割鼻子，也说是蚩尤发明的，反正蚩尤打了败仗，一切“好事”都算到他头上。劓刑是广义解释的，包括割耳朵。劓刑方面，所谓“劓罪五百”，所谓“夏有劓墨各千”，所谓“我乃劓殄之，无遗育”，所谓“又曰劓刵人，无或劓别人”，可见此刑的普遍使用，就好像《违警罚法》似的。劓刑的外一章是割耳朵（刵），在《易经》中，有“何校灭耳，凶”的卦，“何校”是一种使耳朵跟人分家的刑具，何是背，校是枷，加起来，就是背在背上的一种枷，可以把耳朵“灭”掉，其“凶”可知。这种刑具的发明家认为：耳朵的用处在使人因听而聪明，犯罪的人，显然因不听而笨，所以，耳朵该罚。劓刑事实上是“刑不上大夫”的，墨刑也一样，所以汉朝民间出来“投鼠忌器”的讽刺，器是指皇帝，割大夫的鼻子，是给皇帝难看，当然就“割乎哉？不割也”了。
001.“缇萦救父”表示了什么？.txt	49	五刑中排名第三的，是“刖”刑，也叫“剕”刑。是砍掉脚或脚耻（重刑砍右趾，轻刑砍左趾），当然还是蚩尤干的缺德事。它的最早名字是“膑”，后来被第一任司法行政部长皋陶给改了，但还通用。不但通用，并且像黥布一样，出来一位“孙膑”。他被老同学庞涓陷害，黥了面又砍去脚，他虽然最后得到了胜利，可是却失掉了名字，大家都叫他“孙膑”，谁也不知道他本名了。古人用刖刑整人，范围也不下于《违警罚法》，偷车的，刖；跳城墙的，刖；向统治者扯谎的，刖。《韩非子》记楚人和氏璧故事，和氏得到了宝玉，向统治者拍马屁，可是统治者不识货，先后被“刖其左足”又“刖其右足”。他哭的时候，人家还告诉他：“天下之刖者多矣！”可见这种整人法多普遍。《左传》《晏子春秋》《孔子家语》《说苑》《庄子》等古书里，到处都有刖的记录，写不完的。我们现在说“踊跃”，不知道“踊”字就是被刖的人所穿的鞋，普通人穿的鞋叫履，古书里有“踊贵而履贱”的话，意思是说：没脚的比有脚的流行，法法法法法，太黑暗了！
001.“缇萦救父”表示了什么？.txt	53	宫刑是仅次于死刑的重刑，这种刑，照《周礼》说法，是“男女不以义交者，其刑宫”。什么是“义交”呢？就是要合乎当时道德法律的性交。就是说，任何非法的性交，被发现了，就要割家伙。但这只是理论，因为古书中有大量的“不以义交”，公然为之以后，家伙依然健在。而《左传》里记楚子想割羊舌肸生殖器的故事，却明明和“义交”无关，而是政治问题。何况古书中明明有“夏刑宫辟五百”、“宫罪五百”、“宫刑之属三百”等话，宫刑使用的范围，自然绝不止于“不以义交”。
001.“缇萦救父”表示了什么？.txt	63	没废？汉文帝扯谎吗？倒也不是。《史记》第十卷“孝文本纪”说汉文帝看到陈情书后，“怜悲其意”，乃下诏表示：古代不来肉刑，老百姓少犯法；现在肉刑之下，反倒一犯再犯，其咎“乃朕德薄而教不明欤？吾甚自愧”。最后决定“其除肉刑”。可见不是说着玩的。
001.“缇萦救父”表示了什么？.txt	67	第二、所谓“其除肉刑”，并不是不跟你算账了，账还是要算的。《史记》只写到“其除肉刑”，《汉书》却补足“其除肉刑，有以易之”。易了什么？易了不再是身体刑吗？不是。易的还是肉刑，一种新确定的肉刑。以墨刑来说，墨刑易为“髡钳，为晨旦、舂”。“髡”是削去头发，“钳”是脖子上戴上铁圈，“晨旦”是男犯人白天守寇虏，晚上筑长城；“舂”是女犯人磨米，每人要这样做五年。以劓刑刖刑来说，劓刑易为“笞三百”，“笞”是用竹子打屁股（女人屁股不好给人看，改为打背）；刖刑易为“笞五百”（但以“切左脚趾”的罪为限。“切右脚趾”的罪，反倒要从重易为死刑）。虽然还不脱皮肉受苦的身体刑，但总算不切不割，落个血肉相连下场。表面上看，该是不幸中的大幸，感谢政府德政无比，可惜的是，毛病就出在这儿。因为“笞”这种刑，看来轻，实际一点也不轻，反倒重得要命。常常笞一阵，人已气绝了。研究报告是：“外有轻刑之名，内实杀人！”“文帝乃重刑，非轻之也！”
001.“缇萦救父”表示了什么？.txt	71	大慈悲家汉文帝德政的缺德，很快就被他的继承人汉景帝看出来了。景帝一上台，就宣布开幕大优待，笞五百的，六折优待，改为笞三百；笞三百的，六七优待，改为笞二百。于是普天同庆，举国试行，但行了十二年，笞死的还是累累不绝。景帝又下诏说：“看到人被打死了，该打的数目还没打完，还在打，朕甚怜之！”于是再来期中大减价，笞三百改为六七折笞二百，笞二百改为对折笞一百，特别还规定了执行细节，限制竹子的长宽厚，削平竹子的节，并且禁止打手换手，这样愈打愈累，愈累愈轻，挨打的勉强可活命，修理人的也不容易乘机勒索。尽管这样，老百姓还是吃不消，还是要求“求求你别再宽大了，还是恢复肉刑干脆”。但是，不行，打上瘾来了。两千年下来，汉文帝做仁君，老百姓挨揍。什么五刑八刑九刑，只是名亡不亡的分别，实总是存，只是明暗多少而已。汉文帝以后，墨刑没有了吗？照旧有。如果没了，《后汉书》朱穆为什么要“黥首”？南北朝宋明帝为什么要赐黥两颊？唐末朱全忠为什么要文面？宋朝为什么要刺配？辽朝为什么下吏杖黥？元朝为什么赦囚黥面？明朝为什么要刺臂？清朝为什么要照律刺字？……劓刑没了吗？照旧有。如果没了。《后汉书》显宗孝明帝纪的注里怎么说？金朝“劓刵以为别”怎么说？元朝整人耳朵怎么说？明...
001.“缇萦救父”表示了什么？.txt	83	上面垂直的是根棒子，下面画的是右手。所谓“父亲”，就是“右手拿个棒子的”，这足以说明一切。一般说来，父亲有杀人权（所谓“父赐子死，尚安复请？”）、父亲有打人权（所谓“小杖则受”）、父亲有卖人权（所谓“鬻妻子”）、父亲有财产权（所谓“子弟无私财”）、父亲有主婚权（所谓“父母之命”）、父亲有离婚权（所谓“七出”）……这些现象，说明了做了一家之主多神气、多划得来，也间接说明了中国人一骂架就要自称“老子”的缘故。
001.“缇萦救父”表示了什么？.txt	89	以韩信为例。韩信以所谓叛乱罪被处死的时候，他的子女，照现代标准，只是被“列管”、被“特别注意”而已，但在当时，却没这样便宜，他们不但要陪死，还要“具五刑”式惨死，就是说，一个个要墨劓刖宫以后，“笞杀之，枭其首，菹其骨肉于市！”
001.“缇萦救父”表示了什么？.txt	91	传统文化中固然有“罪不相及，恶止其身“的高调，但事实上，总是“一人有罪，延其阖门”。尤其发生叛乱罪的时候，一律杀一窝，即所谓“族诛”、“连坐”、“灭门”、“满门抄斩”。标准杀法叫做“夷三族”，也有“夷五族”、“诛九族”乃至“诛十族”（学生在内）等花样。不管哪种花样，做子女的，怎么也逃不掉的。最倒霉是做女儿的，做女儿的嫁人后，挨刀的比率比任何人多一倍：婆家出了事，她固然难逃；娘家出了事，她也要送命，真所谓两头吃。知道三国以后，才有程咸等人出面说公道话，要求——
001.“缇萦救父”表示了什么？.txt	129	按现代刑法观念，谈犯罪，要弄清“犯罪主体”，犯罪主体是立于犯罪地位的人。所谓人，有“自然人”和“法人”的分别，在经济、行政或其他法规中，虽有对“法人”课处罚金及没收的规定，但“法人”无法做“犯罪主体”，因为它不是生物，既不能枪毙，又不能关它。所以，“犯罪主体”，只剩下“自然人”。对“自然人”做“犯罪主体”，现代刑法观念是谁犯罚谁，不能“黄狗偷食，黑狗当灾”的由别人代替，不管别人是他什么人，不管别人是不是情愿，都不行。中国的“人权代位”传统，在现代刑法观念的检定下，不但荒唐，而且不通。即使在礼教中心、家族本位的古代，也有人异议。前面提到的尹次、史玉案，当时应劭就反对“杀无罪”的、“活当死”的，认为这是“不祥制刑之本，而信一时之仁”。不罚该罚的、罚了不该罚的，即使挨罚的甘心情愿，同意他们那样，也是“一时之仁”。
001.“缇萦救父”表示了什么？.txt	131	现代法理中有所谓“私权”中的“人身权”，包括“人格权”和“身份权”，人格权有专属性，例如生命权、身体权、自由权、名誉权、姓名权、肖像权等，都和权利人密不可分，不能让与、不能继承、不能送、不能“不要了，给你了”。项羽虽然把脑袋送给老朋友马童而说“吾为若德！”（我做个人情给你吧！）阮小五、阮小七虽然为智多星吴用赴汤蹈火而说“这腔热血只要卖与识货的！”但是，这些都不能说是法律上“人格权”的过户，而只是人情上的侠义行为。在法律上，不能接受“人格权”的脱产行为，不论自愿不自愿。
001.“缇萦救父”表示了什么？.txt	155	也许你说，缇萦这种官婢，只是人海里的少数。请翻翻《汉书·贡禹传》，看看那句“诸官奴婢十万余人”的统计，你就知道奴隶、奴隶，中国可太多了！
001.“缇萦救父”表示了什么？.txt	161	最上面是手，中间是绳圈，下面是女人。表示“手持绳圈套女人”。女奴隶叫“奚”，男奴隶叫“隶”，合称“奚隶”。再生出“奚婢”“奚奴”等叫法。奚字除了指女奴隶外。也指有才能的奴隶——“有才能曰奚，无才能曰奴”，混称“奚奴”。
002.给杨贵妃的一封信.txt	5	你我萧条异代，生死幽明，你不知道我是谁，我知道的你，也极有限。我从陈鸿《长恨传》里，知道你是唐明皇派高力士“潜搜外宫”搜到的杨家女儿；从白居易《长恨歌》里，又知道你是“养在深闺人未识”、“一朝选在君王侧”的杨家小姐，但我后来一查，这全不是真的。你根本是唐明皇第十八个儿子寿王瑁的妃子，唐明皇其实是你公公，他横刀夺了儿子的爱，以一国之尊，却做了扒灰大王。你的老公可真多情多得捞过了界！
002.给杨贵妃的一封信.txt	7	你是唐朝第一美人，你压倒群芳，使“六宫粉黛无颜色”，使女人在你面前降低地位，但也由于你的缘故，“遂令天下父母心，不重生男重生女”，而使女人在男人面前提高地位。中国男女不平等的观念，由于有了你，居然一时出现了“生女勿悲酸，生男勿喜欢”的民谣。可惜你当时只提倡“妃权”而没有提倡“女权”，如果提倡了，当时男女对跳“迪斯科”了，谁还要舞《霓裳羽衣曲》呢？
002.给杨贵妃的一封信.txt	11	唐明皇同你山盟海誓，说什么“在天愿作比翼鸟，在地愿为连理枝”，但在紧要关头，他却不能同生、不能共死、不能横刀救美，反倒自己逃难去了。他这种作风，实在一点也不男性化，而是十分君主化。后代的诗人袁子才，批评你老公的懦种行为说——
002.给杨贵妃的一封信.txt	17	实在一针见血。后代的另一诗人自我期许“不爱江山爱美人”，但他既无江山，又乏美人，光说不练，等于白说。真正做到“不爱江山爱美人”的，是英国皇帝爱德华第八，他宁肯不要江山，也要美人，改行做了温莎公爵。可见江山美人之间，能抱住该抱的，中土以外，大有其人。只可叹你玉环女士生不逢时，又不逢地，风华绝代，竟为伧夫俗子老油条薄命，真大大划不来。《长恨传》里说唐明皇跟你又发誓：“愿世世为夫妇！”天啊！又来了！这样不可靠的家伙，下辈子还能嫁他吗？去他妈的蛋吧！要嫁，也来个贵妃和番，嫁给温莎公爵，再也别“唐明皇，胡子长”了！千万！千万！
003.“逸豫适足亡身”吗？.txt	5	我李敖的作文，虽然自称五十年来和五百年内包办前三名，但这只是自称而已，在大专国文系老夫子的眼中，全不是那么回事。老夫子最恨我的国文：我在抡才大典中，作文吃过鸭蛋，为了我批评了作文题目；我大学的国文成绩，差点不及格，为了我拒绝背书。所以，一谈到国文，我恨老夫子，老夫子恨我，但我一点也不怕老夫子恨我：恨李敖吗？恨李敖的人可太多了！你还得排队呢！
003.“逸豫适足亡身”吗？.txt	11	“二十五史”总算最基本的了吧？老夫子总不好意思说没读过吧？读过吗？读过就不该出纰漏。这次联考作文题，所谓“忧劳所以兴国，逸豫适足亡身”，其中就有错引的笑话。欧阳修《新五代史》卷三十七“伶官传”里，论喜欢听戏的唐庄宗：
003.“逸豫适足亡身”吗？.txt	13	书曰：“满招损，谦受益。”忧劳可以兴国，逸豫可以亡身，自然之理也。故方其盛也，举天下之豪杰，莫能与之争；及其衰也，数十伶人困之而身死国灭，为天下笑。
003.“逸豫适足亡身”吗？.txt	15	欧阳修写这段话，原文是“逸豫‘可以’亡身”，而不是“适足”亡身，可是老夫子把线装书乱读一气，硬把较有弹性的“可以”字眼，记错成缺少弹性的“适足”字眼，记错以后，还牵强附会，加以引申，结果适足闹了笑话。
003.“逸豫适足亡身”吗？.txt	19	欧阳修写五代史记，是私撰的，在他生前，他把稿本藏在家里，不轻易给人看。他死后，皇帝下令把这书送到皇宫，过了五年，公开刊行。这书因为不是官修，有的地方就很“欧化”。宋神宗问王安石意见，王安石说：“臣方读数册，其文辞多不合义理。”
003.“逸豫适足亡身”吗？.txt	21	“不合义理”不但是欧阳修作文的大毛病，也是中国文人作文的普遍毛病。欧阳修写“逸豫可以亡身”，在义理上就难苟合。
003.“逸豫适足亡身”吗？.txt	23	这段古文出自“伶官传”，“伶官传”是欧阳修自己发明的一种史传，翻成白话，就是“唱戏的传”。欧阳修认为五代乱哄哄的原因，唱戏的责任重大。他认为唐庄宗李存勖本来是好好的皇帝，“方其盛也，举天下之豪杰，莫能与之争”；可是后来变成戏迷，“及其衰也，数十伶人困之而身死国灭，为天下笑。”
003.“逸豫适足亡身”吗？.txt	25	唐庄宗的“亡身”，欧阳修认为是“逸豫”惹的祸，按诸历史，这可“不合义理”。唐庄宗身死国灭的原因，可太多了。其中最重要的，我看是因为他怕老婆。他怕的老婆是刘后，刘后本是二姨太，后来夺权成功，当了皇后。刘后是最有名的爱钱大王，她爱财如命，但唯一肯花的钱是送老和尚；为了她深信她能当上皇后，是佛力保佑的结果。刘后的导演，最后惹出了天下大乱，宰相看到事态严重，向她调头寸，她装穷，从里面推出妆具、三个银盆子、三个皇幼子给宰相，说：“皇宫里只剩这点老本了，你去卖了劳军吧！”后来唐庄宗身死国灭，刘后带着珠宝金条与小叔子双宿双飞。小叔子被杀，她投资盖了一座尼姑庵，下海当起尼姑来。新统治者不让她逍遥法外，把她给宰了。
003.“逸豫适足亡身”吗？.txt	27	刘后喜欢唱戏，唐庄宗为了取悦老婆，自己居然粉墨登场，演给老婆看。愈演愈高兴，所有的戏子也就因而得宠。唐庄宗同唱戏的君臣同乐，是真的，但说喜欢唱戏“适足亡身”，则就“不合义理”。乾隆皇帝就是戏迷，他一辈子把别人的国亡来亡去，但谁亡了他了？欧阳修这样倒果为因，是不通的。
003.“逸豫适足亡身”吗？.txt	39	何况，欧阳修写这两句话，明明是特指唐庄宗说的，又写在“伶官传”里，逸豫所特指，也是唱戏而已。唱戏本身，对戏迷说来，是消痰化气的大快乐，怎么会“亡身”？会要命？这又从何说起？
003.“逸豫适足亡身”吗？.txt	43	又何况，“逸豫”到底何所指，也别有学问。《诗经》里所指的“逸豫”，本来只不过是一种安逸与娱乐，又有何大逆不道，值得大惊小怪？只可恨中国传统中有一类“道德迷”，咬定所有安逸、所有娱乐，都是罪过，坚持一切要正襟危坐，一切都要坐硬邦邦的处处直角九十度的“太师椅”，不是坐“沙发”。中国文化里只见太师椅，不见沙发，这和老夫子的危言耸听“逸豫亡身论”大有关系。
003.“逸豫适足亡身”吗？.txt	45	但老夫子自己真的那么“太师椅”吗？那可不见得。即以写“逸豫可以亡身”的欧阳修而论，他老夫子自己，就“逸豫”得风传捞过了界：他三十七岁那年，为了跟外甥女的关系；六十一岁那年，为了跟儿媳妇的关系，都闹出风风雨雨，但他一点也没有“亡身”，仍旧自号“醉翁”，大谈醉翁之意，大盖“有动乎中，必摇其精”的秋声赋，大写“笑问鸳鸯两字怎生书”的情诗艳词，何必计较呢？
003.“逸豫适足亡身”吗？.txt	59	今日开始放榜的大学联考在阅卷期间，其中国文科作文部分，据本报报导几位阅卷老师的初步反应；一般水准还算不错，但真正破题深刻的文章并不多见。有的不过百来个字，就草草成篇，或者反复论理，内容空泛，更有些考生连题目都看不懂。
003.“逸豫适足亡身”吗？.txt	63	我们的知识青年，起码要能阅读一般书籍，使用自己的文字，来汲取更多知识、来表达情感思想，从而互相沟通意见，使智慧得以交流汇合，培溉出灿烂的文化花朵。在往昔科举时代，以策论诗赋取士，就是考验见解与才华。如宋代苏轼因《刑赏忠厚之至》的论文，为主考欧阳修所激赏，而名登高第，声誉大起。现代学校教育的内涵甚为广泛，但从初中到大学一年级，国文仍是一门主科，大学联考的国文科，列有作文与测验题，即在测量考生能否具有上述的程度。像这次的作文题目——“忧劳所以兴国，逸豫适足亡身”，主旨明确，切合时宜，应能写出一些道理或加以发挥；可是在试卷中少见佳构，且有不明题意者，可见很多学生平时对国文不加重视，连报刊时论恐亦很少留心阅览。
003.“逸豫适足亡身”吗？.txt	73	我们关心学生的国文程度，并非要求学生们人人都能写出一手好文章，只是希望每个高中以上的青年，均有充分阅读能力，在写作上词能达意，文字通畅。因为，中国文字基于文化历史的深厚悠久，在世界上占有重要地位，此项宝贵资产，必须大家善加珍视，尤须每个学生力求打好国文根底，以扩大文字，文化转播交流的功能；对于自己知识的增进、气质的培养，以及创造作业的基本条件，充实治事处世的本领，亦均有受用不尽的好处。
