file	line	context
《我梦碎，所以我梦醒》序.txt	9	《我梦碎，所以我梦醒》，多么生动的题目。滔滔者，天下皆梦也。梦不必反求诸己，可以是自己的梦、可以是别人的梦、可以新华春梦、可以金陵春梦、可以红楼梦、可以黄粱梦、可以南柯梦、可以李伯大梦、可以胡茵梦。哦，她在梦碎之后，改名胡“因”梦了。梦碎使她不再芳草如茵、梦碎使她从絮果悟出兰因，她落草了。
《我梦碎，所以我梦醒》序.txt	65	大方向是需要制衡力量，可叫它做“第三势力”。虽然“第三势力”这个词汇已经给用滥过，我们还是不妨一用，因为这个岛的确需要两个党以外的第三种势力。
《我梦碎，所以我梦醒》序.txt	77	我们对打王八蛋没有兴趣、对打龟儿子没有兴趣，对联合兔崽子打王八蛋和龟儿子有兴趣。
002.“公投”梦碎.txt	9	要公民投票，得先有公投法，于是1999年4月10日，由彭明敏、李镇源、林义雄、黄石城、辜宽敏、陈隆志带头，由蔡同荣、高俊明、许世楷、黄昭堂等为召集人，发动促使“通过公民投票法”，并不得有台湾前途议题的“排除条款”大行动。他们白纸黑字宣告：“全民公投，才能确认台湾自有主权，否则所谓‘中华民国早已是主权独立国家’的说法，只是在自欺欺人！”
002.“公投”梦碎.txt	19	蔡同荣版的提案是：《公投法》“适用事项”应包括“国旗、国歌、国号、领土变更、国家主权等国家定位议题”，这就是呼应他们在1999年所推动的《公投法》“不得有台湾前途议题的‘排除条款’”，可是，投票的时候，当主席宣布“首先就蔡委员同荣等提案条文进行表决”，蔡同荣不但不投票同意自己提的案，反倒投了弃权票！同样妙的是：跟他一起提案的以绿色为主的100名立委，也都投了弃权票！其中李文忠尤其妙，他脱身不及，情急之下，投了反对票，你怎么反对起你自己的提案了呢？这真是古今中外人类议会史上的大笑话！
002.“公投”梦碎.txt	21	原来他们不敢玩真的！绝食是假的！提案也是假的！他们口口声声要向中国、向中华民国、向外来政权争回“国旗、国歌、国号、领土变更、国家主权等国家定位议题”，可是真正有机会对决的时候，他们都吓跑了，他们口中的台湾人尊严与勇敢，都不见了！
002.“公投”梦碎.txt	23	结果，2004年“公投绑大选”中，公投项目，竟然是买不买飞弹等枝枝节节选项，真正该依《民进党党纲》“以公民投票方式”建立“台湾共和国”的大目标，也就是所谓“台独公投”，反倒给出局了。
002.“公投”梦碎.txt	45	民进党明说建立“台湾共和国”，但对“中华民国”四个字却没处放，就活像男同性恋者性交时，多出一坨在体外摇荡，没地方放。从“中华民国到台湾”、到“中华民国在台湾”、到“中华民国是台湾”，诠释纷纷，可是就是拿不掉这“外来政权”的国号、也拿不掉它的国旗、也拿不掉它丑陋的国歌，执政党做的一切，其实都是家家酒：国歌动口不发声也、印228台湾邮票也、中华邮政改名也、护照加注TAIWAN也……都是家家酒，因为不敢玩真的。
002.“公投”梦碎.txt	47	真的是什么？真的是废掉“中华民国”国号、国旗和国歌。不敢废掉国号、国旗、和国歌，而把蒋介石铜像大卸816块，都没有用，都是自欺欺人，因为你不敢打中要害。你只是玩家家酒，蒋介石铜块陪你玩，他在地狱笑得要死，他会说：“本民族救星扣在你们台独英雄头上的国号、国旗、和国歌，你们敢改吗？”
002.“公投”梦碎.txt	53	台独英雄们说228就是台独，如今64年了。关键是，过去台独英雄不是执政党、没当家，未能废掉“外来政权”国号国旗，不能全怪他。但今天怎么说呢？你们执政了前后8年，有足够的机会了：总统是你、行政院长是你、执政党是你、国会半数是你，执政8年了也是你，怎么还搞家家酒呢，炒“正名”、炒“爱台湾”、炒“台湾人出头天”、炒“台湾人不是吓大的”、炒“去中国化”、炒“去蒋介石化”、炒“第N次修宪”……除非你去掉“中华民国”国号、国旗与国歌在先，一切炒作，都没有用、都是家家酒。
003.“台独”梦碎.txt	3	皇帝有真假，太子有真假，公主有真假，但真的比假的多得多，全世界各行各业中，只有一个行业，很少真的，几乎全是假货，那就是所谓“台独”分子。这话说来好像不是真的，但事实却正如此，多奇怪啊！
004.“国家”梦碎.txt	11	陈布雷自杀前留有遗书给潘公展、程沧波，充满了自恨自悔的“自谴自责”，他说他“以百无一用之书生”想救国，“妄思自效于党、自效于国”，结果“十余年来”，国没救成，结果竟是“误国”！“误国之罪，百身莫赎”。 他在给洪兰友信中说他“忧心如焚，自责自讥”；给陈方、李惟果、陶希圣信中说他“一生辛苦，乃落得如此一文不值之下场……在公为不可谅恕之罪恶，但在私则有其无可奈何之苦衷”。又在给蒋介石信中表示“目睹耳闻，饱受刺激”，更显示了他的痛苦与挣扎。陈布雷共有6子2女。这8个孩子中，陈琏（怜儿）最早做了共产党。陈琏是1919年生的。她的母亲是杨夫人，生她以后20多天就“以生育太频，气血亏竭”而死。陈琏长大后进入师范，读了一年就转入杭州高中，后来进了西南联大地质系。1939年，她加入了共产党，后来又转入中央大学历史系。抗战胜利后，她在北平贝满女中教书。1947年，国民党保密局破获了中共北京地下电台，又在保定、西安、兰州发现中共组织和地下电台，大肆搜捕，意外得知了陈布雷的女儿陈琏竟是共产党，蒋介石为之大为惊讶、震怒。保密局局长毛人凤在大抓特抓之余，很感慨地说：“我们这样抓、这样杀，还是有这样多的人敢提着脑袋闯进来，真不知是为什么？”其实国民党永远...
004.“国家”梦碎.txt	15	不但儿女发了红，连弟弟也保不住，七弟陈训惠也出了问题。陈布雷死后，除长子陈迟（积泉）学农，在台湾做农业专家外，夫人和子女们都“投共”了。三子陈适（积皓）同济大学毕业，学工，是铁路工程师，原被国民党派到奥地利工作，后来“回归”大陆了。长女陈绣也入了共产党。
005.“中华民国”亡国考.txt	5	晚近幕僚之道，不足论矣，不是主管不尊重幕僚的地位，把幕僚视同奴属，便是幕僚乘机弄权舞弊、结党营私，竟很少道义的结合。而布雷先生则是当代最理想的幕僚长之一。他与领袖之间，真所谓精诚无间，领袖对他特别敬重，他对领袖绝对忠诚。无论任何场合，他可以说没有自己的得失、没有自己的荣辱，他以领袖的得失为得失、以领袖的荣辱为荣辱。他之所以能做到这个境地，乃是由于他的心境的纯洁，毫无私念和私欲。他从不位置私人，从不想扩张自己的权力。在侍从室的时候，领袖为事实的需要，几次要扩大他所主管业务的范围，他总是如若不胜的推荐其他的同志来担任。终其侍从室第二处主管任内，工作同志始终只有20余人。尽管他置身政治的里层，领袖对他信任有加，但他时有廊庙山林之思。34年冬，侍从室结束以后，有一天我和布雷先生闲谈，他说：“宋朝有一种制度，凡于国家有功勋的大臣，到了晚年退休的时候，他可以请求朝廷去管理一个寺院。我想我回到南京以后，无论鸡鸣寺或灵谷寺，如果让我管领一处，借那清静的环境来整理国家的文献，那才是名山盛业哩。”那种眉飞色舞的神情，及今思之，犹在目前。
005.“中华民国”亡国考.txt	27	这天，陈布雷彷彿显得比往常从容镇定。上午，他关照我去请来了理发师，替他理发修面。随后又去洗了个澡，换了一身干净整洁的衣服，一双新布鞋。午饭后，他睡了一个多小时的午觉。醒来正值总统府第二局局长陈芷町来访，二人促膝倾谈近两个小时，其中陈芷町不乏宽慰之词。辞别时陈布雷一直送客人至大门外，再三表示感激。
005.“中华民国”亡国考.txt	43	看到了吧！照贵总裁的说法，“中华民国”早在“去年（1949）年终”就“灭亡”了，这不是“亡国”又是什么？可见说“中华民国”未亡者，自不符合“总裁言论”也！感而有诗，翻作一首：
006.蒋介石不止一次自承“亡国”.txt	7	国民党丢掉了祖国，逃到台湾，却以祖国自居，说它代表“中华民国”，但是，它有什么脸皮代表“中华民国”呢？所谓“中华民国”的国都南京，就被它丢掉两次；所谓“中华民国”的国父陵寝，就被它辞庙两回；所谓“中华民国”的国土，就被它丢掉千分之九百九十七，而只剩下千分之三……如果这些只是暂时现象，也就罢了。事实上绝非暂时，不是3年5年，也不是13年15年，也不是23年25年，国民党根本回不去祖国了。到了第26年，国民党的领导人蒋介石死了；又过了13年，他的儿子蒋经国也死了。接下来是儿子的大玩偶李登辉12年、大玩偶的小玩偶陈水扁8年，和美国玩偶马英九3年，总共61年，就自欺欺人过去了。
006.蒋介石不止一次自承“亡国”.txt	11	上面这篇《“中华民国”亡国考》，是我1984年9月3日写的，距今27年了。也就是说，我早在27年前就用证据点破“中华民国”早就“亡国”了。我特别落墨在“亡国”这一惊悚字眼上，因为只有这一字眼出现，才算是休止符。我特别戏谑性的挖出蒋介石的秘密谈话来印证“亡国”，是很毒辣的手法。这一手法，震惊了国民党文工会主任廖风德。在TVBS电视台碰到我，他告诉我，当时他们一方面吓呆了，一方面咬定李敖造谣。后来一查，果然“亡国”之言见于他们总裁的全集，只好暗中饮恨。我说：张其昀、秦孝仪编的你们总裁全集，都在“亡国”语气上动过手脚，都不如蒋介石原来的秘密谈话原件完整呢。廖风德偷偷告诉我，他佩服我，佩服极了。
007.“知耻”梦碎.txt	7	所谓人间政治的常理，就是政治责任与下台的行规。古今中外，当政者谋国，成功则引吭高歌，失败则引咎辞职，自苏伊士运河事件的英国首相，到福克兰群岛事件的阿根廷执政团首领，不论贤或不肖，无一例外。但是，这种政治责任与下台的行规，对国民党是完全不适用的，所以，国民党是人类有史以来，一个丢的领土最大最多、却干得最久最负责任的长寿政党，别人丢了大陆，早就给赶下台了或自己下台了，可是国民党却会“将功折罪”、却会“舍我其谁”、却会“这次不算，再来一次”、却会“将革命事业从头做起”！
007.“知耻”梦碎.txt	9	这种干不好却不下台的不要脸，的确是国民党一大特色。但特色之尤，却莫甚于今日。国民党主席马英九公然表示他干得不好，可是却还要参选，“舍我其谁”、“这次不算，再来一次”，而国民党《联合报》《中国时报》以及TVBS李涛主持的媒体，众口一声，唁唁拥护马英九第二届总统连庄，这是什么心态呢？干不好他自己还老下脸皮来选；干不好马屁咚咚还老下脸皮来助选，这和蒋介石又何以异呢？马英九选连任，和蒋介石选连任，在无耻上，毫无不同，一个是干不好，还是老子干；一个是干不好，还是要选我。
008.“民国”梦碎.txt	5	早在蒋介石死前3年，1972年，也就是他第5度连任“中华民国”总统的前夜，国民党的中常会“决议吁请征召蒋经国同志出任行政院长”。国民党革的是什么命啊，革到你家里去了。老子做“中华民国”总统、儿子做“中华民国”行政院长，成何体统啊，民什么国啊？“天下为公”个屁啊！国民党全体党员、每个党员，不觉得怪异吗？“中华民国”竟“民”到父子接班吗？
008.“民国”梦碎.txt	17	英文中“国家”（state）一词，观念始于16世纪马基维利（Machiavelli）之首创，但马基维利时的国家观念，就比现代构成的要项少，例如缺一定领土观念、也缺现代主权观念等。可见古人比今人还实事求是得多，古人比较能单刀直入，扣紧真正关键在君臣臣民人际上的“恶”，反不易为幻象所欺也。今天则以幻象的所谓国家自欺欺人，自蒋介石蒋经国父死子继，到他们留下的奴才接踵“中华民国”，都是用空头国号骗人。最后巨骗，是马英九的“建国百年”大手笔。“民国”至此，焉不梦碎？
009.“首都”梦碎.txt	9	孙中山不民主的坚持设在南京，是有私心的。骨子里的原因是让了总统位子给袁世凯，不甘心，老袁坐镇北京，根据地在北京，总要把老袁弄到南京来迁地为良，方好制住。至于表面上的原因，当然另有说词，乃说北京是明清两代的首都，帝王气与官僚气甚重，迁都南京，可以荡瑕涤秽，有利共和前途。
009.“首都”梦碎.txt	15	袁世凯被选为临时大总统，南政府将解，孙黄以袁氏难制，欲令迁都江宁以困之。余谓：“江宁僻左，不足控制外藩。清命虽黜，其遗孽尚在，北军未必无思旧主者；重以蒙古东三省之援，死灰将复炽，赖袁氏镇制使不起耳。一日南迁，则复辟之祸作矣。”克强闻之，愤甚，与余辩难。且遣使者三人入宛平迎袁公南下，袁公亦诱致兵变以劫之，卒不能成言。夫假人威力以翦建夷，名实归之，而又欲以小慧牵制，所谓既不能令又不受命者矣。斯孙黄所以败也。
009.“首都”梦碎.txt	35	章太炎批评国民党建都南京，用一副对联，写得淋漓尽致：
011.“抗战”梦碎.txt	11	1940年（民国二十九年）2月14日，今井武夫和这位宋子良在香港东肥洋行会见。两人商定在2月底举行中日两方正式圆桌会议。今井武夫赶到南京向西尾总司令报告后，奉命在19日飞东京向闲院宫参谋总长和畑俊六陆相说明会谈内容。参谋本部立即派谋略课长臼井茂树大佐到了香港实地了解情况。这就是日本陆军中央期待极大的非常重要而且秘密的所谓“桐工作”。
011.“抗战”梦碎.txt	27	小矶在发动政治工作的时候，曾策动两个幕后的秘密活动：请宇垣一成大将到中国来旅行访问，邀汪伪政权考试院副院长缪斌访问日本。同时，日本天皇又命前首相近卫文麿的弟弟水谷川男爵到上海来，和国际问题研究所派在上海的负责人何世桢（重庆情报机关、上海自治大学校长）会晤，表达天皇希望和平的意向。后来，水谷川曾几次往返于东京和上海之间。
012.“受降”梦碎.txt	13	会议约开了一个钟头，发言都翻译成中、日、美三国语言，完全像演剧一样。
012.“受降”梦碎.txt	59	我对日本人性格相当了解，一种自大狂的心理，此时并未因战败而降低或消除，以往对我国交涉任何事件，均喜用一种试探手腕来观察你，即俗话说：“先秤秤你的分量”，如果你对他敷衍、迁就，他就认定你软弱低能，用尽方法来摆布你、作弄你，使你啼笑皆非，达到他的目的为止；倘使能义正词严的交涉，他反而敬佩你，不敢无理要求。在抗战前，中日两国的若干交涉，不乏先例，最后我乃指示陈倬对日方说：冈村宁次大将来时，我到室外（非大门口）去欢迎他，并嘱卫兵敬礼。日方来员又回去请示，再来答复，表示同意；接着双方官员续谈明日会见方式座次，一切齐备，临睡时，因大问题迎刃而解，安然入梦，竟不知东方之既白。
012.“受降”梦碎.txt	61	愚笨的国民党冷欣不知道，从芷江洽降开始，日本人早就秤过你的分量了，你到了南京再神气，也是《水浒传》孙二娘说的：“由你这厮奸似鬼，喝了老娘洗脚水”了！
012.“受降”梦碎.txt	67	照国民党冷欣的回忆，我们看到的是：在他和冈村宁次见面以前，没有国民党大员“和冈村在私宅相见”的，所谓“怎能和冈村在私宅相见，未便同意”的。并且他的“各位参议先生”（顾毓琇、刁作谦、邵毓麟、龚德柏）也“一致向我建议反对”的。但是，只要我们细心查看一下，国民党冷欣这种民族正气，很快就穿了帮。因为“参议先生”之一的国民党邵毓麟（后来的驻韩大使、驻土大使），在《胜利前后》的回忆里，就泄漏了真相：
012.“受降”梦碎.txt	71	可见日本人早就摆下圈套，要你前去“聆教”了。国民党冷欣书中说他当时宣布成立前进指挥所后，“并即转达何总司令的命令：所有人员均不得私自外出，如有必要，必须事前请假。并告诫绝对不许有人‘接收’任何东西，亦不得使用封条，违者军法从事！”可见在这种规定之下，前进指挥所的一员——国民党邵毓麟，是不会私人行动的，他要先去见冈村宁次，必出自国民党冷欣的授意，所以国民党冷欣的所谓私宅不见之说，就十足是扯谎了。
012.“受降”梦碎.txt	156	国民党不但在照片上扯谎，并且在整个典礼上，由于国民党何应钦的腰有媚骨，更暴露了许多有辱国体的外一章。据1956年日本《文艺春秋》4月号刊出的国民党何应钦与冈村宁次会谈记，两人在受降11年后，曾在日本有这样的谈话：
014.“外蒙古”梦碎.txt	57	我曾分年按月摘出王世杰日记中的纪录，目的在从不同时间、不同角度看他心境的起伏变化，和他对卖国行为的自欺欺人。观察他的全部自解，主轴上，是所谓不畏负责、不计毁誉、“代人受过”，并托词在“为国家利益”外衣下，守口如瓶。另一方面，他口口声声“该约未能挽救中国大局之原因”，主要是“在苏联之不守约”、“为苏联不肯忠实执行条约”，但苏联之不守约，在《中苏友好条约》签订前，至少有19次以上（包括对中国的1937年的一次），苟有国际法与现代史常识，岂可贸然签字？
014.“外蒙古”梦碎.txt	63	这种肉麻的谀词，还说是“书生本色”，真使我们感慨：人间是非、人间公道。人间羞耻，是这样诠释的吗？
015.“建国百年”的殭尸花费.txt	84	制播“民国百年——我们的家园、我们的歌”系列广播节目/新闻局/2,000/2,000/
015.“建国百年”的殭尸花费.txt	129	这一浩大的“建国百年”烧钱活动，是由马英九担纲的，结果怪事连连，被民进党告到地检署。光在演出两场歌剧一项，《联合报》就有报导如下：
015.“建国百年”的殭尸花费.txt	137	庄瑞雄说，此标案在今年4月20日才公告招标，但厂商竟在3月21日就知道要承包此案，明显是文建会内神通外鬼、勾结厂商；此案也涉及泄漏国防以外之秘密，让厂商预做准备，显然是标准的图利、贪污案件。他还说，国外的歌剧平均上演寿命15到20年，但台湾梦想家两天就演完，有违常理。
016.“建国百年”的马嘶呓语.txt	5	建国百年庆祝活动筹备委员会昨天召开第三次全体委员会……马总统致词时表示，政府刚到台湾时，可以说是风雨飘摇，那时台湾银行发出的信用状，很多国外银行都不收，许多邦交国与我断交，外交官流离失所。中华民国在台湾宝岛上历经许多挑战与挫折，仍展现无比的毅力、韧性及抗压性，逐步走向政治民主、经济繁荣与社会进步，尤其是宁静革命的政治奇迹，更为世人所敬佩。
017.“法统”梦碎.txt	3	今年2011年，这个岛上大闹“中华民国第13任总统选举”，正好又赶上所谓“建国百年”，更给了所谓“第12任总统”马英九的张本。不过口口声声今年是“中华民国”100年，则100年间，“总统”绝不止10任，早在民国元年到民国十七年间，就有10任可循，现开1928年前“中华民国”历任元首（总统、执政、大元帅）姓名表如下：
017.“法统”梦碎.txt	27	1948年4月19日，国民党在南京召开国民大会，选出了蒋介石做总统，这是总统之名，在“中华民国”史上的重新出现，但并非首次出现。国民党对“中华民国”总统第几任第几任的分期方法，显然是大大的有毛病的（客气地说，是有语病的）。若说1948年当选的是“第1任”，则1948年以前37年间的“中华民国”历任总统（包括国民党必须承认的孙文在内），又搁在哪儿？若说1948年起的总统是“行宪后”第1任，但也与法统和事实都不合，因为“中华民国”早在1912年就是民国元年了，并非1948年才是民国元年。何况所谓“行宪后”的说法，国民党也罕言之矣。并且所谓“行宪后”之说，也是巧立名目，因为这样加帽子，则以前的总统都可援例大加特加，袁世凯就可来个“行约（约法）后”第1任了，别人也可以依样葫芦了，试问一个国家的总统任期算法，可如是乎？第3任的美国总统杰斐逊（Jefferson），能说他是“战乱后”第1任吗？第16任的美国总统林肯（Lincoln），能说他是“内战后”第1任吗？除非美国亡了国，杰斐逊、林肯不会这样吧？
018.“正统”梦碎.txt	5	最近我一边看这张漫画，一边想到马英九。马英九今天的手足无措，“一定在什么地方弄错了”。当年他竞选市长时，有一天秘密来拜访我，问我秘笈；当选后，未曾再来，很久不见了，顺手翻到他选举时的一本小册子，题为《二十一世纪台北》，其中有一段是：“去年，北一女校庆，班联会邀我去演讲，演讲对我本是家常便饭，但是那场讲得患得患失，因为我的女儿提醒我，北一女学生对不精采的演讲是何种反应，当天她也坐在台下。会后，虽然现场反应热烈，我也觉得讲得不错，却一直等待女儿的反应，女儿那天回家，第一句话说：‘爸，I'm proud of your（我以你为傲！）’这句话像天籁，让我快乐了好几天。记得鼓励别人，即使是你家人也不例外，你想像不到他们多么需要这些鼓励。”我看了，为之一笑，我笑的是，即使哈佛大学博土头衔的马英九，竟也在英文中译上不小心弄出乌龙。因为I'm proud of you不该译成“我以你为傲”，这样译是错误的。正确的译法是“我以你为荣”，按说马英九的英文当然好，但他一旦发生短路，也许“一定在什么地方弄错了”。
018.“正统”梦碎.txt	15	马英九所谓“正统”，原来如此。
019.“道统”梦碎.txt	11	中山先生的思想，完全是中国的正统思想。就是继承尧舜以至孔孟而中绝的仁义道德的思想。在这一点，我们可以承认中山先生是二千年以来中绝的中国道德文化的复活。去年有一个俄国的革命家，去广东问先生：“你的革命思想基础是什么？”先生答覆他说：“中国有一个正统的道德思想，自尧、舜、禹、汤、文、武、周公至孔子而绝。我的思想，就是继承这一个正统思想来发扬光大的。”那人不明白，再又问先生。先生仍旧把这一句话来答覆。我们就这一段话，就看得出先生的抱负。同时也就可以认得清楚先生的国民革命，是立脚在中国国民文化的复兴上面。是中国国民创制力的复活，是要把中国文化之世界的价值，高调起来，为世界大同的基础。
019.“道统”梦碎.txt	15	再讲一句话，我们要晓得总理的思想，即是继承尧、舜、禹、汤、文、武、周公、孔子以来的仁义道德思想，将之发扬光大，三民主义就是从仁义道德中发生出来。总理讲这句话是在广西桂林，我当时也在桂林，那个俄国共产党问总理的时候，我也在那里。共产党当时只是宣传，头一次越飞还没有来，那个俄国共产党并不是俄国人，而是瑞士人，也是第三国际派来的。孙先生头一句话答覆他的就是：“中国有一个正统的道德思想，自尧、舜、禹、汤、文、武、周公、孔子而绝，我的思想就是继承这一个正统思想来发扬光大的。”由这一段话，大家可知总理主义是怎么一个思想。
