file	line	text
008.中国历史人物.txt	617	胡适写作量最高峰实在1924到1930这六年，他写了一百万字，平均每年十七万字，每月只一万四千字，每天只四百七十个字。这还是最高峰的六年，他活了七十一岁，写作生命有五十年，成绩这样少，可见浪费得多可惜！他为人热心，好交际，交际包括教书、办事，占去了他太多太多的时间。交际只能影响一时一地一部分人，作品却永恒而深远，并且影响到大部分人。可惜胡适一辈子不能把握到这一分际，浪费了。否则，以他的大才，专心写作，一定可以写出完整的世界性的大书，比如说，他可以写一部中国史，很好的中国史，留给全世界。（《新下蚕室条例》）
008.中国历史人物.txt	621	在中国新文学运动史上，胡适扮演的是一个“提倡有心，创造无力”的角色，除了于1920年发表一本《尝试集》外，他始终自承是“新文艺创作的逃兵”，而替他压住阵脚的，志摩可算是一员大将，尤其在新诗方面，志摩在早期文坛上，曾以他优美的才华建树了许多奠基的成就。志摩之所以有那么大的功绩，当然是受了胡适相当的影响，他写《爱的灵感》一诗，开首就有“奉适之”的话，说：“下面这些诗行好歹是他撩拨出来的，正如这十年来大多数的诗行好歹是他撩拨出来的。”可见胡适对志摩的创作，的确有过许多启迪的功劳。
008.中国历史人物.txt	623	胡适与志摩在教书上共事有三次，第一次是民国十三年，在北平北京大学；第二次是民国十六年，在上海光华大学；第三次是民国十九年，又在北京大学。他们在一起最热闹的活动，是民国十六年开始组织“新月社”那一段日子。当时他们（胡适、徐志摩、梁实秋、叶公超等）不到十个人的小团体齐聚在上海，创办新月书店，发行《新月》杂志，今天到极斯菲尔路胡适寓中聚餐，明天到环龙路徐志摩家里摆龙门阵，闹得有声有色。
008.中国历史人物.txt	625	胡适与志摩在学术上的合作共有两次，第一次合作是民国十二年，他们同住在西湖上，相约一同翻译英国女作家曼殊斐尔的小说，……第二次合作是在民国二十年翻印《醒世姻缘》，胡适做历史考据，志摩做文学批评。（《三人连环传》）
008.中国历史人物.txt	629	毛子水本是《自由中国》的社委，雷震被捕后，《自由中国》自然停刊，国民党为了“李代桃僵”，特别弄出个新的杂志——《新时代》，由毛子水出面，以图鱼目混珠。而无格无耻的毛子水，居然就这样干上了，这是我最看不起他的一点——他这样配合国民党干见利忘友之事，真是士林败类。他这样做，实在有国特之嫌。
008.中国历史人物.txt	631	毛子水今年九十五岁，这几天国民党报上捧他，曲学阿世的国民党学人与同路人也捧他。中央研究院院长吴大猷捧毛子水是“把书真正念通的人，其学术造诣已达最高的境界”，全是瞎说；事实上，毛子水读书虽多，却是俞大维式的笨伯；台大校长孙震捧毛子水是“台大的宝贵资产”，也全是瞎说；事实上，台大已被这种货色丢人丢得破产矣，又何“资产”之有哉？（《老毛是国特？》）
008.中国历史人物.txt	635	在近代中国妇女运动史上，有两个重要的实际推动者：一个是冯玉祥，他对河南女人小脚的解放，用心最苦；另一个是朱家骅，他对广东女人乳房的解放，功劳最大。朱家骅在民国十六年做广东省民政厅长，大力提倡“天乳运动”，惹得守旧的老广们大骂“丢你老妈唉”，埋怨这个“外江老”败坏广东地方的名教。但是朱家骅不管，还是要提倡，因为他深切了解束胸对国民健康的不良影响，他知道女人乳房的自由，是现代中国人所必须争取的自由之一。（《大奶奶运动史》）
008.中国历史人物.txt	639	多少次，在太阳下山的时候，我坐在姚从吾先生的身边，望着他那脸上的皱纹与稀疏的白发，看着他编织成功的白首校书的图画，我忍不住油然而生的敬意，也忍不住油然而生的茫然。在一位辛勤努力的身教面前，我似乎不该不跟他走那纯学院的道路，但是每当我在天黑时锁上研究室，望着他那迟缓的背影在黑暗里消失，我竟忍不住要问我自己：“也许有更适合我做的事，‘白首下书帷’的事业对我还太早，寂寞投阁对我也不合适，我还年轻，我该冲冲看！”（《十三年和十三月》）
008.中国历史人物.txt	653	对国民党的态度，蒋廷黻的表现更是光明磊落的。他在1935年十月二十七号，在天津《大公报》星期论文上，本发表过一篇《国民党与国民党员》，里面很爽快的指出他“对国民党素无好感”。但这种“素无好感”，并不影响他对国民党的公正论断，也不影响他跟国民党中的优秀分子合作，一同为中华民国（不是“中华党国”）而努力。蒋廷黻做官，做的是堂堂中华民国的官，并不是“党官”。因此我说，他的态度是光明磊落的。
008.中国历史人物.txt	655	蒋廷黻这个“中国自由党”的梦，可说是一个爱国书生的好梦，一个关心国事的知识分子的美梦。这个梦在刚做的时候，他对“党魁”的推荐，很属意于胡适。（《蒋廷黻选集》序）
008.中国历史人物.txt	659	他所要求于知识界的，是动态、是入世、是实事、是实物、是书本以外、是主义以外、是文字以外、是“清议”以外、是生产、是事业、是与小百姓同一呼吸。……这种真正的民胞物与经世致用的精神，才是蒋廷黻的真精神。（《论牺牲自己的名誉去奋斗》）
008.中国历史人物.txt	665	蒋廷黻是中国学人从政的一个榜样——一个“清高”的、“光荣”的、“最后一个机会”的、“有很大贡献”的一个标准样品。在坎坷颠沛的中国官场上，多少从政的学人都愁眉不展了，蒋廷黻在此必然是个例外，也应该是个例外。唯有他的例外，才能延续中国学优则仕的一个传统，我们这些人虽不做官，但也不希望中国传统上这一脉香火在他身上“及身而绝”，因为仓库里尽管没货色，橱窗里却不可没样品。中国的读书人，请来看看这件样品。（《蒋廷黻和他走的路》）
008.中国历史人物.txt	669	蒋廷黻在中国近代史的研究方面，最有成绩的时期是1923年到1935年，也就是他十二年大学教授的那一阶段。在这一阶段，他首先有《近代中国外交史资料辑要》上卷的编纂，1931年11月在上海商务印书馆出版。这部书，是中国有史以来，第一部不靠外国蓝皮书等单方面文件而编成的外交史资料。过去人们研究外交史，不分中外，都以外国单方面的文件为根据，这就好像只根据一造的口供就来判案一样，当然有失公平。蒋廷黻这部《近代中国外交史资料辑要》，不但纠正了这种偏颇，同时还将历史研究带出了《春秋大义》或《资治通鉴》式的主观论断，这部书里没有描写洋鬼子如何欺压中国，也没有宣扬不平等条约该如何废除。……它只是平铺直叙挖掘历史真相，并且呈露历史真相。这样子编写历史，才真正是中国旧史学的埋葬，真正算中国新史学的开端。（《<中国近代史论集>序例》）
008.中国历史人物.txt	681	这段对话的基本意思，施之于林语堂，也是如此。香港正文出版社出资三万元，约我写一本《林语堂论》，我现在还没做最后决定。如果我写，这段意思，我一定要反复说明。你以为何如？（《给Y的四十八封信》）
008.中国历史人物.txt	689	溥儒是满族的皇族出身，就是所谓的“旧王孙”，自己根本就是这种地位的人，自然也就更目无权贵。一般画家都巴结权贵，可是溥儒不买帐，再显赫的他也不理。我们只注意到毕加索在德国军人面前的傲慢，却忘了溥心畬在日本军人面前的不合作。溥儒在整天诗画世界当中，寄身于无为，以显示有为。他是德国生物学博士，可是他好象有意把自己给“报废”了——变成一个只会画画的，他不要自己变的有用。
008.中国历史人物.txt	691	溥儒一派天真，不拘虚礼，在日本大饭店餐厅，他忽然嫌热，脱掉长袍，光起胳膊，吓得洋婆子大叫起来。吃酒席时候，他发现有一盘特别好吃，他就端到自己面前，向其他客人说：“你们别吃了，由我一个人吃吧！”（《真艺术家的人格》）
008.中国历史人物.txt	695	志摩离婚后3年，就与陆小曼结婚了。志摩的父母本来对他与张幼仪的离婚就不满意，这次再婚，更是不赞成，他们老两口提出三个条件，一定要志摩遵照办理了才许结婚，条件之一就是证婚人非由梁任公担任不可，这一下子可难为了徐志摩，他明知任公对他的离婚再娶是不满意的，但迫于无奈，只有央求胡适去游说，果然胡适神通广大，一言九鼎，终于说动梁任公。任公在结婚典礼的致词中，很不客气地把新郎新娘痛斥一番，首先说两人皆是曾经结过婚的过来人，希望此后各自检点，勿再做一次过来人。其次便指着徐志摩大骂，说他性情太浮，以致学问做不好；用情不专，所以闹离婚再娶，往者不谏，此后一定要洗心革面重新做人。……任公唠唠叨叨这样骂个不停，最后志摩只好走上前去服罪，面红耳赤地请求道：“请老师不要再说下去了，顾全学生一点面子吧！”任公也觉得骂得差不多了，便就此停住。梁实秋先生在《谈徐志摩》一书中写道：
008.中国历史人物.txt	699	志摩的死，说来好像是劫数难逃，他自上海北上前本来已经把火车票买好了，但是临行头一天有人送给他一张中国航空公司“济南号”的飞机票，他就临时决定改坐飞机去北平，而这架“济南号”竟在济南西南的党家庄附近触山失事，志摩及两名驾驶员均遭难，时在民国二十年11月19日。（《三人连环传》）
008.中国历史人物.txt	719	李济三十一岁起就做学阀，八十四岁才在武侠小说中死去。他的死，象征了中国重量级学阀时代的结束，今后的学阀只有迷你级，再也不迷人了！（《一个学阀的悲剧》）
008.中国历史人物.txt	723	沈刚伯慵懒成性，游学无根，完全不足为文学院的表率，完全是个误人误事的老人。这个老人在学问上除了对希腊史、罗马史稍加涉猎外，其他表现则为才子派，有许多是信口乱道、信笔乱写的。此公此才，对初出茅庐的大一学生，可以开开茅塞，可是一个学期足够了，再听就是浪费青春，因为“沈郎之才，技仅此耳”！三十多年来，沈刚伯在学术著作上是一片空白，唯一可举的是目前中学生用的所谓“标准本”外国史，其中大部分还是抄别人的。
008.中国历史人物.txt	727	沈刚伯除了不贪财以外，其他一切都是老教授中腐败的代表，也是最好的活证与抽样，更是集大成的人物。他十四年来唯一可歌颂的“德政”，是不让徐复观之流混进台湾大学，大概是想引某某入室的典故而心有惴惴，结果嫁祸于东海大学，使东海大学的师生心头暗叫：“苦也！恁地引进这湖北佬来！”（《高等教育的一面怪现状》）
008.中国历史人物.txt	737	第三，国民党是个又笨又自大的集团，它低估了窝里反的人对它的伤害，国民党拿手好戏是优于制造它打不倒的敌人，但吴国桢事件上，却又证明了国民党还优于制造它打不倒的“同志”。（《吴国桢窝里反妙史》）
008.中国历史人物.txt	743	司机先生证实了叶公超垮台的真正原因，是出于沈昌焕的向蒋中正告密，告密内容，不是一般所说的内容，而只不过是叶公超私人谈话中有了“对元首不敬畏的语气”。（《国民党大使垮台秘闻》）
008.中国历史人物.txt	747	溥仪虽不是当皇帝时间最久的，却是次数最多的，他一生当了三次皇帝，第一次是3岁到6岁，当了三年（1909-1912）；第二次是12岁，当了十二天（1917）；第三次是29岁到40岁，当了十一年（1934-1945）。这三次当皇帝，头两次溥仪年纪小，自己没有责任可言，最后一次当满洲国皇帝却不无责任。溥仪三次当皇帝，只有这一次假戏真做，虽然做到头来，还是一名傀儡。（《介绍<满宫残照记>》）
008.中国历史人物.txt	753	“末”像收尾，但其作用，又是开场。末代皇帝溥仪这个人，是中国帝王之“末”，但又何尝不是中国平民之“末”？此人的象征意义，真是古之所无、今之绝有。他从帝王转为囚犯，再从囚犯转为平民的过程，最富传奇性。研究这一个人，无异研究了最好的取样，他是人类浮沉对比最强烈的缩影。（《<末代皇帝研究>前言》）
008.中国历史人物.txt	757	古今中外亡国之君很多，但是亡国以后几十年间，饱更忧患，忽而御苑称孤、忽而出宫道寡、忽而以王被尊、忽而因夷就攘，最后满洲为帝、赤塔成囚、东京受审、抚顺观天，垂老又以一介平民，重回故宫，重游他当年做皇帝的所在，为难友做义务导游……这几十年的荣枯对比与浮沉奇遇，不但是古今中外帝王所绝无，也是人类有史以来平民所仅有。溥仪这一生太动人了。他是一个死掉的皇帝，却是一部活的现代史，在这部现代史中，庄士敦云龙契合于先、奋笔疾书于后，为时代留下他所目击身经的一段，“雄文高行，为中国儒者所不及。”（《介绍<紫禁城的黄昏>》）
008.中国历史人物.txt	763	居浩然身为居正之子，在国民党生殖器关系集团中，充满了骄傲、自负与不服气，他这种八面威风与八斗高才，不是小鼻子小眼的国民党容得下的，所以，他最后以当令少爷之尊，被出局了事。他老死他乡，临死似乎还没觉醒及此，国民党少爷们的不可救药，就于此可见了！（《写在居浩然<十论>的前面》）
008.中国历史人物.txt	781	总之，我几年来细心观察居浩然淡江英专校长垮台后的言论，我很高兴的指出居浩然是我们自由中国最可贵的一位“大少爷”，一位西化的勇敢的斗士——打官司除外。（写在居浩然《<义和团思想和文化沙文主义>的后面》）
008.中国历史人物.txt	785	殷海光早年投身在救国的急湍里，他的狂热和动辄“立正示敬”，十足是一个“法西斯分子”。他被国民党争取到，为国民党做文化打手，被共产党列为“十大文化战犯”之一。到台湾后，他勇于觉悟，把国民党的祸国殃民，批了个痛痛快快，这是殷海光一生中最登峰造极的，没有这些登峰造极，自然无所谓思想家殷海光、无所谓逻辑学者殷海光。所以，论定殷海光，必须就这一生命中最光彩的登峰造极来论定，否则就是别有用心了。（《扭曲了的“纪念”》）
008.中国历史人物.txt	791	更糟的是，从他背后又钻出一条毛茸茸的东西——一条大狼犬。这条狼犬，殷海光命名为“领袖”，是把纳粹党对希特勒的尊称的走狗化。“领袖”究竟是“领袖”，威武无比，跟殷海光比起来，愈发显出殷海光的猥琐。“他真不该养这条不民主的东西。”我想。（《我的殷海光》）
008.中国历史人物.txt	795	殷海光虽是我佩服的思想家，但他的思想面并不宽，只以方法学与政论为主，其他方面，都表现得很弱。他服膺思想家罗素，但罗素思想面极宽。殷海光虽在台大开“罗素哲学”，但他对罗素的全面性了解，似乎不够。即以个人修养而论，罗素很早就征服了快乐，殷海光却整天为不快乐所笼罩。我常向他说：“老师为什么不细看一下罗素的Conquest of Happiness呢？你这样多愁善感，可不是罗素的信徒啊！”殷海光最后得胃癌而死，得这种病，简直对学哲学的是一种讽刺。
008.中国历史人物.txt	797	胡适歌颂雷震为自由民主政治奋斗的功劳，主张给雷震立铜像，我却认为雷震铜像的肩膀上，更该立一个人，就是殷海光。殷海光和雷震，在鼓吹自由民主的功劳上，真可说空前绝后，但他们的气质，却是非常缺乏自由民主的。自由民主的气质是自然的、从俗的、快乐的、喜开玩笑的、幽默的、嘻嘻哈哈的、拍肩膀捏大腿（或看大腿）的、青年会总干事式的。……但是殷海光和雷震却全不如此。殷海光和雷震的气质是革命党式的、单调的、专断的、严肃的、不恢廓的、高高在上的、兴趣狭窄的、圣王、贤君、教主式的。……这些气质，很过瘾、很雄浑，可惜都不是自由民主的气质。（《我的殷海光》）
008.中国历史人物.txt	803	殷海光永生。（《我的殷海光》）
008.中国历史人物.txt	807	我说殷海光是高级知识分子，从他生活细节上，也可看出一斑。他从不坐公共汽车，他认为人的尊严会给挤掉；他喝高级咖啡，吃英国饼干，去贵族医院看病……这些都表示他也满布尔乔亚的。另一方面，他除了不太会用电话机、不会用自动电梯外，要替人做衣服的殷太太向人收两种工钱——有钱的人要多付，没钱的要少付……这些都表示他也蛮书呆的一面。以这样层次的知识分子，来了解人间万象与真相，当然要受到很多限制。殷海光虽然天姿英明，但在生活面上和人事面上，却显得生疏而笨拙，他很容易被投其所好、被小人利用。（《我的殷海光》）
008.中国历史人物.txt	811	殷海光责备胡适喜欢以人情的原因揄扬别人的学问。说得很对，但他自己，却也犯这种毛病。殷海光吸收及门弟子，当时都是张灏型的，整天只会看洋书、谈方法学，但他们的知识基础太窄、货太少，所以充其量只会搭钢筋，没有水泥。殷海光自己也水泥不多，但他在大陆见多识广、文笔又好，所以能弥补不少“水泥缺货”，他的及门弟子却比他差得太远、太远。这种情形殷海光自己是心里有数的，但他的及门弟子心里无数，所以他们在台大，颇有不知天高地厚的毛病，以优异学生自居。（《我的殷海光》）
008.中国历史人物.txt	815	殷海光的怪毛病是：他刚见到一个人，经常是不讲话，态度也不友善，一定要“暖车”以后，他才逸兴横飞高谈阔论不止，这时候他也有说有笑，与常人无异。但是下次见面时，他又要重新从那种死样子开始。一些人不了解这怪毛病，常常在一开始就被他气走了。这次殷海光到我家，怪毛病倒颇为从简，大概他怕我以其人之术，还治其人之身，所以很快就了无拘束地聊起来了。（《我的殷海光》）
008.中国历史人物.txt	831	李师科是中国农民，在抗战胜利后，他想解甲归田，重新回到家乡和土地，但是，巨掌拦住了他，他要继续爱国下去，他一次又一次的参加战斗，在枪林弹雨中，他只被打败，没被打死；最后，他跟到台湾。他眼看政府退后，自己却不能退伍，因为，正如政工人员所说：“国家需要他！”
008.中国历史人物.txt	845	恰像狄更斯（Charles Dckens）《双城记》（A Tale of Two Cities）中卡尔登（Sidney Carton）临刑前的说话，李师科做完了比他做过的更好的事，即将走向比他知道的更好的地方。李师科不会死，因为千千万万的李师科在活着。（《为老兵李师科喊话》）
008.中国历史人物.txt	849	王尚义是悲剧人物，没有错，但我永远不明白，这么善良、这么有才华的青年人，为什么不把自己打造成男子汉，而要变嗓成娘娘腔，最后肝癌上身、憔悴以死？为什么死的不是敌人，而是我们？为什么“软性”的不是敌人，而是我们？王尚义全错了，他在“一个时代”里，完全做错了表现。——在“一个时代”里，只该有一种表现，那就是战斗的表现、男子汉的表现、把敌人打得哇哇叫的表现。（《关于“王尚义与李敖》”）
009.中国当代人物.txt	9	钱穆的信，写得工工整整，足见此公主敬修养的一面。信中对一个18岁的青年人如此鼓励，固因我的好学引起他的注意，也实可看出他具有教育家的风度。（《“一朝眉羽成，钻破亦在我”》）
009.中国当代人物.txt	15	我自主持《文星》起，引不满钱穆的反动思想，始终攻击不断。这种不满，由于钱穆在1967年回到台湾投奔蒋介石，更形火上加油。钱穆本来在香港办新亚书院，曾反对蒋介石连任，还有点独立性。但投奔蒋介石后，蒋介石请他吃饭，当面质问他，他就不敢再多说。蒋介石收买他，给了他豪华住宅，就是现在士林外双溪东吴大学东侧的“素书楼”。“素书楼”用的是属阳明山管理局的公地，豪华建筑花的是公帑，钱穆公私不分，一住近二十年，成为蒋介石养育卵翼的御用学者，这是他一生中最大的败笔。
009.中国当代人物.txt	17	如今他过九十三岁生日，五代弟子，冠盖云集，人人称庆，我却别有致哀，——我为钱穆惜，他有做成真正“一代儒宗”的机会，可是他却做成个假的。历史上，真正“一代宗濡”是不会倒在统治者的怀里的！（《“一朝眉羽成，钻破亦在我”》）
009.中国当代人物.txt	21	把不抵抗主义，一股脑儿记在东北军张学良的账上，是不公道的。“西安事变”的发生原因之一，是张学良想用行动表明他不是“不抵抗将军”。据陈立夫《参加抗战准备工作之回忆》（《近代中国》季刊，1977年6月30日），明说张学良“并期以‘不抵抗将军’之头衔，转加诸中央领袖，终致造成西安事变”。显然“西安事变”前，张学良对背了五年的黑锅，已经不愿再背了，所以弄出“西安事变”。（不料事变后，他更没澄清的机会了，不但没机会卸下以前的黑锅；反倒又加上许多新黑锅！）（《“西安事变”的另一主角》）
009.中国当代人物.txt	29	为了给张学良做历史定位、为了驳斥蒋介石及其党羽几十年来的诬蔑与谬说，我决心出版《张学良研究》来拍案与翻案——勿谓东北无人也！东北讲武堂往矣，讲文堂登场，戏亦好哉！（《<张学良研究>前言》）
009.中国当代人物.txt	39	再从历史定位看，孙立人案的种种冤情，又正如岳飞案。岳飞案的成立关键是凭“众证结案，而武穆竟无服辞云”。这就是说，全凭别人的旁证咬岳飞，并没有岳飞自己承认的证据，孙立人也是“无服辞”，真是古今同调。（《<孙立人研究>前言》）
009.中国当代人物.txt	45	陈立夫当年发明“唯生论”，写了一本专书，叫《唯生论》，其中有一段说：“总理从前说过‘生是宇宙的中心，民生是人类历史的中心’。”但是，我翻遍了孙文的遗著，也看不到孙文说过这些话或做过类似的说法。所以，陈立夫全是造谣。因为这个人有这样公然造谣的前科，如今他说暗杀廖仲恺的种种，我也就不得不有合理的怀疑。（《陈立夫，你为什么不早说？》）
009.中国当代人物.txt	53	照中国传统历史家的章法，黄少谷这种“私昵”级的人物，不论政治上怎么捧他，在历史上，他却是十足的贰臣，永远为正义之士所唾弃。（《黄少谷应入贰臣传》）
009.中国当代人物.txt	57	他们从大陆挫败来台，在国民党统治下，这种挫败之气，一直不能平息，他们一路垮下来了。我觉得虽然同是垮，可是其中台静农却垮得走样，台静农当年是鲁迅的大将，被捕后吓破了胆，从此“不干了”，以诗酒毛笔字自娱（实乃自“误”），如今垂老反倒愈发妖娆，一笔妖字上市，令人殊感其愈老愈无聊。至于与梁实秋同上台受国民党颁奖，则更属无聊双绝矣！（《李敖札记》1985年3月20日）
009.中国当代人物.txt	63	……就这样的八面玲珑，他一方面又当了“国策顾问”，一方面又成了党外人士的偶像，里外通吃如此，左右逢源如彼，并且一连多年，这不太奇怪了吗？（《围剿陶百川的一个教训》）
009.中国当代人物.txt	71	丁玲当年，为帮中共打天下，情人送了命，自己也坐了牢。后来放出来，跑到延安，替中共机关报编副刊。一九四九年，丁玲出版了《太阳照在桑干河上》，红的要命。
