file	line	covered_ids	context
417.成大共产党.txt	7		“成大共产党”领袖是蔡俊军，是一位率真勇敢的年轻人，后来与我成为好友，出狱后还打电话并来我家感谢我对他的照顾。有一次我送他一套睡衣，他那时被判死刑，穿着睡衣，带着脚镣对我说：“枪毙的时候，我就穿它去。”又指着胸前说：“子弹就从这儿打出来。”态度从容之至。后来死里逃生，改判无期，十五年后出狱。我的同案李政一曾和蔡俊军同房，他告诉我：“同房难友任何人的食品，蔡俊军都会抓来就吃，连招呼都不先打一下。人问他为什么，他说：‘我们是共产党，你的就是我的，我要共你的产啊！’”
417.成大共产党.txt	9		“成大共产党”另一领袖吴荣元，也被判死刑，也是一位率真勇敢的年轻人。他被判死刑后，带着脚镣，等待枪毙，找来佛经看，以为解脱；后来改判无期，他把佛经一丢，说：“既然没死，还是看李敖的书吧！”荣元是唯一一个“死不悔改”的英雄人物。他出狱后，依然故我，组织了劳动党，继续玩真的。年前还同二十七个统派团体去北京见习近平。这些人中，我看只有吴荣元和廖天欣是冒险犯难过的。
418.在八号房独居.txt	3		在八号房独居。有一次换房，因人太多，派进一个桃园大园的流氓同我暂住。此公叫许性德，我在看书，他大唱日本歌，我说你太吵了，你做一点工吧，他说没工可做，我看到马桶内外有多年累积的脏斑，我说你就洗马桶吧，他说好，洗了一阵，脏斑洗不下来，他说只有用刀刮才成，你有刀吗？我就把私做的一把代用刀——用垫鞋底的铁片磨成的——交给他，他很高兴，就慢慢刮起来了。刮了一下午，只刮了一点点，我笑他做得太慢，他说：“我是故意慢的，有工要留着慢慢做，做完了怎么办？”许性德的话，一语道破了只坐牢不做工的苦处。做工除了容易打发时间外，工厂活动范围...
420.《忘了我是谁》.txt	3		在八号房时，仍不准看报，外面消息只靠口耳相传。有一天，一个外役搞到几“块”破报纸，他说他喜欢搜集歌词，以备他年作谱消遣。如我能写几首歌词同他交换，这几“块”报纸便是李先生的了。我同意了。就立刻写了几首，其中一首就是《忘了我是谁》：
420.《忘了我是谁》.txt	29		这歌词我发表在1979年9月18日《中国时报》，新格公司作为“金韵奖”第一名推出，由许翰君作曲、王海玲演唱，引起轰动。事实上，我认为作曲和演唱都比歌词好。这首歌词《忘了我是谁》五个字，后来变成台湾报刊常用语，经常用在标题上。传说这歌是我为胡茵梦作的，绝对错误，因为在牢中写它时全无特定对象，眼前只是一面白墙耳！
421.我只好另外找一位.txt	3	LAFLZ-077	我在军法监狱，年复一年不准看报，所得消息，但凭新进牢的人口耳相传，最新世界大事所得不多，最新流行歌曲倒听了不少，因为大家无聊，以唱歌自遣者比比皆是。有一次一群小流氓们个个会唱刘家昌的《往事只能回味》，歌词是：“时光一逝永不回，往事只能回味，忆童年时竹马青梅，两小无猜，日夜相随，春风又吹红了花蕊，你也已经添了新岁，你就要变心，像时光难倒回，我只有在梦里相依偎。”当时我没见到歌词，把内容听了模模糊糊，最后一句“我只有在梦里相依偎”，我听成“我只好另外找一位”。出狱以后，偶然机会看到歌词，才恍然失笑。但却觉得，我的误听后...
422.四十岁生日一个人过.txt	3		同案八人中，刘辰旦住第六房，与我牢房最近，慢慢熟起来。1975年4月二十五日，我在小房里独自看书，特别是小蕾请她父母送来祝我40岁生日的《生活杂志画册》（The Best Of Life）。忽然班长送进一个生日蛋糕，原来是刘辰旦请他姐姐特地为我买了送来的，刘辰旦的体贴细心，照顾朋友，由此可见。他的姐姐在弟弟受难期间，本来打算把退休金买间小房子的，结果钱都花在救弟弟上面了，房子吹了，她真是一位伟大的姐姐。刘辰旦他们虽然与我同案，但是罪状却你东我西。他们罪状是所谓爆炸案，其实这是冤枉的。在年复一年的囚居里，我慢慢得知：...
423.我在法庭一言不发.txt	9		第一点：关于本案内容部分——我没有话可说，我用法律里面的缄默权。我想我也不必说明我为什么不说话，一千九百四十六年以前，耶稣在被审判的时候，也不说话。
423.我在法庭一言不发.txt	15		第四点：关于所谓爆炸案部分——虽然跟我无关，但我愿为李政一、刘辰旦、吴忠信、郭荣文、詹重雄五个小朋友做他们“人品的证人”，这就是说，我相信他们不是做这种事的人，他们的诬服，是被刑求的结果。我请求审判长先生给他们做无罪的判决（附带声明一声，在进这军法处大门以前，我跟他们并不认识，所以我的请求，可以说是客观的，值得审判长先生参考的）。
424.“有一张坏嘴巴”.txt	3		正因为我看透这一真相，所以，在警备总部军法审判的时候，我是以耶稣姿态出现的，我说了“耶稣受审时，他也没说话”后，就对军法官不屑置一辞，也不请律师代我置一辞。我愿意坐牢，其他不必废话。判决书中说李敖“犯罪事证已甚明确，虽被告于本庭缄默，依《刑事诉讼法》第205条之规定，得不待其陈述，径行判决”，所以有这样的文字，就肇因于此。最可笑的是在审判时，魏廷朝看我一言不发，居然对军法官说：“李敖不讲话，我可不可以替他讲？”我这做耶稣的听了，简直忍不住笑。——这胖子正如李政一所说，“有一张坏嘴巴”，他和谢聪敏不够朋友，硬把我咬成...
425.初判十年.txt	11		警备总部就凭上面这三类罪名，判了我十年大狱。判决日是1972年3月10日，审判长是聂开国、审判官是张玉芳、王云涛。收到判决书后，我拒绝上诉，准备坐它十年。但是军事检察官韩延年说判得太轻了，声请复判。拖了三年半，1975年8月12日才下来，因为赶上蒋介石死了大减刑，所以刑期就短了。“主文”是：
426.复判丢了大官.txt	3		但是，耐人寻味的是，在复判中，这一参与“台湾本部”的重大案件，居然暗中消逝了，最后，反而用了无所附丽的一些浮词，罗织定罪，这是完全站不住的！这一判决后二十一年，我在路上碰到当年整我的保安处处长吴彰炯，他早已退休，改在仁爱路远东百货公司五楼富贵楼当总经理，他约我到他办公室小坐。我问他：“你现在还相信我是台独分子吗？”他笑着说：“你是啊，当时我们的情报你是‘台湾本部’五委员之一啊，你不但是台独分子，并且是大官哩！”我说：“我最后的判决书上，已经完全没有了‘台湾本部’这一事实了，五委员之说，复判时根本被推翻了，我有幸做了...
427.洗脑.txt	3		在判决定谳后，所余刑期只有一年多了。1975年12月22日清早，我突然被通知收拾行李，要移送“仁爱教育实验所”（仁爱庄），就这样的，我从景美移到土城，开始被国民党“仁爱”了。为了优待也为了隔离，我被放到“仁爱教育实验所”中的花园洋房里，开了专班。专班“同学”四人，即李敖、谢聪敏、魏廷朝、李政一，从外请来所谓学者名流给我“上课”，他们是陶涤亚、毛树清、项乃光、周道济、王洸、屠炳春、施敏雄、林钟雄、任卓宣、柴松林、魏萼、乔宝泰、邬昆如等等，每周来“上课”一次，我看不起他们，对他们冷眼相向，一言不发。在两旁“陪太子读书”...
428.五年没看报.txt	3		我第一次做政治犯时候，其间有近五年的时间，甚至《中央日报》都不准看，所以根本不发生被切割的问题。雷震同我说，他坐牢可以看报，但是切割得很厉害，他抗议，监狱负责人说：“有问题的新闻你没权利看。”雷震说：“就算你们说得对，可是你们一切割，背面那一块没问题的也给切掉了，那一块我有权利看啊！”监狱方面没办法，就改用墨来涂，不再切割了。但所谓切割，只是掩耳盗铃而已，重要的新闻，还是不久就可以“补”上。雷震举例说：“李宗仁投共的新闻给切割了，可是过几天看到白崇禧责备李宗仁的新闻，就可以推断出那天被切割的新闻原来是什么了。”台北...
428.五年没看报.txt	5		最后一年可以看《中央日报》了，我把五年的合订本全买来，一本一本看。一天看到小蕾结婚的广告，而丈夫竟是我的朋友。我心情低落好几天。我出狱后，小蕾到我家亲手为我做了一顿饭。饭后在床上，不做解释，她哭了。前年在一家泰国餐厅，她和许多人聚餐，临走时到我餐桌边致意，我拍她肩、又拍她背。小屯奇怪我为什么跟这女人这么亲热。我说：“她就是小蕾啊。”
436.魏胖.txt	3		魏廷朝第一次坐牢时，我写了信，送了钱，被国特追问，我开玩笑说：“别问啦！你们在台湾作恶，我送台湾人点礼，是替你们收买台湾人人心啊！”当时蒋经国曾送钱一千元，交魏廷朝上司中研院近史所所长郭廷以转致，郭廷以也送了五百元，他们送的钱加在一起，也赶不上李敖送的多。——国民党收买人心之手面可知也！固一介匹夫不若也！送款信由郭廷以亲写，后来魏廷朝送了给我，我转送给台独分子林世煜、胡慧玲小两口了，以见外省人花钱术之一斑。
439.谢聪敏（二）.txt	3		我成为台独分子，谢聪敏是一个施展连环套的角色。他和魏廷朝先把我咬进牢里，使官方上当；然后在声势已壮之后、在海内外皆知李敖加入台独活动之后，再设法替李敖翻案，用李敖在文化界的声名，反衬出国民党在如何以冤狱迫害自由作家。这样一来，李敖可被黄鱼两吃，而国民党的害贤之名却又加倍。谢聪敏在牢中替李敖翻案，不是容易的事，因为管制森严。但是一次阴错阳差，使他有了机会。一个日本人小林正成一度住他押房隔壁，在小林被驱逐出境前夜，他抛了一封信由小林带出来，辗转登在《纽约时报》。信披露后，自然使官方灰头土脸。谢聪敏纵在牢中，还能有这种机...
439.谢聪敏（二）.txt	5		信登在《纽约时报》后，官方追查，谢聪敏瞒过由小林带信的真相，反咬了一个班长陈留恨，说信是陈留恨带出的。陈留恨因此被捕，被拷打不已，直到最后查出不是班长而是小林，才真相大白。由于陈留恨对待囚犯极坏，谢聪敏这一乱咬，却也咬得人心大快。谢聪敏被罚带脚镣好几个月，最后取下脚镣时，班长们对他恭贺，他笑嘻嘻地说：“小意思、小意思。”
439.谢聪敏（二）.txt	11		谢聪敏对我说：“彭先生要我不要同李敖来往了，我当然不肯，结果与彭先生也远了。”谢聪敏比这些“台独英雄们”都有情有义多了。虽然他长了一对狼眼。
442.彭明敏泄台独分子的底.txt	5		在美国搅“台湾政治”者（在美国或其他外国，怎能搅“台湾政治”，荒唐之至），煞有介事，其实都是拼命从事你所说的“意淫”而已（而且都是不能达到orgasms）。有的在美搅得声名狼藉，混不下去，便逃回台湾，自称“侨领”或“教授”（在台者不知所谓教授实是在美学界无人看得起的市立野鸡专科学校厮混误人子弟者），在台自立山头，自任“民主运动健将”，继续以似是而非的浅薄言论敛财骗人。在美国搅“中国”或“台湾”政治者，基本上都是con men，利用或abuse侨民“爱乡心”之切，自我膨胀，诈财骗人而已。令人感慨者，古今东西，地球上似...
444.马萨利克的照片.txt	3		直到彭明敏回来一年后，我抵不住陆啸钊的坚邀，才答应三人一起吃一次饭。那天主人陆啸钊和彭明敏先到陶陶园等我，我与彭明敏，在他回来后一年才见面，就是二十四年后才首次见面。我很礼貌的带了一件小礼物送他，那是一个小镜框，中有马萨利克（T. Masaryk）的一张照片。彭明敏很谦虚，他说：“你李先生太博学了，你考倒我了，这位是谁啊？”我说：“他是捷克的国父马萨利克。他是名教授，当年带着学生领导独立运动，流亡海外，1918年他成功了，并且当了总统，1937年87岁时死去。他为捷克打下独立的基础，可是他无法解决与强邻的关系，最后...
445.谢长廷之问.txt	3		与彭明敏反目两年后，谢长廷约我上他主持的《长廷问青天》电视节目，在化妆室聊天时，好奇的问我：“彭先生在书中删去李敖的名字，这事到底是不是彭先生干的？”我说：“不是又怎样？即使是别人干的，事后他纵容别人这样做，又有多次机会去更正、去澄清，他都高姿态不去做，他还怪谁啊？”谢长廷听了，点头一叹。
446.错不在我.txt	3		两次饭局后，我和彭明敏又恢复了不相往来的状态。谢聪敏偶尔与我联络，我多次请他侧面影响影响彭明敏。谢聪敏说：“李敖啊，老彭已经被海外那些新贵们包围啦，连我都讲不进去，也不敢讲话啦！”我笑说：“就是皇帝，也是打到天下后，才清除功臣、不纳忠言呀！怎么还没打到天下，只回台湾得意几天就忘形起来了，连老朋友都冷淡了？这样笨，还搞什么政治？”谢聪敏说：“老彭就是那样，我又有什么办法？”我写这本自传的时候，已经事隔二十多年了，谢聪敏告诉我两点：一、他和彭先生已疏远了。二、他认为彭先生已后悔不应该那样对李敖，“因为李敖一点错都没有。...
450.九字祸源.txt	3		爆破点是这样的：远流出版公司老板王荣文送了他出版的《彭明敏看台湾》等书给我，其中收有“原载于《中国时报》1992年10月14日”的一篇《卜大中专访》——《为毕生理想再尽心力》一文，是专访彭明敏的。该书第35页一段话，使我一震。因为“1992年10月14日”的《中国时报》原文，并不如此。原文在“我赞佩的人当中有提携我的外省籍师长，如胡适先生、萨孟武先生、傅斯年先生等等，也有外省籍好友”和“这说明我绝不是一个狭隘的省籍主义者”之间，明明有九个字，被彭明敏暗中删掉了，这九个字是：“包括反对台独的李敖。”我火了。彭明敏删掉...
452.失之交臂.txt	3		彭明敏1989年4月21日秘密写信给我，大骂他的学生蔡同荣说：“蔡此人实际乱来，应予适当教训。”当然，他口中的“教训”不是情报局局长对江南式的，只是口诛笔伐而已。当谢聪敏感到事情不妙，李敖要把隐忍了三十多年的事写出来“适当教训”的时候，遂有7月5日彭明敏要同我吃饭之举。可是，一切都太迟了，我拒绝了筷子，拿起了笔杆。想当年美国南北战争时，南方总司令李将军（Gen. Robert Lee）手下有位大将杰克逊（Stonewall Jackson），受了重伤，失去左臂。当他受伤时，李将军曾写信给他，说道：“你的情况比我还好...
454.被歪曲了的一段历史.txt	3		我在《李敖电子报》里，写过一篇小文章，《与谢聪敏通话结论》。说电话中我跟他说，当年你和彭明敏、魏廷朝的《台湾人民自救运动宣言》，我仔细读过、统计过，全文并没有鲜明的“台独”或“台湾独立”字样，你们的主调明明是自由民主运动、反蒋运动，今天被解释成台独主调，是与历史不符的。聪敏说：“你说的对，那是自由民主运动、反蒋运动。”我在文章中提到，宣言全部“目标”与“原则”中的四十五条细目中，只有“建设新的国家”与“重新加入联合国”两条，算是有点“台独”的边儿而已，如今各路台独英雄好汉，勇于改写历史，把过去的一切都“台独定位”、...
455.“原来你是温情主义者！”.txt	3		也许有人奇怪，以快意恩仇为人生观的李敖，为何却能忠厚隐忍彭明敏这么多年对他的不仁不义。原因有二：第一、我痛恨国民党，彭明敏有志气不加入国民党，我认为这是很难得的。格于岛国局面，台湾人本来像样的、成材的就不多，我一直珍惜这样的台湾人朋友，我希望他变成台湾的胡适，做最有志气、最有学问、最有高度教养的伟大知识分子。第二、大家只看到我穷凶极恶的一面，却忘了我豁达大度的一面，政治上，我被台独分子诬陷，我不介意。另一方面我又极重感情，老同学刘显叔的太太陈烈看到我写《你不知道的彭明敏》在《商业周刊》前几期的连载，笑着点破：“我现...
456.路遇宿敌吴处长.txt	3		我出狱以后10多年，路遇当年抓我的蒋家鹰犬、警备总司令部保安处处长吴彰炯中将，那时他已退役，在富贵楼餐厅担纲，他约我到他办公室，做了他单方面“相逢一笑泯恩仇”式的长谈。我最后打趣他，我说：“你们军人有‘五大信念’，所谓主义、领袖、国家、责任、荣誉。现在呢，你们革了几十年的命，民族主义等被敌人实行了、领袖死了、国家变成千分之三了、责任扯不清了、荣誉也不好意思说了，全没了，处长啊，你也老了，你输了。”不料他眨眨眼睛，神秘地告诉我：“李先生，我没输，我移民到美国了，我子女都是博士，个个在美成家立业。李先生，我没输！”吴处...
457.毒药与泻药.txt	3		吴处长吴彰炯那时在富贵楼餐厅做总经理。一天，萧启庆、王国璎夫妇请我在富贵楼吃饭。吴彰炯过来拍我肩膀说：“李敖兄，你为什么一直不来我们饭店吃饭？”我说：“我怕你下毒药毒我。”他听了笑着捏我一把，说我胡说，我说：“说下毒药也许重了一点，不过放泻药倒是可能的。”大家都笑了。——这就是人生、这就是人生际遇，这是蒋氏父子留下的血色黄昏。在黄昏中，你的主要敌人都已死去，但他们留下的走狗都只只貌似从良，仿佛跟你一起珍惜夕阳无限之好，人世玄黄乍变，竟离奇如此！
459.吴老师出面.txt	3		1975年9月22日判决确定后，我写了一封秘密的信给吴俊才老师，吴俊才在台大教我《近代印度史》，那时是国民党文工会主任，是当权派。我的信提出一个饵，诱他们放我出国，我再徐图后计，跟国民党算总账。君子报仇，出国不晚。信奏了效，1976年7月23日，我正在“仁爱庄”被洗脑，所方忽然通知我，说保安处派车来，接我去台北一趟。上车后直驶基隆路警备总部招待所客厅，未几吴俊才出现，他说他收到我的信很感动，为国家为学生他都愿出面处理。后来吴俊才再和我见一次面，他说被银行占去的水晶大厦房子部分，他帮忙解决；出国部分，等我出狱后再说；...
460.女职员送聘书.txt	3		1976年11月19日，我第一次政治犯出狱了。这时再过五个月，我就42岁了。由于吴俊才安排我去政治大学国际关系研究中心做副研究员，该中心主任蔡维屏先约见了我，此公是个官僚，虚情假意，像个YMCA（基督教青年会）总干事。言语无味。不久聘书由女职员送来，我说：“副研究员相当于大学副教授，过去按老规矩，聘书都是大学校长亲自送上门的，怎么派女职员送来了？这是哪门子礼遇？”女职员说：“蔡主任最礼遇李先生了，别人的聘书，都是工友送去的。”我听了，恍然大悟，时代已经变得太多了。
461.弃干薪而去.txt	3		我是1976年11月19日服刑五年八个月期满，无保出狱的。出狱后第十一天（12月1日），就有了生平第一个正式职业。那天国关中心主任蔡维屏约我见面，说目前研究大楼的研究室已满，把我安排到总务大楼，用总务主任办公厅对面的房间做研究室，我心知他们要“隔离”我，我笑而受之。国关中心图书馆“匪情资料”甚多，我去借书，我一到，安全室江主任就到，并向女职员们调查我所借何书，我心里有数，一本书也不借。我去国关中心，根本的心态就是应付吴俊才的。到了第二年，吴俊才去萨尔瓦多做大使去了，我趁机坚辞国关中心职务，主任蔡维屏不肯放人。我感觉...
462.辜振甫赔我钱.txt	3		我的经济基础是我坐牢前留下的两户房子，但坐牢时，都被我弟弟不由分说，伙同溺爱他的母亲，私下予以抵押，抵押了又不缴利息，以致鱼烂河决，难以收拾。最后吴俊才老师请保安处出面，保安处转由林家祺个人出面见证，“逼迫”华侨银行以230万买下水晶大厦房子。我代我弟弟还给该行100万欠债后，所余又还了另一户房子的30多万欠债，最后手上不过百万元，靠着这点钱，我计划东山再起。再起的第一场大戏是我查出辜振甫动“中国合成橡胶股份有限公司”股东的手脚，影响我的投资权益，我摆出兴讼姿态。辜振甫挽小姨子华严出面，前来谈判。于是，华严带了她的...
463.严侨死了.txt	7	LAFLZ-078|LAFLZ-079	真实的佛教，颇有高明之处……不过中国的佛徒，十有八九皆十分庸暗，因“广大”之名而引了许多邪神野鬼，此最为可惜。《金刚经》云：佛无有定法可说，无定法者无偶像之成见也。又曰：“无所住而生其心”，无所住，则不为一切法所拘囚，自然日进不已矣。然而无成见、无所住，非无头无脑、无主意之谓，佛之头脑在何处？在智慧，故曰金刚般若波罗密，言智慧如金刚，能摧坏一切愚暗烦恼，令人到彼岸也。故为佛徒而不求智慧，只讲礼拜、烧香、祷告是佛教之大罪人，非佛徒也。虽信得性命不顾，亦非佛徒也。只是邪教而已。
463.严侨死了.txt	9	LAFLZ-080	佛教不拜偶像，《金刚经》说：“若以色见我，以音声求我，是人行邪道，不能见如来。”你做佛教徒，为何行邪道。可惜了！
464.严门四代.txt	5		我总觉得严氏一门，正是中国现代史上最好的家传资料。第一代严复，身逢帝制不绝，志在引进新潮，赍志以没了；第二代严琥，身逢新旧交替，志在富国强兵，家破人亡了；第三代严侨，身逢国共斗争，志在建国大业，自己报废了；第四代严正，身逢国民党在台湾通吃，志在经济挂帅，埋头做白领阶级了。严氏家传的横剖，岂不正是中国现代史的缩影？严侨生不逢时、死不逢地，音容醉貌，长在我心，他一生与中国现代史的横剖关系，绝非他一己之私，因此我在五十之年（1985年4月17日），写下《我最难忘的一位老师》纪念他。这篇文章三年后由大陆《中华英烈》杂志转载...
465.“辜振甫万岁！”.txt	3		辜振甫的200万台币对我有了大改变，除送了二十分之一给严师母，又以二十分之一给了我弟弟外，我以余款买了东丰街一家小店面，后来赶上房地产大涨，使我有了翻一番的本钱，再加上“文字之业”的收入，使我从此立于经济上不败之地。——人间“致富”，可以阴错阳差、时来运转到这一复杂又交错的程度，想来不胜离奇。十多年前，我摄护腺癌，由名医张树人操刀，全身麻醉。事后麻醉师笑着对我说：“李先生，你知道你麻醉醒来第一句话是什么吗？”我问：“是什么？”麻醉师说：“你说的第一句不是话，而是轻喊了一声：‘辜振甫万岁！’”我听了笑开怀。我告诉麻醉...
466.风流余韵.txt	5		昨晚在烛光下，听你四次说到你很快乐，我却不觉得，我觉得你是一个虚度青春的老是想考一百分的问题儿童。你不停止这种“灯之歌”式的人生观，你的下场，一定很悲惨，悲惨得怎么把痣点掉都没用！不过不论怎么悲惨，你将永远冷艳动人，正如你昨晚一样。
466.风流余韵.txt	7		后来李明瑾主持电视节目，从俗以去，我一直为她可惜。金记环球大厦因为在车位上处理失当，我去信抗议，他们央求我的旧识黎昌意出面解决，最后以20万买了我收藏的一点字画，双方解约了事。后来建筑界在车位上特别明订权利归属，市井盛传此乃“李敖条款”云。
