score	file	line	text	context
8	138.如此春蚕，如此吐丝.txt	167	像这种光景，你看能不能去？	同一天晚八时半，历史系主任许倬云来访，说：“海耶克教授住在统一饭店，约殷先生往谈。请定一个时间。”我就把今天下午所发生的事情之经过告诉他，并问：“像这种光景，你看能不能去？”于是，约谈的事被打消了。
7	138.如此春蚕，如此吐丝.txt	167	海耶克教授住在统一饭店，约殷先生往谈。请定一个时间。	同一天晚八时半，历史系主任许倬云来访，说：“海耶克教授住在统一饭店，约殷先生往谈。请定一个时间。”我就把今天下午所发生的事情之经过告诉他，并问：“像这种光景，你看能不能去？”于是，约谈的事被打消了。
4	138.如此春蚕，如此吐丝.txt	175	还是把殷放走吧！因为他如能出国，该是政府有自由的最好人证，是划得来，得可偿失的。	……四月二十五日由宏恩〔医院〕转到台大医院。宏恩费用由李敖负担。五月一日在台大手术，胃切掉了三分之二。五月十四日出院。五月美国哈佛大学决定聘请殷到哈佛与史华慈教授研究中国近代思想史。开始办理出国手续，但直至逝世一直未获出境。为此事李敖七月向有关方面暗示：“还是把殷放走吧！因为他如能出国，该是政府有自由的最好人证，是划得来，得可偿失的。”七月接到台大续聘书，但...
5	138.如此春蚕，如此吐丝.txt	183	哥哥灵魂不远，今日兄弟与你报仇雪恨！	《水浒传》记武松替那“死得好苦”的哥哥报仇，洒泪道：“哥哥灵魂不远，今日兄弟与你报仇雪恨！”我今年陆续发表这些纪念殷海光的文字，目的无他，就是要揭发伪君子们的真面目，替“死得好苦”的殷海光“报仇雪恨”。——我就是这么干脆、血性而有火气，我就是这样写出来了！
4	139.有恩于林正杰的下场.txt	3	林正杰有一个特色，他是党外人士中最像蒋介石的。	张春男去北京前一年，他和许荣淑、纪万生等人到我家来，谈话中顺便提到林正杰。张春男笑着打趣说：“林正杰有一个特色，他是党外人士中最像蒋介石的。”我们听了，会心一笑。
4	139.有恩于林正杰的下场.txt	7	‘言行不一’的林正杰，我们不必支持他	一九八五年十一月四日，郑南榕在《民主天地》周刊发表了一篇文章，叫做“‘言行不一’的林正杰，我们不必支持他”，把林正杰拆穿。郑南榕这篇文章有一段是这样说的：“林正杰的糟糕已极之处，就是他太爱耍权术！太爱玩谋略了！当他需要你的时候，哄得你心花怒放；但是当他觉得你对他构成威胁了，或是觉得不再需要你了，他就会不遗余力的来打击你、丑化你。”
3	139.有恩于林正杰的下场.txt	7	林正杰的糟糕已极之处，就是他太爱耍权术！太爱玩谋略了！当他需要你的时候，哄得你心花怒放；但是当他觉得你对他构成威胁了，或是觉得不再需要你了，他就会不遗余力的来打击你、丑化你。	一九八五年十一月四日，郑南榕在《民主天地》周刊发表了一篇文章，叫做“‘言行不一’的林正杰，我们不必支持他”，把林正杰拆穿。郑南榕这篇文章有一段是这样说的：“林正杰的糟糕已极之处，就是他太爱耍权术！太爱玩谋略了！当他需要你的时候，哄得你心花怒放；但是当他觉得你对他构成威胁了，或是觉得不再需要你了，他就会不遗余力的来打击你、丑化你。”
8	139.有恩于林正杰的下场.txt	11	与党外新生代所办刊物，……联手打击魔鬼	看了这些大捧特捧的话，谁能想到，同一个林正杰，在两个月后，在同样的白纸黑字上，却对恩人恶言相向了。两个月前，白纸黑字还夸奖我“炮口朝内”呢！两个月后，却责备我“刀口向内”了；两个月前，还歌颂我“与党外新生代所办刊物，……联手打击魔鬼”呢！两个月后，却挖苦我不“互相扶持、同舟共济”了；两个月前，还呼吁“发育中的党外”要“应多参考”李敖的文章，“避免成为类似当前...
8	139.有恩于林正杰的下场.txt	11	互相扶持、同舟共济	看了这些大捧特捧的话，谁能想到，同一个林正杰，在两个月后，在同样的白纸黑字上，却对恩人恶言相向了。两个月前，白纸黑字还夸奖我“炮口朝内”呢！两个月后，却责备我“刀口向内”了；两个月前，还歌颂我“与党外新生代所办刊物，……联手打击魔鬼”呢！两个月后，却挖苦我不“互相扶持、同舟共济”了；两个月前，还呼吁“发育中的党外”要“应多参考”李敖的文章，“避免成为类似当前...
6	139.有恩于林正杰的下场.txt	11	避免成为类似当前官场的小格局政客	看了这些大捧特捧的话，谁能想到，同一个林正杰，在两个月后，在同样的白纸黑字上，却对恩人恶言相向了。两个月前，白纸黑字还夸奖我“炮口朝内”呢！两个月后，却责备我“刀口向内”了；两个月前，还歌颂我“与党外新生代所办刊物，……联手打击魔鬼”呢！两个月后，却挖苦我不“互相扶持、同舟共济”了；两个月前，还呼吁“发育中的党外”要“应多参考”李敖的文章，“避免成为类似当前...
3	139.有恩于林正杰的下场.txt	11	炮口朝内	看了这些大捧特捧的话，谁能想到，同一个林正杰，在两个月后，在同样的白纸黑字上，却对恩人恶言相向了。两个月前，白纸黑字还夸奖我“炮口朝内”呢！两个月后，却责备我“刀口向内”了；两个月前，还歌颂我“与党外新生代所办刊物，……联手打击魔鬼”呢！两个月后，却挖苦我不“互相扶持、同舟共济”了；两个月前，还呼吁“发育中的党外”要“应多参考”李敖的文章，“避免成为类似当前...
3	139.有恩于林正杰的下场.txt	11	刀口向内	看了这些大捧特捧的话，谁能想到，同一个林正杰，在两个月后，在同样的白纸黑字上，却对恩人恶言相向了。两个月前，白纸黑字还夸奖我“炮口朝内”呢！两个月后，却责备我“刀口向内”了；两个月前，还歌颂我“与党外新生代所办刊物，……联手打击魔鬼”呢！两个月后，却挖苦我不“互相扶持、同舟共济”了；两个月前，还呼吁“发育中的党外”要“应多参考”李敖的文章，“避免成为类似当前...
3	139.有恩于林正杰的下场.txt	11	发育中的党外	看了这些大捧特捧的话，谁能想到，同一个林正杰，在两个月后，在同样的白纸黑字上，却对恩人恶言相向了。两个月前，白纸黑字还夸奖我“炮口朝内”呢！两个月后，却责备我“刀口向内”了；两个月前，还歌颂我“与党外新生代所办刊物，……联手打击魔鬼”呢！两个月后，却挖苦我不“互相扶持、同舟共济”了；两个月前，还呼吁“发育中的党外”要“应多参考”李敖的文章，“避免成为类似当前...
3	139.有恩于林正杰的下场.txt	11	应多参考	看了这些大捧特捧的话，谁能想到，同一个林正杰，在两个月后，在同样的白纸黑字上，却对恩人恶言相向了。两个月前，白纸黑字还夸奖我“炮口朝内”呢！两个月后，却责备我“刀口向内”了；两个月前，还歌颂我“与党外新生代所办刊物，……联手打击魔鬼”呢！两个月后，却挖苦我不“互相扶持、同舟共济”了；两个月前，还呼吁“发育中的党外”要“应多参考”李敖的文章，“避免成为类似当前...
3	139.有恩于林正杰的下场.txt	11	不识大体	看了这些大捧特捧的话，谁能想到，同一个林正杰，在两个月后，在同样的白纸黑字上，却对恩人恶言相向了。两个月前，白纸黑字还夸奖我“炮口朝内”呢！两个月后，却责备我“刀口向内”了；两个月前，还歌颂我“与党外新生代所办刊物，……联手打击魔鬼”呢！两个月后，却挖苦我不“互相扶持、同舟共济”了；两个月前，还呼吁“发育中的党外”要“应多参考”李敖的文章，“避免成为类似当前...
3	139.有恩于林正杰的下场.txt	11	政客	看了这些大捧特捧的话，谁能想到，同一个林正杰，在两个月后，在同样的白纸黑字上，却对恩人恶言相向了。两个月前，白纸黑字还夸奖我“炮口朝内”呢！两个月后，却责备我“刀口向内”了；两个月前，还歌颂我“与党外新生代所办刊物，……联手打击魔鬼”呢！两个月后，却挖苦我不“互相扶持、同舟共济”了；两个月前，还呼吁“发育中的党外”要“应多参考”李敖的文章，“避免成为类似当前...
3	139.有恩于林正杰的下场.txt	11	侠骨豪情	看了这些大捧特捧的话，谁能想到，同一个林正杰，在两个月后，在同样的白纸黑字上，却对恩人恶言相向了。两个月前，白纸黑字还夸奖我“炮口朝内”呢！两个月后，却责备我“刀口向内”了；两个月前，还歌颂我“与党外新生代所办刊物，……联手打击魔鬼”呢！两个月后，却挖苦我不“互相扶持、同舟共济”了；两个月前，还呼吁“发育中的党外”要“应多参考”李敖的文章，“避免成为类似当前...
6	139.有恩于林正杰的下场.txt	13	李大哥：……您有恩于前进	其实，这还算是客气的呢！两个月后之后，林正杰索性联合起国民党特务，干脆用造谣诽谤的法子，甚至用捏造法院判决书、捏造文献会图片等法子，用来斗臭恩人了。一九八六年五月二日，蔡仁坚写信给我，坦承“李大哥：……您有恩于前进”，但是“有恩”的下场，就是动员《前进》杂志一连四个月三十个星期的对恩人展开造谣诽谤！这种是非品质与道德品质、这种高速的忘恩负义与过河拆桥，我纵观...
4	140.中毒的主义·主义的中毒.txt	5	三民主义既不修正消除共产毒素，大专院校应即暂停再教国父思想。	周之鸣先生大作的重点是：一九五二年四月间，蒋介石公开说共产主义是有“毒素”的；一九七八年十一月间，蒋经国公开说共产主义是“有毒”的。但三民主义中又大量中了共产主义的毒，“三民主义既不修正消除共产毒素，大专院校应即暂停再教国父思想。”
8	140.中毒的主义·主义的中毒.txt	7	民生主义就是社会主义，又名共产主义	由于三民主义中明明有“民生主义就是共产主义”的话，令国民党头痛万分，因思有以解决。乃有国民党党史会主任委员罗家伦提出建议，要求以所谓新发现的“国父手订本”为依据，来反证、来脱困。原来三民主义一书，除了一九二四年演讲纪录稿的现行本，一九四三年间，国民党党史会又找到另一本亦是当年纪录的所谓手订本（一称手改本），两种版本，间有差异，其中现行本民生主义第一讲中，内有...
8	140.中毒的主义·主义的中毒.txt	7	民生主义就是用来替代社会主义，并用来包括社会主义外之附属问题，这便是民生主义之定义	由于三民主义中明明有“民生主义就是共产主义”的话，令国民党头痛万分，因思有以解决。乃有国民党党史会主任委员罗家伦提出建议，要求以所谓新发现的“国父手订本”为依据，来反证、来脱困。原来三民主义一书，除了一九二四年演讲纪录稿的现行本，一九四三年间，国民党党史会又找到另一本亦是当年纪录的所谓手订本（一称手改本），两种版本，间有差异，其中现行本民生主义第一讲中，内有...
8	140.中毒的主义·主义的中毒.txt	7	此总理手改本之原文，可以解除一切曲解之纠纷，与本党历年对此问题所受之困扰	由于三民主义中明明有“民生主义就是共产主义”的话，令国民党头痛万分，因思有以解决。乃有国民党党史会主任委员罗家伦提出建议，要求以所谓新发现的“国父手订本”为依据，来反证、来脱困。原来三民主义一书，除了一九二四年演讲纪录稿的现行本，一九四三年间，国民党党史会又找到另一本亦是当年纪录的所谓手订本（一称手改本），两种版本，间有差异，其中现行本民生主义第一讲中，内有...
6	140.中毒的主义·主义的中毒.txt	7	民生主义就是共产主义	由于三民主义中明明有“民生主义就是共产主义”的话，令国民党头痛万分，因思有以解决。乃有国民党党史会主任委员罗家伦提出建议，要求以所谓新发现的“国父手订本”为依据，来反证、来脱困。原来三民主义一书，除了一九二四年演讲纪录稿的现行本，一九四三年间，国民党党史会又找到另一本亦是当年纪录的所谓手订本（一称手改本），两种版本，间有差异，其中现行本民生主义第一讲中，内有...
6	140.中毒的主义·主义的中毒.txt	7	何等重要！‘替代’二字尤为重要，因其与通行本所用‘就是’意义完全不同。而且总理在此处连共产主义亦未提到，尤可注意	由于三民主义中明明有“民生主义就是共产主义”的话，令国民党头痛万分，因思有以解决。乃有国民党党史会主任委员罗家伦提出建议，要求以所谓新发现的“国父手订本”为依据，来反证、来脱困。原来三民主义一书，除了一九二四年演讲纪录稿的现行本，一九四三年间，国民党党史会又找到另一本亦是当年纪录的所谓手订本（一称手改本），两种版本，间有差异，其中现行本民生主义第一讲中，内有...
4	140.中毒的主义·主义的中毒.txt	7	国父手订本	由于三民主义中明明有“民生主义就是共产主义”的话，令国民党头痛万分，因思有以解决。乃有国民党党史会主任委员罗家伦提出建议，要求以所谓新发现的“国父手订本”为依据，来反证、来脱困。原来三民主义一书，除了一九二四年演讲纪录稿的现行本，一九四三年间，国民党党史会又找到另一本亦是当年纪录的所谓手订本（一称手改本），两种版本，间有差异，其中现行本民生主义第一讲中，内有...
3	140.中毒的主义·主义的中毒.txt	7	亲笔改正	由于三民主义中明明有“民生主义就是共产主义”的话，令国民党头痛万分，因思有以解决。乃有国民党党史会主任委员罗家伦提出建议，要求以所谓新发现的“国父手订本”为依据，来反证、来脱困。原来三民主义一书，除了一九二四年演讲纪录稿的现行本，一九四三年间，国民党党史会又找到另一本亦是当年纪录的所谓手订本（一称手改本），两种版本，间有差异，其中现行本民生主义第一讲中，内有...
5	140.中毒的主义·主义的中毒.txt	9	可拟呈审查人员名单核定后，审查修正可也	蒋介石虽然为之心动，并批示“可拟呈审查人员名单核定后，审查修正可也”，及“对民生主义之解释等项，应依照总理手改本三民主义原稿审查修正”。但是兹事体大，拖到今天，国民党还不敢大刀阔斧也。
5	140.中毒的主义·主义的中毒.txt	9	对民生主义之解释等项，应依照总理手改本三民主义原稿审查修正	蒋介石虽然为之心动，并批示“可拟呈审查人员名单核定后，审查修正可也”，及“对民生主义之解释等项，应依照总理手改本三民主义原稿审查修正”。但是兹事体大，拖到今天，国民党还不敢大刀阔斧也。
6	140.中毒的主义·主义的中毒.txt	11	所谓修正，无论是依照手改本三民主义以解释民生主义定义，或将现行本作废而以手改本代替之，是否能够彻底消除所有共产主义毒素，严格划清敌我思想界限，殊多疑义。	周之鸣先生的研究结论很逗。他说：“所谓修正，无论是依照手改本三民主义以解释民生主义定义，或将现行本作废而以手改本代替之，是否能够彻底消除所有共产主义毒素，严格划清敌我思想界限，殊多疑义。”“虽然可以修正民生主义定义，消除其中共产毒素，国父全书的其他部分，仍有不少共产毒素存在。且据笔者多年细心审查结果，全书中显有共产主义或布尔什维克毒素者，多达一、二百处以上，...
6	140.中毒的主义·主义的中毒.txt	11	虽然可以修正民生主义定义，消除其中共产毒素，国父全书的其他部分，仍有不少共产毒素存在。且据笔者多年细心审查结果，全书中显有共产主义或布尔什维克毒素者，多达一、二百处以上，所谓修正谈何容易。	周之鸣先生的研究结论很逗。他说：“所谓修正，无论是依照手改本三民主义以解释民生主义定义，或将现行本作废而以手改本代替之，是否能够彻底消除所有共产主义毒素，严格划清敌我思想界限，殊多疑义。”“虽然可以修正民生主义定义，消除其中共产毒素，国父全书的其他部分，仍有不少共产毒素存在。且据笔者多年细心审查结果，全书中显有共产主义或布尔什维克毒素者，多达一、二百处以上，...
6	140.中毒的主义·主义的中毒.txt	11	国民党中央既已停止修正，为求不再自我宣传并培养繁殖共产毒素，严重损坏我原为坚决反共的政党、政府、国家的光荣、美好形象，尤其在今中共因天安门事件，已成过街老鼠、人人喊打之际，为表示与中共真正划清敌我思想界限，笔者以为执政党与其领导政府，第一件应该做的事，似乎即为从速决定所有大专院校及高中，从下学期起，暂停再教含有共产主义，尤其布尔什维克毒素之国父思想与三民主义。	周之鸣先生的研究结论很逗。他说：“所谓修正，无论是依照手改本三民主义以解释民生主义定义，或将现行本作废而以手改本代替之，是否能够彻底消除所有共产主义毒素，严格划清敌我思想界限，殊多疑义。”“虽然可以修正民生主义定义，消除其中共产毒素，国父全书的其他部分，仍有不少共产毒素存在。且据笔者多年细心审查结果，全书中显有共产主义或布尔什维克毒素者，多达一、二百处以上，...
6	140.中毒的主义·主义的中毒.txt	13	国父遗教与三民主义	周之鸣先生的见解，虽然在小地方难脱党政立场，但在大方向上，他勇敢的指出所谓“国父遗教与三民主义”，其实已是毒性大发之身，他以专家的资格，呼吁此路不通，尤其值得我们重视。
8	140.中毒的主义·主义的中毒.txt	15	多研究些问题，少谈些主义	七十年前，中国的先知者胡适就提出“多研究些问题，少谈些主义”的看法，可是国民党头脑不清，强抱主义以肆其革命，不料所抱者竟是中毒的主义，至今暗中叫苦。其实治国平天下，自有正道可循，真正民主国家，固无靠什么主义者也。只有专制的国家才犯主义的中毒，认为主义是万灵丹，可以包医百病，真是异想天开。多年前周德伟跟我笑任卓宣，说：“国民党这些党棍，没主义就不能活！他背弃了...
7	140.中毒的主义·主义的中毒.txt	15	国民党这些党棍，没主义就不能活！他背弃了共产主义，又依靠三民主义了。	七十年前，中国的先知者胡适就提出“多研究些问题，少谈些主义”的看法，可是国民党头脑不清，强抱主义以肆其革命，不料所抱者竟是中毒的主义，至今暗中叫苦。其实治国平天下，自有正道可循，真正民主国家，固无靠什么主义者也。只有专制的国家才犯主义的中毒，认为主义是万灵丹，可以包医百病，真是异想天开。多年前周德伟跟我笑任卓宣，说：“国民党这些党棍，没主义就不能活！他背弃了...
5	141.拉杂又有“不亦快哉”.txt	51	一脸横肉，扑人而来	其一：拆穿柏杨老婆，指其“一脸横肉，扑人而来”，不亦快哉！
3	142.孙中山只信基督教吗？.txt	3	国父孙中山先生，于民国五年八月，与同志胡汉民等诸先生来山，在佛顶山，国父亲睹灵异，兹录其亲笔所记之《游普陀志奇》原文于下，以证明有仙佛的存在。	胡基峻老弟寄来一页“中山真人之见证”的影印本，上有《国父游南海普陀山亲见大士现金身》一文，文前有说明如下：“国父孙中山先生，于民国五年八月，与同志胡汉民等诸先生来山，在佛顶山，国父亲睹灵异，兹录其亲笔所记之《游普陀志奇》原文于下，以证明有仙佛的存在。”
4	142.孙中山只信基督教吗？.txt	7	国父游普陀山亲见观世音菩萨现身，其灵异事迹录存志奇书内，本所九智杂志曾经刊登报导，请来函索取	胡基峻老弟寄来的这页“中山真人之见证”，收在台湾妙文出版社出版的《大道真理图说》一书中（一九八六年一月十五日出版）。其实这篇孙中山的杰作，在台湾的迷信宣传品中，别有流传，并不限于这册《大道真理图说》中。例如九月二十一日的民众日报上，就有玉玺星相传播研究所的《通灵大法函授教材》广告，中有“宗教与伟人”一节，内容就有“国父游普陀山亲见观世音菩萨现身，其灵异事迹录...
3	142.孙中山只信基督教吗？.txt	13	世上宗教甚夥，有野蛮之宗教，有文明之宗教。我国偶像遍地，异端尚盛，未能一律崇奉一尊之宗教。今幸有西方教士为先觉，以开导吾国。惟愿将来全国皆钦崇至尊全能之宗教，以补民国政令之不逮。	一九一二年，孙中山在法教堂欢迎会上演讲，说：“世上宗教甚夥，有野蛮之宗教，有文明之宗教。我国偶像遍地，异端尚盛，未能一律崇奉一尊之宗教。今幸有西方教士为先觉，以开导吾国。惟愿将来全国皆钦崇至尊全能之宗教，以补民国政令之不逮。”谁能想到，他孙中山自己，却在五年后，却“野蛮”如此了。谁说孙中山只信基督教？
4	143.忠狗的哀鸣.txt	3	蒋家天下陈家党	“蒋家天下陈家党”，这是中国现代政治的一句人所咸知的真话。陈家党的陈家是陈果夫、陈立夫兄弟，所谓CC是也。陈氏兄弟的父亲是陈其业，就是陈勤士；陈勤士的弟弟是大名鼎鼎的陈其美，就是陈英士，蒋介石的拜把大哥。正因为陈家与蒋介石关系极深，所以情交两代，互相提拔，共同抢天下，其中不可告人之事多多，吾人所知者，九牛一毛耳。
3	143.忠狗的哀鸣.txt	15	……所以至今日，皆赖父兄抚顾、总裁蒋公栽植之恩。不孝无似，无以报党国，深负父兄矣！大陆沦匪，三弟民夫不及相从，不孝随亦远游异邦，兄之死，不遑归；父老不及养。……	一九六一年三月十五日，九十一岁的陈勤士死在台湾，死前蒋介石准陈立夫回来二十天，匆匆而来，匆匆而去，避嫌拒客，忧谗畏讥。他在家奠祭文中对他老子说：“……所以至今日，皆赖父兄抚顾、总裁蒋公栽植之恩。不孝无似，无以报党国，深负父兄矣！大陆沦匪，三弟民夫不及相从，不孝随亦远游异邦，兄之死，不遑归；父老不及养。……”革命革到这步骨肉分离的田地，还感皇恩不绝，此非忠狗而...
5	143.忠狗的哀鸣.txt	17	望早回国，愈早愈好	陈立夫的家奠祭文，收在《陈勤士先生哀思录》里，后世的历史家读来，绝对想不到，害他骨肉分离的，不是别人，正是“栽植之恩”的总裁！同样的，后世的历史家看到“总统蒋公墨宝”中写给“立夫同志”的信（一九六七年九月十二日），看到其中“望早回国，愈早愈好”的话，也绝对想不到这么亲切的叮咛者，竟是把陈立夫赶出国门的同一人！
7	144.给段宏俊上一课.txt	3	参选是一个公民应享的权利。干涉别人的参选与否，是不民主的行为	我在六月二十二日写《李庆华与生殖器政治》，指出：从正常的民主社会看，李庆华所谓的“参选是一个公民应享的权利。干涉别人的参选与否，是不民主的行为”，这话没错。但是，李庆华他老子刚由中央党部秘书长转任行政院长，又兼中央辅选小组召集人，纵李焕本人一本至公大义灭亲，明说不帮他儿子，但从龙附凤之徒，又岂能就此赴义而把李焕的至亲灭掉？所以，李庆华出来参选，是形式上十足“...
