score	file	line	text	context
6	002.为《播种者胡适》翻旧账.txt	1051	如果郑先生真读了那两首诗，也许可以发现老胡真正的‘心愿’所在，那种‘我们要造反了！’（《威权》）‘我们又来了！’（《乐观》）的气概，好像不是‘不便公开发表’的！	李敖说：“如果郑先生真读了那两首诗，也许可以发现老胡真正的‘心愿’所在，那种‘我们要造反了！’（《威权》）‘我们又来了！’（《乐观》）的气概，好像不是‘不便公开发表’的！”（53期60页）李敖先生，我再读这两首诗，一些也未曾“发现”它俩和陈独秀出狱有什么关系。如果硬说有关系，那也是闪闪烁烁地说着：这又说明他太识“时务”了。至于说：胡适们“要造反了！”，历史指...
6	002.为《播种者胡适》翻旧账.txt	1051	要造反了！	李敖说：“如果郑先生真读了那两首诗，也许可以发现老胡真正的‘心愿’所在，那种‘我们要造反了！’（《威权》）‘我们又来了！’（《乐观》）的气概，好像不是‘不便公开发表’的！”（53期60页）李敖先生，我再读这两首诗，一些也未曾“发现”它俩和陈独秀出狱有什么关系。如果硬说有关系，那也是闪闪烁烁地说着：这又说明他太识“时务”了。至于说：胡适们“要造反了！”，历史指...
4	002.为《播种者胡适》翻旧账.txt	1051	好人政府	李敖说：“如果郑先生真读了那两首诗，也许可以发现老胡真正的‘心愿’所在，那种‘我们要造反了！’（《威权》）‘我们又来了！’（《乐观》）的气概，好像不是‘不便公开发表’的！”（53期60页）李敖先生，我再读这两首诗，一些也未曾“发现”它俩和陈独秀出狱有什么关系。如果硬说有关系，那也是闪闪烁烁地说着：这又说明他太识“时务”了。至于说：胡适们“要造反了！”，历史指...
3	002.为《播种者胡适》翻旧账.txt	1051	老胡	李敖说：“如果郑先生真读了那两首诗，也许可以发现老胡真正的‘心愿’所在，那种‘我们要造反了！’（《威权》）‘我们又来了！’（《乐观》）的气概，好像不是‘不便公开发表’的！”（53期60页）李敖先生，我再读这两首诗，一些也未曾“发现”它俩和陈独秀出狱有什么关系。如果硬说有关系，那也是闪闪烁烁地说着：这又说明他太识“时务”了。至于说：胡适们“要造反了！”，历史指...
8	002.为《播种者胡适》翻旧账.txt	1055	突然替胡适辩起来，真有趣！	“拙文”说：“胡适当时对反孔的论战，是取旁观者的立场，只在后来为吴虞文录写序恭维战胜者吴氏为只手打倒孔家店的英雄这句话，使他后来蒙了反孔的不白之冤！”（52期27页）李敖说我和叶青先生“突然替胡适辩起来，真有趣！”后面他引胡写的《吴虞文录序》，证明胡适是反孔。
7	002.为《播种者胡适》翻旧账.txt	1055	胡适当时对反孔的论战，是取旁观者的立场，只在后来为吴虞文录写序恭维战胜者吴氏为只手打倒孔家店的英雄这句话，使他后来蒙了反孔的不白之冤！	“拙文”说：“胡适当时对反孔的论战，是取旁观者的立场，只在后来为吴虞文录写序恭维战胜者吴氏为只手打倒孔家店的英雄这句话，使他后来蒙了反孔的不白之冤！”（52期27页）李敖说我和叶青先生“突然替胡适辩起来，真有趣！”后面他引胡写的《吴虞文录序》，证明胡适是反孔。
3	002.为《播种者胡适》翻旧账.txt	1057	百非而无一是	《吴虞文录序》写于1921年6月16日，而“反孔”的大浪潮是1917年（见52期“拙文”的“表”）。这等于说，胡适在“孔教”倒后，跟别人后面当啦啦队。后来胡氏忏悔地以孔子比耶稣基督，而且比得好。李敖先生，我和叶先生的话并没有说错。为胡适鸣不白之冤，等于我指出主张以白话文为汉语拼音化过渡的胡适，被实行者毛泽东们骂为“百非而无一是”，同是正确的。难道我们为了胡适...
8	002.为《播种者胡适》翻旧账.txt	1061	褪了色的诗人、一个落了伍的外交家	高明的读者诸君，由前九节的分析，早已知道李敖是何种青年。就道德（不管是旧的、新的和西化的）说来，他是会使卢那察尔斯基（lunacharsky）笔下的桑戈·潘查流泪的。因为他先对中央研究院院长胡适博士似行三跪九叩礼，尊胡博士为“我们思想界的伟大领袖”，马上站起来，指他的“伟大领袖”的鼻子说：“老胡”，你不通，你不是哲学家兼史学家，你是“褪了色的诗人、一个落了伍...
8	002.为《播种者胡适》翻旧账.txt	1061	流露着一股愤愤之气，偶尔激动得很厉害	高明的读者诸君，由前九节的分析，早已知道李敖是何种青年。就道德（不管是旧的、新的和西化的）说来，他是会使卢那察尔斯基（lunacharsky）笔下的桑戈·潘查流泪的。因为他先对中央研究院院长胡适博士似行三跪九叩礼，尊胡博士为“我们思想界的伟大领袖”，马上站起来，指他的“伟大领袖”的鼻子说：“老胡”，你不通，你不是哲学家兼史学家，你是“褪了色的诗人、一个落了伍...
5	002.为《播种者胡适》翻旧账.txt	1061	我们思想界的伟大领袖	高明的读者诸君，由前九节的分析，早已知道李敖是何种青年。就道德（不管是旧的、新的和西化的）说来，他是会使卢那察尔斯基（lunacharsky）笔下的桑戈·潘查流泪的。因为他先对中央研究院院长胡适博士似行三跪九叩礼，尊胡博士为“我们思想界的伟大领袖”，马上站起来，指他的“伟大领袖”的鼻子说：“老胡”，你不通，你不是哲学家兼史学家，你是“褪了色的诗人、一个落了伍...
4	002.为《播种者胡适》翻旧账.txt	1061	发泄痛恨	高明的读者诸君，由前九节的分析，早已知道李敖是何种青年。就道德（不管是旧的、新的和西化的）说来，他是会使卢那察尔斯基（lunacharsky）笔下的桑戈·潘查流泪的。因为他先对中央研究院院长胡适博士似行三跪九叩礼，尊胡博士为“我们思想界的伟大领袖”，马上站起来，指他的“伟大领袖”的鼻子说：“老胡”，你不通，你不是哲学家兼史学家，你是“褪了色的诗人、一个落了伍...
3	002.为《播种者胡适》翻旧账.txt	1061	伟大领袖	高明的读者诸君，由前九节的分析，早已知道李敖是何种青年。就道德（不管是旧的、新的和西化的）说来，他是会使卢那察尔斯基（lunacharsky）笔下的桑戈·潘查流泪的。因为他先对中央研究院院长胡适博士似行三跪九叩礼，尊胡博士为“我们思想界的伟大领袖”，马上站起来，指他的“伟大领袖”的鼻子说：“老胡”，你不通，你不是哲学家兼史学家，你是“褪了色的诗人、一个落了伍...
3	002.为《播种者胡适》翻旧账.txt	1061	老胡	高明的读者诸君，由前九节的分析，早已知道李敖是何种青年。就道德（不管是旧的、新的和西化的）说来，他是会使卢那察尔斯基（lunacharsky）笔下的桑戈·潘查流泪的。因为他先对中央研究院院长胡适博士似行三跪九叩礼，尊胡博士为“我们思想界的伟大领袖”，马上站起来，指他的“伟大领袖”的鼻子说：“老胡”，你不通，你不是哲学家兼史学家，你是“褪了色的诗人、一个落了伍...
3	002.为《播种者胡适》翻旧账.txt	1061	四十一个	高明的读者诸君，由前九节的分析，早已知道李敖是何种青年。就道德（不管是旧的、新的和西化的）说来，他是会使卢那察尔斯基（lunacharsky）笔下的桑戈·潘查流泪的。因为他先对中央研究院院长胡适博士似行三跪九叩礼，尊胡博士为“我们思想界的伟大领袖”，马上站起来，指他的“伟大领袖”的鼻子说：“老胡”，你不通，你不是哲学家兼史学家，你是“褪了色的诗人、一个落了伍...
3	002.为《播种者胡适》翻旧账.txt	1061	原始资料	高明的读者诸君，由前九节的分析，早已知道李敖是何种青年。就道德（不管是旧的、新的和西化的）说来，他是会使卢那察尔斯基（lunacharsky）笔下的桑戈·潘查流泪的。因为他先对中央研究院院长胡适博士似行三跪九叩礼，尊胡博士为“我们思想界的伟大领袖”，马上站起来，指他的“伟大领袖”的鼻子说：“老胡”，你不通，你不是哲学家兼史学家，你是“褪了色的诗人、一个落了伍...
3	002.为《播种者胡适》翻旧账.txt	1061	表现‘仁之端’	高明的读者诸君，由前九节的分析，早已知道李敖是何种青年。就道德（不管是旧的、新的和西化的）说来，他是会使卢那察尔斯基（lunacharsky）笔下的桑戈·潘查流泪的。因为他先对中央研究院院长胡适博士似行三跪九叩礼，尊胡博士为“我们思想界的伟大领袖”，马上站起来，指他的“伟大领袖”的鼻子说：“老胡”，你不通，你不是哲学家兼史学家，你是“褪了色的诗人、一个落了伍...
3	002.为《播种者胡适》翻旧账.txt	1061	痛恨	高明的读者诸君，由前九节的分析，早已知道李敖是何种青年。就道德（不管是旧的、新的和西化的）说来，他是会使卢那察尔斯基（lunacharsky）笔下的桑戈·潘查流泪的。因为他先对中央研究院院长胡适博士似行三跪九叩礼，尊胡博士为“我们思想界的伟大领袖”，马上站起来，指他的“伟大领袖”的鼻子说：“老胡”，你不通，你不是哲学家兼史学家，你是“褪了色的诗人、一个落了伍...
3	002.为《播种者胡适》翻旧账.txt	1061	恨	高明的读者诸君，由前九节的分析，早已知道李敖是何种青年。就道德（不管是旧的、新的和西化的）说来，他是会使卢那察尔斯基（lunacharsky）笔下的桑戈·潘查流泪的。因为他先对中央研究院院长胡适博士似行三跪九叩礼，尊胡博士为“我们思想界的伟大领袖”，马上站起来，指他的“伟大领袖”的鼻子说：“老胡”，你不通，你不是哲学家兼史学家，你是“褪了色的诗人、一个落了伍...
3	002.为《播种者胡适》翻旧账.txt	1061	拿出证据	高明的读者诸君，由前九节的分析，早已知道李敖是何种青年。就道德（不管是旧的、新的和西化的）说来，他是会使卢那察尔斯基（lunacharsky）笔下的桑戈·潘查流泪的。因为他先对中央研究院院长胡适博士似行三跪九叩礼，尊胡博士为“我们思想界的伟大领袖”，马上站起来，指他的“伟大领袖”的鼻子说：“老胡”，你不通，你不是哲学家兼史学家，你是“褪了色的诗人、一个落了伍...
7	002.为《播种者胡适》翻旧账.txt	1065	胡适先生见你在《祖国》关于中共问题的论文，认为是有学问的人写的。……	高明的读者诸君：在我发表“拙文”之前，未写专文批判胡博士；就是我口头上对胡博士的批判，是当面的。我的日记有这记载：1959年2月17日下午由办公处回来，稍息。中研院总干事全汉升先生乘轿车来，寒喧后，他说：“胡适先生见你在《祖国》关于中共问题的论文，认为是有学问的人写的。……”（下面一段话不便发表。）最后，全先生说：“胡先生要来看你。”我马上答道：“不敢当。就...
7	002.为《播种者胡适》翻旧账.txt	1065	不敢当。就年龄说来，我应看胡先生；就他是文化界老前辈说来，我应向胡先生领教。	高明的读者诸君：在我发表“拙文”之前，未写专文批判胡博士；就是我口头上对胡博士的批判，是当面的。我的日记有这记载：1959年2月17日下午由办公处回来，稍息。中研院总干事全汉升先生乘轿车来，寒喧后，他说：“胡适先生见你在《祖国》关于中共问题的论文，认为是有学问的人写的。……”（下面一段话不便发表。）最后，全先生说：“胡先生要来看你。”我马上答道：“不敢当。就...
3	002.为《播种者胡适》翻旧账.txt	1065	胡先生要来看你。	高明的读者诸君：在我发表“拙文”之前，未写专文批判胡博士；就是我口头上对胡博士的批判，是当面的。我的日记有这记载：1959年2月17日下午由办公处回来，稍息。中研院总干事全汉升先生乘轿车来，寒喧后，他说：“胡适先生见你在《祖国》关于中共问题的论文，认为是有学问的人写的。……”（下面一段话不便发表。）最后，全先生说：“胡先生要来看你。”我马上答道：“不敢当。就...
6	002.为《播种者胡适》翻旧账.txt	1067	午饭后，约12时一刻，到楼上，女同事告我有长途电话。一接，知是胡适。他说：我久仰你。客气后，约定下午4时，并说要派车接我。我说：胡先生办公费不多，节省汽油吧，还是我前往。下午3时离办公室，乘公共汽车转长途汽车，到南港，再换乘三轮车到中央研究院胡住处。一按电铃，有人来，知道是我，就在客厅坐。胡来，热烈握手。	2月20日，“午饭后，约12时一刻，到楼上，女同事告我有长途电话。一接，知是胡适。他说：我久仰你。客气后，约定下午4时，并说要派车接我。我说：胡先生办公费不多，节省汽油吧，还是我前往。下午3时离办公室，乘公共汽车转长途汽车，到南港，再换乘三轮车到中央研究院胡住处。一按电铃，有人来，知道是我，就在客厅坐。胡来，热烈握手。”以后我俩谈话，一直谈到8时许，在胡宅晚...
7	002.为《播种者胡适》翻旧账.txt	1073	一个人，一生只能干一件有历史意义的事。	一位在文化界有贡献的人，受后一代或后代人的批评，是一件值得骄傲的事。意大利统一运动英雄加里波底曾说：“一个人，一生只能干一件有历史意义的事。”胡适博士提倡白话文的成功，就是那“一件事”，干了那“一件事”，他已名垂青史了。可是恰如西哲所说：“吾爱吾师，吾更爱真理。”我们不能为了胡适博士曾干“一件事”就不批评他，如果他有应当批判和值得批判的地方。
7	002.为《播种者胡适》翻旧账.txt	1073	吾爱吾师，吾更爱真理。	一位在文化界有贡献的人，受后一代或后代人的批评，是一件值得骄傲的事。意大利统一运动英雄加里波底曾说：“一个人，一生只能干一件有历史意义的事。”胡适博士提倡白话文的成功，就是那“一件事”，干了那“一件事”，他已名垂青史了。可是恰如西哲所说：“吾爱吾师，吾更爱真理。”我们不能为了胡适博士曾干“一件事”就不批评他，如果他有应当批判和值得批判的地方。
7	002.为《播种者胡适》翻旧账.txt	1079	我从不生气，并且非常欢迎。	说到胡适博士的容忍精神，使我们有遗憾之感。据说：在最后一次酒会中，开始是他的大将发言，暗示现在有人“围剿”胡院长，胡院长该用本院组织法第一条起而领导学术。这是和容忍精神相反的。到最后，依报载，胡博士说，40年来，他一直受各方面围剿的事。又说：“我从不生气，并且非常欢迎。”可是语气中，他是生气的，否则不会用“围剿”。这说明他的容忍量不够大。
4	002.为《播种者胡适》翻旧账.txt	1081	怀疑，是做学问的旅舍。	说到我们只能珍存胡博士怀疑精神（不是他的创见）的一半，因为，如西哲所说：“怀疑，是做学问的旅舍。”一个人，对一件事、对一种主张不能永久怀疑，最后总要决定是和非。有一个极恰当的说明例子。
3	002.为《播种者胡适》翻旧账.txt	1083	孙文学说	这个例子，就是胡适本人。大家都知道：“孙文学说”的基础是“知难行易”，对它，胡博士不仅怀疑，而且拉表“知难行亦不易”。这等于说：他对“知难行易”，由怀疑到否定。可是，他后来参加制宪，明定三民主义（后来在一次国代联谊年会中解释信奉三民主义的道理）。这说明，他又由否定到肯定。
3	002.为《播种者胡适》翻旧账.txt	1083	知难行易	这个例子，就是胡适本人。大家都知道：“孙文学说”的基础是“知难行易”，对它，胡博士不仅怀疑，而且拉表“知难行亦不易”。这等于说：他对“知难行易”，由怀疑到否定。可是，他后来参加制宪，明定三民主义（后来在一次国代联谊年会中解释信奉三民主义的道理）。这说明，他又由否定到肯定。
3	002.为《播种者胡适》翻旧账.txt	1083	知难行亦不易	这个例子，就是胡适本人。大家都知道：“孙文学说”的基础是“知难行易”，对它，胡博士不仅怀疑，而且拉表“知难行亦不易”。这等于说：他对“知难行易”，由怀疑到否定。可是，他后来参加制宪，明定三民主义（后来在一次国代联谊年会中解释信奉三民主义的道理）。这说明，他又由否定到肯定。
3	002.为《播种者胡适》翻旧账.txt	1087	忠告	高明的读者诸君：我对李敖的驳论，都答复了。他最后对我的叛决词，是“忠告”（！）我要“深省”（！），和到“书斋”去“编”（写？）《共产党史》（？《中共党史》）！我已说过：他的骂人和捧人都是儿戏，而况他还是上帝为中国文化界加工制造的特殊青年。阿门！（《文星》第54期，1962年4月1日台北出版）
5	002.为《播种者胡适》翻旧账.txt	1093	故意把一部分文献删去不列	最近4期的《文星》中，先有李敖先生的《播种者胡适》（52期2、7页），继有郑学稼先生的《小心求证<播种者胡适>的大胆假设》，把胡适在新青年所发表的信和文章列出“详表”（53期25-27页），嗣由李敖先生“故意把一部分文献删去不列”（53期58页），郑先生于是又提出答辩（54期49页）。
6	002.为《播种者胡适》翻旧账.txt	1097	最有效的、最彻底的反孔手段，是使后一代人不能读‘孔氏之遗书’。要达到此目的，最好的手段，是用白话文代替文言文。	一、郑先生说：“最有效的、最彻底的反孔手段，是使后一代人不能读‘孔氏之遗书’。要达到此目的，最好的手段，是用白话文代替文言文。”（54期43页）胡适博士提倡白话文，确为事实。但其目的是否在使后一代人不能读孔氏之遗书？这不能无疑。记得七八年前，台北报纸也曾登过胡适博士在旧金山对华侨讲演，主张废除汉文。不久就证明这是谣言，或可说是捏词诬陷。我很盼望有人能够提出真...
3	002.为《播种者胡适》翻旧账.txt	1099	物质条件	二、郑先生在52期那篇文章中，说白话文的首倡者不是胡适，而是陈天华和陈独秀（27页）。经李敖先生提出证据反驳后，于是他的笔锋一转，说白话文运动是当时的“物质条件”和“社会条件”所造成的（54期43、44页）。
3	002.为《播种者胡适》翻旧账.txt	1099	社会条件	二、郑先生在52期那篇文章中，说白话文的首倡者不是胡适，而是陈天华和陈独秀（27页）。经李敖先生提出证据反驳后，于是他的笔锋一转，说白话文运动是当时的“物质条件”和“社会条件”所造成的（54期43、44页）。
7	002.为《播种者胡适》翻旧账.txt	1103	一个人，一生只能干一件有历史意义的事。	一位在文化界有贡献的人，受后一代或后代人的批评，是一件值得骄傲的事。意大利统一运动英雄加里波底曾说：“一个人，一生只能干一件有历史意义的事。”胡适博士提倡白话文的成功，就是那“一件事”，干了那“一件事”，他已名垂青史了。（54期54页）
3	002.为《播种者胡适》翻旧账.txt	1107	《文学革命论》是一气呵成，情文并茂的大手笔，又是文学革命运动史的不朽文献。如果陈独秀不组织共产党，这篇文章一定被选入国文读本。	三、郑先生接着恭维陈独秀的《文学革命论》说：“《文学革命论》是一气呵成，情文并茂的大手笔，又是文学革命运动史的不朽文献。如果陈独秀不组织共产党，这篇文章一定被选入国文读本。”（54期45页）郑先生唯恐我们没有机会读到原文，于是乎照抄了最精彩的四大段。而且还“吼喝”出一段，“估评”了一段，又再“如此地指出”了一段。这样的抄、抄、抄，足足地登满《文星》一整页。
8	002.为《播种者胡适》翻旧账.txt	1109	后日在政治上的投机主义者，在当时新文化运动中也是投机主义者	四、郑先生又骂胡适是“后日在政治上的投机主义者，在当时新文化运动中也是投机主义者”（45页）。又批评胡氏“时常改变自己的论点”（44页）；这几句话似嫌过火。我知道郑先生平日的为人，必不愿用此类词句。大概在动气下，就没有好话了。
5	002.为《播种者胡适》翻旧账.txt	1109	时常改变自己的论点	四、郑先生又骂胡适是“后日在政治上的投机主义者，在当时新文化运动中也是投机主义者”（45页）。又批评胡氏“时常改变自己的论点”（44页）；这几句话似嫌过火。我知道郑先生平日的为人，必不愿用此类词句。大概在动气下，就没有好话了。
4	002.为《播种者胡适》翻旧账.txt	1111	高明的读者诸君	郑先生《附答李敖先生》的文章，分作十个项目，又足足占了《文星》7页之多。既承他屡次呼吁“高明的读者诸君”来做义务“裁判”，这件工作对我并不见“光荣”，可是我觉得以第三者的身分出来讲几句话，似乎义不容辞，责无旁贷。
4	002.为《播种者胡适》翻旧账.txt	1113	维辛斯基老爷	一、“维辛斯基”是俄国沙皇时代的旧官僚，先投身孟什维克，继投机转入布尔什维克，未获青睐。以后斯大林利用他来诛锄异己，遂官拜苏联总检察官，二十年前莫斯科的几次大公审，造成史无前例的“大冤狱”，即由此人担任刽子手。凡属具有人性的人，无不恨之刺骨。今郑先生迭称李敖为“维辛斯基老爷”，李敖这家伙也要变成众矢之的了！
3	002.为《播种者胡适》翻旧账.txt	1113	维辛斯基	一、“维辛斯基”是俄国沙皇时代的旧官僚，先投身孟什维克，继投机转入布尔什维克，未获青睐。以后斯大林利用他来诛锄异己，遂官拜苏联总检察官，二十年前莫斯科的几次大公审，造成史无前例的“大冤狱”，即由此人担任刽子手。凡属具有人性的人，无不恨之刺骨。今郑先生迭称李敖为“维辛斯基老爷”，李敖这家伙也要变成众矢之的了！
6	002.为《播种者胡适》翻旧账.txt	1115	不能戴这样漂亮的帽子	二、郑先生在他的文中曾代钱玄同先生戴上一顶“虚无主义”的帽子。此刻他又想同样的奉送胡适之先生一顶（54期52页）。李敖先生说：“这顶帽子太大了”，钱先生“不能戴这样漂亮的帽子”（53期63页）。我亦颇以为然，我想要僭代郑先生送给钱玄同“土包子”的帽子，也尽使得。至于胡适博士呢，郑先生那篇文章中，曾有如下的一段话：
4	002.为《播种者胡适》翻旧账.txt	1115	虚无主义	二、郑先生在他的文中曾代钱玄同先生戴上一顶“虚无主义”的帽子。此刻他又想同样的奉送胡适之先生一顶（54期52页）。李敖先生说：“这顶帽子太大了”，钱先生“不能戴这样漂亮的帽子”（53期63页）。我亦颇以为然，我想要僭代郑先生送给钱玄同“土包子”的帽子，也尽使得。至于胡适博士呢，郑先生那篇文章中，曾有如下的一段话：
4	002.为《播种者胡适》翻旧账.txt	1115	这顶帽子太大了	二、郑先生在他的文中曾代钱玄同先生戴上一顶“虚无主义”的帽子。此刻他又想同样的奉送胡适之先生一顶（54期52页）。李敖先生说：“这顶帽子太大了”，钱先生“不能戴这样漂亮的帽子”（53期63页）。我亦颇以为然，我想要僭代郑先生送给钱玄同“土包子”的帽子，也尽使得。至于胡适博士呢，郑先生那篇文章中，曾有如下的一段话：
