file	line	text
024.批判国民党.txt	7	神话有三种：一、神话。二、台湾人的台湾独立。三、国民党的反攻大陆。（《李语录》）
024.批判国民党.txt	11	阳明山沿仰德大道而上，就有警察局三座，德还没仰到，就先仰到警察。国民党说“国民党永远和民众在一起”，这话有一段省略式，全文该是“国民党永远和警察在一起，警察永远和民众在一起”。如此僭为补正，意思才告完整，你们说对不对？（《漫谈“大姑娘洗澡心理”》）
024.批判国民党.txt	15	当年郑成功浮海来台，他们在台湾重建、开拓、怀念中原文化，他本人，不正是“龙头”吗？沈葆桢说郑成功把台湾做为“遗民世界”，郑成功的心理，的确如此。但郑成功在重建、开拓、怀念之时，并没寻求没有出息的独立，他只是把台湾做为拓展中国的一个基地而已。——台湾的存在是使中国变得更大，而不是更小。郑成功大概怎么也想不透他的一部分后人，居然变得那样小家子气、那样没出息。当然，这种小家子气、这种没出息，实际上，乃是国民党教化下的产品，国民党是真正台湾独立的实行者，它实行了，却鸣鼓而攻别人是台独，而别人居然配合做台独式的胎动，殊不知配合半天，自己怀胎不下，国民党那边，却早就长大成人，接收遗产矣！——台独、台独，其实是堕入国民党术中而不自知也！一如黄狗偷食，却大喊黑狗是贼，于是黄狗逸去，黑狗当灾。大家把注意力集中在黑狗身上，黄狗自然窃笑矣！（《黄狗的窃笑》）
024.批判国民党.txt	19	国民党口口声声说他们最早废除不平等条约、完全废除不平等条约、只有他们废除不平等条约、别人没有废除不平等条约等等，是完全与历史不符的吹牛；相反的，国民党自己订的新的不平等条约——像《中苏友好同盟条约》等等，其丧权辱国的程度，连满清、“军阀”、汉奸都干不出来！作为一个中国人、作为一个追求真理与真相的人，我实在无法坐视国民党如此歪曲历史、美化自己、丑化别人，我一定要根据公开的材料，把国民党给公然开掉。古话说：“勿谓秦无人也！”国民党别以为一切都是你们说了算，至少在这岛上，历史、正义和公论绝不在你们手里。（《不平等条约是国民党废除的吗？》）
024.批判国民党.txt	23	共产党用“三通”政策对付国民党；国民党用拒绝“三通”政策对付共产党。于是，大陆来信，台湾拒收，此拒绝通邮也（虽然台湾的外省老太太都有秘密管道可转家书）；大陆卖大同电锅，台湾抓当归黑枣，此拒绝通商也（虽然台湾的中药店、大饭店都有“匪货”可以消受）；大陆大放其人，台湾不准入境；大陆要求来往，台湾把门一关，此拒绝通航也（虽然从陈香梅到李政道都可“转航”，都有不同的“特权”可以例外）。虽然这样，国民党的拒绝“三通”，也有国民党说的道理在，当国民党把拒绝“三通”说得响当当的时候，我们做小百姓的，只有眼巴巴欣赏他们“奉行基本国策”，没有别的可说。（《国民党的三通前科》）
024.批判国民党.txt	29	古人是“民之所好，好之”。国民党总是别扭，总是“民之所好，恶之”。李焜泰的入狱，是国民党与广大民心对抗赛的又一杰作，国民党永远与民众站在一起，但总是脑袋里少了根筋，结果永远是犯众怒、惹老百姓怨声四起。如今连龙发堂中的精神病患者都朝国民党大发其怒了，国民党制造敌人的本事，可真愈来愈有精神了！（《看你还做真和尚！》）
024.批判国民党.txt	33	大家只看不良少年问题，却忘了看不良老年问题。不良少年的许多问题，其实是不良老年引起来的。古今中外，从来没有像国民党集团这么多的不良老年密集在一起，从来没有！（《李语录》）
024.批判国民党.txt	37	国民党《中央日报》骂宋希濂“黄埔败类”“甘为中共鹰犬”，但我们遍查宋希濂的记录，却满篇都是“黄埔之光”“甘为中‘国’（国民党）鹰犬”。他在四十三岁以前的青春，都在为国民党做鹰做犬、做忠鹰忠犬，出生入死、肝脑涂地；他五十三岁以前的生命，又在为曾做鹰犬而付代价，陷身大狱、劳改终年。为什么他在五十三岁出狱后开始转向？开始“此度见花枝，白头誓不归”，为什么？宋希濂到了美国，已不在大陆，不在中共的控制之下，他为什么不“投奔自由”？为什么不颐养天年，少说几句？为什么要甘为鹰犬成性，一而已矣，继之以再？甘为老K鹰犬之未足，又甘为中共鹰犬？这是为什么？对这一为什么，中国人民害怕，不敢提出真的答案；宋希濂自己心寒，不愿提出真的答案；中国共产党恶作剧，不会提出真的答案，看来看去，只有伟大的国民党能够提出真的答案了。可是国民党只有伟大，没有答案，抹杀老鹰老犬，培养新鹰小犬，就是国民党的答案；国民党是绝不反省自己的，国民党是永不认错的，把一切过失都怪到人家头上，就是国民党的答案。（《鹰犬将军》）
024.批判国民党.txt	41	“古今中外的在野者”，对“执政当局”是哪种态度，其实要看“执政当局”本身是哪种态度。如果这种当局根本是不可与言的，那么同它说话，就统统是废话。国民党是一个不可与言的集团，我们对它的警告也好、劝告也好，它都是不可能改变的，改变就不是国民党了。大家以为舆论可以影响国民党，这完全错误，国民党根本不看你的、也不听你的，国民党的压力团体在美国参议院、众议院，根本不在台湾。以为国民党听人劝的人，完全高估了自己，国民党哪里会采纳民意呢（它若肯采纳民意，也不会丢了大陆，给赶到台湾来了）？国民党的民意管道绝不来自舆论，甚至也不来自他们自己包办的舆论，他们的管道完全来自贴身那几个宦竖意见而已。（《别为盗贼上条陈！》）
024.批判国民党.txt	45	狷者的特色只有一个，就是深思熟虑后的有所不为。狷是狷介、是狷急、是“不能从俗”（《后汉书》范冉传的话）。狷者并不是不做事，而是断然拒绝去做同流合污的事。
024.批判国民党.txt	49	国民党朱汇森根本是典型的官僚与乡愿，但却冒充做狷者，这是对狷者标准的最大侮辱，我们生睁巨眼，绝不接受；孔夫子死不瞑目，也绝不接受。国民党祸国殃民这么多年，又意犹未足，还想把许多道德标准一一打碎、把许多高贵名目一一穿戴，这成什么话！我们一定要拆穿他们！朱汇森绝不是狷者，做国民党的也绝不会是狷者。天下没有这种不知羞耻的狷者、天下没有这种不能洁身自爱的狷者、天下没有这种整天同流合污还能洋洋自得的狷者。国民党别恶心人了吧！（《国民党有狷者吗？》）
024.批判国民党.txt	53	萧启庆在普林斯顿说李敖抵得住国民党一师的军队。我笑着说：“只有一师吗？”启庆，老友也，来台讲学一年，不敢来看我。国民党的恐怖不只它本身，而是它衍生出来的使人“自己吓自己”的恐怖感觉，它能使高等知识分子人人俯首帖耳、人人噤若寒蝉，高等知识分子一一成了逃世的懦夫的时候，国民党的作恶，也就更无忌惮了。（《李敖札记》）
024.批判国民党.txt	59	“大老爷式逃难”外，剩下就是“小百姓式逃难”了。小百姓消息不灵、工具不行、财力不够，其逃难也，只能扶老携幼、手抱婴儿，大队而行，但是一兵荒一马乱，大队就冲散了，结果死的死、伤的伤、沦入沟壑的沦入沟壑、流落街头的流落街头。（《“赛跑式逃难”与“逃难式赛跑”》）
024.批判国民党.txt	63	我生平对国民党全无好感，也不寄任何希望，我评论国民党，完全是以一个未来历史家的身份，提前做盖棺前的论定而已。1944年，戴传贤在重庆曾家岩发豪语：“周朝的天下是八百年，国民党至少要掌握政权一千年。”一千年后，上帝见证，国民党总要还政于民了，但那时候，下台的国民党和垮台的党外人士，恐怕都将踩在苏南成之流的脚下。国民党是有过理想主义的，虽然已经凋谢：党外人士是有着理想主义的，虽然已经不多，但苏南成之流的无耻政客绝对没有这些，他们只有奶和娘——随时变换的奶和娘。苏南成之流的当道，就是最可怕的小人当道。如今这种小人当道了，国民党居然勤于捧他，党外巨头居然不肯骂他，双方居然都没警觉到：这种小人和他的现实主义是真正毁灭人类和理想主义的丑恶东西。国民党的自毁，固不足惜；党外巨头的“过失”，也就太可悲了！（《不是他个人的事》）
024.批判国民党.txt	67	中国人民何辜，九十年来，敬陪国民党革命，“革命，革命，革过又革了”，最后革得骨肉生不能见、死不能送，关山难越，尽是失散之人；幽明永隔，长为他乡之客，最后不能“反攻大陆”，也不准大陆人民来台，也不准直系血亲来往见面。只死命的一个劲儿扣住在小岛上的一切，这又算是什么？国民党再英雄、再豪杰，为什么不去整共产党，却对付起老太太们不准看女儿？使人母女三十五年不见面，这算哪一门子救国救民？哪一门子英雄豪杰？这样莫名其妙的冷血政党，古今中外，还能找得出第二个吗？（《乱世母女泪》）
024.批判国民党.txt	71	看了三十多年来的报禁依然、报禁仍旧，我感到国民党的可恶有两点：第一点是他们箝制了我们办报的自由，第二点是他们箝制之后，又一再拿连他们自己都不信的屁话来搪塞人民。这种作风，第一点固然可恶，第二点尤其可恶。因为第一点只是欺人，第二点却是欺人之后，又拿人民当傻瓜、当凯子来骗。一骗之不足，又推出光怪陆离的说法来作弄我们。我们为什么要受这种作弄呢？我们要宣布不接受！（《还是第一声最像》）
024.批判国民党.txt	75	唯有以“忏悔”的态度面对全国人民，国民党的诚意，才会被我们相信。否则的话，国民党尽管在刀光剑影中统治我们，尽管在强词夺理中摆布我们，尽管在动辄多数决中欺侮我们，长此以往，真正的悲剧演员，还是他们自己。林肯说：“你可以欺骗多数人于暂时，你可以欺骗少数人于永久，但你不能欺骗多数人于永久。”三十三年了，多数人已不再暂时，少数人也不再永久，国民党纵使再舌敝唇焦，也无法把多数人带入永久了！（《从陶百川绑票大学生说起》）
024.批判国民党.txt	79	党外人士对国民党最不了解的一点是：他们总是从国民党的宣传品上，去认定国民党是政治学上的一个政党，这是蛋头之见、书生之见。他们不知道，国民党的前身是革命团体，它的第一代走过秘密结社的路线，所以它有党证、宣誓等不合现代民主政党的规矩。当它取得政权后，在形式上和形势上，要靠近民主阵营，所以又要把自己扭出现代民主政党的模样，这种转变，是很吃力的。（《给党外人士上一课》）
024.批判国民党.txt	83	在国民党眼中，唯一美中不足的是，一小撮党外人士，显然对国民党另有意见，对国民党所说的不全以为真，所做的常引以为异。对这一小撮人说来，国民党认为他们的教育与宣传没收到效果，因而很失望、很生气，其实国民党大可不必如此想不开，因为事实上，国民党三十二年来的教育与宣传，对党外人士也发生了很多影响的。譬如说，党外人士对国民党的过去和历史，就是照着国民党的教育与宣传了解的，这样的了解，当然无法对国民党有准确的判断。……党外人士对国民党了解的不够，反过来看，当然是国民党三十二年一手遮天的成功。（《给党外人士上一课》）
024.批判国民党.txt	87	全世界各地都有政治犯或承认政治犯的今天，中国国民党大官居然公开宣称，一再宣称：台湾没有政治犯！说台湾有的只是叛乱犯，不是政治犯！查1949年6月21日公布的《惩治叛乱条例》，第一条明定“叛乱罪犯适用本条例惩治之”，这是叛乱犯的法源；第二条明定在内乱外患罪上，《刑法》的罪名而以这一条例严刑重罚而已。所以，政治犯的罪名，骨子里都不过是《刑法》的罪名。既用了《刑法》的罪名，不论用哪一条，目的都是整政敌的冤枉而已。所以余登发既以“叛乱”罪名坐牢，也以“图利他人”罪名坐牢；李敖既以“叛乱”罪名坐牢，也以“侵占”罪名坐牢。……除非一个人是官式宣传下的受害者，除非一个人是不能明辨是非的可怜虫，他绝不会相信余登发是“图利他人”的人，一如绝不会相信李敖是“侵占”的人，不论国民党的报纸与法院怎么斗臭、怎么判决，政治犯就是政治犯。但国民党大官说没有政治犯，只有叛乱犯，只有图利他人的余登发，只有侵占的李敖，只有知匪不报的雷震，只有妨害兵役的王地，只有涉嫌窃盗的高玉树，只有贪污的杨金虎，只有包庇的宋霖康，只有收贿的杨玉城，只有伤害的吴哲朗，只有妨害公务的黄玉娇。……只有这个、只有那个，就是没有政治犯，这不是怪事吗？现在我们懂了美容学，从美容学观点研究国民党，我们才恍然大悟：原来这是国民党大官的“司法美容”，国民党大官另用卑鄙的罪名加给政敌，巧妙的闪开政治犯：政治原因，法律解决；军法大审，司法斗臭；使政敌灰头土脸，使自己“眉骨加高”、“瘦面加胖”。事实上，司法案件明明是政治迫害的整型，所谓没有政治犯，所谓纯粹司法案件，只是政治的化妆而已。（《文化美容·财政美容·司法美容》）
024.批判国民党.txt	91	民主国家里没有“党外”，因为民主国家里不允许一党独大。没有一党独大，自然就没有“党外”，因为你若说“党外”，别人不懂。别人不晓得是保守党外呢还是工党党外，是民主党外呢还是共和党外？只有在一党独大的情况下，党才变成了专有名词而非普通名词，党才变成了“就是那个党嘛！”变成“还有哪个党嘛？”变成了唯一的。
024.批判国民党.txt	93	所以，你在公共汽车站等车，看到站牌上写着“中央党部”，就知道那是国民党中央党部，从公车站长到公车车掌，从七十岁老太太到七岁小姑娘，大家想都“不做第二党想”，“中央党部”，“中央党部”当然是国民党嘛，还有哪个党嘛？明知故问！（《党外是谁喊出来的？》）
024.批判国民党.txt	97	当乡愿风蔓延的时候，在这岛上，我们就愈来愈看不到义正辞严痛痛快快的言论了，从国民党似是而非的宣传里、从两面人左右逢源的顾盼里、从座谈会专家模棱两可的取巧里、从康宁祥式党外人士对国民党大员致“最高敬意”“更多的敬意”的表率里，我们不得不说，这是一个充满乡愿气的岛，我们不得不警觉！（《党外与混蛋》）
024.批判国民党.txt	103	中国传统中“政统”和“学统”大体成双轨演化着，搞政治的人不太附庸风雅，国民党在打天下的时候，也是如此。国民党至多只是控制学术机构，但不敢控制学术，也无此妄想。但到台湾以后，地小人稠，闲来无事，居然殃及学术，研究院、研究所、研究中心、大学等等，纷纷渗入了党团与党棍，他们也要写论文了，也要办学报了，也要召开或参加学术会议了，但天知道这是什么“学术”！三十三年来，学术已是一片焚琴煮鹤的大锅炒！学术何辜！呜呼学术！（《你盖棺，我论定》）
024.批判国民党.txt	107	失败与失信，并没给国民党大官人任何反省与教训，他们照样还是老套，兴致来了，就雷厉风行到北投禁娼，可是兴致一过，北投还是北投，大官人还是大官人，私娼的花灯还是若隐若现，公娼的绿灯还是半明半暗，警局的红灯还是眼开眼闭，《台湾省管理妓女办法》还是一张废纸！
024.批判国民党.txt	111	“妇职所”成立的目的，是收容十二到十八岁（后来延伸到二十岁）的雏妓，施以三个月（后来延伸到六个月）的职业训练，希望她们出所以后，能在社会上从良。“妇职所”吸收的标准本是“自愿接受辅导习艺”的，但自成立以来，所谓“自愿”，竟是警察局押送来的，当然问题也就由此而生。（《雏妓问题》）
024.批判国民党.txt	117	三十三年来，我们的确感受到我们是鸡，在被牛刀杀来杀去。这不怪我们，也不怪牛刀，而该怪没有反攻大陆，以致国民党精力过剩，不大材小用不为快。在这种苦闷的心情下，在这种必须使使拳脚以舒展筋骨的必要下，自然“不能安外，却如此攘内”，牛刀不杀鸡，也就别无可杀了！（《牛刀不杀鸡，杀什么？》）
024.批判国民党.txt	125	“毋忘在莒”的笑话，毛病出在整天宣传复兴中华文化的人，根本不好好读古书，其实这也难怪。他们这些人，整天在办党、办公、办案、办人、办喜事、办后事、办公共关系，他们的确没有多少时间真的潜心学问、潜心中国文化。所以，涉及学问与中国文化问题，我们看他们闹了笑话，也就可以了解。但是，我们不能了解的是：他们在涉及“总裁言论”上，居然也犯了“不好好读”的毛病，这就又未免太目中无读书人了！为了使秦孝仪先生没还手余地，我愿举一些绝对客观的“一翻两瞪眼”的铁证，给内行看门道，给外行看热闹。（《给秦孝仪先生上一课》）
024.批判国民党.txt	129	当国民党逃到台湾以后，当二、三十年的投闲置散以后，许多老国民党，开始对过去的“光荣”愈来愈怀念了，他们忍不住有“白头宫女谈天宝”的兴致，或是“骨董山人说晚明”的心情，而要把当年老子如何如何，口沫横飞的给抖了出来。在这岛上，传记文学型的杂志可以那样风光，证明了这种杂志对那些老而不死的健康，是大有裨益的。于是，在这种近乎变态的“回忆力特强”情况下，他们在大陆胡作非为的一些秘密，终于在得意之中，不小心的给泄漏出来。其中关于国民党喜欢以政府之尊，一再搞暗杀的把戏，也包括在内。（《张琍敏的爸爸杀了谁？》）
024.批判国民党.txt	135	今天大家口口声声指责蔡辰洲、指责蔡家财阀，他们固然可恶，但是只指责他们，而忘了他们背后真正的祸首，就未免弄错目标。上面所举国民党第一党报的一些明证，就说明了一切：国民党在经济上大力保护特权，目的正是制造出“金牛”，在政治上做为羽翼；做为掌握财源、掌握铁票的鹰犬，真正支持国泰诈财的祸首是国民党，国泰只不过是国民党大狩猎下的鹰犬之一。国泰的错误是在前去捡回主子打下的猎物时，自己就地先大吃特吃，吃得太多，以致惹得主子不高兴，而要说几句“反对垄断！反对特权！反对投机！”的话来“以正视听”。其实这只不过是一个偶发的特例而已，国民党基本政策还是要继续保护特权下去。因为只有保护特权，才保护了官僚资本的国民党自己。国民党根本是官僚资本的党，它一直是以“金牛”做火牛，想去完成田单复国式的大业。但是，用“金牛”做火牛，最后永远是“在莒”，而不能“毋忘在莒”，“莒”是他们最后的汤沐邑，也是他们最后的坟场，他们的悲剧是铁定的，虽然坟场处处是发光的，——全是金子。（《谁是支持国泰诈财的祸首？》）
024.批判国民党.txt	139	国民党不准他们住在锡安山，也不准他们在河床上望山兴叹，这对锡安山的先驱者说来，是“神”的问题；可是对国民党说来，却是“神经”的问题。国民党神经兮兮，它不喜欢外省的退役老兵和台湾的穷苦大众这样紧密的团结在一起，虽然他们的团结只是对神的顶礼与寄望，他们并没要造反，造反也不会在人间造，因为正如耶稣所说，他的国在天上，当然造反也该在天上。但是，国民党不管，国民党要天上人间，统统一视同仁。（《警棍下的失乐园》）
024.批判国民党.txt	143	很多人说王章清头脑太笨，以致被摆了一道，我看王章清并不笨，而是他的头脑跟不上时代。王章清资助后进也好、变相行贿也罢，他都做梦也没想到新一代的人会这样朝双方脸上涂大便。王章清是老一代的政客，老一代的政客再下三烂，再没有“政治道德”，却能守“政治行规”，至少知道什么是“政治行规”，而对荒腔走板于心不安；可是他不了解台湾的新一代政客，新一代政客在国民党几十年的调教下，青出于蓝，已经不明白起码的取舍、是非与荣辱，已经一切悍然行之而满不在乎，国民党的后进如此，民进党的新贵亦然，世风日下到这种程度，究其原始，责在老辈。《旧约》何西阿书（Hosea）中说：“他们所种的是风，所收的是暴风。”这种“作恶之报，果大于因”是人间天理，可是国民党只知作恶、不知天理，以致今天灰头土脸于小岛，真是活该。（《吴勇雄错在哪儿？》）
024.批判国民党.txt	151	所谓口头禅，本是不能领会禅理，只是口头上袭用禅宗和尚常用的语言。三民主义最后沦为口头禅，它本身的空中楼阁、窒碍难行，固非无因，但是国民党宁肯挂羊头卖狗肉，而一路作伪、言行不一，则是今天陷入死巷的当然结果。三民主义是连自己都统一不了的粗糙理论，国民党却要拿它统一中国，真是天下第一鲜！（《三民主义口头禅》）
024.批判国民党.txt	161	吴樾死难后，他的太太也殉情了。但这两句诗，倒真可移为诗谶。因为他们为理想献身的大业，到了最后，却被一群牛鬼蛇神占尽了便宜。在他们牺牲后，他们的“同志”接收了所有革命的果实，成立了新党。这个新党，很快的丧失了素志与初衷，变成了争权夺利政治分肥的工具，既不民主，也不进步，虽然名字好听无比——叫“国民党”，可是，在“同志”眼中，国民又算老几呢？（《从五大臣到八大臣》）
024.批判国民党.txt	165	1987年11月3日，八十六岁的梁实秋死了，他六十岁的女儿梁文茜，匆匆从北京到台北奔丧，可是到了香港，就被挡住。——国民党说按照《国安法施行细则》第十二条第六款规定，大陆同胞须在“自由地区”停满五年以上方可申请来台，梁文茜因此不能看死爸爸最后一面。显然的，梁实秋死不逢地，他若想到父女之间，在生死线外，如此缘悭一面，他真该死在美国，以利奔丧了。
024.批判国民党.txt	167	我们中国人民，在国民党的虐政里，不要忘记也不该忘记：我们怎样在受难、怎样在被作弄、怎样在生离死别、怎样在“不得亲其亲、不得子其子”的悲惨里，为他们生殉、为自己默哀。——我们永不忘记！（《从不准看活爸爸到不准看死爸爸》）
024.批判国民党.txt	171	张学良从三十八岁被关到八十三岁，一切毛病，都出在国民党太“宽大”，并且强迫张学良接受这种“宽大”。设想当时无此“宽大”，张学良判十年，坐十年牢，早在三十六年前就恢复自由了，又何必受“无形中变为无期徒刑”的德政？张学良的一生，告诉我们一个教训，就是：国民党的“宽大”是很可怕的，我们要对国民党的“宽大”，敬而远之才好！（《别赖张学良了！》）
024.批判国民党.txt	177	我们必须彻底认清：任何方向的中国人，在任何地区的中国土地上，都不该有“作客”的情绪和“作地主”的小心眼。我们没有主人和客人，也不该有反客为主和端茶送客的误解或事实，我们该努力减少这种误解或事实。（《从乡愁到大气派》）
024.批判国民党.txt	181	孙中山朝人民盖空中楼阁，蒋介石却收起房租来。（《李语录》）
