file	line	text	context
015.“建国百年”的殭尸花费.txt	84	民国百年——我们的家园、我们的歌	制播“民国百年——我们的家园、我们的歌”系列广播节目/新闻局/2,000/2,000/
015.“建国百年”的殭尸花费.txt	129	建国百年	这一浩大的“建国百年”烧钱活动，是由马英九担纲的，结果怪事连连，被民进党告到地检署。光在演出两场歌剧一项，《联合报》就有报导如下：
017.“法统”梦碎.txt	3	中华民国第13任总统选举	今年2011年，这个岛上大闹“中华民国第13任总统选举”，正好又赶上所谓“建国百年”，更给了所谓“第12任总统”马英九的张本。不过口口声声今年是“中华民国”100年，则100年间，“总统”绝不止10任，早在民国元年到民国十七年间，就有10任可循，现开1928年前“中华民国”历任元首（总统、执政、大元帅）姓名表如下：
017.“法统”梦碎.txt	3	建国百年	今年2011年，这个岛上大闹“中华民国第13任总统选举”，正好又赶上所谓“建国百年”，更给了所谓“第12任总统”马英九的张本。不过口口声声今年是“中华民国”100年，则100年间，“总统”绝不止10任，早在民国元年到民国十七年间，就有10任可循，现开1928年前“中华民国”历任元首（总统、执政、大元帅）姓名表如下：
017.“法统”梦碎.txt	3	第12任总统	今年2011年，这个岛上大闹“中华民国第13任总统选举”，正好又赶上所谓“建国百年”，更给了所谓“第12任总统”马英九的张本。不过口口声声今年是“中华民国”100年，则100年间，“总统”绝不止10任，早在民国元年到民国十七年间，就有10任可循，现开1928年前“中华民国”历任元首（总统、执政、大元帅）姓名表如下：
017.“法统”梦碎.txt	3	中华民国	今年2011年，这个岛上大闹“中华民国第13任总统选举”，正好又赶上所谓“建国百年”，更给了所谓“第12任总统”马英九的张本。不过口口声声今年是“中华民国”100年，则100年间，“总统”绝不止10任，早在民国元年到民国十七年间，就有10任可循，现开1928年前“中华民国”历任元首（总统、执政、大元帅）姓名表如下：
017.“法统”梦碎.txt	3	总统	今年2011年，这个岛上大闹“中华民国第13任总统选举”，正好又赶上所谓“建国百年”，更给了所谓“第12任总统”马英九的张本。不过口口声声今年是“中华民国”100年，则100年间，“总统”绝不止10任，早在民国元年到民国十七年间，就有10任可循，现开1928年前“中华民国”历任元首（总统、执政、大元帅）姓名表如下：
017.“法统”梦碎.txt	27	中华民国	1948年4月19日，国民党在南京召开国民大会，选出了蒋介石做总统，这是总统之名，在“中华民国”史上的重新出现，但并非首次出现。国民党对“中华民国”总统第几任第几任的分期方法，显然是大大的有毛病的（客气地说，是有语病的）。若说1948年当选的是“第1任”，则1948年以前37年间的“中华民国”历任总统（包括国民党必须承认的孙文在内），又搁在哪儿？若说1948年起的总统是“行宪后”第1任，但也与法统和事实都不合，因为“中华民国”早在1912年就是民国元年了，并非1948年才是民国元年。何况所谓“行宪后”的说法，国民党也罕言之矣。并且所谓“行宪后”之说，也是巧立名目，因为这样加帽子，则以前的总统都可援例大加特加，袁世凯就可来个“行约（约法）后”第1任了，别人也可以依样葫芦了，试问一个国家的总统任期算法，可如是乎？第3任的美国总统杰斐逊（Jefferson），能说他是“战乱后”第1任吗？第16任的美国总统林肯（Lincoln），能说他...
017.“法统”梦碎.txt	27	第1任	1948年4月19日，国民党在南京召开国民大会，选出了蒋介石做总统，这是总统之名，在“中华民国”史上的重新出现，但并非首次出现。国民党对“中华民国”总统第几任第几任的分期方法，显然是大大的有毛病的（客气地说，是有语病的）。若说1948年当选的是“第1任”，则1948年以前37年间的“中华民国”历任总统（包括国民党必须承认的孙文在内），又搁在哪儿？若说1948年起的总统是“行宪后”第1任，但也与法统和事实都不合，因为“中华民国”早在1912年就是民国元年了，并非1948年才是民国元年。何况所谓“行宪后”的说法，国民党也罕言之矣。并且所谓“行宪后”之说，也是巧立名目，因为这样加帽子，则以前的总统都可援例大加特加，袁世凯就可来个“行约（约法）后”第1任了，别人也可以依样葫芦了，试问一个国家的总统任期算法，可如是乎？第3任的美国总统杰斐逊（Jefferson），能说他是“战乱后”第1任吗？第16任的美国总统林肯（Lincoln），能说他...
017.“法统”梦碎.txt	27	行宪后	1948年4月19日，国民党在南京召开国民大会，选出了蒋介石做总统，这是总统之名，在“中华民国”史上的重新出现，但并非首次出现。国民党对“中华民国”总统第几任第几任的分期方法，显然是大大的有毛病的（客气地说，是有语病的）。若说1948年当选的是“第1任”，则1948年以前37年间的“中华民国”历任总统（包括国民党必须承认的孙文在内），又搁在哪儿？若说1948年起的总统是“行宪后”第1任，但也与法统和事实都不合，因为“中华民国”早在1912年就是民国元年了，并非1948年才是民国元年。何况所谓“行宪后”的说法，国民党也罕言之矣。并且所谓“行宪后”之说，也是巧立名目，因为这样加帽子，则以前的总统都可援例大加特加，袁世凯就可来个“行约（约法）后”第1任了，别人也可以依样葫芦了，试问一个国家的总统任期算法，可如是乎？第3任的美国总统杰斐逊（Jefferson），能说他是“战乱后”第1任吗？第16任的美国总统林肯（Lincoln），能说他...
017.“法统”梦碎.txt	27	行约（约法）后	1948年4月19日，国民党在南京召开国民大会，选出了蒋介石做总统，这是总统之名，在“中华民国”史上的重新出现，但并非首次出现。国民党对“中华民国”总统第几任第几任的分期方法，显然是大大的有毛病的（客气地说，是有语病的）。若说1948年当选的是“第1任”，则1948年以前37年间的“中华民国”历任总统（包括国民党必须承认的孙文在内），又搁在哪儿？若说1948年起的总统是“行宪后”第1任，但也与法统和事实都不合，因为“中华民国”早在1912年就是民国元年了，并非1948年才是民国元年。何况所谓“行宪后”的说法，国民党也罕言之矣。并且所谓“行宪后”之说，也是巧立名目，因为这样加帽子，则以前的总统都可援例大加特加，袁世凯就可来个“行约（约法）后”第1任了，别人也可以依样葫芦了，试问一个国家的总统任期算法，可如是乎？第3任的美国总统杰斐逊（Jefferson），能说他是“战乱后”第1任吗？第16任的美国总统林肯（Lincoln），能说他...
017.“法统”梦碎.txt	27	战乱后	1948年4月19日，国民党在南京召开国民大会，选出了蒋介石做总统，这是总统之名，在“中华民国”史上的重新出现，但并非首次出现。国民党对“中华民国”总统第几任第几任的分期方法，显然是大大的有毛病的（客气地说，是有语病的）。若说1948年当选的是“第1任”，则1948年以前37年间的“中华民国”历任总统（包括国民党必须承认的孙文在内），又搁在哪儿？若说1948年起的总统是“行宪后”第1任，但也与法统和事实都不合，因为“中华民国”早在1912年就是民国元年了，并非1948年才是民国元年。何况所谓“行宪后”的说法，国民党也罕言之矣。并且所谓“行宪后”之说，也是巧立名目，因为这样加帽子，则以前的总统都可援例大加特加，袁世凯就可来个“行约（约法）后”第1任了，别人也可以依样葫芦了，试问一个国家的总统任期算法，可如是乎？第3任的美国总统杰斐逊（Jefferson），能说他是“战乱后”第1任吗？第16任的美国总统林肯（Lincoln），能说他...
017.“法统”梦碎.txt	27	内战后	1948年4月19日，国民党在南京召开国民大会，选出了蒋介石做总统，这是总统之名，在“中华民国”史上的重新出现，但并非首次出现。国民党对“中华民国”总统第几任第几任的分期方法，显然是大大的有毛病的（客气地说，是有语病的）。若说1948年当选的是“第1任”，则1948年以前37年间的“中华民国”历任总统（包括国民党必须承认的孙文在内），又搁在哪儿？若说1948年起的总统是“行宪后”第1任，但也与法统和事实都不合，因为“中华民国”早在1912年就是民国元年了，并非1948年才是民国元年。何况所谓“行宪后”的说法，国民党也罕言之矣。并且所谓“行宪后”之说，也是巧立名目，因为这样加帽子，则以前的总统都可援例大加特加，袁世凯就可来个“行约（约法）后”第1任了，别人也可以依样葫芦了，试问一个国家的总统任期算法，可如是乎？第3任的美国总统杰斐逊（Jefferson），能说他是“战乱后”第1任吗？第16任的美国总统林肯（Lincoln），能说他...
018.“正统”梦碎.txt	15	正统	马英九所谓“正统”，原来如此。
019.“道统”梦碎.txt	11	你的革命思想基础是什么？	中山先生的思想，完全是中国的正统思想。就是继承尧舜以至孔孟而中绝的仁义道德的思想。在这一点，我们可以承认中山先生是二千年以来中绝的中国道德文化的复活。去年有一个俄国的革命家，去广东问先生：“你的革命思想基础是什么？”先生答覆他说：“中国有一个正统的道德思想，自尧、舜、禹、汤、文、武、周公至孔子而绝。我的思想，就是继承这一个正统思想来发扬光大的。”那人不明白，再又问先生。先生仍旧把这一句话来答覆。我们就这一段话，就看得出先生的抱负。同时也就可以认得清楚先生的国民革命，是立脚在中国国民文化的复兴上面。是中国国民创制力的复活，是要把中国文化之世界的价值，高调起来，为世界大同的基础。
019.“道统”梦碎.txt	11	中国有一个正统的道德思想，自尧、舜、禹、汤、文、武、周公至孔子而绝。我的思想，就是继承这一个正统思想来发扬光大的。	中山先生的思想，完全是中国的正统思想。就是继承尧舜以至孔孟而中绝的仁义道德的思想。在这一点，我们可以承认中山先生是二千年以来中绝的中国道德文化的复活。去年有一个俄国的革命家，去广东问先生：“你的革命思想基础是什么？”先生答覆他说：“中国有一个正统的道德思想，自尧、舜、禹、汤、文、武、周公至孔子而绝。我的思想，就是继承这一个正统思想来发扬光大的。”那人不明白，再又问先生。先生仍旧把这一句话来答覆。我们就这一段话，就看得出先生的抱负。同时也就可以认得清楚先生的国民革命，是立脚在中国国民文化的复兴上面。是中国国民创制力的复活，是要把中国文化之世界的价值，高调起来，为世界大同的基础。
019.“道统”梦碎.txt	13	去年	文中“去年”是1924年。戴传贤写这书是1925年。6年以后，1931年，蒋介石在教育部讲《中国教育的思想问题》，照引“戴季陶同志”这段话，加以背书和引伸说：
019.“道统”梦碎.txt	13	戴季陶同志	文中“去年”是1924年。戴传贤写这书是1925年。6年以后，1931年，蒋介石在教育部讲《中国教育的思想问题》，照引“戴季陶同志”这段话，加以背书和引伸说：
019.“道统”梦碎.txt	15	中国有一个正统的道德思想，自尧、舜、禹、汤、文、武、周公、孔子而绝，我的思想就是继承这一个正统思想来发扬光大的。	再讲一句话，我们要晓得总理的思想，即是继承尧、舜、禹、汤、文、武、周公、孔子以来的仁义道德思想，将之发扬光大，三民主义就是从仁义道德中发生出来。总理讲这句话是在广西桂林，我当时也在桂林，那个俄国共产党问总理的时候，我也在那里。共产党当时只是宣传，头一次越飞还没有来，那个俄国共产党并不是俄国人，而是瑞士人，也是第三国际派来的。孙先生头一句话答覆他的就是：“中国有一个正统的道德思想，自尧、舜、禹、汤、文、武、周公、孔子而绝，我的思想就是继承这一个正统思想来发扬光大的。”由这一段话，大家可知总理主义是怎么一个思想。
019.“道统”梦碎.txt	17	国父	蒋介石这些话最引起我们注意的，是他在引戴传贤所述“国父”的话以后，并且透露：“我当时也在桂林，那个俄国共产党问总理的时候，我也在那里。”这就是说，他给戴传贤的话做了人证，表示这话是真的。
019.“道统”梦碎.txt	17	我当时也在桂林，那个俄国共产党问总理的时候，我也在那里。	蒋介石这些话最引起我们注意的，是他在引戴传贤所述“国父”的话以后，并且透露：“我当时也在桂林，那个俄国共产党问总理的时候，我也在那里。”这就是说，他给戴传贤的话做了人证，表示这话是真的。
019.“道统”梦碎.txt	21	你的革命哲学的基础是什么？	现在国家到了这样危急的情况，我们用什么方法可以把它挽救过来，完成我们的革命，使中华民族复兴起来呢？我很简单忠实的说，只有大家相信三民主义，而且要实行三民主义，就可挽救危亡。因此，我们要问：三民主义是怎样发生出来的？它的思想之渊源以及它的根本精神是在什么地方？简单的讲一句，它的思想渊源，就是继承中国从古以来——尧、舜、禹、汤、文、武、周公、孔子一脉相承所流传下来的道统，它的根本精神，就是要用中华民族固有的精神来领导革命，复兴民族。关于这一点，在从前共产党时代，共产党必当这句话是一种封建思想，且以把总理为偶像化这点来批评我们，殊不知共产党别有鬼胎，所最怕的就在此点。我记得总理与苏俄代表见面时，当时他第一句话，就问总理：“你的革命哲学的基础是什么？”总理回答说：“我们中国有一个传统的精神，就是尧、舜、禹、汤、文、武、周公、孔子所遗传下的固有道统，我就是继承这尧、舜、禹、汤、文、武、周公、孔子以来的道统，这就是中国民族固有的精神。”我们...
019.“道统”梦碎.txt	21	我们中国有一个传统的精神，就是尧、舜、禹、汤、文、武、周公、孔子所遗传下的固有道统，我就是继承这尧、舜、禹、汤、文、武、周公、孔子以来的道统，这就是中国民族固有的精神。	现在国家到了这样危急的情况，我们用什么方法可以把它挽救过来，完成我们的革命，使中华民族复兴起来呢？我很简单忠实的说，只有大家相信三民主义，而且要实行三民主义，就可挽救危亡。因此，我们要问：三民主义是怎样发生出来的？它的思想之渊源以及它的根本精神是在什么地方？简单的讲一句，它的思想渊源，就是继承中国从古以来——尧、舜、禹、汤、文、武、周公、孔子一脉相承所流传下来的道统，它的根本精神，就是要用中华民族固有的精神来领导革命，复兴民族。关于这一点，在从前共产党时代，共产党必当这句话是一种封建思想，且以把总理为偶像化这点来批评我们，殊不知共产党别有鬼胎，所最怕的就在此点。我记得总理与苏俄代表见面时，当时他第一句话，就问总理：“你的革命哲学的基础是什么？”总理回答说：“我们中国有一个传统的精神，就是尧、舜、禹、汤、文、武、周公、孔子所遗传下的固有道统，我就是继承这尧、舜、禹、汤、文、武、周公、孔子以来的道统，这就是中国民族固有的精神。”我们...
019.“道统”梦碎.txt	23	自尧、舜、禹、汤、文、武、周公、孔子而绝	两年以后蒋介石这段话，出现了两个最令我们注意的不同：第一、原来没有道统的字眼，现在出现了；第二、原来说“自尧、舜、禹、汤、文、武、周公、孔子而绝”，但是现在不提“而绝”了。
019.“道统”梦碎.txt	23	而绝	两年以后蒋介石这段话，出现了两个最令我们注意的不同：第一、原来没有道统的字眼，现在出现了；第二、原来说“自尧、舜、禹、汤、文、武、周公、孔子而绝”，但是现在不提“而绝”了。
019.“道统”梦碎.txt	25	国父	再过了一年，1934年，蒋介石在卢山军训团讲《中国魂》，道统的出现更频繁了，并且引“国父”的话，在文字上也有了出入：
019.“道统”梦碎.txt	27	你革命的哲学基础的出发点，在什么地方？你的革命主义由什么地方发生出来的？	但是我们还要知道，总理绝不是凭空创造出来的，这个三民主义是有所本的，其渊源所自，早在总理以前，与我中华民族之历史的生命同流发展，不过到了总理手里，才拿这个东西重新整理，构成一部完善的思想体系，就叫三民主义。这个主义虽是最新的，而其本质和基本精神之所在，却完全是由我们历史文化的正统，历数千年一直传下来的。这个意思，总理在生时已经自己说明过的，我们只要将总理对苏俄代表马林所讲几句话，复按一下，就可以明白我们总理的学问、总理的思想、总理的道德和总理的革命主义，完全继承中国五千年来历史文化的正统。当时苏俄代表问总理：“你革命的哲学基础的出发点，在什么地方？你的革命主义由什么地方发生出来的？”总理当时告诉他：“我们中国有一个立国的精神，有一个自尧、舜、禹、汤、文、武、周公、孔子数千年来历圣相传的正统思想，这个就是我们中华民族的道统；我的革命思想、革命主义，就是从这个道统遗传下来的。我现在就是要继承我们中华民族的道统，就是要继续发扬我们中华...
019.“道统”梦碎.txt	27	我们中国有一个立国的精神，有一个自尧、舜、禹、汤、文、武、周公、孔子数千年来历圣相传的正统思想，这个就是我们中华民族的道统；我的革命思想、革命主义，就是从这个道统遗传下来的。我现在就是要继承我们中华民族的道统，就是要继续发扬我们中华民族历代祖宗遗传下来的正统精神。	但是我们还要知道，总理绝不是凭空创造出来的，这个三民主义是有所本的，其渊源所自，早在总理以前，与我中华民族之历史的生命同流发展，不过到了总理手里，才拿这个东西重新整理，构成一部完善的思想体系，就叫三民主义。这个主义虽是最新的，而其本质和基本精神之所在，却完全是由我们历史文化的正统，历数千年一直传下来的。这个意思，总理在生时已经自己说明过的，我们只要将总理对苏俄代表马林所讲几句话，复按一下，就可以明白我们总理的学问、总理的思想、总理的道德和总理的革命主义，完全继承中国五千年来历史文化的正统。当时苏俄代表问总理：“你革命的哲学基础的出发点，在什么地方？你的革命主义由什么地方发生出来的？”总理当时告诉他：“我们中国有一个立国的精神，有一个自尧、舜、禹、汤、文、武、周公、孔子数千年来历圣相传的正统思想，这个就是我们中华民族的道统；我的革命思想、革命主义，就是从这个道统遗传下来的。我现在就是要继承我们中华民族的道统，就是要继续发扬我们中华...
019.“道统”梦碎.txt	29	国父	再过了5年，1939年，蒋介石讲《三民主义之体系及其实行程序》，引“国父”的话，文字上的出入更多了：
019.“道统”梦碎.txt	31	民生	我们更要知道，总理的基本思想，渊源于中国正统的政治思想和伦理思想。总理既认定了“民生”为历史的中心，便根据这个思想，指出我国固有的“天下为公”的思想，为改造社会的基本法则，与实行革命的最高理想。因为人类的生存最大保障，是在全体的生存，不在部分的或个人的发展。总理继承了中国固有的正统思想，认定利他是革命的本务，仁爱是救世的基本，利他和仁爱的极则，无过于天下为公。这张表上“民生哲学”下面这个“公”字，就是天下为公的“公”字。《礼记》礼运篇说：“大道之行也，天下为公，选贤与能，讲信修睦。故人不独亲其亲，不独子其子，使老有所终、壮有所用、幼有所长、矜寡孤独废疾者皆有所养，男有分，女有归。货恶其弃于地也，不必藏于己；力恶其不出于身也，不必为己。是故谋闭而不兴，盗窃乱赃而不作，故外户而不闭，是谓大同。”这实在是我们中国一种最完美、最高尚的政治思想和伦理思想，总理生平遇到什么人请他题字的时候，一提笔总是写这几句话。可以说，这几句话，就是总理在...
019.“道统”梦碎.txt	31	天下为公	我们更要知道，总理的基本思想，渊源于中国正统的政治思想和伦理思想。总理既认定了“民生”为历史的中心，便根据这个思想，指出我国固有的“天下为公”的思想，为改造社会的基本法则，与实行革命的最高理想。因为人类的生存最大保障，是在全体的生存，不在部分的或个人的发展。总理继承了中国固有的正统思想，认定利他是革命的本务，仁爱是救世的基本，利他和仁爱的极则，无过于天下为公。这张表上“民生哲学”下面这个“公”字，就是天下为公的“公”字。《礼记》礼运篇说：“大道之行也，天下为公，选贤与能，讲信修睦。故人不独亲其亲，不独子其子，使老有所终、壮有所用、幼有所长、矜寡孤独废疾者皆有所养，男有分，女有归。货恶其弃于地也，不必藏于己；力恶其不出于身也，不必为己。是故谋闭而不兴，盗窃乱赃而不作，故外户而不闭，是谓大同。”这实在是我们中国一种最完美、最高尚的政治思想和伦理思想，总理生平遇到什么人请他题字的时候，一提笔总是写这几句话。可以说，这几句话，就是总理在...
019.“道统”梦碎.txt	31	民生哲学	我们更要知道，总理的基本思想，渊源于中国正统的政治思想和伦理思想。总理既认定了“民生”为历史的中心，便根据这个思想，指出我国固有的“天下为公”的思想，为改造社会的基本法则，与实行革命的最高理想。因为人类的生存最大保障，是在全体的生存，不在部分的或个人的发展。总理继承了中国固有的正统思想，认定利他是革命的本务，仁爱是救世的基本，利他和仁爱的极则，无过于天下为公。这张表上“民生哲学”下面这个“公”字，就是天下为公的“公”字。《礼记》礼运篇说：“大道之行也，天下为公，选贤与能，讲信修睦。故人不独亲其亲，不独子其子，使老有所终、壮有所用、幼有所长、矜寡孤独废疾者皆有所养，男有分，女有归。货恶其弃于地也，不必藏于己；力恶其不出于身也，不必为己。是故谋闭而不兴，盗窃乱赃而不作，故外户而不闭，是谓大同。”这实在是我们中国一种最完美、最高尚的政治思想和伦理思想，总理生平遇到什么人请他题字的时候，一提笔总是写这几句话。可以说，这几句话，就是总理在...
