file	line	text	context
012.妈妈·弟弟·电影.txt	13	生民以来，未之有也！	所谓“一泻千里式”是妈妈骂我们的一种基本方法，只要我们八个孩子中的任何一个得罪了妈妈，妈妈就要采取“惩一儆八”的策略，一个个点名骂下去，因人而异，各有一套说词，绝无向隅之感，真是天网恢恢疏而不失，八面玲珑人人俱到。比如说三小姐使妈妈不开心了，妈妈并不开门见山直接骂三小姐，她先从大小姐不该买那件黄外套开始，然后顺流而下。谴责二小姐不该留赫本头，再依此类推，直骂到幺小姐的第六号男朋友的大鼻子为止。这种骂法，既可得以偏概全之功；又可收举一得八之效，因材施骂，报怨以直，个个鸣鼓小攻一番，不失古诗人轻怨薄怒的风度。但有个例外是，阴险的辛八达经常是个漏网者，因为他很乖巧，一看到妈妈“骂人开始”了，他便赶紧跑到厨房去烧开水，等到妈妈骂完幺小姐刚要峰回路转枪口对他的时候，他便准时把热腾腾的红茶从门外端进来，那种唯恭唯谨的嘴脸、必信必忠的姿态、清白此身的尊容，再加上举案齐眉的红茶，四种攻势立刻使妈妈化干戈为玉帛，拨云雾而见青天——笑逐颜开了。大喜...
012.妈妈·弟弟·电影.txt	15	红茶战术	今天小施故技，老太又被“红茶战术”击垮，转而对我谬许不止。不过妈妈似乎对“八”这个数字很偏爱，只骂七个人犹意未足，所以把老太爷抬出来补骂一阵，小子何人？竟劳动老子代我受过，实在不孝之至。感而有诗，成六绝一首：
012.妈妈·弟弟·电影.txt	25	天下万事，事事可让，碰到电影，绝不后人！	妈妈的半部自传就是一部电影发展史。妈妈从十几岁就开始看电影，那时还正是默片时代。四十年来，妈妈从黑白看到彩色；从真人看到卡通；从平面看到立体；从无声看到身历声。不但如此，妈妈还看白了嘉宝的头发；看老了卓别林的神情；看死了范伦铁诺的风采；也看花了她自己的眼睛。这种赫赫的历史背景使她轻易取得了电影“权威”的宝座，妈妈也不谦辞，她的座右铭是：“天下万事，事事可让，碰到电影，绝不后人！”但是电影界的日新月异，新人辈出，未免使妈妈很辛苦。有一次我半夜醒来，竟看到她戴着老花眼镜，坐在灯前，口诵心维，用起功来，我蹑手蹑脚走到她后面去看，吓！原来她念的是一大串美国新歌星的名字与履历！其用情之专、用力之勤、用心之苦，真可为千古壶范而无愧色！妈妈虽不忘新人力争上游，可是在不经意间，仍可见其心折于老明星而讨厌这些后起之秀。她最痛恨普雷斯利，本来早有挞伐之意，想不到六小姐与幺小姐却对猫王大为倾倒、大为卿狂，妈妈一人难敌两口，何况贬斥新星容易被人戴上老顽...
012.妈妈·弟弟·电影.txt	25	不错，猫王的嗓子也不错，他有几个调门是学平克劳斯贝的；而他的鼻子又很像却尔斯鲍育！	妈妈的半部自传就是一部电影发展史。妈妈从十几岁就开始看电影，那时还正是默片时代。四十年来，妈妈从黑白看到彩色；从真人看到卡通；从平面看到立体；从无声看到身历声。不但如此，妈妈还看白了嘉宝的头发；看老了卓别林的神情；看死了范伦铁诺的风采；也看花了她自己的眼睛。这种赫赫的历史背景使她轻易取得了电影“权威”的宝座，妈妈也不谦辞，她的座右铭是：“天下万事，事事可让，碰到电影，绝不后人！”但是电影界的日新月异，新人辈出，未免使妈妈很辛苦。有一次我半夜醒来，竟看到她戴着老花眼镜，坐在灯前，口诵心维，用起功来，我蹑手蹑脚走到她后面去看，吓！原来她念的是一大串美国新歌星的名字与履历！其用情之专、用力之勤、用心之苦，真可为千古壶范而无愧色！妈妈虽不忘新人力争上游，可是在不经意间，仍可见其心折于老明星而讨厌这些后起之秀。她最痛恨普雷斯利，本来早有挞伐之意，想不到六小姐与幺小姐却对猫王大为倾倒、大为卿狂，妈妈一人难敌两口，何况贬斥新星容易被人戴上老顽...
012.妈妈·弟弟·电影.txt	25	此时无声胜有声！	妈妈的半部自传就是一部电影发展史。妈妈从十几岁就开始看电影，那时还正是默片时代。四十年来，妈妈从黑白看到彩色；从真人看到卡通；从平面看到立体；从无声看到身历声。不但如此，妈妈还看白了嘉宝的头发；看老了卓别林的神情；看死了范伦铁诺的风采；也看花了她自己的眼睛。这种赫赫的历史背景使她轻易取得了电影“权威”的宝座，妈妈也不谦辞，她的座右铭是：“天下万事，事事可让，碰到电影，绝不后人！”但是电影界的日新月异，新人辈出，未免使妈妈很辛苦。有一次我半夜醒来，竟看到她戴着老花眼镜，坐在灯前，口诵心维，用起功来，我蹑手蹑脚走到她后面去看，吓！原来她念的是一大串美国新歌星的名字与履历！其用情之专、用力之勤、用心之苦，真可为千古壶范而无愧色！妈妈虽不忘新人力争上游，可是在不经意间，仍可见其心折于老明星而讨厌这些后起之秀。她最痛恨普雷斯利，本来早有挞伐之意，想不到六小姐与幺小姐却对猫王大为倾倒、大为卿狂，妈妈一人难敌两口，何况贬斥新星容易被人戴上老顽...
012.妈妈·弟弟·电影.txt	37	巧笑倩兮	妈妈生平最大的遗憾大概就是生不逢时未能献身银幕了，但聊以自慰的是，人生本是个大舞台，有演员也得有观众。妈妈说她既不能“巧笑倩兮”于水银灯下，只好“美目盼兮”于电影院中。委曲求全之余，妈妈不但成功地做了一个伟大的观众，并且把六位千金和辛八达训练成大影迷，个个精谙影星家传，银幕春秋。最要命的是，我这个“不孝有三，不爱电影为大”的长子最使她失望，幸有弟弟善全母志克绍箕裘，俨然以未来明星自期许，常使妈妈厚望不已。有一次妈妈居然打破一向不信释道鬼神的惯例，在老佛爷面前焚香膜拜起来了，只见她五体投地扑身便倒，口中念念有词，词曰：
012.妈妈·弟弟·电影.txt	37	美目盼兮	妈妈生平最大的遗憾大概就是生不逢时未能献身银幕了，但聊以自慰的是，人生本是个大舞台，有演员也得有观众。妈妈说她既不能“巧笑倩兮”于水银灯下，只好“美目盼兮”于电影院中。委曲求全之余，妈妈不但成功地做了一个伟大的观众，并且把六位千金和辛八达训练成大影迷，个个精谙影星家传，银幕春秋。最要命的是，我这个“不孝有三，不爱电影为大”的长子最使她失望，幸有弟弟善全母志克绍箕裘，俨然以未来明星自期许，常使妈妈厚望不已。有一次妈妈居然打破一向不信释道鬼神的惯例，在老佛爷面前焚香膜拜起来了，只见她五体投地扑身便倒，口中念念有词，词曰：
012.妈妈·弟弟·电影.txt	37	不孝有三，不爱电影为大	妈妈生平最大的遗憾大概就是生不逢时未能献身银幕了，但聊以自慰的是，人生本是个大舞台，有演员也得有观众。妈妈说她既不能“巧笑倩兮”于水银灯下，只好“美目盼兮”于电影院中。委曲求全之余，妈妈不但成功地做了一个伟大的观众，并且把六位千金和辛八达训练成大影迷，个个精谙影星家传，银幕春秋。最要命的是，我这个“不孝有三，不爱电影为大”的长子最使她失望，幸有弟弟善全母志克绍箕裘，俨然以未来明星自期许，常使妈妈厚望不已。有一次妈妈居然打破一向不信释道鬼神的惯例，在老佛爷面前焚香膜拜起来了，只见她五体投地扑身便倒，口中念念有词，词曰：
012.妈妈·弟弟·电影.txt	45	人心不古	我认为如果有“人心不古”的事，那就是后人不如古人有幽默感。司马迁的《滑稽列传》及身而绝就是一个显例。流风所被，好像一个人不板着脸孔写文章就是大逆不道！不写硬邦邦的文章就是没有价值！
012.妈妈·弟弟·电影.txt	51	李敖对叶（青）、郑（学稼）之文无能答辩，只得‘蝉曳残声到别枝’去写《纪翠绫该生在什么时候？》和他的《妈妈·弟弟·电影》了。	以上全文及后记原登《文星》第五十六号，1962年6月1日台北出版。发表后，6月25日任卓宣发行的《政治评论》第八卷第八期上，有一篇所谓《为白话文问题代郑学稼辨诬》，其中指出：“李敖对叶（青）、郑（学稼）之文无能答辩，只得‘蝉曳残声到别枝’去写《纪翠绫该生在什么时候？》和他的《妈妈·弟弟·电影》了。”同月，在张铁君发行的《学宗》第三卷第二期上，有一篇《此次文化问题论战之总述评》，其中也诬指：“被胡适全心全力支持的西化太保也‘蝉曳残声到别枝’去考证《纪翠绫该生在什么时候？》谈他《妈妈·弟弟·电影》了。”到了10月3日，胡秋原在记者招待会上宣布控告我，其中也谈到：“后来听说这小诽谤者写《妈妈我服了》，又自称‘文化太保’谈梅毒去了。”上面这些文字，都是我这篇《妈妈·弟弟·电影》发表后的小插曲。在另一方面，我的“妈妈”在6月14日来信说：“读了你的大作，我们有同样的感觉——‘体无完肤’，幸而那段《后记》，使我们稍慰于心。”我另外在公共汽车...
012.妈妈·弟弟·电影.txt	51	被胡适全心全力支持的西化太保也‘蝉曳残声到别枝’去考证《纪翠绫该生在什么时候？》谈他《妈妈·弟弟·电影》了。	以上全文及后记原登《文星》第五十六号，1962年6月1日台北出版。发表后，6月25日任卓宣发行的《政治评论》第八卷第八期上，有一篇所谓《为白话文问题代郑学稼辨诬》，其中指出：“李敖对叶（青）、郑（学稼）之文无能答辩，只得‘蝉曳残声到别枝’去写《纪翠绫该生在什么时候？》和他的《妈妈·弟弟·电影》了。”同月，在张铁君发行的《学宗》第三卷第二期上，有一篇《此次文化问题论战之总述评》，其中也诬指：“被胡适全心全力支持的西化太保也‘蝉曳残声到别枝’去考证《纪翠绫该生在什么时候？》谈他《妈妈·弟弟·电影》了。”到了10月3日，胡秋原在记者招待会上宣布控告我，其中也谈到：“后来听说这小诽谤者写《妈妈我服了》，又自称‘文化太保’谈梅毒去了。”上面这些文字，都是我这篇《妈妈·弟弟·电影》发表后的小插曲。在另一方面，我的“妈妈”在6月14日来信说：“读了你的大作，我们有同样的感觉——‘体无完肤’，幸而那段《后记》，使我们稍慰于心。”我另外在公共汽车...
012.妈妈·弟弟·电影.txt	51	后来听说这小诽谤者写《妈妈我服了》，又自称‘文化太保’谈梅毒去了。	以上全文及后记原登《文星》第五十六号，1962年6月1日台北出版。发表后，6月25日任卓宣发行的《政治评论》第八卷第八期上，有一篇所谓《为白话文问题代郑学稼辨诬》，其中指出：“李敖对叶（青）、郑（学稼）之文无能答辩，只得‘蝉曳残声到别枝’去写《纪翠绫该生在什么时候？》和他的《妈妈·弟弟·电影》了。”同月，在张铁君发行的《学宗》第三卷第二期上，有一篇《此次文化问题论战之总述评》，其中也诬指：“被胡适全心全力支持的西化太保也‘蝉曳残声到别枝’去考证《纪翠绫该生在什么时候？》谈他《妈妈·弟弟·电影》了。”到了10月3日，胡秋原在记者招待会上宣布控告我，其中也谈到：“后来听说这小诽谤者写《妈妈我服了》，又自称‘文化太保’谈梅毒去了。”上面这些文字，都是我这篇《妈妈·弟弟·电影》发表后的小插曲。在另一方面，我的“妈妈”在6月14日来信说：“读了你的大作，我们有同样的感觉——‘体无完肤’，幸而那段《后记》，使我们稍慰于心。”我另外在公共汽车...
012.妈妈·弟弟·电影.txt	51	读了你的大作，我们有同样的感觉——‘体无完肤’，幸而那段《后记》，使我们稍慰于心。	以上全文及后记原登《文星》第五十六号，1962年6月1日台北出版。发表后，6月25日任卓宣发行的《政治评论》第八卷第八期上，有一篇所谓《为白话文问题代郑学稼辨诬》，其中指出：“李敖对叶（青）、郑（学稼）之文无能答辩，只得‘蝉曳残声到别枝’去写《纪翠绫该生在什么时候？》和他的《妈妈·弟弟·电影》了。”同月，在张铁君发行的《学宗》第三卷第二期上，有一篇《此次文化问题论战之总述评》，其中也诬指：“被胡适全心全力支持的西化太保也‘蝉曳残声到别枝’去考证《纪翠绫该生在什么时候？》谈他《妈妈·弟弟·电影》了。”到了10月3日，胡秋原在记者招待会上宣布控告我，其中也谈到：“后来听说这小诽谤者写《妈妈我服了》，又自称‘文化太保’谈梅毒去了。”上面这些文字，都是我这篇《妈妈·弟弟·电影》发表后的小插曲。在另一方面，我的“妈妈”在6月14日来信说：“读了你的大作，我们有同样的感觉——‘体无完肤’，幸而那段《后记》，使我们稍慰于心。”我另外在公共汽车...
013.长袍心理学.txt	7	文学院那穿长袍的	长袍成为我个人的商标，历史已久，不但传之于众口，而且形之于笔墨。前年香港出版的一期《大学生活》里，某君曾列举台大的四怪三丑，而怪丑之尤就是“长袍怪”，好像长袍就是我的化身一般。事实上，若论台大声名显赫的人物，除钱校长外大概就是我了。没有一个人敢说他没见过“文学院那穿长袍的”，除非他是瞎子，可是瞎子也得听说过李某人，除非他还愿意做聋子！
013.长袍心理学.txt	19	长袍心理学	可是我穿长袍在光天化日大太阳之下，理由却与她们迥然不同。盖穿长袍是一门失传的学问，降至洋服充斥的今日，凡是再穿长袍的人都有他一个深远的理论背景，我把这种理论背景归而纳之，分为五派，一统其名曰“长袍心理学”。
013.长袍心理学.txt	21	中学为体派	第一是“中学为体派”。此派可以钱穆为代表。钱先生承张文襄公之余绪，大倡东方精神文明，“中学为体，西学为用”，他在行动方面，也表现出“中衣为体，西鞋为用”的精神——当然去美国时穿西装是例外，入境问俗，中国之进入夷狄者则夷狄之，何况圣之时者的钱先生乎？我个人在长袍一点上，足为国粹派争光。身外之物虽系小事，然“其意岂在一发哉？盖不忍中国之衣冠，沦于夷狄耳！”故我对它始终乐之不疲一往情深，时时玩索不已，心体力行不止，持久性足可追随钱夫子而臻于“汉唐以来所未有也”的境界。何况长袍还是我们东方物质文明最辉煌的表现，也是我们反抗文化侵略的一件有力武器，它那变形虫的特性给了我们无限的安全感，黄袍加身日，我思古人时，洋鬼子的物质文明又何有于我哉？
013.长袍心理学.txt	21	中学为体，西学为用	第一是“中学为体派”。此派可以钱穆为代表。钱先生承张文襄公之余绪，大倡东方精神文明，“中学为体，西学为用”，他在行动方面，也表现出“中衣为体，西鞋为用”的精神——当然去美国时穿西装是例外，入境问俗，中国之进入夷狄者则夷狄之，何况圣之时者的钱先生乎？我个人在长袍一点上，足为国粹派争光。身外之物虽系小事，然“其意岂在一发哉？盖不忍中国之衣冠，沦于夷狄耳！”故我对它始终乐之不疲一往情深，时时玩索不已，心体力行不止，持久性足可追随钱夫子而臻于“汉唐以来所未有也”的境界。何况长袍还是我们东方物质文明最辉煌的表现，也是我们反抗文化侵略的一件有力武器，它那变形虫的特性给了我们无限的安全感，黄袍加身日，我思古人时，洋鬼子的物质文明又何有于我哉？
013.长袍心理学.txt	21	中衣为体，西鞋为用	第一是“中学为体派”。此派可以钱穆为代表。钱先生承张文襄公之余绪，大倡东方精神文明，“中学为体，西学为用”，他在行动方面，也表现出“中衣为体，西鞋为用”的精神——当然去美国时穿西装是例外，入境问俗，中国之进入夷狄者则夷狄之，何况圣之时者的钱先生乎？我个人在长袍一点上，足为国粹派争光。身外之物虽系小事，然“其意岂在一发哉？盖不忍中国之衣冠，沦于夷狄耳！”故我对它始终乐之不疲一往情深，时时玩索不已，心体力行不止，持久性足可追随钱夫子而臻于“汉唐以来所未有也”的境界。何况长袍还是我们东方物质文明最辉煌的表现，也是我们反抗文化侵略的一件有力武器，它那变形虫的特性给了我们无限的安全感，黄袍加身日，我思古人时，洋鬼子的物质文明又何有于我哉？
013.长袍心理学.txt	21	其意岂在一发哉？盖不忍中国之衣冠，沦于夷狄耳！	第一是“中学为体派”。此派可以钱穆为代表。钱先生承张文襄公之余绪，大倡东方精神文明，“中学为体，西学为用”，他在行动方面，也表现出“中衣为体，西鞋为用”的精神——当然去美国时穿西装是例外，入境问俗，中国之进入夷狄者则夷狄之，何况圣之时者的钱先生乎？我个人在长袍一点上，足为国粹派争光。身外之物虽系小事，然“其意岂在一发哉？盖不忍中国之衣冠，沦于夷狄耳！”故我对它始终乐之不疲一往情深，时时玩索不已，心体力行不止，持久性足可追随钱夫子而臻于“汉唐以来所未有也”的境界。何况长袍还是我们东方物质文明最辉煌的表现，也是我们反抗文化侵略的一件有力武器，它那变形虫的特性给了我们无限的安全感，黄袍加身日，我思古人时，洋鬼子的物质文明又何有于我哉？
013.长袍心理学.txt	21	汉唐以来所未有也	第一是“中学为体派”。此派可以钱穆为代表。钱先生承张文襄公之余绪，大倡东方精神文明，“中学为体，西学为用”，他在行动方面，也表现出“中衣为体，西鞋为用”的精神——当然去美国时穿西装是例外，入境问俗，中国之进入夷狄者则夷狄之，何况圣之时者的钱先生乎？我个人在长袍一点上，足为国粹派争光。身外之物虽系小事，然“其意岂在一发哉？盖不忍中国之衣冠，沦于夷狄耳！”故我对它始终乐之不疲一往情深，时时玩索不已，心体力行不止，持久性足可追随钱夫子而臻于“汉唐以来所未有也”的境界。何况长袍还是我们东方物质文明最辉煌的表现，也是我们反抗文化侵略的一件有力武器，它那变形虫的特性给了我们无限的安全感，黄袍加身日，我思古人时，洋鬼子的物质文明又何有于我哉？
013.长袍心理学.txt	23	男权至上派	第二是“男权至上派”。此派可以某些女人痛恨者为代表。想当年满清刚入关，金之俊建议十从十不从，第一条就是男从女不从，所以当时男人穿清朝旗袍，女人穿明朝服装；到了民国后，男人又流行穿西装了，女人才流行穿旗袍。换言之，女人总是晚咱们男人一着，总是跟在时代后面穷赶，思念起来，好不开心！想不到好景不长，没过几年，女人们也穿起洋婆子的衣裳来了，但是她们并不喜新厌旧地放弃旗袍，反倒变本加厉，把旗袍开衩到苏茜黄的世界，而此世界之有碍观瞻与体统，不必多言一望便知。可是你又不能厚非小娘子们，因为她们这么做是有古书为之支援的，《诗经》上不是说过吗？
013.长袍心理学.txt	27	作……异服……以疑众，杀！	有诗云可证，挟经典以重，老学究们还敢再多嘴吗？《礼记》中虽有“作……异服……以疑众，杀！”的王制，但是女人太可爱了，安能遽以一衩之高低挥泪杀之？何况普天之下率土之滨。双面夏娃多如牛毛兔子毛，又安能尽得而诛之？故劝千岁，杀字休出口，杀乎哉？不杀也！但是，既然不能杀之而后快，某些卫道之士自然不服气不甘心，但又恨无新服装可跟她们比赛。失望之余，只好折回头来，重新从箱底取出长衫儿，晒一晒，也穿起来了，心里还想：同是旗人之袍，娘儿们穿得，我穿不得？他妈的，穿！堂堂大丈夫奇男子，岂可让这些造了反的女人专美于前吗？于是“男权至上派”遂在“冲冠一怒为红颜”的公愤下成立了。
013.长袍心理学.txt	27	男权至上派	有诗云可证，挟经典以重，老学究们还敢再多嘴吗？《礼记》中虽有“作……异服……以疑众，杀！”的王制，但是女人太可爱了，安能遽以一衩之高低挥泪杀之？何况普天之下率土之滨。双面夏娃多如牛毛兔子毛，又安能尽得而诛之？故劝千岁，杀字休出口，杀乎哉？不杀也！但是，既然不能杀之而后快，某些卫道之士自然不服气不甘心，但又恨无新服装可跟她们比赛。失望之余，只好折回头来，重新从箱底取出长衫儿，晒一晒，也穿起来了，心里还想：同是旗人之袍，娘儿们穿得，我穿不得？他妈的，穿！堂堂大丈夫奇男子，岂可让这些造了反的女人专美于前吗？于是“男权至上派”遂在“冲冠一怒为红颜”的公愤下成立了。
013.长袍心理学.txt	27	冲冠一怒为红颜	有诗云可证，挟经典以重，老学究们还敢再多嘴吗？《礼记》中虽有“作……异服……以疑众，杀！”的王制，但是女人太可爱了，安能遽以一衩之高低挥泪杀之？何况普天之下率土之滨。双面夏娃多如牛毛兔子毛，又安能尽得而诛之？故劝千岁，杀字休出口，杀乎哉？不杀也！但是，既然不能杀之而后快，某些卫道之士自然不服气不甘心，但又恨无新服装可跟她们比赛。失望之余，只好折回头来，重新从箱底取出长衫儿，晒一晒，也穿起来了，心里还想：同是旗人之袍，娘儿们穿得，我穿不得？他妈的，穿！堂堂大丈夫奇男子，岂可让这些造了反的女人专美于前吗？于是“男权至上派”遂在“冲冠一怒为红颜”的公愤下成立了。
013.长袍心理学.txt	31	没有西装派	这四是“没有西装派”。此派正好与前一派相反，前一派因西装太多，尼龙、奥龙、达克龙……五颜六色，宽条窄条，穿得厌了，所以才穿长袍傲同性而引异性；此派却因一条龙也没有；且西装之为物，日新月异，宽领窄领，三钮二扣，变化无穷，除非财力雄厚，否则休想跟上时代而当选服装最佳的男人。若穿长袍，就无这种麻烦了，大可隆中高卧，以不变应万变，任凭别人的料子龙来龙去，老憎反正是一龙也不龙，至多以聋报之。而且，清高的阴丹士林是从不褪色的，正如我们固有文化的万古常新，放之四海而皆准，俟诸百世而不惑，长袍小物可以喻大，“去蛇反转变成龙”，袍之既久，自怜之态砉然消失，路过短衣窄袖的西装店，反倒望望然而去之，只见他把咽下去的口水朝玻璃窗上一吐，仰天长啸曰：“予岂好袍哉？予不得已也！”
013.长袍心理学.txt	31	去蛇反转变成龙	这四是“没有西装派”。此派正好与前一派相反，前一派因西装太多，尼龙、奥龙、达克龙……五颜六色，宽条窄条，穿得厌了，所以才穿长袍傲同性而引异性；此派却因一条龙也没有；且西装之为物，日新月异，宽领窄领，三钮二扣，变化无穷，除非财力雄厚，否则休想跟上时代而当选服装最佳的男人。若穿长袍，就无这种麻烦了，大可隆中高卧，以不变应万变，任凭别人的料子龙来龙去，老憎反正是一龙也不龙，至多以聋报之。而且，清高的阴丹士林是从不褪色的，正如我们固有文化的万古常新，放之四海而皆准，俟诸百世而不惑，长袍小物可以喻大，“去蛇反转变成龙”，袍之既久，自怜之态砉然消失，路过短衣窄袖的西装店，反倒望望然而去之，只见他把咽下去的口水朝玻璃窗上一吐，仰天长啸曰：“予岂好袍哉？予不得已也！”
