score	file	line	text	context
3	《千秋万岁乌鸦求是合集》目录.txt	130	绝无共产主义成分在内	128.“绝无共产主义成分在内”？
3	《千秋万岁乌鸦求是合集》目录.txt	136	不必去管资本主义或社会主义	134.“不必去管资本主义或社会主义”
4	001.第一条多了什么？.txt	3	中华民国基于三民主义，为民有民治民享之民主共和国。	国民党龙头学者萨孟武写《中国宪法新论》，对《中华民国宪法》第一条：“中华民国基于三民主义，为民有民治民享之民主共和国。”有意见如下：
6	001.第一条多了什么？.txt	5	以外国人所倡之口号，冠之于自己国体之上，已非光荣。且此种口号，仅适用之于一国政体，而不能适用之于一国国体。兹竟移置于国体条文之上，诚属憾事	案“民有民治民享”为林肯（A. Lincoln）所说of the people, by the people, for the people的译语。我赞成刘庆瑞教授的意见，民主共和已含有“民有民治民享”之涵义，国体既为共和，而政体又是民主了，再加上这个形容词，似是同语反复（tautology），善哉，谢瀛洲教授之言：“以外国人所倡之口号，冠之于自己国体之上，...
3	001.第一条多了什么？.txt	5	民有民治民享	案“民有民治民享”为林肯（A. Lincoln）所说of the people, by the people, for the people的译语。我赞成刘庆瑞教授的意见，民主共和已含有“民有民治民享”之涵义，国体既为共和，而政体又是民主了，再加上这个形容词，似是同语反复（tautology），善哉，谢瀛洲教授之言：“以外国人所倡之口号，冠之于自己国体之上，...
3	001.第一条多了什么？.txt	11	基于三民主义为民主共和国	我们认为问题不在“民有民治民享”，而在加上“三民主义”这个花边。不论所加为“为三民主义共和国”，或“基于三民主义为民主共和国”，俱属费解，勉强。
5	001.第一条多了什么？.txt	13	中华民国基于三民主义，为民有民治民享之民主共和国	五五宪草第一条是“中华民国为三民主义共和国”，宪草修正案是“中华民国基于三民主义，为民有民治民享之民主共和国”。国大第一组审查修改为“中华民国为三民主义民主共和国”，比五五宪草多“民主”两字，综合审查又翻案为“中华民国基于三民主义为民主共和国”，所争仅在“为”或“基于”三民主义，远不如民社党所主张的“中华民国为民主共和国”，来得明朗。理由如下：
3	001.第一条多了什么？.txt	13	中华民国为三民主义共和国	五五宪草第一条是“中华民国为三民主义共和国”，宪草修正案是“中华民国基于三民主义，为民有民治民享之民主共和国”。国大第一组审查修改为“中华民国为三民主义民主共和国”，比五五宪草多“民主”两字，综合审查又翻案为“中华民国基于三民主义为民主共和国”，所争仅在“为”或“基于”三民主义，远不如民社党所主张的“中华民国为民主共和国”，来得明朗。理由如下：
3	001.第一条多了什么？.txt	13	中华民国为三民主义民主共和国	五五宪草第一条是“中华民国为三民主义共和国”，宪草修正案是“中华民国基于三民主义，为民有民治民享之民主共和国”。国大第一组审查修改为“中华民国为三民主义民主共和国”，比五五宪草多“民主”两字，综合审查又翻案为“中华民国基于三民主义为民主共和国”，所争仅在“为”或“基于”三民主义，远不如民社党所主张的“中华民国为民主共和国”，来得明朗。理由如下：
3	001.第一条多了什么？.txt	13	中华民国基于三民主义为民主共和国	五五宪草第一条是“中华民国为三民主义共和国”，宪草修正案是“中华民国基于三民主义，为民有民治民享之民主共和国”。国大第一组审查修改为“中华民国为三民主义民主共和国”，比五五宪草多“民主”两字，综合审查又翻案为“中华民国基于三民主义为民主共和国”，所争仅在“为”或“基于”三民主义，远不如民社党所主张的“中华民国为民主共和国”，来得明朗。理由如下：
3	001.第一条多了什么？.txt	13	中华民国为民主共和国	五五宪草第一条是“中华民国为三民主义共和国”，宪草修正案是“中华民国基于三民主义，为民有民治民享之民主共和国”。国大第一组审查修改为“中华民国为三民主义民主共和国”，比五五宪草多“民主”两字，综合审查又翻案为“中华民国基于三民主义为民主共和国”，所争仅在“为”或“基于”三民主义，远不如民社党所主张的“中华民国为民主共和国”，来得明朗。理由如下：
5	001.第一条多了什么？.txt	15	苏维埃社会主义共和国联盟为工农的社会主义国家。	一、各国宪法都未标明什么主义，只有苏联宪法第一条规定：“苏维埃社会主义共和国联盟为工农的社会主义国家。”苏联这样规定是有条件的：①苏联除共产党外，没有第二个党派存在。②它真有一套社会主义制度，名副其实，与众不同。③国内人民没有阶级，利害相同，信仰一致，而中国显然不具备这些条件。国民党尚未真正统一全国，也不希望永久实施一党制。中国现状是多党并存，贫富悬殊，人民...
5	001.第一条多了什么？.txt	17	宪法草案，当本于建国大纲，及训政宪政两时期之成绩……	二、国大开后，宪政开始，根据孙中山先生遗教，宪政时期即还政于民。“还政于民”四字不论作何解释，总不能再还政于国民党一党。若宪法规定中华民国是三民主义国家，则国家已不啻为国民党所有，将置四亿人民于何地？若然，政权还来还去都是还给国民党了，“还政于民”，将何以自圆其说？且建国大纲第二十二条载：“宪法草案，当本于建国大纲，及训政宪政两时期之成绩……”国民党训政二十...
3	001.第一条多了什么？.txt	17	中华民国永为统一共和国	二、国大开后，宪政开始，根据孙中山先生遗教，宪政时期即还政于民。“还政于民”四字不论作何解释，总不能再还政于国民党一党。若宪法规定中华民国是三民主义国家，则国家已不啻为国民党所有，将置四亿人民于何地？若然，政权还来还去都是还给国民党了，“还政于民”，将何以自圆其说？且建国大纲第二十二条载：“宪法草案，当本于建国大纲，及训政宪政两时期之成绩……”国民党训政二十...
3	001.第一条多了什么？.txt	19	中华民国为三民主义民主共和国	三、就条文文法看，实也欠通。中华民国已有一个“民”字，这个“民”（Republic）应该就是共和，就是民主了。若宪草修正第一条用了六个民字，在字面为赘瘤，论意义则叠床架屋，婆婆妈妈，不成样子。有了民国，则三民应去一民。民国即民主共和国。有了民有民治民享，则三民全可删削了。全条意思变成这样：中华这个共和国，根据民族民权民生这三个主义（民权就是民主共和）它是民有...
3	001.第一条多了什么？.txt	21	三民主义就是救国主义	四、上面所说，不可解释为反对三民主义。我们只反对三民主义入宪。三民主义本是一种政纲政策，一个政党可为此而奋斗，一部宪法也可具体表现其精神，但宪法却不应加此花边。不应该的理由是：三民主义内容浩繁，在主义的形成与发展中，有阶段，有错综，到现在还没有人能给三民主义下个定义。孙中山先生说：“三民主义就是救国主义”，“三民主义也是共产主义”。这出入太大，以至不可捉摸。...
3	001.第一条多了什么？.txt	21	三民主义也是共产主义	四、上面所说，不可解释为反对三民主义。我们只反对三民主义入宪。三民主义本是一种政纲政策，一个政党可为此而奋斗，一部宪法也可具体表现其精神，但宪法却不应加此花边。不应该的理由是：三民主义内容浩繁，在主义的形成与发展中，有阶段，有错综，到现在还没有人能给三民主义下个定义。孙中山先生说：“三民主义就是救国主义”，“三民主义也是共产主义”。这出入太大，以至不可捉摸。...
3	001.第一条多了什么？.txt	25	中华民国为民主共和国	五、我们以为第一条“中华民国为民主共和国”就已足够，“民有民治民享”是林肯的话，拿林肯的话去限制三民主义，尤显得不伦不类，有欠雅驯。问题是在中华民国上不必挂主义的招牌。
7	002.“个人行为”并发症.txt	3	我们可以断定，江南是死于共党之手，江南命案是共党制造的。	江南案发生时候，国民党《香港时报》（一九八四年十月十九日）首先指出：“我们可以断定，江南是死于共党之手，江南命案是共党制造的。”“这次共党为什么要枪杀江南呢？扼要言之，其作用有三：一是破坏中华民国的形象；二是冲淡和平衡红虹及陆雨淅投奔自由之不利影响；三是藉此展开宣传攻势，转移港人不满《联合声明》的视线。”（《江南命案是共党制造的》）但是，事与愿违，到了一月十...
6	002.“个人行为”并发症.txt	3	这次共党为什么要枪杀江南呢？扼要言之，其作用有三：一是破坏中华民国的形象；二是冲淡和平衡红虹及陆雨淅投奔自由之不利影响；三是藉此展开宣传攻势，转移港人不满《联合声明》的视线。	江南案发生时候，国民党《香港时报》（一九八四年十月十九日）首先指出：“我们可以断定，江南是死于共党之手，江南命案是共党制造的。”“这次共党为什么要枪杀江南呢？扼要言之，其作用有三：一是破坏中华民国的形象；二是冲淡和平衡红虹及陆雨淅投奔自由之不利影响；三是藉此展开宣传攻势，转移港人不满《联合声明》的视线。”（《江南命案是共党制造的》）但是，事与愿违，到了一月十...
6	002.“个人行为”并发症.txt	3	涉案人之间的个人行为	江南案发生时候，国民党《香港时报》（一九八四年十月十九日）首先指出：“我们可以断定，江南是死于共党之手，江南命案是共党制造的。”“这次共党为什么要枪杀江南呢？扼要言之，其作用有三：一是破坏中华民国的形象；二是冲淡和平衡红虹及陆雨淅投奔自由之不利影响；三是藉此展开宣传攻势，转移港人不满《联合声明》的视线。”（《江南命案是共党制造的》）但是，事与愿违，到了一月十...
4	002.“个人行为”并发症.txt	3	个人行为	江南案发生时候，国民党《香港时报》（一九八四年十月十九日）首先指出：“我们可以断定，江南是死于共党之手，江南命案是共党制造的。”“这次共党为什么要枪杀江南呢？扼要言之，其作用有三：一是破坏中华民国的形象；二是冲淡和平衡红虹及陆雨淅投奔自由之不利影响；三是藉此展开宣传攻势，转移港人不满《联合声明》的视线。”（《江南命案是共党制造的》）但是，事与愿违，到了一月十...
4	002.“个人行为”并发症.txt	21	个人行为	一月二十八日，“蓬莱岛案”被告家属终于独立上诉。此事早在一审判决之时，被告就宣布不上诉、家属也不上诉，并且男女双方又招待记者又联合照相，以示行动一致。但是曾几何时，女方居然说在不上诉宣布之时女方不知情，因而要上诉；上诉后男方又居然说上诉之事男方也不知情，因此不忍深责，意谓家属有其独立人格，要上诉也是无奈，这又是“个人行为”并发症。
3	002.“个人行为”并发症.txt	21	蓬莱岛案	一月二十八日，“蓬莱岛案”被告家属终于独立上诉。此事早在一审判决之时，被告就宣布不上诉、家属也不上诉，并且男女双方又招待记者又联合照相，以示行动一致。但是曾几何时，女方居然说在不上诉宣布之时女方不知情，因而要上诉；上诉后男方又居然说上诉之事男方也不知情，因此不忍深责，意谓家属有其独立人格，要上诉也是无奈，这又是“个人行为”并发症。
6	002.“个人行为”并发症.txt	29	纯属立委个人的司法案件	这又是“个人行为”并发症。（事实上，“党部”早就秘密“协调”了，这在同一天的《联合报》也有迹可寻。所谓“纯属立委个人的司法案件”云云，都是谎话）
4	002.“个人行为”并发症.txt	29	个人行为	这又是“个人行为”并发症。（事实上，“党部”早就秘密“协调”了，这在同一天的《联合报》也有迹可寻。所谓“纯属立委个人的司法案件”云云，都是谎话）
4	002.“个人行为”并发症.txt	49	个人行为	总之，“个人行为”的说词，我们看来看去，实在无法不说它是一种新障眼法。有了这种新障眼法，则一切祸事、滥污、失信、反复、程序责任、法律责任、行政责任、政治责任，……都可“奇门遁甲”，推卸得干干净净。——这样子的“个人行为”，真是太自欺了；这样子的“个人行为”，真是太欺人了！
3	002.“个人行为”并发症.txt	49	奇门遁甲	总之，“个人行为”的说词，我们看来看去，实在无法不说它是一种新障眼法。有了这种新障眼法，则一切祸事、滥污、失信、反复、程序责任、法律责任、行政责任、政治责任，……都可“奇门遁甲”，推卸得干干净净。——这样子的“个人行为”，真是太自欺了；这样子的“个人行为”，真是太欺人了！
8	002.“个人行为”并发症.txt	51	尔虽不我责，我责何由逃？	我总觉得，检定一个地区道德水平的上下，端在看这一地区人物“负责度”的高低，“负责度”高的，遇事就要勇于面对，一如古诗所说：“尔虽不我责，我责何由逃？”只有这样勇于面对，一切错误才有改进的起点。一切都归咎于“个人行为”，只是一种怯懦、一种逃避、一种道德的沦落与迷失，这是要不得的。
4	002.“个人行为”并发症.txt	51	个人行为	我总觉得，检定一个地区道德水平的上下，端在看这一地区人物“负责度”的高低，“负责度”高的，遇事就要勇于面对，一如古诗所说：“尔虽不我责，我责何由逃？”只有这样勇于面对，一切错误才有改进的起点。一切都归咎于“个人行为”，只是一种怯懦、一种逃避、一种道德的沦落与迷失，这是要不得的。
3	003.三民主义口头禅.txt	3	没有奉行三民主义之故	三十六年前，国民党刚从大陆给赶到台湾的时候，曾经痛定思痛，检讨丢掉大陆的原因。检讨下来，原因众多，但是蒋介石却单刀直入，说出真的原因，乃在“没有奉行三民主义之故”！一九四九年十月，蒋介石在阳明山讲《军事改革之基本精神与要点》，慨乎言之如下：
3	003.三民主义口头禅.txt	5	三民主义是世界上最完美的主义	我在三民主义之体系及其实行程序中，曾经说明“三民主义是世界上最完美的主义”，一定可以战胜共产主义，而造福于中国人民和世界人类。然则我们今天为奉行三民主义而战的国民革命军为什么会失败，而共匪反能胜利呢？这就说明了今天我们军队的失败，就是没有奉行三民主义之故。换言之，就是我们军队已经失却战胜的基本条件，就是我们军队尤其是高级将领已经失却了主义的信仰，我们的军队已...
3	003.三民主义口头禅.txt	7	五十年来救国，三民主义为宗。五权宪法制度，以救政治之穷。民元以至于今，几于无人信从。三十五年纷乱，为私而不为公。	蒋介石这种国民党“没有奉行三民主义”的感慨，其实早在他说这话的四年前（一九四六年），就由他的亲密战友戴传贤（蒋纬国的真正爸爸）感慨过。戴传贤说：“五十年来救国，三民主义为宗。五权宪法制度，以救政治之穷。民元以至于今，几于无人信从。三十五年纷乱，为私而不为公。”可见国民党对三民主义“只有形式的信仰”、只“把三民主义当作了一个口头禅而已”的现象，早在国民党大员的...
3	003.三民主义口头禅.txt	7	把三民主义当作了一个口头禅而已	蒋介石这种国民党“没有奉行三民主义”的感慨，其实早在他说这话的四年前（一九四六年），就由他的亲密战友戴传贤（蒋纬国的真正爸爸）感慨过。戴传贤说：“五十年来救国，三民主义为宗。五权宪法制度，以救政治之穷。民元以至于今，几于无人信从。三十五年纷乱，为私而不为公。”可见国民党对三民主义“只有形式的信仰”、只“把三民主义当作了一个口头禅而已”的现象，早在国民党大员的...
3	003.三民主义口头禅.txt	11	把三民主义当作了一个口头禅而已	国民党逃到台湾后，虽然失国失民，不足以语奉行民族主义，但是小国小民，奉行起民权主义民生主义那三分之二，却也不无戏路。但是，三十六年下来，对这三分之二，国民党还是“只有形式的信仰”而已、只“把三民主义当作了一个口头禅而已”。
8	003.三民主义口头禅.txt	13	平生不学口头禅，脚踏实地性虚天	所谓口头禅，本是不能领会禅理，只是口头上袭用禅宗和尚常用的语言。宋朝王楙《野客丛书》附录《王先生圹铭临终诗》，其中说“平生不学口头禅，脚踏实地性虚天”，就是指此。三民主义最后沦为口头禅，它本身的空中楼阁、窒碍难行，固非无因，但是国民党宁肯挂羊头卖狗肉，而一路作伪、言行不一，则是今天陷入死巷的当然结果。三民主义是连自己都统一不了的粗糙理论，国民党却要拿它统一中...
3	003.三民主义口头禅.txt	23	三民主义教学研讨会	三民主义教学渐趋教条八股，致使青年学子丧失学习兴趣，是教育界学术界人士最痛心者，昨日师大三研究所长特别在“三民主义教学研讨会”中，介绍以数来宝、黄梅调等实作演出，来表现三民主义的生动活泼教育方式，非但让与会人士大开眼界，也建立起三民主义教学绝不一定是枯燥乏味的信心。
6	004.始知真放在精微.txt	7	在英国与共党有过接触	先说胡秋原，胡秋原早年参加共产党CY，又参加闽变叛国，抗战时加入国民党做中央委员并办党报，大陆丢掉时“打算做共党百姓”，不肯出来，后来才到台湾。有一次被派出去，竟“在英国与共党有过接触”而遭国民党党纪处分。他是一个反复多变的人，由于反复多变，政治上，自然也就不能被一再信任。因而在心理上，他有了一种幻想的被迫害症，他的自高自大自我膨胀，过份重视自己，使他老觉得...
4	004.始知真放在精微.txt	7	幻想的迫害者	先说胡秋原，胡秋原早年参加共产党CY，又参加闽变叛国，抗战时加入国民党做中央委员并办党报，大陆丢掉时“打算做共党百姓”，不肯出来，后来才到台湾。有一次被派出去，竟“在英国与共党有过接触”而遭国民党党纪处分。他是一个反复多变的人，由于反复多变，政治上，自然也就不能被一再信任。因而在心理上，他有了一种幻想的被迫害症，他的自高自大自我膨胀，过份重视自己，使他老觉得...
3	004.始知真放在精微.txt	7	打算做共党百姓	先说胡秋原，胡秋原早年参加共产党CY，又参加闽变叛国，抗战时加入国民党做中央委员并办党报，大陆丢掉时“打算做共党百姓”，不肯出来，后来才到台湾。有一次被派出去，竟“在英国与共党有过接触”而遭国民党党纪处分。他是一个反复多变的人，由于反复多变，政治上，自然也就不能被一再信任。因而在心理上，他有了一种幻想的被迫害症，他的自高自大自我膨胀，过份重视自己，使他老觉得...
3	004.始知真放在精微.txt	7	学术诈欺	先说胡秋原，胡秋原早年参加共产党CY，又参加闽变叛国，抗战时加入国民党做中央委员并办党报，大陆丢掉时“打算做共党百姓”，不肯出来，后来才到台湾。有一次被派出去，竟“在英国与共党有过接触”而遭国民党党纪处分。他是一个反复多变的人，由于反复多变，政治上，自然也就不能被一再信任。因而在心理上，他有了一种幻想的被迫害症，他的自高自大自我膨胀，过份重视自己，使他老觉得...
5	004.始知真放在精微.txt	9	其实胡秋原、徐高阮在翻译上的错误，早就是超越前进	我这段话中所说“其实胡秋原、徐高阮在翻译上的错误，早就是超越前进”，是有许多证据的，因为我当年看了胡秋原、徐高阮翻译一些东西，就粗略发觉错误错得比殷海光超越前进。但英文纠谬非我专长，我只是粗略发觉而已，若想一一细为揪出，还得劳动专家才成。台湾的英文专家虽不乏人，但是跟我渊源甚深并且我甚佩服的，却是我台中一中的英文老师陈绍鹏先生，于是我就找到绍鹏先生。
3	004.始知真放在精微.txt	15	始知真放在精微	绍鹏先生读书细心，然后放言高论，深入浅出。我看乔大壮刻印一方，文曰“始知真放在精微”，就联想到他这两篇文字。
5	005.这叫什么公开审判？（李敖·史通）.txt	5	李先生，陈启礼是军人身分啊，怎么可以不军法审判？	三月二十二日，董尚和先生打电话来，说：“李先生，陈启礼是军人身分啊，怎么可以不军法审判？”我劝他写出来，他说：“李先生，你饶了我吧！”我觉得董先生的提醒很有道理，乃约史通合作，写下这篇使国民党头疼的文字。
5	005.这叫什么公开审判？（李敖·史通）.txt	5	李先生，你饶了我吧！	三月二十二日，董尚和先生打电话来，说：“李先生，陈启礼是军人身分啊，怎么可以不军法审判？”我劝他写出来，他说：“李先生，你饶了我吧！”我觉得董先生的提醒很有道理，乃约史通合作，写下这篇使国民党头疼的文字。
4	005.这叫什么公开审判？（李敖·史通）.txt	9	现役军人	但是，一个问题来了，就是陈启礼真非“现役军人”吗？根据三月二十二日《联合报》刊载陈启礼的录音带内容，指出：
3	005.这叫什么公开审判？（李敖·史通）.txt	39	我是中华民国情报局的情报员，在情报局里面我的名字是郑泰成，……我的是属于‘基’六二一七，我的编号号码是七三〇〇六三……	从上面的报导，我们可以确认：不论汪希苓的目的究竟是为了狙杀海外叛逆也好，或是为了发展海外帮派也罢，国民党的情报局吸收陈启礼为情报员并加以训练的事实，已是毫无可疑的了。所以，陈启礼自述“我是中华民国情报局的情报员，在情报局里面我的名字是郑泰成，……我的是属于‘基’六二一七，我的编号号码是七三〇〇六三……”等话，应可相信。因此，陈启礼是国民党情报局的情报员，也是...
7	005.这叫什么公开审判？（李敖·史通）.txt	55	陆海空军军队、官署、学校及一切特设机关。	也视同陆海空军军人。又所谓“在乡军人”是指“在现役以外之兵役者及退役之准尉以上之官长。”（参见同法第七条）；所谓“陆海空军军属”是指“现服勤务之陆海空军文官。”（参见同法第八条）：所谓“部队”是指“陆海空军军队、官署、学校及一切特设机关。”（参见同法第十一条）。由此可见，编制在国防部属下的情报局，不论是“官署”也好，“特设机关”也罢，应属“部队”无疑。情报局...
6	005.这叫什么公开审判？（李敖·史通）.txt	55	非依召集而在部队服军人动务……之在乡军人	也视同陆海空军军人。又所谓“在乡军人”是指“在现役以外之兵役者及退役之准尉以上之官长。”（参见同法第七条）；所谓“陆海空军军属”是指“现服勤务之陆海空军文官。”（参见同法第八条）：所谓“部队”是指“陆海空军军队、官署、学校及一切特设机关。”（参见同法第十一条）。由此可见，编制在国防部属下的情报局，不论是“官署”也好，“特设机关”也罢，应属“部队”无疑。情报局...
