file	line	context
038.“五四”梦碎.txt	3	梁实秋在《“五四”与文艺》一文里，说“五四运动原是一个单纯的爱国运动，后来转变为新文化运动”。这一说法，是大错特错的。事实上，新文化运动在前，“五四”运动在后。“五四”运动发生在1919年，只有在广义的说法里，它才包括1917和1918年的新文化运动。而新文化运动，才是“五四”运动的基础。新文化运动是孙中山所命名的词儿，他在南方，深思远虑的把眼光投射到北京，他肯定了“一二觉悟者”所引起的“思想界空前之大变动”。他写信给海外同志，告诉他们“吾党欲收革命之成功，必有赖于思想之变化”，他极力赞美从北方起来的那个变化。可惜的是，所有的革命者都在思想变化过程中，就先政治挂帅了一切，于是，“五四”变成了一条岔路，“吾党”应“五四”而兴，“五四”却完了。
038.“五四”梦碎.txt	5	所谓“吾党”，其实有两个：一个是1919年成立的国民党，一个是1921年成立的共产党。这两个党，都是“五四”的受益人，都利用了“五四”的救亡的、救国的澎湃浪潮，大事接收。事实上，“五四”中顶尖的人物，多被国民党接收以去，不过，共产党也不吃亏，在国民党“联俄容共”的哥俩好决策下，它进入到国民党里，在1924年，跟国民党如胶似漆起来。据吴敬恒转述于右任和张作霖的谈话：“张作霖曾问于右任：你们国民党我赞成，我却不赞成共产党。于回答：中山先生与你同一心理，但异其手段。有人驱逐共产党，共产党便想法独立存在，中山先生把共产党转变为国民党，即共产党自然不存在。”在孙中山这一如意算盘下，他打算外靠俄援、内吃老共。这一打算，虽然一时占了便宜，可是长期斗争下来，却吃了败仗，从联俄容共到反共抗俄、从大陆称孤到台湾道寡，政策的日长正反映了领土的日消，在整个的局面上，国民党完蛋了，“自然不存在”的，不是共产党，而是别有其人呢！
039.“烈士”梦碎.txt	3	许强医师，台大医院前身台北帝大医科第一届毕业、日本九州帝国大学医学博士，曾任台大医学院内科副教授，并兼附设医院第三内科主任，1950年因“意图破坏国体，以非法方式颠覆政府”，被国民党政权枪决，当时才37岁。
041.“爱国”梦碎.txt	13	陈仪出身浙江求是学堂，是浙江大学前身。1902年留日，进日本士官学校第5期炮兵科，跟何成浚、姜登选同期。这一期学生是老资格的前辈，仅晚于蒋作宾一期，却早于张群五期。
041.“爱国”梦碎.txt	15	陈仪不但有日本士官学校的资历，还有陆军大学的资历，且是中国学生留日陆大第一期的毕业生。这种显赫的军事条件，使他早在1922年就担任了师长。
041.“爱国”梦碎.txt	19	冒充日本士官学校毕业的蒋介石，对陈仪很敬重。派他到德国考察，并聘请德国顾问。在欧洲半年，取道美国、日本返国。1929年4月出任军政部兵工署署长；5月任军政部常务次长。1934年任福建省主席。1937年以陆军中将加上将衔。1941年任行政院秘书长。1942年任行政院经济会议秘书长。1943年代理陆军大学校长。1945年日本投降，任台湾行政长官。
041.“爱国”梦碎.txt	33	陈仪有两首“无题”的诗，全文是：
042.“老贼”梦碎.txt	9	谷正纲出道甚早，他在1924年就加入国民党，那时他正在德国柏林大学留学。后来转赴苏联，入莫斯科孙逸仙大学，以国民党死硬派著称。回国以后，他投身汪精卫系，后来转入蒋介石旗下。不论对汪、对蒋，此公都是感情充沛、声泪俱下的。《白崇禧先生访问记录》中回忆汪精卫出走后，“谷正纲听了，当场号啕大哭，说：‘我保证汪先生绝不会做汉奸。’”《李宗仁回忆录》中回忆蒋介石下野前，“谷正纲忽忍泪起立大声疾呼：‘总裁不应退休，应继续领导，和共产党作战到底！’”正因为谷正纲有这种大声疾呼、声泪俱下的本钱，所以，他在社会部长、内政部长以降，一直位居党中要津。
042.“老贼”梦碎.txt	13	谷正纲一直视“世盟”、“亚盟”为其禁脔，可是在他年老昏聩以后，对外不得不由张建邦代他出马了。但谷正纲自己却不知道。他每天还照样去上班，只是感到公文少了，大叫公文太少，批得不过瘾。他的手下，乃假造大量公文给他批。在变态心理学上，有所谓“虚无的妄想”（Nihilistic Delusions），犯此病的，老是拒绝其本人的存在；而谷正纲者，正好相反，他过分承认他自己的存在。正因为他老先生过分存在，所以笑话不绝。
043.“老贼”又梦碎.txt	5	胡庚年是我父亲的朋友和同事，我父亲毕业国立北京大学，胡庚年先进南京金陵大学、再入南京国立东南大学，23岁去日本，先进早稻田大学、再入东京帝国大学，追随日本学者神川彦松研究国际政治，前后5年。他是一位爱国者，在日本留学期间，正赶上九一八事变，国际联盟派出李顿调查团（The Lytton Commission）调查真相，该团路过东京时，胡庚年曾递上英文报告书，并在帝国饭店向该团先行阐述真相。这种爱国绝不后人的精神，使他在归国后，毅然跟上国民党，先后任南京陆军军官学校政治教官、陕西韩城县长、陆军第38集团军军法处长、旅顺市长、辽宁青年团干事长、沈阳《中央日报》社长、沈阳市立法委员。
043.“老贼”又梦碎.txt	7	1949年胡赓年到台湾的时候，只有45岁，他是以国破家亡的心情，流亡岛上的。所谓国破，因为中央政府已经偏安；所谓家亡，因为他抛弃了发妻而与另一抛弃“发夫”的女子私奔抵台，这位女子，就是人称胡星妈者。胡庚年到台湾后，对政治已万念俱灰。1980年5月6日我与胡茵梦结婚的当天晚上，他请我和胡茵梦吃饭，谈到立法委员生涯，突然得意地说：“31年来，我在立法院，没有说过一句话！”我听了，感到很难过。难过的不是他放弃了他的言责，因为他们其实都放弃了；难过的是，他放弃了言责以后，居然还那么得意！这未免太不得体了。我忍不住，回他说：“立法委员的职务就是要‘为民喉舌’，东北同乡选您出来，您不替东北同乡讲话——一连31年都不讲话，这可不对吧？一个警察如果31年都不抓小偷，他是好警察吗？这种警察能以不抓小偷自豪吗？”
043.“老贼”又梦碎.txt	19	我为此公道恕词。
044.“大人”梦碎.txt	3	孟子说：“说大人，则藐之，勿视其巍巍然。”孟子毕竟是一代大儒，他敢于轻视那些政治人物，气概自是不凡。
044.“大人”梦碎.txt	5	中国历史上有孟子这一气概的人很少见，大家对政治人物，既畏且羡。这种态度，降至台湾地区，更形鲜活。台湾在清朝是边陲之地，建置以后，不过一府三县，论起官职，小之又小。转入日本统治后，一仍旧贯，台湾人能做的，不过委任之官，50年间，台湾只有一名简任官，而委任之官，也不过千分之十。故在台湾人眼中，一警察、一校长，无一不是大官，眼界之小，世罕其匹。到了国民党来台，名中央实地方，上下官位众多，台湾人见官心喜。一县长、一立委、一省市议员，就抢得不亦乐乎，抢到后洋洋自得，自以为巍巍矣，其实，就官职言、就中国言，这些都是小屁官，连“大人”都够不上。在有识之士眼中，他们只是“小大人”而已，一般说来，只是些“小人得志”式的“大人”而已。
044.“大人”梦碎.txt	7	政治人物追求虐待狂式的权力，追求到后来，肉麻当有趣，什么都要插上一脚，他们到处要文告、演说、剪彩、致词、颁奖、评审、座谈、题字、参观、巡视、去飞机场……一次画展，他们是贵宾；一次音乐会，他们坐第一排；一幕婚礼，他们是证婚人；一幕追悼会，他们是治丧主委……他们整天以此为荣，闹得别人也跟着一起做奴性配角。到了选举季节，这些人更是群魔乱舞，空头支票满场飞，五颜六色都出笼，巧言令色，更密集了政治人物的讨厌。
044.“大人”梦碎.txt	9	正因为台湾格局小，所以一次选举，全岛若狂，在朝者无“大人”相，在野者皆“小人”相，看来令人讨厌之至。一场选举下来，又增加了一批讨厌的嘴脸。“说大人，则藐之”的孟子，若生今之世、值此之岛，除了全是“小人”可藐外，欲求“大人”来藐，都不可得矣！
045.“活佛”梦碎.txt	3	诺贝尔委员会把1989年诺贝尔和平奖给了达赖喇嘛，理由是：“达赖喇嘛在寻求解放西藏的奋斗中，一直反对使用暴力，他主张使用以容忍和相互尊重为基础的和平解决方法，以期维护西藏人民的历史与文化遗产。”（Dalai Lama in his struggle for the liberation of Tibet consistently has opposed the use of violence. He has instead advocated peaceful solutions based upon tolerance and mutual respect in order to preserve the historical and cultural heritage of his people.）达赖喇嘛访问美国，美国国会领袖纷纷致词欢迎他，所说颂词，也与诺贝尔委员会如出一辙，并且还强调了他争人权的纪录。
045.“活佛”梦碎.txt	7	事实上，达赖喇嘛是最落伍、最黑暗、最迷信神权政教统治的代表，所谓“西藏人民的历史与文化遗产”，其实正是这种丑恶统治的护符。说“解放西藏”、为西藏争取自由吗？首先该做的，乃是该打破这种最落伍、最黑暗、最迷信的神权政教统治，才是当务之急。但是，从7世纪的吐蕃政权开始，到20世纪的达赖政权为止，西藏人民，完全笼罩在奴隶制与精神奴隶制的统治之下，又何来自由与解放？更何来人权？
045.“活佛”梦碎.txt	13	卜问写道：达赖喇嘛在1959年之前统治西藏地方的时候，也是有法的。这个法就是沿用了300多年的所谓《十三法典》和《十六法典》。在这两部法典中，按人的血统贵贱、职位高低，规定“人有上、中、下三等，每等人又分上、中、下三级”。藏王、大小活佛及贵族属“上等人”，商人、职员、牧主等属“中等人”，铁匠、屠夫和妇女等属“下等下级人”。各等人的生命价值也是不同的。法典规定：“人有等级之分，因此命价也有高低。”根据这两部法典的规定，做为“上等上级人”的“命价”为“无价”，或“遗体与金等量”；作为“上等中级人”的“命价”为“300至400两”（黄金）；而被列为“下等下级人”的铁匠、屠夫、妇女等，“命价”则为“草绳一根”，“杀铁匠、屠夫等，赔命价草绳一根”（见《十三法典》第7条《杀人命价律》）。为了维护这种“三等九级”的制度，法典严厉惩罚以下犯上的行为，《十三法典》第3条明文规定：“卑贱与尊贵争执者拘捕”；第8条规定：“伤人上下有别：民伤官，视伤势轻重，断伤人之手足；主失手伤仆，治伤不再判罪。主殴仆致伤，无赔偿之说。”《十三法典》第4条“重罪肉刑律”更规定肉刑为：“挖眼、刖足、割舌、砍手、推崖、溺死、处死等”。在旧西藏，不仅各级政府设堂办狱，而...
047.“上将”梦碎.txt	17	他的玩世，不但表现在待人处世上，甚至对他自己的冤狱也玩世出之。我为孙立人案做历史平反，编《孙立人研究》、《孙案研究》等书，由曾心仪访问到他，曾心仪回来说：“这个陈良埙，讲话不着边际，遮遮掩掩，使人弄不清楚真相。”这一作风，他的同案受难者也不乏同感，有人对他不无微词，我也当面打趣过他，我说：“是不是你被抓后受不了威胁利诱，出卖了孙立人？怎么大家都不谅解你？”他听了，只是笑。有一天，他心血来潮，写了一封信给“李敖（他故意写成‘傲’）老弟”，盼“老弟有以教我”，附有他在1990年3月写给调查孙案的三个监察委员的信，信中说：
047.“上将”梦碎.txt	27	陈良埙34岁坐牢，74岁死去。前半生英姿风发、飘然而来；后半生40年如一日，索寞以去。他用玩世式的天真穿透了一切，他欲说还休。可是，他想休说的，也被我穿透得一清二楚。这个人一生本该是一支蜡烛，燃烧自己，照亮别人；但时运不济，竟做了烟草商人，燃烧烟草，害了自己——他最后死于肺癌，结束了忧患的一生。麦克阿瑟引美国军歌说：“老兵永远不死，他只是凋谢。”虽云凋谢，也应有像样的凋法谢法，可是陈良埙这样凋谢，纵含笑九泉，也死不瞑目。中国古诗写：“何世无奇才，遗之在草泽。”从草泽四望，天苍野茫，这不仅是陈良埙的悲剧、孙立人的悲剧，也是孙案受难者和中国人民的共同悲剧。
049.“解严”梦碎.txt	3	1990年4月12日，马英九在所谓“蒋经国先生的思想行谊与事功学术讨论会”上，发表了一篇所谓“学术论文”，标题是《蒋经国先生与复兴基地建设》，里面说了许许多多与“学术”无关的肉麻话外，还写了许许多多根本不实的马屁“论文”。
049.“解严”梦碎.txt	9	诸如此类扼杀宪法上人民权利义务的，始作俑者，固是蒋经国的老子，但是真正执行人，却是蒋经国自己。蒋经国在台40年，他有40年的机会、又有30年的机会、又有20年的机会、又有老子死后12年的机会，他都毫不把握，最后，在40年的强人统治之后，在死前几个月里、在衰病侵寻中、在美国人的一再压力下，只不过虚晃几着、搞一点开放党禁、报禁、探亲的噱头、一点换汤不换药的解严戏，就备受马屁之颂了，这叫什么比例！又叫什么公道！
049.“解严”梦碎.txt	13	何况，纵使侈言开放，有的成效如何尚未可知、有的越解越严变本加厉（如对书刊的查禁，竟杠上开花，用到“违警”、“妨害秩序”等法令，尺度之严，前所未有）、有的还根本在言而无信的大开倒车呢！例如马英九马屁说：“嗣后行政院在草拟《国家安全法》的时候，经国先生也曾指示：‘解严之后，一定要放宽，绝不能换汤不换药。’他改革的诚意，确实是无可置疑的。”这话乍看起来，冠冕堂皇，其实所谓“解严之后，一定要放宽”，全是谎话。例如戒严40年，军事审判的案件，共有29407件之多，接近3万件。按照《戒严法》第10条，明明信誓旦旦向老百姓承诺过：戒严时期军事机关的审判判决，“均得于解严之翌日起，依法上诉。”《戒严法》这种承诺，绝没规定解严之后要另立他法替代、也绝没任何他法有把信誓旦旦53年的《戒严法》承诺一笔勾消的道理，因为这样做，必是典型的违宪。按照《宪法》第9条，“人民除现役军人外，不受军事审判”；按照《宪法》第16条，“人民有……诉讼之权”。戒严时期既然把人民给军事审判了，解严之后自然要允许人民行使诉讼之权以为救济，这种权利不容剥夺、更不容在承诺53年后剥夺、更不容在人民有所指望53年后剥夺。但是，这边声言戒严解除前夕，那边就高速冒出了《国家安全法...
050.“人才”梦碎.txt	11	蒋经国在台湾正式当权13年，等于日本吉田首相6年加上佐藤首相7年的总和。吉田茂做首相，前后用了93位部长；佐藤荣做首相，前后用了130位部长，他们为什么这样改组频繁？原因在提拔新人、培植新人，为国举才、为国储才。反看蒋经国，他却无此眼光、度量与气魄。及其死也，遗留在党内的人才，寥寥可数。更要命的，是这些所谓青年才俊的产生，却又来非正道。大体说来，他们都是些倖进之徒。他们只是蒋经国的“私暱”、只是“宠臣”，不是“大臣”。
051.“百分之百”梦碎.txt	5	台湾是中国领土的一部分，已是国际法大宗师格老秀斯（Hugo Grotius）所谓“超乎记忆所及”（going beyond memory）的源远流长关系，只要统治中国大陆的政权存在，台湾就是这政权领土的一部分，这种情况，除中间割让给日本一段时间外，前后皆不在话下。以为大陆的政权未曾统一到它，它就可以自外于中央了，其实这是一种诡论。这种诡论是台独分子向国民党学来的。
051.“百分之百”梦碎.txt	7	国民党说，台湾是大陆的千分之三。因为共产党统治不到这千分之三，所以中共非中国，因为“地理成分”不足，没有百分之百。但是，照国民党的历史，秦始皇明明统一了中国。实际上，秦始皇在他死前，也没把百分之百的中国统一。《史记》中有《卫康叔世家》，它起源于周朝分封时周武王的小弟弟那一支，这个小国，因为太小了，反倒苟延残喘，一直没被中央统一。直到秦始皇灭六国后12年，秦始皇死后1年，它的“总统”，才被秦二世废为庶人，才“卫绝祀”。若从秦出兵争天下起算，从惠文君到秦二世，凡122年，卫国有122年之久，独立于秦的“内政问题”之外，可是再怎么挣扎，它也是中国的。什么百分之百才算？你这不能自卫的小地方，又能卫到哪里去呢？
052.“美国”梦碎.txt	11	美国动用排山倒海的“柔性力量”（soft power）载歌载舞，在欢乐中使我们向往它，淡化它的恶形恶状。我们曾经向往过，但是，我们必须觉悟了。我们决心不再受骗了。
053.“反军购”梦碎.txt	3	1978年12月15日的台湾晚上，美国驻“中华民国”的大使安克志（Leonard S. Unger）突然收到华盛顿那边的神秘指令，叫他静候在大使馆里，听进一步消息。到了午夜，消息来了，说华盛顿在12月16日上午10点钟，要与“中华民国”断交，这是晴天霹雳，但不能先告诉“中华民国”，只能在断交宣布前两小时告诉，安克志在台湾混了很久，认为只给两小时应变，未免太残忍了，要求改为7小时，华盛顿那边同意了。于是，12月16日清早两点半，安克志透过宋楚瑜，叫醒了“中华民国”所谓总统蒋经国，在蒋经国睡眼和泪眼交织中，表达了66年的邦交关系即将在7个小时后一刀两断。对66年的邦交，如此无情，正是美国主子的拿手好戏，“中华民国”是什么不必多说了，“中华民国”的领导人，在美国主子眼中，的确是一条狗无误。因为美国用的政策正是“系犬政策”（leash on），从对老蒋到对小马，无一例外。
053.“反军购”梦碎.txt	5	从1946年2月22日，乔治·肯楠（George Kennan）由莫斯科大使馆向华盛顿发了第551号长电报，到第二年他以“X”笔名在《外交季刊》（Foreign Affairs）上发表大文章。美国一路在用大战略围困它眼中的敌人。1950年，继肯楠之后，保罗·尼兹（Paul Nitze）又指导出第68号文件（NSC-68），更积极的泰山压顶……接着下来的一连串思维，都是要用军备竞赛拖垮苏联。后来苏联垮了，美国又重施故技，要拖垮中国，事实上却是拖垮两岸。如果所谓台独分子聪明，应该坐山观虎斗，看中国美国军备竞赛，自己闪开。但这些台湾人太笨了，不但自己不闪开，反倒为美国做看门狗，还自费买骨头做看门狗、还被主子大赚骨头钱做看门狗，这不是贱贱贱贱的“贱种”吗？这个岛上，只有一个先知点破了这一贱相，这先知就是我，我登高一呼：“做看门狗还要自己花钱买骨头吗？”成为暮鼓晨钟。
053.“反军购”梦碎.txt	15	军购案的媚美过关，民进党必须得力于国民党的有媚一同。国民党在李敖的横刀立马下，迟迟而行。主席马英九推出所谓支持“合理军购”，至于什么是“合理”，却一路闪躲。2005年10月9日，它的党报《中央日报》上还登出“媒体报导，中国国民党主席马英九拟采纳幕僚建议，以‘准执政党’主席角度思考放行军购之必要性；不过，相关说法昨日遭到国民党多位军购小组成员驳斥，包括国民党国防专业立委帅化民、丁守中、苏起皆口径一致表示，小组最近没开会，党内对军购案亦尚未定调”云云，事实上，自马英九以下，他们都是媚美军购的共犯，与民进党不同的，只是付款方式而已，其他早已定调。对他们这些媚美军购的“军购汉奸”（含“军购台奸”〉，我早洞烛其奸，并且也知道最后拍板那一天，不论我怎么阻挡，都会到来。
054.误信“军购保台”的备忘录.txt	3	一、因为师承了蒋介石的仇共轻共宣传，所谓国防政策就是打打打，以兵凶战危为能事。再加上美国日本等从中媒孽，台湾居然以美日的“第一岛链”成员自居，做美日的看门狗，仗着美势日势，对付起中国人来。
054.误信“军购保台”的备忘录.txt	7	三、军购起算在美国承认中华人民共和国后第二年，当时是小买，后来越买越大，几千亿花下去了，最大一笔是连战下订的六千一百零八亿，这时李敖做了立法委员，揭竿而起，群情和之。国民党马英九以下被迫道出反对“凯子军购”，但赞成“合理军购”。但什么是“合理军购”，马英九却秘而不宣，也不群谋佥同，一直蓄谋偷渡。李敖乃指斥所谓“合理军购”根本不通，因为后面有个“购”字，就是不通、就是不合理。
054.误信“军购保台”的备忘录.txt	9	四、李敖指出：军购的法源是《台湾关系法》，但该法关键词是provide（供应），然后益之以make available to（供应）紧钉此义，明示是“供应”，不是“售予”。不可思议的是，自《台湾关系法》立法以来，美国政府对provide 一字，一直武断而霸道的解释成“售予”。此字在英文字典中从无“售予”之义。经查最新出版的美国众议院《2006至2007财政年度外交关系授权法》（FOREIGN RELATIONS AUTHORIZATION ACT, FISCAL YEARS 2006 AND 2007）小册，其中第234页倒数第14行中，赫然有“The President is authorized to provide (without charge)…”字样，足证美国立法单位业已明确将provide（提供）定义为without charge（免费），从而美国年年要台湾以巨资买武器，乃属不当得利。
055.误信“固守保台”的备忘录.txt	3	一、基于仇共轻共宣传的打打打政策，几十年来，在所谓国防上的花费，压得民不聊生也官不聊生。
055.误信“固守保台”的备忘录.txt	19	九、国防部所谓固守保台是自欺欺人的。军购对台湾只是象征、只是美国要求的表现决心，事实上买的是又不能对打、又不堪一击、又击也击不到、又击不胜击的定心丸，只是肥了美国军火商而已。
056.误信“美国来救我们”的备忘录.txt	5	二、驻美“地下大使”李大维在外交委员会向李敖也招认说：台湾变废墟，美国可能不来救台湾。依《台湾关系法》，美国会“严重关切”（grave concern）。李敖追问：“严重关切”不等于出兵。李敖举证美国参议员裴西（Charles Percy）就认为“严重关切”是不够的，要求改为“安全利益”（security interest）但是被否决了，否决理由是：用“安全利益”一词会迫使美国对中共采取军事行动！
058.“读经”梦碎.txt	15	经过明末以来朴学之进步，我们今日应该充分感觉六经之难读。汉儒之师说既不可恃，宋儒的臆想又不可凭，在今日只有妄人才敢说诗书全能了解。有声音文字训诂学训练的人是深知“多闻阙疑”“不知为不知”之重要性的。那么，今日学校读经，无异于拿些教师自己半懂不懂的东西给学生……六经虽在专门家手里也是半懂不懂的东西，一旦拿来给儿童，教者不是混沌混过，便要自欺欺人。这样的效用，究竟是有益于儿童的理智呢，或是他们的人格？
