file	line	context
243.胡适送我一千元.txt	3	在给姚从吾老师做国家长期发展科学委员会助理的时候，因为该会成立不久，一切还没有完全上轨道，所订一些规章不尽理想。在助理人员发薪上要拖上一阵子，就是一例。我身受其害，我忍不住了，决定不使姚从吾老师为难，直接“通天”了。——我在十月六日写信给老师的老师胡适，向他抗议。因为他是这个委员会的负责人。
243.胡适送我一千元.txt	5	胡适收信后，在七日就限时信寄到我新店山居，他写道：
243.胡适送我一千元.txt	19	胡适 五十年十月七日夜
243.胡适送我一千元.txt	21	我收到胡适的信和一千元后，非常高兴，也很感动。胡适是我爸爸的老师，虽然他早已忘了我爸爸的名字。他对我的赏识，纯粹是基于我的治学成绩使他讶异，他有眼光看出我是最有潜力的台大学生，我很感谢他对我的特别照料，这一千元的确帮了我大忙。也许有人说风凉话，说胡适此举，意在收买人心。但是他老先生这样做，对人有益，对己无害（除了少了一千元外），又何乐而不为？别的老先生，高高...
244.胡适通风报信.txt	1	胡适通风报信
244.胡适通风报信.txt	3	为了救急，我只好动用胡适寄来的一千元。但我决定不把这一千元作为赠款，只作为贷款，我决定借用一阵子后，把钱还给他。
244.胡适通风报信.txt	5	我在十月十日回信给胡适，表示我对他的感谢。信中细述了“李敖先生”的一些身世，其中包括我跟严侨的关系，和在严侨被捕后、死去后，我如何受到胡适自由主义的影响，因而在思想上得到新的境界。这封信写得很长，有五千字，写得很动人。我听说胡适收到信后，深受感动。他拿给几个人看，其中真巧，在十月二十八日叶明勋、华严夫妇去南港看他的时候，他把信又拿出来，因而从这对夫妇口中，得...
244.胡适通风报信.txt	13	严停云女士（《智慧的灯》的作者）和她丈夫叶明勋先生昨天来看我。他们说，严以侨已恢复自由了，现在台北私立育英中学教书。他喝酒太多，身体颇受影响。
244.胡适通风报信.txt	17	胡适 五十年十月二十九日夜
244.胡适通风报信.txt	19	胡适在信封上写“敬乞姚从吾先生便交李敖先生”字样，他不把这封信付邮，显然是怕被国民党邮政检查，对我不便。他真是细心的人，细心得不露痕迹，真是老到感人！
245.再见严侨.txt	3	严侨没死，太好了，透过华严，我得到严侨的地址，当天下午我就决定去看看他。看他的感想，我有一封信给胡适，提到重见严侨，说：“七年隔世，他真老了，脸上的皱纹、头上的白发、口中的酒气，没有任何一点能证明那是四十二岁的壮年！”这都是实情。严侨那时住在新生北路的陋巷里，住的是一幢老旧日式平房，我走进玄关的时候，他喊我名字，跑过来，抱住我，流出了眼泪。一切都有了改变，除...
246.债主死了.txt	3	一九五二年十月二日，胡适到台中来讲演，那时我在台中一中，头天在火车站递了一封信给他，第二天特别跷课去听，回来被训导主任谭卓民警告，我在周记里特别抗议，表示不服。念台大后，到胡适死前，我跟他偶有往还。在他送了我一千元后，我觉得受之有愧，决定1962年3月12日以前还他。到了2月，钱一直没着落，我心里很急，不料2月24日他突然死了，我真的“如释重负”，我想起《胡...
248.王尚义.txt	5	一九八三年六月，木令耆在海外发表《王尚义与李敖——一个时代的两种表现》，文章中说王尚义和李敖他们有“脱离了母系环境，少年被移植后的失落惆怅”的处境，是真的；说“正当他们开始有些对人生认识的知悟，正当他们想迎风而飘，随着祖国历史的潮流向前迈去，他们被父母带去到一个陌生的小岛，他们与祖国正动荡着的新时代隔绝了。”“既看不见天日，也无伸展之地”，是真的；“李敖的成...
250.我进《文星》.txt	3	1952年，萧孟能、朱婉坚夫妇在台北开了文星书店；五年后，1957年，这对夫妇又创办了《文星》。1958年，23岁的我写信给马宏祥，谈到知识分子从事文化事业的构想，我构想大家“真不妨做‘文化商人’”，以利“思想的传布”。我在信中举“台北文星书店及敦煌书店的主持人”为例，认为他们是优秀的“文化商人”。这封信所构想的“文化商人”，其实我们那些穷大学生是没能力做的...
252.真真假假的罪名.txt	3	《文星》在我的带头下，主张中国走现代化的道路，它的自由、民主、开明、进步、战斗等鲜明色彩，慢慢使官方串连出这些推论：《文星》是“匪谍头子”、《文星》走《自由中国》的路、《文星》是“生活书店”翻版、《文星》判乱、《文星》“在海外通匪”、《文星》“为匪宣传，与共匪隔海唱和”、《文星》反对中国文化、《文星》煽动青年、《文星》影响民心士气、《文星》诬蔑先烈、元首、《...
253.背后原来是蒋经国.txt	3	早在1964年起，情治背景的国民党就加入批斗，其中最明显的一人，就是写《文化界中一枝毒草》《文星与李敖》等书的侯立朝。1985年5月25日，林正杰的《前进》上透露，侯立朝告诉他们，“他曾是‘蒋经国的打手’，说他当年亲奉蒋经国之命，对《文星》集团开火。”我真“感谢”林正杰背离党外，大力批我，由于这种串联国民党情治人员批李敖的联合作业，我才在二十年后得知了这么奇...
257.《文星》永不复起.txt	3	到了一九六五年十一月中，正好发生了国民党中四组（文工会前身）主任谢然之与《征信新闻报》（《中国时报》前身）余纪忠的冲突，我索性“趁火打劫”，趁机以“清君侧”的讽刺，在12月1日《文星》第98期发表《我们对“国法党限”的严正表示》，直指国民党党中央。国民党立刻动手了，12月26日下午，我正在家里忙下一期的《文星》，萧孟能走进来，平静地说：“别忙了，休息休息吧，...
258.老子挡在那儿.txt	1	老子挡在那儿
258.老子挡在那儿.txt	3	整个事件的演变中，我与国民党既无渊源也不愿有渊源，且不善自保，一路死硬派；萧孟能倒与国民党有渊源，这种渊源不是政治的，是血缘的。萧孟能的老子是国民党萧同兹。萧同兹一九三二年起任国民党中央社社长，做到一九五〇年，做了十八年，后改任中央社管理委员会主任委员，到一九六四年离职。随后受聘为总统府国策顾问及国民党中央评议委员。他在国民党中德高望重，人事关系极佳，文星能...
258.老子挡在那儿.txt	5	在国民党眼中，你萧同兹儿子的事业，你是脱不了干系的。正因为如此，当国民党中常会上，自谢然之以下的小人们向蒋介石报告文星闹事应该严办的时候，蒋介石说：“把萧孟能、李敖先给党纪处分。”小人们再说：“但萧孟能、李敖不是党员。”蒋介石说：“萧孟能的父亲萧同兹是啊！要萧同兹负责！”——青天白日下的奥妙，原来在此！萧同兹对文星虽然无为不治，但他的老面子，却使消灭文星的作...
261.国民党的文宣头子.txt	3	《文星》惹来杀身之祸时，拿刀的走狗头子是国民党中央委员会第四组（文化工作会前身）主任谢然之，共产党出身，倒过来后被重用，权倾一时。他住在天母豪宅，看中了下女，奸之成孕，被太太发觉，怒将孕妇赶出家门。后来太太一想，自己既然不能生，何不收个儿子？于是遍寻下女，找了两三个月才找到。不料下女拿乔，敲了两万元，才把儿子交出。谢然之后来荣升中央党部副秘书长，再外放为驻萨...
265.蔡土蛋.txt	3	这一“国泰信义公寓”，是四楼公寓的顶楼，总价十二万，六万元付现进门，余六万元分期付款。我这户东面两户是文星资料室、西面一户由陆啸钊买到，四户相通。在起造过程中，我发现房子盖得不老实，偷工减料、面积也不足，我单枪匹马，跑到国泰建设公司去理论。它的老板蔡万霖亲自出来，很傲慢的向我威胁说：“李先生，你知道我们蔡家兄弟是什么出身的？”我说：“你们是流氓出身的。”他听...
272.我生平不怕同王八蛋合作.txt	3	方豪的例子，证实了好人需要“善霸”逼他做好事，好人多是伪君子，如果云龙契合，伪君子也会做出好事。我这种态度，才真真是“与人为善”。非但伪君子如此，甚至真小人真坏人也可以适时打造。我生平不怕同王八蛋合作，如果你厉害，使王八蛋无法施展他王八蛋那一面，他可能就变成一次好人，做出一次好事，《法门寺》中的宦官刘瑾，就是一例。有些伪善的人，并非不可救药。如果碰巧来电，也...
279.陶希圣公开攻击我.txt	3	最有趣的，陶希圣在拉我加入国民党不成，老羞成怒，在《文星》越闹越凶的时候，终于对我反目相向，在国民党第一党报《中央日报》上写短论批我。他先写了一篇《保全台大的名誉》（1964年9月2日），指我“诬蔑台大的文章，叛师毁友，极尽其架空造谣刻薄恶毒之能事。我们认为台大对于这种玷辱校誉的事情，应该依法追诉，无所用其姑息。”四天以后（1964年9月6日），他又写了一篇...
280.我拆穿陶希圣.txt	3	多年以后，胡秋原回忆说陶希圣和他前嫌尽弃了，又是好朋友了，我得知后，为之一笑。我笑陶希圣空在李敖头上做了一场好梦，最后撇清李敖，自以为得计，殊不知他太小看了李敖。李敖是要举行最后审判的，他难逃李敖的最后笔伐与报复。陶希圣在开革李敖二十五年后——一九八八年死去，活了九十一岁。死后，他的儿子陶龙生在国民党党报透露：陶希圣去做汉奸，是蒋介石秘密派他去卧底的。换句话...
281.五四人物罗家伦.txt	3	开国文献会全名“中华民国开国五十年文献编纂委员会”，形式上是罗家伦、陶希圣两人主持的。罗家伦是五四风云人物，跟我长谈了一次，印象最深的是外传他“一身猪熊狗”，见之果然，长得真是又怪又丑，更糟的是他的声带，此公声带有异，发音沙沙作响，好像公火鸭似的，他大夸我的文章多sharp，念出sharp这个字，因有sh的音，更是沙沙，非常好笑。其实他也可以sharp啊！可...
283.情人“H”.txt	7	“H”因为演过电影《窗外》的女主角，亦属台湾名媛。有一次，在中央酒店吃饭，邻桌有涂咪咪，是中国小姐候选人，也是台湾名媛。涂咪咪为了表示媛媛相惜，特委同桌一客人过来，向“H”说：“涂咪咪问你好。”不料“H”却傲然回问一句：“谁是涂咪咪？”“H”后来去美国了。抵美后，发现未婚夫不忠实，偷偷跟别人结婚了。“H”也厉害，她千方百计把未婚夫给抢了回来，结婚后又离婚了，...
285.与女人的四种关系.txt	3	我跟女人的关系，可分四大类，第一类是跟我有性交关系的；第二类是没有性交关系但有肌肤之亲的；第三类只是相识但却长入我梦的，所谓梦，主要是白日梦式意淫；第四类最邪门儿，是双方完全不相识的，这种“女人”，主要是她们的照片，尤其是裸照。对这类照片和裸照，我从大学便开始搜集，主要来源是从外国旧画报上取得，不过那时格于环境，所收品质不佳，直到我退伍回来，住在“四席小屋”...
286.小朋友们.txt	3	在文星时还有许多中学生的读者，我知道的有陈晓林最优秀，能文能译，可惜埋没在《联合报》。还有一位中学生读者，字写得歪七扭八，向我备致仰慕之忱，且由张菱舲转达此意，此人后来搞云门舞集，即林怀民。坐大后垄断舞蹈资源，与官方关系太好了。还有一位黄三（黄胜常），比我小十一岁，我在文星时候，他透过萧孟能夫人朱婉坚，与我结交。他的父亲是桂系要人黄雪邨，母亲是左宗棠曾孙女。...
287.余光中最无耻.txt	3	文星盛时，余光中对我最巴结；文星被封，余光中最先落井下石，萧孟能在日记中痛骂他。余光中演讲时不敢说出文星被封真相，反倒说是财务问题关门，为蒋家护航，最为无耻。他谄媚蒋氏父子，无正义感，被我一路痛骂。他厚颜说：“我不回答，表示我的人生可以没有他；他不停止，表示他的人生不能没有我。”什么鬼逻辑啊！你骂一个人无耻，他不回答，就能证明他有耻吗？不回答只能证明他无耻属...
288.女作家中最坏的.txt	3	文星时期认识了不少女作家。其中最坏的，是聂华苓。《自由中国》全盛时代，聂华苓跟前跟后的跟着享尽盛名。《自由中国》垮了、胡适死了、雷震坐牢了。聂华苓却怪起胡适来，说胡适鼓动雷震组党闯祸云云。现在，胡雷之间的密件，都由李敖和胡虚一（胡学古）公布了，文件俱在，胡适何曾鼓励过雷震？胡适生前，奉侍惟恐不谨；胡适死后，厚诬惟恐不严；这是伪君子行径，也是小人行径。文星时期...
289.三毛的伪善.txt	3	我第一次政治犯出狱后，有一次，皇冠的平鑫涛请我吃饭，由皇冠的几位同仁作陪，我到了以后，平鑫涛说：“有一位作家很仰慕李先生，我也请她来了，就是三毛。”于是他把三毛介绍了给我。三毛很友善，但我对她印象欠佳。三毛说她：“不是个喜欢把自己落在框子里去说话的人”，我看却正好相反，我看她整天在兜她的框框，这个框框就是她那个一再重复的爱情故事。如果三毛是个美人，也许她可以...
292.其他闺秀派.txt	3	三毛不是文星时期的女作家，她是晚辈。在三毛走红时节，她和其他女作家们，倒有一个共同优点，就是“不出其位”，三毛的范围是自恋、海市蜃楼的荷西和撒哈拉；琼瑶的范围是恋老师、苍白又苍白；于梨华的范围是恋别人汉子、一心想偷人养汉……她们不谈大道理、也不越位。但从聂华苓开始，却谈起大道理来，结果厚诬先贤、令人恶心。降至龙应台，则女人大谈起思想来。傅斯年曾做讽世之言，讥...
293.王崇五之言.txt	3	在文星的读者中，有一位请我吃饭，他是我台大同学王裕珩的父亲王崇五。他曾在俄国留学，是共产党，后来被判死刑。他的舅舅丁鼎丞是国民党大员，就拉他合作，免了死刑，还做到济南市长。到台湾后，担任国际关系中心副主任。他请我吃饭时，讲了一句很有意思的话。他说他给共产党办过《红旗》，他知道什么是好文章，并且知道怎么样办宣传。他这辈子看过的文章里，能有鲁迅的讽刺、胡适的清晰...
296.陈诚之言.txt	3	一九六四年五月二十二日，陈诚约我谈了两个多小时。他说：“今天台湾三十岁以下的男士，只有你李先生和蒋孝文是名人。”我说：“今天台湾的年轻人很难出人头地，老一辈的高高在上，内阁年龄平均六十六岁。八十开外的于院长、莫院长实在都该表现表现风气，该下台了。”陈诚说：“你说的全对，我也该下台了。这个问题不解决，一定是悲剧。”不过他最后说：“你李先生还不到三十岁，你前途远...
297.蒋梦麟之言.txt	3	在文星时，国民党大员我还领教过蒋梦麟，他是爸爸在北京大学时的代校长，在台湾主持农复会，他为了写《西潮》以外自传的事，约我到农复会，谈了许久。他本想找我帮忙，可是他一直不谈报酬，也许他的意思是先帮了再议，可是我的经济情况不允许我做完了再拿钱，此事就不了了之了。蒋梦麟与徐贤乐的婚事，闹得满城风雨。陈诚跟我说：他告诉蒋梦麟，如果与徐贤乐结婚，他们夫妇将不再去蒋家。...
298.叶公超之言.txt	3	我住水晶大厦时，有个邻居，就是叶公超。一九八三年十月九日傍晚，碰到叶公超的司机，因为我平日对老农老圃级的人士最有礼貌，他们最愿意同我聊天。司机说，叶公超死后，留下的遗嘱，他的朋友们全都不执行，人在人情在，人死什么都没有了。我说他们这些达官贵人的交情啊，看起来最热络，其实最虚情假意、最浅盘没根。所以，人活着，交情不过文酒之会；人一死，交情就是公祭上香了，任何深...
301.李焕外一章.txt	3	多年以后，李焕住我家附近。一九八六年一天晚上，我和小屯在附近一家小店买东西，在门口碰到李焕，他主动向我打招呼，伸手来握，二十二年不见，此公的记忆力实在惊人。他说他很久没看到我写文章了，其实那时我天天著书立说，只是国民党大员不读书耳！巧合的是，我和李焕、卢修一，三户人家都在同一警察管辖之内，李焕家浴室窗外正对着的，就是卢修一家的后窗。有一次，可爱的女人李庆安笑...
307.胡适批评李敖.txt	1	胡适批评李敖
307.胡适批评李敖.txt	3	一九六二年一月，胡适死前不久，对我有所评论，评论之言，都收在他的秘书胡颂平编的《胡适之先生晚年谈话录》和《胡适之先生年谱长编初稿》里。胡适说李敖“喜欢借题发挥”，说“作文章切莫要借题发挥”，他能够看出来我写文章的“喜欢借题发挥”，是他的高明处，但他把“喜欢借题发挥”看成一种大忌，却是他的大错特错。胡适在1930年写《介绍我自己的思想》，辩护他为什么要考证《红...
308.徐开尘约我写文章.txt	3	一九九〇年十二月，胡适百年诞辰，《民生报》的徐开尘要我写一篇纪念短文，我写了《胡适百年孤寂》交给她：
308.徐开尘约我写文章.txt	5	《读书周刊》要我写一千字谈谈胡适的文字，以纪念胡适百岁诞辰。我想今天赶时髦谈胡适的人虽多，但是真正与他有渊源有交往的，恐怕百不得一。我生在1935年，胡适大我四十四岁，跟小他四十四岁的青年朋友“忘年交”，我是唯一的一个。自我以下，不但赶不上和他有渊源有交往，甚至连见过他的人也不多了。——他毕竟是老去的五四人物了，距离我们太远了。
308.徐开尘约我写文章.txt	7	我初见胡适在1952年，那时我是台中一中的学生，跟他只匆匆说过几句话；七年后，1959年，他约我单独大聊了一阵，那时我是台大学生。后来又见过几次面，通了几次信。1961年我进台大研究所，他得知我穷得裤子进了当铺，特别限时信寄来一千元，并写给我说：“……过了双十节，你来玩玩，好不好？现在送上一千元的支票一张，是给你‘赎当’救急的。你千万不要推辞，正如同你送我许...
309.我可能反下山门.txt	3	我在《胡适百年孤寂》写道：
309.我可能反下山门.txt	5	胡适是我父亲在北京大学时的老师，并不是我的老师，但他跟我说，他完全不记得我父亲这个学生了，这是我父亲在北大成绩并不出色的缘故。胡适的学生姚从吾是我老师，姚从吾写信给人说，胡先生待李敖如罗尔纲。罗尔纲是胡适贴身的出色徒弟，身陷大陆。胡适特别亲题罗尔纲《师门五年记》一册寄我、又当面送我一册，我感到姚从吾老师所说，不为无因。在胡适眼中，我是出色的，可是没等我念完研...
309.我可能反下山门.txt	7	不过，今我老去，我倒有点怀疑徒弟之说，只是一种胡适的愿望。我不就是姚从吾的徒弟吗？但最后的结局却是这徒弟很友好的反下山门。像我这样恃才傲物的人，能够安于做人徒弟吗？这样日新又新的人，能够跟个老师而不《谢本师》吗？
310.他百年孤寂，我千山独行.txt	3	我在《胡适百年孤寂》收尾写：
310.他百年孤寂，我千山独行.txt	5	胡适死后八年，我为《胡适给赵元任的信》编标题，在一封被我标做《收徒弟的哲学》一信里，重温他引清朝学者李恕谷的话：“交友以自大其身，求士以求此身之不朽。”我颇有感悟。胡适生前交朋友以“自大其身”是热闹的，但他死后，他的朋友却犹大者天下皆是也，幸亏有我这种“士”来不断从大方向以“不朽”之，或聊偿其所愿。梁实秋在《读<胡适评传>第一册》中说，胡适告诉他“台湾有一位...
311.胡适也是“匪谍”吗？.txt	1	胡适也是“匪谍”吗？
311.胡适也是“匪谍”吗？.txt	3	在官方对我的秋后算账外，胡秋原他们也没闲着。他们利用他们取得的一封信，对我落井下石。1966年11月7日，在台北妇女之家举行声讨李敖大会，“邀约了国青民三党人士和若干文化界的朋友三十人”（有陈启天、胡秋原等等，最令人不可思议的，当时我已离《文星》，《文星》实际老板萧孟能竟然还派胡汝森去参加呢！），开会斗倒李敖。徐高阮等当场油印公布了我在新店山居时给胡适的信，...
311.胡适也是“匪谍”吗？.txt	5	在整个公布李敖给胡适的信的戏路里，最有趣的一项，是国民党们对这封信的种种离奇解释。胡秋原《中华杂志》登徐高阮在声讨大会上的谈话，报导徐高阮说：“这一封信是民国五十年（1961）11月间胡先生交给他的。当胡先生交给他的时候，态度虽不严重，也不轻松。约四五日后胡先生即入医院，再出院不久就逝世了。他现在对社会公开这一封信，而负一切的责任。”徐高阮的结论索性直指李敖...
312.我被检举“知匪不报”.txt	3	我感念胡适在我艰困时送了一千元给我。一九六一年十月十日，我写了一封长信重诉生平。这是一封动人的信，胡适看后，拿给一些人看，当他拿给叶明勋、华严看的时候，得知严侨之死，只是误传，他赶忙写信通知了我；不过，当他拿给徐高阮看的时候，却被这共产党变节者、国民党卧底特务、中央研究院副研究员扣住不还。这时胡适突然死了，信落在徐高阮手中，变成了李敖“知匪不报”并且“预谋投...
313.“反反复复”的家伙.txt	3	最反讽的，是当年把自己戴过的红帽朝别人头上掼、举发李敖是“匪谍”的胡秋原自己，居然跑到“匪区”去了，并公然主张联“匪”统一，最后且是所谓统一联盟名誉主席！人世角色转变，滑稽如此，真不知胡主席何以自解也！天下竟有一边叫抓“匪谍”一边喊联“匪”的，这是哪国的“一介老儒”啊？雷震日记中透露胡秋原此人“反反复复”，雷震大概不知道“反反复复”的实际记录，计开：胡秋原做...
315.胡适没写完的一封信.txt	1	胡适没写完的一封信
315.胡适没写完的一封信.txt	3	我在文星走红时候，一九六三年夏天，台大校长钱思亮约我长谈。谈到胡适，这位胡适的干女婿透露了一个秘密，他说：“胡先生死后，留下一些遗稿，其中有一封写给你的信，可惜没写完，所以你直到今天还看不到。信中有一段是胡先生否认你在《播种者胡适》文章中提到的六万美金的事，你说政府送他六万美金宣传费，胡先生退回了。你写出胡先生这种高风亮节，对胡先生是好的。可是胡先生否认对他...
316.中央研究院不准进门.txt	3	语言学家、中央研究院院士李方桂来台，姚从吾老师请他吃饭，他说他佩服李敖，盼能约李敖一起吃。1963年5月8日，我在心园同他们吃了一顿饭，在座有毛子水、吴相湘等。姚从吾、吴相湘两位老师绝口不提我离文献会事，我也绝口不提。5月26日，余光中向我说：“梁实秋先生听说你失了业，想替你找事。”后来我才知道，梁实秋不让我知道，直接写信给中央研究院院长王世杰和历史语言研究...
325.对他印象奇劣.txt	3	我同殷海光的第一次谈话，就在并不投机的情形下做一结束。我对他印象奇劣，虽然我喜欢他那光芒四射的文章，可是对他这个人，我却十分倒胃，倒胃得甚至不想选他的课。我的逻辑选的是曾天从开的课。曾天从其笨无比。我不知道殷海光对我第一印象是怎样的，大概也不会好，因为两人谈得极不投机。我在逼问他一个问题：“骂国民党是对的，国民党真的该骂。我要请问的是：你过去为国民党主持过宣...
