file	line	score	tags	quotes	text
086.老树开菜花.txt	55	4	proverb|quote|political_context		到了日本统治台湾的时期，日本人真正的精致文化，没有到台湾。所以我们在台湾看到的一开始是流民的文化，然后变成日本流氓的文化，很多日本浪人在台湾，流氓的文化；然后再到了50多年以前，台独分子眼里的这些中国人到了台湾，叫做流亡的文化。故宫博物院所代表的文化就是典型的流亡的文化，中国的古代宫廷的这些所谓奇技淫巧这些东西，然后运到台湾展示出来。所以我们可以看到很有趣的现象，有一次好多年以前，我跟谢长廷还有林永丰医师，我们一起到阳明山去玩，在阳明山我们坐在那里，谢长廷坐在我旁边就聊天，谢长廷讲了一句话，他说有些东西真的应该还给中国大陆。譬如说故宫博物院这些古物，这几十万件的古物应该还给中国大陆，因为的确不是台湾的，也不是国民党的，应该还给中国大陆。可是这几十年来我们台湾花钱买的这东西，当然就属于台湾的。可是我们问问看，这几十年来台湾买了什么东西？买了半天也是大陆流出来的东西。好比说台湾每年的故宫的预算很少，也不过3000万多少钱，可是有人有的时候花了1亿多的特别预算，买了什么？买了个什么鎏金佛，秦孝仪时代干的这种事情。买了这些佛像干什么？不要买这么多，也不要买这么贵，可是买来干什么？我们可以知道，买来也是中原的文化。
087.陈水扁有脸谈杰斐逊吗？.txt	11	4	proverb|quote|political_context		今天讲的第一个题目，好像有点问题，叫做陈水扁卵翼下的那个女人。哪个女人呢？就是吕秀莲嘿嘿嘿这个事件中的那个女人。我们可以看到所谓《新新闻》诽谤吕秀莲的案件，法院宣布改成4月10号才宣判。为什么延期宣判？因为这件案子的法律争执，有了新的证据出现了，包括新的录音。这个案子很有趣，明明是一个吕秀莲在电话里面，向她所相信的人来讲总统府里面有绯闻案出现，什么绯闻呢？嘿嘿嘿？绯闻的意思重点就是说陈水扁在扯到女人，就是当时在给陈水扁做翻译的那个外国人，还不是中国人，不是台湾人，还没取得国籍，就是萧美琴。当时这个嘿嘿嘿案子一闹出来的时候，本来大家都锁定在陈水扁总统府身边的绯闻案。可是忽然由于吕秀莲告了《新新闻》，这个案子的焦点被转移了。从总统府里面的绯闻案转到了吕秀莲和《新新闻》的事件上去了。大家不觉得很奇怪吗？怎么样给它移焦了？把焦点移走了。为什么移走了？大家忘记了这个绯闻案。我告诉各位，以我李敖的看法，我觉得本案是真的，真的不是说一定要发生在萧美琴身上。为什么呢？因为萧美琴的漂亮，那个水准是陈水扁所达不到的，换句话说这个陈水扁土蛋，他的审美标准是吴淑珍式的，而不是萧美琴似的。让他来选择女人，他的格调还到不了萧美琴的这种水准。所以他并不会以为萧美琴怎么好看，因为他的水准审美标准很低。可是为什么可能发生在陈水扁和萧美琴身上？
087.陈水扁有脸谈杰斐逊吗？.txt	23	4	proverb|quoted|political_context	谁说的？	我觉得阿扁真是太不要脸了！今天阿扁说，赫鲁晓夫双眼狠狠地瞄向群众，问到：“谁说的？”阿扁讲这个故事，意思是说钳制言论自由和他无关。可是今天我们告诉各位，什么人在双眼狠狠地瞄向群众？今天有一个人两个眼睛狠狠地瞄向群众。什么人？陈定南。陈定南公开用外患罪来搜查媒体、来整别人。谁用的陈定南？我李敖现在眼睛也这样子，狠狠地瞄向观众，请问谁用的陈定南？阿扁用的。使我想起个笑话，就美国的有名的喜剧明星叫鲍勃·霍普，他讲了一句话，里根总统的好朋友在讲笑话描写里根总统，他说里根总统不要说谎话，为什么？因为有人替他说，里根总统不要说谎话，因为有人替他说。今天阿扁不需要两个眼睛狠狠的对着群众，或者对着媒体。什么原因呢？有人两个眼睛狠狠的替他来对。什么人？他的走狗陈定南。不是吗？阿扁口口声声谈到自由民主、谈到宽容、谈到言论自由，可是现在当了总统以后，一连三次搜查媒体的是什么人呢？就是你阿扁。不是吗？我是不咬人的，我的狗咬人，放出条狗来咬你们。大家怕这条狗不是一样吗？这走狗就是陈定南。不就是吗？我在第2次做政治犯坐牢的，我们在北所就发生一个事情，说你们管理员不可以打人，监狱的禁子牢头、狱吏也不可以打人，有一个人就踢一个囚犯，把人踢得要死要活，他说我没有打你，我用脚踢你。今天不是这样子吗？阿扁说我没有干涉言论自由，我没有用两个眼睛凶狠的瞪着你们，那是斯大林。可是现在问题来了，谁是执行阿扁打击媒体的、干涉言论自由的人？不就是阿扁的走狗陈定南吗？广告过后继续讲。
087.陈水扁有脸谈杰斐逊吗？.txt	27	4	proverb|quoted|political_context	死了|水蛭	请大家看我李敖写的一篇文章，在当年我写一本书叫做《蒋经国研究》，然后标题说蒋经国死了。注意那个时候蒋经国没有死，蒋经国没有死，怎么搞的蒋经国死了？我是开一个玩笑，就是《自立晚报》吴三连这些伪君子，他们登个广告说是李敖死了，并且说李敖是水蛭。我也不吭不响，我也透过我母亲的名义也去买个广告，我们到时候要登了，到时候广告稿拟好了以后就送进去，他不敢登，为什么不敢登？上面我写的是吴三连死了，你这发行人也死了。为什么不登呢？他不登我才知道，原来你知道登了别人死了这话是不对的。对不对？结果吴三连我说你死了你就不登，你说我死了，那我告你。告到法院以后，注意当时的司法院长就是丑八怪黄任中的爸爸黄少谷，他领导下的法官就判无罪。所以我就注明了一句话，说别人死了无罪，好了我就写出来蒋经国死了，看看有没有罪！所以蒋经国没死，我就用这个标题说蒋经国死了。我里面就说的很清楚，根据司法院长黄少谷管辖下台北地方法院院长吴树立属下法官杨丰卿的判决书、根据司法院院长林洋港管辖下台湾高等法院院长罗萃儒属下法官杨力行、许增男、胡森田的判决书，这样以“死了”宣传活人，并说这种人是“水蛭”，一点也没关系！不算诽谤人！既然你法院这样判决，那么我就说蒋经国死了，就这样来玩出来了，大家不敢吭气。
088.邱彰掉到国特手里.txt	39	4	proverb|quote|political_context		我刚才谈到了，辛辛苦苦的龙应台，为了尽量的认同台湾、认同本土，到处找古迹，找要保留的房子，结果在阳明山就找到阎锡山的故居。我讲过，大家忘记了1949年这个外来政权的政府正式搬到台湾的，请注意不是蒋介石，至少形式上不是。因为蒋介石已经从总统上面退下来了，副总统事实上是总统叫李宗仁，所谓代总统到了美国，不敢回来，被蒋介石威胁不敢回来。所以真正把中央政府迁到台湾的人是当时的行政院长，他的名字就叫做阎锡山。所以我们看到报纸上出来了：龙应台踏勘山西窑洞形式官舍，阎锡山故居别有洞天。为什么呢？它是在阳明山冷水坑下的永公路上面有一个房子，然后走上去，这就是阎锡山的故居，我们看到龙应台在查看。同样我们看到：阎锡山故居，重开历史大门，龙应台造访，房舍完好墨宝仍在，台北市文化局研议妥适保存，我们看得很清楚。
088.邱彰掉到国特手里.txt	49	4	proverb|quote|political_context		他知道过去反对蒋介石，蒋介石对他不满，他把行政院长立刻交出来了，交给陈诚，就是伪君子陈履安的爸爸。然后他就藏在阳明山，在阳明山里面挖个洞啊，他藏在里面。我告诉你，他藏在里面的时候，就这个地方，刚才我讲过照片里龙应台去的这个地方，没有自来水，也没有电灯，他自己就跑到阳明山，带着他的这个左右，就藏在这个山洞里面。当然旁边盖了一些小房子，在里面藏起来。干什么？给蒋介石看，我绝对不会跟你作对，你也躲我远一点啊，他就藏起来了，最后呢，就这样子死在了阳明山。你不觉得好有趣吗？这就是今天的龙应台说阎锡山故居被我们发现了，我们要保留。值不值得保留？我觉得值得保留，因为太有趣了。就是这么一票人物，辛亥革命时代的人物居然阴错阳差，跑到了台湾，并且死在台湾。所以我们可以看到最后阎锡山死在台湾，可是死的太有趣了，因为他为了躲避蒋介石。所以我们看得很清楚报上说：这时候的阎锡山就是住在这栋房子里面，过着深居浅出的山中岁月。他的副官说这里原是日本人没有完工的一个农场，没有公路、没有自来水，也没有电灯电话，什么都没有！阎锡山就躲避炎热和台风，都藏在里面。我告诉你，漏了一句话，还躲避蒋介石，所以他藏在这个山洞里面。今天呢，被我们伟大的文化局长龙应台看中了，要把这个故居保留。我赞成。为什么呢？留给台湾看。台湾觉得好奇怪，我们台湾倒什么霉，居然有阎锡山这号人物，辛亥革命时期的人死在这个岛上。可是还没完，还有更精彩的广告过后，我告诉你。
088.邱彰掉到国特手里.txt	53	4	proverb|quote|political_context		可是我告诉各位，阎锡山这个系统在山西的，他们不是蒋介石这个系统的，可是他们制造了个奇迹，就是说太原最后被包围的时候，有500个人，包括他们省警察局局长，500个人跟共产党最后作战打死了，叫做五百完人。蒋介石那时候打败了以后，正好缺货，就没有烈士啊，没有这么多烈士来给我们宣传。怎么办呢？忽然发现山西太原出了500个烈士，好极了！蒋介石就接过来了，就变成了太原五百完人。请大家看，当时那天的报纸：圆山今天举行公祭，遥招五百完人魂。总统主祭，五院长陪祭。看到没有？看到这报纸都黄掉了，为什么呢？这个报纸是40年就是1951年2月19号的《中央日报》，我都保存到现在，就是我保存了51年了。然后可以看到《中央日报》40年2月19号的社论说：魂兮归来！就是招魂，招这五百完人，然后蒋总统祭五百完人。为什么有五百完人呢？大家不晓得这个地方，常常会忽略。我们从中山北路走下去以后，快到士林的部分左转，左转之后，右边有个小山坡，山坡上面走上去以后就是圆山饭店，圆山饭店以前有台北市天文台，现在拆掉了，旁边有一堆树，树里面有一个宫殿式的房子，就是这个房子太原五百完人的一个招魂冢。你们人死了我们招你们魂，把魂招回来。大家看我写了本小说《上山·上山·爱》，里面就谈到这段话，为什么呢？我李敖这本小说还没写完，就被查禁。查禁的原因就是说，你侮辱了革命先烈。什么原因呢？你说五百完人是假的。为什么呢？后来被我抓到名单，一个个掀出来，就很多完人没有完，还活着；有的还到了台湾，名字都改了，根本没死；有的当然也死掉了啊。所以我讲的这个故事，结果台湾的警备总司令部就把我的书，没写完就查禁，说侮辱壮烈的革命先烈。就这本《上山·上山·爱》的这本小说里面有一段呢，就讲到了五百完人。
089.美国爸爸救命.txt	49	4	proverb|quote|political_context		这是当时我说的话，请大家看当时还要人写篇序，在我的序以后写篇序，大家看他标题是《民意——执政之钥》，它的名字叫做陈水扁，当时台北市长，我们看陈水扁那句话，他说：身为民进党的一份子，至少可以让自己谦卑的期望，我们现在所做的一切将来都可以向台湾人民展现本党执政的用心和截然不同于国民党的作风。如果，台北可以成为希望的城市，未来民进党执政的台湾也必然可以是一座希望的岛屿。有趣吧！七年以前陈水扁这样讲，甚至五年以后民进党执政了，陈水扁这些话放屁！为什么是放屁？因为他告诉我们说，他说民进党所做的一切都可以向台湾人民展现本党执政的用心和截然不同于国民党的作风。今天做的完全是国民党的作风，比国民党还国民党，比国民党还腐败，腐败的速度比国民党还快。大家知道吗？太阳底下没有新鲜的事情。同样呢，我们再看陈水扁后面又一篇序，这个序叫做《国民党才是最大的台独》，作者是张俊宏，民进党的前秘书长啊，现在的立法委员。我们看张俊宏的两段话，最后说：民进党长久受国民党残暴的凌迟，如何解除斯德哥尔摩症候群，摆脱暴力、暴党、暴政的崇拜症。愿大家一起想一想如何解除执政的瓶颈，培养气吞山河、恢弘壮阔之局，相信必能开展创世之象。希望大家共襄盛举！
090.汤耀明“祈战死”.txt	11	4	proverb|quoted|political_context	祈战死|祈战死|祈战死|祈战死|祈战死|祈战死|祈战死	李敖大哥大。今天讲第一个题目是汤耀明“祈战死”。为什么“祈战死”用括号？我先讲什么是“祈战死”？如果听广播的朋友们会听到，祈是祈祷的祈，战是战争的战，死是打死的死。为什么国防部部长汤曜明“祈战死”？“祈战死”是我给他加上去的三个字，大家看到画面里面就是汤曜明。请注意，他可是台湾人，他不是外省的将军，他是台湾人。汤曜明为什么“祈战死”？“祈战死”是日本人过去对出征的军人，有一个欢送的仪式，我们常常就看到那个牌子举起来或者布条举起来，上面写了三个字叫做祈战死。就是说军人出去作战，我不是祈祷你回来，并不是希望你回来，我是希望你在沙场上面打死，为国捐躯。大家想想看，我们有一个谚语叫做马革裹尸，马的皮革来包裹着尸体。什么意思？就是我在前方作战，我打死了，我的马也打死了，我怎么回来呢？我用马的这个皮把我尸体包回来，所以叫马革裹尸。这是汉朝了不起的将军马援的一句话，他说，我们大丈夫不要死在子女面前，死在儿女的怀里，不可以的！我要马革裹尸，我要战死在前方，然后用马皮包着我的尸体回来表示这种悲壮，有的人虽然不在第一线作战，可是他在后方指挥也属于一级的这种战士。像第一次世界大战法国的老虎总理克里蒙梭，他最后死的时候下命令所有的护士先走开，他不可以死在女人面前，他是男人，他不可以死在女人面前。当然这种事情会被新女性族群抗议，可是当时他这种男人气概，他说我不要死在女人面前，并且死了以后放在棺材里面，这个棺材要给我立正站好，不能平着放那里，这棺材立着的，表示说我死了以后，也要很挺拔的站着死掉，这是一种英雄气概。
090.汤耀明“祈战死”.txt	15	4	proverb|quote|political_context		为什么呢？当核子武器打过来的时候，台湾海峡的台湾、日本、南韩首先遭殃，而美国所守的害可能还没有台湾受的多，我们为什么去做炮灰？所以我们看到了这个情况。这时候美国发表出一种声音来，他们说台湾的军人不会为台湾作战，换句话说认为台湾的军人是有问题的。美国五角大厦有些人认为台北的军方不能或者不愿意保护台湾，就出来这么一个讯息。这个时候汤曜明又发表谈话，请大家看他说：战至一兵一卒。最后剩下一个兵了，我们也要打到底。所以汤曜明这个战至一兵一卒的说法，是因为美国的中国问题专家江文汉论文摘要明白表示，他们说美国国防部有人认为台北的军方不能或不愿保护台湾。所以，汤曜明说了这样一句话，我们不但要保护台湾，我们还为台湾可以打到了最后一人，战至一兵一卒。所以我们报上看到这个汤曜明说：国军愿战到一兵一卒。立法院答询指国军有为国家牺牲准备，必要时焦土作战。
091.余政宪含沙弄祖.txt	23	4	proverb		我今天的标题叫做余政宪含沙弄祖。大家知道这个典故吗，叫含沙射影。什么叫做含沙射影？含沙射影，就是中国古代的一个典故，有一种鬼叫做蜮，一个虫子旁，一个或者的或，当你人走到水旁边，有个影子在水里面投影，他就嘴里面含个沙子就射你里面的影子，射到影子以后，你本人就会生病，你的影子被射到以后，你会生病。像中国古代的人，他不肯照相，因为照相以后，在摄影机里面的那个是反过来的，那个底片是反过来的旧式的摄影机。中国人认为，我怎么在你这个照相机里面人会反过来？那我魂都被你勾走了。所以中国人一开始不肯照相，这就是因为有很多原因，人的魂会被你勾走。怎么样被勾走，先被广告勾一下，再继续跟大家谈。
093.见有一匹灰色马.txt	25	4	proverb|quote|political_context		在西班牙这样浩劫的过程里面，这个将军我讲过，就代表法西斯的就是佛朗哥将军。那么看起来非常的神气，事实上他只有160公分高。在这个故事里面，他当道以后，我刚才讲过，有40万人越过比利牛斯山跑到法国，其中很多的共产党，大家看到这个团队，越过法国跑掉了。然后，就进入了我今天所要讲的这个故事。大家看到没有？越过比利牛斯山。干什么？BEHOLD A PALE HORSE,看到一匹灰色马，看到死亡。什么意思？我告诉你这个小说被拍成电影，还是大明星演的，可是由于我们世界的人大家水准不高，没有特别重视这个电影，我今天把这个背景给大家讲一下。这个电影在中文名字翻得很俗气，叫做《十面埋伏擒蛟龙》。请大家看这个小说背后，谈到了这个。这个照片大家看注意，这个就是大明星安东尼奎因，他演什么？他演佛朗哥的在马德里地方的这个警务处长，就是这个安全局局长。这个是奥马尔沙里夫，他演什么？演西班牙的神父。这个是格里高利派克，他演什么？他演一个从西班牙逃亡到法国的一个潦倒的共产党。这个是个小孩子。故事这么来的。什么呢？就是一个小孩子，越过了比利牛斯山，在法国一个小巷子里面、一个违章建筑里面，找到了穷途潦倒的一个共产党的领袖，我们就叫他格里高利派克。小孩怎么回事呢？小孩子的爸爸是格里高利派克在西班牙一起做共产党的战友，被杀掉了。可是小孩子从小就知道他爸爸的好朋友就是格里高利派克，他是一个有名的共产党。所以，他崇拜他是个英雄。这个小孩子，就一个人越过了比利牛斯山，经过了千辛万苦，在法国找到了这个穷途潦倒的他。为什么穷途潦倒？因为革命失败了，革命尚未成功，当然失败了。可是他小孩子年幼无知，就跟格里高利派克说，我请你回到我们的祖国，回到西班牙。干什么？为我爸爸报仇。在小孩的眼里面，你这个格里高利派克还是英雄、还是有理想的共产党，你还是有实力的，请你回到我的国家，回到我们的国家替我爸爸报仇。
093.见有一匹灰色马.txt	53	4	proverb|quote|political_context		我再把话要说回来，刚才我提到西班牙的领导人物像佛朗哥，在西班牙做独裁者统治了36年。可是我告诉大家，你们知道他虽然是个杀人不眨眼的魔王，虽然他死了以后，西班牙才开始有言论自由。可是我告诉你，佛朗哥虽然做了一辈子独裁者，可是他能够为了西班牙的某些利益，做了某种程度的保存。譬如说，我刚才讲过，他在西班牙夺权的时候得力于两个国家帮助他，一个是德国的希特勒，一个意大利的墨索里尼，他们都是法西斯政权，而佛朗哥自己也是法西斯政权。法西斯到什么程度？他把希特勒的照片放在他的书桌上面，把墨索里尼照片放在书桌上面，表示他法西斯。可是请注意，在二次世界大战的时候，德国人占领了比利时、占领了法国以后，就希望西班牙跟他们一起作为一个轴心，干什么呢？来占领西班牙尖端的英国的直布罗陀，就换句话说，希望佛朗哥跟他们合作。佛朗哥二次大战一律守中立，就是不肯合作，就是不肯下海。希特勒说你忘恩负义，我就是忘恩负义。说我帮过你忙，你帮过忙，可是我现在赞美你，可是我就是不干。希特勒跟佛朗哥谈判的时候，佛朗哥故意迟到一小时，我先打压你的士气，然后佛朗哥就是不加入。希特勒气死了，讲了一句话说，宁肯拔掉三个牙，再也不要跟这个王八蛋见面。怎么样呢？希特勒垮掉了，德国垮掉了、意大利垮掉了，西班牙没有垮。大家看到没有？这才是爱西班牙，虽然他是个王八蛋、他是个坏蛋、他是个独裁者，可他做的事情保留了国家的元气。今天我们在台湾看到了什么？看到了一匹灰色马，骑在马上的名字叫做死。今天讲到这里。
094.郑南榕自焚真相.txt	25	4	proverb|quote|political_context		然后有趣的现象出现了。郑南榕坐牢就跟我讲，我这个烟戒不掉，在牢里面抽烟，我们叫做鼓，就是敲鼓的鼓，牢里面讲的黑话。捡到烟屁股以后，用张纸把它卷起来，变成很细很细的一条烟叫老鼠尾，也抽得很高兴。为什么呢？缺货。郑南榕就跟我讲，他说，李大哥，我晓得你李敖，现在画面就是郑南榕的女儿。郑南榕跟我说，我晓得你李敖在黑牢里有办法，请你无论如何要供应我我这个烟，那时候不但我的黑势力在牢里面，我不但叫黑道的大哥或者那个管监狱的这些不供应郑南榕烟，还特别管制，不许他抽烟。什么原因？为了健康，我要逼你戒烟。所以郑南榕坐牢坐怕了，他怕坐牢，因为觉得不能抽烟，苦得不得了。然后，发生所谓的自焚事件，这个真相我今天讲给大家听，这个是个疑案。说郑南榕为台独自焚的案子本身是个疑案。什么疑案？就郑南榕不想坐牢，他对坐牢抵制。怎么办？然后就发生了政府要请他出庭、要传达出庭，他不肯出庭。他的杂志社里面就把门封起来，买了汽油干什么？就是说，他买汽油不是要烧死自己，买汽油是要抵抗国民党、抵抗警察、他拒捕、拒绝你来抓我。郑南榕这个行为，请大家注意，人的感觉，一个念头像马鞍式的、波浪式的。什么意思？有时候很高，有时候很低。什么叫高低？有的时候我是要杀身成仁，有的时候我不要杀身成仁，我愿意苟且偷生。
095.李敖谈《中国时报》.txt	17	4	proverb|quoted|political_context	品质	现在我们立刻进入第二个题目，叫做如果“品质”变成条件，品质两个字我画了引号，这就是陈水扁说的：我们在追求100%言论自由，郑南榕自焚13周年，陈总统说，言论的品质仍待提升。郑南榕追思会，扁谈言论品质。意思说我们要追求100%的言论自由，可是，也要谈到言论的品质。陈水扁说的对不对？陈水扁说的不对。陈水扁说的什么情况？我看起来是胡说八道、牛头不对马嘴。为什么？言论自由的性质是有无的问题，不是好坏的问题。换句话说，有没有言论自由，这是重要问题，有或者没有，你给人家或者不给人家，争取到了或者没争取到，所以言论自由是个有和无的问题，不是一个好的坏的问题。为什么？好坏谁来鉴定？你凭什么说我言论自由不好？言论自由包括胡说八道的自由。我可以胡说八道。所以言论自由不发生品质的问题，言论自由发生的是有无的问题。那陈水扁口口声声要赞成。陈水扁当年和李敖和郑南榕，我们办杂志所标榜的就为你争取100%的言论自由。今天要狗尾续貂，又来了我们要求言论自由的品质。对不起！品质谁来决定呢？你陈水扁能决定吗？陈定南能决定吗？高检署能决定吗？法官能决定吗？新闻局的人能决定吗？通通不能决定。言论自由的好坏品质，对不起！不是提倡言论自由的人所能过问的。所以陈水扁讲品质问题，就牛头不对马嘴。
