file	line	text	reason	context
008.第七章——回向.txt	223	学约十条	modern-political-news-context	梁启超、谭嗣同碰面后四个多月，他们就先后南下了。他们觉得北京难以发展，所以到南方去做扎根的工作。“梁启超先在上海办《时务报》、开大同译书局、发起不缠足会、并且创办了女学堂。后来发现湖南巡抚陈宝箴思想开通，他的儿子陈三立与手下黄遵宪、徐仁铸，都协助推行新政，有更好的发展机会，就转到湖南，做时务学堂总教习。谭嗣同也去做了老师。在时务学堂里，梁启超亲自教育四十名学生，培养下一代的救国人才。他用的是康有为在万木草堂的经验，师生打成一片，教育学生新思想、变法思想、民主思想。他每天上课四小时，课余办理校务、批答学生作文和笔记，每次批答，有的在一千字以上，忙得常常熬夜，最后累出了大病。这时候，湖南地方的守旧势力也正好检举梁启超他们，说他们非圣无法、妖言惑众，湖南巡抚也保护不了他们了，所以一一予以解聘。梁启超只好由学生扶着，登上轮船，东去上海。在学生中，有一位年纪最小的，只有十六岁，他身体瘦弱，可是灵气过人，一直在梁启超身边，替老师整理行装。他...
008.第七章——回向.txt	223	非读万国之书，则不能读一国之书。	modern-political-news-context	梁启超、谭嗣同碰面后四个多月，他们就先后南下了。他们觉得北京难以发展，所以到南方去做扎根的工作。“梁启超先在上海办《时务报》、开大同译书局、发起不缠足会、并且创办了女学堂。后来发现湖南巡抚陈宝箴思想开通，他的儿子陈三立与手下黄遵宪、徐仁铸，都协助推行新政，有更好的发展机会，就转到湖南，做时务学堂总教习。谭嗣同也去做了老师。在时务学堂里，梁启超亲自教育四十名学生，培养下一代的救国人才。他用的是康有为在万木草堂的经验，师生打成一片，教育学生新思想、变法思想、民主思想。他每天上课四小时，课余办理校务、批答学生作文和笔记，每次批答，有的在一千字以上，忙得常常熬夜，最后累出了大病。这时候，湖南地方的守旧势力也正好检举梁启超他们，说他们非圣无法、妖言惑众，湖南巡抚也保护不了他们了，所以一一予以解聘。梁启超只好由学生扶着，登上轮船，东去上海。在学生中，有一位年纪最小的，只有十六岁，他身体瘦弱，可是灵气过人，一直在梁启超身边，替老师整理行装。他...
008.第七章——回向.txt	223	孔子之教，非徒治一国，乃以治天下	modern-political-news-context	梁启超、谭嗣同碰面后四个多月，他们就先后南下了。他们觉得北京难以发展，所以到南方去做扎根的工作。“梁启超先在上海办《时务报》、开大同译书局、发起不缠足会、并且创办了女学堂。后来发现湖南巡抚陈宝箴思想开通，他的儿子陈三立与手下黄遵宪、徐仁铸，都协助推行新政，有更好的发展机会，就转到湖南，做时务学堂总教习。谭嗣同也去做了老师。在时务学堂里，梁启超亲自教育四十名学生，培养下一代的救国人才。他用的是康有为在万木草堂的经验，师生打成一片，教育学生新思想、变法思想、民主思想。他每天上课四小时，课余办理校务、批答学生作文和笔记，每次批答，有的在一千字以上，忙得常常熬夜，最后累出了大病。这时候，湖南地方的守旧势力也正好检举梁启超他们，说他们非圣无法、妖言惑众，湖南巡抚也保护不了他们了，所以一一予以解聘。梁启超只好由学生扶着，登上轮船，东去上海。在学生中，有一位年纪最小的，只有十六岁，他身体瘦弱，可是灵气过人，一直在梁启超身边，替老师整理行装。他...
008.第七章——回向.txt	223	求治天下之理	modern-political-news-context	梁启超、谭嗣同碰面后四个多月，他们就先后南下了。他们觉得北京难以发展，所以到南方去做扎根的工作。“梁启超先在上海办《时务报》、开大同译书局、发起不缠足会、并且创办了女学堂。后来发现湖南巡抚陈宝箴思想开通，他的儿子陈三立与手下黄遵宪、徐仁铸，都协助推行新政，有更好的发展机会，就转到湖南，做时务学堂总教习。谭嗣同也去做了老师。在时务学堂里，梁启超亲自教育四十名学生，培养下一代的救国人才。他用的是康有为在万木草堂的经验，师生打成一片，教育学生新思想、变法思想、民主思想。他每天上课四小时，课余办理校务、批答学生作文和笔记，每次批答，有的在一千字以上，忙得常常熬夜，最后累出了大病。这时候，湖南地方的守旧势力也正好检举梁启超他们，说他们非圣无法、妖言惑众，湖南巡抚也保护不了他们了，所以一一予以解聘。梁启超只好由学生扶着，登上轮船，东去上海。在学生中，有一位年纪最小的，只有十六岁，他身体瘦弱，可是灵气过人，一直在梁启超身边，替老师整理行装。他...
008.第七章——回向.txt	223	成大丈夫	modern-political-news-context	梁启超、谭嗣同碰面后四个多月，他们就先后南下了。他们觉得北京难以发展，所以到南方去做扎根的工作。“梁启超先在上海办《时务报》、开大同译书局、发起不缠足会、并且创办了女学堂。后来发现湖南巡抚陈宝箴思想开通，他的儿子陈三立与手下黄遵宪、徐仁铸，都协助推行新政，有更好的发展机会，就转到湖南，做时务学堂总教习。谭嗣同也去做了老师。在时务学堂里，梁启超亲自教育四十名学生，培养下一代的救国人才。他用的是康有为在万木草堂的经验，师生打成一片，教育学生新思想、变法思想、民主思想。他每天上课四小时，课余办理校务、批答学生作文和笔记，每次批答，有的在一千字以上，忙得常常熬夜，最后累出了大病。这时候，湖南地方的守旧势力也正好检举梁启超他们，说他们非圣无法、妖言惑众，湖南巡抚也保护不了他们了，所以一一予以解聘。梁启超只好由学生扶着，登上轮船，东去上海。在学生中，有一位年纪最小的，只有十六岁，他身体瘦弱，可是灵气过人，一直在梁启超身边，替老师整理行装。他...
008.第七章——回向.txt	223	以大儒定大乱	modern-political-news-context	梁启超、谭嗣同碰面后四个多月，他们就先后南下了。他们觉得北京难以发展，所以到南方去做扎根的工作。“梁启超先在上海办《时务报》、开大同译书局、发起不缠足会、并且创办了女学堂。后来发现湖南巡抚陈宝箴思想开通，他的儿子陈三立与手下黄遵宪、徐仁铸，都协助推行新政，有更好的发展机会，就转到湖南，做时务学堂总教习。谭嗣同也去做了老师。在时务学堂里，梁启超亲自教育四十名学生，培养下一代的救国人才。他用的是康有为在万木草堂的经验，师生打成一片，教育学生新思想、变法思想、民主思想。他每天上课四小时，课余办理校务、批答学生作文和笔记，每次批答，有的在一千字以上，忙得常常熬夜，最后累出了大病。这时候，湖南地方的守旧势力也正好检举梁启超他们，说他们非圣无法、妖言惑众，湖南巡抚也保护不了他们了，所以一一予以解聘。梁启超只好由学生扶着，登上轮船，东去上海。在学生中，有一位年纪最小的，只有十六岁，他身体瘦弱，可是灵气过人，一直在梁启超身边，替老师整理行装。他...
009.第八章——大刀王五.txt	239	五爷，请受我一拜。	modern-political-news-context	“五爷这种感觉，我一点也不笑你，并且可以告诉你，我也有这种预感。但是，我们没有选择。不瞒五爷和各位说，我来北方，结交你们这些英雄好汉；我在南方，也结交五湖四海、其中有不少我湖南家乡的人物，这些人物中，有一位叫黄轸——草头黄、珍贵的珍字左边去掉斜玉旁换成车马炮的车字。他比我小八岁，今年二十五。这人文的考上秀才，出身湖南岳麓书院；武的能空手夺白刃，南拳北腿，几个人近不了他的身。他为人行侠仗义，跟哥老会关系极深。像黄轸这种哥儿们．他们相信要救中国，路只有一条，就是革命，只有赶走满洲人，中国才有救。跟满洲人合作，是绝对不行的。他们那种担心‘与虎谋皮’的心理，比五爷还强烈。我这次北上，他们特别为我饯行，也特别劝我小心，甚至劝我不要应满洲皇帝之召，而跟他们一起搞革命。坦白说，如果不是受了康有为影响，如果不是碰到光绪皇帝，我很可能走上革命的路。但是，变法维新的道理，康有为已写得那么头头是道，令人心服；而对变法维新的诚意，光绪皇帝又表现得那么求...
009.第八章——大刀王五.txt	239	七哥，也受我一拜。	modern-political-news-context	“五爷这种感觉，我一点也不笑你，并且可以告诉你，我也有这种预感。但是，我们没有选择。不瞒五爷和各位说，我来北方，结交你们这些英雄好汉；我在南方，也结交五湖四海、其中有不少我湖南家乡的人物，这些人物中，有一位叫黄轸——草头黄、珍贵的珍字左边去掉斜玉旁换成车马炮的车字。他比我小八岁，今年二十五。这人文的考上秀才，出身湖南岳麓书院；武的能空手夺白刃，南拳北腿，几个人近不了他的身。他为人行侠仗义，跟哥老会关系极深。像黄轸这种哥儿们．他们相信要救中国，路只有一条，就是革命，只有赶走满洲人，中国才有救。跟满洲人合作，是绝对不行的。他们那种担心‘与虎谋皮’的心理，比五爷还强烈。我这次北上，他们特别为我饯行，也特别劝我小心，甚至劝我不要应满洲皇帝之召，而跟他们一起搞革命。坦白说，如果不是受了康有为影响，如果不是碰到光绪皇帝，我很可能走上革命的路。但是，变法维新的道理，康有为已写得那么头头是道，令人心服；而对变法维新的诚意，光绪皇帝又表现得那么求...
010.第九章——戊戌政变.txt	167	并且，更糟的是，在革命党的眼中，甚至还解释成我为满洲人而死，我还是汉奸呢！	modern-political-news-context	“并且，更糟的是，在革命党的眼中，甚至还解释成我为满洲人而死，我还是汉奸呢！”
010.第九章——戊戌政变.txt	199	真的？真的在革命党眼里，就不再真。他们会说：看吧，还妄想和满洲鞑子搞变法吗？连在满洲皇帝前面得了君，你们都行不了道，都要被老太婆翻掌一扑，所有什么新政，都烟消云散，人人头挂高竿。还妄想与虎谋皮吗？死了心吧，这就是谭嗣同血的教训，血淋淋的证明了中国前途只有一条路，就是革命，可别再妄想走改良的路了！想想看，卓如，有没有这种可能？我一死，反倒帮了革命党？如果这样，我的声名岂不被双方来抢，给分尸了？	modern-political-news-context	“真的？真的在革命党眼里，就不再真。他们会说：看吧，还妄想和满洲鞑子搞变法吗？连在满洲皇帝前面得了君，你们都行不了道，都要被老太婆翻掌一扑，所有什么新政，都烟消云散，人人头挂高竿。还妄想与虎谋皮吗？死了心吧，这就是谭嗣同血的教训，血淋淋的证明了中国前途只有一条路，就是革命，可别再妄想走改良的路了！想想看，卓如，有没有这种可能？我一死，反倒帮了革命党？如果这样，我的声名岂不被双方来抢，给分尸了？”
010.第九章——戊戌政变.txt	213	哎哟！复生，你在说什么？你这些话太可怕了，就算你真的否定改良的路线，肯定革命的路线，那你也不该用死来证明你的否定和肯定，你为什么不去加入、不去革命，为革命贡献一份力量，为什么你要死？	modern-political-news-context	“哎哟！复生，你在说什么？你这些话太可怕了，就算你真的否定改良的路线，肯定革命的路线，那你也不该用死来证明你的否定和肯定，你为什么不去加入、不去革命，为革命贡献一份力量，为什么你要死？”
010.第九章——戊戌政变.txt	221	如果你为了告诉革命者走他们的路而死，你不必死，革命者无须你告诉，他们就走那条路。	modern-political-news-context	“如果你为了告诉革命者走他们的路而死，你不必死，革命者无须你告诉，他们就走那条路。”
010.第九章——戊戌政变.txt	223	革命者是无须我告诉。但有些参加革命的朋友们．知道我用死告诉了他们是对的，我是错的。也许，我真正死的心情，没有人知道。别人从表面上只知道我为变法而死，却不知道我为变法可以不死。从高远博大的角度来说，我不是为变法而死，我是为革命而死。	modern-political-news-context	“革命者是无须我告诉。但有些参加革命的朋友们．知道我用死告诉了他们是对的，我是错的。也许，我真正死的心情，没有人知道。别人从表面上只知道我为变法而死，却不知道我为变法可以不死。从高远博大的角度来说，我不是为变法而死，我是为革命而死。”
010.第九章——戊戌政变.txt	225	为革命而死？谁会这么想？谁会承认？革命党也不会承认。	modern-political-news-context	“为革命而死？谁会这么想？谁会承认？革命党也不会承认。”
010.第九章——戊戌政变.txt	227	所谓为革命而死，意思是一死对革命有帮助、有大帮助。我的死，使改良者转向革命者、使广大的中国人民倾向革命者，等于我在为他们推荐革命的将是正路，我为他们做了一种血荐。	modern-political-news-context	“所谓为革命而死，意思是一死对革命有帮助、有大帮助。我的死，使改良者转向革命者、使广大的中国人民倾向革命者，等于我在为他们推荐革命的将是正路，我为他们做了一种血荐。”
010.第九章——戊戌政变.txt	229	革命党不承认，也不领情。	modern-political-news-context	“革命党不承认，也不领情。”
010.第九章——戊戌政变.txt	231	我何必要他们领情、承认？革命行动像花一样，有显性的、有隐性的，我做的是隐性的。他们是显性。我无须经他们承认我是革命党，我才是革命党。	modern-political-news-context	“我何必要他们领情、承认？革命行动像花一样，有显性的、有隐性的，我做的是隐性的。他们是显性。我无须经他们承认我是革命党，我才是革命党。”
010.第九章——戊戌政变.txt	233	那你为什么不干脆去革命？也去做显性的？	modern-political-news-context	“那你为什么不干脆去革命？也去做显性的？”
010.第九章——戊戌政变.txt	235	我做显性的，到了海外我是什么，人家说我，我只是一个改良未成愤而革命的家伙，甚至说我是投机分子也不一定。我加入革命，不过是一个生员、一个生力军。但如我做隐性的，情况就完全不同。我觉得死比生效果大得多。因为死可以血荐。	modern-political-news-context	“我做显性的，到了海外我是什么，人家说我，我只是一个改良未成愤而革命的家伙，甚至说我是投机分子也不一定。我加入革命，不过是一个生员、一个生力军。但如我做隐性的，情况就完全不同。我觉得死比生效果大得多。因为死可以血荐。”
010.第九章——戊戌政变.txt	237	你要血荐，你不说你转向革命，谁知道啊？你何不先到海外，你那时要血荐，你可以发表大家支持革命的宣言，然后当众切腹自杀，这不也是很好的血荐吗？总比你这种一言不发大家猜谜式的好。	modern-political-news-context	“你要血荐，你不说你转向革命，谁知道啊？你何不先到海外，你那时要血荐，你可以发表大家支持革命的宣言，然后当众切腹自杀，这不也是很好的血荐吗？总比你这种一言不发大家猜谜式的好。”
010.第九章——戊戌政变.txt	239	就是什么都不能说，才能加强血荐的效果。	modern-political-news-context	谭嗣同笑了，他拍拍梁启超的肩膀，站起来。透过公使馆的方窗户，向远望着。“就是什么都不能说，才能加强血荐的效果。”他侧过头来，望着梁启超，梁启超抬头看他。谭嗣同笑着，“卓如啊，你一个劲儿的想说动我出走，事事都朝出走有好处解释，甚至要死也该在海外死，你可太爱朋友了。你明明知道要血荐就是要借这口老太婆的刀才妙！这也叫借刀杀人吧？怎么可以自杀？老太婆杀了我，才证明给天下这个政府无道，大家该革命；若如你所说，不给老太婆杀而去自杀，不但给这个老太婆脱了罪，自己消灭了他们的眼中钉，并且自杀又变成了种种离奇解释。比如说，人家就会说自杀是因为改良失败而厌世，或是什么别的，总之，那个时候，整个的效果完全不对了。所以，要血荐，就在这儿血溅，就要血溅菜市口。在这儿，才有最好死的地方，才有最佳死的方式。”
010.第九章——戊戌政变.txt	279	支那通	modern-political-news-context	平山周陪谭嗣同走着，一路谈的，多是沿途的地理与掌故。谭嗣同奇怪这日本人对中国了解如此之深。他从平山周机警的眼神里、渊博的谈吐里，蓦然想起：这个人，难道真是日本外交人员吗？他愈想愈疑惑。他听说日本秘密社会像黑龙会等的成员，许多都是“支那通”。眼前这位平山周的东洋人，难道不是黑龙会的人物吗？
011.第十章——抢救.txt	13	他说了两个理由，一个理由是各国变法都要流血，他愿意流这个血，用他的血，来振奋人心，以利于变法的宣传；另一个理由倒很怪，他说他本来决定不了救中国到底走革命的路好呢，还是走改良的路好，只是比较倾向革命。后来碰到了康梁，他才走改良的路，一起搞变法，这次变法结果，他愿意用一死来证明改良的路行不通，大家今后死心塌地的走革命的路。	modern-political-news-context	“他说了两个理由，一个理由是各国变法都要流血，他愿意流这个血，用他的血，来振奋人心，以利于变法的宣传；另一个理由倒很怪，他说他本来决定不了救中国到底走革命的路好呢，还是走改良的路好，只是比较倾向革命。后来碰到了康梁，他才走改良的路，一起搞变法，这次变法结果，他愿意用一死来证明改良的路行不通，大家今后死心塌地的走革命的路。”
011.第十章——抢救.txt	23	我们能做的，还是尽量做吧。	modern-political-news-context	“我们能做的，还是尽量做吧。”林权助叹了口气，“伊藤公也表示了这些中国青年是中国的灵魂，我们该救他们，伊藤公的看法是不能不重视的，伊藤公最有眼光。纯粹站在日本政府的立场，我只是代理公使，我实在也不敢拿这么大的主意，幸亏伊藤公在北京，他肯定表示该救他们，我才放了心。现在的办法是，你多约几位你们的弟兄，再去会馆一齐去劝谭嗣同，你可以技巧的用到伊藤公的名义，说是我转达的。伊藤公盼望谭先生以大局为重，还是先到日本，徐图大举为上策。日本政府碍于官方立场，不能主动邀谭先生，只能转告伊藤公的好意，请谭先生三思。并且由你们几位日本弟兄一齐登门请他去日本，这样一来，自然也和他自己请求政治庇护情形不一样。谭的自尊心很强，用以上的方法，也许比较有效。总之。我能做的，一定全做，并且也愿意做，但是太明显太主动的表露日本官方的立场，以我的身分办不到，并且谭嗣同也不会接受。站在我私人的立场是，对这些中国青年，我极为同情、敬佩，也愿意帮助他们；站在日本政府的立...
011.第十章——抢救.txt	25	好主意，等一下弟兄们就到使馆来，我就约他们去一趟。政治，我们不懂，我们只知道到中国来帮助这些有理想有勇气的人。	modern-political-news-context	平山周说：“好主意，等一下弟兄们就到使馆来，我就约他们去一趟。政治，我们不懂，我们只知道到中国来帮助这些有理想有勇气的人。”
011.第十章——抢救.txt	43	你们是一种狂热分子。你们在家里坐不住，所以跑到外面，老是帮别人兴风作浪。你们有一种捣乱狂，老是想推翻头顶上的一切。日本政府太稳了，你们推不翻，所以跑到中国来捣乱。	modern-political-news-context	“你们是一种狂热分子。你们在家里坐不住，所以跑到外面，老是帮别人兴风作浪。你们有一种捣乱狂，老是想推翻头顶上的一切。日本政府太稳了，你们推不翻，所以跑到中国来捣乱。”
011.第十章——抢救.txt	45	你们日本政府的代表，在中国不也兴风作浪吗？	modern-political-news-context	“你们日本政府的代表，在中国不也兴风作浪吗？”
011.第十章——抢救.txt	55	帮助你们？还是你们帮助我们，你们难道还看不出来，你们代日本政府做了日本政府不便做、也做不到的事。	modern-political-news-context	“帮助你们？还是你们帮助我们，你们难道还看不出来，你们代日本政府做了日本政府不便做、也做不到的事。”
011.第十章——抢救.txt	57	我们不给政府利用。	modern-political-news-context	“我们不给政府利用。”
011.第十章——抢救.txt	59	那是你们的想法、天真的想法。只可惜你们逃不掉被利用的命运，也许你们不知道。但事实总是：你们无形中在被日本政府利用，或被极端国权主义分子军部利用，或被民权主义右翼分子财阀利用，甚至，最惨的，被支那人利用。	modern-political-news-context	“那是你们的想法、天真的想法。只可惜你们逃不掉被利用的命运，也许你们不知道。但事实总是：你们无形中在被日本政府利用，或被极端国权主义分子军部利用，或被民权主义右翼分子财阀利用，甚至，最惨的，被支那人利用。”
011.第十章——抢救.txt	163	对清政府守什么国际公法？他们还不是在伦敦绑架孙文？	modern-political-news-context	“对清政府守什么国际公法？他们还不是在伦敦绑架孙文？”可儿长说。
011.第十章——抢救.txt	179	不会吗？你太乐观了吧？	modern-political-news-context	“不会吗？你太乐观了吧？”谭嗣同冷笑了，”你说这话，证明你太不清楚日本和中国来往的历史了。历史上，在中国困难的时候，你们日本从来没有帮助过它。宋朝的末年、明朝的末年，都是最有名的例子，不但不帮忙，甚至做得不近人情，中国人朱舜水到日本来请求帮助，他在日本受到水户侯的尊礼，帮助日本改进政治经济教育，等于是国师，可是他孙子后来从中国去看他，日本竟不许他们祖孙会面。郑成功的母亲是日本人，他是中日混血，但在他困难的时候，日本都不帮忙。另一方面，反倒是中国帮日本忙。宋朝末年，日本人靠中国人李竹隐和中国和尚祖元的帮忙，才有了抵抗蒙古的精神动力；明末时候，靠中国人朱舜水的帮忙，才有了以后王政复古以至明治维新的精神渊源。从国与国的立场来说，日本人实在欠中国的、日本实在缺乏帮中国忙的传统。所以，日本人到中国来的，就根本不简单，所以，我劝你最好别忘了你是日本人。”
