score	file	line	text	context
5	001.楔子.txt	15	徐菁死了一个月了，怎么回事？	四周也张望着她。突然间，邻座女生惊声尖叫起来：“看她的学号！看她的学号！CY781984！C-Y-7-8-1-9-8-4！天哪！这是徐菁的学号！”“徐菁不是车祸死了吗？”“徐菁死了一个月了，怎么回事？”“我们没有转学生，也不可能有同样学号！”……七嘴八舌，立刻乱成一团。“你是谁？”“你是谁？”“你怎么穿着徐菁的制服？”“你哪儿来的？”……乱成一团中，大家包围...
5	001.楔子.txt	15	我们没有转学生，也不可能有同样学号！	四周也张望着她。突然间，邻座女生惊声尖叫起来：“看她的学号！看她的学号！CY781984！C-Y-7-8-1-9-8-4！天哪！这是徐菁的学号！”“徐菁不是车祸死了吗？”“徐菁死了一个月了，怎么回事？”“我们没有转学生，也不可能有同样学号！”……七嘴八舌，立刻乱成一团。“你是谁？”“你是谁？”“你怎么穿着徐菁的制服？”“你哪儿来的？”……乱成一团中，大家包围...
3	001.楔子.txt	15	徐菁不是车祸死了吗？	四周也张望着她。突然间，邻座女生惊声尖叫起来：“看她的学号！看她的学号！CY781984！C-Y-7-8-1-9-8-4！天哪！这是徐菁的学号！”“徐菁不是车祸死了吗？”“徐菁死了一个月了，怎么回事？”“我们没有转学生，也不可能有同样学号！”……七嘴八舌，立刻乱成一团。“你是谁？”“你是谁？”“你怎么穿着徐菁的制服？”“你哪儿来的？”……乱成一团中，大家包围...
3	001.楔子.txt	15	你是谁？	四周也张望着她。突然间，邻座女生惊声尖叫起来：“看她的学号！看她的学号！CY781984！C-Y-7-8-1-9-8-4！天哪！这是徐菁的学号！”“徐菁不是车祸死了吗？”“徐菁死了一个月了，怎么回事？”“我们没有转学生，也不可能有同样学号！”……七嘴八舌，立刻乱成一团。“你是谁？”“你是谁？”“你怎么穿着徐菁的制服？”“你哪儿来的？”……乱成一团中，大家包围...
3	001.楔子.txt	15	你怎么穿着徐菁的制服？	四周也张望着她。突然间，邻座女生惊声尖叫起来：“看她的学号！看她的学号！CY781984！C-Y-7-8-1-9-8-4！天哪！这是徐菁的学号！”“徐菁不是车祸死了吗？”“徐菁死了一个月了，怎么回事？”“我们没有转学生，也不可能有同样学号！”……七嘴八舌，立刻乱成一团。“你是谁？”“你是谁？”“你怎么穿着徐菁的制服？”“你哪儿来的？”……乱成一团中，大家包围...
3	001.楔子.txt	15	你哪儿来的？	四周也张望着她。突然间，邻座女生惊声尖叫起来：“看她的学号！看她的学号！CY781984！C-Y-7-8-1-9-8-4！天哪！这是徐菁的学号！”“徐菁不是车祸死了吗？”“徐菁死了一个月了，怎么回事？”“我们没有转学生，也不可能有同样学号！”……七嘴八舌，立刻乱成一团。“你是谁？”“你是谁？”“你怎么穿着徐菁的制服？”“你哪儿来的？”……乱成一团中，大家包围...
4	001.楔子.txt	17	请给我一点空间，让我说。	飘逸的陌生人吓到了，她紧抱着书包，想站起来，可是没有空间，一声声的质问压迫着她，她摇着头、咬着下唇，万般无奈。最后，她决心给出答案：“请给我一点空间，让我说。”她有点喘息。“大家让开一下。”“让开一下。”“她要说了。”“说出她是谁。”……包围的人头们让开了，光线透了过来、空气透了过来，飘逸的轻声细语传出了：“我不是别人，我就是徐菁。”
4	001.楔子.txt	17	我不是别人，我就是徐菁。	飘逸的陌生人吓到了，她紧抱着书包，想站起来，可是没有空间，一声声的质问压迫着她，她摇着头、咬着下唇，万般无奈。最后，她决心给出答案：“请给我一点空间，让我说。”她有点喘息。“大家让开一下。”“让开一下。”“她要说了。”“说出她是谁。”……包围的人头们让开了，光线透了过来、空气透了过来，飘逸的轻声细语传出了：“我不是别人，我就是徐菁。”
5	001.楔子.txt	19	徐菁明明死了，怎么是徐菁！	前排的女生尖叫起来、跳起来：“天哪！她就是徐菁！”“她说她是徐菁！”“徐菁明明死了，怎么是徐菁！”“她是女鬼，哇！”……在惊声尖叫中，飘逸的伸出纤细秀美的手，抚上自己的前额，倒在椅子上。“她昏倒了！”“快叫救护车！”“叫医务室护士来！”“假徐菁昏倒了！”“快救她！”……
5	001.楔子.txt	19	她是女鬼，哇！	前排的女生尖叫起来、跳起来：“天哪！她就是徐菁！”“她说她是徐菁！”“徐菁明明死了，怎么是徐菁！”“她是女鬼，哇！”……在惊声尖叫中，飘逸的伸出纤细秀美的手，抚上自己的前额，倒在椅子上。“她昏倒了！”“快叫救护车！”“叫医务室护士来！”“假徐菁昏倒了！”“快救她！”……
3	001.楔子.txt	19	天哪！她就是徐菁！	前排的女生尖叫起来、跳起来：“天哪！她就是徐菁！”“她说她是徐菁！”“徐菁明明死了，怎么是徐菁！”“她是女鬼，哇！”……在惊声尖叫中，飘逸的伸出纤细秀美的手，抚上自己的前额，倒在椅子上。“她昏倒了！”“快叫救护车！”“叫医务室护士来！”“假徐菁昏倒了！”“快救她！”……
3	001.楔子.txt	19	她说她是徐菁！	前排的女生尖叫起来、跳起来：“天哪！她就是徐菁！”“她说她是徐菁！”“徐菁明明死了，怎么是徐菁！”“她是女鬼，哇！”……在惊声尖叫中，飘逸的伸出纤细秀美的手，抚上自己的前额，倒在椅子上。“她昏倒了！”“快叫救护车！”“叫医务室护士来！”“假徐菁昏倒了！”“快救她！”……
3	001.楔子.txt	19	她昏倒了！	前排的女生尖叫起来、跳起来：“天哪！她就是徐菁！”“她说她是徐菁！”“徐菁明明死了，怎么是徐菁！”“她是女鬼，哇！”……在惊声尖叫中，飘逸的伸出纤细秀美的手，抚上自己的前额，倒在椅子上。“她昏倒了！”“快叫救护车！”“叫医务室护士来！”“假徐菁昏倒了！”“快救她！”……
3	001.楔子.txt	19	快叫救护车！	前排的女生尖叫起来、跳起来：“天哪！她就是徐菁！”“她说她是徐菁！”“徐菁明明死了，怎么是徐菁！”“她是女鬼，哇！”……在惊声尖叫中，飘逸的伸出纤细秀美的手，抚上自己的前额，倒在椅子上。“她昏倒了！”“快叫救护车！”“叫医务室护士来！”“假徐菁昏倒了！”“快救她！”……
3	001.楔子.txt	19	叫医务室护士来！	前排的女生尖叫起来、跳起来：“天哪！她就是徐菁！”“她说她是徐菁！”“徐菁明明死了，怎么是徐菁！”“她是女鬼，哇！”……在惊声尖叫中，飘逸的伸出纤细秀美的手，抚上自己的前额，倒在椅子上。“她昏倒了！”“快叫救护车！”“叫医务室护士来！”“假徐菁昏倒了！”“快救她！”……
3	001.楔子.txt	19	假徐菁昏倒了！	前排的女生尖叫起来、跳起来：“天哪！她就是徐菁！”“她说她是徐菁！”“徐菁明明死了，怎么是徐菁！”“她是女鬼，哇！”……在惊声尖叫中，飘逸的伸出纤细秀美的手，抚上自己的前额，倒在椅子上。“她昏倒了！”“快叫救护车！”“叫医务室护士来！”“假徐菁昏倒了！”“快救她！”……
3	001.楔子.txt	19	快救她！	前排的女生尖叫起来、跳起来：“天哪！她就是徐菁！”“她说她是徐菁！”“徐菁明明死了，怎么是徐菁！”“她是女鬼，哇！”……在惊声尖叫中，飘逸的伸出纤细秀美的手，抚上自己的前额，倒在椅子上。“她昏倒了！”“快叫救护车！”“叫医务室护士来！”“假徐菁昏倒了！”“快救她！”……
5	001.楔子.txt	23	不逼她，让她一起上课，多么好！	随着大门重新关起，学校恢复了表面的安静。表面下的浮动，一波一波在流传。高二真班的女生们已无心上课，大家“白日见鬼”，心里毛毛的。唯一的安慰是，这女鬼可“出奇的漂亮！”“她太漂亮了！”“人怎么可以长得那么美？”“看到她，我性向转变，不再喜欢男生了。”……大家开始恢复了笑容，也开始互相埋怨。“不逼她，让她一起上课，多么好！”“是呀，我们高二真班有了校花。”“这校...
4	001.楔子.txt	23	看到她，我性向转变，不再喜欢男生了。	随着大门重新关起，学校恢复了表面的安静。表面下的浮动，一波一波在流传。高二真班的女生们已无心上课，大家“白日见鬼”，心里毛毛的。唯一的安慰是，这女鬼可“出奇的漂亮！”“她太漂亮了！”“人怎么可以长得那么美？”“看到她，我性向转变，不再喜欢男生了。”……大家开始恢复了笑容，也开始互相埋怨。“不逼她，让她一起上课，多么好！”“是呀，我们高二真班有了校花。”“这校...
4	001.楔子.txt	23	是呀，我们高二真班有了校花。	随着大门重新关起，学校恢复了表面的安静。表面下的浮动，一波一波在流传。高二真班的女生们已无心上课，大家“白日见鬼”，心里毛毛的。唯一的安慰是，这女鬼可“出奇的漂亮！”“她太漂亮了！”“人怎么可以长得那么美？”“看到她，我性向转变，不再喜欢男生了。”……大家开始恢复了笑容，也开始互相埋怨。“不逼她，让她一起上课，多么好！”“是呀，我们高二真班有了校花。”“这校...
4	001.楔子.txt	23	这校花走到北一女门口，那些绿色丑八怪不敢放学了。	随着大门重新关起，学校恢复了表面的安静。表面下的浮动，一波一波在流传。高二真班的女生们已无心上课，大家“白日见鬼”，心里毛毛的。唯一的安慰是，这女鬼可“出奇的漂亮！”“她太漂亮了！”“人怎么可以长得那么美？”“看到她，我性向转变，不再喜欢男生了。”……大家开始恢复了笑容，也开始互相埋怨。“不逼她，让她一起上课，多么好！”“是呀，我们高二真班有了校花。”“这校...
4	001.楔子.txt	23	为什么不敢？她们要抢着出来，转学中山了。	随着大门重新关起，学校恢复了表面的安静。表面下的浮动，一波一波在流传。高二真班的女生们已无心上课，大家“白日见鬼”，心里毛毛的。唯一的安慰是，这女鬼可“出奇的漂亮！”“她太漂亮了！”“人怎么可以长得那么美？”“看到她，我性向转变，不再喜欢男生了。”……大家开始恢复了笑容，也开始互相埋怨。“不逼她，让她一起上课，多么好！”“是呀，我们高二真班有了校花。”“这校...
4	001.楔子.txt	23	徐菁已是漂亮的女生，如果死了变得更漂亮，像这女鬼，天啊，我去死吧。	随着大门重新关起，学校恢复了表面的安静。表面下的浮动，一波一波在流传。高二真班的女生们已无心上课，大家“白日见鬼”，心里毛毛的。唯一的安慰是，这女鬼可“出奇的漂亮！”“她太漂亮了！”“人怎么可以长得那么美？”“看到她，我性向转变，不再喜欢男生了。”……大家开始恢复了笑容，也开始互相埋怨。“不逼她，让她一起上课，多么好！”“是呀，我们高二真班有了校花。”“这校...
3	001.楔子.txt	23	出奇的漂亮！	随着大门重新关起，学校恢复了表面的安静。表面下的浮动，一波一波在流传。高二真班的女生们已无心上课，大家“白日见鬼”，心里毛毛的。唯一的安慰是，这女鬼可“出奇的漂亮！”“她太漂亮了！”“人怎么可以长得那么美？”“看到她，我性向转变，不再喜欢男生了。”……大家开始恢复了笑容，也开始互相埋怨。“不逼她，让她一起上课，多么好！”“是呀，我们高二真班有了校花。”“这校...
3	001.楔子.txt	23	她太漂亮了！	随着大门重新关起，学校恢复了表面的安静。表面下的浮动，一波一波在流传。高二真班的女生们已无心上课，大家“白日见鬼”，心里毛毛的。唯一的安慰是，这女鬼可“出奇的漂亮！”“她太漂亮了！”“人怎么可以长得那么美？”“看到她，我性向转变，不再喜欢男生了。”……大家开始恢复了笑容，也开始互相埋怨。“不逼她，让她一起上课，多么好！”“是呀，我们高二真班有了校花。”“这校...
3	001.楔子.txt	23	人怎么可以长得那么美？	随着大门重新关起，学校恢复了表面的安静。表面下的浮动，一波一波在流传。高二真班的女生们已无心上课，大家“白日见鬼”，心里毛毛的。唯一的安慰是，这女鬼可“出奇的漂亮！”“她太漂亮了！”“人怎么可以长得那么美？”“看到她，我性向转变，不再喜欢男生了。”……大家开始恢复了笑容，也开始互相埋怨。“不逼她，让她一起上课，多么好！”“是呀，我们高二真班有了校花。”“这校...
3	001.楔子.txt	23	她怎么会有徐菁的制服？徐菁是她什么人？	随着大门重新关起，学校恢复了表面的安静。表面下的浮动，一波一波在流传。高二真班的女生们已无心上课，大家“白日见鬼”，心里毛毛的。唯一的安慰是，这女鬼可“出奇的漂亮！”“她太漂亮了！”“人怎么可以长得那么美？”“看到她，我性向转变，不再喜欢男生了。”……大家开始恢复了笑容，也开始互相埋怨。“不逼她，让她一起上课，多么好！”“是呀，我们高二真班有了校花。”“这校...
4	002.与阴茎对话.txt	51	十车。还要看是什么车，最好是水肥车。	“十车。”突然间，第三者声音出现了。“十车。还要看是什么车，最好是水肥车。”
3	002.与阴茎对话.txt	53	你是谁？	“你是谁？”一个我在问第三者。
3	002.与阴茎对话.txt	55	你是谁？	“你是谁？”另一个我也在问第三者。
7	002.与阴茎对话.txt	59	我们‘形而上’联合起来，对付‘形而下’。	“原来是它！”两个我不约而同。“我们‘形而上’联合起来，对付‘形而下’。”
6	002.与阴茎对话.txt	59	原来是它！	“原来是它！”两个我不约而同。“我们‘形而上’联合起来，对付‘形而下’。”
4	002.与阴茎对话.txt	61	要对付‘形而下’，那阴茎、那愤世嫉俗的阴茎、那不安分的阴茎！	两个我又合一了。“要对付‘形而下’，那阴茎、那愤世嫉俗的阴茎、那不安分的阴茎！”
4	002.与阴茎对话.txt	69	你能跟你自己对话，现在轮到我了，我要跟你对话。	“你能跟你自己对话，现在轮到我了，我要跟你对话。”
4	002.与阴茎对话.txt	71	你是我的‘形而下’，我很愿意下情上达。	“你是我的‘形而下’，我很愿意下情上达。”
3	002.与阴茎对话.txt	73	别这么得意吧，谁是谁的，真很难说。记得希腊神话Demeter（狄蜜特）女神吧，她要烧掉Demophon（狄默丰）身上mortal parts（会死掉的部分）以成全永生，结果却被误会，害得全体都不得永生。我和你们其他器官的关系，就是这样，本来我是可以单独永生的，你们会身名俱裂，只有我永生。但我被你们牵累了，所以陪着倒霉。	“别这么得意吧，谁是谁的，真很难说。记得希腊神话Demeter（狄蜜特）女神吧，她要烧掉Demophon（狄默丰）身上mortal parts（会死掉的部分）以成全永生，结果却被误会，害得全体都不得永生。我和你们其他器官的关系，就是这样，本来我是可以单独永生的，你们会身名俱裂，只有我永生。但我被你们牵累了，所以陪着倒霉。”
4	002.与阴茎对话.txt	77	哈哈，很好笑，但很冷，很好冷笑。	“哈哈，很好笑，但很冷，很好冷笑。”
4	002.与阴茎对话.txt	79	不管冷不冷，我们活得比你久，你活不过我们，你只是自大狂。	“不管冷不冷，我们活得比你久，你活不过我们，你只是自大狂。”
4	002.与阴茎对话.txt	83	你只是一条阴茎，却如此自大。	“你只是一条阴茎，却如此自大。”
4	002.与阴茎对话.txt	85	我不是自大，我真的很伟大。	“我不是自大，我真的很伟大。”
4	002.与阴茎对话.txt	87	你不是什么伟大，你只是屌大而已。三个女人没好话、三个男人比屌大。你跟男人比过屌大吗？	“你不是什么伟大，你只是屌大而已。三个女人没好话、三个男人比屌大。你跟男人比过屌大吗？”
4	002.与阴茎对话.txt	89	我这屌可屌得很，无与伦比吧，没有比过。	“我这屌可屌得很，无与伦比吧，没有比过。”
3	002.与阴茎对话.txt	91	看你也没有，但我知道你的屌多大，你的屌很奇怪，平常时候，看起来很正常的大小，但非常的时候，就非常大，大得有点吓到女孩子，该怎么说？乱掰吧，你的膨胀系数可真大，大大大，非常大。	“看你也没有，但我知道你的屌多大，你的屌很奇怪，平常时候，看起来很正常的大小，但非常的时候，就非常大，大得有点吓到女孩子，该怎么说？乱掰吧，你的膨胀系数可真大，大大大，非常大。”
6	002.与阴茎对话.txt	93	你的‘非常’两个字很使我受用，用得好，使我联想起孙中山曾自称‘非常大总统’，我呢，可以自称‘非常大鸡鸡’。	“你的‘非常’两个字很使我受用，用得好，使我联想起孙中山曾自称‘非常大总统’，我呢，可以自称‘非常大鸡鸡’。”
4	002.与阴茎对话.txt	95	你不要又玩世了，你这样扯上孙中山，孙中山会向法院提出‘非常上诉’。	“你不要又玩世了，你这样扯上孙中山，孙中山会向法院提出‘非常上诉’。”
6	002.与阴茎对话.txt	97	这不是法律问题，‘非常上诉’有什么用？但孙中山可提出‘非常异议’。古人何休在《公羊传序》里说：传述古书《春秋》的很多种，‘其中我非常异议可怪之论。’孙中山可就这段古书，提出抗议。抗议你有不当联想，至少抗议你乱用‘非常’两个字。	“这不是法律问题，‘非常上诉’有什么用？但孙中山可提出‘非常异议’。古人何休在《公羊传序》里说：传述古书《春秋》的很多种，‘其中我非常异议可怪之论。’孙中山可就这段古书，提出抗议。抗议你有不当联想，至少抗议你乱用‘非常’两个字。”
3	002.与阴茎对话.txt	99	其实，乱用的是他孙中山自己，大总统就是大总统，可是他这位革命狂，一辈子老是干上杠上开花的大总统，比如说，他先干上‘临时大总统’，后来又干上‘非常大总统’，你不觉得奇怪吗？他太邪门儿了，政治使人邪门儿，邪门儿到全世界的政治系教科书都无法解读这些杠上开花。	“其实，乱用的是他孙中山自己，大总统就是大总统，可是他这位革命狂，一辈子老是干上杠上开花的大总统，比如说，他先干上‘临时大总统’，后来又干上‘非常大总统’，你不觉得奇怪吗？他太邪门儿了，政治使人邪门儿，邪门儿到全世界的政治系教科书都无法解读这些杠上开花。”
3	002.与阴茎对话.txt	101	好了，扯远了，还是拉回来，看你自己，恭喜你有了‘非常大鸡鸡’虽然也是‘临时大鸡鸡’。不管是‘临时’还是‘非常’，你总是生有异禀，讨女人喜欢。所以，我才用‘膨胀系数’来奉承你。	“好了，扯远了，还是拉回来，看你自己，恭喜你有了‘非常大鸡鸡’虽然也是‘临时大鸡鸡’。不管是‘临时’还是‘非常’，你总是生有异禀，讨女人喜欢。所以，我才用‘膨胀系数’来奉承你。”
6	002.与阴茎对话.txt	103	‘膨胀系数’？你当然是指expansion coefficient那个物理学名词。标准定义是物体受热膨胀时，其膨胀体积、面积、或长度与其在摄氏温度零度时的体积、面积、或长度之比，分别称为‘体膨胀系数’、‘面膨胀系数’、和‘线膨胀系数’。其实这定义对我不是不奉承，是奉承得不够，因为除‘体’‘面’‘线’三个膨胀系数外，还严重漏掉了一个系数。	“‘膨胀系数’？你当然是指expansion coefficient那个物理学名词。标准定义是物体受热膨胀时，其膨胀体积、面积、或长度与其在摄氏温度零度时的体积、面积、或长度之比，分别称为‘体膨胀系数’、‘面膨胀系数’、和‘线膨胀系数’。其实这定义对我不是不奉承，是奉承得不够，因为除‘体’‘面’‘线’三个膨胀系数外，还严重漏掉了一个系数。”
3	002.与阴茎对话.txt	105	什么系数？	“什么系数？”
3	002.与阴茎对话.txt	109	物理学上有这种鬼系数吗？	“物理学上有这种鬼系数吗？”
4	002.与阴茎对话.txt	113	哈哈，你真逗。	“哈哈，你真逗。”
4	002.与阴茎对话.txt	115	逗的是你，你是硬汉，但穿衣服才是硬汉只是一半的硬汉，脱光也硬才算两全其美。	“逗的是你，你是硬汉，但穿衣服才是硬汉只是一半的硬汉，脱光也硬才算两全其美。”
6	002.与阴茎对话.txt	117	哈哈，怎么硬法？少吹牛，你知道有所谓‘硬度表’（hardness scale）吗？背给你听：一度滑石、二度石膏、三度方解石、四度萤石、五度磷灰石、六度正长石、七度石英、八度黄玉、九度刚玉、十度金刚石。你硬？硬的是哪度？	“哈哈，怎么硬法？少吹牛，你知道有所谓‘硬度表’（hardness scale）吗？背给你听：一度滑石、二度石膏、三度方解石、四度萤石、五度磷灰石、六度正长石、七度石英、八度黄玉、九度刚玉、十度金刚石。你硬？硬的是哪度？”
6	002.与阴茎对话.txt	119	你别胡扯，你指的乃是奥地利矿物学家Fried Mohs（摩斯）的分类，那是指矿物、指石头说的，你可以心如铁石，但你不能屌如铁石，真正的好屌不是死硬派，而是软中带硬硬中带软，要有点弹性，像矽胶。一部分也像宋朝造瓷器的专家，他们对瓷土有所谓‘软硬劲’，你可叫它是‘软硬功’，不是一味硬干硬来的，记住你是大情人，不是强奸犯，你搬来一大堆石头向我说什么，你太不了解我了。不是吗？	“你别胡扯，你指的乃是奥地利矿物学家Fried Mohs（摩斯）的分类，那是指矿物、指石头说的，你可以心如铁石，但你不能屌如铁石，真正的好屌不是死硬派，而是软中带硬硬中带软，要有点弹性，像矽胶。一部分也像宋朝造瓷器的专家，他们对瓷土有所谓‘软硬劲’，你可叫它是‘软硬功’，不是一味硬干硬来的，记住你是大情人，不是强奸犯，你搬来一大堆石头向我说什么，你太不了解我...
4	002.与阴茎对话.txt	131	你只仗着大脑的优势，仗着它高高在上，你把我工具化。	“你只仗着大脑的优势，仗着它高高在上，你把我工具化。”
4	002.与阴茎对话.txt	135	哦，我把自己定位成快乐的工具。	“哦，我把自己定位成快乐的工具。”
4	002.与阴茎对话.txt	137	说得也是，但别忘了你在牢里的惨象。你该‘毋忘在莒’。	“说得也是，但别忘了你在牢里的惨象。你该‘毋忘在莒’。”
4	002.与阴茎对话.txt	139	‘毋忘在莒’不是蒋介石的口号吗？我在牢里很受用，只是写成‘毋忘再举’而已。	“‘毋忘在莒’不是蒋介石的口号吗？我在牢里很受用，只是写成‘毋忘再举’而已。”
3	002.与阴茎对话.txt	141	哈？原来政治犯是你，你如此冒犯伟大领袖！你自己就十足够成钦命要犯了，再也别怪我连累你了。	“哈？原来政治犯是你，你如此冒犯伟大领袖！你自己就十足够成钦命要犯了，再也别怪我连累你了。”
4	002.与阴茎对话.txt	143	反正我在牢里闲着也是闲着，就近朱者赤一下吧。	“反正我在牢里闲着也是闲着，就近朱者赤一下吧。”
3	002.与阴茎对话.txt	147	什么都要俊，可是屌要丑才性格，丑大粗长硬，大粗长硬是跟丑配套的，它们合在一起，可玩得漂亮。	“什么都要俊，可是屌要丑才性格，丑大粗长硬，大粗长硬是跟丑配套的，它们合在一起，可玩得漂亮。”
3	002.与阴茎对话.txt	149	玩得漂亮还是玩漂亮的？	“玩得漂亮还是玩漂亮的？”
