file	line	quote	context
009.胡茵梦的清高哪儿去了？.txt	31	口口声声	事实上，我从来就宁愿尊重胡茵梦是清高的人，故我从来没有把这种仅值百八十万的小房子说送给她（她口口声声说我要送给她，是不实之言）。天母静庐与胡茵梦的关系，自始就是信托关系。如今她为了脱背信侵占之罪，竟如报载，在庭上又说“房子是李敖送给她的，她当然有权处置”云云，这与事实自然不符，也与她自己三年前的存证信和证词不符。
009.胡茵梦的清高哪儿去了？.txt	35	大义灭亲	以上举证，在证明一个人不能里子面子你都要，你不能又清高又拿人东西，又拿人东西还“大义灭亲”去伪证。天下没有这种道德！西谚说法律是六十分的道德，如今我争讼公庭，所争无他，端在谁的道德在六十分以下而已！
010.租给张三，却告李四.txt	5	锲而不舍	六年前（1980年8月26日）萧孟能自诉李敖侵占案，当时由于王昇主持秘密小组、官方舆论，和胡茵梦等伪证的介入、配合，使李敖一时含冤莫白，入狱六个月。出狱后，李敖锲而不舍，追究个水落石出，终由最高法院以六件判决书（一、1982年度台上字第2400号。二、1983年度台抗字第247号。三、1984年度台上字第4502号。四、1984年度台上字第4647号。五、1982年度台上字第2225号。六、1984年度台上字第4511号），推翻高院推事林晃、黄剑青、顾锦才所做的不公正的判决；另一方面，由于李敖入狱时发表《给黄少谷先
010.租给张三，却告李四.txt	5	水落石出	六年前（1980年8月26日）萧孟能自诉李敖侵占案，当时由于王昇主持秘密小组、官方舆论，和胡茵梦等伪证的介入、配合，使李敖一时含冤莫白，入狱六个月。出狱后，李敖锲而不舍，追究个水落石出，终由最高法院以六件判决书（一、1982年度台上字第2400号。二、1983年度台抗字第247号。三、1984年度台上字第4502号。四、1984年度台上字第4647号。五、1982年度台上字第2225号。六、1984年度台上字第4511号），推翻高院推事林晃、黄剑青、顾锦才所做的不公正的判决；另一方面，由于李敖入狱时发表《给黄少谷先
010.租给张三，却告李四.txt	81	只字不提	这封信发信时间是1983年7月22日，是在告李敖侵占“建物”之后，信中萧孟能只字不提“侵占”的事，可见这“建物”根本就没有被“侵占”。相关时间列表一下，便更明白：
010.租给张三，却告李四.txt	103	只字不提	这封信发信时间是1981年7月31日，也是在告李敖侵占“建物”之后，信中萧孟能也只字不提“侵占”的事，可见这“建物”也根本没有被“侵占”。因为这一“建物”根本就没有什么“借用”情况，所谓“借用”，全是萧孟能的“自谓”，李放已直斥其谬。但是，从另一角度看这一存证信，却正好反证了萧孟能既说建物是“借用”给李放的，则他跑去告李敖“侵占”，就是公然的诬告了！
012.驳萧孟能的“上诉理由（一）状”.txt	3	锲而不舍	七年前（1980年8月26日）萧孟能自诉李敖侵占案，当时由于王昇主持秘密小组、官方舆论，和胡茵梦等伪证的介入、配合，使李敖一时含冤莫白，入狱六个月。出狱后，李敖锲而不舍，追究个水落石出，终由最高法院以六件判决书（一、1983年度台上字第2400号。二、1983年度台抗字第247号。三、1984年度台上字第4502号。四、1984年度台上字第4647号。五、1982年度台上字第2225号。六、1984年度台上字第4511号）推翻高等法院推事林晃、黄剑青、顾锦才对李敖所做的不公正的判决；另一方面，由于李敖入狱时发表《给
012.驳萧孟能的“上诉理由（一）状”.txt	3	水落石出	七年前（1980年8月26日）萧孟能自诉李敖侵占案，当时由于王昇主持秘密小组、官方舆论，和胡茵梦等伪证的介入、配合，使李敖一时含冤莫白，入狱六个月。出狱后，李敖锲而不舍，追究个水落石出，终由最高法院以六件判决书（一、1983年度台上字第2400号。二、1983年度台抗字第247号。三、1984年度台上字第4502号。四、1984年度台上字第4647号。五、1982年度台上字第2225号。六、1984年度台上字第4511号）推翻高等法院推事林晃、黄剑青、顾锦才对李敖所做的不公正的判决；另一方面，由于李敖入狱时发表《给
012.驳萧孟能的“上诉理由（一）状”.txt	63	瞒天过海	事实上，恰恰根据这一“长账单”，就可查出萧孟能瞒天过海、所说不实。现分述于下：“长账单”12月23日账下有“附水晶工程总说明”，明说：
012.驳萧孟能的“上诉理由（一）状”.txt	79	瞒天过海	萧孟能前面“上诉理由（一）状”中说“张桂贞或李敖都未投资垫付装修费”，这话也瞒天过海、所说不实。因为水晶大厦屋顶突出的独立三座房屋，原来只是大厦为公用电梯马达间及公用蓄水槽而加盖，其中空房，豪无内部装修、不能使用，要想使用得大费周章、进行内部装修不可。在中间面包给朱婉坚的时候，只完成了外面的“土木管道工程”，只“修换”了锁，此外萧孟能别无分文花在上面。据萧孟能和朱婉坚“协议书补充条款”中明订：
012.驳萧孟能的“上诉理由（一）状”.txt	99	用之则行、舍之则藏	事实上，萧孟能这种证明方式是不能成立的。因为张桂贞有独立人格，她和萧孟能订立“租赁契约书”时，且经陈良榘律师见证（附证四），事证明确如此，岂容否认？何况租约期满后，萧孟能还是凭此所谓“虚伪”的租约，向地方法院控告张桂贞，要求判决张桂贞应返还房屋的。（附证五。事实上，早在租约未到期前，张桂贞已把这房屋交还给朱婉坚了。张桂贞是一位有正义感的老太太——她直接替萧孟能履行了“协议书补充条款”！）——萧孟能要房子的时候，“租赁契约书”就说是真的；躲罪的时候，“租赁契约书”就说是假的，一纸契约，竟可“用之则行、舍之则藏”，天下
012.驳萧孟能的“上诉理由（一）状”.txt	123	张冠李戴	事实上，这是故意曲解授权书内容，并予以张冠李戴。因为当时的授权书，每张都有特定的含义。萧孟能说授权李敖“全权代表授权人处理水晶大厦中与朱婉坚、萧广仁、萧近仁及叶肇模有关之一切事项”，“自亦包括本案系争房屋”。这是蒙混局外人的话。因为“朱婉坚、萧广仁、萧近仁及叶肇模”外加萧孟能自己，这五人一组的不可分关系，是针对一个特定机构而行使的。这个特定机构就是国防部福利总处。水晶大厦二楼全部及地下室部分押租给了国防部福利总处，而产权却属于这五人一组的，我可举证如下：
012.驳萧孟能的“上诉理由（一）状”.txt	137	张冠李戴	萧孟能全部授权，据李敖列表（附证十三），共二十四项，其中与水晶大厦有关的共十三项，即1.处理与陈良榘律师之一切事项，2.交涉并处理与躬行代书翁颂道之一切未了事项，6.与郑锡华先生有关水晶大厦十楼IJ户之一切未了事项，7.与高仲元先生有关一切事项，8.与周康熙先生之一切事项，9.与水晶大厦有关之一切事项，10.之（1）水晶大厦地下室，10之（2）水晶大厦十二楼， 10之（3）水晶大厦八楼JI户（向杨奉琛催收未付款项及利息），11.水晶大厦与朱婉坚、萧广仁、萧近仁及叶肇模有关之一切事项，12.与台北市银行有关事项，13
012.驳萧孟能的“上诉理由（一）状”.txt	141	瞒天过海	萧孟能所谓“系争房屋”有授权李敖云云，现在有一重要证据可证，不容瞒天过海。1980年萧孟能告李敖，曾有台北三十九支邮局存证信函第1302号至李敖（附证十四），内列授权事项（一）-（二十一）件，其中全没有涉及水晶大厦屋顶建物的事。这一存证信，白纸黑字，证明了根本没有授权的事实。原因很简单——他自己租给张三了，房子已在张三使用之下，又何来李四代劳？又何来对李四的授权呢？
013.为萧孟能入狱在即致施启扬函.txt	11	不得要领	一、三年前7月27日，我曾写信给老兄，提到萧孟能因窃占台北市复兴南路与信义路4段交叉口的角地，经刘会云告到台北地检处，经高院于该年4月25日判决（1984年上易字第857号），应坐牢五十天。因为是确定判决，所以萧孟能的牢，是必坐无疑了。不料，在无疑之中，却有令人起疑的事发生了。按照法务部作业流程，判决确定后约一个月即通知报到服刑，但是萧孟能却在两个月后仍经法务部让他逍遥法外，仍未发监执行。经刘会云写信给地检处首席陈涵，但陈涵似乎很傲慢，对人民书信悍然不理；又拖了一个月，在判决确定三个月后，刘会云亲赴台北地检处拜访负
013.为萧孟能入狱在即致施启扬函.txt	15	种豆得豆	三、老兄这种纵容的恶果，如今在三年后，果然种豆得豆了。累犯萧孟能又因违反《国家总动员法案》，又被高院于去年4月29日判决（1985年度上更一字第795号），应坐牢四个月，这一判决，经司法院第二厅复刘会云移文单（1987厅刑移三字第77号），明说：“该案业经最高法院于1986年11月6日判决上诉驳回，并于1986年11月14日以七五台刑五字第19971号函移送最高法院检察署办理。”换句话说，此案早在去年11月14日就移送到法务部检察司。再据高检处复刘会云函（检彦纪来4224号），明说：“被告萧孟能、王剑芬等违反《国家
013.为萧孟能入狱在即致施启扬函.txt	19	恩怨分明	萧孟能入狱后，你不能丝毫优待他，也不能丝毫虐待他，优待和虐待都是非法的。麦克阿瑟对敌人的方法是：给敌人最好的律师来辩护，如果有罪，把他吊死在最高的树上。——既重人权又立威信，这是一种男子汉的恩怨分明，我李敖一直有这种恩怨分明。
013.为萧孟能入狱在即致施启扬函.txt	39	知过能改	曾庆璧收信后，知道事态严重，乃立将萧孟能迁出“病监”，改移于重刑犯监，与一重刑犯同居一室。这种做法，表面上知过能改，其实问题仍多。查依《监狱行刑法》第15条：“受刑人新入监者，应先独居监禁，其期限为三个月；刑期较短者，依其刑期。”曾庆璧对萧孟能显然未能照办，此其一。又依同法第16条：凡“刑期不满六个月者”、“曾受徒刑之执行者”，都“应尽先独居监禁”，曾庆璧对萧孟能也显然未能照办，此其二。又依同法第17条：“受刑人因衰老、疾病或残废，不宜与其他受刑人杂居者，应分别监禁之。”曾庆璧对萧孟能也显然未能照办，此其三。又依同
014.告李敖的下场.txt	23	忘了我是谁	最可怪者，被告萧孟能复函所用语气，好像因诬告被判六个月的是别人似的，而不知自己已被兵临城下。这种“浑然忘我”、“忘了我是谁”，实在值得注意，令人好笑也。
014.告李敖的下场.txt	23	兵临城下	最可怪者，被告萧孟能复函所用语气，好像因诬告被判六个月的是别人似的，而不知自己已被兵临城下。这种“浑然忘我”、“忘了我是谁”，实在值得注意，令人好笑也。
014.告李敖的下场.txt	33	锲而不舍	二、萧孟能在最后陈述中，说地方法院推事判决张桂贞应返还系争房屋，殊不知此位推事名童有德，就是自民庭调刑庭后，此次判萧孟能诬告罪成立的同一位童有德！可见公道终在法官之心！又本案中有认定萧孟能上诉不成立的最高法院判决书（1985年11月7日，1985年度台上字第5874号），由最高法院推事钟日成、施文仁、罗一宇、董明霈、黄剑青列名，其中黄剑青不是别人，就是六年前和高等法院推事林晃、顾锦才一同审萧孟能自诉李敖所谓侵占案，误判李敖的同一位黄剑青！黄剑青从高等法院调最高法院后，此次能够认定萧孟能上诉不成立，也可见公道终在法官
014.告李敖的下场.txt	55	哭笑不得	2时后出地检处庭。庭前胡茵梦先向我高声问好，庭后又来聊天。她说：“李敖你老了。”我说：“和你一样老了。”她说：“你看我头发剪短了。”我说：“你不是预言要做尼姑吗？还会更短呢！”萧孟能在旁边，我拍他肩膀说：“孟能这一阵我告你，你先被判了一个月零二十天；现在又被判了四个月，一共五个月零二十天。——你还欠我十天，等我第三次要你坐了牢，十天还我，就扯平了。你死了，我们朋友一场，我会买个金棺材送你。”孟能听了，哭笑不得。
015.迟来的正义也算正义.txt	3	迟来的正义不是正义	西方有一句谚语是：“迟来的正义不是正义。”（Justice delay is Justice denial）看到八年以后最高法院确定萧孟能诬告李敖属实的判决书（8月2日寄到），我自嘲嘲人，脱口说了一句：“在台湾这种法院里，迟来的正义也算正义！”
015.迟来的正义也算正义.txt	5	水落石出	八年前萧孟能告我侵占，由于执法单位与新闻媒体微妙配合官方的斗臭李敖作业，双杀之下，众口铄金，我当时夷然入狱，没工夫也没机会仔细一一辩证。今天水落石出了，我愿意把高等法院林晃、黄剑青、顾锦才三推事妙手制造冤狱的部分笑话，酌写几点，以见法官水平。
015.迟来的正义也算正义.txt	5	众口铄金	八年前萧孟能告我侵占，由于执法单位与新闻媒体微妙配合官方的斗臭李敖作业，双杀之下，众口铄金，我当时夷然入狱，没工夫也没机会仔细一一辩证。今天水落石出了，我愿意把高等法院林晃、黄剑青、顾锦才三推事妙手制造冤狱的部分笑话，酌写几点，以见法官水平。
016.无所遁形，也责无旁贷.txt	1	无所遁形	无所遁形，也责无旁贷
016.无所遁形，也责无旁贷.txt	27	无所遁形	相对的，被告康宁祥却恰恰是《八十年代杂志》的发行人，登记证字号是局版台志字第1979号；也恰恰是“八十年代出版社”的发行人，登记证字号是局版台业字第1958号。所以，如今以八十年代招牌搞出版品，不论是杂志类还是书籍类，被告康宁祥都无所遁形，也责无旁贷。
017.给颜文闩一个教训.txt	17	恍然大悟	五、我不认识颜文闩，四年前，他任《自立晚报》总编辑时候，登出国民党议员郁慕明对我的错误谈话，我写信去澄清，亲送《自立晚报》。颜文闩要我删掉信中带刺的语句，答应登出。不料1985年1月14日我见报，原来登出的前面，全没下标题，我的辩驳书，全部藏在不相干的其他新闻标题之下！对颜文闩这种新闻工作者的作风，我至此恍然大悟！
018.《自由时报》被裁定诚意不足.txt	5	以讹传讹	在裁定文中，主文指出：“本会于七十八年11月4日接获李敖先生之陈诉函，略谓《自由时报》（七十八年10月28日二版）刊登不实报导《李揆“鸭子划水”，高！》，诽谤其清誉，同时未依出版法及新闻道德规范刊登其辩驳书。本会就《自由时报》所刊之‘报导’与‘更正’两部分加以分析，发现其《李揆‘鸭子划水’，高！》一文，系未经求证，‘以讹传讹’的报导，有违《中国新闻记者信条》第4条：‘吾人深信：新闻记述，正确第一。凡一字不真，一语失实，不问为有意之造谣夸大，或无意之失检致误，均无可恕……’及《中华民国报业道德规范》第（二）节‘新闻报
018.《自由时报》被裁定诚意不足.txt	13	不是猛龙不过江	我在寄信给新闻评议会之时，内容曾有这么一段：今天找上贵会，意在测验贵会所标榜的，到底执事诸公能兑现多少，以便张正义而供写作之资。贵会执事诸公多为有头有脸的，但在我笔下，亦少恕词。过去的萧同兹也、黄少谷也、陶百川也、端木恺也、于斌也、张建邦也、梁肃戎也、罗光也、戴炎辉也……或因乡愿、或因伪善、或因逼母上吊、或因抄袭论文……一一被我揭发；目前的第六届评议委员十一人中，其中一半（孙震、王洪钧、陈奇禄、吴延环、柴松林），且被我“点名批判”过，如今“不是猛龙不过江”，居然拿案送请你们评议，就是要看看你们是否会公正处理。对不公
018.《自由时报》被裁定诚意不足.txt	13	恩怨分明	我在寄信给新闻评议会之时，内容曾有这么一段：今天找上贵会，意在测验贵会所标榜的，到底执事诸公能兑现多少，以便张正义而供写作之资。贵会执事诸公多为有头有脸的，但在我笔下，亦少恕词。过去的萧同兹也、黄少谷也、陶百川也、端木恺也、于斌也、张建邦也、梁肃戎也、罗光也、戴炎辉也……或因乡愿、或因伪善、或因逼母上吊、或因抄袭论文……一一被我揭发；目前的第六届评议委员十一人中，其中一半（孙震、王洪钧、陈奇禄、吴延环、柴松林），且被我“点名批判”过，如今“不是猛龙不过江”，居然拿案送请你们评议，就是要看看你们是否会公正处理。对不公
018.《自由时报》被裁定诚意不足.txt	13	乡愿	我在寄信给新闻评议会之时，内容曾有这么一段：今天找上贵会，意在测验贵会所标榜的，到底执事诸公能兑现多少，以便张正义而供写作之资。贵会执事诸公多为有头有脸的，但在我笔下，亦少恕词。过去的萧同兹也、黄少谷也、陶百川也、端木恺也、于斌也、张建邦也、梁肃戎也、罗光也、戴炎辉也……或因乡愿、或因伪善、或因逼母上吊、或因抄袭论文……一一被我揭发；目前的第六届评议委员十一人中，其中一半（孙震、王洪钧、陈奇禄、吴延环、柴松林），且被我“点名批判”过，如今“不是猛龙不过江”，居然拿案送请你们评议，就是要看看你们是否会公正处理。对不公
018.《自由时报》被裁定诚意不足.txt	35	以讹传讹	本会就《自由时报》所刊之“报导”与“更正”两部分加以分析，发现其《李揆“鸭子划水”，高！》一文，系未经求证，“以讹传讹”的报导，有违《中国新闻记者信条》第4条：“吾人深信：新闻记述，正确第一。凡一字不真，一语失实，不问为有意之造谣夸大，或无意之失检致误，均无可恕……”及《中华民国报业道德规范》第（二）节“新闻报导”第（一）条“新闻报导应以确实、客观、公正为第一要义。在未明真相前，暂缓报导……”之规定。
018.《自由时报》被裁定诚意不足.txt	55	说大人，则藐之	三、自来荣辱标准，因人而异……所以判例明定：侮辱人之罪成立与否，应以对于个人在社会上所保持之人格及地位，因加害者之举动达于足以毁损其名誉之程度与否以定标准。（七年上字第187号）李敖为人，几十年来，以孤傲高蹈、戏公卿、弄王侯，“说大人，则藐之”为天下显、为天下倡，如今如《自由时报》所描写，则给人趋炎附势的印象，自对李敖构成诽谤。拉丁文中有innuendo，在英美侵权行为法中引申为“诽谤的释明”，指诽谤语言有明示于外者，亦有隐蓄于内者。后者表面上似无诽谤字眼，但因对特定之人说来，适成诽谤，故不能照普通解释。
018.《自由时报》被裁定诚意不足.txt	57	变本加厉	四、《自由时报》刊出捏造的这种事的当天午后2点，我即以国内快捷邮件台北七支局000384号寄辩驳书给该报，要求该报按《出版法》第15条“于接到要求后三日内更正，或登载辩驳书”之规定，一字不改，刊出全文，并按同条“更正或辩驳书之登载，其版面应与原文所载者相同”处理。并告诉他们：“……如今变本加厉，在第二版上又故态复萌，且涉及我生平“只拥抱美女，不拥抱大官”的立身本末、清誉与大节……”促其反省补救，但已逾三日，该报悍然不理。
018.《自由时报》被裁定诚意不足.txt	111	以讹传讹	《自由时报》刊载《李揆“鸭子划水”，高！》的报导，系以“副总统人选”话题为主。文中报导行政院长李焕参加国大代表路国华的儿子婚宴，却穿插“席间，李敖突然出现，并和李焕亲切拥抱，引起现场一阵骚动”的内容。记者既然视“李敖与李焕亲切拥抱”为值得报导的新闻，就应该向当事人求证。否则，虽然《自由时报》在答辩函中表示纯为资深国代误认误传之“无心之失”，但以讹传讹的不实报导，亦可能对当事人造成伤害。再者，消息来源既是得之于资深国代，记者在报导时即不应以亲自目击的手法描述，此乃明显违反了《中国新闻记者信条》第4条：“吾人深信：新闻
019.质问吴伯雄市长.txt	13	说大人，则藐之	三、自来荣辱标准，因人而异，在奴才眼中，被“张大帅亲手打我一个耳光”、被“蒋总统亲自踢我一脚”，无不引以为荣；但在有人格、有自尊心的人的眼中，无不目为奇耻。所以判例明定：“侮辱人之罪成立与否，应以对于个人在社会上所保持之人格及地位，因加害者之举动达于足以毁损其名誉之程度与否以定标准。”（七年上字第187号）李敖为人，几十年来，以孤傲高蹈，戏公卿、弄王侯，“说大人，则藐之”为天下显、为天下倡，如今如《自由时报》所描写，则给人趋炎附势的印象，自对李敖构成诽谤。拉丁文中有innuendo，在英美侵权行为法中引申为“诽谤的
019.质问吴伯雄市长.txt	25	知过能改	〔后记〕这封质问信发出后，台北市政府知过能改，即予《自由时报》处分矣！处分文件如下：
020.控告《自由时报》.txt	9	说大人，则藐之	三、自来荣辱标准，因人而异，在奴才眼中，被“张大帅亲手打我一个耳光”、被“蒋总统亲自踢我一脚”，无不引以为荣；但在有人格有自尊心的人的眼中，无不目为奇耻。所以判例明定：“侮辱人之罪成立与否，应以对于个人在社会上所保持之人格及地位，因加害者之举动达于足以毁损其名誉之程度与否，以定标准。”（七年上字第187号）李敖为人，几十年来，以孤傲高蹈，戏公卿、弄王侯，“说大人，则藐之”为天下显、为天下倡，如今如《自由时报》所描写，则给人趋炎附势的印象，自对李敖构成诽谤。拉丁文中有innuendo，在英美侵权行为法中引申为“诽谤的
020.控告《自由时报》.txt	11	变本加厉	四、《自由时报》刊出捏造的这种事的当天午后两点，李敖即以国内快捷邮件台北七支局000384号寄辩驳书给该报，要求该报按《出版法》第15条“于接到要求后三日内更正，或登载辩驳书”之规定，一字不改，刊出全文，并按同条“更正或辩驳书之登载，其版面应与原文所载者相同”处理。并告诉他们：“贵报先在副刊上，对我屡次做不实报导与评述，已于《中国新闻记者信条》第1条、第2条、第4条、第5条、第8条、第10条、第11条有亏；亦与《中华民国报业道德规范》第2项、第4项不合，令人厌恶。如今变本加厉，在第二版上又故态复萌，且涉及我生平‘只
022.总比国民党值钱呀！.txt	15	说大人，则藐之	李敖为三十年来之知名作家，声名且见于《纽约时报》（New York Times）及《时代周刊》（Time）。三十年来，一直以孤傲高蹈，戏公卿、弄王侯，“说大人，则藐之”为天下显、为天下倡。如今如被告等所描写，则给人趋炎附势印象，自然构成严重诽谤。三十年来，李敖写书百余种，公卿、王侯、大人如孙中山、蒋中正、蒋经国、李登辉、宋美龄一干人等之真面目，无不一一被李敖著书拆穿，使天下人恍悟：原来此类公卿、王侯、大人也者，不过乃尔！如今被告等横加抹黑李敖如此，则李敖声名之公信力，悉将令人大打折扣，且对李敖人格与文格之一致性，亦
