score	file	line	text	context
3	006.第五部——2002（黄花岗91年后）.txt	307	李师科殉的是永远的中国。中国，没有杂七杂八国号的中国。‘中华民国’不是国了，只是一个朝代而已，它不是中国，只是中国的一个朝代，跟在宋、元、明、清屁股以后的一个短命朝代，说它短命，细节我哪里懂，你大学问家说说看，中国享国三十八年的朝代只此一家吗？	“李师科殉的是永远的中国。中国，没有杂七杂八国号的中国。‘中华民国’不是国了，只是一个朝代而已，它不是中国，只是中国的一个朝代，跟在宋、元、明、清屁股以后的一个短命朝代，说它短命，细节我哪里懂，你大学问家说说看，中国享国三十八年的朝代只此一家吗？”
3	006.第五部——2002（黄花岗91年后）.txt	309	让我想想看。哦，接近的朝代有北凉，享国三十九年；南唐、李后主的南唐，也享国三十九年；还有享国三十二年的陈、后蜀；享国三十三年的后赵；享国三十四年的前燕、后秦；享国三十六年的五代十国的吴；享国三十七年的五代十国的闽。至于享国三十八年的，只此‘中华民国’一家。	“让我想想看。哦，接近的朝代有北凉，享国三十九年；南唐、李后主的南唐，也享国三十九年；还有享国三十二年的陈、后蜀；享国三十三年的后赵；享国三十四年的前燕、后秦；享国三十六年的五代十国的吴；享国三十七年的五代十国的闽。至于享国三十八年的，只此‘中华民国’一家。”
4	006.第五部——2002（黄花岗91年后）.txt	311	天啊，你不用电脑，但你林排长的大脑就是电脑。	“天啊，你不用电脑，但你林排长的大脑就是电脑。”
4	006.第五部——2002（黄花岗91年后）.txt	313	不敢当、不敢当，这只是一点统计学而已。	“不敢当、不敢当，这只是一点统计学而已。”
6	006.第五部——2002（黄花岗91年后）.txt	315	问题在别的朝代，一亡国，就干干脆脆自承亡国了事，只是‘中华民国’这朝代最不要脸。哦，别怪‘中华民国’，这四个字只是一个名词而已，该怪打着招魂幡庆祝什么‘建国百年’的那群王八蛋，不要脸的是他们。凭他们的不要脸，我相信他们九年后一定庆祝什么‘建国百年’。	“问题在别的朝代，一亡国，就干干脆脆自承亡国了事，只是‘中华民国’这朝代最不要脸。哦，别怪‘中华民国’，这四个字只是一个名词而已，该怪打着招魂幡庆祝什么‘建国百年’的那群王八蛋，不要脸的是他们。凭他们的不要脸，我相信他们九年后一定庆祝什么‘建国百年’。”
5	006.第五部——2002（黄花岗91年后）.txt	317	九年后，他们是谁呢？现在看得出来吗？	“九年后，他们是谁呢？现在看得出来吗？”
3	006.第五部——2002（黄花岗91年后）.txt	319	是谁都一样。扁的、长的、姓牛的、姓马的，都一样。他们是一个娘生的，差异有限，唯一不同的是有人长得好看一点，有人太丑了。有人偷吃还知道擦擦嘴，有人连嘴都不擦。	“是谁都一样。扁的、长的、姓牛的、姓马的，都一样。他们是一个娘生的，差异有限，唯一不同的是有人长得好看一点，有人太丑了。有人偷吃还知道擦擦嘴，有人连嘴都不擦。”
6	006.第五部——2002（黄花岗91年后）.txt	323	孤臣是被皇上疏远的臣、孽子是姨太太生的儿子。本来‘孤臣孽子’不是什么好字眼，后来发生词变，变成正经八百的字眼了。其实蒋介石的天下没有‘孤臣孽子’可言，他传下来的都是佞幸。没有资格称为‘孤臣孽子’。	“孤臣是被皇上疏远的臣、孽子是姨太太生的儿子。本来‘孤臣孽子’不是什么好字眼，后来发生词变，变成正经八百的字眼了。其实蒋介石的天下没有‘孤臣孽子’可言，他传下来的都是佞幸。没有资格称为‘孤臣孽子’。”
3	006.第五部——2002（黄花岗91年后）.txt	325	这九年会发生反对党执政吧？	“这九年会发生反对党执政吧？”
4	006.第五部——2002（黄花岗91年后）.txt	327	反对党又怎样，别忘了他们和执政党是一个娘生的。	“反对党又怎样，别忘了他们和执政党是一个娘生的。”
3	006.第五部——2002（黄花岗91年后）.txt	329	那你约我九年后见干什么？	“那你约我九年后见干什么？”
4	006.第五部——2002（黄花岗91年后）.txt	333	九年前是王八、九年后是老王八。	“九年前是王八、九年后是老王八。”
4	006.第五部——2002（黄花岗91年后）.txt	335	又不是我一个人老，你也老，‘与子偕老’。	“又不是我一个人老，你也老，‘与子偕老’。”
3	006.第五部——2002（黄花岗91年后）.txt	337	好吧，就照你这怪咖意思，我们九年后‘忠烈祠’见了，噢，话说远了，还是弄不懂，为什么是‘忠烈祠’，不是别的地方？	“好吧，就照你这怪咖意思，我们九年后‘忠烈祠’见了，噢，话说远了，还是弄不懂，为什么是‘忠烈祠’，不是别的地方？”
3	006.第五部——2002（黄花岗91年后）.txt	339	别忘了，‘忠烈祠’可是你见到莫纪彭老先生的地方。别忘了过去聊天时，你谈到过他。你记得吗？	“别忘了，‘忠烈祠’可是你见到莫纪彭老先生的地方。别忘了过去聊天时，你谈到过他。你记得吗？”
4	006.第五部——2002（黄花岗91年后）.txt	343	我再说一遍，李师科抢走的不止是钱，还包含头衔。	“但是，李师科抢走了这头衔。李师科真了不起，他抢走了五百万，又抢走了‘第七十三烈士’的头衔。”王宇补充说：“我再说一遍，李师科抢走的不止是钱，还包含头衔。”
3	006.第五部——2002（黄花岗91年后）.txt	343	但是，李师科抢走了这头衔。李师科真了不起，他抢走了五百万，又抢走了‘第七十三烈士’的头衔。	“但是，李师科抢走了这头衔。李师科真了不起，他抢走了五百万，又抢走了‘第七十三烈士’的头衔。”王宇补充说：“我再说一遍，李师科抢走的不止是钱，还包含头衔。”
4	006.第五部——2002（黄花岗91年后）.txt	345	这头衔被抢走了，莫纪彭不知道。	“这头衔被抢走了，莫纪彭不知道。”
4	006.第五部——2002（黄花岗91年后）.txt	349	头衔岂能靠你王排长、我林排长分来分去的，给了这个又给了那个。	“头衔岂能靠你王排长、我林排长分来分去的，给了这个又给了那个。”
4	006.第五部——2002（黄花岗91年后）.txt	351	因为我们是时代的见证人，也是颁奖人。	“因为我们是时代的见证人，也是颁奖人。”
3	006.第五部——2002（黄花岗91年后）.txt	353	我们在台下做颁奖人吗？	“我们在台下做颁奖人吗？”
4	006.第五部——2002（黄花岗91年后）.txt	355	真正的颁奖人是在台下的。但更重要的是，真正的颁奖人是没埋在地下的。活着才是一切。	“真正的颁奖人是在台下的。但更重要的是，真正的颁奖人是没埋在地下的。活着才是一切。”王宇伸出拳头。“我活着，所以我颁奖。”
4	006.第五部——2002（黄花岗91年后）.txt	355	我活着，所以我颁奖。	“真正的颁奖人是在台下的。但更重要的是，真正的颁奖人是没埋在地下的。活着才是一切。”王宇伸出拳头。“我活着，所以我颁奖。”
5	006.第五部——2002（黄花岗91年后）.txt	357	这样说来，我们之中一个死了，那活着的会颁给对方什么奖吗？	“这样说来，我们之中一个死了，那活着的会颁给对方什么奖吗？”
3	006.第五部——2002（黄花岗91年后）.txt	361	会给什么头衔吗？	“会给什么头衔吗？”
3	006.第五部——2002（黄花岗91年后）.txt	371	那你呢？	“那你呢？”
3	006.第五部——2002（黄花岗91年后）.txt	373	我是历史家，我什么都不要，我只要统计学。一个人是故事、是悲剧，七十二个人只是统计数字。不过，第七十三个又回到故事、回到悲剧。第七十三编号太好了，它是鱼尾巴、尾鳍。不过它不是上下对称的同形尾，而是上下不对称的歪形尾，它是鲛类和硬骨鱼类中的那种鲟鱼，这尾巴，可以决定前进的方向，也就是说，‘第七十三烈士’可以决定七十二烈士的方向。多逗啊，一个不正点的歪形尾，但它决定你的方向。	“我是历史家，我什么都不要，我只要统计学。一个人是故事、是悲剧，七十二个人只是统计数字。不过，第七十三个又回到故事、回到悲剧。第七十三编号太好了，它是鱼尾巴、尾鳍。不过它不是上下对称的同形尾，而是上下不对称的歪形尾，它是鲛类和硬骨鱼类中的那种鲟鱼，这尾巴，可以决定前进的方向，也就是说，‘第七十三烈士’可以决定七十二烈士的方向。多逗啊，一个不正点的歪形尾，但它...
4	006.第五部——2002（黄花岗91年后）.txt	375	你是说七十二烈士死了，但他们的方向，有待于‘第七十三烈士’来定向？	“你是说七十二烈士死了，但他们的方向，有待于‘第七十三烈士’来定向？”
4	006.第五部——2002（黄花岗91年后）.txt	377	不止定向。也包括定位、定性、定型。	“不止定向。也包括定位、定性、定型。”
3	006.第五部——2002（黄花岗91年后）.txt	379	你是什么历史家嘛！	“你是什么历史家嘛！”
4	006.第五部——2002（黄花岗91年后）.txt	381	我就是这种历史家，我使死者瞑目、使活人睁眼。	“我就是这种历史家，我使死者瞑目、使活人睁眼。”
4	006.第五部——2002（黄花岗91年后）.txt	383	我全没看错！我九年后要见你，就是要见那种歪形尾的你。	“对了！”王宇一鼓掌。“我全没看错！我九年后要见你，就是要见那种歪形尾的你。”
4	006.第五部——2002（黄花岗91年后）.txt	385	你这老屌，你九年后还不怀好心。你卖什么关子？你为什么不早说清楚一切？	“你这老屌，你九年后还不怀好心。你卖什么关子？你为什么不早说清楚一切？”
3	006.第五部——2002（黄花岗91年后）.txt	387	坦白告诉你老弟，为什么要等九年后，因为我儿子还未成年，我没有安全感。我要等到一切都各就各位了，没有后顾之忧了，我才说出我的秘密。	王宇有点黯然。“坦白告诉你老弟，为什么要等九年后，因为我儿子还未成年，我没有安全感。我要等到一切都各就各位了，没有后顾之忧了，我才说出我的秘密。”
3	006.第五部——2002（黄花岗91年后）.txt	389	原来你有秘密！让我重复一下，你光着屁股跟我大便几百次、光着屁股跟我洗澡几百次，你他妈的还有秘密，你太神了。	“原来你有秘密！让我重复一下，你光着屁股跟我大便几百次、光着屁股跟我洗澡几百次，你他妈的还有秘密，你太神了。”
3	006.第五部——2002（黄花岗91年后）.txt	391	真人不露相啊，真人只露屁股，但不露相啊，虽然我们是哥儿们，但二十年、三十年、四十年下来，有多少变化啊，你退伍了、坐牢了；我退伍了、念了野鸡大学了、结婚生子了；李师科开了后半辈子计程车，最后给枪毙了。还有别人……有多少变化呀，才二十年、三十年、四十年。总体说来，变化是有，可是沉淀得不够、结晶得不够，所以要再等九年，等到七老八十、等到你我鸡巴毛都白了，再来番总检讨，那才是时候。	王宇苦笑一下。“真人不露相啊，真人只露屁股，但不露相啊，虽然我们是哥儿们，但二十年、三十年、四十年下来，有多少变化啊，你退伍了、坐牢了；我退伍了、念了野鸡大学了、结婚生子了；李师科开了后半辈子计程车，最后给枪毙了。还有别人……有多少变化呀，才二十年、三十年、四十年。总体说来，变化是有，可是沉淀得不够、结晶得不够，所以要再等九年，等到七老八十、等到你我鸡巴毛都...
3	006.第五部——2002（黄花岗91年后）.txt	397	别扯了吧，还等九年，那时候，不是鸡巴毛白了，而是掉光了。九年内你死了我死了，你的秘密又讲给谁听？	“别扯了吧，还等九年，那时候，不是鸡巴毛白了，而是掉光了。九年内你死了我死了，你的秘密又讲给谁听？”
3	006.第五部——2002（黄花岗91年后）.txt	399	我忧患一生，能活下来，靠的就是这点盲目的乐观与信心。我就赌这个啊。九年是没问题的。老兵不死，他可以再活九年。	“我忧患一生，能活下来，靠的就是这点盲目的乐观与信心。我就赌这个啊。九年是没问题的。老兵不死，他可以再活九年。”
3	006.第五部——2002（黄花岗91年后）.txt	401	万一死了呢？	“万一死了呢？”
4	006.第五部——2002（黄花岗91年后）.txt	403	万一死了，也不过是一场赛跑你跑不到终点而已。一定有别的选手跑到。	“万一死了，也不过是一场赛跑你跑不到终点而已。一定有别的选手跑到。”
4	006.第五部——2002（黄花岗91年后）.txt	407	你呀！九年后你才七十六岁。你那时候更成熟，会是更好的历史家。	“你呀！九年后你才七十六岁。你那时候更成熟，会是更好的历史家。”
3	006.第五部——2002（黄花岗91年后）.txt	411	我的秘密嘛……也没那么重要了。我们老兵的秘密，到李师科为止，已经至矣尽矣、已经光芒万丈了。没有我这一段，至多美中不足，到李师科为止，已经很美了。	“我的秘密嘛……也没那么重要了。我们老兵的秘密，到李师科为止，已经至矣尽矣、已经光芒万丈了。没有我这一段，至多美中不足，到李师科为止，已经很美了。”
4	006.第五部——2002（黄花岗91年后）.txt	413	你这老王八，卖尽了关子。	“你这老王八，卖尽了关子。”
4	006.第五部——2002（黄花岗91年后）.txt	415	你上车吧。九年后，2011年3月29日，早上9点，‘忠烈祠’大门口见。	“你上车吧。九年后，2011年3月29日，早上9点，‘忠烈祠’大门口见。”
5	006.第五部——2002（黄花岗91年后）.txt	417	妈的，你以为你是谁呀！跟张良订约会的黄石公吗？	“妈的，你以为你是谁呀！跟张良订约会的黄石公吗？”
4	006.第五部——2002（黄花岗91年后）.txt	419	我没资格做黄石公，但你有资格做张良。	“我没资格做黄石公，但你有资格做张良。”
5	006.第五部——2002（黄花岗91年后）.txt	421	做了又怎样，做张良代表什么？	“做了又怎样，做张良代表什么？”
3	006.第五部——2002（黄花岗91年后）.txt	423	代表复仇啊、代表推翻暴政啊、代表复仇和推翻以后飘然而去啊。至于我，我哪够资格做什么黄石公，我只是因缘际会认识了你，愿意因你而出口屌气而已。我未能做李师科，但我有我的方法，就是健康长寿、忍气吞声，但扒住一个老屌不放，那老屌就是你。就是相约九年后，九年后一切便见真章。妈的，你上车吧，上路还要走好大一段呢。	“代表复仇啊、代表推翻暴政啊、代表复仇和推翻以后飘然而去啊。至于我，我哪够资格做什么黄石公，我只是因缘际会认识了你，愿意因你而出口屌气而已。我未能做李师科，但我有我的方法，就是健康长寿、忍气吞声，但扒住一个老屌不放，那老屌就是你。就是相约九年后，九年后一切便见真章。妈的，你上车吧，上路还要走好大一段呢。”
4	006.第五部——2002（黄花岗91年后）.txt	425	妈的，	“妈的，”林光烈伸出手来，紧握了王宇。“妈的，我已经是怪咖，又碰到一个更怪咖的怪咖。”
4	006.第五部——2002（黄花岗91年后）.txt	425	妈的，我已经是怪咖，又碰到一个更怪咖的怪咖。	“妈的，”林光烈伸出手来，紧握了王宇。“妈的，我已经是怪咖，又碰到一个更怪咖的怪咖。”
3	006.第五部——2002（黄花岗91年后）.txt	431	你不同我回台北吗？	“你不同我回台北吗？”
4	006.第五部——2002（黄花岗91年后）.txt	433	谁说我住在台北？我住在新店，一个离李师科更近的地方。	“谁说我住在台北？我住在新店，一个离李师科更近的地方。”王宇神气的说。“要找我，你找得到我。新店市公所有我的住址。我不要找你，你找我就是我找你。”
4	006.第五部——2002（黄花岗91年后）.txt	433	要找我，你找得到我。新店市公所有我的住址。我不要找你，你找我就是我找你。	“谁说我住在台北？我住在新店，一个离李师科更近的地方。”王宇神气的说。“要找我，你找得到我。新店市公所有我的住址。我不要找你，你找我就是我找你。”
4	006.第五部——2002（黄花岗91年后）.txt	435	我们谁也不要找谁。有本领九年以后‘忠烈祠’门口见。如果见不到，就有人死定了。	“我们谁也不要找谁。有本领九年以后‘忠烈祠’门口见。如果见不到，就有人死定了。”
4	006.第五部——2002（黄花岗91年后）.txt	437	你太小看了我，不但在‘忠烈祠’门口有我，说不定牌位里也会有我呢。哈哈哈哈！	“你太小看了我，不但在‘忠烈祠’门口有我，说不定牌位里也会有我呢。哈哈哈哈！”
4	007.第六部——2011（黄花岗百年后）.txt	13	王宇，真有你的！你真老而不死，说九年，就九年。	“王宇，真有你的！你真老而不死，说九年，就九年。”说着，两人紧抱在一起、两只老手紧握在一起。
3	007.第六部——2011（黄花岗百年后）.txt	15	林光烈，你还不是一样。对我说来，你是少壮派，你只七十六岁，我大你八岁，八十四了，上次见你正是我七十六岁的年纪，如今你赶上上次的我，但我还是走在你前面。	“林光烈，你还不是一样。对我说来，你是少壮派，你只七十六岁，我大你八岁，八十四了，上次见你正是我七十六岁的年纪，如今你赶上上次的我，但我还是走在你前面。”
4	007.第六部——2011（黄花岗百年后）.txt	19	在‘忠烈祠’这鬼地方，早死晚死不重要，重要的是你怎么定它的坐标。	“在‘忠烈祠’这鬼地方，早死晚死不重要，重要的是你怎么定它的坐标。”
5	007.第六部——2011（黄花岗百年后）.txt	21	你说得太玄了，什么坐标？坐什么标？	“你说得太玄了，什么坐标？坐什么标？”
4	007.第六部——2011（黄花岗百年后）.txt	23	等一下你就知道了。我盼这一天，盼了五十年了。	“等一下你就知道了。我盼这一天，盼了五十年了。”
3	007.第六部——2011（黄花岗百年后）.txt	25	你这老屌卖什么关子？	“你这老屌卖什么关子？”
4	007.第六部——2011（黄花岗百年后）.txt	39	王宇，我看到你不笑的时候。	“王宇，我看到你不笑的时候。”
3	007.第六部——2011（黄花岗百年后）.txt	43	你看到了什么？	“你看到了什么？”王宇故作冷言冷语：“你在我背后，你只看到我的后脑勺，你怎么知道我没笑？我一个人也在笑，不一定是哈哈哈那种，而可能是嘻嘻嘻那种，也可能没有声音，我在冷笑、在暗笑、在嘲笑、在奸笑、在偷笑，我一个人，不要笑给谁看，事实上我在自己对自己笑。你看，我不是在笑吗？”
3	007.第六部——2011（黄花岗百年后）.txt	43	你在我背后，你只看到我的后脑勺，你怎么知道我没笑？我一个人也在笑，不一定是哈哈哈那种，而可能是嘻嘻嘻那种，也可能没有声音，我在冷笑、在暗笑、在嘲笑、在奸笑、在偷笑，我一个人，不要笑给谁看，事实上我在自己对自己笑。你看，我不是在笑吗？	“你看到了什么？”王宇故作冷言冷语：“你在我背后，你只看到我的后脑勺，你怎么知道我没笑？我一个人也在笑，不一定是哈哈哈那种，而可能是嘻嘻嘻那种，也可能没有声音，我在冷笑、在暗笑、在嘲笑、在奸笑、在偷笑，我一个人，不要笑给谁看，事实上我在自己对自己笑。你看，我不是在笑吗？”
3	007.第六部——2011（黄花岗百年后）.txt	45	你在笑，没错，可是那是‘皮笑肉不笑’，肉笑了又怎样，你事实上在惨笑、在苦笑。如果惨笑、苦笑算是笑的话，我看到你是在笑，惨笑和苦笑。你呀，王宇，可以有理由惨笑、苦笑，但我奇怪你对着‘忠烈祠’的鬼牌位做什么惨笑苦笑，如果非要笑，你可以做别的种类的笑。	“你在笑，没错，可是那是‘皮笑肉不笑’，肉笑了又怎样，你事实上在惨笑、在苦笑。如果惨笑、苦笑算是笑的话，我看到你是在笑，惨笑和苦笑。你呀，王宇，可以有理由惨笑、苦笑，但我奇怪你对着‘忠烈祠’的鬼牌位做什么惨笑苦笑，如果非要笑，你可以做别的种类的笑。”
3	007.第六部——2011（黄花岗百年后）.txt	51	狞笑？狞笑太多仇恨了，笑是有益健康的，但狞笑显然不算。不过，狞笑有益于展现正义。正义之士应该有点狞笑、来点狞笑。当正义伸张的时候，当坏人被打倒、躺在地下的时候，你来点狞笑，做得意状，似乎也不错呢。	“狞笑？狞笑太多仇恨了，笑是有益健康的，但狞笑显然不算。不过，狞笑有益于展现正义。正义之士应该有点狞笑、来点狞笑。当正义伸张的时候，当坏人被打倒、躺在地下的时候，你来点狞笑，做得意状，似乎也不错呢。”
5	007.第六部——2011（黄花岗百年后）.txt	53	照你这么说，你刚才应该正在狞笑，狞得快射精了，被我撞见了，是不是？	“照你这么说，你刚才应该正在狞笑，狞得快射精了，被我撞见了，是不是？”
5	007.第六部——2011（黄花岗百年后）.txt	55	哈哈，妈的，我对这鬼牌位狞个什么？射什么精？	“哈哈，妈的，我对这鬼牌位狞个什么？射什么精？”
6	007.第六部——2011（黄花岗百年后）.txt	57	牌位，牌位象征的是什么？让我告诉你，牌位就是中国古文字中的‘且’字，就是鸡巴造型。古人生殖器崇拜，就崇拜起鸡巴来了。慎终追远，就崇拜起祖宗的鸡巴来了。并且，为了鸡巴的需要，就出现‘且’字在旁的‘祖’字、祖宗的‘祖’字，就是崇拜老祖宗的鸡巴。所以呀，每个‘且’字，就是每个翘起来的鸡巴，翘起来干什么，射精呀，传宗接代呀！	“牌位，牌位象征的是什么？让我告诉你，牌位就是中国古文字中的‘且’字，就是鸡巴造型。古人生殖器崇拜，就崇拜起鸡巴来了。慎终追远，就崇拜起祖宗的鸡巴来了。并且，为了鸡巴的需要，就出现‘且’字在旁的‘祖’字、祖宗的‘祖’字，就是崇拜老祖宗的鸡巴。所以呀，每个‘且’字，就是每个翘起来的鸡巴，翘起来干什么，射精呀，传宗接代呀！”
3	007.第六部——2011（黄花岗百年后）.txt	59	原来如此。毕竟你林光烈学问大、眼力不凡，进了‘忠烈祠’，眼之所见，鸡巴林立。但你有否想过，你见到的，都是死鸡巴？你见到的唯一活鸡巴，在我王宇身上。	“原来如此。毕竟你林光烈学问大、眼力不凡，进了‘忠烈祠’，眼之所见，鸡巴林立。但你有否想过，你见到的，都是死鸡巴？你见到的唯一活鸡巴，在我王宇身上。”
3	007.第六部——2011（黄花岗百年后）.txt	63	不管是真先烈或假先烈，至少有一点是真的，就是他们都是死了的人了，但左上角那位牌位上的先烈，却到今天还没死呢。	“不管是真先烈或假先烈，至少有一点是真的，就是他们都是死了的人了，但左上角那位牌位上的先烈，却到今天还没死呢。”
3	007.第六部——2011（黄花岗百年后）.txt	65	今天还没死？	“今天还没死？”
3	007.第六部——2011（黄花岗百年后）.txt	69	还活着？	“还活着？”
3	007.第六部——2011（黄花岗百年后）.txt	73	我知道有过人没死，以为他死了，就进了‘忠烈祠’的，像太原五百完人。但五十年下来、几十年下来，没死的也死光光了，哪有活的？你胡扯什么？	“我知道有过人没死，以为他死了，就进了‘忠烈祠’的，像太原五百完人。但五十年下来、几十年下来，没死的也死光光了，哪有活的？你胡扯什么？”
