score	file	line	text	context
5	001.楔子——1911（黄花岗）.txt	3	师爷，第几个了？	“师爷，第几个了？”
5	001.楔子——1911（黄花岗）.txt	5	报告大人，数也数不准了，包括打死的、砍头的，一共七十二个吧？	“报告大人，数也数不准了，包括打死的、砍头的，一共七十二个吧？”
5	001.楔子——1911（黄花岗）.txt	7	七十二个死尸？没弄混吗？我们的官兵也死了好多，没混在一起吗？	“七十二个死尸？没弄混吗？我们的官兵也死了好多，没混在一起吗？”
3	001.楔子——1911（黄花岗）.txt	9	报告大人，不可能混在一起，我们的人，是穿制服的。都分清楚了，穿制服的、跟没穿制服的，都分开了。穿制服的要埋得像样一点；没穿的，丢他老妈吧。老祖宗规矩叫‘曝尸三日’，就曝曝这些死革命党的尸吧。什么革命党，都是乱党！	“报告大人，不可能混在一起，我们的人，是穿制服的。都分清楚了，穿制服的、跟没穿制服的，都分开了。穿制服的要埋得像样一点；没穿的，丢他老妈吧。老祖宗规矩叫‘曝尸三日’，就曝曝这些死革命党的尸吧。什么革命党，都是乱党！”
5	001.楔子——1911（黄花岗）.txt	11	砍了这么多个，拿鬼头刀的刽老爷累坏了吧？	“砍了这么多个，拿鬼头刀的刽老爷累坏了吧？”
3	001.楔子——1911（黄花岗）.txt	13	报告大人，刽老爷跟他徒弟们一起砍的，都累坏了。他们就坐在那土堆上抽旱烟呢，大人要不要慰问一下？给他们赏几文？	“报告大人，刽老爷跟他徒弟们一起砍的，都累坏了。他们就坐在那土堆上抽旱烟呢，大人要不要慰问一下？给他们赏几文？”
4	001.楔子——1911（黄花岗）.txt	15	嗯，叫他们过来。现在国家财政拮据，但赏刽子手的钱可不能少。	“嗯，叫他们过来。现在国家财政拮据，但赏刽子手的钱可不能少。”
4	001.楔子——1911（黄花岗）.txt	21	丢老妈！这些死革命党！年纪轻轻的，革什么命？革命就是丢老妈造反啊，造反就得杀头啊！杀得老子累死了，一个又一个、一个又一个，要杀这么多头啊，溅得一身都是血，这些死革命党真不怕死啊，砍了一辈子人头，多少江洋大盗、绿林好汉，有的临砍头前就懦了、就软了、就脸白了、就腿抖了，可是这些死革命党啊，一个又一个、一个又一个，没有一个懦的，怎么回事啊，丢老妈！	“丢老妈！这些死革命党！年纪轻轻的，革什么命？革命就是丢老妈造反啊，造反就得杀头啊！杀得老子累死了，一个又一个、一个又一个，要杀这么多头啊，溅得一身都是血，这些死革命党真不怕死啊，砍了一辈子人头，多少江洋大盗、绿林好汉，有的临砍头前就懦了、就软了、就脸白了、就腿抖了，可是这些死革命党啊，一个又一个、一个又一个，没有一个懦的，怎么回事啊，丢老妈！”
4	001.楔子——1911（黄花岗）.txt	23	报告大人，刽老爷他们说话没规矩，在大人面前讲粗话，太失态了。	“报告大人，刽老爷他们说话没规矩，在大人面前讲粗话，太失态了。”
4	001.楔子——1911（黄花岗）.txt	25	不怪他们、不怪他们。	“不怪他们、不怪他们。”总督大人说。“他们是粗人。干这行是祖传的，不是吗？刽老爷？”
4	001.楔子——1911（黄花岗）.txt	25	他们是粗人。干这行是祖传的，不是吗？刽老爷？	“不怪他们、不怪他们。”总督大人说。“他们是粗人。干这行是祖传的，不是吗？刽老爷？”
4	001.楔子——1911（黄花岗）.txt	27	丢老妈！真是祖传的，我们一家三代都是拿鬼头刀的。丢老妈！	“丢老妈！真是祖传的，我们一家三代都是拿鬼头刀的。丢老妈！”
3	001.楔子——1911（黄花岗）.txt	29	你们杀人无数？	“你们杀人无数？”
4	001.楔子——1911（黄花岗）.txt	33	大人是说，你们三代杀的人可多了、数不清了。	“大人是说，你们三代杀的人可多了、数不清了。”
3	001.楔子——1911（黄花岗）.txt	35	哦，丢老妈！真数不清了。但一天内一个接一个、连杀这么多的，可是第一次。并且，过去我们杀的，都是江洋大盗、绿林好汉，没杀过革命党，除了十多天前杀的那一个，叫什么温什么的。他是行刺孚琦将军的凶手，砍他的时候，他戴着粗脚镣拖过来，还大骂‘丢老妈’呢。那叫什么温什么的，他的辫子，又粗又有力道，砍头的时候，我的徒弟拉直这辫子，我看得发呆，我从没看过那样的辫子。	“哦，丢老妈！真数不清了。但一天内一个接一个、连杀这么多的，可是第一次。并且，过去我们杀的，都是江洋大盗、绿林好汉，没杀过革命党，除了十多天前杀的那一个，叫什么温什么的。他是行刺孚琦将军的凶手，砍他的时候，他戴着粗脚镣拖过来，还大骂‘丢老妈’呢。那叫什么温什么的，他的辫子，又粗又有力道，砍头的时候，我的徒弟拉直这辫子，我看得发呆，我从没看过那样的辫子。”刽老...
5	001.楔子——1911（黄花岗）.txt	37	别小看了辫子，	“别小看了辫子，”总督大人淡淡的说，“为了这条辫子，千万人头落地。噢，你说温什么的，都是你们老广。”
4	001.楔子——1911（黄花岗）.txt	37	为了这条辫子，千万人头落地。噢，你说温什么的，都是你们老广。	“别小看了辫子，”总督大人淡淡的说，“为了这条辫子，千万人头落地。噢，你说温什么的，都是你们老广。”
4	001.楔子——1911（黄花岗）.txt	39	丢老妈！他是老广，老广杀老广，很不是滋味。	“丢老妈！他是老广，老广杀老广，很不是滋味。”
4	001.楔子——1911（黄花岗）.txt	41	他叫温生才，温开水的温、生小孩的生、才能的才。	“他叫温生才，温开水的温、生小孩的生、才能的才。”
3	001.楔子——1911（黄花岗）.txt	43	丢老妈！温什么的看来比今天杀的这些死革命党干脆得多，今天的死革命党被砍头前，有的还谈大道理，我们听不懂。	“丢老妈！温什么的看来比今天杀的这些死革命党干脆得多，今天的死革命党被砍头前，有的还谈大道理，我们听不懂。”
5	001.楔子——1911（黄花岗）.txt	45	大概他们劝你们改行吧，	“大概他们劝你们改行吧，”总督大人说，“别一连三代都干刽子手了？”
3	001.楔子——1911（黄花岗）.txt	45	别一连三代都干刽子手了？	“大概他们劝你们改行吧，”总督大人说，“别一连三代都干刽子手了？”
4	001.楔子——1911（黄花岗）.txt	47	他们皇上不是也一连三代干同一行吗？丢老妈！他们死革命党如果不死，难道不一连干三代革命党吗？	“他们皇上不是也一连三代干同一行吗？丢老妈！他们死革命党如果不死，难道不一连干三代革命党吗？”
4	001.楔子——1911（黄花岗）.txt	49	报告大人，刽老爷是粗人，但不知道革命党只干第一代，第二代就改行当刽子手了。	“报告大人，刽老爷是粗人，但不知道革命党只干第一代，第二代就改行当刽子手了。”
3	001.楔子——1911（黄花岗）.txt	51	革命党变刽子手，无须等到下一代。全世界最好的革命党就是死了的革命党。他们死了，是他们永远的光荣。	总督大人瞪了左右一眼。“革命党变刽子手，无须等到下一代。全世界最好的革命党就是死了的革命党。他们死了，是他们永远的光荣。”
5	001.楔子——1911（黄花岗）.txt	53	光荣，报告大人，从被砍头开始算吗？	“光荣，报告大人，从被砍头开始算吗？”
3	001.楔子——1911（黄花岗）.txt	55	不是吧？	“不是吧？”大人若有所思。“该从‘曝尸三日’后开始算。哦，本官是外省人，孚琦将军被刺后我才忙起来，不太清楚这地方，这地方叫什么名字啊？”
3	001.楔子——1911（黄花岗）.txt	55	该从‘曝尸三日’后开始算。哦，本官是外省人，孚琦将军被刺后我才忙起来，不太清楚这地方，这地方叫什么名字啊？	“不是吧？”大人若有所思。“该从‘曝尸三日’后开始算。哦，本官是外省人，孚琦将军被刺后我才忙起来，不太清楚这地方，这地方叫什么名字啊？”
4	001.楔子——1911（黄花岗）.txt	57	报告大人，它叫‘红花岗’。	“报告大人，它叫‘红花岗’。”
4	001.楔子——1911（黄花岗）.txt	59	哦，‘红花岗’、‘红花岗’，气味太强、颜色太重了，也许有一天，它不叫‘红花岗’了。	“哦，‘红花岗’、‘红花岗’，气味太强、颜色太重了，也许有一天，它不叫‘红花岗’了。”
5	001.楔子——1911（黄花岗）.txt	61	报告大人，请开示叫什么呢？	“报告大人，请开示叫什么呢？”
4	001.楔子——1911（黄花岗）.txt	63	我也不知道。也许有一天，它会叫——‘黄——花——岗’。	“我也不知道。也许有一天，它会叫——‘黄——花——岗’。”
4	002.第一部——1949（黄花岗38年后）.txt	25	七十二烈士之墓	大官人向党徽们瞄了一眼，充满了卑视。最后，他游移的目光锁定在方碑底座，底座奠基在一片大方阵上，方阵四面石栏围绕，人莫得近，方阵方得有点怪异，因为向中凸起，凸起顶端，就树立了“七十二烈士之墓”那方碑。整个黄花岗的主坟就在这里。在方碑之下、方阵之下，不像是坟，因为不太隆起；又不像是墓，因为又不立体又不平面，但它大得的确接近人的想像，七十二具死尸就埋在那里、埋在底...
4	002.第一部——1949（黄花岗38年后）.txt	25	人血馒头	大官人向党徽们瞄了一眼，充满了卑视。最后，他游移的目光锁定在方碑底座，底座奠基在一片大方阵上，方阵四面石栏围绕，人莫得近，方阵方得有点怪异，因为向中凸起，凸起顶端，就树立了“七十二烈士之墓”那方碑。整个黄花岗的主坟就在这里。在方碑之下、方阵之下，不像是坟，因为不太隆起；又不像是墓，因为又不立体又不平面，但它大得的确接近人的想像，七十二具死尸就埋在那里、埋在底...
6	002.第一部——1949（黄花岗38年后）.txt	47	缔造民国七十二烈士纪功坊	大官人兴趣来了。那是一行从右到左的十二字小篆，写得回肠荡气、功力超凡。写它的“章炳麟”，不是别人，就是“中华民国”四字招牌的定型者章太炎。章太炎为革命而坐牢、而亡命、而逐出师门，最后，“中华民国”成立了，但是，袁大总统的鹰犬爪牙软禁他、孙大总统的徒子徒孙通缉他，敌友江湖，正反显出的，是一片嘶喊与寥落。1920年，当他写下“缔造民国七十二烈士纪功坊”的时候，他...
4	002.第一部——1949（黄花岗38年后）.txt	47	中华民国	大官人兴趣来了。那是一行从右到左的十二字小篆，写得回肠荡气、功力超凡。写它的“章炳麟”，不是别人，就是“中华民国”四字招牌的定型者章太炎。章太炎为革命而坐牢、而亡命、而逐出师门，最后，“中华民国”成立了，但是，袁大总统的鹰犬爪牙软禁他、孙大总统的徒子徒孙通缉他，敌友江湖，正反显出的，是一片嘶喊与寥落。1920年，当他写下“缔造民国七十二烈士纪功坊”的时候，他...
6	002.第一部——1949（黄花岗38年后）.txt	53	缔造民国七十二烈士纪功坊	南京是没有资格“龙蟠虎踞”的，“古人”以此赞美南京，并非实话；而打着革命旗号的国民党，只不过是一群贼，他们“鼠窃狗偷”了这个国家，先烈地下有知，将死不瞑目。虽然开国元勋愤慨如此，但章太炎对死者的顶礼，迄未少衰。他在“民国九年”，用小篆写下“缔造民国七十二烈士纪功坊”，“缔造”者的前功是不能忘记的，也许这是唯一能肯定的，“缔造”以后，接下去的是不堪闻问。章太炎...
4	002.第一部——1949（黄花岗38年后）.txt	53	龙蟠虎踞	南京是没有资格“龙蟠虎踞”的，“古人”以此赞美南京，并非实话；而打着革命旗号的国民党，只不过是一群贼，他们“鼠窃狗偷”了这个国家，先烈地下有知，将死不瞑目。虽然开国元勋愤慨如此，但章太炎对死者的顶礼，迄未少衰。他在“民国九年”，用小篆写下“缔造民国七十二烈士纪功坊”，“缔造”者的前功是不能忘记的，也许这是唯一能肯定的，“缔造”以后，接下去的是不堪闻问。章太炎...
4	002.第一部——1949（黄花岗38年后）.txt	53	民国九年	南京是没有资格“龙蟠虎踞”的，“古人”以此赞美南京，并非实话；而打着革命旗号的国民党，只不过是一群贼，他们“鼠窃狗偷”了这个国家，先烈地下有知，将死不瞑目。虽然开国元勋愤慨如此，但章太炎对死者的顶礼，迄未少衰。他在“民国九年”，用小篆写下“缔造民国七十二烈士纪功坊”，“缔造”者的前功是不能忘记的，也许这是唯一能肯定的，“缔造”以后，接下去的是不堪闻问。章太炎...
4	002.第一部——1949（黄花岗38年后）.txt	53	民国二十五年	南京是没有资格“龙蟠虎踞”的，“古人”以此赞美南京，并非实话；而打着革命旗号的国民党，只不过是一群贼，他们“鼠窃狗偷”了这个国家，先烈地下有知，将死不瞑目。虽然开国元勋愤慨如此，但章太炎对死者的顶礼，迄未少衰。他在“民国九年”，用小篆写下“缔造民国七十二烈士纪功坊”，“缔造”者的前功是不能忘记的，也许这是唯一能肯定的，“缔造”以后，接下去的是不堪闻问。章太炎...
4	002.第一部——1949（黄花岗38年后）.txt	53	民国三十八年	南京是没有资格“龙蟠虎踞”的，“古人”以此赞美南京，并非实话；而打着革命旗号的国民党，只不过是一群贼，他们“鼠窃狗偷”了这个国家，先烈地下有知，将死不瞑目。虽然开国元勋愤慨如此，但章太炎对死者的顶礼，迄未少衰。他在“民国九年”，用小篆写下“缔造民国七十二烈士纪功坊”，“缔造”者的前功是不能忘记的，也许这是唯一能肯定的，“缔造”以后，接下去的是不堪闻问。章太炎...
3	002.第一部——1949（黄花岗38年后）.txt	53	古人	南京是没有资格“龙蟠虎踞”的，“古人”以此赞美南京，并非实话；而打着革命旗号的国民党，只不过是一群贼，他们“鼠窃狗偷”了这个国家，先烈地下有知，将死不瞑目。虽然开国元勋愤慨如此，但章太炎对死者的顶礼，迄未少衰。他在“民国九年”，用小篆写下“缔造民国七十二烈士纪功坊”，“缔造”者的前功是不能忘记的，也许这是唯一能肯定的，“缔造”以后，接下去的是不堪闻问。章太炎...
3	002.第一部——1949（黄花岗38年后）.txt	53	鼠窃狗偷	南京是没有资格“龙蟠虎踞”的，“古人”以此赞美南京，并非实话；而打着革命旗号的国民党，只不过是一群贼，他们“鼠窃狗偷”了这个国家，先烈地下有知，将死不瞑目。虽然开国元勋愤慨如此，但章太炎对死者的顶礼，迄未少衰。他在“民国九年”，用小篆写下“缔造民国七十二烈士纪功坊”，“缔造”者的前功是不能忘记的，也许这是唯一能肯定的，“缔造”以后，接下去的是不堪闻问。章太炎...
3	002.第一部——1949（黄花岗38年后）.txt	53	民国	南京是没有资格“龙蟠虎踞”的，“古人”以此赞美南京，并非实话；而打着革命旗号的国民党，只不过是一群贼，他们“鼠窃狗偷”了这个国家，先烈地下有知，将死不瞑目。虽然开国元勋愤慨如此，但章太炎对死者的顶礼，迄未少衰。他在“民国九年”，用小篆写下“缔造民国七十二烈士纪功坊”，“缔造”者的前功是不能忘记的，也许这是唯一能肯定的，“缔造”以后，接下去的是不堪闻问。章太炎...
6	002.第一部——1949（黄花岗38年后）.txt	57	‘缔造民国七十二烈士纪功坊’、‘缔造民国七十二烈士纪功坊’，他们的功，是可以纪的，但是，‘中华民国’呢？今天我来了，‘中华民国’就亡在眼前，他们虽死犹生、我虽生犹死，‘中华民国’、‘中华民国’，是我向他们讨呢？还是他们向我讨呢？他们地下有知，应会知道，他们给不出来‘中华民国’了吧？	大官人一直抬头看着这行横表，口中念念有词：“‘缔造民国七十二烈士纪功坊’、‘缔造民国七十二烈士纪功坊’，他们的功，是可以纪的，但是，‘中华民国’呢？今天我来了，‘中华民国’就亡在眼前，他们虽死犹生、我虽生犹死，‘中华民国’、‘中华民国’，是我向他们讨呢？还是他们向我讨呢？他们地下有知，应会知道，他们给不出来‘中华民国’了吧？”
5	002.第一部——1949（黄花岗38年后）.txt	65	这位陈炯明先生，	“这位陈炯明先生，”大官人说，“最后开罪了孙中山，结果在碑上给抹黑了。”
4	002.第一部——1949（黄花岗38年后）.txt	65	最后开罪了孙中山，结果在碑上给抹黑了。	“这位陈炯明先生，”大官人说，“最后开罪了孙中山，结果在碑上给抹黑了。”
3	002.第一部——1949（黄花岗38年后）.txt	67	这位先生的罪过，似乎不在开罪谁，而在他没在黄花岗死掉。他如早死了，就没有日后的是与非了。	窥视者点点头。“这位先生的罪过，似乎不在开罪谁，而在他没在黄花岗死掉。他如早死了，就没有日后的是与非了。”
4	002.第一部——1949（黄花岗38年后）.txt	69	这样说来，晚死也是一种‘罪过’？	“这样说来，晚死也是一种‘罪过’？”
4	002.第一部——1949（黄花岗38年后）.txt	71	晚死也许不是罪过，但晚死却使人难堪，不论使别人难堪或使自己难堪，却是‘罪过’。	“晚死也许不是罪过，但晚死却使人难堪，不论使别人难堪或使自己难堪，却是‘罪过’。”
3	002.第一部——1949（黄花岗38年后）.txt	73	你这位先生说得真好！	“你这位先生说得真好！”大官人又轻又慢的鼓了三下掌。“真是深通哲理。”
5	002.第一部——1949（黄花岗38年后）.txt	75	在这碑上，	“在这碑上，”窥视者说，“‘陈炯明’的名字只是被涂黑，尚没被凿掉，已经很‘宽大’了。”
4	002.第一部——1949（黄花岗38年后）.txt	75	‘陈炯明’的名字只是被涂黑，尚没被凿掉，已经很‘宽大’了。	“在这碑上，”窥视者说，“‘陈炯明’的名字只是被涂黑，尚没被凿掉，已经很‘宽大’了。”
5	002.第一部——1949（黄花岗38年后）.txt	77	可能当时工具不足，上坟的人，总不习惯随身携带锤子吧？	“可能当时工具不足，上坟的人，总不习惯随身携带锤子吧？”
3	002.第一部——1949（黄花岗38年后）.txt	79	也许，黄花岗离拿锤子的人太远了。拿锤子的都在党中央，在那边改写陈炯明的革命史就根本解决了，在荒郊野外公墓的一块碑上，也懒得追杀了。	“你先生说得是。”窥视者一笑。“也许，黄花岗离拿锤子的人太远了。拿锤子的都在党中央，在那边改写陈炯明的革命史就根本解决了，在荒郊野外公墓的一块碑上，也懒得追杀了。”
3	002.第一部——1949（黄花岗38年后）.txt	81	党中央有专门改写革命史的吗？	“党中央有专门改写革命史的吗？”
4	002.第一部——1949（黄花岗38年后）.txt	85	‘党史会’改写革命史，专门追杀跟党中央调调不同的革命党吗？	“‘党史会’改写革命史，专门追杀跟党中央调调不同的革命党吗？”
3	002.第一部——1949（黄花岗38年后）.txt	87	也不尽然。‘党史会’不但追杀，也会拉拢。有许多跟国民党完全没关系的革命党，成先烈后，都被国民党一网兜收了。远处不必说，这里就躺了七十二位，这七十二位，在三十八年前三月二十九革命的时候，谁是国民党啊？那时国民党还没成立呢，七十二烈士怎么竟变成它的人了呢？这不是假造历史吗？	“也不尽然。‘党史会’不但追杀，也会拉拢。有许多跟国民党完全没关系的革命党，成先烈后，都被国民党一网兜收了。远处不必说，这里就躺了七十二位，这七十二位，在三十八年前三月二十九革命的时候，谁是国民党啊？那时国民党还没成立呢，七十二烈士怎么竟变成它的人了呢？这不是假造历史吗？”
3	002.第一部——1949（黄花岗38年后）.txt	89	骂这票人假造历史的章太炎呢？他不是也比照陈炯明待遇了吗？	“骂这票人假造历史的章太炎呢？他不是也比照陈炯明待遇了吗？”
4	002.第一部——1949（黄花岗38年后）.txt	97	章太炎说陈炯明‘落魄以死’，听说他死后连棺材都买不起。	“章太炎说陈炯明‘落魄以死’，听说他死后连棺材都买不起。”
3	002.第一部——1949（黄花岗38年后）.txt	99	那时陈炯明的母亲还健在，但按老规矩，预留了寿材，只好把留给母亲用的棺材先给陈炯明用了。	“那时陈炯明的母亲还健在，但按老规矩，预留了寿材，只好把留给母亲用的棺材先给陈炯明用了。”
4	002.第一部——1949（黄花岗38年后）.txt	101	想不到以革命党自居的国民党，竟如此无情。	“真令人一叹。”大官人说。“想不到以革命党自居的国民党，竟如此无情。”
3	002.第一部——1949（黄花岗38年后）.txt	103	更无情的是孙中山当年靠陈炯明的一点武力，维系在广州的小朝廷，却安排蒋介石做参谋长，挖陈炯明墙脚，甚至要暗杀陈炯明，孙中山死的时候，蒋介石还声言挖陈炯明的心肝来血祭孙中山呢，这是什么国民党同志嘛，太荒谬了。所以啊，戏谑性的说，陈炯明的‘罪过’，是死得太晚了。当年如死在黄花岗，就不会证实出那些难堪了，陈炯明晚死了二十二年，证实出多少孙中山、蒋介石的真面目啊，‘罪过’、‘罪过’。	“更无情的是孙中山当年靠陈炯明的一点武力，维系在广州的小朝廷，却安排蒋介石做参谋长，挖陈炯明墙脚，甚至要暗杀陈炯明，孙中山死的时候，蒋介石还声言挖陈炯明的心肝来血祭孙中山呢，这是什么国民党同志嘛，太荒谬了。所以啊，戏谑性的说，陈炯明的‘罪过’，是死得太晚了。当年如死在黄花岗，就不会证实出那些难堪了，陈炯明晚死了二十二年，证实出多少孙中山、蒋介石的真面目啊，‘...
3	002.第一部——1949（黄花岗38年后）.txt	105	听了你先生的一番话，真使我们对革命党有了更深一层的认识，原来最好的革命党，就是早死的革命党，革命党不早死，看来就是麻烦，给自己惹麻烦、给同志惹麻烦。	“听了你先生的一番话，真使我们对革命党有了更深一层的认识，原来最好的革命党，就是早死的革命党，革命党不早死，看来就是麻烦，给自己惹麻烦、给同志惹麻烦。”
5	002.第一部——1949（黄花岗38年后）.txt	109	给假同志惹麻烦。像陈炯明。	“给假同志惹麻烦。像陈炯明。”大官人跟了一句。
4	002.第一部——1949（黄花岗38年后）.txt	113	你这位先生说得真对，其实我在当时就略有所闻，不瞒你说，那时我就在袁世凯的北洋政府里。	大官人仔细听着，一再点着头。“你这位先生说得真对，其实我在当时就略有所闻，不瞒你说，那时我就在袁世凯的北洋政府里。”
3	002.第一部——1949（黄花岗38年后）.txt	115	你先生在袁世凯那边服务过？	窥视者眼睛一亮。“你先生在袁世凯那边服务过？”
3	002.第一部——1949（黄花岗38年后）.txt	119	几品啊？	“几品啊？”
4	002.第一部——1949（黄花岗38年后）.txt	121	不值得提、不值得提，是小官。	“不值得提、不值得提，是小官。”
3	002.第一部——1949（黄花岗38年后）.txt	123	当然看过袁世凯了？	“当然看过袁世凯了？”
4	002.第一部——1949（黄花岗38年后）.txt	125	见过，还一起开过会。	“见过，还一起开过会。”
3	002.第一部——1949（黄花岗38年后）.txt	127	那你先生可能是做过封疆大吏的？	“那你先生可能是做过封疆大吏的？”
