score	file	line	text	context
5	《大学后期日记乙集》前记.txt	15	反抗腐败教育对我压迫的精神	乙集后面附录了一封妙信，是我写给钱思亮校长的。从这封信中，读者多少可以想见钱思亮诸公颟顸腐败的一面。大学生在他们这批人的手里，大学生怎么不完蛋？我在《〈大学后期日记甲集〉前记》中，已经指出我在日记中的一种“反抗腐败教育对我压迫的精神”，我的反抗方法，表面上是消极的，骨子里却是积极的。写到这里，我忽然想到陆游的一首小诗，正好用来做我这阶段日记的描写——
3	001.1959年1月.txt	21	舍弃许多不属于你的东西	（一）马言该“舍弃许多不属于你的东西”，凡高得罪多人仍有其成就。人生不能肯定所有事。
6	001.1959年1月.txt	245	天才与世人的联系是其弱点	（七）人与人之间以弱点联系是不好的，要以优点联系。“天才与世人的联系是其弱点”。
3	001.1959年1月.txt	307	你这死样子！	四、我的鬼脸对人，洵美说：“你这死样子！”
4	001.1959年1月.txt	395	征求女友	六、台大有某君贴布告“征求女友”之妙举，诗以咏之：
3	001.1959年1月.txt	415	精子诗	三、“精子诗”：
3	001.1959年1月.txt	555	陈丢是王八！	“陈丢是王八！”
3	001.1959年1月.txt	745	李敖先生啊！你没结婚就想离婚！	三、与“神枪手”小谈，笑了半天，此女士亦一真爽人也！她开我玩笑说：“李敖先生啊！你没结婚就想离婚！”
4	001.1959年1月.txt	777	知识中求快乐	四、决定从知识里面找永恒的快乐，这是一个广袤深邃的世界，单在卡片箱旁，就看到了那个世界是何等的深远，我要养成在“知识中求快乐”的习惯，我过去虽读了不少书，可是还是不够，我做嗜书如命的人还不太够，我要再努力去做一个书虫。这是今晚的大决定。“万事莫如读书乐”，当永远记得这句口号。
4	001.1959年1月.txt	777	万事莫如读书乐	四、决定从知识里面找永恒的快乐，这是一个广袤深邃的世界，单在卡片箱旁，就看到了那个世界是何等的深远，我要养成在“知识中求快乐”的习惯，我过去虽读了不少书，可是还是不够，我做嗜书如命的人还不太够，我要再努力去做一个书虫。这是今晚的大决定。“万事莫如读书乐”，当永远记得这句口号。
4	001.1959年1月.txt	811	某一部分人	一、今天又有大变化，我深刻的感到我对所谓“朋友”的认识，太不够严格，而他们的“无耻”与“不懂事”今天都证明了，我感到非常的不快乐，我知道我过去那种待朋友的方法，在某几点上需要加以修正才行，譬如说在金钱上对“某一部分人”要一介不再予、不再取——此为人情上的清介（清楚、耿介）；又如尽量减少和“无意义的人”鬼谈鬼扯，做无意义的事……这些都是迫切的、必要的。我深深知...
4	001.1959年1月.txt	811	无意义的人	一、今天又有大变化，我深刻的感到我对所谓“朋友”的认识，太不够严格，而他们的“无耻”与“不懂事”今天都证明了，我感到非常的不快乐，我知道我过去那种待朋友的方法，在某几点上需要加以修正才行，譬如说在金钱上对“某一部分人”要一介不再予、不再取——此为人情上的清介（清楚、耿介）；又如尽量减少和“无意义的人”鬼谈鬼扯，做无意义的事……这些都是迫切的、必要的。我深深知...
3	001.1959年1月.txt	811	朋友	一、今天又有大变化，我深刻的感到我对所谓“朋友”的认识，太不够严格，而他们的“无耻”与“不懂事”今天都证明了，我感到非常的不快乐，我知道我过去那种待朋友的方法，在某几点上需要加以修正才行，譬如说在金钱上对“某一部分人”要一介不再予、不再取——此为人情上的清介（清楚、耿介）；又如尽量减少和“无意义的人”鬼谈鬼扯，做无意义的事……这些都是迫切的、必要的。我深深知...
3	001.1959年1月.txt	811	无耻	一、今天又有大变化，我深刻的感到我对所谓“朋友”的认识，太不够严格，而他们的“无耻”与“不懂事”今天都证明了，我感到非常的不快乐，我知道我过去那种待朋友的方法，在某几点上需要加以修正才行，譬如说在金钱上对“某一部分人”要一介不再予、不再取——此为人情上的清介（清楚、耿介）；又如尽量减少和“无意义的人”鬼谈鬼扯，做无意义的事……这些都是迫切的、必要的。我深深知...
5	001.1959年1月.txt	815	跟他们在一起绝对成不了什么气候	三、例如上下午胡跑了一阵，回想起来真是后悔，我觉得“跟他们在一起绝对成不了什么气候”。这句话是我的大收获。我真该醒醒了！
5	002.1959年2月.txt	57	要坚持在我们正在做的工作上，不管这个工作是多么的没有意义，要再接再厉，进而完成它	四、夜读Hater's Castle A. J. Cronin，作者一文述“完”之精神于皇冠，日后当多看此类新式新体裁之修养文字，实胜过十册旧教条式之修养书，“要坚持在我们正在做的工作上，不管这个工作是多么的没有意义，要再接再厉，进而完成它”。如罗耀拉在生命最后二十分钟内仍主张打完手上的球。
3	002.1959年2月.txt	99	什么是那虚无缥渺的理想？	三、我又深感我过去的路是对了，唉！“什么是那虚无缥渺的理想？”我简直是虚无主义了。数日狂热，今晚尽矣！
7	002.1959年2月.txt	125	你们阔老子阔不了，你们穷老子一定穷。	（八）所谓文人之言：“你们阔老子阔不了，你们穷老子一定穷。”
5	002.1959年2月.txt	151	己所不欲，勿施于人	三、我今午的一个大突变是真真想到在脾气上面的“己所不欲，勿施于人”，我此刻该做到的是：
3	002.1959年2月.txt	157	理性化的做人成功的人	（三）更多的礼貌、恕道与体贴（如跟耀祖打架、吾心中实忏悔）。我发愿要做成一个“理性化的做人成功的人”。
4	002.1959年2月.txt	189	朋友面前莫言假，老婆面前不说真。	五、李教官对我说他的人生观：“朋友面前莫言假，老婆面前不说真。”
5	002.1959年2月.txt	191	保持距离，以策安全	六、无论友情爱情皆要“保持距离，以策安全”。
3	002.1959年2月.txt	295	非狄更斯时代之英国	三、解冻，洗冷水浴，想到麦米伦“论我们试试看”与“非狄更斯时代之英国”等谈话。——西方人政治用语皆工巧，非如我们之枯燥八股也。
4	002.1959年2月.txt	313	有女朋友真麻烦，下棋还得故意输。	一、与周渝各吃冰淇淋三，牛肉包二。并把家存象牙棋一盒送他。因周渝说：“有女朋友真麻烦，下棋还得故意输。”所以我写道：“愿这盒象牙棋能使小周渝赢尽他所碰到的女孩子。四八、二、二五。棋王李敖。”
4	002.1959年2月.txt	313	愿这盒象牙棋能使小周渝赢尽他所碰到的女孩子。四八、二、二五。棋王李敖。	一、与周渝各吃冰淇淋三，牛肉包二。并把家存象牙棋一盒送他。因周渝说：“有女朋友真麻烦，下棋还得故意输。”所以我写道：“愿这盒象牙棋能使小周渝赢尽他所碰到的女孩子。四八、二、二五。棋王李敖。”
4	002.1959年2月.txt	321	深深的海水	（二）史一的Stone确是个可人的小丫头，两个眼睛，可比做新文艺中所谓的“深深的海水”。市女中毕业。忽焉在前，忽焉在后。
4	002.1959年2月.txt	323	我看到你，我觉得你和胡老先生一模一样。	（三）想不到Bonnie这么可爱——少妇型的，社会型的，黄色太空装。先说：“你昨天也去听讲演了吧？”我说：“是啊！”她说：“我看到你，我觉得你和胡老先生一模一样。”我说：“啊呀！不敢当，我要请客了！等黄淑兰给我压岁钱以后请客。”后来又碰到好几次，她和我都说有缘，后来又碰到一两次，她叫我一定要请客。我真有点喜欢她。
4	002.1959年2月.txt	323	啊呀！不敢当，我要请客了！等黄淑兰给我压岁钱以后请客。	（三）想不到Bonnie这么可爱——少妇型的，社会型的，黄色太空装。先说：“你昨天也去听讲演了吧？”我说：“是啊！”她说：“我看到你，我觉得你和胡老先生一模一样。”我说：“啊呀！不敢当，我要请客了！等黄淑兰给我压岁钱以后请客。”后来又碰到好几次，她和我都说有缘，后来又碰到一两次，她叫我一定要请客。我真有点喜欢她。
3	002.1959年2月.txt	323	你昨天也去听讲演了吧？	（三）想不到Bonnie这么可爱——少妇型的，社会型的，黄色太空装。先说：“你昨天也去听讲演了吧？”我说：“是啊！”她说：“我看到你，我觉得你和胡老先生一模一样。”我说：“啊呀！不敢当，我要请客了！等黄淑兰给我压岁钱以后请客。”后来又碰到好几次，她和我都说有缘，后来又碰到一两次，她叫我一定要请客。我真有点喜欢她。
4	002.1959年2月.txt	333	见到李敖，这是过年来第一高兴的事。	（八）萧启庆屡言跟我在一起之愉快，小丢日记写我：“见到李敖，这是过年来第一高兴的事。”戴之昂来信给英善谓：“李敖兄的沉闷的心情，虽然我也想为他分担一些，但对他说是未减分毫的，这都是由于我行也匆匆，未能有妥当的安排所致。虽然短短接触不多，我发觉敖兄确可深交。”
3	002.1959年2月.txt	333	李敖兄的沉闷的心情，虽然我也想为他分担一些，但对他说是未减分毫的，这都是由于我行也匆匆，未能有妥当的安排所致。虽然短短接触不多，我发觉敖兄确可深交。	（八）萧启庆屡言跟我在一起之愉快，小丢日记写我：“见到李敖，这是过年来第一高兴的事。”戴之昂来信给英善谓：“李敖兄的沉闷的心情，虽然我也想为他分担一些，但对他说是未减分毫的，这都是由于我行也匆匆，未能有妥当的安排所致。虽然短短接触不多，我发觉敖兄确可深交。”
4	002.1959年2月.txt	367	爸爸带我去，妈妈带我回。	丙：“爸爸带我去，妈妈带我回。”
3	003.1959年3月.txt	11	好话说三遍	四、傍晚复徐高阮一长信攻击胡适以下的老朽们。我对胡适那种“好话说三遍”的态度愈来愈不满意。
8	003.1959年3月.txt	55	亲友如抔沙，放手还复散	一、对那些现实功利的朋友，只有用沙子论来对付（敖按：朋友沙子论是我从东坡诗“亲友如抔沙，放手还复散”想出来的）。
4	003.1959年3月.txt	57	我真佩服你这一点想完了悲哀的事，一唱又快活了的态度。	二、以前某君对我说：“我真佩服你这一点想完了悲哀的事，一唱又快活了的态度。”
5	003.1959年3月.txt	111	才气很高，就是不用功	三、静波与仲序言我“才气很高，就是不用功”。
3	003.1959年3月.txt	127	旧欢重拾不起来	三、“旧欢重拾不起来”——当练习此类成语新诂或改释。
5	003.1959年3月.txt	155	好，再见	一、在法学院新教室门口碰到P，走上台阶才看到，“喂”，“喂”，“好久不见”，“你来找谁啊？”“我找戴炎辉”，“好，再见”，“再见”。
3	003.1959年3月.txt	155	你来找谁啊？	一、在法学院新教室门口碰到P，走上台阶才看到，“喂”，“喂”，“好久不见”，“你来找谁啊？”“我找戴炎辉”，“好，再见”，“再见”。
3	003.1959年3月.txt	159	阴险得真到家了！	三、罗马史下课文学院旁后门前与新汉言时，罗思琳、石梅丽鱼贯过，罗思琳骂我说：“阴险得真到家了！”这小丫头！
4	003.1959年3月.txt	173	我不爱你是应该，你爱我是本分。	二、“我不爱你是应该，你爱我是本分。”——此某女士之妙语也！
8	003.1959年3月.txt	185	宁可信其有，不可信其无	四、所谓“无风不起浪”，“宁可信其有，不可信其无”。
4	003.1959年3月.txt	185	无风不起浪	四、所谓“无风不起浪”，“宁可信其有，不可信其无”。
3	003.1959年3月.txt	215	有意的故意活泼	三、请启庆夜饭，后赴临七参加班会，我言笑皆活跃，且我深知“有意的故意活泼”即会使我快乐起来，否则一个人就像一座冷了的柴油引擎。会中交换饼干糖果等，程、徐言我酷似胡适。淑平说她最近给胡适照了一张相，要送给我。
8	003.1959年3月.txt	243	饮且食兮寿而康，无不足兮奚所望？	罗斯福路有蜀店“寿尔康”者，其厨牛山濯濯，酷似落发之鲁达，所炒酱爆肉最脍炙余口，每过大嚼，腹负便便；推潭仆远，余味津津。韩愈《送李愿归盘谷序》曰：“饮且食兮寿而康，无不足兮奚所望？”朵颐之乐，唯“寿尔康”足以当之。饭饱之余，诗以遣兴：
3	003.1959年3月.txt	243	寿尔康	罗斯福路有蜀店“寿尔康”者，其厨牛山濯濯，酷似落发之鲁达，所炒酱爆肉最脍炙余口，每过大嚼，腹负便便；推潭仆远，余味津津。韩愈《送李愿归盘谷序》曰：“饮且食兮寿而康，无不足兮奚所望？”朵颐之乐，唯“寿尔康”足以当之。饭饱之余，诗以遣兴：
3	003.1959年3月.txt	309	唉呀我的妈！	突然吾醒了，“唉呀我的妈！”
8	003.1959年3月.txt	313	举世誉之而不加劝，举世非之而不加沮	子曰：“文穷而后工。”我曰：“诗穷而后工。”不过工不工自有“私”论，寡人所好，谁得而非之？庄生勉人以“举世誉之而不加劝，举世非之而不加沮”。有志为打油诗人（poetaster）者大可不必气馁也。
3	003.1959年3月.txt	313	文穷而后工。	子曰：“文穷而后工。”我曰：“诗穷而后工。”不过工不工自有“私”论，寡人所好，谁得而非之？庄生勉人以“举世誉之而不加劝，举世非之而不加沮”。有志为打油诗人（poetaster）者大可不必气馁也。
3	003.1959年3月.txt	313	诗穷而后工。	子曰：“文穷而后工。”我曰：“诗穷而后工。”不过工不工自有“私”论，寡人所好，谁得而非之？庄生勉人以“举世誉之而不加劝，举世非之而不加沮”。有志为打油诗人（poetaster）者大可不必气馁也。
3	003.1959年3月.txt	329	快乐神	凯瑟琳女皇（Catherine The Great）曾称伏尔泰（Voltaire）为“快乐神”（the divinity of gayety），可是我却嫌他那种took nothing too seriously的味儿还不到家，觊觎之念，不能自已，因作此诗遣怀。
3	003.1959年3月.txt	345	电影请不起呀！	二、夜打电话给陈淑平：“电影请不起呀！”
5	004.1959年4月.txt	7	你们那‘胡适迷’怎样了？	二、午前与姚老谈，姚老多鼓励，并说胡适向他问我：“你们那‘胡适迷’怎样了？”
4	004.1959年4月.txt	55	当世贵不羁，遭难能解纷。	一、晨为鼓应等办事于课外活动组，我之口才与办事能力实过人，一组长一再言吾之看法之佳。“当世贵不羁，遭难能解纷。”吾当之无愧矣！
5	004.1959年4月.txt	95	恶霸式、专制式的请客方式	七、夜请周弘、述古等吃面时，众人言我之“恶霸式、专制式的请客方式”。
3	004.1959年4月.txt	113	适之先生的个性要比我温和得多，即以他目前在国内发表的若干谈话来说，都非常含蓄婉转，有时甚至使人弄不清楚他到底是赞同什么或反对什么。但我的个性却喜欢开门见山、单刀直入。	“适之先生的个性要比我温和得多，即以他目前在国内发表的若干谈话来说，都非常含蓄婉转，有时甚至使人弄不清楚他到底是赞同什么或反对什么。但我的个性却喜欢开门见山、单刀直入。”
5	004.1959年4月.txt	155	昔孟轲亚圣，母之教也，今有子如轲，虽死何憾？尚飨！	年月日，某位某，诸以清酌之奠，告于某官之灵，呜呼哀哉！（李荷祭欧阳修母：“昔孟轲亚圣，母之教也，今有子如轲，虽死何憾？尚飨！”）
8	004.1959年4月.txt	231	必然地是应该短暂的、无理性的、不可预测的和疯狂的	因为爱情“必然地是应该短暂的、无理性的、不可预测的和疯狂的”。这位纽约大学教授又说：“爱情为一种情欲。情欲一词的原义本为‘痛苦’，这是一种界于欲念和满足之间的紧张状态。”当然爱情满足之后，它就不再存在。它可使人快乐，也可使人不快乐，像很多无理性可喻的事物一样，例如爬山也是这样。
7	004.1959年4月.txt	231	爱情为一种情欲。情欲一词的原义本为‘痛苦’，这是一种界于欲念和满足之间的紧张状态。	因为爱情“必然地是应该短暂的、无理性的、不可预测的和疯狂的”。这位纽约大学教授又说：“爱情为一种情欲。情欲一词的原义本为‘痛苦’，这是一种界于欲念和满足之间的紧张状态。”当然爱情满足之后，它就不再存在。它可使人快乐，也可使人不快乐，像很多无理性可喻的事物一样，例如爬山也是这样。
3	004.1959年4月.txt	233	但婚姻则是一件严肃的事。它是理性的，很合法，而且是公开的，它所根据的为短暂的爱情。社会设计出婚姻，强迫人们于热情冷却之后仍生活在一起。	他说：“但婚姻则是一件严肃的事。它是理性的，很合法，而且是公开的，它所根据的为短暂的爱情。社会设计出婚姻，强迫人们于热情冷却之后仍生活在一起。”
8	004.1959年4月.txt	325	少公，归易耳！恐再辱奈何？……	昭帝立，大将军霍光、左将军上官桀辅政，素与〔李〕陵善，遣陵故人陇西任立政等三人俱至匈奴招陵（此字改“之”字更佳。1960年9月17日，敖之）。立政等至，单于置酒赐汉使者，李陵卫律皆侍坐，立政等见陵，未得私语，即目视陵，而数数自循其刀环，握其足，阴谕之，言可还归汉也。后陵律持牛酒劳汉使博饮，两人皆胡服椎结，立政大言曰：“汉已大赦，中国安乐，主上富于春秋，霍子孟...
8	004.1959年4月.txt	325	李少卿贤者不独居一国，范蠡遍游天下，由余去戎入秦，今何语之亲也！	昭帝立，大将军霍光、左将军上官桀辅政，素与〔李〕陵善，遣陵故人陇西任立政等三人俱至匈奴招陵（此字改“之”字更佳。1960年9月17日，敖之）。立政等至，单于置酒赐汉使者，李陵卫律皆侍坐，立政等见陵，未得私语，即目视陵，而数数自循其刀环，握其足，阴谕之，言可还归汉也。后陵律持牛酒劳汉使博饮，两人皆胡服椎结，立政大言曰：“汉已大赦，中国安乐，主上富于春秋，霍子孟...
7	004.1959年4月.txt	325	汉已大赦，中国安乐，主上富于春秋，霍子孟上官少叔用事。	昭帝立，大将军霍光、左将军上官桀辅政，素与〔李〕陵善，遣陵故人陇西任立政等三人俱至匈奴招陵（此字改“之”字更佳。1960年9月17日，敖之）。立政等至，单于置酒赐汉使者，李陵卫律皆侍坐，立政等见陵，未得私语，即目视陵，而数数自循其刀环，握其足，阴谕之，言可还归汉也。后陵律持牛酒劳汉使博饮，两人皆胡服椎结，立政大言曰：“汉已大赦，中国安乐，主上富于春秋，霍子孟...
7	004.1959年4月.txt	325	请少卿来归故乡，毋忧富贵。	昭帝立，大将军霍光、左将军上官桀辅政，素与〔李〕陵善，遣陵故人陇西任立政等三人俱至匈奴招陵（此字改“之”字更佳。1960年9月17日，敖之）。立政等至，单于置酒赐汉使者，李陵卫律皆侍坐，立政等见陵，未得私语，即目视陵，而数数自循其刀环，握其足，阴谕之，言可还归汉也。后陵律持牛酒劳汉使博饮，两人皆胡服椎结，立政大言曰：“汉已大赦，中国安乐，主上富于春秋，霍子孟...
6	004.1959年4月.txt	325	吾已胡服矣！	昭帝立，大将军霍光、左将军上官桀辅政，素与〔李〕陵善，遣陵故人陇西任立政等三人俱至匈奴招陵（此字改“之”字更佳。1960年9月17日，敖之）。立政等至，单于置酒赐汉使者，李陵卫律皆侍坐，立政等见陵，未得私语，即目视陵，而数数自循其刀环，握其足，阴谕之，言可还归汉也。后陵律持牛酒劳汉使博饮，两人皆胡服椎结，立政大言曰：“汉已大赦，中国安乐，主上富于春秋，霍子孟...
6	004.1959年4月.txt	325	霍与上官无恙乎？	昭帝立，大将军霍光、左将军上官桀辅政，素与〔李〕陵善，遣陵故人陇西任立政等三人俱至匈奴招陵（此字改“之”字更佳。1960年9月17日，敖之）。立政等至，单于置酒赐汉使者，李陵卫律皆侍坐，立政等见陵，未得私语，即目视陵，而数数自循其刀环，握其足，阴谕之，言可还归汉也。后陵律持牛酒劳汉使博饮，两人皆胡服椎结，立政大言曰：“汉已大赦，中国安乐，主上富于春秋，霍子孟...
6	004.1959年4月.txt	325	亦有意乎？	昭帝立，大将军霍光、左将军上官桀辅政，素与〔李〕陵善，遣陵故人陇西任立政等三人俱至匈奴招陵（此字改“之”字更佳。1960年9月17日，敖之）。立政等至，单于置酒赐汉使者，李陵卫律皆侍坐，立政等见陵，未得私语，即目视陵，而数数自循其刀环，握其足，阴谕之，言可还归汉也。后陵律持牛酒劳汉使博饮，两人皆胡服椎结，立政大言曰：“汉已大赦，中国安乐，主上富于春秋，霍子孟...
6	004.1959年4月.txt	325	丈夫不能再辱！	昭帝立，大将军霍光、左将军上官桀辅政，素与〔李〕陵善，遣陵故人陇西任立政等三人俱至匈奴招陵（此字改“之”字更佳。1960年9月17日，敖之）。立政等至，单于置酒赐汉使者，李陵卫律皆侍坐，立政等见陵，未得私语，即目视陵，而数数自循其刀环，握其足，阴谕之，言可还归汉也。后陵律持牛酒劳汉使博饮，两人皆胡服椎结，立政大言曰：“汉已大赦，中国安乐，主上富于春秋，霍子孟...
5	004.1959年4月.txt	325	咄！少卿良苦！霍子孟上官少叔谢女。	昭帝立，大将军霍光、左将军上官桀辅政，素与〔李〕陵善，遣陵故人陇西任立政等三人俱至匈奴招陵（此字改“之”字更佳。1960年9月17日，敖之）。立政等至，单于置酒赐汉使者，李陵卫律皆侍坐，立政等见陵，未得私语，即目视陵，而数数自循其刀环，握其足，阴谕之，言可还归汉也。后陵律持牛酒劳汉使博饮，两人皆胡服椎结，立政大言曰：“汉已大赦，中国安乐，主上富于春秋，霍子孟...
3	004.1959年4月.txt	325	之	昭帝立，大将军霍光、左将军上官桀辅政，素与〔李〕陵善，遣陵故人陇西任立政等三人俱至匈奴招陵（此字改“之”字更佳。1960年9月17日，敖之）。立政等至，单于置酒赐汉使者，李陵卫律皆侍坐，立政等见陵，未得私语，即目视陵，而数数自循其刀环，握其足，阴谕之，言可还归汉也。后陵律持牛酒劳汉使博饮，两人皆胡服椎结，立政大言曰：“汉已大赦，中国安乐，主上富于春秋，霍子孟...
5	004.1959年4月.txt	341	我们中学朋友们谈起李敖来，没有不摇头的！	一、午前托吴庆宜约吴铸人晚8时来，8时宏祥亦至，铸人笑向老马说：“我们中学朋友们谈起李敖来，没有不摇头的！”老马、铸人同赞我之热情与凝聚力。我劝慰铸人良久。
3	004.1959年4月.txt	347	李先生	一、上午10时后在台大医院四楼特別病房与胡适谈，先经与胡颂平秘书谈，时胡适正有客人，胡适之见我大呼“李先生”，请我坐，我说等一下，遂再与胡颂平谈。胡适头大而清癯、蓝袍、褐袜、拖鞋。他的客人走后，我们大聊一阵，他颇怀疑《名公书判清明集》的时代，我却不以为然。
3	005.1959年5月.txt	59	自信	二、夜在铸人处与铸人、家伦二位谈。二人言我大名士。家伦之活力愈发不足，甚虚无低潮，且罕言语，多稳重之风，自谓自知能力不足，彼过去曾视我为超人，然今日视诸凡人亦觉有其可取之处。送家伦上三路车后独自归来，颇有所触。要之，益增我意气之纵横耳。家伦说不能亦不愿成为我之型，而我却益欲使吾之型发扬光大，我的“活力”、“亲和力”、“嚣张”、“豪迈”、“自信”、“跋扈”，皆...
5	005.1959年5月.txt	91	台大学生若不知道李敖的，那他台大也白念了！	二、卢华栋言：“台大学生若不知道李敖的，那他台大也白念了！”
