file	line	text	context
047.“上将”梦碎.txt	17	这个陈良埙，讲话不着边际，遮遮掩掩，使人弄不清楚真相。	他的玩世，不但表现在待人处世上，甚至对他自己的冤狱也玩世出之。我为孙立人案做历史平反，编《孙立人研究》、《孙案研究》等书，由曾心仪访问到他，曾心仪回来说：“这个陈良埙，讲话不着边际，遮遮掩掩，使人弄不清楚真相。”这一作风，他的同案受难者也不乏同感，有人对他不无微词，我也当面打趣过他，我说：“是不是你被抓后受不了威胁利诱，出卖了孙立人？怎么大家都不谅解你？”他听了，只是笑。有一天，他心血来潮，写了一封信给“李敖（他故意写成‘傲’）老弟”，盼“老弟有以教我”，附有他在1990年3月写给调查孙案的三个监察委员的信，信中说：
047.“上将”梦碎.txt	17	是不是你被抓后受不了威胁利诱，出卖了孙立人？怎么大家都不谅解你？	他的玩世，不但表现在待人处世上，甚至对他自己的冤狱也玩世出之。我为孙立人案做历史平反，编《孙立人研究》、《孙案研究》等书，由曾心仪访问到他，曾心仪回来说：“这个陈良埙，讲话不着边际，遮遮掩掩，使人弄不清楚真相。”这一作风，他的同案受难者也不乏同感，有人对他不无微词，我也当面打趣过他，我说：“是不是你被抓后受不了威胁利诱，出卖了孙立人？怎么大家都不谅解你？”他听了，只是笑。有一天，他心血来潮，写了一封信给“李敖（他故意写成‘傲’）老弟”，盼“老弟有以教我”，附有他在1990年3月写给调查孙案的三个监察委员的信，信中说：
047.“上将”梦碎.txt	17	李敖（他故意写成‘傲’）老弟	他的玩世，不但表现在待人处世上，甚至对他自己的冤狱也玩世出之。我为孙立人案做历史平反，编《孙立人研究》、《孙案研究》等书，由曾心仪访问到他，曾心仪回来说：“这个陈良埙，讲话不着边际，遮遮掩掩，使人弄不清楚真相。”这一作风，他的同案受难者也不乏同感，有人对他不无微词，我也当面打趣过他，我说：“是不是你被抓后受不了威胁利诱，出卖了孙立人？怎么大家都不谅解你？”他听了，只是笑。有一天，他心血来潮，写了一封信给“李敖（他故意写成‘傲’）老弟”，盼“老弟有以教我”，附有他在1990年3月写给调查孙案的三个监察委员的信，信中说：
047.“上将”梦碎.txt	17	老弟有以教我	他的玩世，不但表现在待人处世上，甚至对他自己的冤狱也玩世出之。我为孙立人案做历史平反，编《孙立人研究》、《孙案研究》等书，由曾心仪访问到他，曾心仪回来说：“这个陈良埙，讲话不着边际，遮遮掩掩，使人弄不清楚真相。”这一作风，他的同案受难者也不乏同感，有人对他不无微词，我也当面打趣过他，我说：“是不是你被抓后受不了威胁利诱，出卖了孙立人？怎么大家都不谅解你？”他听了，只是笑。有一天，他心血来潮，写了一封信给“李敖（他故意写成‘傲’）老弟”，盼“老弟有以教我”，附有他在1990年3月写给调查孙案的三个监察委员的信，信中说：
047.“上将”梦碎.txt	27	老兵永远不死，他只是凋谢。	陈良埙34岁坐牢，74岁死去。前半生英姿风发、飘然而来；后半生40年如一日，索寞以去。他用玩世式的天真穿透了一切，他欲说还休。可是，他想休说的，也被我穿透得一清二楚。这个人一生本该是一支蜡烛，燃烧自己，照亮别人；但时运不济，竟做了烟草商人，燃烧烟草，害了自己——他最后死于肺癌，结束了忧患的一生。麦克阿瑟引美国军歌说：“老兵永远不死，他只是凋谢。”虽云凋谢，也应有像样的凋法谢法，可是陈良埙这样凋谢，纵含笑九泉，也死不瞑目。中国古诗写：“何世无奇才，遗之在草泽。”从草泽四望，天苍野茫，这不仅是陈良埙的悲剧、孙立人的悲剧，也是孙案受难者和中国人民的共同悲剧。
047.“上将”梦碎.txt	27	何世无奇才，遗之在草泽。	陈良埙34岁坐牢，74岁死去。前半生英姿风发、飘然而来；后半生40年如一日，索寞以去。他用玩世式的天真穿透了一切，他欲说还休。可是，他想休说的，也被我穿透得一清二楚。这个人一生本该是一支蜡烛，燃烧自己，照亮别人；但时运不济，竟做了烟草商人，燃烧烟草，害了自己——他最后死于肺癌，结束了忧患的一生。麦克阿瑟引美国军歌说：“老兵永远不死，他只是凋谢。”虽云凋谢，也应有像样的凋法谢法，可是陈良埙这样凋谢，纵含笑九泉，也死不瞑目。中国古诗写：“何世无奇才，遗之在草泽。”从草泽四望，天苍野茫，这不仅是陈良埙的悲剧、孙立人的悲剧，也是孙案受难者和中国人民的共同悲剧。
049.“解严”梦碎.txt	3	蒋经国先生的思想行谊与事功学术讨论会	1990年4月12日，马英九在所谓“蒋经国先生的思想行谊与事功学术讨论会”上，发表了一篇所谓“学术论文”，标题是《蒋经国先生与复兴基地建设》，里面说了许许多多与“学术”无关的肉麻话外，还写了许许多多根本不实的马屁“论文”。
049.“解严”梦碎.txt	3	学术论文	1990年4月12日，马英九在所谓“蒋经国先生的思想行谊与事功学术讨论会”上，发表了一篇所谓“学术论文”，标题是《蒋经国先生与复兴基地建设》，里面说了许许多多与“学术”无关的肉麻话外，还写了许许多多根本不实的马屁“论文”。
049.“解严”梦碎.txt	3	学术	1990年4月12日，马英九在所谓“蒋经国先生的思想行谊与事功学术讨论会”上，发表了一篇所谓“学术论文”，标题是《蒋经国先生与复兴基地建设》，里面说了许许多多与“学术”无关的肉麻话外，还写了许许多多根本不实的马屁“论文”。
049.“解严”梦碎.txt	3	论文	1990年4月12日，马英九在所谓“蒋经国先生的思想行谊与事功学术讨论会”上，发表了一篇所谓“学术论文”，标题是《蒋经国先生与复兴基地建设》，里面说了许许多多与“学术”无关的肉麻话外，还写了许许多多根本不实的马屁“论文”。
049.“解严”梦碎.txt	13	违警	何况，纵使侈言开放，有的成效如何尚未可知、有的越解越严变本加厉（如对书刊的查禁，竟杠上开花，用到“违警”、“妨害秩序”等法令，尺度之严，前所未有）、有的还根本在言而无信的大开倒车呢！例如马英九马屁说：“嗣后行政院在草拟《国家安全法》的时候，经国先生也曾指示：‘解严之后，一定要放宽，绝不能换汤不换药。’他改革的诚意，确实是无可置疑的。”这话乍看起来，冠冕堂皇，其实所谓“解严之后，一定要放宽”，全是谎话。例如戒严40年，军事审判的案件，共有29407件之多，接近3万件。按照《戒严法》第10条，明明信誓旦旦向老百姓承诺过：戒严时期军事机关的审判判决，“均得于解严之翌日起，依法上诉。”《戒严法》这种承诺，绝没规定解严之后要另立他法替代、也绝没任何他法有把信誓旦旦53年的《戒严法》承诺一笔勾消的道理，因为这样做，必是典型的违宪。按照《宪法》第9条，“人民除现役军人外，不受军事审判”；按照《宪法》第16条，“人民有……诉讼之权”。戒严时期既...
049.“解严”梦碎.txt	13	妨害秩序	何况，纵使侈言开放，有的成效如何尚未可知、有的越解越严变本加厉（如对书刊的查禁，竟杠上开花，用到“违警”、“妨害秩序”等法令，尺度之严，前所未有）、有的还根本在言而无信的大开倒车呢！例如马英九马屁说：“嗣后行政院在草拟《国家安全法》的时候，经国先生也曾指示：‘解严之后，一定要放宽，绝不能换汤不换药。’他改革的诚意，确实是无可置疑的。”这话乍看起来，冠冕堂皇，其实所谓“解严之后，一定要放宽”，全是谎话。例如戒严40年，军事审判的案件，共有29407件之多，接近3万件。按照《戒严法》第10条，明明信誓旦旦向老百姓承诺过：戒严时期军事机关的审判判决，“均得于解严之翌日起，依法上诉。”《戒严法》这种承诺，绝没规定解严之后要另立他法替代、也绝没任何他法有把信誓旦旦53年的《戒严法》承诺一笔勾消的道理，因为这样做，必是典型的违宪。按照《宪法》第9条，“人民除现役军人外，不受军事审判”；按照《宪法》第16条，“人民有……诉讼之权”。戒严时期既...
049.“解严”梦碎.txt	13	嗣后行政院在草拟《国家安全法》的时候，经国先生也曾指示：‘解严之后，一定要放宽，绝不能换汤不换药。’他改革的诚意，确实是无可置疑的。	何况，纵使侈言开放，有的成效如何尚未可知、有的越解越严变本加厉（如对书刊的查禁，竟杠上开花，用到“违警”、“妨害秩序”等法令，尺度之严，前所未有）、有的还根本在言而无信的大开倒车呢！例如马英九马屁说：“嗣后行政院在草拟《国家安全法》的时候，经国先生也曾指示：‘解严之后，一定要放宽，绝不能换汤不换药。’他改革的诚意，确实是无可置疑的。”这话乍看起来，冠冕堂皇，其实所谓“解严之后，一定要放宽”，全是谎话。例如戒严40年，军事审判的案件，共有29407件之多，接近3万件。按照《戒严法》第10条，明明信誓旦旦向老百姓承诺过：戒严时期军事机关的审判判决，“均得于解严之翌日起，依法上诉。”《戒严法》这种承诺，绝没规定解严之后要另立他法替代、也绝没任何他法有把信誓旦旦53年的《戒严法》承诺一笔勾消的道理，因为这样做，必是典型的违宪。按照《宪法》第9条，“人民除现役军人外，不受军事审判”；按照《宪法》第16条，“人民有……诉讼之权”。戒严时期既...
049.“解严”梦碎.txt	13	解严之后，一定要放宽	何况，纵使侈言开放，有的成效如何尚未可知、有的越解越严变本加厉（如对书刊的查禁，竟杠上开花，用到“违警”、“妨害秩序”等法令，尺度之严，前所未有）、有的还根本在言而无信的大开倒车呢！例如马英九马屁说：“嗣后行政院在草拟《国家安全法》的时候，经国先生也曾指示：‘解严之后，一定要放宽，绝不能换汤不换药。’他改革的诚意，确实是无可置疑的。”这话乍看起来，冠冕堂皇，其实所谓“解严之后，一定要放宽”，全是谎话。例如戒严40年，军事审判的案件，共有29407件之多，接近3万件。按照《戒严法》第10条，明明信誓旦旦向老百姓承诺过：戒严时期军事机关的审判判决，“均得于解严之翌日起，依法上诉。”《戒严法》这种承诺，绝没规定解严之后要另立他法替代、也绝没任何他法有把信誓旦旦53年的《戒严法》承诺一笔勾消的道理，因为这样做，必是典型的违宪。按照《宪法》第9条，“人民除现役军人外，不受军事审判”；按照《宪法》第16条，“人民有……诉讼之权”。戒严时期既...
049.“解严”梦碎.txt	13	均得于解严之翌日起，依法上诉。	何况，纵使侈言开放，有的成效如何尚未可知、有的越解越严变本加厉（如对书刊的查禁，竟杠上开花，用到“违警”、“妨害秩序”等法令，尺度之严，前所未有）、有的还根本在言而无信的大开倒车呢！例如马英九马屁说：“嗣后行政院在草拟《国家安全法》的时候，经国先生也曾指示：‘解严之后，一定要放宽，绝不能换汤不换药。’他改革的诚意，确实是无可置疑的。”这话乍看起来，冠冕堂皇，其实所谓“解严之后，一定要放宽”，全是谎话。例如戒严40年，军事审判的案件，共有29407件之多，接近3万件。按照《戒严法》第10条，明明信誓旦旦向老百姓承诺过：戒严时期军事机关的审判判决，“均得于解严之翌日起，依法上诉。”《戒严法》这种承诺，绝没规定解严之后要另立他法替代、也绝没任何他法有把信誓旦旦53年的《戒严法》承诺一笔勾消的道理，因为这样做，必是典型的违宪。按照《宪法》第9条，“人民除现役军人外，不受军事审判”；按照《宪法》第16条，“人民有……诉讼之权”。戒严时期既...
049.“解严”梦碎.txt	13	人民除现役军人外，不受军事审判	何况，纵使侈言开放，有的成效如何尚未可知、有的越解越严变本加厉（如对书刊的查禁，竟杠上开花，用到“违警”、“妨害秩序”等法令，尺度之严，前所未有）、有的还根本在言而无信的大开倒车呢！例如马英九马屁说：“嗣后行政院在草拟《国家安全法》的时候，经国先生也曾指示：‘解严之后，一定要放宽，绝不能换汤不换药。’他改革的诚意，确实是无可置疑的。”这话乍看起来，冠冕堂皇，其实所谓“解严之后，一定要放宽”，全是谎话。例如戒严40年，军事审判的案件，共有29407件之多，接近3万件。按照《戒严法》第10条，明明信誓旦旦向老百姓承诺过：戒严时期军事机关的审判判决，“均得于解严之翌日起，依法上诉。”《戒严法》这种承诺，绝没规定解严之后要另立他法替代、也绝没任何他法有把信誓旦旦53年的《戒严法》承诺一笔勾消的道理，因为这样做，必是典型的违宪。按照《宪法》第9条，“人民除现役军人外，不受军事审判”；按照《宪法》第16条，“人民有……诉讼之权”。戒严时期既...
049.“解严”梦碎.txt	13	人民有……诉讼之权	何况，纵使侈言开放，有的成效如何尚未可知、有的越解越严变本加厉（如对书刊的查禁，竟杠上开花，用到“违警”、“妨害秩序”等法令，尺度之严，前所未有）、有的还根本在言而无信的大开倒车呢！例如马英九马屁说：“嗣后行政院在草拟《国家安全法》的时候，经国先生也曾指示：‘解严之后，一定要放宽，绝不能换汤不换药。’他改革的诚意，确实是无可置疑的。”这话乍看起来，冠冕堂皇，其实所谓“解严之后，一定要放宽”，全是谎话。例如戒严40年，军事审判的案件，共有29407件之多，接近3万件。按照《戒严法》第10条，明明信誓旦旦向老百姓承诺过：戒严时期军事机关的审判判决，“均得于解严之翌日起，依法上诉。”《戒严法》这种承诺，绝没规定解严之后要另立他法替代、也绝没任何他法有把信誓旦旦53年的《戒严法》承诺一笔勾消的道理，因为这样做，必是典型的违宪。按照《宪法》第9条，“人民除现役军人外，不受军事审判”；按照《宪法》第16条，“人民有……诉讼之权”。戒严时期既...
049.“解严”梦碎.txt	13	解严之翌日起	何况，纵使侈言开放，有的成效如何尚未可知、有的越解越严变本加厉（如对书刊的查禁，竟杠上开花，用到“违警”、“妨害秩序”等法令，尺度之严，前所未有）、有的还根本在言而无信的大开倒车呢！例如马英九马屁说：“嗣后行政院在草拟《国家安全法》的时候，经国先生也曾指示：‘解严之后，一定要放宽，绝不能换汤不换药。’他改革的诚意，确实是无可置疑的。”这话乍看起来，冠冕堂皇，其实所谓“解严之后，一定要放宽”，全是谎话。例如戒严40年，军事审判的案件，共有29407件之多，接近3万件。按照《戒严法》第10条，明明信誓旦旦向老百姓承诺过：戒严时期军事机关的审判判决，“均得于解严之翌日起，依法上诉。”《戒严法》这种承诺，绝没规定解严之后要另立他法替代、也绝没任何他法有把信誓旦旦53年的《戒严法》承诺一笔勾消的道理，因为这样做，必是典型的违宪。按照《宪法》第9条，“人民除现役军人外，不受军事审判”；按照《宪法》第16条，“人民有……诉讼之权”。戒严时期既...
049.“解严”梦碎.txt	13	换汤不换药	何况，纵使侈言开放，有的成效如何尚未可知、有的越解越严变本加厉（如对书刊的查禁，竟杠上开花，用到“违警”、“妨害秩序”等法令，尺度之严，前所未有）、有的还根本在言而无信的大开倒车呢！例如马英九马屁说：“嗣后行政院在草拟《国家安全法》的时候，经国先生也曾指示：‘解严之后，一定要放宽，绝不能换汤不换药。’他改革的诚意，确实是无可置疑的。”这话乍看起来，冠冕堂皇，其实所谓“解严之后，一定要放宽”，全是谎话。例如戒严40年，军事审判的案件，共有29407件之多，接近3万件。按照《戒严法》第10条，明明信誓旦旦向老百姓承诺过：戒严时期军事机关的审判判决，“均得于解严之翌日起，依法上诉。”《戒严法》这种承诺，绝没规定解严之后要另立他法替代、也绝没任何他法有把信誓旦旦53年的《戒严法》承诺一笔勾消的道理，因为这样做，必是典型的违宪。按照《宪法》第9条，“人民除现役军人外，不受军事审判”；按照《宪法》第16条，“人民有……诉讼之权”。戒严时期既...
049.“解严”梦碎.txt	13	改革	何况，纵使侈言开放，有的成效如何尚未可知、有的越解越严变本加厉（如对书刊的查禁，竟杠上开花，用到“违警”、“妨害秩序”等法令，尺度之严，前所未有）、有的还根本在言而无信的大开倒车呢！例如马英九马屁说：“嗣后行政院在草拟《国家安全法》的时候，经国先生也曾指示：‘解严之后，一定要放宽，绝不能换汤不换药。’他改革的诚意，确实是无可置疑的。”这话乍看起来，冠冕堂皇，其实所谓“解严之后，一定要放宽”，全是谎话。例如戒严40年，军事审判的案件，共有29407件之多，接近3万件。按照《戒严法》第10条，明明信誓旦旦向老百姓承诺过：戒严时期军事机关的审判判决，“均得于解严之翌日起，依法上诉。”《戒严法》这种承诺，绝没规定解严之后要另立他法替代、也绝没任何他法有把信誓旦旦53年的《戒严法》承诺一笔勾消的道理，因为这样做，必是典型的违宪。按照《宪法》第9条，“人民除现役军人外，不受军事审判”；按照《宪法》第16条，“人民有……诉讼之权”。戒严时期既...
049.“解严”梦碎.txt	13	诚意	何况，纵使侈言开放，有的成效如何尚未可知、有的越解越严变本加厉（如对书刊的查禁，竟杠上开花，用到“违警”、“妨害秩序”等法令，尺度之严，前所未有）、有的还根本在言而无信的大开倒车呢！例如马英九马屁说：“嗣后行政院在草拟《国家安全法》的时候，经国先生也曾指示：‘解严之后，一定要放宽，绝不能换汤不换药。’他改革的诚意，确实是无可置疑的。”这话乍看起来，冠冕堂皇，其实所谓“解严之后，一定要放宽”，全是谎话。例如戒严40年，军事审判的案件，共有29407件之多，接近3万件。按照《戒严法》第10条，明明信誓旦旦向老百姓承诺过：戒严时期军事机关的审判判决，“均得于解严之翌日起，依法上诉。”《戒严法》这种承诺，绝没规定解严之后要另立他法替代、也绝没任何他法有把信誓旦旦53年的《戒严法》承诺一笔勾消的道理，因为这样做，必是典型的违宪。按照《宪法》第9条，“人民除现役军人外，不受军事审判”；按照《宪法》第16条，“人民有……诉讼之权”。戒严时期既...
049.“解严”梦碎.txt	13	确实是无可置疑的	何况，纵使侈言开放，有的成效如何尚未可知、有的越解越严变本加厉（如对书刊的查禁，竟杠上开花，用到“违警”、“妨害秩序”等法令，尺度之严，前所未有）、有的还根本在言而无信的大开倒车呢！例如马英九马屁说：“嗣后行政院在草拟《国家安全法》的时候，经国先生也曾指示：‘解严之后，一定要放宽，绝不能换汤不换药。’他改革的诚意，确实是无可置疑的。”这话乍看起来，冠冕堂皇，其实所谓“解严之后，一定要放宽”，全是谎话。例如戒严40年，军事审判的案件，共有29407件之多，接近3万件。按照《戒严法》第10条，明明信誓旦旦向老百姓承诺过：戒严时期军事机关的审判判决，“均得于解严之翌日起，依法上诉。”《戒严法》这种承诺，绝没规定解严之后要另立他法替代、也绝没任何他法有把信誓旦旦53年的《戒严法》承诺一笔勾消的道理，因为这样做，必是典型的违宪。按照《宪法》第9条，“人民除现役军人外，不受军事审判”；按照《宪法》第16条，“人民有……诉讼之权”。戒严时期既...
050.“人才”梦碎.txt	11	私暱	蒋经国在台湾正式当权13年，等于日本吉田首相6年加上佐藤首相7年的总和。吉田茂做首相，前后用了93位部长；佐藤荣做首相，前后用了130位部长，他们为什么这样改组频繁？原因在提拔新人、培植新人，为国举才、为国储才。反看蒋经国，他却无此眼光、度量与气魄。及其死也，遗留在党内的人才，寥寥可数。更要命的，是这些所谓青年才俊的产生，却又来非正道。大体说来，他们都是些倖进之徒。他们只是蒋经国的“私暱”、只是“宠臣”，不是“大臣”。
050.“人才”梦碎.txt	11	宠臣	蒋经国在台湾正式当权13年，等于日本吉田首相6年加上佐藤首相7年的总和。吉田茂做首相，前后用了93位部长；佐藤荣做首相，前后用了130位部长，他们为什么这样改组频繁？原因在提拔新人、培植新人，为国举才、为国储才。反看蒋经国，他却无此眼光、度量与气魄。及其死也，遗留在党内的人才，寥寥可数。更要命的，是这些所谓青年才俊的产生，却又来非正道。大体说来，他们都是些倖进之徒。他们只是蒋经国的“私暱”、只是“宠臣”，不是“大臣”。
050.“人才”梦碎.txt	11	大臣	蒋经国在台湾正式当权13年，等于日本吉田首相6年加上佐藤首相7年的总和。吉田茂做首相，前后用了93位部长；佐藤荣做首相，前后用了130位部长，他们为什么这样改组频繁？原因在提拔新人、培植新人，为国举才、为国储才。反看蒋经国，他却无此眼光、度量与气魄。及其死也，遗留在党内的人才，寥寥可数。更要命的，是这些所谓青年才俊的产生，却又来非正道。大体说来，他们都是些倖进之徒。他们只是蒋经国的“私暱”、只是“宠臣”，不是“大臣”。
051.“百分之百”梦碎.txt	5	超乎记忆所及	台湾是中国领土的一部分，已是国际法大宗师格老秀斯（Hugo Grotius）所谓“超乎记忆所及”（going beyond memory）的源远流长关系，只要统治中国大陆的政权存在，台湾就是这政权领土的一部分，这种情况，除中间割让给日本一段时间外，前后皆不在话下。以为大陆的政权未曾统一到它，它就可以自外于中央了，其实这是一种诡论。这种诡论是台独分子向国民党学来的。
051.“百分之百”梦碎.txt	7	地理成分	国民党说，台湾是大陆的千分之三。因为共产党统治不到这千分之三，所以中共非中国，因为“地理成分”不足，没有百分之百。但是，照国民党的历史，秦始皇明明统一了中国。实际上，秦始皇在他死前，也没把百分之百的中国统一。《史记》中有《卫康叔世家》，它起源于周朝分封时周武王的小弟弟那一支，这个小国，因为太小了，反倒苟延残喘，一直没被中央统一。直到秦始皇灭六国后12年，秦始皇死后1年，它的“总统”，才被秦二世废为庶人，才“卫绝祀”。若从秦出兵争天下起算，从惠文君到秦二世，凡122年，卫国有122年之久，独立于秦的“内政问题”之外，可是再怎么挣扎，它也是中国的。什么百分之百才算？你这不能自卫的小地方，又能卫到哪里去呢？
