score	file	line	text	context
4	033.不打击自由主义吗？.txt	77	危险份子	我说政府对自由主义分子认识错误，是因为政府当局总认为自由主义分子的思想是左倾的。这个大前提就完全错误。就自由主义分子的气质分析起来，与其说易于左倾，毋宁说易的右倾，因为中国的自由主义分子，大多数都有几个特点：第一，中庸性很强，事事都要求其合乎中道，反对过激的行为，这种气质根本就与左倾方向不一致的。第二，唯心的倾向重于唯物的倾向。左派人物固然百分之百都是唯物论...
7	033.不打击自由主义吗？.txt	85	得民者昌，失民者亡。	其次，政府之所以不能容纳自由主义分子，是由于忽略了自由主义分子的重要性，不但不能接受他们的意见，反而把他们拒于千里之外，这是绝对不高明的。在这里，我们不妨找一点历史教训，远的不说，就说北伐吧！北伐这一役之所以能够迅速成功，固然主要的是由于革命势力的统一协调，左右两派的精诚合作所致。而在思想上，精神上之能够把握住一般自由主义分子，得到他们的响应，关系的确也很大...
4	033.不打击自由主义吗？.txt	87	民之所好好之；民之所恶恶之。	然而，要凭着什么才能争取到自由主义分子的拥护呢？高官厚禄绝不足动其心，真正的自由主义分子必不为富贵淫；严刑峻法绝不足以变其志，真正自由主义分子必不为威武屈。反之，凡为富贵所淫，威武所屈的，都绝对不是真正的自由主义分子，只是些挂羊头卖狗肉的伪君子，极可鄙可耻的乡愿小人。要争取真正的自由主义分子的拥护，只有在政治表现上尽量顺应其意见。古代的为政者，应该做到“民之...
4	033.不打击自由主义吗？.txt	89	防民之口，甚于防川。	再退一万步来说，自由主义的思想又是不是可以取缔净尽，自由主义分子又是不是可以摧残无余呢？事实上也绝对不可能。因为自由主义分子的言论主张既然合乎大多数老百姓的需要，则自由主义的思想必然深中于人心，自由主义分子在社会上亦自能得到应有的尊重。肆意取缔，横加摧残，至多不过封住他们的口，却无法改变他们的心。更何况“防民之口，甚于防川。”封住他们的口，也还不见得办得到呢...
3	033.不打击自由主义吗？.txt	97	自由主义可与儒家的精神相结合	对《自由中国》殷海光一路的自由主义者，国民党除了正面的围剿和“黑邮船”（black mail）式的手段外，他们推出一种假自由主义，由一次拿过国民党十两黄金、三千美金出身的徐复观带头，他们也宣传一点自由主义，但是那是与中国儒家结合的自由主义，天知道那是哪门子的自由主义！另一方面，殷海光的一些国民党籍的学生，也如此呼应着（例如林毓生就说“自由主义可与儒家的精神相...
3	033.不打击自由主义吗？.txt	97	自由主义色彩浓厚的人	对《自由中国》殷海光一路的自由主义者，国民党除了正面的围剿和“黑邮船”（black mail）式的手段外，他们推出一种假自由主义，由一次拿过国民党十两黄金、三千美金出身的徐复观带头，他们也宣传一点自由主义，但是那是与中国儒家结合的自由主义，天知道那是哪门子的自由主义！另一方面，殷海光的一些国民党籍的学生，也如此呼应着（例如林毓生就说“自由主义可与儒家的精神相...
4	033.不打击自由主义吗？.txt	99	大义灭亲	对《文星》李敖一路的自由主义者，国民党除了正面的围剿和查禁外，公然的诽谤和“黑邮船”式的手段外，还一再运用“斗倒”“斗臭”的布尔什维克招式，尤其运用到李敖的妻子与朋友的路子，使李敖灰头土脸，破坏李敖的名誉与公信力。（胡茵梦最早写《特立独行的李敖》，遭到楚崧秋主持的文化工作会行文中央电影公司，严重警告，弄得无戏可拍；同时宋楚瑜主持的新闻局也封锁胡茵梦，不让她主...
8	033.不打击自由主义吗？.txt	101	前事不忘，后事之师	从以上的论证中，我们清楚看到：国民党根本不允许自由主义者的正常存在；国民党打击自由主义者，几十年来，一直不遗余力；国民党所谓联合自由主义者，也根本是一个骗局。“前事不忘，后事之师”，对中国自由前途关心的人，不可不警觉这一点！
3	033.不打击自由主义吗？.txt	103	夏日最后一朵玫瑰	国民党在十六年前，以匪谍原因，把我约谈；在十一年前，以台独原因，把我入狱。但是不论怎么抓我关我，谁都知道我是自由主义者，任何不适合我的帽子，给我戴上，都未免可笑。所以，从两年前开始，国民党开始给我换帽子，以下三滥的罪名，置我于狱。可是，还是没用，我还是出来了，并且苦战不懈。从今以后，我知道国民党不会放过我，我清楚知道，并且准备殉道。在百花凋零的萧瑟里，我是“...
5	035.当然是个人人格问题.txt	9	内疚神明，外惭清议	这篇社论在批评“终身职的民意代表”的可耻方面，写得有中肯的地方，但在人格的检定标准上，显然有所疏忽。社论说他们“早已失掉民意的代表性”，原因“不是个人人格问题”，而是“团体体质和政治结构的问题”。这种说法，是绝对不对的。因为这些老而不死的家伙们，他们的大错特错，都先发生在“个人人格问题”上。——他们一个个明知依照任何公道的标准，他们都不能再代表民意——代表三...
5	035.当然是个人人格问题.txt	11	痛心于政治清明之无望，不忍为同流合污之苟安	反过来说，不论“团体体质和政治结构”怎么糟，有人格的个人，还是可以“出淤泥而不染”。一九二三年，蔡元培向政府辞职，理由就是“痛心于政治清明之无望，不忍为同流合污之苟安”！所以要“奉身而退，以谢教育界及国人”！他的基本尺度就是“为保持人格”。可见这种去就，都先发生在“个人人格问题”上，说问题不在“个人人格问题”上，是绝对不通的。
5	035.当然是个人人格问题.txt	11	奉身而退，以谢教育界及国人	反过来说，不论“团体体质和政治结构”怎么糟，有人格的个人，还是可以“出淤泥而不染”。一九二三年，蔡元培向政府辞职，理由就是“痛心于政治清明之无望，不忍为同流合污之苟安”！所以要“奉身而退，以谢教育界及国人”！他的基本尺度就是“为保持人格”。可见这种去就，都先发生在“个人人格问题”上，说问题不在“个人人格问题”上，是绝对不通的。
4	035.当然是个人人格问题.txt	15	鞠躬尽瘁，死而后已。	在日本军国主义的统治之下、在德国法西斯主义的统治之下，像广田弘毅、史匹尔这样的人，也不知道有多少，他们都只知“小德”而不知“大德”，只重小的行为而忽略大的行为、大的规迹、大的方向。他们自以为在精忠报国，自以为卖命的对象是苦难的国家，因而做孤臣、做循吏，“鞠躬尽瘁，死而后已。”殊不知他们做的，只是对一党一家一姓的愚忠、对一党一家一姓的扶同为恶而已，他们在“大德...
3	036.我们总能看出些什么.txt	11	一见钟情	记得当你二次入狱之时，我写的那篇《“哀”我的朋友李敖》芜文，曾经提及孟能为你安排的“喜临门”之会，我提到了浩然在席间对你之“一见钟情”，惺惺相惜。那次你们似为初识，浩然年长于你近二十岁，而能不避耳目当筵对你表示倾倒，他的率真，不逾于当年胡适之对你的惊才！均是难能可贵的事。
3	036.我们总能看出些什么.txt	13	还有一位老先生和他的女儿	那次宴会，与会者除孟能系以半个主人身分周旋于宾主之间外，宾客有：叶明勋、居浩然、吴申叔、何祚歆、李子弋、郑锡华、周群、虞君质和他的女公子（我写《“哀”我的朋友李敖》时，一时竟记不起虞君质的大名，而已“还有一位老先生和他的女儿”带过），在那俊彦毕集的盛会中，还有就是我这个最起码的蹩脚角色。如今二十一年过去了，虞君质早归道山，吴申叔亦已墓草久宿，当年与你“恩若兄...
5	036.我们总能看出些什么.txt	15	别看李敖芒角峥嵘，然由这些小事上看他，可真是一个多情的性情中人啊！	六十九年七月你我再次相见之时，你谈及第一次出狱之后，曾一个人独自到阳明山公墓申叔的坟前作无言之吊唁。言下对故人的凋落，颇多伤感！我回家以此对老婆言及：“别看李敖芒角峥嵘，然由这些小事上看他，可真是一个多情的性情中人啊！”我妻说：“我老早就知道李敖是表里一致的性情中人，你到今天才这末说，未免嫌迟了些吧！”此所以你发生许多事，我老婆言来语去总是“护”着你的原因。
5	036.我们总能看出些什么.txt	15	我老早就知道李敖是表里一致的性情中人，你到今天才这末说，未免嫌迟了些吧！	六十九年七月你我再次相见之时，你谈及第一次出狱之后，曾一个人独自到阳明山公墓申叔的坟前作无言之吊唁。言下对故人的凋落，颇多伤感！我回家以此对老婆言及：“别看李敖芒角峥嵘，然由这些小事上看他，可真是一个多情的性情中人啊！”我妻说：“我老早就知道李敖是表里一致的性情中人，你到今天才这末说，未免嫌迟了些吧！”此所以你发生许多事，我老婆言来语去总是“护”着你的原因。
6	036.我们总能看出些什么.txt	19	这种小孩子模式的恶作剧，实在不值得你去生气，见怪不怪，其怪必然自败。他画牛伯伯打游击，总不可能天天都在同一乱葬岗上打下去吧！	大约是民国四十三年，现在的牛哥夫人冯娜妮，时在浩然的“淡江”就读，马上就要毕业了，不知为了什么原因，被校长居浩然勒令退学，牛哥为了替热恋中的女朋友出气，乃在所画的《牛伯伯打游击》漫画中，做了手脚，画面是：牛伯伯在一片乱葬岗背景里与共产党打游击战，乱葬岗有许多坟墓与墓碑，牛哥在一块墓碑上给写了“居歪之墓”的字样，不幸又给浩然看到了，认为：“辱及先人”，和他夫人...
4	036.我们总能看出些什么.txt	19	居歪之墓	大约是民国四十三年，现在的牛哥夫人冯娜妮，时在浩然的“淡江”就读，马上就要毕业了，不知为了什么原因，被校长居浩然勒令退学，牛哥为了替热恋中的女朋友出气，乃在所画的《牛伯伯打游击》漫画中，做了手脚，画面是：牛伯伯在一片乱葬岗背景里与共产党打游击战，乱葬岗有许多坟墓与墓碑，牛哥在一块墓碑上给写了“居歪之墓”的字样，不幸又给浩然看到了，认为：“辱及先人”，和他夫人...
4	036.我们总能看出些什么.txt	19	辱及先人	大约是民国四十三年，现在的牛哥夫人冯娜妮，时在浩然的“淡江”就读，马上就要毕业了，不知为了什么原因，被校长居浩然勒令退学，牛哥为了替热恋中的女朋友出气，乃在所画的《牛伯伯打游击》漫画中，做了手脚，画面是：牛伯伯在一片乱葬岗背景里与共产党打游击战，乱葬岗有许多坟墓与墓碑，牛哥在一块墓碑上给写了“居歪之墓”的字样，不幸又给浩然看到了，认为：“辱及先人”，和他夫人...
3	036.我们总能看出些什么.txt	21	浩然，你大少爷脾气又发作了。你开除了牛哥的女朋友，以恶作剧报复的是牛哥，小痴总不能也在他画的漫画上面，同样画一座坟墓，依样在墓碑上写了‘牛哥之墓’替你出气。这种事，不去理他、不去记他，自然就不会生气了。	后来过了三四年，我在江良规博士的写字间作客，浩然也不约而到。见到了我还是悻悻述说我的不是，径指我和牛哥是一路货色。搞得江良规一头雾水，不知我什么事得罪了浩然，而追问根由。迨双方说清了经过一切，江博士说：“浩然，你大少爷脾气又发作了。你开除了牛哥的女朋友，以恶作剧报复的是牛哥，小痴总不能也在他画的漫画上面，同样画一座坟墓，依样在墓碑上写了‘牛哥之墓’替你出气。...
4	036.我们总能看出些什么.txt	23	党国元老	也由于我对他这一点有深刻的亲身感受，因此他一九七二年在前往美国加州旅途之中，知道了你入狱消息，而在随身小笔记本上留下《天涯怀李敖》的诗，更证明了他对你的感情是如何的真挚。人生百岁，得一知友可以无憾。我羡慕你有这末一位生死更见交情的朋友！他以“党国元老”哲嗣的身分，而为你的入狱写了“浮云遮白日”的辨冤之句，是不容易的。也足以使你在千秋之后，留一见证了。
4	036.我们总能看出些什么.txt	23	浮云遮白日	也由于我对他这一点有深刻的亲身感受，因此他一九七二年在前往美国加州旅途之中，知道了你入狱消息，而在随身小笔记本上留下《天涯怀李敖》的诗，更证明了他对你的感情是如何的真挚。人生百岁，得一知友可以无憾。我羡慕你有这末一位生死更见交情的朋友！他以“党国元老”哲嗣的身分，而为你的入狱写了“浮云遮白日”的辨冤之句，是不容易的。也足以使你在千秋之后，留一见证了。
4	036.我们总能看出些什么.txt	25	开拍之时，一定通知我赶回来饰演居正一角。	五十二年，我受中影总经理龚弘之聘，兼职为：中影公司编审委员会驻会委员。是时，龚弘将中影的制片部解散，自领编审委员会主任委员之职，编审会就兼办起制片的业务。此时龚弘致全力筹划拍摄《国父传》，到处在物色容貌、身材，可经化妆之后酷肖中山先生的演员，试镜结果，以当时电视上一位滑稽演员“矮仔福”，外型最为神似，然又以“矮仔福”为一已暴光的滑稽演员，如由斯人而来饰演国父...
3	036.我们总能看出些什么.txt	25	要拍《国父传》，免不了要出现我家老太爷的场面，要找我家老太爷的角色，除了我没有人更像了。所以要拍的时候，一定把饰演居正的角色，将我列入第一人选。	五十二年，我受中影总经理龚弘之聘，兼职为：中影公司编审委员会驻会委员。是时，龚弘将中影的制片部解散，自领编审委员会主任委员之职，编审会就兼办起制片的业务。此时龚弘致全力筹划拍摄《国父传》，到处在物色容貌、身材，可经化妆之后酷肖中山先生的演员，试镜结果，以当时电视上一位滑稽演员“矮仔福”，外型最为神似，然又以“矮仔福”为一已暴光的滑稽演员，如由斯人而来饰演国父...
8	036.我们总能看出些什么.txt	27	世人皆欲杀，君独对我怜	你所作四组《怀念居浩然》五律，第四首开头有：“世人皆欲杀，君独对我怜”之句。在辞意上，好像这世界上对你怜才的人，只有唯一“一浩然”，其他的世人皆是“欲杀”你的大众。我觉得这有推敲的必要；尽管你的文章泼辣得使凡涉及之人消受不了，尽管他们无不对你恨得牙痒痒的，但我知道他们对你佩服的，还是大有人在。甚至政府的执行单位，也不例外。
8	036.我们总能看出些什么.txt	31	宁正言不讳，以危身乎？将从俗富贵，以媮生乎？	在过去二十年来，我曾不止一次劝你“勿为祢衡”，你回我的信，举出了孟子的：“所恶有甚于死者，故患有所不辟也。”的问题；又提出了屈原的：“宁正言不讳，以危身乎？将从俗富贵，以媮生乎？”的问题为答案。我拜读之后，感到你既以“献身理想”为职志，而从另一角度去看，则在这一“坚守民主阵容”的时代，能有你这么一个“数百年一发钟于人”的人物出现，来为这一时代装点出更多的姿采...
7	036.我们总能看出些什么.txt	31	所恶有甚于死者，故患有所不辟也。	在过去二十年来，我曾不止一次劝你“勿为祢衡”，你回我的信，举出了孟子的：“所恶有甚于死者，故患有所不辟也。”的问题；又提出了屈原的：“宁正言不讳，以危身乎？将从俗富贵，以媮生乎？”的问题为答案。我拜读之后，感到你既以“献身理想”为职志，而从另一角度去看，则在这一“坚守民主阵容”的时代，能有你这么一个“数百年一发钟于人”的人物出现，来为这一时代装点出更多的姿采...
4	036.我们总能看出些什么.txt	31	献身理想	在过去二十年来，我曾不止一次劝你“勿为祢衡”，你回我的信，举出了孟子的：“所恶有甚于死者，故患有所不辟也。”的问题；又提出了屈原的：“宁正言不讳，以危身乎？将从俗富贵，以媮生乎？”的问题为答案。我拜读之后，感到你既以“献身理想”为职志，而从另一角度去看，则在这一“坚守民主阵容”的时代，能有你这么一个“数百年一发钟于人”的人物出现，来为这一时代装点出更多的姿采...
4	036.我们总能看出些什么.txt	31	坚守民主阵容	在过去二十年来，我曾不止一次劝你“勿为祢衡”，你回我的信，举出了孟子的：“所恶有甚于死者，故患有所不辟也。”的问题；又提出了屈原的：“宁正言不讳，以危身乎？将从俗富贵，以媮生乎？”的问题为答案。我拜读之后，感到你既以“献身理想”为职志，而从另一角度去看，则在这一“坚守民主阵容”的时代，能有你这么一个“数百年一发钟于人”的人物出现，来为这一时代装点出更多的姿采...
4	036.我们总能看出些什么.txt	31	数百年一发钟于人	在过去二十年来，我曾不止一次劝你“勿为祢衡”，你回我的信，举出了孟子的：“所恶有甚于死者，故患有所不辟也。”的问题；又提出了屈原的：“宁正言不讳，以危身乎？将从俗富贵，以媮生乎？”的问题为答案。我拜读之后，感到你既以“献身理想”为职志，而从另一角度去看，则在这一“坚守民主阵容”的时代，能有你这么一个“数百年一发钟于人”的人物出现，来为这一时代装点出更多的姿采...
3	036.我们总能看出些什么.txt	31	勿为祢衡	在过去二十年来，我曾不止一次劝你“勿为祢衡”，你回我的信，举出了孟子的：“所恶有甚于死者，故患有所不辟也。”的问题；又提出了屈原的：“宁正言不讳，以危身乎？将从俗富贵，以媮生乎？”的问题为答案。我拜读之后，感到你既以“献身理想”为职志，而从另一角度去看，则在这一“坚守民主阵容”的时代，能有你这么一个“数百年一发钟于人”的人物出现，来为这一时代装点出更多的姿采...
3	036.我们总能看出些什么.txt	31	亦属佳事	在过去二十年来，我曾不止一次劝你“勿为祢衡”，你回我的信，举出了孟子的：“所恶有甚于死者，故患有所不辟也。”的问题；又提出了屈原的：“宁正言不讳，以危身乎？将从俗富贵，以媮生乎？”的问题为答案。我拜读之后，感到你既以“献身理想”为职志，而从另一角度去看，则在这一“坚守民主阵容”的时代，能有你这么一个“数百年一发钟于人”的人物出现，来为这一时代装点出更多的姿采...
6	036.我们总能看出些什么.txt	35	现在二十多岁的青年以你李先生为最有名	是则，你所指的——居浩然——“君独对我怜”之“怜”，又何止于居浩然哉？在浩然之前，有胡适之到处为你揄扬；有陈辞修对你说：“现在二十多岁的青年以你李先生为最有名”的话，也都足以觇见当道者对你的一片爱才之正面表示。
4	036.我们总能看出些什么.txt	35	君独对我怜	是则，你所指的——居浩然——“君独对我怜”之“怜”，又何止于居浩然哉？在浩然之前，有胡适之到处为你揄扬；有陈辞修对你说：“现在二十多岁的青年以你李先生为最有名”的话，也都足以觇见当道者对你的一片爱才之正面表示。
4	036.我们总能看出些什么.txt	37	但他晚年竟精神有异，‘遂为狂疾’。	话又回过头来再谈浩然，你所透露的：“但他晚年竟精神有异，‘遂为狂疾’。”——如果他致死的原因竟以此，不能不使人为之感到心酸！由于我在二十六—七年前无事总常到江良规的办公室聊天，而浩然也常常前去，在一次居浩然向江良规借了汽车拿了车钥忽忙离去后，江良规对我说：“浩然这个大少爷，自己手创的淡江英专，又为校长，居然会被人扫地出门，我看他近来说话老是颠三倒四，可能真要...
3	036.我们总能看出些什么.txt	37	浩然这个大少爷，自己手创的淡江英专，又为校长，居然会被人扫地出门，我看他近来说话老是颠三倒四，可能真要气疯了。	话又回过头来再谈浩然，你所透露的：“但他晚年竟精神有异，‘遂为狂疾’。”——如果他致死的原因竟以此，不能不使人为之感到心酸！由于我在二十六—七年前无事总常到江良规的办公室聊天，而浩然也常常前去，在一次居浩然向江良规借了汽车拿了车钥忽忙离去后，江良规对我说：“浩然这个大少爷，自己手创的淡江英专，又为校长，居然会被人扫地出门，我看他近来说话老是颠三倒四，可能真要...
4	036.我们总能看出些什么.txt	51	赠后生之可畏者	小痴所提的“‘喜临门”之会”，正确日子是一九六四年一月十四日。会后居浩然在《自立晚报》和《新闻天地》上，向我大抛媚眼，用臭诗来“赠后生之可畏者”，诗云：
6	036.我们总能看出些什么.txt	71	这是我们野狐西化论者的国粹玩意，自然会被正派的西化论者殷海光所笑，也会被赠诗凌波的徐复观所笑，浩然和我，自然全不在乎，——我们脸皮厚。	我曾戏谓“这是我们野狐西化论者的国粹玩意，自然会被正派的西化论者殷海光所笑，也会被赠诗凌波的徐复观所笑，浩然和我，自然全不在乎，——我们脸皮厚。”我的戏言言犹在耳，殷海光、徐复观、居浩然这些湖北佬，都一一先后做了古人，九头鸟使我想起“鸟鸣山更幽”的古诗，如今鸟不鸣了，山也幽得一默了。
4	036.我们总能看出些什么.txt	71	鸟鸣山更幽	我曾戏谓“这是我们野狐西化论者的国粹玩意，自然会被正派的西化论者殷海光所笑，也会被赠诗凌波的徐复观所笑，浩然和我，自然全不在乎，——我们脸皮厚。”我的戏言言犹在耳，殷海光、徐复观、居浩然这些湖北佬，都一一先后做了古人，九头鸟使我想起“鸟鸣山更幽”的古诗，如今鸟不鸣了，山也幽得一默了。
5	036.我们总能看出些什么.txt	73	世衰道微，乖戾嚣起！	居浩然在《文星》第九十五期写《“读后感”的读后感》骂我，殷海光读了，在上面批“世衰道微，乖戾嚣起！”（殷海光原迹，在我手中。）我总觉得看（或挑拨）他们湖北人打成一团，是人间一乐。
3	036.我们总能看出些什么.txt	75	他的身后共有儿女四人，俱已婚嫁，只幼女居美结婚时，他们夫妇自澳洲不远万里来美主持。据他说实为一万三千英里，折合四万华里，其偏爱可知矣。	小痴说的居浩然千金中，漏掉了小女儿居美。六月一日童轩荪写《纵谈悼念浩然兄！》（《传记文学》第四十二卷第六期）中说“他的身后共有儿女四人，俱已婚嫁，只幼女居美结婚时，他们夫妇自澳洲不远万里来美主持。据他说实为一万三千英里，折合四万华里，其偏爱可知矣。”
4	036.我们总能看出些什么.txt	77	赠后生之可畏者	小痴说居浩然“一向以惧内名世”，居浩然说他太太不准他交李敖那种朋友，他在一九六四年一月二十三日把那首“赠后生之可畏者”的诗修正寄我，内附一信，信说：
3	036.我们总能看出些什么.txt	77	一向以惧内名世	小痴说居浩然“一向以惧内名世”，居浩然说他太太不准他交李敖那种朋友，他在一九六四年一月二十三日把那首“赠后生之可畏者”的诗修正寄我，内附一信，信说：
