score	file	line	text	context
3	004.9月22日神州文化之旅第四天.txt	7	一向喜欢张扬个性，屁股像着火的李敖，刚进录音棚面部表情有些紧张，自始至终他一直很规矩，多半时间是两腿分开，将双手放在膝盖上。	现场的媒体记者则认为：“在录制现场，李敖变成了一个喜剧、娱乐人物，尽管锋芒不断出现，但极少提及敏感字眼，一改往日狂妄作风，变化得令人诧异不已。”“一向喜欢张扬个性，屁股像着火的李敖，刚进录音棚面部表情有些紧张，自始至终他一直很规矩，多半时间是两腿分开，将双手放在膝盖上。”
3	004.9月22日神州文化之旅第四天.txt	77	我的北京话比你们全好	“我的北京话比你们全好”
3	004.9月22日神州文化之旅第四天.txt	251	你别干了	李敖：胡适是影响我的其中之一。他究竟是五四时代的大儒，比如蒋介石干到死，整个台湾没人敢讲“你别干了”，胡适敢讲，唯一的一个敢讲这种话的人。
6	004.9月22日神州文化之旅第四天.txt	265	胡适和殷海光是我大学时代最佩服的前辈，其他无论师友跟我固有交情，但谈佩服则无其感，由此可见我这个大学生如何挑剔，如何眼高于顶。	鲁豫：大师回忆录里有一段：“胡适和殷海光是我大学时代最佩服的前辈，其他无论师友跟我固有交情，但谈佩服则无其感，由此可见我这个大学生如何挑剔，如何眼高于顶。”
5	004.9月22日神州文化之旅第四天.txt	445	天人交战，内心挣扎	李敖：这是过分宣传，没有几个，那时候女人比较保守，我们又没有钱，连带长得不像马英九。我在五十岁以前，看到女孩子立刻下手；六十岁以后，看到漂亮女孩就“天人交战，内心挣扎”；到了七十岁，调头就走。
4	004.9月22日神州文化之旅第四天.txt	479	终于见到了，真高兴。	同学：“终于见到了，真高兴。”
3	004.9月22日神州文化之旅第四天.txt	481	认得出吗？	记者：“认得出吗？”
4	004.9月22日神州文化之旅第四天.txt	483	当然了，这是我的拜把子兄弟。	李敖：“当然了，这是我的拜把子兄弟。”
3	004.9月22日神州文化之旅第四天.txt	489	潘金莲！	“潘金莲！”李敖见到老同学潘燕生，“外号”脱口而出。这个当年被李敖起外号的“潘金莲”如今已经是七旬老人。他说，李敖小时候就喜欢领导别人，是个“孩子王”。当年詹永杰是班长，是“官方的领导”，而李敖爱给别人起外号，是班里的“民间领导”。而《李敖回忆录》里有关记载是：“有一次，我在班上恶作剧，搂住一位两眼含情脸蛋泛红的潘姓漂亮小男生大叫：‘我爱潘金莲！’”
3	004.9月22日神州文化之旅第四天.txt	489	有一次，我在班上恶作剧，搂住一位两眼含情脸蛋泛红的潘姓漂亮小男生大叫：‘我爱潘金莲！’	“潘金莲！”李敖见到老同学潘燕生，“外号”脱口而出。这个当年被李敖起外号的“潘金莲”如今已经是七旬老人。他说，李敖小时候就喜欢领导别人，是个“孩子王”。当年詹永杰是班长，是“官方的领导”，而李敖爱给别人起外号，是班里的“民间领导”。而《李敖回忆录》里有关记载是：“有一次，我在班上恶作剧，搂住一位两眼含情脸蛋泛红的潘姓漂亮小男生大叫：‘我爱潘金莲！’”
4	004.9月22日神州文化之旅第四天.txt	495	不可以，不可以。	与同学们一起面对摄像机镜头，旁边人提议让李敖站在中间，他连忙说：“不可以，不可以。”李敖站在了最左侧，紧挨着詹永杰说话。最后，同学会的老师和同学合影，主持人提议让李敖站在最中间，李敖连忙推让，他提议让当年的老班长詹永杰站在后排的中央，黄维汉老师坐在前排的中央，他还是站在詹永杰旁边。
5	004.9月22日神州文化之旅第四天.txt	497	跟人奋斗，其乐无穷	一位银发苍苍的女同学，李敖想了半天却叫不出名字了。这位女同学却至今记得李敖当年和别人闹矛盾的事儿。三岁看老，小时候打架，长大了打官司，李敖从小就“跟人奋斗，其乐无穷”。
6	004.9月22日神州文化之旅第四天.txt	513	你我同在一群中，感情一直都相通。你有快乐我分享，我有忧愁你与共。彼此情谊砌金石，日月明照此寸中。	李敖还和十六位小学同学一起高唱当年的“童子军”歌谣：“你我同在一群中，感情一直都相通。你有快乐我分享，我有忧愁你与共。彼此情谊砌金石，日月明照此寸中。”李敖只唱了几句就跟不上大家的节奏，忘记了歌词只能“随声附和”。
3	004.9月22日神州文化之旅第四天.txt	513	童子军	李敖还和十六位小学同学一起高唱当年的“童子军”歌谣：“你我同在一群中，感情一直都相通。你有快乐我分享，我有忧愁你与共。彼此情谊砌金石，日月明照此寸中。”李敖只唱了几句就跟不上大家的节奏，忘记了歌词只能“随声附和”。
3	004.9月22日神州文化之旅第四天.txt	513	随声附和	李敖还和十六位小学同学一起高唱当年的“童子军”歌谣：“你我同在一群中，感情一直都相通。你有快乐我分享，我有忧愁你与共。彼此情谊砌金石，日月明照此寸中。”李敖只唱了几句就跟不上大家的节奏，忘记了歌词只能“随声附和”。
4	004.9月22日神州文化之旅第四天.txt	519	不可以，不可以。怎么可以站在同学中间。这样站旁边就好了。	李敖今天穿红夹克、红领带、白衬衣，显得很年轻。更难得的是，在老同学面前，李大师格外谦虚。与同学们一起面对摄像机镜头，一起合影留念时，主持人劝他站在中间。李敖连说，“不可以，不可以。怎么可以站在同学中间。这样站旁边就好了。”李敖坚持和拜把子兄弟詹永杰一起站在最边儿上。
5	005.9月23日神州文化之旅第五天.txt	7	李敖有话说、我们有话说——台湾知名人士李敖先生清华演讲提问及赠言征集	消息说，演讲会的地点选在中央主楼报告厅，这里是清华大学举办重要学术活动的惯例场所，不少国际政要、学术大师、社会名流都曾在这里发表演讲。报告厅能容纳500名听众，演讲会的入场券是在师生自愿报名的基础上，抽签产生。此前，学生在校园网上开展了“李敖有话说、我们有话说——台湾知名人士李敖先生清华演讲提问及赠言征集”活动，赢得最佳提问和赠言的前两名同学将获得入场券。
7	005.9月23日神州文化之旅第五天.txt	31	室中更无人，唯有乳下孙。有孙母未去，出入无完裙	我们的确富强起来了。当时穷的时候，日本人奚落我们的外交部长陈毅，说你们中国人穷得裤子都没的穿，还要造原子弹？虎虎有生气的陈毅外长说，我们光着屁股，没有裤子穿也要造原子弹。我觉得这个气势是很了不起。大家记得不记得唐诗，官府来抓壮丁，男的跑掉了，家里剩下老太太。她和抓兵的官儿说，我家里只有吃奶的孙子和孙子的妈妈，但是不能见你们，因为没有裤子穿，没有裙子穿，“室中...
4	005.9月23日神州文化之旅第五天.txt	35	汉唐以来所未有也	我们中国这么穷，这个账不能算在共产党头上。1949年共产党接受的是什么摊子？国民党带走了全中国国库里的黄金，折成美金是3亿美金，可是当时全中国的钱。留给中国大陆的是一穷二白，国库掏空了，能破坏的桥都炸掉了，能带走的东西全部带走了，并且留下了300万的坏分子捣乱，引起共产党紧张，又穷又要解决这些治安的问题。我们是在这种情况下成长的，现在是中国自汉唐以来所没有的...
4	005.9月23日神州文化之旅第五天.txt	39	这个房屋里面没有汉奸。	当年，胡适先生在北京大学，共产党的学生和国民党的学生为了一件事情在礼堂里吵起来。胡先生出现时，共产党的学生起来指着胡适骂：汉奸！胡先生心平气和、苦口婆心地说：“这个房屋里面没有汉奸。”今天在我们的祖国大地上，没有谁不爱中国，没有谁是要捣你的乱，和你过不去，乱出反动言论，影响民心士气。有的人说你们言论有问题，这就是邓小平同志所讲的，有些同志思想需要慢慢地改过来...
3	005.9月23日神州文化之旅第五天.txt	41	汗牛充栋	我告诉各位，我现在放弃了自由主义，为什么？我不和大家谈学理，17世纪、18世纪、19世纪关于自由主义的著作是“汗牛充栋”。现在我只谈两个部分，第一是“反求诸己”，自己的心灵能够开放，不被那些思想所困，是对我自己的一种改革开放，有这个本领，才是自由主义者；另外一半是和政府的关系，从17世纪、18世纪到20世纪，大家所争取的自由都是虚无缥缈的。我告诉大家，自由和...
3	005.9月23日神州文化之旅第五天.txt	41	反求诸己	我告诉各位，我现在放弃了自由主义，为什么？我不和大家谈学理，17世纪、18世纪、19世纪关于自由主义的著作是“汗牛充栋”。现在我只谈两个部分，第一是“反求诸己”，自己的心灵能够开放，不被那些思想所困，是对我自己的一种改革开放，有这个本领，才是自由主义者；另外一半是和政府的关系，从17世纪、18世纪到20世纪，大家所争取的自由都是虚无缥缈的。我告诉大家，自由和...
8	005.9月23日神州文化之旅第五天.txt	43	这里是我的国家，我要使它自由	美国的富兰克林一生分成两段，前半生做生意、办报纸、放风筝；后半生革命，越老越激进，最后变成美国的革命党。富兰克林讲了一句话，非常动人，他说：“哪里有自由，哪里就是我的祖国。”告诉大家，富兰克林是错误的，这句话被我李敖改写成“这里是我的国家，我要使它自由”。别以为都是假的，当我们努力就是真的；别以为他们在骗我们，当我们认真，他们就不是骗子。
7	005.9月23日神州文化之旅第五天.txt	43	哪里有自由，哪里就是我的祖国。	美国的富兰克林一生分成两段，前半生做生意、办报纸、放风筝；后半生革命，越老越激进，最后变成美国的革命党。富兰克林讲了一句话，非常动人，他说：“哪里有自由，哪里就是我的祖国。”告诉大家，富兰克林是错误的，这句话被我李敖改写成“这里是我的国家，我要使它自由”。别以为都是假的，当我们努力就是真的；别以为他们在骗我们，当我们认真，他们就不是骗子。
4	005.9月23日神州文化之旅第五天.txt	71	鸣鼓而攻之	李敖：我是和孔子学的，孔子不拿拐杖打学生吗？不是“鸣鼓而攻之”，要发威吗？这就是中国人的传统，当面说好话，背后下毒手。（笑声）
5	005.9月23日神州文化之旅第五天.txt	91	人类历史上第一位集欧洲文艺复兴时期的诸种学艺，和中国四书五经等古典学问于一身的巨人	利玛窦是意大利人，明万历年间（1582年）来到澳门，1601到北京，1610年在北京去世。他去世后，明万历皇帝因为他翻译《几何》有功，破例把他葬在北京西郊。曾有日本学者把利玛窦称为“人类历史上第一位集欧洲文艺复兴时期的诸种学艺，和中国四书五经等古典学问于一身的巨人”“地球上出现的第一位世界公民”。利玛窦墓的两边还安葬着另外两位著名的传教士——汤若望和南怀仁。
3	005.9月23日神州文化之旅第五天.txt	91	地球上出现的第一位世界公民	利玛窦是意大利人，明万历年间（1582年）来到澳门，1601到北京，1610年在北京去世。他去世后，明万历皇帝因为他翻译《几何》有功，破例把他葬在北京西郊。曾有日本学者把利玛窦称为“人类历史上第一位集欧洲文艺复兴时期的诸种学艺，和中国四书五经等古典学问于一身的巨人”“地球上出现的第一位世界公民”。利玛窦墓的两边还安葬着另外两位著名的传教士——汤若望和南怀仁。
6	005.9月23日神州文化之旅第五天.txt	95	朝廷为已亡诸教士雪辱涤耻……	利玛窦墓地重修后，利玛窦、汤若望、南怀仁等人的墓碑被重新树立起来，郎世宁等七十多通墓碑嵌在新建的教堂的外墙上。这个名为石门教堂的大门上端，嵌入了一块道歉的石碑。这块道歉碑现在嵌在利玛窦墓地的右墙上，上书：“朝廷为已亡诸教士雪辱涤耻……”云云。到20世纪初，此地成为天主教的公共墓地，先后埋葬了数百名西方传教士，是明清以来西方传教士在东方安息的一个集中所在。文革...
4	005.9月23日神州文化之旅第五天.txt	95	永世不得翻身	利玛窦墓地重修后，利玛窦、汤若望、南怀仁等人的墓碑被重新树立起来，郎世宁等七十多通墓碑嵌在新建的教堂的外墙上。这个名为石门教堂的大门上端，嵌入了一块道歉的石碑。这块道歉碑现在嵌在利玛窦墓地的右墙上，上书：“朝廷为已亡诸教士雪辱涤耻……”云云。到20世纪初，此地成为天主教的公共墓地，先后埋葬了数百名西方传教士，是明清以来西方传教士在东方安息的一个集中所在。文革...
3	005.9月23日神州文化之旅第五天.txt	97	利先生，讳玛窦，号西泰，大西洋意大里亚国人。自幼入会真修，明万历壬午年航海首入中华行教。万历庚子年来都，万历庚戍年卒，在世五十九年，在会四十二年。	李敖很仔细地看了利玛窦的墓碑。碑高近3米，碑身用拉丁文和中文刻着“耶稣士利公之墓”，并记录了利玛窦的生平：“利先生，讳玛窦，号西泰，大西洋意大里亚国人。自幼入会真修，明万历壬午年航海首入中华行教。万历庚子年来都，万历庚戍年卒，在世五十九年，在会四十二年。”
4	005.9月23日神州文化之旅第五天.txt	139	这里有这么多书，只能拿走送给我的一本复制品，其他的东西都拿不走。	詹福瑞代表国图送给李敖的礼物是——司马光《资治通鉴》手稿复制件。李敖“遗憾”地开玩笑说：“这里有这么多书，只能拿走送给我的一本复制品，其他的东西都拿不走。”
7	005.9月23日神州文化之旅第五天.txt	147	学问挺好，字不是太好。	李敖：这个在赵明诚《金石录》里有记录。是上下两册，这个拓本按年代来算，有人怀疑是唐末期，有人怀疑是北宋。这个比较珍贵。接下来看的有司马光的《资治通鉴》手稿，有有梦溪笔谈的原刻本，有王国维的遗书真迹，有鲁迅《阿Q正传》的手稿和朱自清的手稿。李敖对名人的字非常在意。看梁启超的手稿时说，你看看，这字写得多漂亮。对鲁迅的手稿，他说，字写得不错。但在看章太炎的“轴”时...
7	005.9月23日神州文化之旅第五天.txt	157	不做刀笔吏，愿做守藏吏。	参观结束，李敖向工作人员致谢，合影留念并题词：“不做刀笔吏，愿做守藏吏。”写完这十个字，李敖先生又开始“显摆”：“刀笔吏出自《汉书》，是指那些靠笔去做官的人。守藏吏就更早了，从老子起就有了典故，能写出这十个字，显示出我胸中有无数丰富的知识！”然后哈哈大笑！
6	005.9月23日神州文化之旅第五天.txt	157	刀笔吏出自《汉书》，是指那些靠笔去做官的人。守藏吏就更早了，从老子起就有了典故，能写出这十个字，显示出我胸中有无数丰富的知识！	参观结束，李敖向工作人员致谢，合影留念并题词：“不做刀笔吏，愿做守藏吏。”写完这十个字，李敖先生又开始“显摆”：“刀笔吏出自《汉书》，是指那些靠笔去做官的人。守藏吏就更早了，从老子起就有了典故，能写出这十个字，显示出我胸中有无数丰富的知识！”然后哈哈大笑！
4	006.9月24日李敖做客凤凰网（聊天节选）.txt	81	人书俱老	网友：您在北大图书馆和法源寺题词“人书俱老”，你是指自己也老了吗？
4	006.9月24日李敖做客凤凰网（聊天节选）.txt	83	人书俱老	李敖：“人书俱老”出自孙过庭《书谱》里的一句话，“书”指书法。我在图书馆里写这个“书”代表书也代表书法。这个“老”字，不是真的老，是炉火纯青的意思，代表书是了不起的书，人也是了不起的人，隐含了吹牛的意思。
3	006.9月24日李敖做客凤凰网（聊天节选）.txt	83	老	李敖：“人书俱老”出自孙过庭《书谱》里的一句话，“书”指书法。我在图书馆里写这个“书”代表书也代表书法。这个“老”字，不是真的老，是炉火纯青的意思，代表书是了不起的书，人也是了不起的人，隐含了吹牛的意思。
3	006.9月24日李敖做客凤凰网（聊天节选）.txt	93	过午不食	网友：您现在七十岁了，看起来像五十多岁。您在节目中说过您的养生秘诀是“过午不食”？
3	006.9月24日李敖做客凤凰网（聊天节选）.txt	95	过午不食	李敖：“过午不食”是给自己一个约束，不要使肚子有饱的感觉，换句话说就是少吃。我身高172公分，体重从来没有超过72公斤。我体重是标准的，所以健康才有有某种程度的水平。比如我没有心脏病、没有糖尿病。这样子的健康才可以“祸害”别人。（笑）
5	006.9月24日李敖做客凤凰网（聊天节选）.txt	109	铮铮铁骨，百折不挠，伶牙俐齿，特立独行	网友：您的社会形象是“铮铮铁骨，百折不挠，伶牙俐齿，特立独行”，您在家里的形象是怎样的？
4	006.9月24日李敖做客凤凰网（聊天节选）.txt	169	女子无才便是德	雪域：您女儿李文是个非常优秀的女性，您怎么样看待女儿的才能与您自己所谓“女子无才便是德”的言论呢？
8	006.9月24日李敖做客凤凰网（聊天节选）.txt	185	读万卷书，行零里路	李敖：“走走”对我的生命而言，是浪费我的老年。如果看山看水，山水各地都差不多，为什么不看看电影和幻灯片？为什么要身临其境？董其昌讲了一句话：行万里路，读万卷书。我认为这是不对的，应该是“读万卷书，行零里路”。
5	006.9月24日李敖做客凤凰网（聊天节选）.txt	203	朝三暮四、朝四暮三，加到一起还不是七吗	李敖说，自己一路走来都是如此，表达的方式有轻重缓急，但“朝三暮四、朝四暮三，加到一起还不是七吗”？至于有人说他由硬转软，李敖则开玩笑地说，“我感谢他描写了我一个器官”。
4	006.9月24日李敖做客凤凰网（聊天节选）.txt	233	你能读外国书，很好；我只能读中国书，都读完了，没得读了。	李敖：很难说。当年陈寅恪给他的表兄讲了一个故事，他幼年时去见历史学家夏曾佑，那位老人对他说：“你能读外国书，很好；我只能读中国书，都读完了，没得读了。”他当时很惊讶，以为那位学者老糊涂了。等到自己也老了时，他才觉得那话有点道理。中国书有十万种怎么看完呢？中国书有一个主轴，中国文化有一个主轴，就是孔孟文化。除了主轴以外，还有儒家的、道家的，其余的许多都是千篇一...
4	006.9月24日李敖做客凤凰网（聊天节选）.txt	259	千山将尽，万法唱空。百年即至，唯我四中	李敖送给四中一套《李敖大全集》，又题字“千山将尽，万法唱空。百年即至，唯我四中”。2007年是四中百年校庆。
3	007.9月25日神州文化之旅第七天.txt	31	虽然外滩过去的样子还在，但是我的心境完全不一样了。那时候，我是难民，上船后在甲板上漂到台湾去的。今天的情景完全不一样了。	在外滩3号这个非常有名的时尚地界，李敖打开窗户观赏了黄浦江畔的桨声灯影。凤凰卫视记者询问李敖先生在阔别57年后对新上海的印象，李敖说：“虽然外滩过去的样子还在，但是我的心境完全不一样了。那时候，我是难民，上船后在甲板上漂到台湾去的。今天的情景完全不一样了。”
5	007.9月25日神州文化之旅第七天.txt	35	您到达北京和上海时都有女孩献花，你对南北方不同的女孩如何评价？	记者问：“您到达北京和上海时都有女孩献花，你对南北方不同的女孩如何评价？”李敖笑答：“没有看清，因为都被花挡住了。”话虽如此说，但李敖并不拒绝美女，挽住两位凤凰卫视上海站的漂亮美眉一起合影。
4	007.9月25日神州文化之旅第七天.txt	35	没有看清，因为都被花挡住了。	记者问：“您到达北京和上海时都有女孩献花，你对南北方不同的女孩如何评价？”李敖笑答：“没有看清，因为都被花挡住了。”话虽如此说，但李敖并不拒绝美女，挽住两位凤凰卫视上海站的漂亮美眉一起合影。
4	007.9月25日神州文化之旅第七天.txt	37	我的身体很好啊，一点问题都没有。	晚上近8点钟，李敖一行抵达下榻的锦江饭店贵宾楼，终于出现在上海众多媒体的视线里，刚下车，李敖就被记者“包围”了。当被媒体责问“来到上海和记者捉猫猫”时，“敖哥”很老实地解释说是“飞机误点”，并向大家致歉。有媒体记者询问他身体状况，李敖说：“我的身体很好啊，一点问题都没有。”
3	007.9月25日神州文化之旅第七天.txt	37	来到上海和记者捉猫猫	晚上近8点钟，李敖一行抵达下榻的锦江饭店贵宾楼，终于出现在上海众多媒体的视线里，刚下车，李敖就被记者“包围”了。当被媒体责问“来到上海和记者捉猫猫”时，“敖哥”很老实地解释说是“飞机误点”，并向大家致歉。有媒体记者询问他身体状况，李敖说：“我的身体很好啊，一点问题都没有。”
4	007.9月25日神州文化之旅第七天.txt	57	是，你的票差点就是我‘转让’的了。	飞机就要起飞了，王纪言走到本报记者面前说，你就是楚天的张欧亚？我开玩笑说：“是，你的票差点就是我‘转让’的了。”
3	007.9月25日神州文化之旅第七天.txt	59	为了让李大师休息好，我们没有让一个记者进入头等舱包括我们自己的记者。昨天一查，竟有一张在你手里。他又说，李大师要休息，你先不要打扰他，下半航程时，我们会安排记者进来，那时你可以随访。	王纪言说：“为了让李大师休息好，我们没有让一个记者进入头等舱包括我们自己的记者。昨天一查，竟有一张在你手里。他又说，李大师要休息，你先不要打扰他，下半航程时，我们会安排记者进来，那时你可以随访。”
4	007.9月25日神州文化之旅第七天.txt	61	呵呵，原来是你啊，我们是老朋友了。	刘长乐见到记者忙说：“呵呵，原来是你啊，我们是老朋友了。”去年在香港和马来西亚，本报记者曾两次采访过刘长乐。刘长乐对李敖介绍说，这是楚天的记者，唯一一张“流失”的头等舱票被他拿走了。
4	007.9月25日神州文化之旅第七天.txt	69	看到了吗？大师多么谦虚，他是因记者刚才的采访打扰了他们，在记者走后表示歉意。	众记者从头等舱撤退后，李敖怕打扰了三名美国乘客，向他们连声说“sorry”。刘长乐走过来对本报记者说：“看到了吗？大师多么谦虚，他是因记者刚才的采访打扰了他们，在记者走后表示歉意。”刘长乐又透露：“昨天晚上即将离开钓鱼台国宾馆时，大师让人把每一个工作人员包括司机的名字全部抄来，一一为他们签名，并每人给了一个红包。”李敖又回头对本报记者说：“对不起。我们已经认...
4	007.9月25日神州文化之旅第七天.txt	69	对不起。我们已经认识了，所以刚刚没有专门对你说‘sorry’。	众记者从头等舱撤退后，李敖怕打扰了三名美国乘客，向他们连声说“sorry”。刘长乐走过来对本报记者说：“看到了吗？大师多么谦虚，他是因记者刚才的采访打扰了他们，在记者走后表示歉意。”刘长乐又透露：“昨天晚上即将离开钓鱼台国宾馆时，大师让人把每一个工作人员包括司机的名字全部抄来，一一为他们签名，并每人给了一个红包。”李敖又回头对本报记者说：“对不起。我们已经认...
