file	line	text	context
003.一网成擒，笑话伺候.txt	3	哀思录	林肯总统开国务会议时，总是先说个笑话，使大家放轻松。李敖写书也如此。以什么“哀思录”为书名的书，总不能先哭哭啼啼。谈到笑话，一定涉及人，虽然立法院里我因交友不慎而所交非人者多，但也有足资醒世解颐者，除分别写出散见此书者外，先就一网成擒者一打，抽样如下：
003.一网成擒，笑话伺候.txt	19	做立委时，坐在最后一排，常常收到林益世送吃的东西	八、林益世。陈文茜跟我说，她“做立委时，坐在最后一排，常常收到林益世送吃的东西”。如今我也坐在最后一排，林益世没送吃的来，反倒吃了我，他送了喜帖。我乃秀才人情纸半张，题诗如下：
004.以玩笑出之.txt	5	干青云而直上	我在这小岛上，用股票术语，陷入一种盘，一种“落单”的盘，我“干青云而直上”，高得没有跟得上的良师畏友了，也没有什么同志、什么门徒，陷入严重的“落单”。落了单，标准的反应是行吟泽畔、是怀才不遇、是横眉冷对、是独喝闷酒与胃溃疡。可是我却全没这些。相反的，我一片欢喜，一点也不负面或消极。我的最大本领是自得其乐，并且常常乐不可支。草山（阳明山）上有一幢老旧大厦，五楼边间有我的书房，我常常“落单”其中，几天几夜足不出户，庄子所谓“独与天地精神往来”，正此之谓，但比庄子那时代的，更知天高地厚。我的书房不大，二三十坪，但高3.6米，有夹层其中，书桌4张，此上彼下，舞厅小姐“转枱子”，我也“转枱子”，台子一转，我隔世矣。我的大门可真考究，是英国唐宁街（Downing Street）式的，全无文丐街（Grub Street）的穷酸。那道门反锁起来，浑然有响，气派非凡。书房中典雅琳琅，挂有沈尹默写的韩昌黎诗，中有一句是“宫门一锁不复启，虽有九陌无尘...
004.以玩笑出之.txt	5	独与天地精神往来	我在这小岛上，用股票术语，陷入一种盘，一种“落单”的盘，我“干青云而直上”，高得没有跟得上的良师畏友了，也没有什么同志、什么门徒，陷入严重的“落单”。落了单，标准的反应是行吟泽畔、是怀才不遇、是横眉冷对、是独喝闷酒与胃溃疡。可是我却全没这些。相反的，我一片欢喜，一点也不负面或消极。我的最大本领是自得其乐，并且常常乐不可支。草山（阳明山）上有一幢老旧大厦，五楼边间有我的书房，我常常“落单”其中，几天几夜足不出户，庄子所谓“独与天地精神往来”，正此之谓，但比庄子那时代的，更知天高地厚。我的书房不大，二三十坪，但高3.6米，有夹层其中，书桌4张，此上彼下，舞厅小姐“转枱子”，我也“转枱子”，台子一转，我隔世矣。我的大门可真考究，是英国唐宁街（Downing Street）式的，全无文丐街（Grub Street）的穷酸。那道门反锁起来，浑然有响，气派非凡。书房中典雅琳琅，挂有沈尹默写的韩昌黎诗，中有一句是“宫门一锁不复启，虽有九陌无尘...
004.以玩笑出之.txt	5	转枱子	我在这小岛上，用股票术语，陷入一种盘，一种“落单”的盘，我“干青云而直上”，高得没有跟得上的良师畏友了，也没有什么同志、什么门徒，陷入严重的“落单”。落了单，标准的反应是行吟泽畔、是怀才不遇、是横眉冷对、是独喝闷酒与胃溃疡。可是我却全没这些。相反的，我一片欢喜，一点也不负面或消极。我的最大本领是自得其乐，并且常常乐不可支。草山（阳明山）上有一幢老旧大厦，五楼边间有我的书房，我常常“落单”其中，几天几夜足不出户，庄子所谓“独与天地精神往来”，正此之谓，但比庄子那时代的，更知天高地厚。我的书房不大，二三十坪，但高3.6米，有夹层其中，书桌4张，此上彼下，舞厅小姐“转枱子”，我也“转枱子”，台子一转，我隔世矣。我的大门可真考究，是英国唐宁街（Downing Street）式的，全无文丐街（Grub Street）的穷酸。那道门反锁起来，浑然有响，气派非凡。书房中典雅琳琅，挂有沈尹默写的韩昌黎诗，中有一句是“宫门一锁不复启，虽有九陌无尘...
004.以玩笑出之.txt	5	宫门一锁不复启，虽有九陌无尘埃	我在这小岛上，用股票术语，陷入一种盘，一种“落单”的盘，我“干青云而直上”，高得没有跟得上的良师畏友了，也没有什么同志、什么门徒，陷入严重的“落单”。落了单，标准的反应是行吟泽畔、是怀才不遇、是横眉冷对、是独喝闷酒与胃溃疡。可是我却全没这些。相反的，我一片欢喜，一点也不负面或消极。我的最大本领是自得其乐，并且常常乐不可支。草山（阳明山）上有一幢老旧大厦，五楼边间有我的书房，我常常“落单”其中，几天几夜足不出户，庄子所谓“独与天地精神往来”，正此之谓，但比庄子那时代的，更知天高地厚。我的书房不大，二三十坪，但高3.6米，有夹层其中，书桌4张，此上彼下，舞厅小姐“转枱子”，我也“转枱子”，台子一转，我隔世矣。我的大门可真考究，是英国唐宁街（Downing Street）式的，全无文丐街（Grub Street）的穷酸。那道门反锁起来，浑然有响，气派非凡。书房中典雅琳琅，挂有沈尹默写的韩昌黎诗，中有一句是“宫门一锁不复启，虽有九陌无尘...
004.以玩笑出之.txt	5	侬是一只卵	我在这小岛上，用股票术语，陷入一种盘，一种“落单”的盘，我“干青云而直上”，高得没有跟得上的良师畏友了，也没有什么同志、什么门徒，陷入严重的“落单”。落了单，标准的反应是行吟泽畔、是怀才不遇、是横眉冷对、是独喝闷酒与胃溃疡。可是我却全没这些。相反的，我一片欢喜，一点也不负面或消极。我的最大本领是自得其乐，并且常常乐不可支。草山（阳明山）上有一幢老旧大厦，五楼边间有我的书房，我常常“落单”其中，几天几夜足不出户，庄子所谓“独与天地精神往来”，正此之谓，但比庄子那时代的，更知天高地厚。我的书房不大，二三十坪，但高3.6米，有夹层其中，书桌4张，此上彼下，舞厅小姐“转枱子”，我也“转枱子”，台子一转，我隔世矣。我的大门可真考究，是英国唐宁街（Downing Street）式的，全无文丐街（Grub Street）的穷酸。那道门反锁起来，浑然有响，气派非凡。书房中典雅琳琅，挂有沈尹默写的韩昌黎诗，中有一句是“宫门一锁不复启，虽有九陌无尘...
004.以玩笑出之.txt	5	李翰祥满脸骄气，李敖一身傲骨。	我在这小岛上，用股票术语，陷入一种盘，一种“落单”的盘，我“干青云而直上”，高得没有跟得上的良师畏友了，也没有什么同志、什么门徒，陷入严重的“落单”。落了单，标准的反应是行吟泽畔、是怀才不遇、是横眉冷对、是独喝闷酒与胃溃疡。可是我却全没这些。相反的，我一片欢喜，一点也不负面或消极。我的最大本领是自得其乐，并且常常乐不可支。草山（阳明山）上有一幢老旧大厦，五楼边间有我的书房，我常常“落单”其中，几天几夜足不出户，庄子所谓“独与天地精神往来”，正此之谓，但比庄子那时代的，更知天高地厚。我的书房不大，二三十坪，但高3.6米，有夹层其中，书桌4张，此上彼下，舞厅小姐“转枱子”，我也“转枱子”，台子一转，我隔世矣。我的大门可真考究，是英国唐宁街（Downing Street）式的，全无文丐街（Grub Street）的穷酸。那道门反锁起来，浑然有响，气派非凡。书房中典雅琳琅，挂有沈尹默写的韩昌黎诗，中有一句是“宫门一锁不复启，虽有九陌无尘...
004.以玩笑出之.txt	7	倚老卖老	正因为我老资格如此，所以在立法院，我的基调是“倚老卖老”的，老子眼里哪有别人，别人只是一笑耳。八大山人动辄“涉事”，我一“涉事”，就不免“以玩笑出之”，为什么玩笑？因为：一、不值得；二、要长命百岁。殷海光死于49岁，蒋介石死于89岁，你反对你的敌人，你的敌人比你多活了40岁，反对个屁呀，李敖才没那么笨呢！此书伊始，先申立场如上。
004.以玩笑出之.txt	7	以玩笑出之	正因为我老资格如此，所以在立法院，我的基调是“倚老卖老”的，老子眼里哪有别人，别人只是一笑耳。八大山人动辄“涉事”，我一“涉事”，就不免“以玩笑出之”，为什么玩笑？因为：一、不值得；二、要长命百岁。殷海光死于49岁，蒋介石死于89岁，你反对你的敌人，你的敌人比你多活了40岁，反对个屁呀，李敖才没那么笨呢！此书伊始，先申立场如上。
005.为何起了怪书名？.txt	3	十年辛苦不寻常	10年前，1997年，我出版了《李敖回忆录》，写我62岁以前的自己；一年半后，又出版了《李敖快意恩仇录》，意犹未尽，再来点睛。如今“十年辛苦不寻常”，我72岁了，已是孔夫子逝者如斯之年，72岁以前，可谓“同孔子之年”；72岁以后，可谓“超孔子之年”，二人行，必有寿星，如今我活过孔子，已属必然，瞻之在前，忽焉在后，吾知勉夫，乃就十年来的自己，先就议坛部分写出，续成回忆。
005.为何起了怪书名？.txt	3	同孔子之年	10年前，1997年，我出版了《李敖回忆录》，写我62岁以前的自己；一年半后，又出版了《李敖快意恩仇录》，意犹未尽，再来点睛。如今“十年辛苦不寻常”，我72岁了，已是孔夫子逝者如斯之年，72岁以前，可谓“同孔子之年”；72岁以后，可谓“超孔子之年”，二人行，必有寿星，如今我活过孔子，已属必然，瞻之在前，忽焉在后，吾知勉夫，乃就十年来的自己，先就议坛部分写出，续成回忆。
005.为何起了怪书名？.txt	3	超孔子之年	10年前，1997年，我出版了《李敖回忆录》，写我62岁以前的自己；一年半后，又出版了《李敖快意恩仇录》，意犹未尽，再来点睛。如今“十年辛苦不寻常”，我72岁了，已是孔夫子逝者如斯之年，72岁以前，可谓“同孔子之年”；72岁以后，可谓“超孔子之年”，二人行，必有寿星，如今我活过孔子，已属必然，瞻之在前，忽焉在后，吾知勉夫，乃就十年来的自己，先就议坛部分写出，续成回忆。
005.为何起了怪书名？.txt	7	哀思录	或问用“哀思录”做自己书名，不忌讳吗？答案是毫不忌讳。我不信怪力乱神、不信吉日凶日、不信星座星象、不信姓名笔画、不信塔罗塔不罗……当年我鬼月买房，人或有言，我说鬼都怕我。我怕什么？我的思想多么新，相对的，别人看来很新很年轻，其实思想极旧极腐朽，往往21世纪的人，却是11世纪、1世纪乃至公元前1世纪的头脑，妖妄迷信，不可胜数，我漂亮的前妻就是其中之一。她的大脑跟她的脸蛋全不相配，可叹哉。
007.绝无仅有的选举方式.txt	3	5566	虽然参选立委，说起来也不无理由，但是逍遥在外的我，还得靠有人催促，才起歹念。催促的人是陈境圳，我在东吴大学教书时的旁听生，经他提议，我就玩起来了。本无所谓竞选，也无所谓团队，我拿出10万元交给陈文茜的漂亮秘书Vicky（李姿仪），就这样启动了。在王祥基的办公室，由祥基指挥主持。他是我的哥们儿，是我在凤凰卫视《李敖有话说》的制作人，一起折腾的还有阙聪华、张书铭（我的老友成阳印刷厂张坤山之子兼小老板），还有“清客”赖岳忠——我的“御用”摄影师。台北市警察局怕出事，依法派来小常（常修治）、小蔡（蔡志煌）两位保护我。小常是2000年我选所谓总统时的旧识，见我没有交通工具，开来一辆奔驰轿车，车牌“5566”，就是美国球王迈克尔·乔丹（Michael Jordan）到台湾使用的那辆，我不愿资本家对我这么好，就谢绝了。交通工具，我都坐出租车。偶尔坐王祥基的，亦奔驰也。开票那天，陈文茜约我上飞碟电台节目，路上祥基表演飞车特技，一边开车，一边电话...
007.绝无仅有的选举方式.txt	3	报佳音	虽然参选立委，说起来也不无理由，但是逍遥在外的我，还得靠有人催促，才起歹念。催促的人是陈境圳，我在东吴大学教书时的旁听生，经他提议，我就玩起来了。本无所谓竞选，也无所谓团队，我拿出10万元交给陈文茜的漂亮秘书Vicky（李姿仪），就这样启动了。在王祥基的办公室，由祥基指挥主持。他是我的哥们儿，是我在凤凰卫视《李敖有话说》的制作人，一起折腾的还有阙聪华、张书铭（我的老友成阳印刷厂张坤山之子兼小老板），还有“清客”赖岳忠——我的“御用”摄影师。台北市警察局怕出事，依法派来小常（常修治）、小蔡（蔡志煌）两位保护我。小常是2000年我选所谓总统时的旧识，见我没有交通工具，开来一辆奔驰轿车，车牌“5566”，就是美国球王迈克尔·乔丹（Michael Jordan）到台湾使用的那辆，我不愿资本家对我这么好，就谢绝了。交通工具，我都坐出租车。偶尔坐王祥基的，亦奔驰也。开票那天，陈文茜约我上飞碟电台节目，路上祥基表演飞车特技，一边开车，一边电话...
007.绝无仅有的选举方式.txt	3	国家领导人	虽然参选立委，说起来也不无理由，但是逍遥在外的我，还得靠有人催促，才起歹念。催促的人是陈境圳，我在东吴大学教书时的旁听生，经他提议，我就玩起来了。本无所谓竞选，也无所谓团队，我拿出10万元交给陈文茜的漂亮秘书Vicky（李姿仪），就这样启动了。在王祥基的办公室，由祥基指挥主持。他是我的哥们儿，是我在凤凰卫视《李敖有话说》的制作人，一起折腾的还有阙聪华、张书铭（我的老友成阳印刷厂张坤山之子兼小老板），还有“清客”赖岳忠——我的“御用”摄影师。台北市警察局怕出事，依法派来小常（常修治）、小蔡（蔡志煌）两位保护我。小常是2000年我选所谓总统时的旧识，见我没有交通工具，开来一辆奔驰轿车，车牌“5566”，就是美国球王迈克尔·乔丹（Michael Jordan）到台湾使用的那辆，我不愿资本家对我这么好，就谢绝了。交通工具，我都坐出租车。偶尔坐王祥基的，亦奔驰也。开票那天，陈文茜约我上飞碟电台节目，路上祥基表演飞车特技，一边开车，一边电话...
008.从参选到上台.txt	15	李敖是我的偶像	2005年3月20日《联合报》上，有李文仪谈话，说“李敖是我的偶像”云云。我的感想是：Jennifer（李文仪）是迷人的女人，可惜总是交错了男朋友。
011.王闿运的身影.txt	9	逍遥通世法	他在1916年（中华民国五年）死去，死后，他的学生杨度挽联说他以“圣人”之才，“逍遥通世法”，我到伪政府的立法院，王闿运的身影每每笑傲而出。此公倚老卖老，目无余子，哪有什么中华民国、什么民国总统那类狗东西，但他既然时来错遇，也就“逍遥通世法”以作弄之。基调是“逍遥”，是“通”达。这一基调，在我身上大神附体起来，构成我在伪政府立法院的基调，平上去入、起承转合、得心应手、从吾所好，或好戏连台、或歹戏拖棚，全都随我高兴，玩世之情，不可掩也。大观“李委员”动态，必须闿运运之，方得圣解，否则只是浅人识见，不足以知圣人也。
011.王闿运的身影.txt	9	李委员	他在1916年（中华民国五年）死去，死后，他的学生杨度挽联说他以“圣人”之才，“逍遥通世法”，我到伪政府的立法院，王闿运的身影每每笑傲而出。此公倚老卖老，目无余子，哪有什么中华民国、什么民国总统那类狗东西，但他既然时来错遇，也就“逍遥通世法”以作弄之。基调是“逍遥”，是“通”达。这一基调，在我身上大神附体起来，构成我在伪政府立法院的基调，平上去入、起承转合、得心应手、从吾所好，或好戏连台、或歹戏拖棚，全都随我高兴，玩世之情，不可掩也。大观“李委员”动态，必须闿运运之，方得圣解，否则只是浅人识见，不足以知圣人也。
013.我拒绝向孙中山宣誓.txt	15	是一名医生，现在茂宜（Maui）岛的姑剌（Kula）地方行医。	二、孙中山说他“是一名医生，现在茂宜（Maui）岛的姑剌（Kula）地方行医。”事实上，孙中山在行医上，已“此道荒疏”（见冯自由《革命逸史》二集《孙眉公传略》），他当时并无正式行医的事实。说在茂宜岛的姑剌地方行医云云，全是谎话。
013.我拒绝向孙中山宣誓.txt	15	此道荒疏	二、孙中山说他“是一名医生，现在茂宜（Maui）岛的姑剌（Kula）地方行医。”事实上，孙中山在行医上，已“此道荒疏”（见冯自由《革命逸史》二集《孙眉公传略》），他当时并无正式行医的事实。说在茂宜岛的姑剌地方行医云云，全是谎话。
018.我告诉你，就是狗.txt	15	老兵永远不死，只是凋谢。	麦克阿瑟下台后到国会所作的演讲，大都被引证错误，一般人认为麦克阿瑟曾说：“老兵永远不死，只是凋谢。”其实麦克阿瑟没有讲过这句话，他引证的是当年西点军校的军歌。老兵永远不死，现在更变成“立法委员”站在这里，那就是此刻的本席，今天我要告诉各位的是，我们可不可以从另外一个角度面对这个问题，如果不用付钱就可拿到美国人的武器，不是皆大欢喜吗？我们是美国“第一岛链”的最前线，是美国人的看门狗，看门狗买骨头，还要自己花钱吗？
018.我告诉你，就是狗.txt	15	立法委员	麦克阿瑟下台后到国会所作的演讲，大都被引证错误，一般人认为麦克阿瑟曾说：“老兵永远不死，只是凋谢。”其实麦克阿瑟没有讲过这句话，他引证的是当年西点军校的军歌。老兵永远不死，现在更变成“立法委员”站在这里，那就是此刻的本席，今天我要告诉各位的是，我们可不可以从另外一个角度面对这个问题，如果不用付钱就可拿到美国人的武器，不是皆大欢喜吗？我们是美国“第一岛链”的最前线，是美国人的看门狗，看门狗买骨头，还要自己花钱吗？
018.我告诉你，就是狗.txt	15	第一岛链	麦克阿瑟下台后到国会所作的演讲，大都被引证错误，一般人认为麦克阿瑟曾说：“老兵永远不死，只是凋谢。”其实麦克阿瑟没有讲过这句话，他引证的是当年西点军校的军歌。老兵永远不死，现在更变成“立法委员”站在这里，那就是此刻的本席，今天我要告诉各位的是，我们可不可以从另外一个角度面对这个问题，如果不用付钱就可拿到美国人的武器，不是皆大欢喜吗？我们是美国“第一岛链”的最前线，是美国人的看门狗，看门狗买骨头，还要自己花钱吗？
019.我闻过他们的臭脚.txt	15	行政院国军退除役官兵辅导委员	过去我在当排长的时候，老兵都会写遗嘱，有一位老兵表示，我什么财产都没有，只有留下一双新的袜子，我死后要送给蒋总统，后来指导员来了之后表示，你怎么这样侮辱蒋总统？怎么把一双袜子送给蒋总统？这位老兵说，你们整天说总统是我们的家长，而我的遗产就是一双袜子，我死了就把它送给家长，这样有什么不对？此外，当时蒋经国是总政战部主任，蒋经国曾对一位老兵说，你到军中乐园肏姑娘为什么不戴保险套而得性病了？老兵说，报告主任，我不愿意穿着袜子洗脚，所以我不要戴套子。我举出这个故事给你听，这都是血泪交织的故事，他们宁可冒着性病的危险还是不要戴保险套。为什么会这样？这是因为他们没有指望，蒋介石、蒋经国让他断子绝孙了，因为他们没有指望，他们不能结婚，不是吗？今天他们好不容易存一点点钱能够买到一个大陆老婆回来，过去是买高山族的老婆，现在是买大陆的老婆回来，连身份都这样被刁难，各位实在太年轻了，你们没有真的接触过老兵的痛苦，你们可以帮着政府保护这些财产或财团化，...
021.上将割屌记.txt	29	一闪一闪亮晶晶，满天都是‘小鸡鸡’	李委员敖：事实上，我们表达决心有很多种方法，当年明朝宦官魏忠贤是拿刀割下自己的LP以表达自己的决心。我告诉你一个故事，当年我小儿子年幼时，将《小星星》的歌词改编为“一闪一闪亮晶晶，满天都是‘小鸡鸡’”。今天前来国防委员会，我看到在座都是大将军，所以这应该是满天都是“大星星”。你们有没有考虑割下LP以展现自己的决心？本席绝不是在开玩笑，韩国人切下手指头以表达抗日的决心。为什么你们不能割下LP？请部长答复yes or no。
021.上将割屌记.txt	29	大星星	李委员敖：事实上，我们表达决心有很多种方法，当年明朝宦官魏忠贤是拿刀割下自己的LP以表达自己的决心。我告诉你一个故事，当年我小儿子年幼时，将《小星星》的歌词改编为“一闪一闪亮晶晶，满天都是‘小鸡鸡’”。今天前来国防委员会，我看到在座都是大将军，所以这应该是满天都是“大星星”。你们有没有考虑割下LP以展现自己的决心？本席绝不是在开玩笑，韩国人切下手指头以表达抗日的决心。为什么你们不能割下LP？请部长答复yes or no。
022.我高潮，你刹车.txt	9	Give the devil his due.	刚才林委员引证了一句英文谚语，叫做“Give the devil his due.”你的会是什么会呢？你的会应该是“魔鬼委员会”，行政院部会都有自己的职责，好比客委会要保护客家人，青辅会要保护青年人，严格来说，陆委会应该要保护内地、关切内地，但就本席的感觉，却认为事实正好相反。
022.我高潮，你刹车.txt	9	魔鬼委员会	刚才林委员引证了一句英文谚语，叫做“Give the devil his due.”你的会是什么会呢？你的会应该是“魔鬼委员会”，行政院部会都有自己的职责，好比客委会要保护客家人，青辅会要保护青年人，严格来说，陆委会应该要保护内地、关切内地，但就本席的感觉，却认为事实正好相反。
023.应该去跟妇产科医生讲.txt	7	我不恨你对我说谎，可是我恨你对我说粗糙的谎话	李委员敖：主席、各位列席官员、各位同仁。听到前一位委员的质询，本席必须说我对国防不内行，可是我对捣乱很内行，今天本席想要谈一点原则性的问题。英国有两位同名的作家，包括一个16世纪的，一个是19世纪末20世纪初的，后者讲了一句名言，就是“我不恨你对我说谎，可是我恨你对我说粗糙的谎话”。你用粗糙的谎话骗我的时候，你不但对我说谎，还把我当傻瓜。现在的问题是，我们看到刑警局和阿扁，都在说粗糙的谎话，至于“国防部”的谎话就细腻得多，做了那么多的表格，但是代表着这都是谎话。
023.应该去跟妇产科医生讲.txt	7	国防部	李委员敖：主席、各位列席官员、各位同仁。听到前一位委员的质询，本席必须说我对国防不内行，可是我对捣乱很内行，今天本席想要谈一点原则性的问题。英国有两位同名的作家，包括一个16世纪的，一个是19世纪末20世纪初的，后者讲了一句名言，就是“我不恨你对我说谎，可是我恨你对我说粗糙的谎话”。你用粗糙的谎话骗我的时候，你不但对我说谎，还把我当傻瓜。现在的问题是，我们看到刑警局和阿扁，都在说粗糙的谎话，至于“国防部”的谎话就细腻得多，做了那么多的表格，但是代表着这都是谎话。
