file	line	text	reason	context
012.第十一章——舍生.txt	115	谭先生的心意，我们全明白。	modern-political-news-context	“谭先生的心意，我们全明白。”来人说。“黄轸兄派我们来以前，已经同我们说得很清楚。黄轸兄说，当时他反对谭先生北上，要谭先生东渡日本，一同走革命的路子，但谭先生认为中国太弱了，底子太差，革命的方法像给病人吃重药，不一定对中国有利，也不一定成功。如果有缓和的路子，也不要失掉派人一试的机会。北京既然有机会，总不该失去，所以谭先生自己愿意深入虎穴，或跳这个火坑。黄轸兄说他完全了解谭先生和他是殊途同归，谭先生不论走哪条路、不论怎么走法，大家都是同志。只是今天眼看北上这条路走不通了，黄轸兄怕谭先生做无谓的牺牲，所以特派小弟们来接谭先生南下。这条路既走不通，再留在北京，已无意义。请谭先生体谅黄轸兄的一番心意和小弟们走这一趟的目的，不要再说了，先动身再说吧！”
012.第十一章——舍生.txt	131	不要紧，只是昏了过去。这些革命党，只会革命，功夫却不敢领教，一碰就完了！	modern-political-news-context	“不要紧，只是昏了过去。这些革命党，只会革命，功夫却不敢领教，一碰就完了！”
012.第十一章——舍生.txt	207	台湾人所著书	modern-political-news-context	常兄大鉴：弟冲决网罗，著《仁学》以付卓如，朝布道，夕死可矣！《仁学》题以“台湾人所著书”，假台人抒愤，意在亡国之民，不忘宗周之陨。前致书我兄，勉以“吾党其努力为亡后之图”，意谓“国亡，而人犹在也”。今转而思之，我亡，而国犹在也。我亡，则中国不亡。嗣同死矣！改良之道，当随我以去；吾兄宜约轸兄东渡，以革命策来兹也。临颖神驰，复生绝笔。戊戌八月九日，于莽苍苍斋。
012.第十一章——舍生.txt	207	吾党其努力为亡后之图	modern-political-news-context	常兄大鉴：弟冲决网罗，著《仁学》以付卓如，朝布道，夕死可矣！《仁学》题以“台湾人所著书”，假台人抒愤，意在亡国之民，不忘宗周之陨。前致书我兄，勉以“吾党其努力为亡后之图”，意谓“国亡，而人犹在也”。今转而思之，我亡，而国犹在也。我亡，则中国不亡。嗣同死矣！改良之道，当随我以去；吾兄宜约轸兄东渡，以革命策来兹也。临颖神驰，复生绝笔。戊戌八月九日，于莽苍苍斋。
012.第十一章——舍生.txt	207	国亡，而人犹在也	modern-political-news-context	常兄大鉴：弟冲决网罗，著《仁学》以付卓如，朝布道，夕死可矣！《仁学》题以“台湾人所著书”，假台人抒愤，意在亡国之民，不忘宗周之陨。前致书我兄，勉以“吾党其努力为亡后之图”，意谓“国亡，而人犹在也”。今转而思之，我亡，而国犹在也。我亡，则中国不亡。嗣同死矣！改良之道，当随我以去；吾兄宜约轸兄东渡，以革命策来兹也。临颖神驰，复生绝笔。戊戌八月九日，于莽苍苍斋。
013.第十二章——从监牢到法场.txt	11	大隈重信首相正式宣布，清国变法维新志士梁启超君在日本国民的道义协助下，已安抵日本。	modern-political-news-context	一星期后，八位日本人乘大岛军舰到达了日本。日本报纸头条报导着：“大隈重信首相正式宣布，清国变法维新志士梁启超君在日本国民的道义协助下，已安抵日本。”
013.第十二章——从监牢到法场.txt	109	老同年	modern-political-news-context	由于张荫桓是有名的大官，气焰又盛，他在刑部狱里，倒比别人拉风得多。这时他六十二岁了，他在官场打滚几十年，什么黑暗都见过，在黑暗里，他以部分玩世的从容，面对着世事的波谲云诡，也颇能自解、自得和自脱。但是这次，他仿佛感到自脱不得了，但他仍达观得不太介意。他虽在清朝中央政府中做了大官，实际上，几乎已是外相、外交部长的身分，但他并不是科举出身。在几乎人人科举出身的官场里，显得非常刺眼与索寞。科举出身的讲究梯次，同一年考取的叫“老同年”、先前考取的叫“老前辈”，在办公场所、在大庭广众，到处是“老同年”、“老前辈”称呼得此起彼落，把他窘在一旁。但是张荫桓却别有自嘲嘲人之道。他找来三个名戏子：秦稚芬、王瑶卿、朱霞芬，叫她们戏称他做“老前辈”，他自己戏称她们叫“老同年”，以为反讽。如今，他身陷牢里，角色换了，所有先他坐牢的，都成了“老前辈”；所有与他同时坐牢的，都变成了“老同年”，他寻思起来，不禁好笑。
013.第十二章——从监牢到法场.txt	109	老前辈	modern-political-news-context	由于张荫桓是有名的大官，气焰又盛，他在刑部狱里，倒比别人拉风得多。这时他六十二岁了，他在官场打滚几十年，什么黑暗都见过，在黑暗里，他以部分玩世的从容，面对着世事的波谲云诡，也颇能自解、自得和自脱。但是这次，他仿佛感到自脱不得了，但他仍达观得不太介意。他虽在清朝中央政府中做了大官，实际上，几乎已是外相、外交部长的身分，但他并不是科举出身。在几乎人人科举出身的官场里，显得非常刺眼与索寞。科举出身的讲究梯次，同一年考取的叫“老同年”、先前考取的叫“老前辈”，在办公场所、在大庭广众，到处是“老同年”、“老前辈”称呼得此起彼落，把他窘在一旁。但是张荫桓却别有自嘲嘲人之道。他找来三个名戏子：秦稚芬、王瑶卿、朱霞芬，叫她们戏称他做“老前辈”，他自己戏称她们叫“老同年”，以为反讽。如今，他身陷牢里，角色换了，所有先他坐牢的，都成了“老前辈”；所有与他同时坐牢的，都变成了“老同年”，他寻思起来，不禁好笑。
013.第十二章——从监牢到法场.txt	111	京师里头有顺天府尹的直辖监狱、有五城御史的司坊，为什么刑部的监狱还关着这么多囚犯？	modern-political-news-context	他虽不是科举出身，书却念得极好，很多古文他都背得烂熟。在无聊中以背古文自遣，背到方苞那篇《狱中杂记》，他忽然大有所悟。近一百九十年前，清朝大学者方苞被判死刑，关在牢里，那个牢，不正是这座刑部狱吗？方苞后来被赦出狱，写的那篇《狱中杂记》，所写的内容，岂不还流传到眼前吗？方苞写监狱黑暗，写这监狱一共有四座老监房。每座监房有五个房间：狱卒住在当中的一间，前面有大窗通光线，屋前有小窗透空气；其余的四个房间都没有窗，可是关的犯人经常有两百多。每天天还没黑，就上锁了，大小便都在房间里，和吃饭喝水的气味混在一道。加上寒冬腊月，没钱的犯人睡在地上，等到春气一动，没有不发病的。往往一死就死上十来个。监狱的规矩，一定要等天亮才开锁，整个晚上，活人和死人就头靠头脚对脚的睡着，没法闪躲，这便是传染病多的原因。还有奇怪的是：凡属大盗累犯或杀人要犯，大概由于气质强悍旺盛，反倒被传染上的不到十分之一二；纵使传染上，也很快就好了。那接二连三死掉的，却都是些案子...
013.第十二章——从监牢到法场.txt	111	斯罗	modern-political-news-context	他虽不是科举出身，书却念得极好，很多古文他都背得烂熟。在无聊中以背古文自遣，背到方苞那篇《狱中杂记》，他忽然大有所悟。近一百九十年前，清朝大学者方苞被判死刑，关在牢里，那个牢，不正是这座刑部狱吗？方苞后来被赦出狱，写的那篇《狱中杂记》，所写的内容，岂不还流传到眼前吗？方苞写监狱黑暗，写这监狱一共有四座老监房。每座监房有五个房间：狱卒住在当中的一间，前面有大窗通光线，屋前有小窗透空气；其余的四个房间都没有窗，可是关的犯人经常有两百多。每天天还没黑，就上锁了，大小便都在房间里，和吃饭喝水的气味混在一道。加上寒冬腊月，没钱的犯人睡在地上，等到春气一动，没有不发病的。往往一死就死上十来个。监狱的规矩，一定要等天亮才开锁，整个晚上，活人和死人就头靠头脚对脚的睡着，没法闪躲，这便是传染病多的原因。还有奇怪的是：凡属大盗累犯或杀人要犯，大概由于气质强悍旺盛，反倒被传染上的不到十分之一二；纵使传染上，也很快就好了。那接二连三死掉的，却都是些案子...
013.第十二章——从监牢到法场.txt	111	答应了我的条件，便先刺心；不然的话，四肢解完，心还没死。	modern-political-news-context	他虽不是科举出身，书却念得极好，很多古文他都背得烂熟。在无聊中以背古文自遣，背到方苞那篇《狱中杂记》，他忽然大有所悟。近一百九十年前，清朝大学者方苞被判死刑，关在牢里，那个牢，不正是这座刑部狱吗？方苞后来被赦出狱，写的那篇《狱中杂记》，所写的内容，岂不还流传到眼前吗？方苞写监狱黑暗，写这监狱一共有四座老监房。每座监房有五个房间：狱卒住在当中的一间，前面有大窗通光线，屋前有小窗透空气；其余的四个房间都没有窗，可是关的犯人经常有两百多。每天天还没黑，就上锁了，大小便都在房间里，和吃饭喝水的气味混在一道。加上寒冬腊月，没钱的犯人睡在地上，等到春气一动，没有不发病的。往往一死就死上十来个。监狱的规矩，一定要等天亮才开锁，整个晚上，活人和死人就头靠头脚对脚的睡着，没法闪躲，这便是传染病多的原因。还有奇怪的是：凡属大盗累犯或杀人要犯，大概由于气质强悍旺盛，反倒被传染上的不到十分之一二；纵使传染上，也很快就好了。那接二连三死掉的，却都是些案子...
013.第十二章——从监牢到法场.txt	111	答应了我的条件，第一绞便包断气；不然的话，绞你三次以后还须加用别的刑具，才死得了。	modern-political-news-context	他虽不是科举出身，书却念得极好，很多古文他都背得烂熟。在无聊中以背古文自遣，背到方苞那篇《狱中杂记》，他忽然大有所悟。近一百九十年前，清朝大学者方苞被判死刑，关在牢里，那个牢，不正是这座刑部狱吗？方苞后来被赦出狱，写的那篇《狱中杂记》，所写的内容，岂不还流传到眼前吗？方苞写监狱黑暗，写这监狱一共有四座老监房。每座监房有五个房间：狱卒住在当中的一间，前面有大窗通光线，屋前有小窗透空气；其余的四个房间都没有窗，可是关的犯人经常有两百多。每天天还没黑，就上锁了，大小便都在房间里，和吃饭喝水的气味混在一道。加上寒冬腊月，没钱的犯人睡在地上，等到春气一动，没有不发病的。往往一死就死上十来个。监狱的规矩，一定要等天亮才开锁，整个晚上，活人和死人就头靠头脚对脚的睡着，没法闪躲，这便是传染病多的原因。还有奇怪的是：凡属大盗累犯或杀人要犯，大概由于气质强悍旺盛，反倒被传染上的不到十分之一二；纵使传染上，也很快就好了。那接二连三死掉的，却都是些案子...
013.第十二章——从监牢到法场.txt	111	大家对受刑受绑的既没什么深仇大恨，目的只不过希望弄点钱而已；犯人果真拿不出钱，最后又何妨放人一马，不也算积德吗？	modern-political-news-context	他虽不是科举出身，书却念得极好，很多古文他都背得烂熟。在无聊中以背古文自遣，背到方苞那篇《狱中杂记》，他忽然大有所悟。近一百九十年前，清朝大学者方苞被判死刑，关在牢里，那个牢，不正是这座刑部狱吗？方苞后来被赦出狱，写的那篇《狱中杂记》，所写的内容，岂不还流传到眼前吗？方苞写监狱黑暗，写这监狱一共有四座老监房。每座监房有五个房间：狱卒住在当中的一间，前面有大窗通光线，屋前有小窗透空气；其余的四个房间都没有窗，可是关的犯人经常有两百多。每天天还没黑，就上锁了，大小便都在房间里，和吃饭喝水的气味混在一道。加上寒冬腊月，没钱的犯人睡在地上，等到春气一动，没有不发病的。往往一死就死上十来个。监狱的规矩，一定要等天亮才开锁，整个晚上，活人和死人就头靠头脚对脚的睡着，没法闪躲，这便是传染病多的原因。还有奇怪的是：凡属大盗累犯或杀人要犯，大概由于气质强悍旺盛，反倒被传染上的不到十分之一二；纵使传染上，也很快就好了。那接二连三死掉的，却都是些案子...
013.第十二章——从监牢到法场.txt	111	这是因为要立下规矩以警告旁的犯人、并警告后来的犯人的缘故。如果不这样，便人人都心存侥幸了。	modern-political-news-context	他虽不是科举出身，书却念得极好，很多古文他都背得烂熟。在无聊中以背古文自遣，背到方苞那篇《狱中杂记》，他忽然大有所悟。近一百九十年前，清朝大学者方苞被判死刑，关在牢里，那个牢，不正是这座刑部狱吗？方苞后来被赦出狱，写的那篇《狱中杂记》，所写的内容，岂不还流传到眼前吗？方苞写监狱黑暗，写这监狱一共有四座老监房。每座监房有五个房间：狱卒住在当中的一间，前面有大窗通光线，屋前有小窗透空气；其余的四个房间都没有窗，可是关的犯人经常有两百多。每天天还没黑，就上锁了，大小便都在房间里，和吃饭喝水的气味混在一道。加上寒冬腊月，没钱的犯人睡在地上，等到春气一动，没有不发病的。往往一死就死上十来个。监狱的规矩，一定要等天亮才开锁，整个晚上，活人和死人就头靠头脚对脚的睡着，没法闪躲，这便是传染病多的原因。还有奇怪的是：凡属大盗累犯或杀人要犯，大概由于气质强悍旺盛，反倒被传染上的不到十分之一二；纵使传染上，也很快就好了。那接二连三死掉的，却都是些案子...
013.第十二章——从监牢到法场.txt	111	犯人有的阔有的穷，既然大家都拿了钱，又何必更拿多少作分别？	modern-political-news-context	他虽不是科举出身，书却念得极好，很多古文他都背得烂熟。在无聊中以背古文自遣，背到方苞那篇《狱中杂记》，他忽然大有所悟。近一百九十年前，清朝大学者方苞被判死刑，关在牢里，那个牢，不正是这座刑部狱吗？方苞后来被赦出狱，写的那篇《狱中杂记》，所写的内容，岂不还流传到眼前吗？方苞写监狱黑暗，写这监狱一共有四座老监房。每座监房有五个房间：狱卒住在当中的一间，前面有大窗通光线，屋前有小窗透空气；其余的四个房间都没有窗，可是关的犯人经常有两百多。每天天还没黑，就上锁了，大小便都在房间里，和吃饭喝水的气味混在一道。加上寒冬腊月，没钱的犯人睡在地上，等到春气一动，没有不发病的。往往一死就死上十来个。监狱的规矩，一定要等天亮才开锁，整个晚上，活人和死人就头靠头脚对脚的睡着，没法闪躲，这便是传染病多的原因。还有奇怪的是：凡属大盗累犯或杀人要犯，大概由于气质强悍旺盛，反倒被传染上的不到十分之一二；纵使传染上，也很快就好了。那接二连三死掉的，却都是些案子...
013.第十二章——从监牢到法场.txt	111	没有分别，谁愿意多出钱？	modern-political-news-context	他虽不是科举出身，书却念得极好，很多古文他都背得烂熟。在无聊中以背古文自遣，背到方苞那篇《狱中杂记》，他忽然大有所悟。近一百九十年前，清朝大学者方苞被判死刑，关在牢里，那个牢，不正是这座刑部狱吗？方苞后来被赦出狱，写的那篇《狱中杂记》，所写的内容，岂不还流传到眼前吗？方苞写监狱黑暗，写这监狱一共有四座老监房。每座监房有五个房间：狱卒住在当中的一间，前面有大窗通光线，屋前有小窗透空气；其余的四个房间都没有窗，可是关的犯人经常有两百多。每天天还没黑，就上锁了，大小便都在房间里，和吃饭喝水的气味混在一道。加上寒冬腊月，没钱的犯人睡在地上，等到春气一动，没有不发病的。往往一死就死上十来个。监狱的规矩，一定要等天亮才开锁，整个晚上，活人和死人就头靠头脚对脚的睡着，没法闪躲，这便是传染病多的原因。还有奇怪的是：凡属大盗累犯或杀人要犯，大概由于气质强悍旺盛，反倒被传染上的不到十分之一二；纵使传染上，也很快就好了。那接二连三死掉的，却都是些案子...
013.第十二章——从监牢到法场.txt	111	给我一千两银子，我弄活你们。	modern-political-news-context	他虽不是科举出身，书却念得极好，很多古文他都背得烂熟。在无聊中以背古文自遣，背到方苞那篇《狱中杂记》，他忽然大有所悟。近一百九十年前，清朝大学者方苞被判死刑，关在牢里，那个牢，不正是这座刑部狱吗？方苞后来被赦出狱，写的那篇《狱中杂记》，所写的内容，岂不还流传到眼前吗？方苞写监狱黑暗，写这监狱一共有四座老监房。每座监房有五个房间：狱卒住在当中的一间，前面有大窗通光线，屋前有小窗透空气；其余的四个房间都没有窗，可是关的犯人经常有两百多。每天天还没黑，就上锁了，大小便都在房间里，和吃饭喝水的气味混在一道。加上寒冬腊月，没钱的犯人睡在地上，等到春气一动，没有不发病的。往往一死就死上十来个。监狱的规矩，一定要等天亮才开锁，整个晚上，活人和死人就头靠头脚对脚的睡着，没法闪躲，这便是传染病多的原因。还有奇怪的是：凡属大盗累犯或杀人要犯，大概由于气质强悍旺盛，反倒被传染上的不到十分之一二；纵使传染上，也很快就好了。那接二连三死掉的，却都是些案子...
013.第十二章——从监牢到法场.txt	111	这不难，只消另具奏本，判词不必更改，只把案末单身没有亲戚的两个人换掉你们的名字，等到封奏时候，抽出真奏，换上此奏，就行了。	modern-political-news-context	他虽不是科举出身，书却念得极好，很多古文他都背得烂熟。在无聊中以背古文自遣，背到方苞那篇《狱中杂记》，他忽然大有所悟。近一百九十年前，清朝大学者方苞被判死刑，关在牢里，那个牢，不正是这座刑部狱吗？方苞后来被赦出狱，写的那篇《狱中杂记》，所写的内容，岂不还流传到眼前吗？方苞写监狱黑暗，写这监狱一共有四座老监房。每座监房有五个房间：狱卒住在当中的一间，前面有大窗通光线，屋前有小窗透空气；其余的四个房间都没有窗，可是关的犯人经常有两百多。每天天还没黑，就上锁了，大小便都在房间里，和吃饭喝水的气味混在一道。加上寒冬腊月，没钱的犯人睡在地上，等到春气一动，没有不发病的。往往一死就死上十来个。监狱的规矩，一定要等天亮才开锁，整个晚上，活人和死人就头靠头脚对脚的睡着，没法闪躲，这便是传染病多的原因。还有奇怪的是：凡属大盗累犯或杀人要犯，大概由于气质强悍旺盛，反倒被传染上的不到十分之一二；纵使传染上，也很快就好了。那接二连三死掉的，却都是些案子...
013.第十二章——从监牢到法场.txt	111	这样办可以欺蒙死的，却不能欺蒙长官；假使长官发觉，再行申请，我们都没活路了。	modern-political-news-context	他虽不是科举出身，书却念得极好，很多古文他都背得烂熟。在无聊中以背古文自遣，背到方苞那篇《狱中杂记》，他忽然大有所悟。近一百九十年前，清朝大学者方苞被判死刑，关在牢里，那个牢，不正是这座刑部狱吗？方苞后来被赦出狱，写的那篇《狱中杂记》，所写的内容，岂不还流传到眼前吗？方苞写监狱黑暗，写这监狱一共有四座老监房。每座监房有五个房间：狱卒住在当中的一间，前面有大窗通光线，屋前有小窗透空气；其余的四个房间都没有窗，可是关的犯人经常有两百多。每天天还没黑，就上锁了，大小便都在房间里，和吃饭喝水的气味混在一道。加上寒冬腊月，没钱的犯人睡在地上，等到春气一动，没有不发病的。往往一死就死上十来个。监狱的规矩，一定要等天亮才开锁，整个晚上，活人和死人就头靠头脚对脚的睡着，没法闪躲，这便是传染病多的原因。还有奇怪的是：凡属大盗累犯或杀人要犯，大概由于气质强悍旺盛，反倒被传染上的不到十分之一二；纵使传染上，也很快就好了。那接二连三死掉的，却都是些案子...
013.第十二章——从监牢到法场.txt	111	再行申请，我们固然没活路；但长官也必定以失察见罪、连带免官。他不会只为两条人命把自己的官丢掉的，那么，我们最后还是没有死的理由的。	modern-political-news-context	他虽不是科举出身，书却念得极好，很多古文他都背得烂熟。在无聊中以背古文自遣，背到方苞那篇《狱中杂记》，他忽然大有所悟。近一百九十年前，清朝大学者方苞被判死刑，关在牢里，那个牢，不正是这座刑部狱吗？方苞后来被赦出狱，写的那篇《狱中杂记》，所写的内容，岂不还流传到眼前吗？方苞写监狱黑暗，写这监狱一共有四座老监房。每座监房有五个房间：狱卒住在当中的一间，前面有大窗通光线，屋前有小窗透空气；其余的四个房间都没有窗，可是关的犯人经常有两百多。每天天还没黑，就上锁了，大小便都在房间里，和吃饭喝水的气味混在一道。加上寒冬腊月，没钱的犯人睡在地上，等到春气一动，没有不发病的。往往一死就死上十来个。监狱的规矩，一定要等天亮才开锁，整个晚上，活人和死人就头靠头脚对脚的睡着，没法闪躲，这便是传染病多的原因。还有奇怪的是：凡属大盗累犯或杀人要犯，大概由于气质强悍旺盛，反倒被传染上的不到十分之一二；纵使传染上，也很快就好了。那接二连三死掉的，却都是些案子...
013.第十二章——从监牢到法场.txt	111	这便是把某某人的命换来他们的头的。	modern-political-news-context	他虽不是科举出身，书却念得极好，很多古文他都背得烂熟。在无聊中以背古文自遣，背到方苞那篇《狱中杂记》，他忽然大有所悟。近一百九十年前，清朝大学者方苞被判死刑，关在牢里，那个牢，不正是这座刑部狱吗？方苞后来被赦出狱，写的那篇《狱中杂记》，所写的内容，岂不还流传到眼前吗？方苞写监狱黑暗，写这监狱一共有四座老监房。每座监房有五个房间：狱卒住在当中的一间，前面有大窗通光线，屋前有小窗透空气；其余的四个房间都没有窗，可是关的犯人经常有两百多。每天天还没黑，就上锁了，大小便都在房间里，和吃饭喝水的气味混在一道。加上寒冬腊月，没钱的犯人睡在地上，等到春气一动，没有不发病的。往往一死就死上十来个。监狱的规矩，一定要等天亮才开锁，整个晚上，活人和死人就头靠头脚对脚的睡着，没法闪躲，这便是传染病多的原因。还有奇怪的是：凡属大盗累犯或杀人要犯，大概由于气质强悍旺盛，反倒被传染上的不到十分之一二；纵使传染上，也很快就好了。那接二连三死掉的，却都是些案子...
