file	line	context
013.刻薄的批评与正直的建议.txt	13	还有，关于你对我和徐复观打官司的“批评”（“正直的建议”），我也要说你仍然是中了传统中“戒讼观念”的毒。你该知道一个进步的社会，必须有赖于法治、有赖于大家对法律的信任。中国过去太偏重人治和礼治，所以搅得乱七八糟，毫无客观可循的是非与体统，也毫不实际。你信中所谓的“文人竟不知自爱，不能宽大为怀，多具容忍的气度”三点，在一个有现代法治观念的人面前，都是“碰不到头”的论调。所以我说，你的“正直的建议”固然很令人感谢，但是在方法学上和基点观念上，却根本“碰不到头”。上面这些话，我说得 很“刻薄”，请你别见怪。
014.眼看黑暗到来，又目送黑暗归去.txt	21	也许你们笑我吹牛，当我告诉你们我不太在乎牢狱。牢狱最可怕的地方不在third-degree，而在一种难受的寂寞生涯。李敖今日所过的生活，跟古代人所谓的“画地为牢”又有多少不同？我好像是一个做“坐牢准备动作”、“坐牢预习”的倒霉鬼，并不够资格心安理得的做一个他妈的寓公！
015.办杂志的一些意愿.txt	5	以上所说，是专指“像样的杂志”而言，并不是指“不像样的杂志”。不像样的杂志虽然表面上雷声轰轰，无奈在实质上，只不过是聚蚊成雷。聚蚊而成的雷，不管噪音多大，毕竟是蚊，不是雷。这种杂志的出身，大都是倚靠媚世、津贴或派销而来，它们的特质是卖得便宜和暴殄文字，廉价的大文章朝你直扑，但究其内容，则不外又是“妹妹我病了”之类，办这种杂志的人，他们可能另有所“图”和别有怀“抱”，但显然不是自由文人所谓的鸿“图”和“抱”负，所以，我们还是来谈像样一点的。
015.办杂志的一些意愿.txt	7	首先，我们必须很泄气的承认，像样一点的杂志，在“文化沙漠”上，很不容易生存。有人冀望大家做沙漠中的仙人掌，其实即使成个仙人掌，除了“独留绿点向黄沙”的作用外，实在没有什么积极的意义。目前的一些所谓新作家们和新青年们，他们似乎以吟咏仙人之掌为已足，沙漠之神似乎也容忍他们如此发展，甚至把他们请到中央来定方向，拉进宣言来充指针。仙人掌是清白的，清白得正好可供沙漠之神来点缀。虽然仙人掌自己，还陶然自得的以为他们正在表现自我呢！
015.办杂志的一些意愿.txt	17	〔后记〕我离文星后，1977年7月，隐名与两个朋友办《文风》杂志，只办了一期，就遭到压力，任发行人的朋友打退堂鼓。这篇发刊词也就立刻变成安魂曲。（1978年9月6日）
016.没人能赶在台风前面.txt	3	——致《大学杂志》编者
