file	line	context
056.误信“美国来救我们”的备忘录.txt	5	二、驻美“地下大使”李大维在外交委员会向李敖也招认说：台湾变废墟，美国可能不来救台湾。依《台湾关系法》，美国会“严重关切”（grave concern）。李敖追问：“严重关切”不等于出兵。李敖举证美国参议员裴西（Charles Percy）就认为“严重关切”是不够的，要求改为“安全利益”（security interest）但是被否决了，否决理由是：用“安全...
058.“读经”梦碎.txt	15	经过明末以来朴学之进步，我们今日应该充分感觉六经之难读。汉儒之师说既不可恃，宋儒的臆想又不可凭，在今日只有妄人才敢说诗书全能了解。有声音文字训诂学训练的人是深知“多闻阙疑”“不知为不知”之重要性的。那么，今日学校读经，无异于拿些教师自己半懂不懂的东西给学生……六经虽在专门家手里也是半懂不懂的东西，一旦拿来给儿童，教者不是混沌混过，便要自欺欺人。这样的效用，究...
058.“读经”梦碎.txt	17	孟真先生这段话，无一字不是事实。只可惜这番话是很少人能懂的。今日提倡读经的人们，梦里也没有想到五经至今还只是一半懂得一半不懂得的东西。这也难怪，毛公、郑玄以下，说诗的人谁肯说《诗三百篇》有一半不可懂？王弼、韩康伯以下，说易的人谁肯说《周易》有一大半不可懂？郑玄、马融、王肃以下，说书的人谁肯说《尚书》有一半不可懂？古人且不谈，三百年中的经学家，陈奂、胡承珙、马...
058.“读经”梦碎.txt	21	《诗》、《书》为人人诵习之书，然于六艺中最难读。以弟之愚暗，于《书》所不能解者殆十之五；于《诗》，亦十之一二。此非独弟所不能解也，汉、魏以来诸大师未尝不强为之说，然其说终不可通。以是知先儒亦不能解也。（《观堂集林》卷一，《与友人论诗书中成语书》）
058.“读经”梦碎.txt	23	这是新经学开宗明义的宣言，说话的人是近代一个学问最博而方法最缜密的大师，所以说的话最有分寸，最有斤两。科学的起点在于求知，而求知的动机必须出于诚恳的承认自己知识的缺乏。古经学所以不曾走上科学的路，完全由于汉、魏以来诸大师都不肯承认古经的难懂，都要“强为之说”。南宋以后，人人认朱子、蔡沈的集传为集古今大成的定论，所以经学更荒芜了。顾炎武以下，少数学者走上了声音...
058.“读经”梦碎.txt	27	其难解之故有三：讹阙，一也（此以《尚书》为甚）。古语与今语不同，二也。古人颇用成语，其成语之意义与其中单语分别之意义又不同，三也。
058.“读经”梦碎.txt	29	唐、宋之成语，吾得由汉、魏、六朝人书解之；汉、魏之成语，吾得由周、秦人书解之。至于《诗》、《书》，则书更无古于是者。其成语之数数见者，得比较之而求其相沿之意义。否则不能赞一辞。若但合其中之单语解之，未有不龃龉者。（同上书）
058.“读经”梦碎.txt	31	王国维说的三点，第一是底本，第二是训诂，第三还是训诂。其实古经的难懂，不仅是单字，不仅是成语，还有更重要的文法问题。前人说经，都不注意古文语法，单就字面做训诂，所以处处“强为之说”，而不能满人意。王念孙、王引之父子的《经传释词》，用比较归纳的方法，指出许多前人误认的字是词（虚字），这是一大进步。但他们没有文法学的术语可用，只能用“词”“语词”“助词”“语已词...
058.“读经”梦碎.txt	33	正因为今日的工具和方法都比前人稍进步了，我们今日对于古经的了解的估计，也许比王国维先生的估计还要更小心一点，更谦卑一点。王先生说他对《诗经》不懂的有十之一二，对《尚书》有十之五。我们在今日，严格的估计，恐怕还不能有他那样的乐观。《尚书》在今日，我们恐怕还不敢说懂得了十之五。《诗经》的不懂部分，一定不止十之一二，恐怕要加到十之三四吧。这并不是因为我们比前人更笨...
058.“读经”梦碎.txt	45	这个“猷”字，古训做“道”，清代学者也无异说。但我们在今日就不能这样轻轻的放过它了。（2）又如“弗”“不”两个字，古人多不曾注意到他们的异同：但中央研究院的丁树声先生却寻出了很多的证据，写了两万多字的长文，证明这两个否定词在文法上有很大的区别。“弗”字是“不之”两字的联合省文，在汉以前这两字是从不乱用的。（3）又如《诗》、《书》里常用的“诞”字，古训作“大”...
058.“读经”梦碎.txt	57	“于以”二字，谁不认得？然而清华大学的杨树达先生指出这个“以”字应解作“何”字，就是“今王其如台”的“台”字。这样以来，我们只消在上半句加个疑问符号（？），如下例：
058.“读经”梦碎.txt	67	总而言之，古代的经典，今日正开始受科学的整理的时期，孟真先生说的“六经虽在专门家手中也是半懂不懂的东西”，真是最确当的估计。《诗》、《书》、《易》、《仪》、《礼》，固然有十之五是不能懂的，《春秋三传》也都有从头整理研究的必要；就是《论语》、《孟子》也至少有十之一二是必须经过新经学的整理的。最近一二十年中，学校废止了读经的功课，使得经书的讲授完全脱离了村学究的...
059.“推移”梦碎.txt	3	“推移”是中国思想中一个观念。《庄子》（秋水）里讲“推移”、《淮南子》（脩务训）里讲“推移”。《楚辞》（屈原·渔父）更有精彩的对话，渔父提醒屈原：
059.“推移”梦碎.txt	15	不过，这种迎上前去的人生，在一首诗里有了疑虑。记得宋朝朱熹那首《泛舟》的诗吗：
059.“推移”梦碎.txt	25	诗的大意是说，昨天晚上，江边的春水涨起来了，停泊水面的许多大船都像羽毛一样的浮起来了，回想春水没涨的时候，这些大船，我们得花多少力气去推它移它，其实我们都白花力气了，因为春水来时，大船自然而然浮起来了、自由自在航行在水上了。虽然宋朝的朱熹是道学家，他这首诗是用来比喻学道的开不开窍，本来困难重重的，一旦开了窍，就会觉得没开窍时的许多笨工夫都白下了、枉费了。因为...
059.“推移”梦碎.txt	29	不是这个意思，相反的，我正是鼓励反抗。只是告诉自己、告诉大众，反抗归反抗，但要有心理准备。“反抗”和“反抗成功”有时是两回事。俗话那句“成功不必在我”是有深意的，因为成功未必在你、未必你能看到，你看到的，反倒是不幸、是遗憾平生。
059.“推移”梦碎.txt	31	毛泽东那首《答李淑一》的《蝶恋花》词，第一句是“我失骄阳君失柳”，“骄阳”指毛的妻子杨开慧，“柳”是指李淑一的丈夫柳直荀。一般人都知道杨开慧被蒋介石的手下何键枪决的，以为柳直荀的下场也属一类。其实柳直荀是被共产党枪决的、被共产党自己人害死的。
060.“黄莺”梦碎.txt	11	中国的《诗经》说：“维鹊有巢，维鸠居之。”这句古诗后来演变出成语“鹊巢鸠居”或“鹊巢鸠占”。其实中国鸠之为鸟，实在比不上北美椋之为鸟，因为段数差一大截：占了喜鹊的家，不算本领，叫喜鹊为你傻不鸡鸡的服务，不知不觉中牺牲自己的家来给你耍，这才算本领！
061.梦醒时分.txt	43	八、“后蒋介石”的一切逆流都是小把戏。台湾岛上的所谓“选举”就是其中之一。梦醒使我们相信：基于正义，国民党理应灰飞烟灭；民进党是国民党第二，它的“台独”是骗人的，他们不敢“台独”。台湾岛上的人民是好的，只是太糊涂，笨头笨脑的，但比大陆的人民忠厚善良。
061.梦醒时分.txt	67	对此，李敖阐述说：“英国式的民主很细腻，在英国议会里，你不可以直接叫任何一个议员的名字。可现在，我们的民主变得非常粗野，什么原因？跟台湾学的。跟台湾学的这种粗糙的民主，是假民主。我在台湾做所谓立法委员时，为什么用瓦斯喷他们，为什么有225个立法委员，被我告到法院的有224个，我不能告我自己。有人问，如何证明是假民主？我们都以为两党政治是民主政治，错了。美国是...
061.梦醒时分.txt	75	李敖说：“今天你们说我李敖不骂共产党，很奇怪，共产党却知道我在骂它。6年前，我去北京，出了飞机场，是六车道，其他五车道全部封了起来，我的车一路单独走，对面的车全部停下，司机都下车抽着烟，看着我的车走过，表示等我很久，拿我当国宾对待。可是他们防我，防什么？拿我当贼来防。美国前总统小布什（G. W. Bush）在北京大学讲演，现场全程播出；俄国总理普京（Puti...
061.梦醒时分.txt	89	李敖说，香港的今天，香港人满不满意？当然不满意。最严重的情况，香港人议会现在看来闹得这么凶。可是闹的方法不是英国式的，不是老牌民主国家那种斯文的闹法。为什么今天会变成这样？英国人自私，没有给香港人留下好的基底。帝国主义有很多种，最坏的是比利时式的。它统治非洲刚果70年，没有留下一个律师、没有留下一个医生，只留下了三个大学毕业生。比利时是不负责任的帝国主义者，...
061.梦醒时分.txt	123	一张贺卡、一个花篮，就令一向咄咄逼人的李敖折服，英雄难过美人关依旧是至理名言。这一天是七天书展的高潮日，李敖的演讲场地与林青霞的新书对话会的场地面对面。李敖演讲会结束后才是林青霞的新书对话会。这是书展期间最火爆的两场演讲，李敖那场，读者多达2100多人，林青霞那场也有1500读者入场。李敖演讲结束，在贵宾休息室突然向工作人员提议，去对面会场后台见林青霞。林青...
061.梦醒时分.txt	147	问：宋楚瑜之前找了很多人，都不愿做他的副手，最后选到台湾大学公卫教授林瑞雄，名不见经传，这对他会有加分效果吗？
