score	file	line	text	context
3	022.江南，根本没有春天.txt	43	带着潮水泛滥一样的乡愁回去	蒋芸“带着潮水泛滥一样的乡愁回去”，她的使命与感情是双重的，一重是她自己还乡，一重是代她母亲偿愿。“因为你的缘故，母亲，江南成了我朦胧的但总未忘记的梦；因为它叠印着你的梦，而使这一片土地，在我混沌的梦境中，也如一盏开亮的灯。”蒋芸告诉母亲：“不要以为我不曾带着江南的记忆回去；不要以为在岁月中，我走过的山和水，看过的风土人情会教我遗忘江南。”
3	022.江南，根本没有春天.txt	43	因为你的缘故，母亲，江南成了我朦胧的但总未忘记的梦；因为它叠印着你的梦，而使这一片土地，在我混沌的梦境中，也如一盏开亮的灯。	蒋芸“带着潮水泛滥一样的乡愁回去”，她的使命与感情是双重的，一重是她自己还乡，一重是代她母亲偿愿。“因为你的缘故，母亲，江南成了我朦胧的但总未忘记的梦；因为它叠印着你的梦，而使这一片土地，在我混沌的梦境中，也如一盏开亮的灯。”蒋芸告诉母亲：“不要以为我不曾带着江南的记忆回去；不要以为在岁月中，我走过的山和水，看过的风土人情会教我遗忘江南。”
3	022.江南，根本没有春天.txt	43	不要以为我不曾带着江南的记忆回去；不要以为在岁月中，我走过的山和水，看过的风土人情会教我遗忘江南。	蒋芸“带着潮水泛滥一样的乡愁回去”，她的使命与感情是双重的，一重是她自己还乡，一重是代她母亲偿愿。“因为你的缘故，母亲，江南成了我朦胧的但总未忘记的梦；因为它叠印着你的梦，而使这一片土地，在我混沌的梦境中，也如一盏开亮的灯。”蒋芸告诉母亲：“不要以为我不曾带着江南的记忆回去；不要以为在岁月中，我走过的山和水，看过的风土人情会教我遗忘江南。”
3	022.江南，根本没有春天.txt	55	我宁愿日子回到从前：我躲在你的怀抱中，听你点点滴滴说一些江南旧事，让我看到你黯淡的眼神中，突然点燃的火花；我宁愿躲在书房中说江南，忆江南。	蒋芸告诉母亲，要母亲原谅她，为了她“如此残酷地摧毁了你珍视的旧梦。”她告诉母亲：“我宁愿日子回到从前：我躲在你的怀抱中，听你点点滴滴说一些江南旧事，让我看到你黯淡的眼神中，突然点燃的火花；我宁愿躲在书房中说江南，忆江南。”
4	022.江南，根本没有春天.txt	69	江南，再也没有春天。江南，原来是没有春天的。	蒋芸最后的觉悟是：“江南，再也没有春天。江南，原来是没有春天的。” “原来江南的春早已尽。”蒋芸告诉母亲：“尽管你们、他们都骗了我，但我无法骗自己；母亲啊，我更无法骗你。”蒋芸终于把她毁于一旦的三十年旧梦给坦白出来，“你的梦已无所依归。那么我呢?”
4	022.江南，根本没有春天.txt	69	尽管你们、他们都骗了我，但我无法骗自己；母亲啊，我更无法骗你。	蒋芸最后的觉悟是：“江南，再也没有春天。江南，原来是没有春天的。” “原来江南的春早已尽。”蒋芸告诉母亲：“尽管你们、他们都骗了我，但我无法骗自己；母亲啊，我更无法骗你。”蒋芸终于把她毁于一旦的三十年旧梦给坦白出来，“你的梦已无所依归。那么我呢?”
3	022.江南，根本没有春天.txt	71	梦境一片大好	蒋芸的《江南，再也没有春天》，虽然在部分句子与结构上，融入了稍多滥旧诗文的凿痕，但从抒情文的观点看，大体上，它是非常成功的、动人的作品。从这一观点上看，我会给这篇文章打高分数；但是若换个观点，从思想观点上看，这种“梦境一片大好”式的乡愁，却实在未免可议。
5	022.江南，根本没有春天.txt	79	一片的风霜，一片的疲倦残旧，一派的默默无言	中国根本是穷得哒哒嘀的国家，中国人的家乡，虽然在文学作品中十分风光，但是事实上，并没那样可爱。再加上长年的离乱与困境、失散与差距，“隔世”已久的“故国梦重归”又人重归，必须要有相当的心理准备，自属当然。蒋芸感慨于“它的怀抱已冰冷”，但曾否想到，它又何来热烈的怀抱？你无助于它，它又何来给你热烈的怀抱？千百年来、几十年来，中国人是那样艰苦的苟活着、挣扎着、奋斗着...
8	022.江南，根本没有春天.txt	81	说江南，忆江南	但是，对面对真实的中国人说来，他们却无所谓失望，他们的心情不是“说江南，忆江南”式的，而是不说不忆的“哀江南”。“哀江南”的不幸遭遇，而思有以面对真实、有以解决。恰像那登月以后的太空人，他们在月球上着陆，神话中的美梦，已被“一片的风霜，一片的疲倦残留，一派的默默无言”打破，但是，毕竟那才是真实的月亮。陶醉在多愁善感里，毕竟是一种逃避与自欺。蒋芸说：“尽管你们...
8	022.江南，根本没有春天.txt	81	一片的风霜，一片的疲倦残留，一派的默默无言	但是，对面对真实的中国人说来，他们却无所谓失望，他们的心情不是“说江南，忆江南”式的，而是不说不忆的“哀江南”。“哀江南”的不幸遭遇，而思有以面对真实、有以解决。恰像那登月以后的太空人，他们在月球上着陆，神话中的美梦，已被“一片的风霜，一片的疲倦残留，一派的默默无言”打破，但是，毕竟那才是真实的月亮。陶醉在多愁善感里，毕竟是一种逃避与自欺。蒋芸说：“尽管你们...
8	022.江南，根本没有春天.txt	81	尽管你们、他们都骗了我，但我无法骗自己	但是，对面对真实的中国人说来，他们却无所谓失望，他们的心情不是“说江南，忆江南”式的，而是不说不忆的“哀江南”。“哀江南”的不幸遭遇，而思有以面对真实、有以解决。恰像那登月以后的太空人，他们在月球上着陆，神话中的美梦，已被“一片的风霜，一片的疲倦残留，一派的默默无言”打破，但是，毕竟那才是真实的月亮。陶醉在多愁善感里，毕竟是一种逃避与自欺。蒋芸说：“尽管你们...
3	022.江南，根本没有春天.txt	81	哀江南	但是，对面对真实的中国人说来，他们却无所谓失望，他们的心情不是“说江南，忆江南”式的，而是不说不忆的“哀江南”。“哀江南”的不幸遭遇，而思有以面对真实、有以解决。恰像那登月以后的太空人，他们在月球上着陆，神话中的美梦，已被“一片的风霜，一片的疲倦残留，一派的默默无言”打破，但是，毕竟那才是真实的月亮。陶醉在多愁善感里，毕竟是一种逃避与自欺。蒋芸说：“尽管你们...
5	023.波波颂.txt	7	老爷开饭了，停工吧！	四年前，有暹罗猫跷家，我弟弟李放捡到，送了过来，该暹罗猫作息有定，只在中午12点、下午6点，跃上我书桌，表示：“老爷开饭了，停工吧！”其他时间一切自理，绝对尊重我的私生活，给我印象不恶。后来此跷家猫去，香港邵氏公司马芳踪送另一暹罗猫给胡茵梦。于是胡茵梦和我就养起马家猫。不料胡星妈大叫一个人寂寞，坚持要把马家猫给她。胡茵梦说另找一马家猫给胡星妈，胡星妈不肯，非...
5	023.波波颂.txt	7	当初说把这猫给她，她不要，现在我们养了，她又抢，这是什么意思？	四年前，有暹罗猫跷家，我弟弟李放捡到，送了过来，该暹罗猫作息有定，只在中午12点、下午6点，跃上我书桌，表示：“老爷开饭了，停工吧！”其他时间一切自理，绝对尊重我的私生活，给我印象不恶。后来此跷家猫去，香港邵氏公司马芳踪送另一暹罗猫给胡茵梦。于是胡茵梦和我就养起马家猫。不料胡星妈大叫一个人寂寞，坚持要把马家猫给她。胡茵梦说另找一马家猫给胡星妈，胡星妈不肯，非...
5	023.波波颂.txt	9	要不是我把你救出来，你恐怕还在监狱里！	我离婚时，鉴于胡茵梦“守玉如身”“爱猫如己”，把古玉和猫都让她留在身边，当然这不是“陪嫁”，这是“陪离婚”。从此我不再养猫，也不再收购古玉，一个人做工快活。一天在杂志上看到，说胡星妈胡茵梦为了怕猫生小猫，乃予阉割，猫从高楼跳下，自杀身死，我见此消息，心中惨沮，不乐终日。这只猫店笼中猫，极为通灵，我常对它开玩笑说：“要不是我把你救出来，你恐怕还在监狱里！”它若...
4	023.波波颂.txt	11	你这不是爱猫，你是害猫。你对猫的爱，我看是假的。	胡茵梦说她以前养过一只波斯猫，但懒得给它洗澡，结果浑身沾了泥土粪便，积重难返，乃予以把毛剪短，结果不成样子，不要了。我说：“你这不是爱猫，你是害猫。你对猫的爱，我看是假的。”（我笑胡茵梦是“假爱猫家”，而我却是“爱假猫家”，因我不养猫，只看猫照片。）
3	023.波波颂.txt	23	我对你这小家伙没办法哟！你是一个小赖皮哟！	在战败之后，我搂住波波，一边摸它、揉它、亲它，一边说：“我对你这小家伙没办法哟！你是一个小赖皮哟！”波波顾我而乐之，它居然闭上一只眼，只用另一只看我，憨态可掬，我爱死它了。
6	023.波波颂.txt	45	魏武将见匈奴使，自以形陋，不足雄远国，使崔季珪代，帝自捉刀立床头。既毕，令间谍问曰：‘魏王何如？’匈奴使答曰：‘魏王雅望非常；然床头捉刀人，此乃英雄也！’魏武闻之，追杀此使。	〔附记〕《世说新语·容止篇》描写曹操（魏武）说：“魏武将见匈奴使，自以形陋，不足雄远国，使崔季珪代，帝自捉刀立床头。既毕，令间谍问曰：‘魏王何如？’匈奴使答曰：‘魏王雅望非常；然床头捉刀人，此乃英雄也！’魏武闻之，追杀此使。”这真是个有趣的小故事。
4	024.能下床就是好猫.txt	9	不论黑猫白猫，能下床就是好猫。	寓言的新教训是：“不论黑猫白猫，能下床就是好猫。”
3	025.“本姑娘也点一个”.txt	3	以行同男人为新理想，可是这种行为，反倒害了女人。因为女人要行同男人，只能做个失败的男人	有人以为历来女人不论在床上床下，一直压在男人下面，这是不正确的。女人曾有过压人的时代，只是那种风光，后来被男人反压了。到了18世纪以后，女权运动逐渐形成，于是女人开始夺权。女人夺权，在某些争平等的目标上是好的，不幸的是，女人在争平等时，常常得意忘形，为打倒“大男人主义”而沦为“大女人主义”，她争平等，却不与人平等相处，最要命的，她又想压人，要以“行同男人”的...
6	026.古董与今董.txt	3	时难年荒世业空，弟兄羁旅各西东。田园寥落干戈后，骨肉流离道路中。吊影分为千里雁，辞根散作九秋蓬。共看明月应垂泪，一夜乡心五处同。	我小时候住在故都，对古董有所见闻，我又是学历史的人，对古董的了解，自然又高出别人。和胡茵梦在一起的时候，胡茵梦好古董，我随喜之，但只是陪美人玩物而已，绝不丧志。胡茵梦就像是20世纪的古董，有她在，复有何玩？何况台湾比起故都来，实在是文物边陲，所谓古董，实不足论。此地有所谓中国文物爱好名家，事实上，只是一些文物外行。试以郭良蕙而论，郭良蕙者，新女性又复女作家者...
4	026.古董与今董.txt	3	不具真名诗人	我小时候住在故都，对古董有所见闻，我又是学历史的人，对古董的了解，自然又高出别人。和胡茵梦在一起的时候，胡茵梦好古董，我随喜之，但只是陪美人玩物而已，绝不丧志。胡茵梦就像是20世纪的古董，有她在，复有何玩？何况台湾比起故都来，实在是文物边陲，所谓古董，实不足论。此地有所谓中国文物爱好名家，事实上，只是一些文物外行。试以郭良蕙而论，郭良蕙者，新女性又复女作家者...
3	026.古董与今董.txt	3	宋代诗文	我小时候住在故都，对古董有所见闻，我又是学历史的人，对古董的了解，自然又高出别人。和胡茵梦在一起的时候，胡茵梦好古董，我随喜之，但只是陪美人玩物而已，绝不丧志。胡茵梦就像是20世纪的古董，有她在，复有何玩？何况台湾比起故都来，实在是文物边陲，所谓古董，实不足论。此地有所谓中国文物爱好名家，事实上，只是一些文物外行。试以郭良蕙而论，郭良蕙者，新女性又复女作家者...
8	026.古董与今董.txt	5	尔何不携陋巷之瓢，提叩胫之杖，披曾子之箦，而吹伍子胥之箫？岂无舍太公九圆钱者？	其实，这种假古董家，也是代有遗传的，只是笑话没闹得这么大而已、只是出之精神状态有异者而已。《增新事林广记》中写有秦士是古董迷，有人弄来破席骗他，说“此鲁哀公坐孔子之席也”；又弄来手杖骗他，说“此太王避狄所操之马箠也”；又弄来朽椀骗他，说“此殷商物，乃桀〔纣〕所造”。每件古董，都大敲他竹杠，他也照单全收，收到后来，弄得倾家荡产，在街上讨起饭来：“于是披哀公之席...
7	026.古董与今董.txt	5	此殷商物，乃桀〔纣〕所造	其实，这种假古董家，也是代有遗传的，只是笑话没闹得这么大而已、只是出之精神状态有异者而已。《增新事林广记》中写有秦士是古董迷，有人弄来破席骗他，说“此鲁哀公坐孔子之席也”；又弄来手杖骗他，说“此太王避狄所操之马箠也”；又弄来朽椀骗他，说“此殷商物，乃桀〔纣〕所造”。每件古董，都大敲他竹杠，他也照单全收，收到后来，弄得倾家荡产，在街上讨起饭来：“于是披哀公之席...
6	026.古董与今董.txt	5	此鲁哀公坐孔子之席也	其实，这种假古董家，也是代有遗传的，只是笑话没闹得这么大而已、只是出之精神状态有异者而已。《增新事林广记》中写有秦士是古董迷，有人弄来破席骗他，说“此鲁哀公坐孔子之席也”；又弄来手杖骗他，说“此太王避狄所操之马箠也”；又弄来朽椀骗他，说“此殷商物，乃桀〔纣〕所造”。每件古董，都大敲他竹杠，他也照单全收，收到后来，弄得倾家荡产，在街上讨起饭来：“于是披哀公之席...
6	026.古董与今董.txt	5	此太王避狄所操之马箠也	其实，这种假古董家，也是代有遗传的，只是笑话没闹得这么大而已、只是出之精神状态有异者而已。《增新事林广记》中写有秦士是古董迷，有人弄来破席骗他，说“此鲁哀公坐孔子之席也”；又弄来手杖骗他，说“此太王避狄所操之马箠也”；又弄来朽椀骗他，说“此殷商物，乃桀〔纣〕所造”。每件古董，都大敲他竹杠，他也照单全收，收到后来，弄得倾家荡产，在街上讨起饭来：“于是披哀公之席...
6	026.古董与今董.txt	5	于是披哀公之席，把太王之杖，执桀〔纣〕之椀，行丐于市曰：‘衣食父母：有太公九府钱，乞一文！’	其实，这种假古董家，也是代有遗传的，只是笑话没闹得这么大而已、只是出之精神状态有异者而已。《增新事林广记》中写有秦士是古董迷，有人弄来破席骗他，说“此鲁哀公坐孔子之席也”；又弄来手杖骗他，说“此太王避狄所操之马箠也”；又弄来朽椀骗他，说“此殷商物，乃桀〔纣〕所造”。每件古董，都大敲他竹杠，他也照单全收，收到后来，弄得倾家荡产，在街上讨起饭来：“于是披哀公之席...
4	026.古董与今董.txt	11	我玩的是今董，不是古董，我是明知它们是假的，才玩起来好玩的。	恰像开赌场的人自己绝不赌博一样，真正懂古董的人绝不玩古董。有一次在李翰祥家，看他家琳琅满目，李翰祥说：“我玩的是今董，不是古董，我是明知它们是假的，才玩起来好玩的。”如今我想起许多20世纪的古董美女来，真相其外，假象其中，我真觉得她们是今董了呢！
7	027.天堂不是我们的.txt	5	我们全走了！只留下你们，历史在你们手里，我要能教你们明白我当年的好梦和一开始就做错的地方就好了！……我的儿子，休想能硬把天堂造出来！	凯斯特勒（Arthur Koestler）在他名著《昏黑日午》（Darkness at Noon）里，曾对“职业革命家”有过最精彩的道白，垂死前的苏联老一辈“职业革命家”卢巴雪夫（Rubashov）曾表示：“我们全走了！只留下你们，历史在你们手里，我要能教你们明白我当年的好梦和一开始就做错的地方就好了！……我的儿子，休想能硬把天堂造出来！”
4	027.天堂不是我们的.txt	5	职业革命家	凯斯特勒（Arthur Koestler）在他名著《昏黑日午》（Darkness at Noon）里，曾对“职业革命家”有过最精彩的道白，垂死前的苏联老一辈“职业革命家”卢巴雪夫（Rubashov）曾表示：“我们全走了！只留下你们，历史在你们手里，我要能教你们明白我当年的好梦和一开始就做错的地方就好了！……我的儿子，休想能硬把天堂造出来！”
6	027.天堂不是我们的.txt	7	休想能硬把天堂造出来！	“休想能硬把天堂造出来！”这是一句多么凄惨的哀呼！这种哀呼的深刻意义，在于告诉人们，天堂是渺茫的，想在人间造天堂的人，是一场好梦、一场一开始就错了的好梦，天堂是可望而不可即的。
5	027.天堂不是我们的.txt	9	不知有汉，无论魏晋	可是，受苦受难的人，他们总有这样的好梦，他们或在桃花源、或在锡安山，千辛万苦，想建造他们人间的天堂，但是，人间何处有天堂？在这些人“不知有汉，无论魏晋”的逃世里，穿制服的和穿便衣的，早就渔郎问津，把他们十面埋伏、一网成擒了。
5	027.天堂不是我们的.txt	13	天上复能比乐人间乎？但莫使老死耳！天上多至尊，相奉事，更苦于人间！	中国传统的道家思想中，有一说法，就对死后上天堂表示了疑虑，《太平广记》据《神仙传》，写超级老寿星彭祖问白石先生说：“何不服升天之药？”白石先生答道：“天上复能比乐人间乎？但莫使老死耳！天上多至尊，相奉事，更苦于人间！”这显然是说，天堂上达神贵仙太多了，伺候他们，会苦不堪言，不如在人间长寿，做地上之仙，落得痛快①。
3	027.天堂不是我们的.txt	13	何不服升天之药？	中国传统的道家思想中，有一说法，就对死后上天堂表示了疑虑，《太平广记》据《神仙传》，写超级老寿星彭祖问白石先生说：“何不服升天之药？”白石先生答道：“天上复能比乐人间乎？但莫使老死耳！天上多至尊，相奉事，更苦于人间！”这显然是说，天堂上达神贵仙太多了，伺候他们，会苦不堪言，不如在人间长寿，做地上之仙，落得痛快①。
8	027.天堂不是我们的.txt	15	一人得道，鸡犬升天	中国古话说“一人得道，鸡犬升天”。《太平广记》据《续仙传》说：“全家人物鸡犬一时飞去……唯猫弃而未去。”元好问《游天坛杂诗》说：“同向燕家舐丹鼎，不随鸡犬上青云。”诗下自注说：“仙猫洞，土人传燕家鸡犬升天，猫独不去。”这一记录，引起我最大的兴趣。为什么有天堂可上，猫仍不上天堂呢？难道猫也要学白石先生，只要长生不上天吗？
7	027.天堂不是我们的.txt	15	同向燕家舐丹鼎，不随鸡犬上青云。	中国古话说“一人得道，鸡犬升天”。《太平广记》据《续仙传》说：“全家人物鸡犬一时飞去……唯猫弃而未去。”元好问《游天坛杂诗》说：“同向燕家舐丹鼎，不随鸡犬上青云。”诗下自注说：“仙猫洞，土人传燕家鸡犬升天，猫独不去。”这一记录，引起我最大的兴趣。为什么有天堂可上，猫仍不上天堂呢？难道猫也要学白石先生，只要长生不上天吗？
7	027.天堂不是我们的.txt	15	仙猫洞，土人传燕家鸡犬升天，猫独不去。	中国古话说“一人得道，鸡犬升天”。《太平广记》据《续仙传》说：“全家人物鸡犬一时飞去……唯猫弃而未去。”元好问《游天坛杂诗》说：“同向燕家舐丹鼎，不随鸡犬上青云。”诗下自注说：“仙猫洞，土人传燕家鸡犬升天，猫独不去。”这一记录，引起我最大的兴趣。为什么有天堂可上，猫仍不上天堂呢？难道猫也要学白石先生，只要长生不上天吗？
5	027.天堂不是我们的.txt	15	全家人物鸡犬一时飞去……唯猫弃而未去。	中国古话说“一人得道，鸡犬升天”。《太平广记》据《续仙传》说：“全家人物鸡犬一时飞去……唯猫弃而未去。”元好问《游天坛杂诗》说：“同向燕家舐丹鼎，不随鸡犬上青云。”诗下自注说：“仙猫洞，土人传燕家鸡犬升天，猫独不去。”这一记录，引起我最大的兴趣。为什么有天堂可上，猫仍不上天堂呢？难道猫也要学白石先生，只要长生不上天吗？
8	027.天堂不是我们的.txt	19	鸡犬升天，猫独不去	《水经注》记唐公房得仙，“白日升天，鸡鸣天上，犬吠云中，唯以鼠恶，留之。”这是说鸡犬同升之时，老鼠是坏东西，是不配上天堂的，索性留它在人间作恶。我想，“鸡犬升天，猫独不去”，答案就在这里了。猫是有使命感的伟大动物，人间老鼠还在，猫就要继续打击魔鬼，不要上天堂。地藏菩萨在众生不成佛时他宁下地狱，我看猫却在众鼠不消灭时，它宁不上天堂。猫的猫生观是：人间若还黑暗，...
7	027.天堂不是我们的.txt	19	白日升天，鸡鸣天上，犬吠云中，唯以鼠恶，留之。	《水经注》记唐公房得仙，“白日升天，鸡鸣天上，犬吠云中，唯以鼠恶，留之。”这是说鸡犬同升之时，老鼠是坏东西，是不配上天堂的，索性留它在人间作恶。我想，“鸡犬升天，猫独不去”，答案就在这里了。猫是有使命感的伟大动物，人间老鼠还在，猫就要继续打击魔鬼，不要上天堂。地藏菩萨在众生不成佛时他宁下地狱，我看猫却在众鼠不消灭时，它宁不上天堂。猫的猫生观是：人间若还黑暗，...
5	027.天堂不是我们的.txt	23	不乐升天，但服半剂为地仙，恒居人间	①《抱朴子》上有这样一段：“若且欲留在世间者，但服半剂而录其半。……不死之事已定，无复奄忽之虑，正复且游地上，或入名山。……彭祖言：‘天上多尊官大神，新仙者位卑，所奉事非一，但更劳苦。’故不足役役于登天，而止人间八百余年也！……笃而论之，求长生者，正惜今日之所欲耳，本不汲汲于升虚，以飞腾为胜于地上也！若幸可止家而不死者，亦何必求于速登天乎？”若戏言之，彭祖在...
3	027.天堂不是我们的.txt	23	若且欲留在世间者，但服半剂而录其半。……不死之事已定，无复奄忽之虑，正复且游地上，或入名山。……彭祖言：‘天上多尊官大神，新仙者位卑，所奉事非一，但更劳苦。’故不足役役于登天，而止人间八百余年也！……笃而论之，求长生者，正惜今日之所欲耳，本不汲汲于升虚，以飞腾为胜于地上也！若幸可止家而不死者，亦何必求于速登天乎？	①《抱朴子》上有这样一段：“若且欲留在世间者，但服半剂而录其半。……不死之事已定，无复奄忽之虑，正复且游地上，或入名山。……彭祖言：‘天上多尊官大神，新仙者位卑，所奉事非一，但更劳苦。’故不足役役于登天，而止人间八百余年也！……笃而论之，求长生者，正惜今日之所欲耳，本不汲汲于升虚，以飞腾为胜于地上也！若幸可止家而不死者，亦何必求于速登天乎？”若戏言之，彭祖在...
6	028.用替身可也！.txt	5	博学有才气，尝为《筝赋》成，谓人曰：‘吾赋之比嵇康琴，不赏者必以后出相遗，深识者亦当以高奇见贵。’	顾恺之，字长素，江苏无锡人。《晋书》说他：“博学有才气，尝为《筝赋》成，谓人曰：‘吾赋之比嵇康琴，不赏者必以后出相遗，深识者亦当以高奇见贵。’”这表示他是很坦率的，他不做无谓的谦虚。
5	028.用替身可也！.txt	7	好谐谑，人多爱狎之	顾恺之“好谐谑，人多爱狎之”。他“每食甘蔗，恒自尾至本”。人家问他为什么吃法这么怪，他说这样吃，可以“渐入佳境”。
