file	line	text
001.《李敖语录》前言（苏荣泉）.txt	1	《李敖语录》前言（苏荣泉）
001.《李敖语录》前言（苏荣泉）.txt	13	李敖说：我无法谦虚了，我深觉继往开来的重担上，我担当着一大部分重量，而这等责任又是非我莫属、舍我其谁的，我无法放松我自己，因为我无法忘怀我所应尽的责任，我深知在这浑噩的男人群里，我是一个罕有的奇才、一枝锋芒的独秀，没有人能够跟我相比，我站在世界的一方！
002.《李敖语录》总序（李敖）.txt	1	《李敖语录》总序（李敖）
002.《李敖语录》总序（李敖）.txt	5	常言道“著作等身”，但和身体一边高的著作，只是多而已矣，未必又多又好，国民党中央宣传部代理部长任卓宣（叶青）就是“著作等身”的一位，但是所写各书，本本是糟粕而已，纵等了半天身，又奈读者何？等而上之，国民党层峰极处，也颇多“全集”、“汇编”问世，究其内容，类多出自文学侍从之手，其去王安石所谓“断烂朝报”者，又几希？
002.《李敖语录》总序（李敖）.txt	9	胡适生前，有鉴于此，乃自编《胡适文选》一册，以为救济；不过文选这种体例，它的基本缺点，乃在但求代表性的文章成单元，却忽略了思想方面的普遍选样。结果是代表性的文章虽然完整了，可是代表性的思想却遗漏得很厉害。
002.《李敖语录》总序（李敖）.txt	11	为了免除这种缺点，有一种可叫做“隽语选粹”（an anthology of witicisms）式的收罗方法，分门别类，撷取文章片段，综合印行，以便读者的。像伊格奈（Robert E. Egner）编的《罗素短论集》（Bertrand Russell`s Best）、沙诺姆斯基（F. B. Czarnomski）编的《邱吉尔雄辩集》（The Eloquence of Winston Churchill）等，都属于这一类。这一编法，不论长篇大论也好，片语只字也罢，都能一一撷取精华，巨细不遗，故对全部著作的选样流传，极有帮助。读者读来，也如吃点心小菜，在自成单元之中，随意得其真味。
002.《李敖语录》总序（李敖）.txt	13	基于这种认识，在近二十年前，段宏俊和我就合作过一册《胡适语粹》，内容以胡适一生的主要专书和文字汇集为基料，以《哲学·思想史》、《宗教·迷信》、《东西文化》、《中国前途》、《政治》、《社会·经济》、《教育·知识人》、《方法论·国故》、《文学·语文》以及《人物》等大类，分别囊括这些基料，并且贯串这些基料。全部囊括的基料经贯串为五百个小单元，各加标题，以资醒目。这本书问世后，近二十年来，被盗印多起，如今地摊上还屡见不绝，可见这种体例的编法，颇为读者所喜好。
002.《李敖语录》总序（李敖）.txt	15	近二十年过去了，新一代的出版家苏荣泉，对“著作等身”的李敖，有了更进一步的认知，他倡议编一部《李敖语录》，并把语录从宽解释，涵盖“语粹”和英文中“Best”、“Eloquence”等相当书名，用来便利读者。他请出第一流的出版品行家应凤凰主持这一计划。在应凤凰经年累月的细心编辑下，在李敖出版社吕佳真的校补和詹赐珠的顺稿下，以及叶淑珍全力配合的制作下，这部《李敖语录》，终于大功告成。看了这部书的清样，我的感觉是：连我本人，都不想再看其他李敖的书矣；有此一部，李敖的精华，尽收眼底矣！
003.《李敖语录》编辑手记（应凤凰）.txt	1	《李敖语录》编辑手记（应凤凰）
003.《李敖语录》编辑手记（应凤凰）.txt	9	新一代青年也愈来愈难全面的认识李敖——他的著作已愈堆愈高，截至1988年底，他已累积出版了《李敖全集》八大册、《李敖千秋评论》八十余册、《万岁评论》四十册。《乌鸦评论》创刊后，他更以每天一千字以上的写作量，不断增加当中。
003.《李敖语录》编辑手记（应凤凰）.txt	13	单从资料上看，李敖是——男，1935年生，祖籍东北吉林，念过台大历史系及历史研究所，60年代主编过璀灿一时的《文星》杂志，坐过政治牢，目前定时定点写专栏，并主持一家出版社。
003.《李敖语录》编辑手记（应凤凰）.txt	19	李敖是当代思想家，社会批评家。青年时代，他就出版《为中国思想趋向求答案》一书，并主张全盘西化，引起好大一场论战。他写文章、办杂志，批评对象从执政党高官到文化界名人，文字犀利，有如“小李飞刀”，常命中要害。李敖的信条是“真理所在，绝不饶人”，但是刀刀见血，使人吃不消，因此也树敌无数，四面埋伏。
003.《李敖语录》编辑手记（应凤凰）.txt	23	李敖是大资料家，大藏书家。支持他不停发表文章的，是他拥有一个，不，好几个庞大的资料库。他对于资料及书籍的勤于收集，善于运用，如果他只谦称第二，台湾没有人敢居第一。依他的话：“真正第一流的大思想家的工作地点是自己的书房，而不是图书馆。”为了印行他自己的“麻烦”文章，他只好又身兼出版家——除了每月自写自印一册《李敖千秋评论》丛书，又创办“李敖出版社”，出版一系列《真相丛书》——从《孙中山研究》、《蒋介石研究》，一直到《孙立人研究》、《二二八研究》；截至1989年初，总计已近二百种。
003.《李敖语录》编辑手记（应凤凰）.txt	29	着手编李敖语录的一年多时间，因为要精选，所以得细读，光把他已出版的几十种书集合起来，就有长长的三排书架（其中《千秋评论》一至六十七册，全由他一人执笔），这段时日也得到生平少有的、愉快的阅读经验。
004.自我炼钢.txt	7	在我成长的过程中，我曾花了许多气力来把自己锻炼成钢铁。锻炼的方法，不论是东海圣人的，还是西海圣人的，我都一网兜收，从摸索和试验中，求得安身立命。我这种自我炼钢，是很用心的，我今天能有一些个性、一些独来独往的气魄、一些“虽千万人，吾往矣”的决绝，追溯起来，都跟我早年的刻苦自励有深切关系。（《大学札记前记》1982年）
004.自我炼钢.txt	11	独坐图书馆中，身着大衣，静望窗外，自觉颇有些担当的进境，担当的表现是深沉、冷静、沉着、持重、和气、淡漠，忍耐得住，不浮动张皇。（《大学札记》1957年2月11日）
004.自我炼钢.txt	15	自我训练的成绩到底不是悲观的，消极突击我一两小时，终于又被我消灭掉，万念俱灰的情绪毕竟是浮光掠影，它们在我心头的盘据愈来愈不能长久了，我清楚的知道我已逐渐变得坚强、变得有志气，当我漫步在街头，到处看到的是软弱的男人们，我无法容忍我自己竟和他们一样，我若不能使我与他们比起来有大大的不同，我将感到极端的可耻。（《大学札记》1957年5月16日）
004.自我炼钢.txt	21	钱思亮说：“胡博士虽然一身有好几种病，但是毕竟是一个意志非常坚强的人，他之能够吃苦耐劳，向为朋友们所最钦佩。”但是胡适的意志是长者化了的，未免缺乏英雄之气，如今我所要求自己的是一种有“英雄之气的意志”。（《大学札记》1957年5月18日）
004.自我炼钢.txt	31	“默然不语”是一种最伟大的作风，何况事实上的是非恩怨又是一本搞不清的烂帐！泰戈尔说：“如果不等着说完全的真理，那么要说话是很容易的。”在一种公允的总结永不会产生的情况下，我的确是不该再说什么的。（《大学札记》1957年5月18日）
004.自我炼钢.txt	35	我对它必定要有一种壮烈的反动（a heroic reaction），我不是软弱的人，我是绝不再有暂时的消极情绪的，痛苦的折磨已使我变成一个千锤百炼的硬汉，我耻于做一个平平庸庸的男人，坚强的意志完全支配了我，我已变成了一个“无从腐败的斯诺登（Snowden）”，我不能容忍自己有任何腐败的行为——像那些男人一样（在腐败上面，即使只有一鳞片爪的相同，我也是不能忍受的）。（《大学札记》1957年5月18日）
004.自我炼钢.txt	39	事情过去了就总算是过去了，我虽不愿遗忘，但也的确不愿再回想，一切欢乐、眼泪与名分都已逐渐成为往事，既然都成为往事。“我们该不要回头望，除非是要从过去错误中提取有用的教训，和为了从经验中获得益处（华盛顿）”，否则对既往的缅怀与回想都将是我目前的戕贼与毒素，我为自己订了一个严格的标准：凡是对“现在”有害的回想与想像，我都要一律不去想它。（《大学札记》1957年5月18日）
004.自我炼钢.txt	43	“普通的生活是感觉的生活（life of senses），是属于声色香味的生活，而不是意志的生活（life of Will）。意志的生活是另一种境界，只有特立独行的人才能过得了的。”过意志的生活虽然辛劳坚苦，但是一天下来，它的果实是最能慰藉人的，最能使人心安梦宁的。“过意志的生活”一句话，鼓励我无穷的道德的勇气，我没有丝毫向后退的犹豫了。（《大学札记》1957年5月19日）
004.自我炼钢.txt	47	我正展开一个律己极严的严肃生活，“放弃故我，重修学立身。”在各方面我都严格的要求我自己，非逼迫我“止于至善”不罢休，照我最近的突飞猛进看来，“止于至善”对于我似乎已不是难事，因为“道德的勇气”（moral courage）已在极短的时间内占据了我的心。“Arise；for this matter belongeth unto thre；we also will be with thee：be of good courage，and do it.”－Ezra 10:4（起来！这是你自己应该办的事，我们也赞助你，鼓起勇气去干！）这是道德的勇气的最好颂词了。（《大学札记》1957年5月19日）
004.自我炼钢.txt	51	躺在床上想到另外一件事，就是我该花些时间替我几位好朋友仔细考虑考虑他们的前途，帮助我的朋友们热心做点事。亚当·斯密说：“为人设想多，为己着想少；压制自私，实施慈爱之念，便构成人性的完美。”我要一一为我的朋友们做些打算。（《大学札记》1957年5月25日）
004.自我炼钢.txt	55	今天想到的最具体的一个念头是，我要做一个伟大的人，有一种伟大的自处生活和一种伟大的对人态度，我要使人以我而骄傲，不使人以我而羞耻，我在别人的心目里要成为一个永不能忘的有光彩的人。我曾写“成第一等人做法”的理论道：“世俗的态度固然格卑而不必说，一般有着真情的男孩子的态度也是不足法的，因为他们的做法总不成为第一等人的标准，所以他们做出来的总不能可记可歌，使人感动。（《大学札记》1957年5月27日）
004.自我炼钢.txt	59	在你意想不到地突然被一条毒蛇咬了一口的时候，你该立刻用各种办法去解毒，而不该继续震撼于这种意外，以致扩大你中毒的程度。你要告诉你自己说：不要研究你为什么会被咬了，也不要研究你怎样被咬了，也不要感慨你被咬得如何重……这些都是无益之举，它们除了拖延你中毒的时间，使你中毒更深以外，对你一点好处都没有，甚至有时候它们简直是变形的毒汁，对你是一种毒上加毒落井下石的伤害。（《大学札记》1957年5月29日）
004.自我炼钢.txt	63	我发现我若用苏格拉底的标准来衡量自己，我也和这些男人们无异——也是一个五十步笑百步的懒蛋。苏格拉底的标准是：“不单只是不做事的人，还有那些原可做得更好的人，也算是懒惰的。”直到今天午后，我才真正的发现自己的确是一个懒惰习惯甚深的人！追想起来，我这十五年的读书生活，即使有许多地方我还是比别人高明，可是我还是非常不满意的，因为我“原可做得更好”。詹姆斯说：“若拿我们应当成就的标准，我们只是半醒着，我们只用了我们自己身体和智力的富源的一小部分。广泛的说，人们现在的生活距他们的限度尚远，我们具有许多力量平常不会利用。”沃尔特·司各特说：“工作过度并没有像一般人所猜想的那样危险或是那样普遍。有许多人把工作过度和实在工作过少而着急过多混为一样东西了。一天做事很有成就是觉得很安适的，而一天做事无所成就反而觉得是很吃力的。一个人对于工作极有兴趣，觉得胜过工作的困难是一种快乐，比那些以为工作是一种重担的人，并不觉得疲倦些。”所以懒惰不是一种清福，而是一种不安和不幸（对内心说来是不安，对事业说来是不幸），内心的快乐与事业的成功都不是懒惰所能造成的，吕坤说：“体懈、神昏、志消、气沮，天下事不是这般人干的。”好逸恶劳，怕吃苦，贪容易，都不是成大事者的气象。（《大学札记》1957年6月1日）
004.自我炼钢.txt	67	我目击人们（尤其是青年男女们）腐败的一面，起码都是受过中等教育的人们，有几个还能每天肯花些时间读点正经书，或是思考一下人世的问题呢？不过话又说回来，我也没有理由深责他们，他们并没有什么大志向、大理想、大魄力，他们的才具不过就是做个但求自谋的“自了汉”。在“社会习气”的桎梏下大同小异地顺从一辈子，我不能以志士仁人的标准来厚非他们，试想：志士仁人们在整个人类中所占的比例数，我实在无法不对他们有着无限的怜悯，我不忍心痛斥他们的腐败了，我只静静地观察着他们，私下勉励着我自己：努力去做一个无从腐败的人！（《大学札记》1957年6月2日）
004.自我炼钢.txt	71	躺在床上冥想“第一等人”的境界。（如富兰克林见到伏尔泰、胡适见到罗素），的确使我胸怀宏伟，多想想“第一等人”自处与对人的态度，会使我心中长存着第一等念，而把第二等以下的思想、言论与行为全抹去了。凡是属于“第一等人”的人，他们应付欢乐与不幸的态度几乎都是一样的。老罗斯福总统曾说他每逢遇着困难的问题时，就抬起头来望着挂在墙上的林肯的相片，并且问自己道：“倘若林肯遇到这个问题时，他将怎样做呢？”这是给自己去从取舍的一个好标准，遇事能学得用“第一等人”的观点去看事情，不但是一种伟大的作风，并且还会给自己带来许多自慰与安静。亚里士多德说：“气度宽宏的人无论遭遇命运为善为恶，皆能适度以应之。成功不以为喜，失败不以为悲，外界的毁誉褒贬，一不介怀，只是为所当为、为所可为而已。”这是何等恢宏的胸襟与素养！（《大学札记》1957年6月4日）
004.自我炼钢.txt	75	大体说来，沉默就是进步的表示，沉默的时候是我最进步的时候，我不太以为这样说是武断或矫枉过正的，因为沉默带给我缜密的思考、清醒的意识、安定的内心与沉重的情绪，多说可不必说的话只是证明我为人的没有定力、言辞的没有分量。这些都不是成熟的表示，一个成熟的公式该是爱因斯坦所说的A（成功）= X（工作）＋ Y（游戏）＋Z（少说话），因为目前的我还停留在浅薄与自救的阶段，对任何问题都还没有真知灼见，If you can't say it out loud, keep your mouth shut．不“妄言无当”，“大言不惭”，对我这好说好道的人说来，该是一种很重要的戒条，薛敬轩说：“句句着实不脱空，方是谨言。”“信口乱谈者，无操存省察之功也。”在我忘记了静默寡言的当儿，我该想想古人这几句老话，我相信它会使我悚然变得深沉，老成而稳重。（《大学札记》1957年6月9日）
004.自我炼钢.txt	81	有奇气的人从来不会没精打采嗒然若丧的，他永远是坚强而高兴的。这种坚强而高兴的神情被他养成了习惯。（《大学札记》1957年6月12日）
004.自我炼钢.txt	85	过这种“壮志新来与昔殊”的蜕变生活，这种生活的历程可分四阶段：第一步是发大宏愿，第二步是勉强去做，第三步是养成习惯，第四步是兴味盎然。耿天台描写这种情形道：“此学须是发大愿心，真真切切肯求，便日进而不自知矣。盖只此肯求，便是道了，求得自己渐渐有些滋味，自我放歇不下，便是得了。”（《大学札记》1957年6月12日）
004.自我炼钢.txt	89	自图书馆做工回来，心中真是恬静极了，这可说全是“不做自了汉”的胸怀与志愿带给我的安宁，养成一种恬静安宁的习惯，对我来日这漫长的生活将是一个十分必要的事。弥尔顿说“宁静是克己的王冠”，克己的功夫到了炉火纯青的地步时，我便会得到一个永远平稳和谐的心境了。“宁静的人虽然遇到人生的大恐慌，心底也是一波不起。他们在日常生活中，盖已培养了一种伟大的定力，任何刺激可以不为所动。”（《大学札记》1957年6月13日）
004.自我炼钢.txt	93	“铁石心肠”是意志的最成功的表现，它比任何做人的方法都来得紧要、来得有效、来得干脆，理智是不够的、感情是坏事的、冲动是胡闹的，只有“铁石心肠”才是最有劲最磅礴的人生。当然了，做到“铁石心肠”的起步非通常之男人所能，这也就是成事的硬汉与通常之男人不同的地方，正因为难能，所以做到才可贵；正因为难能，所以必须要做到。古今中外之成事者不论其为善为恶，其有过人之“铁石心肠”则一，设想普天之下的男人当中，真正有“自胜”之“铁石心肠”者究有几人？数数看，真是太可怜了！（《大学札记》1957年6月15日）
004.自我炼钢.txt	97	奥格登（Robert．C．Ogden）说：“青年人的不能上进，最重要的原因是由于他们有多说话的习惯。一个不很开口的人，一个多思想少说话的人，以及比较深沉的人，往往能够成功。”我总是怪我爱乘兴多说话，沉默的素养太差劲，以致对我“沉闷的努力”颇生不良的影响——旷功，疲神，破坏心绪，破坏成熟——这是不行的，我非改变这个爱说话的习惯不可！（《大学札记》1957年6月16日）
004.自我炼钢.txt	101	独坐楼栏，凝望远处的群山，一只孤单的燕子飞向那里，我的心也随它翱翔到那遥远的地方，我的心胸愈来愈恢廓，也愈来愈远大，我倦于与人们计较与争逐，只愿在一个“背时独立抱寂寞”的安详中，静静地认识我自己。（《大学札记》1957年6月18日）
004.自我炼钢.txt	105	从今天开始，我正式迎接痛苦到我的生活里，对它不再采取回避的态度。我告诉我自己说：痛苦算得了什么？迎接好了，整天整夜让它伴着你过，又算得了什么？既然它使你心情永远是阴天，就让它阴天吧，我要满不在乎的去经年累月的忍受，它就算是永远在我身边，永远推不开的小守护神、小幽灵、小捣乱鬼，甚至一个最伤脑筋的小情人吧，我要偶尔也向它打打招呼，寒暄一番，笑一笑，它长年在我心头，也满有用处的，它可以使我很沉重，沉重的不肯放松我自己、沉重的磨练我的抵抗力、沉重的使我努力做一个艰苦卓绝的圣雄。
004.自我炼钢.txt	107	此后我甘愿过一个“以自苦为极”的生活，要活就要这样“跟自己过不去”地活，活一天是一天，活到哪天算哪天，它既然无法彻底排遣掉，那我索性认了：我跟它拼了，慷慨地拼了，随它怎么样磨折我吧，我不再回避了，我迎接它！（《大学札记》1957年6月19日）
004.自我炼钢.txt	111	“明察目光”（open-eyed）的态度对我这盲目自欺已久的人说来，该是极为必要的，“它尽管使人认识善，可不连带宽恕恶。”（It gives knowledge of good，it does not involve forgetfulness of evil．）不愿正视真相而一味拿“善”（good）来蒙蔽自己的眼睛，该是一件非常不智的愚蠢行为，而由这种愚蠢行为带来的痛苦，却又是最不值得、最没有意义的！我要睁开眼睛认清：人都有两面，只看“善”（good）的一面而不愿正视“恶”（evil）的一面的结果，“善”（good）的本身就逐渐膨胀成全体了，在不知不觉之间它慢慢成为神圣的了、太多的了、清一色百分之百的了、无人可及“除却巫山不是云”的了……于是你便被欺骗（当然是自欺）了！所以，我要对自己恳切地说：不要再欺骗自己吧，不要再迷恋偶像，赶紧从事一种明智的舍弃，……（《大学札记》1957年6月19日）
004.自我炼钢.txt	115	胸襟广大度量宽宏的人最尊重别人与自己的人格，不肯丝毫勉强去做一件事或求（强求）一件事，他异常重视别人的自由意志与感情，也非常自爱于一己的不卑与尊严，当他发现事情的发展侵害到任何一方面的人格的时候，他就立刻用一种温和有礼的态度去做有所不为的牺牲了，为了尊贵与美德，他因此遭遇到任何痛苦与遗憾，他都在所不计甘愿忍受，“合则留，不合则去”，这是他为人的爽朗；“不降其志，不辱其身”，这是他为人的决绝。他认为人生最神圣的事，在于堂堂地做一个自尊心极强的“人”，而不是做一个勉强别人或乞求别人“怜”的“贱丈夫”。“不义而富且贵，于我若浮云”，这是何等有所不为的胸襟！（《大学札记》1957年6月21日）
004.自我炼钢.txt	119	我深深体会到“有余味”的感觉与快乐，这种感觉与快乐是轻松的、宁静的、安全的、自尊的、“宠辱不惊”的、“无为而无不为”的。近来我颇觉节制自抑含蓄的态度的有味，而我也高兴我能不觉费力不觉勉强的做到这个境界。（《大学札记》1957年6月24日）
004.自我炼钢.txt	123	邵康节言：“年老不歇，为一惑；安而不乐，为二惑；闲而不清，为三惑。”现在我颇能得到安闲生活的乐趣，我也逐渐深信只有这种生活才能带给我最大的愉快与进步，整天徜徉在绝对自由的气氛里，要做什么就做什么，一点也不受别人意见的限制，这该是多么轻松的生活！今天我才深深知道以无穷的操心与烦恼，去换得一种欢乐的做法是何等的不智！（《大学札记》1957年6月26日）
004.自我炼钢.txt	127	胸襟与雄心的开旷与远大，是我近来所收割的许多成果之一，由于它的吸引，我的生活转入了一条新的大路，这条大路所具有的是被胸襟与雄心所灌溉起来的远景，而对这远景的瞩目将使我得到相当成功的解脱，它使我不再有世俗的兴趣与苦闷（第一步是耻于如此，第二步是无意如此，第三步是无暇如此），它使我“无法容忍我自己竟和他们一样，我若不能使我与他们比起来有大大的不同，我将感到极端的可耻”与非常的不安，我清楚的知道李敖是无法再走老路的人了，“做了过河卒子，只有依旧向前”，我把我自己逼上梁山了。（《大学札记》1957年7月4日）
004.自我炼钢.txt	131	与知心朋友谈天，我很愉快的说很多话；与俗人相处，我就非常爱沉默了。这种态度我觉得很合适。（《大学札记》1957年7月5日）
004.自我炼钢.txt	135	我无法谦虚了，我深觉继往开来的重担上，我担当着一大部分重量，而这等责任又是非我莫属、舍我其谁的，我无法放松我自己，因为我无法忘怀我所应尽的责任，我深知在这浑噩的男人群里，我是一个罕有的奇才，一枝锋芒的独秀，没有人能够跟我相比，我站在世界的一方！（《大学札记》1957年7月5日）
004.自我炼钢.txt	139	我已深知愉快之道，愉快一定要建筑在自恃上面才是真正的长久的，倚恃别人我绝对得不到愉快。（《大学札记》1957年7月6日）
004.自我炼钢.txt	145	我嘲笑这种不健全的病态，同时我也决定放弃——尽量彻底的放弃这种态度，不管别人怎么解释，不管对我有何“好处”，我决定惟妙惟肖的学到胡适内在的乐观与外在的笑脸——这是我今天的大收割。（《大学札记》1957年7月6日）
004.自我炼钢.txt	155	屈原的《九章·抽思》充分写出了这种种瓜得瓜种豆得豆的因果铁律，功力是永远不会唐捐的，写到这里，我想起克里蒙梭和他的《深夜自扪》，“老虎”毕生的成就给了我这在深夜中不停地努力着的男孩子无限的鼓励，我深信我迟早会有扬眉吐气的一天的！（《大学札记》1957年7月7日）
