score	file	line	text	context
4	021.1960年10月.txt	545	任何做母亲的，都不能单凭自己资源喂饱这三个小娃娃。	（四）“任何做母亲的，都不能单凭自己资源喂饱这三个小娃娃。”
4	021.1960年10月.txt	547	这可怜的家伙老想讨人欢喜，仿佛他认为必须如此才能弥补他的缺陷。	（五）“这可怜的家伙老想讨人欢喜，仿佛他认为必须如此才能弥补他的缺陷。”
3	021.1960年10月.txt	549	喔，伟大公正的上帝，我们没有一个人知道这位长眠者知道些什么，我们也没有资格评断他与你之间的一切。	（六）“喔，伟大公正的上帝，我们没有一个人知道这位长眠者知道些什么，我们也没有资格评断他与你之间的一切。”
3	021.1960年10月.txt	551	我便想起可怜的石老先生那声：‘我的安——东尼娅！’他说的那么少，可是所表达出来的却那么深！	（七）“我便想起可怜的石老先生那声：‘我的安——东尼娅！’他说的那么少，可是所表达出来的却那么深！”
7	021.1960年10月.txt	553	（吵嘴）最后一句话由您说吧，这是太太小姐们的特权。	（八）“（吵嘴）最后一句话由您说吧，这是太太小姐们的特权。”
3	021.1960年10月.txt	555	只要一个农夫，染上了要找他（克德，放高利贷者）的习惯以后，那就好像上了赌博或是买彩票的瘾似的，遇到失望之余，便不想回到克德那里去的。	（九）“只要一个农夫，染上了要找他（克德，放高利贷者）的习惯以后，那就好像上了赌博或是买彩票的瘾似的，遇到失望之余，便不想回到克德那里去的。”
6	021.1960年10月.txt	557	这个梦在我面前摊开的诗集上浮荡着如同一幅画，下面印有一行伤感的字句：‘人生最好的日子总是过得最快。’	（十）“这个梦在我面前摊开的诗集上浮荡着如同一幅画，下面印有一行伤感的字句：‘人生最好的日子总是过得最快。’”
4	021.1960年10月.txt	561	假如有什么事我受不了的话，那就为穿得破烂的有钱女人。	（十二）“假如有什么事我受不了的话，那就为穿得破烂的有钱女人。”
3	021.1960年10月.txt	563	……依旧是安东尼娅的眼睛，自从我上次最后一次与他们相望以后，我曾瞧过数千万张不同的人脸，可是从没见过像她那样的眼睛。她的本来面貌逐渐也出现了。岁月所造成的改变，在我眼里也就渐渐不很明显，她不但别来无恙，而且正是最奋发有为的时候，虽然饱经风霜，可是并没有萎缩。	（十三）“……依旧是安东尼娅的眼睛，自从我上次最后一次与他们相望以后，我曾瞧过数千万张不同的人脸，可是从没见过像她那样的眼睛。她的本来面貌逐渐也出现了。岁月所造成的改变，在我眼里也就渐渐不很明显，她不但别来无恙，而且正是最奋发有为的时候，虽然饱经风霜，可是并没有萎缩。”
3	021.1960年10月.txt	565	我知道那么多的女人，虽然保全了她所失去的一切，可是内心的光辉却已逐渐黯淡。然而安东尼娅，不论她已否失去什么，可是她却还没有失去她生命之火。	（十四）“我知道那么多的女人，虽然保全了她所失去的一切，可是内心的光辉却已逐渐黯淡。然而安东尼娅，不论她已否失去什么，可是她却还没有失去她生命之火。”
3	021.1960年10月.txt	567	安东尼娅总是能在人脑子里留下一个不会磨灭而且愈来愈深刻的印象。我脑子里便有一连串的这种印象，鲜明得就好像小学课本里的插图一样。	（十五）“安东尼娅总是能在人脑子里留下一个不会磨灭而且愈来愈深刻的印象。我脑子里便有一连串的这种印象，鲜明得就好像小学课本里的插图一样。”
4	021.1960年10月.txt	573	我还活着，你们瞧，而且还能说话，你们证明我太太死后我还活着。……	“各位请进。”他气如游丝般的说：“我还活着，你们瞧，而且还能说话，你们证明我太太死后我还活着。……”
4	021.1960年10月.txt	577	他喜欢白天干白天的、晚上干晚上的，过得与世人随波逐流。	（十八）“他喜欢白天干白天的、晚上干晚上的，过得与世人随波逐流。”
4	021.1960年10月.txt	581	无论我们失去什么，错过什么，可是那宝贵的，别人无从领会的往事，却永远属于我们所有的。	（二十）“无论我们失去什么，错过什么，可是那宝贵的，别人无从领会的往事，却永远属于我们所有的。”
5	021.1960年10月.txt	585	如何实践诚实荣誉班训	今天我承在座的某几位前辈的抬举，看得起我，推我到这儿来讲几句话，题目是“如何实践诚实荣誉班训”。按照一般演讲的惯例，我该说人家选我做代表我该感到很荣幸，可是我若说我感到很荣幸，我便对不起我自己的良心，我便不诚实了，因为我感到的不是荣幸，而是伤心。
4	021.1960年10月.txt	599	为政不在多言，顾力行何如耳。	两千多年前，汉朝的一个皇帝问一位九十多岁的老头子如何做人做事，老头子回答他说：“为政不在多言，顾力行何如耳。”就是说，实践诚实荣誉多讲话是没用的，要去实行才行。就好像在队伍面前喊口令，我们这些充员官喊起口令来，都是不伦不类南腔北调的，喊立正不像立正，像踩了鸡脖子；喊稍息不像稍息，像车胎泄了气，人家不要问，一听就知道这是充员官喊出来的。补救的办法不是开个演讲比...
8	021.1960年10月.txt	603	父子不责善，责善则离	古人言“父子不责善，责善则离”，岂止父子，夫妇、兄弟、朋友，何其不然，俗云：柴米夫妇，酒肉朋友，非全无由。处今之世，一切是非价值道德之标准皆动摇或失落，人间何能以“善”相“责”？于风雨飘摇之舟中，唯互助互谅耳，所谓“谅”有二义：
3	021.1960年10月.txt	603	善	古人言“父子不责善，责善则离”，岂止父子，夫妇、兄弟、朋友，何其不然，俗云：柴米夫妇，酒肉朋友，非全无由。处今之世，一切是非价值道德之标准皆动摇或失落，人间何能以“善”相“责”？于风雨飘摇之舟中，唯互助互谅耳，所谓“谅”有二义：
4	021.1960年10月.txt	621	身不修，不可以齐其家。	我猜中：“身不修，不可以齐其家。”
3	021.1960年10月.txt	623	反共革命战争的本质	四、一—二“反共革命战争的本质”。
3	021.1960年10月.txt	625	怎样扩大本年三民主义讲习班教育的影响	五、三—四专题讨论“怎样扩大本年三民主义讲习班教育的影响”。第一区队长叫我出来，怪我勿再乱扯个人历史、乱讲话引人反感，对“历史人物评介”寄厚望，叫我下来准备，得乘机摸鱼两小时，为之大快。
4	021.1960年10月.txt	629	每次我经过播音室门口，小姐们就把门关起来了，我希望她们不要把门关起来。	七、五—六荣团会，团长来压阵，我发言：“每次我经过播音室门口，小姐们就把门关起来了，我希望她们不要把门关起来。”众大笑。或谓我为什么不去敲门。此事先后引起主席、区队辅导员评论，最后一营营长（中队长）来评论了，狠狠反击我一次。（“人人皆有高见，独一位同学，说话根本考虑都不考虑。”）我只窃笑彼乏幽默感耳！大概昨晚我演讲开他玩笑，他恨起洒家来了。出来我又去盯那个女...
4	021.1960年10月.txt	629	人人皆有高见，独一位同学，说话根本考虑都不考虑。	七、五—六荣团会，团长来压阵，我发言：“每次我经过播音室门口，小姐们就把门关起来了，我希望她们不要把门关起来。”众大笑。或谓我为什么不去敲门。此事先后引起主席、区队辅导员评论，最后一营营长（中队长）来评论了，狠狠反击我一次。（“人人皆有高见，独一位同学，说话根本考虑都不考虑。”）我只窃笑彼乏幽默感耳！大概昨晚我演讲开他玩笑，他恨起洒家来了。出来我又去盯那个女...
3	021.1960年10月.txt	631	革命精神与革命方法孰重	八、七—八辩论比赛，“革命精神与革命方法孰重”，颇令人发大噱，尤其可见阿兵哥们的逻辑程度。
4	021.1960年10月.txt	633	你真有一套，天才天才。	九、唐斌：“你真有一套，天才天才。”
3	021.1960年10月.txt	651	猜谜晚会	七、夜“猜谜晚会”想不到董学英竟来了，浅红毛衣、无袖白衬衫、瘦黑裙、白高跟皮鞋，唱的是《恋爱经》，中言只攻莫退，一次失败莫灰心云云，很可爱，我吸烟不停，目之不停，她似发觉。
7	021.1960年10月.txt	657	你要砍上将（校）的脖子，要我我也不给你第一。	一、一—二“历史人物评介”，八人中我第七名讲，正好赶上休息十分钟下来，人员到齐，老子精神百倍，烟士波里纯大来，一时气壮声铿，出语为机枪，生平首次用麦克风，效果极佳，我独不用稿子，且两次发言消遣发言者第三号之论诸葛亮之不当，尔昭说万万没想到你有演讲的天才，但你的音色不好，完全是“儿童音”，我也捧了几句关老爷，无奈他们却全误会那些话也是讽刺的了。一营营长没来，又...
4	021.1960年10月.txt	657	历史人物评介	一、一—二“历史人物评介”，八人中我第七名讲，正好赶上休息十分钟下来，人员到齐，老子精神百倍，烟士波里纯大来，一时气壮声铿，出语为机枪，生平首次用麦克风，效果极佳，我独不用稿子，且两次发言消遣发言者第三号之论诸葛亮之不当，尔昭说万万没想到你有演讲的天才，但你的音色不好，完全是“儿童音”，我也捧了几句关老爷，无奈他们却全误会那些话也是讽刺的了。一营营长没来，又...
4	021.1960年10月.txt	663	水淹七军	我说到这儿，大家都知道我说的这位陆军上将是谁了，此人姓关名羽，字云长，长得粗眉大眼，虎体龙腰，胡子很长，血压很高，所以脸很红，是三国时代蜀国的上将军，等于现在的陆军上将。他是刘备的弟弟，张飞的哥哥，关云的爸爸，天下姓关的老祖宗，京戏里边“水淹七军”的男主角，“走麦城”的失败英雄，同时还是陆军十七师四十九团二营四连炮排排长我所选出来参加“历史人物评介”的当选人...
4	021.1960年10月.txt	663	历史人物评介	我说到这儿，大家都知道我说的这位陆军上将是谁了，此人姓关名羽，字云长，长得粗眉大眼，虎体龙腰，胡子很长，血压很高，所以脸很红，是三国时代蜀国的上将军，等于现在的陆军上将。他是刘备的弟弟，张飞的哥哥，关云的爸爸，天下姓关的老祖宗，京戏里边“水淹七军”的男主角，“走麦城”的失败英雄，同时还是陆军十七师四十九团二营四连炮排排长我所选出来参加“历史人物评介”的当选人...
5	021.1960年10月.txt	667	哎呀！上帝呀，你看他们把我写成这个样子，我老关可真不敢当呀！	我个人过去在台湾大学历史系鬼混过四年，整天抱着死人骨头跟死人算死账，整天搞“历史人物评介”，“历史人物评介”对我们说来是家常便饭、拿手好戏，对历史人物不敢说是有研究，只能说稍稍知道一点点皮毛，正史上关于关公的记载只有一部书，就是二十五史里边的《三国志》，大家知道《三国志》当然不是《三国演义》，也不是《三国志演义》。《三国志》的作者姓陈名寿叫陈寿，他的时代和关...
3	021.1960年10月.txt	681	我们还是说相声吧！	四、晚会，董：“我们还是说相声吧！”甚可爱，其他节目则甚烦人。
3	021.1960年10月.txt	713	听说你大出风头！	三、午后又与天昭在福利社，宫连长谓：“听说你大出风头！”
7	022.不与集·1960年11月.txt	37	见10月31日《中央日报》否？可细阅第一版下婚姻广告，当有所得，即此还报凤去楼空……	四、凤移堂主人以简信来：“见10月31日《中央日报》否？可细阅第一版下婚姻广告，当有所得，即此还报凤去楼空……”云云，乃遍寻前日报纸，至军法组始得，万万想不到竟是Rosa结婚启事！我自军法组踏沥青路归来，虽为阴历十四之月色，可是阴云遮了它，我有一点点小的激动，又忍不住笑。
3	022.不与集·1960年11月.txt	51	老骨头实在抗他不起！	天将降“消遣”于斯人也！先必吊其胃口，夺其女人，虎落平阳被犬欺，恶龙独怕地头蛇，如今既掉在老天爷手里，还有何话可说？“老骨头实在抗他不起！”
3	022.不与集·1960年11月.txt	69	已禁止使用	前二句并非指“阳痿”，特此郑重声明，深盼玫园勿妄作解人也！提到玫园，我想起来了，即日起解除钧座玫园称号，此号“已禁止使用”，如非留恋此名不可，故暂以“霉园”代用。
3	022.不与集·1960年11月.txt	109	汉唐以来所未有也！	三、午与珂吃蕉长谈。报载一人谓贾利古柏一辈演侠义英雄，老年演“黄昏之恋”，乃盛名之累白玉之玷，此与钱穆“汉唐以来所未有也！”同一气概！
5	022.不与集·1960年11月.txt	117	头发蓬乱，仪容不整，没礼貌	“三民主义讲习班”被抓公差，参加讲演比赛，本人先讽第一营营长不诚实（此人常打一预官朋友官腔，故乘机讽之），继说师长对“班训”解释之错误，然后军中乐园、打炮、女人大腿、anti论、高跟鞋等全部出笼，众大哄堂，我的营长笑得抬不起头，众大笑后继大骇异，盖彼等当兵以来从未见如此庄严场合竟有如此狂人也。事后中队长（即第一营营长）以“头发蓬乱，仪容不整，没礼貌”反击我，...
5	022.不与集·1960年11月.txt	119	我们很久没听你讲演了，你又来了！	“历史人物评介”比赛又把我推出来，本拟讲武瞾或玉环，因为已受好几个笑脸警告，谓在那种神圣场合安可再及于女人？于是我被硬指定讲关公，在十三四分钟的演说里；在副师长瞪眼睛里；在四五百军官大笑欢呼嗟叹声里；在十几次掌声打断的情况里，我以严肃的脸孔；以台大历史系的金牌子；以嘻笑讽刺的口吻，轻而易举的拆穿了关老爷那张偶像的脸，顺便拆穿了花木兰、包龙图、郑成功等人的真面...
5	022.不与集·1960年11月.txt	119	李敖啊！你真有一套，你的历史背得真有一套！	“历史人物评介”比赛又把我推出来，本拟讲武瞾或玉环，因为已受好几个笑脸警告，谓在那种神圣场合安可再及于女人？于是我被硬指定讲关公，在十三四分钟的演说里；在副师长瞪眼睛里；在四五百军官大笑欢呼嗟叹声里；在十几次掌声打断的情况里，我以严肃的脸孔；以台大历史系的金牌子；以嘻笑讽刺的口吻，轻而易举的拆穿了关老爷那张偶像的脸，顺便拆穿了花木兰、包龙图、郑成功等人的真面...
3	022.不与集·1960年11月.txt	119	你的演说使三民主义讲习班光芒万丈！使预官班光芒万丈！	“历史人物评介”比赛又把我推出来，本拟讲武瞾或玉环，因为已受好几个笑脸警告，谓在那种神圣场合安可再及于女人？于是我被硬指定讲关公，在十三四分钟的演说里；在副师长瞪眼睛里；在四五百军官大笑欢呼嗟叹声里；在十几次掌声打断的情况里，我以严肃的脸孔；以台大历史系的金牌子；以嘻笑讽刺的口吻，轻而易举的拆穿了关老爷那张偶像的脸，顺便拆穿了花木兰、包龙图、郑成功等人的真面...
3	022.不与集·1960年11月.txt	119	为了讨好听众，你的效果达到了；为了争取第一，你就失败了。我们内心佩服你，可是场合不同，所以你得了最末一名！	“历史人物评介”比赛又把我推出来，本拟讲武瞾或玉环，因为已受好几个笑脸警告，谓在那种神圣场合安可再及于女人？于是我被硬指定讲关公，在十三四分钟的演说里；在副师长瞪眼睛里；在四五百军官大笑欢呼嗟叹声里；在十几次掌声打断的情况里，我以严肃的脸孔；以台大历史系的金牌子；以嘻笑讽刺的口吻，轻而易举的拆穿了关老爷那张偶像的脸，顺便拆穿了花木兰、包龙图、郑成功等人的真面...
5	022.不与集·1960年11月.txt	121	这是我生平最正经的一次讲演了，怎么还是不庄？	人或贼笑，问我为何出语皆如此之不庄？我说：“这是我生平最正经的一次讲演了，怎么还是不庄？”其他毁誉甚多，不及讲述也。
7	022.不与集·1960年11月.txt	133	发乎情，止乎‘理’（Reason）	六、推窗看月，正阴历九月十五之月色也，凄清颇引我幻思，重洋雪景，往事云烟，结果是“发乎情，止乎‘理’（Reason）”，不足为害也。
3	022.不与集·1960年11月.txt	161	你们快熬出来了！	三、下午本要听课，参谋长力戒要到，可是我仍溜出营门，与施珂到凤山“打针”去了，在步校访林英义、王秋原、庄因、阿波罗、宋罗泉、宋炳希、郑秀陶等等，及许多忘记姓名的朋友。又去二五二同吃木瓜，到处与珂指点追忆，虽然不过十个多月，可是一时之盛的第九队，竟作鸟兽散——从队长起，散得干干净净，看到这些新一代的预官，和他们的际遇，完全是我们的原案！访召雄不在，归在树权教室...
3	022.不与集·1960年11月.txt	199	国家长期发展科学研究讲座助教	九、见报使我明白了“国家长期发展科学研究讲座助教”是怎么回事。
4	022.不与集·1960年11月.txt	329	我很高兴你这块‘硬骨头’不再‘心酸酸’了，你用红笔画的‘心’很好看，别出心裁。	三、英善寄来宪法书，并谓：“我很高兴你这块‘硬骨头’不再‘心酸酸’了，你用红笔画的‘心’很好看，别出心裁。”英善并言周辰要订婚，程建英即结婚。
4	022.不与集·1960年11月.txt	351	……冷待老友，必遭天谴雷殛，且半夜三更将有厉鬼来击汝脑。	五、给新汉，命转与萧信，并戏谓：“……冷待老友，必遭天谴雷殛，且半夜三更将有厉鬼来击汝脑。”
7	022.不与集·1960年11月.txt	391	值得爱多少，就玩多少（程度）	四、珂来谈一上午，我又述我之“自毁主义”①，此种主义纵不能达“与汝偕亡”或“玉石俱焚”之程度，但至少可达“宁为玉碎”之目的，故又可名曰“玉碎主义”，珂言此正如噬脐莫及之“麝”也，此例甚足以说明此种主义之态度。珂言其与徐静往事，很好玩，其言“值得爱多少，就玩多少（程度）”，故彼可“赋予女人免于恐惧的自由”②。珂欲送我一笔，我谢绝了。
6	022.不与集·1960年11月.txt	391	赋予女人免于恐惧的自由	四、珂来谈一上午，我又述我之“自毁主义”①，此种主义纵不能达“与汝偕亡”或“玉石俱焚”之程度，但至少可达“宁为玉碎”之目的，故又可名曰“玉碎主义”，珂言此正如噬脐莫及之“麝”也，此例甚足以说明此种主义之态度。珂言其与徐静往事，很好玩，其言“值得爱多少，就玩多少（程度）”，故彼可“赋予女人免于恐惧的自由”②。珂欲送我一笔，我谢绝了。
4	022.不与集·1960年11月.txt	391	自毁主义	四、珂来谈一上午，我又述我之“自毁主义”①，此种主义纵不能达“与汝偕亡”或“玉石俱焚”之程度，但至少可达“宁为玉碎”之目的，故又可名曰“玉碎主义”，珂言此正如噬脐莫及之“麝”也，此例甚足以说明此种主义之态度。珂言其与徐静往事，很好玩，其言“值得爱多少，就玩多少（程度）”，故彼可“赋予女人免于恐惧的自由”②。珂欲送我一笔，我谢绝了。
4	022.不与集·1960年11月.txt	391	与汝偕亡	四、珂来谈一上午，我又述我之“自毁主义”①，此种主义纵不能达“与汝偕亡”或“玉石俱焚”之程度，但至少可达“宁为玉碎”之目的，故又可名曰“玉碎主义”，珂言此正如噬脐莫及之“麝”也，此例甚足以说明此种主义之态度。珂言其与徐静往事，很好玩，其言“值得爱多少，就玩多少（程度）”，故彼可“赋予女人免于恐惧的自由”②。珂欲送我一笔，我谢绝了。
4	022.不与集·1960年11月.txt	391	玉碎主义	四、珂来谈一上午，我又述我之“自毁主义”①，此种主义纵不能达“与汝偕亡”或“玉石俱焚”之程度，但至少可达“宁为玉碎”之目的，故又可名曰“玉碎主义”，珂言此正如噬脐莫及之“麝”也，此例甚足以说明此种主义之态度。珂言其与徐静往事，很好玩，其言“值得爱多少，就玩多少（程度）”，故彼可“赋予女人免于恐惧的自由”②。珂欲送我一笔，我谢绝了。
3	022.不与集·1960年11月.txt	391	玉石俱焚	四、珂来谈一上午，我又述我之“自毁主义”①，此种主义纵不能达“与汝偕亡”或“玉石俱焚”之程度，但至少可达“宁为玉碎”之目的，故又可名曰“玉碎主义”，珂言此正如噬脐莫及之“麝”也，此例甚足以说明此种主义之态度。珂言其与徐静往事，很好玩，其言“值得爱多少，就玩多少（程度）”，故彼可“赋予女人免于恐惧的自由”②。珂欲送我一笔，我谢绝了。
3	022.不与集·1960年11月.txt	391	宁为玉碎	四、珂来谈一上午，我又述我之“自毁主义”①，此种主义纵不能达“与汝偕亡”或“玉石俱焚”之程度，但至少可达“宁为玉碎”之目的，故又可名曰“玉碎主义”，珂言此正如噬脐莫及之“麝”也，此例甚足以说明此种主义之态度。珂言其与徐静往事，很好玩，其言“值得爱多少，就玩多少（程度）”，故彼可“赋予女人免于恐惧的自由”②。珂欲送我一笔，我谢绝了。
8	022.不与集·1960年11月.txt	393	一样飘零，宁为尘土，勿随流水	①静安《水龙吟》有“一样飘零，宁为尘土，勿随流水”之句，可移作此种主义之扉句也（1960年11月12日，敖之补记）。
3	022.不与集·1960年11月.txt	425	道	（后两句中，“是”字改“道”字，可作一可爱之小对联。）
4	022.不与集·1960年11月.txt	427	相逢恨在我微诗	此正符合我那“相逢恨在我微诗”之论，“郎”字改“君”字稍好。
3	022.不与集·1960年11月.txt	427	君	此正符合我那“相逢恨在我微诗”之论，“郎”字改“君”字稍好。
3	022.不与集·1960年11月.txt	477	革命大家庭里的怪人	十三、晚上萧镜昌送我的两张漫画。尔昭又来，我大唱了一阵歌。萧言他永远不能忘我这“革命大家庭里的怪人”，“十七师军史里面的怪人”。
3	022.不与集·1960年11月.txt	477	十七师军史里面的怪人	十三、晚上萧镜昌送我的两张漫画。尔昭又来，我大唱了一阵歌。萧言他永远不能忘我这“革命大家庭里的怪人”，“十七师军史里面的怪人”。
5	022.不与集·1960年11月.txt	511	种瓜得瓜，种豆得豆	你千万不要失望，没有无果之因的，苏格拉底为真理而殉命，他自己还得靠永生的信念来支持，他一直未死的，他的“法身”长存在人间，现代的倒更多，不赘，“种瓜得瓜，种豆得豆”真是千古不移之论。
4	022.不与集·1960年11月.txt	531	一、我已为那条恶狗娶了东洋婆娘。二、很想见你谈谈我这一两个月的性生活。……	十五、善培来片：“一、我已为那条恶狗娶了东洋婆娘。二、很想见你谈谈我这一两个月的性生活。……”
8	022.不与集·1960年11月.txt	665	收敛、有力	十三、苏国安骂胡适第三势力等等。今晚事使我益恨我自己竟与蠢人争是非，实在有失“收敛、有力”的纪律，太说不过去了，与这些“人”面红耳赤争什么呢？最好的态度就是哈哈哈委蛇一阵，无争即走可也！今晚我真知道我错了，我恨我错了。还有，我应该想到“身价”两个字，勿自污也！不可与言而与之言，是失言也，失言乃自污也。
3	022.不与集·1960年11月.txt	665	人	十三、苏国安骂胡适第三势力等等。今晚事使我益恨我自己竟与蠢人争是非，实在有失“收敛、有力”的纪律，太说不过去了，与这些“人”面红耳赤争什么呢？最好的态度就是哈哈哈委蛇一阵，无争即走可也！今晚我真知道我错了，我恨我错了。还有，我应该想到“身价”两个字，勿自污也！不可与言而与之言，是失言也，失言乃自污也。
