file	line	quote	context
023.“一国两制”说从头.txt	23	官样文章	一、行政院新闻局诉愿决定书，一派官样文章，说李敖等著作发行之《李敖千秋评论丛书》71——《外交·性交·交》出版品一册，因载有张春男著之《明辨是非、分清敌我、坚持“一国两制”》一文，内容显违出版法第32条第1款，出版品不得为煽动他人触犯内乱罪之记载规定。……与中共伪政权主张之“一国两制”相呼应。查中共伪政权系叛乱团体，僭言“一国两制”，实为统战阴谋云云。因而认定行政处分得当，诉愿显无理由。
023.“一国两制”说从头.txt	27	大惊小怪	三、在法理部分，行政院新闻局官样文章说：“而此所谓内乱罪，依刑法第100条第1项之规定观之，系指意图破坏、窃据国土，或以非法之方法变更国宪、颠覆政府而言。”显然进一步把刑法拉出来给出版法撑腰，把出版法导入刑法解释。但按刑法解释，却必须以武力、暴动、暴力为成立条件，如果只是出之以语言文字，并不构成。例如1962年美国修正《史密斯法》第2385条规定，倡导推翻政府的三种情形，都以“以武力暴动方法推翻或摧毁美国各级政府”为构成要件；1971年瑞士修正刑法第265条规定，叛乱罪以“意图变更联邦宪法或各邦宪法；或撤废宪法上之
023.“一国两制”说从头.txt	27	官样文章	三、在法理部分，行政院新闻局官样文章说：“而此所谓内乱罪，依刑法第100条第1项之规定观之，系指意图破坏、窃据国土，或以非法之方法变更国宪、颠覆政府而言。”显然进一步把刑法拉出来给出版法撑腰，把出版法导入刑法解释。但按刑法解释，却必须以武力、暴动、暴力为成立条件，如果只是出之以语言文字，并不构成。例如1962年美国修正《史密斯法》第2385条规定，倡导推翻政府的三种情形，都以“以武力暴动方法推翻或摧毁美国各级政府”为构成要件；1971年瑞士修正刑法第265条规定，叛乱罪以“意图变更联邦宪法或各邦宪法；或撤废宪法上之
023.“一国两制”说从头.txt	27	司空见惯	三、在法理部分，行政院新闻局官样文章说：“而此所谓内乱罪，依刑法第100条第1项之规定观之，系指意图破坏、窃据国土，或以非法之方法变更国宪、颠覆政府而言。”显然进一步把刑法拉出来给出版法撑腰，把出版法导入刑法解释。但按刑法解释，却必须以武力、暴动、暴力为成立条件，如果只是出之以语言文字，并不构成。例如1962年美国修正《史密斯法》第2385条规定，倡导推翻政府的三种情形，都以“以武力暴动方法推翻或摧毁美国各级政府”为构成要件；1971年瑞士修正刑法第265条规定，叛乱罪以“意图变更联邦宪法或各邦宪法；或撤废宪法上之
023.“一国两制”说从头.txt	31	四不像	一国三制是半吊子内阁制、半吊子总统制、半吊子五权制，但在宪法上，它却是四不像的一国四制。因为宪法前言开宗明义说“依据孙中山先生创立中华民国之遗教”而“制定本宪法”，事实上，孙中山主张人民有权，政府有能，人民的四种政权在中央由国民大会代表行使。可是宪法第27条却把国民大会弄成选举总统和修改宪法的机构——一方面依据遗教一方面又不依据，这是“一国两制”；孙中山又主张政府的五种治权各自独立，分工合作，五院都对国民大会负责，可是宪法却在第55条、第57条、第79条、第84条、第104条上互相制衡，结果行使政权的国民大会，被行
023.“一国两制”说从头.txt	33	口口声声	一国四制的《宪法》，说在1947年12月25日起施行，可是不到五个月，就冒出动员戡乱时期临时条款来法外有法，这是国民党总裁的又一杰作，一方面捧出宪法口口声声行宪，一方面又捧出动员戡乱时期临时条款实实在在违宪，公然“一国两制”，凡四十年，政权虚伪滑稽如此，真是古今一绝也！
023.“一国两制”说从头.txt	35	不胜枚举	五、在事实部分，事涉“一国两制”的，也不胜枚举。外在的事实方面：国民党政权在台湾搞独立，使中国变成不能统一，形成事实上的“一国两制”；宪法第一条即“基于三民主义”，三民主义书中却明说民生主义“又名共产主义”，但国民党又严禁共产主义，并大法伺候之，这又是事实上的“一国两制”。内在的事实方面，种类繁多；例如台湾法院罚钱用银元、市面交流用新台币，此“一国两制”也；台湾使用新台币、金马使用金门币、马祖币，此“一国两制”也；台湾省县市长皆民选，福建省金门县、连江县县长皆军派，此“一国两制”也；台湾省县市有议会，金门、马祖没议
023.“一国两制”说从头.txt	39	官官相护	现在我以再诉愿的形式给贵院，明知你们官官相护，并且政由己出，但我仍愿以再诉愿为手段，逼出真相来。因为愈逼愈露马脚，看看你们这个政权从下到上，层层露马脚，也是现代版《官场现形记》的一章，斯亦乐事。因此我忙里偷闲，把愿一诉再诉，大家逗乐一番，要看你们现形也！
024.连环处分，真有趣呀！.txt	15	平心静气	一、顷见行政院新闻局辑印《请平心静气——听听沉默大众的声音》一书，版权页上，白纸黑字如下：
025.林洋港说话算数吗？.txt	7	司空见惯	为什么不收红包的法官，也是败坏司法的能手呢？原因主要有两个：第一是上级的压力；第二是自己的水准。在上级的压力方面，国民党统治下，政治干涉司法，早已是司空见惯的，堂堂司法院长本人，就是国民党的中常委，司法院长都不避嫌如此，若要法官善尽《宪法》第80条“超出党派以外”的责任，又谈何容易！这样一来，法官在上级的压力下，其不希旨承风、察言观色以断案者，又能有几人？有的案子，有幸不被上级光顾，但是法官自己的水准，也影响到判决书的品质。二十七年来，我亲历法官无数，但是他们之中，有许多人却连法理解释和证据法则的修养都大有问题。以
