score	file	line	text	context
5	001.我的希望.txt	5	人必自侮，而后人侮之	今天我们所受的苦难，都是我们这个民族努力不够的当然结果。也就是说：我们今日所受的失败和耻辱，都是由于过去种种恶因种下的恶果。我们每一个人都不必替自我作辩护，要知道“人必自侮，而后人侮之”；“自侮”的成份一个不减少，怪别人为什么比你强，为什么欺负你。我们要扪心自问一下，自己是什么样的人，国家是一个什么样的国家。你自己如果是眼高手低，志大才疏，那你就没有脸去开会...
8	001.我的希望.txt	9	在这世界里，就好像在大海中，最要紧的，是先救你自己	克莱勒说：“努力去做那些最近于你们目前的事”。易卜生说：“在这世界里，就好像在大海中，最要紧的，是先救你自己”。本着这句箴言，我希望我们能够说出心坎的话，做许多实际的事，要知道除此而外，其他一切的行动都是无裨救国的空谈。时至今日如果再背着良心来“高喊”救国，这真是“自作孽，不可活”了。
8	001.我的希望.txt	9	自作孽，不可活	克莱勒说：“努力去做那些最近于你们目前的事”。易卜生说：“在这世界里，就好像在大海中，最要紧的，是先救你自己”。本着这句箴言，我希望我们能够说出心坎的话，做许多实际的事，要知道除此而外，其他一切的行动都是无裨救国的空谈。时至今日如果再背着良心来“高喊”救国，这真是“自作孽，不可活”了。
5	001.我的希望.txt	9	努力去做那些最近于你们目前的事	克莱勒说：“努力去做那些最近于你们目前的事”。易卜生说：“在这世界里，就好像在大海中，最要紧的，是先救你自己”。本着这句箴言，我希望我们能够说出心坎的话，做许多实际的事，要知道除此而外，其他一切的行动都是无裨救国的空谈。时至今日如果再背着良心来“高喊”救国，这真是“自作孽，不可活”了。
3	002.狱中书信两封.txt	3	书刊以曾经内政部登记有案准许出版者为限	屡承你寄书，至感。所中书刊检查管制办法春来稍有更动，“书刊以曾经内政部登记有案准许出版者为限”，纵经登记有案出版者，如有左列情形之一之书刊，概不发阅（未经登记者自更属之）
3	002.狱中书信两封.txt	41	托丁卖书，丁已前后代为垫汇我九千元，如今他书没拿到，房子也腾不清，无法运用，我内心实感不安。我盼你再南下一次，周渝擅买那三个新铁柜及台中的家俱移丁处理，丁要的书，能找出多少，找出多少，立据给你。然后就现状稍事清理，把台中老家封存起来算了。台中书房似非等我出来，无法可想。	你除夕信及代垫卖书款贰仟元收到。你说：“房子二月不可能腾出来。”书，房二事乃一事，前者不得解决，后者即无法。我刚给孟一信，决定：“托丁卖书，丁已前后代为垫汇我九千元，如今他书没拿到，房子也腾不清，无法运用，我内心实感不安。我盼你再南下一次，周渝擅买那三个新铁柜及台中的家俱移丁处理，丁要的书，能找出多少，找出多少，立据给你。然后就现状稍事清理，把台中老家封存起...
3	003.李敖札记.txt	17	你这样搞国民党有效吗？	晚饭前黄三问我：“你这样搞国民党有效吗？”我说：“搞国民党像搞屄。这不是能不能的问题，只是要一搞耳！有性欲、无性能是另一问题，重要是你要志在一搞才行。”黄三大笑。（1989年3月24日）
3	003.李敖札记.txt	17	搞国民党像搞屄。这不是能不能的问题，只是要一搞耳！有性欲、无性能是另一问题，重要是你要志在一搞才行。	晚饭前黄三问我：“你这样搞国民党有效吗？”我说：“搞国民党像搞屄。这不是能不能的问题，只是要一搞耳！有性欲、无性能是另一问题，重要是你要志在一搞才行。”黄三大笑。（1989年3月24日）
3	003.李敖札记.txt	21	国民党里有很多坏人，所以局面弄成现在这样子；但国民党里也有好人，所以弄成现在这样子还能拖下去。	吴越潮生前在信义路口对我说：“国民党里有很多坏人，所以局面弄成现在这样子；但国民党里也有好人，所以弄成现在这样子还能拖下去。”但我总觉得，帮助国民党作恶的好人，只是“坏的好人”耳！岂配称为好人哉？（1989年4月13日）
5	004.台大校长不要脸.txt	5	台大校庆餐会，李远哲：真正校友，勿要谩骂	今天报上登“台大校庆餐会，李远哲：真正校友，勿要谩骂”、“陈维昭说，社会持续教育缺失”，然后又批评“校园不谈品德”，学生品德不好了。陈维昭还写这个毛笔字“敦品励学、爱国爱人”，这个是台大的校训，代表他很重视大学生的品德。
5	004.台大校长不要脸.txt	5	陈维昭说，社会持续教育缺失	今天报上登“台大校庆餐会，李远哲：真正校友，勿要谩骂”、“陈维昭说，社会持续教育缺失”，然后又批评“校园不谈品德”，学生品德不好了。陈维昭还写这个毛笔字“敦品励学、爱国爱人”，这个是台大的校训，代表他很重视大学生的品德。
5	004.台大校长不要脸.txt	5	敦品励学、爱国爱人	今天报上登“台大校庆餐会，李远哲：真正校友，勿要谩骂”、“陈维昭说，社会持续教育缺失”，然后又批评“校园不谈品德”，学生品德不好了。陈维昭还写这个毛笔字“敦品励学、爱国爱人”，这个是台大的校训，代表他很重视大学生的品德。
5	004.台大校长不要脸.txt	13	为台湾教育史上留下良好示范，台大校长续任应经审慎评鉴	这太无耻了，你怎么在自己任上自肥呢？陈维昭这样无耻、自肥，台大教授就看不过去了，所以有个声明，认为“为台湾教育史上留下良好示范，台大校长续任应经审慎评鉴”，他们说，“现任台大校长是依八十二年大学法及当时台大组织规则上任的，其任期当然依当时法规规定，新的规定只能对下任校长生效，才符合法理。”
3	004.台大校长不要脸.txt	13	现任台大校长是依八十二年大学法及当时台大组织规则上任的，其任期当然依当时法规规定，新的规定只能对下任校长生效，才符合法理。	这太无耻了，你怎么在自己任上自肥呢？陈维昭这样无耻、自肥，台大教授就看不过去了，所以有个声明，认为“为台湾教育史上留下良好示范，台大校长续任应经审慎评鉴”，他们说，“现任台大校长是依八十二年大学法及当时台大组织规则上任的，其任期当然依当时法规规定，新的规定只能对下任校长生效，才符合法理。”
4	004.台大校长不要脸.txt	15	本规程修正实施前，已任聘校长之初任为续任，准用第1项及第2项。	然而台大新组织规程于八十四年10月24日由教育部核定生效，校务会议却径行于规程中规定“本规程修正实施前，已任聘校长之初任为续任，准用第1项及第2项。”就是说这规定适合我了！陈维昭条款，使陈校长任期延为4年，并准用新的办法再来4年。
4	004.台大校长不要脸.txt	21	本人与此事有何干系，因社务繁忙，不克到场作证。	1994年4月17日，《自立晚报》刊出，台大校长陈维昭指出，大学时期看过《自由中国》，对殷海光民主思想深刻，他认为殷海光批评国民党，不但失去自由中国舞台，还被撵出台大教职。后来我李敖打官司，叫陈维昭来作证，因为你说殷海光是被撵出台大教职。陈维昭，这个不要脸的台大校长，不敢来作证，写信给法院，“本人与此事有何干系，因社务繁忙，不克到场作证。”这是多么的不要脸。
8	005.退孙中山的票.txt	3	转商同志之国，极力赞成	1900年的7月24日，一群搞革命的中国人，为了取得外国人的援助，联名写了一封信给香港总督。这封信可说是集“告洋状”的大成。首先说他们想“挽救”“时艰”但是自感“势力微弱”、“政府冥顽”、大臣“观望”，他们想“定乱苏民”，要找谁呢？最后好了，他们找到英国、找到英国殖民地总督，“深知贵国素敦友谊，保中为心；且商务教堂，遍于内地。故某等不嫌越分，呈请助力，以襄厥...
8	005.退孙中山的票.txt	3	受其利者，又不特华人已也	1900年的7月24日，一群搞革命的中国人，为了取得外国人的援助，联名写了一封信给香港总督。这封信可说是集“告洋状”的大成。首先说他们想“挽救”“时艰”但是自感“势力微弱”、“政府冥顽”、大臣“观望”，他们想“定乱苏民”，要找谁呢？最后好了，他们找到英国、找到英国殖民地总督，“深知贵国素敦友谊，保中为心；且商务教堂，遍于内地。故某等不嫌越分，呈请助力，以襄厥...
8	005.退孙中山的票.txt	3	如关税等类，如有增改，必先与列国妥议而行	1900年的7月24日，一群搞革命的中国人，为了取得外国人的援助，联名写了一封信给香港总督。这封信可说是集“告洋状”的大成。首先说他们想“挽救”“时艰”但是自感“势力微弱”、“政府冥顽”、大臣“观望”，他们想“定乱苏民”，要找谁呢？最后好了，他们找到英国、找到英国殖民地总督，“深知贵国素敦友谊，保中为心；且商务教堂，遍于内地。故某等不嫌越分，呈请助力，以襄厥...
7	005.退孙中山的票.txt	3	机不可失，合则有成。	1900年的7月24日，一群搞革命的中国人，为了取得外国人的援助，联名写了一封信给香港总督。这封信可说是集“告洋状”的大成。首先说他们想“挽救”“时艰”但是自感“势力微弱”、“政府冥顽”、大臣“观望”，他们想“定乱苏民”，要找谁呢？最后好了，他们找到英国、找到英国殖民地总督，“深知贵国素敦友谊，保中为心；且商务教堂，遍于内地。故某等不嫌越分，呈请助力，以襄厥...
7	005.退孙中山的票.txt	3	大小讼务，仿欧美之法，立陪审人员，许律师代理，务为平允，不以残刑致死，不以拷打取供。	1900年的7月24日，一群搞革命的中国人，为了取得外国人的援助，联名写了一封信给香港总督。这封信可说是集“告洋状”的大成。首先说他们想“挽救”“时艰”但是自感“势力微弱”、“政府冥顽”、大臣“观望”，他们想“定乱苏民”，要找谁呢？最后好了，他们找到英国、找到英国殖民地总督，“深知贵国素敦友谊，保中为心；且商务教堂，遍于内地。故某等不嫌越分，呈请助力，以襄厥...
6	005.退孙中山的票.txt	3	深知贵国素敦友谊，保中为心；且商务教堂，遍于内地。故某等不嫌越分，呈请助力，以襄厥成，愿借殊勋，改造中国。	1900年的7月24日，一群搞革命的中国人，为了取得外国人的援助，联名写了一封信给香港总督。这封信可说是集“告洋状”的大成。首先说他们想“挽救”“时艰”但是自感“势力微弱”、“政府冥顽”、大臣“观望”，他们想“定乱苏民”，要找谁呢？最后好了，他们找到英国、找到英国殖民地总督，“深知贵国素敦友谊，保中为心；且商务教堂，遍于内地。故某等不嫌越分，呈请助力，以襄厥...
3	005.退孙中山的票.txt	3	势力微弱	1900年的7月24日，一群搞革命的中国人，为了取得外国人的援助，联名写了一封信给香港总督。这封信可说是集“告洋状”的大成。首先说他们想“挽救”“时艰”但是自感“势力微弱”、“政府冥顽”、大臣“观望”，他们想“定乱苏民”，要找谁呢？最后好了，他们找到英国、找到英国殖民地总督，“深知贵国素敦友谊，保中为心；且商务教堂，遍于内地。故某等不嫌越分，呈请助力，以襄厥...
3	005.退孙中山的票.txt	3	政府冥顽	1900年的7月24日，一群搞革命的中国人，为了取得外国人的援助，联名写了一封信给香港总督。这封信可说是集“告洋状”的大成。首先说他们想“挽救”“时艰”但是自感“势力微弱”、“政府冥顽”、大臣“观望”，他们想“定乱苏民”，要找谁呢？最后好了，他们找到英国、找到英国殖民地总督，“深知贵国素敦友谊，保中为心；且商务教堂，遍于内地。故某等不嫌越分，呈请助力，以襄厥...
3	005.退孙中山的票.txt	3	定乱苏民	1900年的7月24日，一群搞革命的中国人，为了取得外国人的援助，联名写了一封信给香港总督。这封信可说是集“告洋状”的大成。首先说他们想“挽救”“时艰”但是自感“势力微弱”、“政府冥顽”、大臣“观望”，他们想“定乱苏民”，要找谁呢？最后好了，他们找到英国、找到英国殖民地总督，“深知贵国素敦友谊，保中为心；且商务教堂，遍于内地。故某等不嫌越分，呈请助力，以襄厥...
3	005.退孙中山的票.txt	3	我南人	1900年的7月24日，一群搞革命的中国人，为了取得外国人的援助，联名写了一封信给香港总督。这封信可说是集“告洋状”的大成。首先说他们想“挽救”“时艰”但是自感“势力微弱”、“政府冥顽”、大臣“观望”，他们想“定乱苏民”，要找谁呢？最后好了，他们找到英国、找到英国殖民地总督，“深知贵国素敦友谊，保中为心；且商务教堂，遍于内地。故某等不嫌越分，呈请助力，以襄厥...
3	005.退孙中山的票.txt	3	分沾利益	1900年的7月24日，一群搞革命的中国人，为了取得外国人的援助，联名写了一封信给香港总督。这封信可说是集“告洋状”的大成。首先说他们想“挽救”“时艰”但是自感“势力微弱”、“政府冥顽”、大臣“观望”，他们想“定乱苏民”，要找谁呢？最后好了，他们找到英国、找到英国殖民地总督，“深知贵国素敦友谊，保中为心；且商务教堂，遍于内地。故某等不嫌越分，呈请助力，以襄厥...
5	005.退孙中山的票.txt	5	仿欧美之法，立陪审人员	这一集“告洋状”大成的文件中，有的不无丧权辱国之处，有的倒也颇有现代化观念，例如它主张进行司法改革，“仿欧美之法，立陪审人员”，就是与人为善的。所以，虽然写信的基本立场是里通外国，但其内容，荒谬之中也有可取者在。
8	005.退孙中山的票.txt	7	仿欧美之法，立陪审人员	联名写这封信的中国人，在写信后的十二年间，有的被砍头了，有的下落不明了。但有一个人却飞黄腾达起来，最后做了国民党的总理，他就是孙中山。由于孙中山的显赫，这封信，也进了《国父全集》、成为《总理遗教》，他的信徒们，自然也就不得不实行了。不过，九十年过去了，孙中山“仿欧美之法，立陪审人员”的遗教，似乎还在退票中。因为在他生前死后，所谓陪审陪审，丝毫没有一点影儿。
3	005.退孙中山的票.txt	9	人民法院审判案件实行人民陪审员制度	也许有人打哈哈说，影儿总有一点吧？例如中共的宪法中，不是有“人民法院审判案件实行人民陪审员制度”吗？
5	005.退孙中山的票.txt	11	同审判员有同等权利	其实不然。共产党的人民陪审员，根据他们的人民法院组织法，乃是“同审判员有同等权利”的家伙，所谓“同等权利”，是在事实认定方面、法律适用方面、刑罚量定方面，他们都要插上一脚，与英美陪审制中，陪审员只就事实认定有罪无罪，其它则归属法官者，根本不同。而且，英美陪审制中的“证据排除法则”，共产党也全不理这一套。于是，相信传闻证据、相信群众路线的人民陪审员，事实上，变...
3	005.退孙中山的票.txt	11	同等权利	其实不然。共产党的人民陪审员，根据他们的人民法院组织法，乃是“同审判员有同等权利”的家伙，所谓“同等权利”，是在事实认定方面、法律适用方面、刑罚量定方面，他们都要插上一脚，与英美陪审制中，陪审员只就事实认定有罪无罪，其它则归属法官者，根本不同。而且，英美陪审制中的“证据排除法则”，共产党也全不理这一套。于是，相信传闻证据、相信群众路线的人民陪审员，事实上，变...
3	005.退孙中山的票.txt	11	证据排除法则	其实不然。共产党的人民陪审员，根据他们的人民法院组织法，乃是“同审判员有同等权利”的家伙，所谓“同等权利”，是在事实认定方面、法律适用方面、刑罚量定方面，他们都要插上一脚，与英美陪审制中，陪审员只就事实认定有罪无罪，其它则归属法官者，根本不同。而且，英美陪审制中的“证据排除法则”，共产党也全不理这一套。于是，相信传闻证据、相信群众路线的人民陪审员，事实上，变...
3	005.退孙中山的票.txt	11	试行陪审制度	其实不然。共产党的人民陪审员，根据他们的人民法院组织法，乃是“同审判员有同等权利”的家伙，所谓“同等权利”，是在事实认定方面、法律适用方面、刑罚量定方面，他们都要插上一脚，与英美陪审制中，陪审员只就事实认定有罪无罪，其它则归属法官者，根本不同。而且，英美陪审制中的“证据排除法则”，共产党也全不理这一套。于是，相信传闻证据、相信群众路线的人民陪审员，事实上，变...
3	005.退孙中山的票.txt	13	对于已经判决徒刑之人犯，经设立再生队，一律送队管教，以为犯罪者之感化机构，在队人犯，早晚均受感化教育，白天做工种菜，务使人人从事生产，免劳力浪费，其收获则归诸犯人。并使犯罪者在法律之前人人平等，毋枉毋纵，经由各人民团体、职业团体、民意机关、推派代表组织金门行政区陪审委员会，对区内民刑案件，在辩论与判决两庭均由陪审委员会以观审方式，派员出席陪审。	其实也不然。根据1953年的《中华民国年鉴》，在金门《改良监狱及试行陪审制度》条下，明说“对于已经判决徒刑之人犯，经设立再生队，一律送队管教，以为犯罪者之感化机构，在队人犯，早晚均受感化教育，白天做工种菜，务使人人从事生产，免劳力浪费，其收获则归诸犯人。并使犯罪者在法律之前人人平等，毋枉毋纵，经由各人民团体、职业团体、民意机关、推派代表组织金门行政区陪审委员...
7	005.退孙中山的票.txt	17	‘陪审’、‘参审’制是否适合我国	说着玩的最新一次拷贝是国民党司法院长林洋港的表现。两年前他一上台，就大做革新司法秀；1987年5月15日，他对联合报记者谈话，在被问及“‘陪审’、‘参审’制是否适合我国”时，他的答复是：“这个问题有待派员赴德、美等国实地考察后再行研酌。”到了同年12月20日，他对自立晚报记者谈话，在被问及“是否考虑采行参审制或陪审制”时，他的答复是：“我们研究到现在为止，依...
7	005.退孙中山的票.txt	17	这个问题有待派员赴德、美等国实地考察后再行研酌。	说着玩的最新一次拷贝是国民党司法院长林洋港的表现。两年前他一上台，就大做革新司法秀；1987年5月15日，他对联合报记者谈话，在被问及“‘陪审’、‘参审’制是否适合我国”时，他的答复是：“这个问题有待派员赴德、美等国实地考察后再行研酌。”到了同年12月20日，他对自立晚报记者谈话，在被问及“是否考虑采行参审制或陪审制”时，他的答复是：“我们研究到现在为止，依...
7	005.退孙中山的票.txt	17	我们研究到现在为止，依旧觉得这个制度，与我国国情不符，实施后的正面效果有待研酌。	说着玩的最新一次拷贝是国民党司法院长林洋港的表现。两年前他一上台，就大做革新司法秀；1987年5月15日，他对联合报记者谈话，在被问及“‘陪审’、‘参审’制是否适合我国”时，他的答复是：“这个问题有待派员赴德、美等国实地考察后再行研酌。”到了同年12月20日，他对自立晚报记者谈话，在被问及“是否考虑采行参审制或陪审制”时，他的答复是：“我们研究到现在为止，依...
5	005.退孙中山的票.txt	17	是否考虑采行参审制或陪审制	说着玩的最新一次拷贝是国民党司法院长林洋港的表现。两年前他一上台，就大做革新司法秀；1987年5月15日，他对联合报记者谈话，在被问及“‘陪审’、‘参审’制是否适合我国”时，他的答复是：“这个问题有待派员赴德、美等国实地考察后再行研酌。”到了同年12月20日，他对自立晚报记者谈话，在被问及“是否考虑采行参审制或陪审制”时，他的答复是：“我们研究到现在为止，依...
3	006.义助慰安妇.txt	9	对于女人，日本兵的行动更坏，是文明世界所梦想不到的。日本对女人的嗜好，到了令人难以置信的程度。	“对于女人，日本兵的行动更坏，是文明世界所梦想不到的。日本对女人的嗜好，到了令人难以置信的程度。”
3	006.义助慰安妇.txt	11	一次，日本兵以三辆卡车，运妇女到兵营去，逐一强奸。我阻止他们，无效。这些妇女，由十二、三岁至四、五十岁。我曾目击日兵的强奸。有时候，日兵在沐浴处强奸中国的妇人。后来，我们走进去，我看见沐浴处的裸体女人在哭。	“一次，日本兵以三辆卡车，运妇女到兵营去，逐一强奸。我阻止他们，无效。这些妇女，由十二、三岁至四、五十岁。我曾目击日兵的强奸。有时候，日兵在沐浴处强奸中国的妇人。后来，我们走进去，我看见沐浴处的裸体女人在哭。”
3	006.义助慰安妇.txt	13	又一次，我同马基氏到南门东新开路第七号。发现该家十一人被杀，三人被强奸。妇人之中，两人十四岁，一人十七岁，日军于强奸后，把东西塞入阴户中。另一年轻的女子，在桌上被强奸，桌上有血。又有一家人，乘船过河。至河中，被日兵发现。日兵检查船内，发现青年女子，就在老父与丈夫面前强奸。丈夫非常愤怒，被日兵所杀，老父和女儿，也同投河溺死。	“又一次，我同马基氏到南门东新开路第七号。发现该家十一人被杀，三人被强奸。妇人之中，两人十四岁，一人十七岁，日军于强奸后，把东西塞入阴户中。另一年轻的女子，在桌上被强奸，桌上有血。又有一家人，乘船过河。至河中，被日兵发现。日兵检查船内，发现青年女子，就在老父与丈夫面前强奸。丈夫非常愤怒，被日兵所杀，老父和女儿，也同投河溺死。”
3	006.义助慰安妇.txt	17	就是在安全地带，中国妇女被日本兵强奸的，每天最少有八千件之多。我的一个德国同事，任职‘国际安全地带委员会’，他亲眼看见日军奸杀暴行达两万次之多。特别是在南京大学校园里的日本兵，竟在光天化日之下，奸杀九岁的女童及七十六岁的老祖母。而且这些奸杀事件，大约有三分之一是在白天进行。尤其有不少奸杀事件，竟发生在大马路上，其情其景真是衣冠禽兽。	“就是在安全地带，中国妇女被日本兵强奸的，每天最少有八千件之多。我的一个德国同事，任职‘国际安全地带委员会’，他亲眼看见日军奸杀暴行达两万次之多。特别是在南京大学校园里的日本兵，竟在光天化日之下，奸杀九岁的女童及七十六岁的老祖母。而且这些奸杀事件，大约有三分之一是在白天进行。尤其有不少奸杀事件，竟发生在大马路上，其情其景真是衣冠禽兽。”
5	006.义助慰安妇.txt	21	没列入编制的慰安妇	日本人对妇女，干出了全世界任何国家都干不出来的坏事，还美其名曰慰安妇的“慰安”。在这种标准下慰安妇其实有两种，一种是上面外籍人士笔下的“没列入编制的慰安妇”，她们的被蹂躪是一时的；另一种是“列入编制的慰安妇”，她们的被蹂躪是长久的，就是今天亚洲各国所关心的一种，她们一生，青春不堪问，老境却堪怜，并且在五六十年的风霜后，所剩无几，在台湾仅有三四十人存活着。
