file	line	text	context
026.用衣冠整禽兽.txt	29	莫须有	最后，当时你们对“莫须有”罪名的真正意义都有所误解。当年岳飞被抓，韩世忠问秦桧为什么要抓岳飞？秦桧回答说“莫须有”，因此大家都以为“莫须有”就是没有罪名，其实是错误的；因为同样的，如果抓了四星或五星上将，怎么能没有罪名？其实“莫须有”是宋朝俗语，意思是“等等看，有的”，所以“莫须有”并不是没有，而是秦桧傲慢地跟韩世忠将军说：“等着瞧吧，有的。”这才是“莫须有”真正的意思。因此关于查司令事件，你刚才也说过了，如果你不愿意承认是海军不喜欢陆军，你只要说一句“莫须有”，意思是“等着瞧吧，有的”，代表着相信最后医生的检查结果，也是有的。今天你很不幸，许多复杂的事情交错在一起，而惹来许多麻烦，李部长应向陈水扁抗议：抗议他不能把海军陆战队的司令派来当海军总司令，如果李部长能够做到这一点，本席就服了你。
026.用衣冠整禽兽.txt	29	等等看，有的	最后，当时你们对“莫须有”罪名的真正意义都有所误解。当年岳飞被抓，韩世忠问秦桧为什么要抓岳飞？秦桧回答说“莫须有”，因此大家都以为“莫须有”就是没有罪名，其实是错误的；因为同样的，如果抓了四星或五星上将，怎么能没有罪名？其实“莫须有”是宋朝俗语，意思是“等等看，有的”，所以“莫须有”并不是没有，而是秦桧傲慢地跟韩世忠将军说：“等着瞧吧，有的。”这才是“莫须有”真正的意思。因此关于查司令事件，你刚才也说过了，如果你不愿意承认是海军不喜欢陆军，你只要说一句“莫须有”，意思是“等着瞧吧，有的”，代表着相信最后医生的检查结果，也是有的。今天你很不幸，许多复杂的事情交错在一起，而惹来许多麻烦，李部长应向陈水扁抗议：抗议他不能把海军陆战队的司令派来当海军总司令，如果李部长能够做到这一点，本席就服了你。
026.用衣冠整禽兽.txt	29	等着瞧吧，有的。	最后，当时你们对“莫须有”罪名的真正意义都有所误解。当年岳飞被抓，韩世忠问秦桧为什么要抓岳飞？秦桧回答说“莫须有”，因此大家都以为“莫须有”就是没有罪名，其实是错误的；因为同样的，如果抓了四星或五星上将，怎么能没有罪名？其实“莫须有”是宋朝俗语，意思是“等等看，有的”，所以“莫须有”并不是没有，而是秦桧傲慢地跟韩世忠将军说：“等着瞧吧，有的。”这才是“莫须有”真正的意思。因此关于查司令事件，你刚才也说过了，如果你不愿意承认是海军不喜欢陆军，你只要说一句“莫须有”，意思是“等着瞧吧，有的”，代表着相信最后医生的检查结果，也是有的。今天你很不幸，许多复杂的事情交错在一起，而惹来许多麻烦，李部长应向陈水扁抗议：抗议他不能把海军陆战队的司令派来当海军总司令，如果李部长能够做到这一点，本席就服了你。
026.用衣冠整禽兽.txt	29	等着瞧吧，有的	最后，当时你们对“莫须有”罪名的真正意义都有所误解。当年岳飞被抓，韩世忠问秦桧为什么要抓岳飞？秦桧回答说“莫须有”，因此大家都以为“莫须有”就是没有罪名，其实是错误的；因为同样的，如果抓了四星或五星上将，怎么能没有罪名？其实“莫须有”是宋朝俗语，意思是“等等看，有的”，所以“莫须有”并不是没有，而是秦桧傲慢地跟韩世忠将军说：“等着瞧吧，有的。”这才是“莫须有”真正的意思。因此关于查司令事件，你刚才也说过了，如果你不愿意承认是海军不喜欢陆军，你只要说一句“莫须有”，意思是“等着瞧吧，有的”，代表着相信最后医生的检查结果，也是有的。今天你很不幸，许多复杂的事情交错在一起，而惹来许多麻烦，李部长应向陈水扁抗议：抗议他不能把海军陆战队的司令派来当海军总司令，如果李部长能够做到这一点，本席就服了你。
027.历史会证明我们同归于尽.txt	7	天下本无事，庸人自扰之	李委员敖：主席、各位列席官员、各位同仁。我们在宋朝有位诗人叫陆游，他写过一首诗，即“天下本无事，庸人自扰之”；可是，本席现在发现他写错了，其实不是庸人自扰，而是很多的聪明人在自扰。
028.长廷啊，不要在后台唱戏.txt	157	在台湾的中国人	李委员敖：谢谢你，我总算抓到你一句yes 。我必须跟你讲，为什么我们国防委员会会谈到杜正胜？你晓得那句话——教育是最廉价的“国防”。对于杜正胜，长廷兄，当年我们两人和林永丰医师游阳明山，我跟你讲了一句话也许你还记得，我说真正的问题是民进党对我们是什么？你说民进党对我们是汉献帝，它代表了正统。今天你抓到了正统，从政治斗争来说，我又想起了十几年前和你说过的话，我曾说你们不要赶走国民党老贼，因为老贼对你们而言是好的，只有老贼才证明国民党是多么黑暗、多么丑陋、多么恶心、多么使我们发笑。老贼赶走了，这么好的道具就没有了。今天大家说我反对杜正胜，其实从政治厉害的观点来讲，我赞成40+1，40位立委再加上我，留下杜正胜。杜正胜会永远是你谢长廷的痛，他给你制造情况，为什么会痛呢？让我们看看数据。有一份极机密资料，那是杜正胜亲笔为李登辉写的演讲稿，其中提到“在台湾的中国人”，那时他承认是中国人。到了1989年他写《历史的再生》一书时，又提到“台湾...
028.长廷啊，不要在后台唱戏.txt	157	台湾有1800万的中国人	李委员敖：谢谢你，我总算抓到你一句yes 。我必须跟你讲，为什么我们国防委员会会谈到杜正胜？你晓得那句话——教育是最廉价的“国防”。对于杜正胜，长廷兄，当年我们两人和林永丰医师游阳明山，我跟你讲了一句话也许你还记得，我说真正的问题是民进党对我们是什么？你说民进党对我们是汉献帝，它代表了正统。今天你抓到了正统，从政治斗争来说，我又想起了十几年前和你说过的话，我曾说你们不要赶走国民党老贼，因为老贼对你们而言是好的，只有老贼才证明国民党是多么黑暗、多么丑陋、多么恶心、多么使我们发笑。老贼赶走了，这么好的道具就没有了。今天大家说我反对杜正胜，其实从政治厉害的观点来讲，我赞成40+1，40位立委再加上我，留下杜正胜。杜正胜会永远是你谢长廷的痛，他给你制造情况，为什么会痛呢？让我们看看数据。有一份极机密资料，那是杜正胜亲笔为李登辉写的演讲稿，其中提到“在台湾的中国人”，那时他承认是中国人。到了1989年他写《历史的再生》一书时，又提到“台湾...
028.长廷啊，不要在后台唱戏.txt	157	中国人	李委员敖：谢谢你，我总算抓到你一句yes 。我必须跟你讲，为什么我们国防委员会会谈到杜正胜？你晓得那句话——教育是最廉价的“国防”。对于杜正胜，长廷兄，当年我们两人和林永丰医师游阳明山，我跟你讲了一句话也许你还记得，我说真正的问题是民进党对我们是什么？你说民进党对我们是汉献帝，它代表了正统。今天你抓到了正统，从政治斗争来说，我又想起了十几年前和你说过的话，我曾说你们不要赶走国民党老贼，因为老贼对你们而言是好的，只有老贼才证明国民党是多么黑暗、多么丑陋、多么恶心、多么使我们发笑。老贼赶走了，这么好的道具就没有了。今天大家说我反对杜正胜，其实从政治厉害的观点来讲，我赞成40+1，40位立委再加上我，留下杜正胜。杜正胜会永远是你谢长廷的痛，他给你制造情况，为什么会痛呢？让我们看看数据。有一份极机密资料，那是杜正胜亲笔为李登辉写的演讲稿，其中提到“在台湾的中国人”，那时他承认是中国人。到了1989年他写《历史的再生》一书时，又提到“台湾...
029.他们忘了站在第一排的要犯.txt	23	未知死、焉知生	总统已于7月11日派专人送聘书来，聘我为有给职国策顾问。相信此事跟您的请命有直接关系。本来猜测总统身边的大老看不过去，因而建议的结果，原来这位大老不是别人，是立法委员李敖。古人有不求禄、禄亦弗及的情形。如今我虽不求禄，禄却及之。除了衷心感谢之外，夫复何言！我目前从事英翻中工作，行有余力时，阅读《西藏生死书》《达赖生死书》等作品，颇有心得。所谓“未知死、焉知生”，孔子错了。您的前妻胡因梦应该早已参透生死。我父亲是曹洞宗的和尚，我却曾是基督教的传道人，我一直想好好写一本书，把这一辈子短短的人生旅程中所见所闻所思所悟写出来，让有眼福的人看看、有耳福的人听听，9月以后应可开始动笔。到时一定请您指教。杂七杂八写了一堆，重点仍是感谢您的请命。即祝
029.他们忘了站在第一排的要犯.txt	29	民进党耆老黄富竟成游民，国策顾问黄华胞兄失忆昏倒无人问，送进游民收容所，同居人和黄华未处理	2005年8月30日报载：“民进党耆老黄富竟成游民，国策顾问黄华胞兄失忆昏倒无人问，送进游民收容所，同居人和黄华未处理”云云。当年黄富曾找我为他出版《三圣会谈》译本，是旧识。他后来参选过民进党主席。我不忍见其82岁时竟潦倒至此，乃转请谢长廷照顾他，是继为林弘宣请命后又一执言，可是没有下文了。
032.李文仪与潜艇采购.txt	7	用和，你去买乐透，中奖以后我把我太太丢掉，你把周守训丢掉，我们两个人拿着你中奖的钱远走高飞。	李委员敖：主席、各位列席官员、各位同仁。部长，林肯总统在开国务会议的时候要先讲个笑话，他不是不尊重国家大事，而是让大家稍微轻松一点。本席也先讲个与我们的前途有关系的笑话。前几年，我在中天电视台做节目，在化妆室碰到周守训的太太汪用和，我向她开玩笑：“用和，你去买乐透，中奖以后我把我太太丢掉，你把周守训丢掉，我们两个人拿着你中奖的钱远走高飞。”汪用和答应了，而且她很得意地把这件事情告诉每一位女主播，结果被一位女主播听到，她的名字叫侯佩岑。侯佩岑过来偷偷跟我讲：“李大哥，如果我去买了乐透，中了以后你要不要跟我走？”我说：“不要买，我们立刻走。”侯佩岑也很高兴，立刻告诉汪用和。汪用和把脸一板，说：“这怎么可以？我飞机票都买好了！”侯佩岑就愁眉苦脸地告诉我：“汪姐说飞机票都买好了。”我说：“没有关系，我们坐船走。”这个笑话到这里还没完。现在有一个叫李文仪的美女出现了，看到李文仪以后，我不能够坐飞机走，也不能够坐船走，我可能坐潜水艇走了。换...
032.李文仪与潜艇采购.txt	7	李大哥，如果我去买了乐透，中了以后你要不要跟我走？	李委员敖：主席、各位列席官员、各位同仁。部长，林肯总统在开国务会议的时候要先讲个笑话，他不是不尊重国家大事，而是让大家稍微轻松一点。本席也先讲个与我们的前途有关系的笑话。前几年，我在中天电视台做节目，在化妆室碰到周守训的太太汪用和，我向她开玩笑：“用和，你去买乐透，中奖以后我把我太太丢掉，你把周守训丢掉，我们两个人拿着你中奖的钱远走高飞。”汪用和答应了，而且她很得意地把这件事情告诉每一位女主播，结果被一位女主播听到，她的名字叫侯佩岑。侯佩岑过来偷偷跟我讲：“李大哥，如果我去买了乐透，中了以后你要不要跟我走？”我说：“不要买，我们立刻走。”侯佩岑也很高兴，立刻告诉汪用和。汪用和把脸一板，说：“这怎么可以？我飞机票都买好了！”侯佩岑就愁眉苦脸地告诉我：“汪姐说飞机票都买好了。”我说：“没有关系，我们坐船走。”这个笑话到这里还没完。现在有一个叫李文仪的美女出现了，看到李文仪以后，我不能够坐飞机走，也不能够坐船走，我可能坐潜水艇走了。换...
032.李文仪与潜艇采购.txt	7	不要买，我们立刻走。	李委员敖：主席、各位列席官员、各位同仁。部长，林肯总统在开国务会议的时候要先讲个笑话，他不是不尊重国家大事，而是让大家稍微轻松一点。本席也先讲个与我们的前途有关系的笑话。前几年，我在中天电视台做节目，在化妆室碰到周守训的太太汪用和，我向她开玩笑：“用和，你去买乐透，中奖以后我把我太太丢掉，你把周守训丢掉，我们两个人拿着你中奖的钱远走高飞。”汪用和答应了，而且她很得意地把这件事情告诉每一位女主播，结果被一位女主播听到，她的名字叫侯佩岑。侯佩岑过来偷偷跟我讲：“李大哥，如果我去买了乐透，中了以后你要不要跟我走？”我说：“不要买，我们立刻走。”侯佩岑也很高兴，立刻告诉汪用和。汪用和把脸一板，说：“这怎么可以？我飞机票都买好了！”侯佩岑就愁眉苦脸地告诉我：“汪姐说飞机票都买好了。”我说：“没有关系，我们坐船走。”这个笑话到这里还没完。现在有一个叫李文仪的美女出现了，看到李文仪以后，我不能够坐飞机走，也不能够坐船走，我可能坐潜水艇走了。换...
032.李文仪与潜艇采购.txt	7	这怎么可以？我飞机票都买好了！	李委员敖：主席、各位列席官员、各位同仁。部长，林肯总统在开国务会议的时候要先讲个笑话，他不是不尊重国家大事，而是让大家稍微轻松一点。本席也先讲个与我们的前途有关系的笑话。前几年，我在中天电视台做节目，在化妆室碰到周守训的太太汪用和，我向她开玩笑：“用和，你去买乐透，中奖以后我把我太太丢掉，你把周守训丢掉，我们两个人拿着你中奖的钱远走高飞。”汪用和答应了，而且她很得意地把这件事情告诉每一位女主播，结果被一位女主播听到，她的名字叫侯佩岑。侯佩岑过来偷偷跟我讲：“李大哥，如果我去买了乐透，中了以后你要不要跟我走？”我说：“不要买，我们立刻走。”侯佩岑也很高兴，立刻告诉汪用和。汪用和把脸一板，说：“这怎么可以？我飞机票都买好了！”侯佩岑就愁眉苦脸地告诉我：“汪姐说飞机票都买好了。”我说：“没有关系，我们坐船走。”这个笑话到这里还没完。现在有一个叫李文仪的美女出现了，看到李文仪以后，我不能够坐飞机走，也不能够坐船走，我可能坐潜水艇走了。换...
032.李文仪与潜艇采购.txt	7	汪姐说飞机票都买好了。	李委员敖：主席、各位列席官员、各位同仁。部长，林肯总统在开国务会议的时候要先讲个笑话，他不是不尊重国家大事，而是让大家稍微轻松一点。本席也先讲个与我们的前途有关系的笑话。前几年，我在中天电视台做节目，在化妆室碰到周守训的太太汪用和，我向她开玩笑：“用和，你去买乐透，中奖以后我把我太太丢掉，你把周守训丢掉，我们两个人拿着你中奖的钱远走高飞。”汪用和答应了，而且她很得意地把这件事情告诉每一位女主播，结果被一位女主播听到，她的名字叫侯佩岑。侯佩岑过来偷偷跟我讲：“李大哥，如果我去买了乐透，中了以后你要不要跟我走？”我说：“不要买，我们立刻走。”侯佩岑也很高兴，立刻告诉汪用和。汪用和把脸一板，说：“这怎么可以？我飞机票都买好了！”侯佩岑就愁眉苦脸地告诉我：“汪姐说飞机票都买好了。”我说：“没有关系，我们坐船走。”这个笑话到这里还没完。现在有一个叫李文仪的美女出现了，看到李文仪以后，我不能够坐飞机走，也不能够坐船走，我可能坐潜水艇走了。换...
032.李文仪与潜艇采购.txt	7	没有关系，我们坐船走。	李委员敖：主席、各位列席官员、各位同仁。部长，林肯总统在开国务会议的时候要先讲个笑话，他不是不尊重国家大事，而是让大家稍微轻松一点。本席也先讲个与我们的前途有关系的笑话。前几年，我在中天电视台做节目，在化妆室碰到周守训的太太汪用和，我向她开玩笑：“用和，你去买乐透，中奖以后我把我太太丢掉，你把周守训丢掉，我们两个人拿着你中奖的钱远走高飞。”汪用和答应了，而且她很得意地把这件事情告诉每一位女主播，结果被一位女主播听到，她的名字叫侯佩岑。侯佩岑过来偷偷跟我讲：“李大哥，如果我去买了乐透，中了以后你要不要跟我走？”我说：“不要买，我们立刻走。”侯佩岑也很高兴，立刻告诉汪用和。汪用和把脸一板，说：“这怎么可以？我飞机票都买好了！”侯佩岑就愁眉苦脸地告诉我：“汪姐说飞机票都买好了。”我说：“没有关系，我们坐船走。”这个笑话到这里还没完。现在有一个叫李文仪的美女出现了，看到李文仪以后，我不能够坐飞机走，也不能够坐船走，我可能坐潜水艇走了。换...
032.李文仪与潜艇采购.txt	7	国防政策	李委员敖：主席、各位列席官员、各位同仁。部长，林肯总统在开国务会议的时候要先讲个笑话，他不是不尊重国家大事，而是让大家稍微轻松一点。本席也先讲个与我们的前途有关系的笑话。前几年，我在中天电视台做节目，在化妆室碰到周守训的太太汪用和，我向她开玩笑：“用和，你去买乐透，中奖以后我把我太太丢掉，你把周守训丢掉，我们两个人拿着你中奖的钱远走高飞。”汪用和答应了，而且她很得意地把这件事情告诉每一位女主播，结果被一位女主播听到，她的名字叫侯佩岑。侯佩岑过来偷偷跟我讲：“李大哥，如果我去买了乐透，中了以后你要不要跟我走？”我说：“不要买，我们立刻走。”侯佩岑也很高兴，立刻告诉汪用和。汪用和把脸一板，说：“这怎么可以？我飞机票都买好了！”侯佩岑就愁眉苦脸地告诉我：“汪姐说飞机票都买好了。”我说：“没有关系，我们坐船走。”这个笑话到这里还没完。现在有一个叫李文仪的美女出现了，看到李文仪以后，我不能够坐飞机走，也不能够坐船走，我可能坐潜水艇走了。换...
032.李文仪与潜艇采购.txt	7	希望与和平	李委员敖：主席、各位列席官员、各位同仁。部长，林肯总统在开国务会议的时候要先讲个笑话，他不是不尊重国家大事，而是让大家稍微轻松一点。本席也先讲个与我们的前途有关系的笑话。前几年，我在中天电视台做节目，在化妆室碰到周守训的太太汪用和，我向她开玩笑：“用和，你去买乐透，中奖以后我把我太太丢掉，你把周守训丢掉，我们两个人拿着你中奖的钱远走高飞。”汪用和答应了，而且她很得意地把这件事情告诉每一位女主播，结果被一位女主播听到，她的名字叫侯佩岑。侯佩岑过来偷偷跟我讲：“李大哥，如果我去买了乐透，中了以后你要不要跟我走？”我说：“不要买，我们立刻走。”侯佩岑也很高兴，立刻告诉汪用和。汪用和把脸一板，说：“这怎么可以？我飞机票都买好了！”侯佩岑就愁眉苦脸地告诉我：“汪姐说飞机票都买好了。”我说：“没有关系，我们坐船走。”这个笑话到这里还没完。现在有一个叫李文仪的美女出现了，看到李文仪以后，我不能够坐飞机走，也不能够坐船走，我可能坐潜水艇走了。换...
032.李文仪与潜艇采购.txt	7	买这个军购并非我单方面可以决定，美国也没有免费提供我武器的责任与义务。	李委员敖：主席、各位列席官员、各位同仁。部长，林肯总统在开国务会议的时候要先讲个笑话，他不是不尊重国家大事，而是让大家稍微轻松一点。本席也先讲个与我们的前途有关系的笑话。前几年，我在中天电视台做节目，在化妆室碰到周守训的太太汪用和，我向她开玩笑：“用和，你去买乐透，中奖以后我把我太太丢掉，你把周守训丢掉，我们两个人拿着你中奖的钱远走高飞。”汪用和答应了，而且她很得意地把这件事情告诉每一位女主播，结果被一位女主播听到，她的名字叫侯佩岑。侯佩岑过来偷偷跟我讲：“李大哥，如果我去买了乐透，中了以后你要不要跟我走？”我说：“不要买，我们立刻走。”侯佩岑也很高兴，立刻告诉汪用和。汪用和把脸一板，说：“这怎么可以？我飞机票都买好了！”侯佩岑就愁眉苦脸地告诉我：“汪姐说飞机票都买好了。”我说：“没有关系，我们坐船走。”这个笑话到这里还没完。现在有一个叫李文仪的美女出现了，看到李文仪以后，我不能够坐飞机走，也不能够坐船走，我可能坐潜水艇走了。换...
032.李文仪与潜艇采购.txt	33	执政20年来，我个人利益可以牺牲，国家利益也可以牺牲	李委员敖：我现在念蒋介石时代驻美大使顾维钧回忆录中的一段话，其中提到蒋介石找到了美国大使蓝钦，对蓝钦说自己“执政20年来，我个人利益可以牺牲，国家利益也可以牺牲”，后面这句话好恐怖——又说“原则和正义永远不能牺牲”，当国家利益都牺牲掉了，还有什么原则和正义？所以，蒋介石最后又讲到“我们也要战到最后的一兵一卒”，对不起，李杰部长，你的一兵一卒理论是跟着你们祖师爷而来的，但是，最后连国家利益都牺牲时，战到一兵一卒又有何意义？我认为你们没有好好跟美国人谈、没有跟美国人敲桌子、打板凳、丢茶杯、耍赖！如我一再勉励你的，效法印度国防部长梅农的态度，他向美国人要武器，就是要用脚踢他。而你们在美国人面前根本像孙子一样，你们不敢跟他们谈嘛！美国人说我们有钱就要买，为什么老子有钱就要买，他们的钱比我们还多，应该要送给我们，否则就根本拒绝买；一旦我们拒绝，美国人就紧张了，因为台湾脱离了美国的势力范围。我告诉部长，阿扁又变了，他如把“台独”抛弃掉，在最...
032.李文仪与潜艇采购.txt	33	原则和正义永远不能牺牲	李委员敖：我现在念蒋介石时代驻美大使顾维钧回忆录中的一段话，其中提到蒋介石找到了美国大使蓝钦，对蓝钦说自己“执政20年来，我个人利益可以牺牲，国家利益也可以牺牲”，后面这句话好恐怖——又说“原则和正义永远不能牺牲”，当国家利益都牺牲掉了，还有什么原则和正义？所以，蒋介石最后又讲到“我们也要战到最后的一兵一卒”，对不起，李杰部长，你的一兵一卒理论是跟着你们祖师爷而来的，但是，最后连国家利益都牺牲时，战到一兵一卒又有何意义？我认为你们没有好好跟美国人谈、没有跟美国人敲桌子、打板凳、丢茶杯、耍赖！如我一再勉励你的，效法印度国防部长梅农的态度，他向美国人要武器，就是要用脚踢他。而你们在美国人面前根本像孙子一样，你们不敢跟他们谈嘛！美国人说我们有钱就要买，为什么老子有钱就要买，他们的钱比我们还多，应该要送给我们，否则就根本拒绝买；一旦我们拒绝，美国人就紧张了，因为台湾脱离了美国的势力范围。我告诉部长，阿扁又变了，他如把“台独”抛弃掉，在最...
