file	line	context
009.过早的答案.txt	21	读过《三国演义》的人，都知道曹操恨祢衡，可是并不杀他，曹操把祢衡送给刘表，意在由刘表杀他，可是刘表是聪明人，他才不做坏人，他把祢衡又转送给黄祖（今名“张宗昌”）。黄祖是个傻小子，傻不登登，把祢衡推出斩了。因此横被千古之恶名。而曹操孟德小名阿瞒者，直到今天，必然还在地狱，“阿”拉“瞒”住阎王，吃吃窃笑呢！
009.过早的答案.txt	25	《中央日报》的短评，在某些头脑开明、心地宽宏的国民党党员看来，纵然不很失体，也是很不妥的。因为在一个“崇尚礼义”的国度里，在一个主张相忍为国、同舟共济的现状下，以国民党党报的地位，不主张息事宁人而公然主张打官司，公然主张所谓“李敖的老师”去告“李敖”，这究竟不算是什么可圈可点的事吧？究竟不算是什么“自由中国”光彩体面的事吧？究竟不算是什么团结一致、协力对外的事吧？
009.过早的答案.txt	41	有时候，我忍不住要天真的想：究竟是什么缘故要造成有智慧的人不能为国家做点事？为什么许多有才智、有个性、有人品的人要被摒弃在野、不能生活，并且受到“忠贞”上面的怀疑？即以被称为“不肖的学生”本李敖而论，论才智、论个性、论人品，凡稍知我者，似乎可证明我绝非小人们所中伤的那样“坏”。就我个人来说，我自知我乃一“卧龙岗散淡的人”，生性疏懒，放浪形骸，自谓不合于党、政、学、商等各方面之要求，亦从不做任何党员、不涉身宦海、不敢自称学者，不配从商。但我是一个人，一个公民，我要要求天赋的和宪法上所给我的一切权利，如同我要尽宪法上所要我尽的一切义务，这并不是什么大逆不道的事。可是这年头怪就怪在这里，你有宪法第二十条当兵的义务，却无宪法第十五条工作的权利。我这个“卧龙岗散淡的人”在大学毕业、当兵回来以后，竟没有工作权，竟连一个当中学教员的机会都找不到！最后只好当了裤子！
009.过早的答案.txt	69	两年五个月前，我写《修改<医师法>与废止中医》（《传统下的独白》页121），我就说过：
009.过早的答案.txt	87	一、对阴影中的攻击我不必提，但是明显的攻击我必需有所正告和还手。《中央日报》对我的攻击，只是许多攻击中的一个主流，其他有汉奸对我的攻击，曾经做过共产党的人对我的攻击，曾经叛国和做过共产党同路人者对我的攻击，曾经留日的某诱奸犯现任某大学教授者对我的攻击，乃至托洛斯基派对我的攻击等等……需要笔杆的，笔杆解决；需要法院的，法院解决，我绝对奉陪，直打到他们下地狱为止。
009.过早的答案.txt	93	在宽广浩瀚的前程中，老不成器和老着脸皮的上一代们，都不是新时代知识分子的“敌人”，因为他们早该是旧时代枝头的落花飞絮，早该凋谢、早该销声敛迹、早该躺在床上，背一句臭诗——“看射猛虎终残年！”
009.过早的答案.txt	119	如今，十四年过去了，谢然之忠奸已判，刘济民幽明永隔，我也黑狱亡魂，劫后重归。我把这篇《过早的答案》再看一遍，发现它已不是“过早的答案”了，它已变成一篇“过迟的答案”。诗人弗洛斯特（Robert Frost）说他年轻时不敢做一个急进派，因为怕他年老时变成一个保守派。对我说来，这种预防可能正好相反——我年老了十四年，我却发现，我年轻时太保守了！
009.过早的答案.txt	127	台湾大学学生毕业出校之后，或在国内各界服务、或在外国留学、或在东南亚各国以及香港等地从事工商及教育事业，为祖国及母校争光者，不在少数。
009.过早的答案.txt	129	台大文学院毕业生在美国著名大学继续文史研究者，在百人以上，颇受各大学及研究所之赞扬，其理工学院毕业生，无论是留学或服务，亦获得各国之重视。事实俱在，可以告慰于这个最高学府。
009.过早的答案.txt	131	但是不肖的学生亦间有之。如某杂志最近几个月，连续刊载某毕业生诬蔑台大的文章，叛师毁友，极尽其架空造谣刻薄恶毒之能事。台大在校师生以及海外师友看见此种文章，至少感觉其为母校之羞，无可容忍。
009.过早的答案.txt	139	凡是中国人都相信，一个名人不免于毁誉相参。一直到他死去的时候，才“盖棺论定”。我们以为“盖棺论定”是指那死者的人格，不一定是指着他的学术思想而言。尽管那死者的学术思想，在他的身后，仍有赞成与反对的两面，但是他的人格总有一个定评，这定评即是所谓“盖棺论定”了。
009.过早的答案.txt	141	举胡适之为例。适之先生的学术思想，在他的身后，仍有赞成与反对的两种评论。但是当他逝世的时候，在士林之中，无论对他的学术思想，或是赞成或是反对，都一致的悼念他、尊重他，极一时之盛。
009.过早的答案.txt	143	不料今日，市场上出现一部书，名为《胡适评传》。这本书只出了第一册。就这一册来说，表面上是赞扬胡适之，而实际上从胡适之的上代，到他的本人，处处都是轻薄、鄙笑、讽刺，使读者不忍卒读。这样一部书，若是如此一册一册出版，而无人提出异议，可以说是士林之耻。我们今日愿以这篇短文，表示异议。（1964年9月6日）
009.过早的答案.txt	149	《三国演义》第二十三回，曹操欲选一有文名之士，往说刘表投降，先找孔融，孔融推荐他的朋友祢衡，融自称：“祢衡之才十倍于我，此人不但可任使者，且宜在帝之左右。”上表给献帝，其中盛赞祢衡的才华，略谓：“……窃见处士平原祢衡，年二十四，字正平，淑质贞亮，英才卓荦，初涉艺文，升堂睹奥。目所一见，辄诵之口；耳所暂闻，不忘于心。性与道合，思若有神，弘羊潛计，安世默识，以衡准之，诚不足怪。忠果正直，志怀霸雪；见善若惊，嫉恶如仇，任座抗行，史鱼厉节，殆无以过也。鸷鸟累百，不如一鹗。使衡立朝，必有可观。……”
009.过早的答案.txt	151	帝览表，以付曹操。操遂使人召衡至。礼毕，操不命坐。衡仰天叹曰：“天地虽宽，何无一人也。”操曰：“吾手下有数十人，皆当世英雄，何谓无人？”衡曰：“愿闻！”曹操列举了帐下的文武干部，衡笑曰：“荀彧可使吊丧问疾，荀攸可使看坟守墓，程昱可使关门闭户，郭嘉可使白词念赋。张辽可使击鼓鸣金，许褚可使牧牛放马，乐进可使取状读诏，李典可使传书送檄，吕虔可使磨刀铸剑，满宠可使饮酒食糟，于禁可使负版筑墙，徐晃可使屠猪杀狗，夏侯惇称为‘完体将军’，曹子孝呼为‘要钱太守’，其余皆是衣架、饭囊、酒桶、肉袋耳！”他自称：“天文地经，无一不通，三教九流，无所不晓，上可以致君为尧舜，下可以配德于孔颜，岂是俗子共论乎？”
009.过早的答案.txt	155	当时，有张辽在侧，掣剑欲斩之。操曰：“吾正少一鼓吏，早晚朝贺宴享，可令祢衡充其职。”衡不推辞，应声而去。辽曰：“此人出言不逊，何不杀之！”操曰：“此人素有虚名，远近所闻。今日杀之，天下必谓我不能容物。彼自以为能，故令鼓吏以辱之。”
009.过早的答案.txt	157	来日操于省厅上大宴宾客，令鼓吏挝鼓，旧吏云：“挝鼓必换新衣。”衡穿旧衣而入，遂击鼓为《渔阳三挝》，音节殊妙。左右喝曰：“何不更衣？”衡当面脱下破旧衣服，裸体而入，浑身尽露，坐客皆掩面，操叱曰：“庙堂之上，何太无礼？”衡曰：“欺君罔上，乃谓无礼，吾露父母之形，以显清白之体耳！”操曰：“汝为清白，为污浊？”衡曰：“汝不识贤愚是眼浊也，不读诗书是口浊也，不纳忠言是耳浊也，不通古今是身浊也，不容诸侯是腹浊也，常怀篡逆是心浊也！吾乃天下名士，用为鼓吏，是犹阳货轻仲尼、臧仓毁孟子耳，欲成王霸之业，而如此轻人耶？”虽然操被他骂得体无完肤，仍然派他去招降刘表。
009.过早的答案.txt	159	在同一时代的诸葛亮也曾自比管仲、乐毅，但是徐庶把他推荐给刘备时，刘备说：“君与俱来！”徐庶曰：“此人不可屈，致宜枉驾求之。”刘备三顾茅庐以后，他才肯出山，照孔融所说以及祢衡自况，他的才能比诸葛亮要高明多了，但为什么一召而至，而且目空一切，连推荐他的孔融几乎都不算是人才。可能如曹操所说的“素有虚名”，而且他的言行充分表现其心理变态，当众裸体，有所谓“暴露狂”，孔子说过：“邦无道危行言逊。”言语谨慎谦逊免遭嫉害，此所谓明哲保身也，他三番两次辱骂曹操，何异自杀？
009.过早的答案.txt	161	祢衡第一次“自杀”未遂，又做第二次，《三国演义》中如此写着：衡至荆州，见刘表毕，虽颂德，实讥讽。表不喜，令去江夏见黄祖。或问表曰：“祢衡戏谑主公，何不杀之？”表曰：“祢衡数辱曹操，操不杀者，恐失人望，故令作使于我，欲借我手杀之，使我受害贤之名也。吾今遣去见黄祖，使曹操知我有识。”众皆称善。
009.过早的答案.txt	163	于是祢衡又做第三次“自杀”。祢衡到了黄祖处，与黄祖共饮，皆醉。祖问衡曰：“君在许都，有何人物？”衡曰：“大儿孔文举（融），小儿杨德祖，除此二人，别无人物。”祖曰：“似我如何？”衡曰：“汝似庙中之神，虽受祭祀，恨无灵验。”祖大怒曰：“汝以我为土木偶人耶！”遂斩之。
009.过早的答案.txt	169	虽然每读《三国演义》至击鼓骂曹，心中为之一快，但深为其人可惜，要是我，不如一辈子傲笑山林之下，何必先为曹操使者，后又受刘表差遣，写到这里，想到今日也有祢衡在。
009.过早的答案.txt	173	近日看到一篇文字，要求将“今之祢衡”绳之以法，我看大可不必。孟子在《离娄篇》曾说过：“有人于此，其待我以横逆，则君子必自反也：‘我必不仁也，必无礼也；此物奚宜至哉！’其自反而仁矣，自反而有礼矣，其横逆犹是也，君子必自反曰：‘我必不忠。’自反而忠矣，其横逆犹是也，君子曰：‘此亦妄人也已矣。……’”何况曹操与刘表虽然祢衡一再辱骂讥讽也不动肝火，让黄祖去杀他，主张治“今之祢衡”之罪的人，其才智风度不及曹操，也不及刘表了！（《大华晚报》，1964年10月3-6日台北出版；并收入《谈古论今》，1965年1月25日台北文星书店版）
009.过早的答案.txt	183	凡是中国人都相信，一个名人不免于毁誉相参。一直到他死去的时候，才“盖棺论定”。这是指那死者的人格，不一定是指着他的学术思想而言。尽管那死者的学术思想，在他的身后，仍有赞成与反对的两面，但是他的人格总有一个定评，这定评即是所谓“盖棺论定”了。
009.过早的答案.txt	185	举胡适之为例。适之先生的学术思想，在他的身后，仍有赞成与反对的两种评论。但是当他逝世的时候，在士林之中，无论对他的学术思想，或是赞成或是反对，都一致的悼念他、尊重他，极一时之盛。
009.过早的答案.txt	187	不料今日，市场上出现一部书，名为《胡适评传》。这本书只出了第一册。就这一册来说，表面上是赞扬胡适之，而实际上从胡适之的上代，到他的本人，处处都是轻薄、鄙笑、讽刺，使读者不忍卒读。这样一部书，若是如此一册一册出版，而无人提出异议，可以说是士林之耻。我们今日愿以这篇短文，表示异议。
009.过早的答案.txt	189	云云。胡适之逝世的时候，曾经有若干人悼念他、尊重他，虽“极一时之盛”，但非“士林一致”则可断言。我就知道那时还有许多人在痛骂他，而中央日报所称“士林一致”显系强奸民意，则为毫无疑问的事实。
009.过早的答案.txt	193	《胡适评传》是何人所作，对胡氏“轻薄”、“鄙笑”、“讽刺”到如此程度，我因未读过，无从知道，这不是我所要讨论的。但对中央日报主笔所主张的“盖棺论定”，则绝对不敢苟同。因为在一个人死的时候，有一次盛大的追悼会，即认为“士林一致悼念他、尊重他”，以少数人视为全体，未免太武断。若以这种方法判断人的贤愚，则在台湾死去的人，开过追悼会，有数千人，甚至万人出席，就认其是圣贤，就盖棺论定，那么台湾的圣贤未免太多，就没有一个不是圣贤了。
009.过早的答案.txt	195	“盖棺论定”这句话，毛病太大，绝对不能成立，眼前的事实，就有斯大林之例在。当1953年斯大林死去的时候，俄国全国追悼，有许多人歌功颂德，谁又敢说不是“士林一致”呢？但不到三年，赫鲁晓夫就首先贬他，现在斯大林在俄国，恐怕比狗屎还臭，这就是“盖棺论定”不能成立的活生生的例证！
009.过早的答案.txt	197	又如明代的政治家张居正，当其死时，朝廷大小臣僚尽系张氏家奴走狗，反对他的人非被杀即遭贬谪，所以朝野“一致”推崇张居正，超越尹周，比拟舜禹，平日被其欺凌之明神宗，亦不能不怆悼辍朝，谕祭九坛，视国公兼师傅例，赠上柱国，缢文忠，命四品卿，锦衣堂上官，司礼太监，护丧归葬。若云“盖棺论定”则张居正之荣哀，可谓前无古人了。但不到二年，因被弹劾贪污，即命司礼太监张诚赴荆州抄没其家，其子敬修被追赃款，自缢而死。神宗下诏尽削居正官，夺玺书诰命，以罪状示天下，其弟都指挥居易，子编修嗣修，俱戍极边。是横行一时之张居正，亦不能“盖棺论定”，而况权势不及他的人呢？
009.过早的答案.txt	201	一个拥有权势的人，当其死时，其权势并未消灭，他在权势掩护下，谁敢不歌功颂德，而其胡作非为，绝对无人敢于指斥，如斯大林、如张居正，在死后不久之追悼会上，都是圣贤。因他们的死，权势渐渐转移，故斯大林三年后被斥为暴君，张居正二年后始因贪污而被抄出赃款若干万，至此始发现张居正之真正人格，始能做其人格之定论，并非如《中央日报》记者所主张盖棺就可论定也。我以这种铁的事实，特指斥中央日报记者之偏私，专为某些贪官污吏做政治上之掩护也。（《民主评论》；并收入《又是愚话》，1965年4月台北文星书店版）
011.论没有“流血的自由”.txt	3	不准“慷慨歌燕市”，
011.论没有“流血的自由”.txt	11	这是我改写的四句诗。原诗引号里头的文字，大家都知道是汪精卫谋刺摄政王不成，在清朝牢里做的。当时汪精卫所处的是一个旧时代，在旧时代中“造反”也好、“起义”也罢、“革命”也行，不管你干什么，只要你不成功被逮到，大概都难逃一死。在挨刀以前，抗节不屈的人，往往可以得到英雄式的招待和烈士式的满足，他在“从容坐楚囚”以后，“绑赴法场”，还可以意气扬扬，“慷慨歌燕市”一番，他可以高喊口号，做简短演说，或是“骂贼而死”。“引刀成一快”前一分钟，他可以表示“二十年后还是一条好汉”，他真的是好汉，在菜市口看热闹的同胞们，也都不得不承认他是好汉。上面这种“引刀成一快”的故事，在古今中外历史中，我们可以找到很多。这些人虽都难逃刀下鬼的命运，但是相对的，也聊以自慰的，他们总算得到了“不负少年头”的满足——除了那混球的阿Q以外。
011.论没有“流血的自由”.txt	13	旧时代的好汉们为理想奋斗，他们深刻了解“千古艰难唯一死”的哲学。奋斗失败了，他们甚至甘愿用“一死”来代替逃亡，代替徐图再起或卷土重来。戊戌政变时候的谭嗣同，就是具有这种信仰的典型。当时日本志士们劝他离开北京，他却不肯，他竟说：“各国变法无不从流血而成，今日中国未闻有因变法而流血者，此国之所以不昌也！有之，请自嗣同始！”——可怜的谭嗣同，他竟认为午门溅血，是变法的一个必要条件！清朝的当政者“成全”了他、“满足”了他这个条件，“以八月十三日斩于市，春秋三十有三，就义之日，观者万人！”清朝政府公开杀他的目的在“示众”，他的目的在“流血”，表面上，双方好像都没吃亏；骨子里，其实双方都吃了亏：一个三十三岁的小伙子，把大好头颅被腐朽的老一代砍下来，这是多么不值得！在另外一方面，清朝政府给了谭嗣同“流血的自由”，又何其“愚蠢”也哉！
011.论没有“流血的自由”.txt	17	所谓“流血的自由”，广义的说，是脖子挨刀的人们，最后表白一下真我的自由，他们以命偿名，临终以死明志，消极说来，也不失为一种抗议——一种悲壮的抗议，一种看似无用却影响深远的抗议。旧式的大权在握者，基于“示众”、“阴德”等复杂心理，对“待死之囚”，总还给他一个“慷慨过市”的机会。换句话说，“待死之囚”最后想得到一个英雄式的烈士结局，他可以被允许得到。从另一个角度说来，这倒也可算是旧式统治者“宽厚”或“愚蠢”的地方。但是，清朝末年禹之谟的死，已为这种“仁政”开始了一个“不仁”的起点，旧式统治者已聪明的觉察到：公开“杀”出个英雄或烈士，虽然可收儆众之功，可是另一方面，却有“反令竖子成名”和“陷政府于不义”的大流弊。利害相权之下，实在得不偿失。
011.论没有“流血的自由”.txt	19	在20世纪的20年代里，革命的浪潮已淘汰了许多旧式统治者，而代之以新式的“王君”。新式统治者，于“杀”人一道，当然也推陈出新，有他聪明的新花样。新式统治者对他想要“杀”掉的人，永远是以神不知鬼不觉的除去为上策，所谓“暗中干掉”是也！但这种“暗中干掉”的方式，只能施之于无名小卒，对薄有微名的异己，就不好向全国人和全世界人交代。于是在“暗中干掉”无名小卒外，不得不另想法子来对付薄有微名的一群。
011.论没有“流血的自由”.txt	25	斯大林最“精采”的杀人表演，是一九三六年开始的三幕“大公审”活剧。在活剧演出时，被告的态度，使全世界的心理学家和法律专家都感到大惑不解。原来名列被告的被整肃的老革命党们，他们在法庭上，竟纷纷“直认罪状不讳”，他们不但不为自己做无辜的辩护，反倒帮忙检察官找最恶毒、最丢脸的形容词朝自己脸上贴；同时他们的律师，也不替他们做无辜的辩护，也一反律师之道，纷纷帮助检察官找寻被告罪行。（他们不做律师，也做了检察官！）最后的收场是：检察官、被告、律师等，又众口一声，颂扬起“伟大、和蔼、聪明、可爱的斯大林”来！颂扬完了，检察官维辛斯基高叫被告是“卖国贼”、是“疯狗”，并且向法官要求：“一定要把他们当疯狗般杀掉！”（维辛斯基是俄国十月革命时的“反革命者”，谁能想到这个当年与革命为敌的人，竞反过头来，有权指控十月革命的老革命党们“反革命”！）
011.论没有“流血的自由”.txt	31	老革命党们用尽量屈辱自己的方法，去希冀在他们死后，斯大林会兑现他的承诺，以使他们的妻儿、朋友和信徒不同赴黄泉。因此，他们死得是那样驯服、那样卑微、那样懦弱而低贱。斯大林完全“成功”了！这个混世暴君已经完全消灭了“流血的自由”。在他的总导演下，没有了歌燕市的慷慨，没有了坐楚囚的从容，一个个叱咤风云的革命志士，都变成了饮恨吞声的可怜虫！
012.牛肉面老板的七封信.txt	7	看了这五个字，你一定先惊喜一番，心想：“又不知是第几号表妹，爱情信飞来了也！待本诗人躲开漂亮的太太，把这信携往厕所，偷读它一番！”
012.牛肉面老板的七封信.txt	17	你一定没读过《后汉书》逸民列传，让我抄一段我很喜欢的给你：
012.牛肉面老板的七封信.txt	45	光中同我，已隔世十三年，愈隔愈远了。记得光中约我在他班上讲了一次演，我当众劝他不要在象牙塔里做诗人，要为被压迫的大众做点哀呼。十五年过去了，我对他的期望毫无改变，我一直奢望“余光中型”的知识人会变成为被压迫大众说话的战士，大概这就是我的狼子野心。今天我写这段附记，我“狼顾”我们那段友谊，既快慰又狼狈。光中光中，故人日远，知我心哉？
012.牛肉面老板的七封信.txt	57	你提到我们李家四大怪杰——李耳、李卓吾、李宗吾、李敖，并说前三杰没有“大改行”，是不太正确的。老子李耳是留下五千言后骑牛（没卖牛肉面）跑掉的，那五千言的产生，是被“官方”强迫或欢迎写的，也没被查禁；李卓吾是在牢里自杀的，早已被迫改行，改行做囚犯，书被禁毁；李宗吾挨过暴揍，并且书被查禁。他们都不是“自由出书以殁”的，他们的处境和遭遇，都各有不同，但是似乎都没有到达“畅乎言之”、“大行其道”的境界。他们的霉运，似乎多少祸延子孙一些，所以我李某人，也就“文光射斗，牛气冲天”了！
012.牛肉面老板的七封信.txt	97	你太抬举我了！我要告诉你，“电流”是“中断”不了的，一定该有更强的电流出来，该有更“声慑文坛”的朋友出来。以文字为业的人，都该有一种信念，那就是“江山代有才人出”的信念，成事不必在我，而我之播种，必不白费。胡适之先生有一次向我说：“无心插柳，尚且成荫；有意栽花，当然要发！”难道老年人不退休，我这个三十一岁的人先“退休”，就没有新的电流了吗？我不相信。如果没有新的电流出来，那我这五年“声慑”也算白费了，我不能相信。
012.牛肉面老板的七封信.txt	101	文坛活动“声慑”的程度，往往不依赖真才实学，而要靠“江山”的大小。“江山”大时，“声慑”时间就久，如韩退之、胡适之；反之，“江山”小时，“声慑”时间也就成正比兑现，在小环境的集中压力下，即使才如江海超迈前代，也无法有“各领风骚数百年”的运气，只好来个“各领风骚只五年”吧！
012.牛肉面老板的七封信.txt	113	限时信收到，你说不全部预约我的书，为了你“向无看别人书信、日记的恶习，且唯恐阁下的情书、日记不堪入目”云云，这十足表示你的观念不够“新”，如果你对我的“判决”不服气，买一套看看便知道。前五本的预约时间已过，你如买一套十本，我还是算你两百元吧！
012.牛肉面老板的七封信.txt	115	谢谢你邀我到南投喝酒，并谢谢你那些“酒林道友”们。南投我没去过，颇想一游。我在台湾住了一十有七年，去的地方极少，此乃王婆所谓“邓、“闲”两条件不足之故。三十八年（1949）我念初二时，班上郊游，我提议去日月潭，结果通过。不料我回家向老子伸手，老子却凑不出钱来，最后本提议人，只好眼巴巴的看着别人上了游览之车，回想起来，至今犹以为憾（日月潭到现在还没去过）。
012.牛肉面老板的七封信.txt	137	所以，总归一句，“和尚”也不好做。也许你去暂时老实的做一个沿门托钵的化缘客，可是说不定哪一天，一顶大帽子又戴在你头上，说你是“妖僧”。那时候，甚至连看潘巧云屁股的机会，也要被剥夺了！
013.刻薄的批评与正直的建议.txt	7	你劝我“改刻薄的批评为正直的建议”，很谢谢你。我只是告诉你，在我眼中，我分不出这两者有什么分际。你这种劝告，是中了传统中“泛敦厚主义”的毒。所谓“泛敦厚主义”，是一些庸言庸德的人，把一切表达法都虚礼化、平庸化。虚礼与平庸的表达结果，使一切意见都丧失了活力和生机，甚至搅得在是非边缘打转转，使面对他的表达法的人，竟闹不清他在尖锐地反对什么，或是大力地赞成什么，而只知道他在说“老生常谈”、“昏昏欲睡”的客套话！
013.刻薄的批评与正直的建议.txt	9	这就是所谓的“正直的建议”！
