score	file	line	text	context
3	004.第三部——1963（黄花岗52年后）.txt	421	你这排长得多借二十元给我，还得让我用牙膏。你要可怜我是你的组长、七五炮组长，炮都能打炮呢，人怎么反倒不能。你排长这样不帮忙，一定思想有问题。	“反正，”张永亭说，“你这排长得多借二十元给我，还得让我用牙膏。你要可怜我是你的组长、七五炮组长，炮都能打炮呢，人怎么反倒不能。你排长这样不帮忙，一定思想有问题。”转向干事：“干事啊，请记他一笔，排长思想有问题。我反共，他不支持我反共，他就是‘反反共’。”
6	004.第三部——1963（黄花岗52年后）.txt	427	那天路过中山室，进去遛遛，干事拿了一本《中华杂志》，摇头晃脑的边看边说：这些立法委员办杂志，就会发明新名词，叫什么‘反反共’。我凑过去看，干事一把把我推开，说你是老粗、是丘八、不认识几个字，你不懂什么叫‘反反共’，你走开。真巧，我走开前就看到那篇文章作者的名字，叫胡什么原，哦，记起来了，叫什么‘胡秋原’。是立法委员呢。干事，立法委员干的什么事？	“那天路过中山室，进去遛遛，干事拿了一本《中华杂志》，摇头晃脑的边看边说：这些立法委员办杂志，就会发明新名词，叫什么‘反反共’。我凑过去看，干事一把把我推开，说你是老粗、是丘八、不认识几个字，你不懂什么叫‘反反共’，你走开。真巧，我走开前就看到那篇文章作者的名字，叫胡什么原，哦，记起来了，叫什么‘胡秋原’。是立法委员呢。干事，立法委员干的什么事？”
3	004.第三部——1963（黄花岗52年后）.txt	429	说了你也不懂，立法委员领干薪不办事，但他们代表法统。没他们几百个人，‘中华民国’飘到台湾了、就没根了。所以法统很重要，我们要花钱供着他们。他们是老先生老太太。	干事笑起来。“说了你也不懂，立法委员领干薪不办事，但他们代表法统。没他们几百个人，‘中华民国’飘到台湾了、就没根了。所以法统很重要，我们要花钱供着他们。他们是老先生老太太。”
4	004.第三部——1963（黄花岗52年后）.txt	431	我们也老啊，我们是老兵、老战士。也该供着啊。	“我们也老啊，我们是老兵、老战士。也该供着啊。”
4	004.第三部——1963（黄花岗52年后）.txt	433	政府整天养着你，不就是供着你吗？只是钱少一点而已，比老先生老太太少一点，哦，少很多。	“政府整天养着你，不就是供着你吗？只是钱少一点而已，比老先生老太太少一点，哦，少很多。”
4	004.第三部——1963（黄花岗52年后）.txt	435	他们拿那么多钱干什么，也‘毋忘在莒’吗？	“他们拿那么多钱干什么，也‘毋忘在莒’吗？”
3	004.第三部——1963（黄花岗52年后）.txt	437	也‘毋忘在莒’,但你比他们多两项，第一、你还会‘毋忘再举’，举起来的举；第二，你还会倒过来举，你‘毋忘举债’。你真行。妈的，张永亭，你真行、你他妈的真行。	“也‘毋忘在莒’,但你比他们多两项，第一、你还会‘毋忘再举’，举起来的举；第二，你还会倒过来举，你‘毋忘举债’。你真行。妈的，张永亭，你真行、你他妈的真行。”
4	004.第三部——1963（黄花岗52年后）.txt	451	这些人现在正列入‘顽固队’受训，因为他们不听话。	大太阳下看到几个老兵排成一队，鱼贯跑步。江排长告诉我：“这些人现在正列入‘顽固队’受训，因为他们不听话。”
4	004.第三部——1963（黄花岗52年后）.txt	455	有之不必然，无之必不然。	一般国民党员只是“门神党员”，门神，贴在大门上，开门时候你在里面、关门时候你在外面，是国民党不算什么，因为你不过是门神，但不是国民党就算什么了，一张党证，“有之不必然，无之必不然。”我没有这张党证，就被另眼看待、另眼防范了。我的长官和同侪、我的属下，他们要开党的小组会议了，会委婉的对我说：“林排长，自己到福利社吃碗面吧。”大家会心一笑，林排长自动放了两个小时...
4	004.第三部——1963（黄花岗52年后）.txt	455	林排长，自己到福利社吃碗面吧。	一般国民党员只是“门神党员”，门神，贴在大门上，开门时候你在里面、关门时候你在外面，是国民党不算什么，因为你不过是门神，但不是国民党就算什么了，一张党证，“有之不必然，无之必不然。”我没有这张党证，就被另眼看待、另眼防范了。我的长官和同侪、我的属下，他们要开党的小组会议了，会委婉的对我说：“林排长，自己到福利社吃碗面吧。”大家会心一笑，林排长自动放了两个小时...
5	004.第三部——1963（黄花岗52年后）.txt	467	晚饭后永亭笑嘻嘻来，竟拿我送他的二十元做老本，又把手表赢回来了，这小子真烂污！	8月14日：“张永亭夜来央我帮其赎手表（求我向行政官说项，准其借钱），并说此后一定不赌了。我说‘羊忘不了吃草，狗改不了吃屎’。你能不赌么？他妈的不要再啰唆，这个忙不帮，这二十元拿去，算我送你的，拿去明天吃杯老酒，在河边打自己几个嘴巴子，死了这颗心罢！（后来他走了，还连说明天再找我来赎表呢。不会放过我的。）”8月15日：“晚饭后永亭笑嘻嘻来，竟拿我送他的二十元...
3	004.第三部——1963（黄花岗52年后）.txt	467	张永亭夜来央我帮其赎手表（求我向行政官说项，准其借钱），并说此后一定不赌了。我说‘羊忘不了吃草，狗改不了吃屎’。你能不赌么？他妈的不要再啰唆，这个忙不帮，这二十元拿去，算我送你的，拿去明天吃杯老酒，在河边打自己几个嘴巴子，死了这颗心罢！（后来他走了，还连说明天再找我来赎表呢。不会放过我的。）	8月14日：“张永亭夜来央我帮其赎手表（求我向行政官说项，准其借钱），并说此后一定不赌了。我说‘羊忘不了吃草，狗改不了吃屎’。你能不赌么？他妈的不要再啰唆，这个忙不帮，这二十元拿去，算我送你的，拿去明天吃杯老酒，在河边打自己几个嘴巴子，死了这颗心罢！（后来他走了，还连说明天再找我来赎表呢。不会放过我的。）”8月15日：“晚饭后永亭笑嘻嘻来，竟拿我送他的二十元...
8	004.第三部——1963（黄花岗52年后）.txt	471	我赤身出于母胎，也必赤身归回	大家聊天，谈到“反攻大陆”。张永亭半开玩笑说：“反攻大陆后第一件事，就是回到老家，掘掉自己的祖坟。——祖坟风水不好，害得我一辈子倒了大霉。”我反问了一句：“如果回不去呢？”他说：“回不去吗？那我退伍后，老得不能动了以后，我就脱掉裤子，跳河自杀。——自杀前我会向我妈说：‘妈，我光着屁股来，现在光着屁股回去了！’”我听了这话，想起《旧约》（约伯记）“我赤身出于母...
6	004.第三部——1963（黄花岗52年后）.txt	471	反攻大陆后第一件事，就是回到老家，掘掉自己的祖坟。——祖坟风水不好，害得我一辈子倒了大霉。	大家聊天，谈到“反攻大陆”。张永亭半开玩笑说：“反攻大陆后第一件事，就是回到老家，掘掉自己的祖坟。——祖坟风水不好，害得我一辈子倒了大霉。”我反问了一句：“如果回不去呢？”他说：“回不去吗？那我退伍后，老得不能动了以后，我就脱掉裤子，跳河自杀。——自杀前我会向我妈说：‘妈，我光着屁股来，现在光着屁股回去了！’”我听了这话，想起《旧约》（约伯记）“我赤身出于母...
6	004.第三部——1963（黄花岗52年后）.txt	471	如果回不去呢？	大家聊天，谈到“反攻大陆”。张永亭半开玩笑说：“反攻大陆后第一件事，就是回到老家，掘掉自己的祖坟。——祖坟风水不好，害得我一辈子倒了大霉。”我反问了一句：“如果回不去呢？”他说：“回不去吗？那我退伍后，老得不能动了以后，我就脱掉裤子，跳河自杀。——自杀前我会向我妈说：‘妈，我光着屁股来，现在光着屁股回去了！’”我听了这话，想起《旧约》（约伯记）“我赤身出于母...
6	004.第三部——1963（黄花岗52年后）.txt	471	回不去吗？那我退伍后，老得不能动了以后，我就脱掉裤子，跳河自杀。——自杀前我会向我妈说：‘妈，我光着屁股来，现在光着屁股回去了！’	大家聊天，谈到“反攻大陆”。张永亭半开玩笑说：“反攻大陆后第一件事，就是回到老家，掘掉自己的祖坟。——祖坟风水不好，害得我一辈子倒了大霉。”我反问了一句：“如果回不去呢？”他说：“回不去吗？那我退伍后，老得不能动了以后，我就脱掉裤子，跳河自杀。——自杀前我会向我妈说：‘妈，我光着屁股来，现在光着屁股回去了！’”我听了这话，想起《旧约》（约伯记）“我赤身出于母...
3	004.第三部——1963（黄花岗52年后）.txt	471	反攻大陆	大家聊天，谈到“反攻大陆”。张永亭半开玩笑说：“反攻大陆后第一件事，就是回到老家，掘掉自己的祖坟。——祖坟风水不好，害得我一辈子倒了大霉。”我反问了一句：“如果回不去呢？”他说：“回不去吗？那我退伍后，老得不能动了以后，我就脱掉裤子，跳河自杀。——自杀前我会向我妈说：‘妈，我光着屁股来，现在光着屁股回去了！’”我听了这话，想起《旧约》（约伯记）“我赤身出于母...
5	004.第三部——1963（黄花岗52年后）.txt	477	我不知道张组长回大陆以后干什么，	“我不知道张组长回大陆以后干什么，”李班长插了嘴，“我回去，第一件事就是把那龟儿子保长杀掉。如果那时候他不在了，我就杀他儿子，儿子不在了，就杀孙子。”
3	004.第三部——1963（黄花岗52年后）.txt	477	我回去，第一件事就是把那龟儿子保长杀掉。如果那时候他不在了，我就杀他儿子，儿子不在了，就杀孙子。	“我不知道张组长回大陆以后干什么，”李班长插了嘴，“我回去，第一件事就是把那龟儿子保长杀掉。如果那时候他不在了，我就杀他儿子，儿子不在了，就杀孙子。”
3	004.第三部——1963（黄花岗52年后）.txt	479	你疯了？你干嘛？	“你疯了？你干嘛？”张组长斜过头问。
3	004.第三部——1963（黄花岗52年后）.txt	483	共产党也要独眼龙？	“共产党也要独眼龙？”一个小兵问。
3	004.第三部——1963（黄花岗52年后）.txt	485	独眼龙还做他们的元帅呢，那个刘伯承什么的，不是独眼龙吗？不信问问排长看，人家是大学生。	“独眼龙还做他们的元帅呢，那个刘伯承什么的，不是独眼龙吗？不信问问排长看，人家是大学生。”李班长说，瞅着林排长。
3	004.第三部——1963（黄花岗52年后）.txt	487	英国的海军元帅纳尔逊就是独眼龙，以色列的戴阳将军也是独眼龙，独眼龙做将军的大有人在，不管是不是共产党。问题是那老三打瞎一只眼睛，瞎的是左眼还是右眼。左眼还好，右眼就不能放枪瞄准了。	林排长心里想，在军队中扯这些共产党的元帅干什么，太敏感了，还是冲淡一下吧，于是说：“英国的海军元帅纳尔逊就是独眼龙，以色列的戴阳将军也是独眼龙，独眼龙做将军的大有人在，不管是不是共产党。问题是那老三打瞎一只眼睛，瞎的是左眼还是右眼。左眼还好，右眼就不能放枪瞄准了。”
5	004.第三部——1963（黄花岗52年后）.txt	489	排长设想得真周到，	“排长设想得真周到，”小兵说，“但对第三排的赖中尾说来，恐怕就不行了。我们耕田的都很笨，但是赖中尾更笨，笨到两只眼睛不能一只睁一只闭，我们每个人都可以左眼睁右眼闭、右眼睁左眼闭，可是赖中尾却不成，要睁全睁、要闭全闭，结果打野外时，他端着步枪，根本不能瞄准，右眼瞄准，左眼却睁着，哪能瞄出准来？气得邵班长找来一块胶布，啪的一下贴在赖中尾的左眼上，这下子睁不开了，...
8	004.第三部——1963（黄花岗52年后）.txt	491	那问题来了，	“那问题来了，”林排长说，“赖中尾如果当了将军，他只能像张飞了。《三国演义》说刺客趁张飞夜里睡觉去行刺的时候，看到他两只眼睛都是睁着的，吓了一跳，不敢动手，后来发现他在打鼾，原来张飞睡觉时候还是睁着眼睛。换句话说，他一天二十四小时，除了眨眼，他的眼睛全是睁着的，并且我认为他甚至眨眼也不会，——因为他杀人不眨眼！”
6	004.第三部——1963（黄花岗52年后）.txt	491	赖中尾如果当了将军，他只能像张飞了。《三国演义》说刺客趁张飞夜里睡觉去行刺的时候，看到他两只眼睛都是睁着的，吓了一跳，不敢动手，后来发现他在打鼾，原来张飞睡觉时候还是睁着眼睛。换句话说，他一天二十四小时，除了眨眼，他的眼睛全是睁着的，并且我认为他甚至眨眼也不会，——因为他杀人不眨眼！	“那问题来了，”林排长说，“赖中尾如果当了将军，他只能像张飞了。《三国演义》说刺客趁张飞夜里睡觉去行刺的时候，看到他两只眼睛都是睁着的，吓了一跳，不敢动手，后来发现他在打鼾，原来张飞睡觉时候还是睁着眼睛。换句话说，他一天二十四小时，除了眨眼，他的眼睛全是睁着的，并且我认为他甚至眨眼也不会，——因为他杀人不眨眼！”
4	004.第三部——1963（黄花岗52年后）.txt	493	但是，	“但是，”小兵问，“张飞若生在现代，两眼全睁着，不是跟赖中尾一样，打靶时不也瞄不成准么？将军学不会放枪，能当上将军吗？”
4	004.第三部——1963（黄花岗52年后）.txt	493	张飞若生在现代，两眼全睁着，不是跟赖中尾一样，打靶时不也瞄不成准么？将军学不会放枪，能当上将军吗？	“但是，”小兵问，“张飞若生在现代，两眼全睁着，不是跟赖中尾一样，打靶时不也瞄不成准么？将军学不会放枪，能当上将军吗？”
4	004.第三部——1963（黄花岗52年后）.txt	495	将军要靠别人放枪，将军自己，只要放屁就够了。	“谁说会放枪才当上将军的？”李班长说。“将军要靠别人放枪，将军自己，只要放屁就够了。”
3	004.第三部——1963（黄花岗52年后）.txt	495	谁说会放枪才当上将军的？	“谁说会放枪才当上将军的？”李班长说。“将军要靠别人放枪，将军自己，只要放屁就够了。”
4	004.第三部——1963（黄花岗52年后）.txt	499	李班长说得还不够。将军除了放屁、放狗屁外，还得会拍马屁。	“李班长说得还不够。将军除了放屁、放狗屁外，还得会拍马屁。”张组长右手做成拍着的动作。
4	004.第三部——1963（黄花岗52年后）.txt	501	我看，	“我看，”林排长说，“会拍马屁还不够，还得会骑马跑才成。”
4	004.第三部——1963（黄花岗52年后）.txt	501	会拍马屁还不够，还得会骑马跑才成。	“我看，”林排长说，“会拍马屁还不够，还得会骑马跑才成。”
3	004.第三部——1963（黄花岗52年后）.txt	503	骑马跑？跑哪里？	“骑马跑？跑哪里？”小兵问。
4	004.第三部——1963（黄花岗52年后）.txt	505	跑后方、向后方跑啊，先逃命啊。	“跑后方、向后方跑啊，先逃命啊。”
5	004.第三部——1963（黄花岗52年后）.txt	507	不先跑，晚一点跑不行吗？	“不先跑，晚一点跑不行吗？”
3	004.第三部——1963（黄花岗52年后）.txt	509	不行，晚跑就被打死了，做了先烈了。看看‘忠烈祠’吧，到处是死人牌位，每个牌位一个先烈。	“不行，晚跑就被打死了，做了先烈了。看看‘忠烈祠’吧，到处是死人牌位，每个牌位一个先烈。”
3	004.第三部——1963（黄花岗52年后）.txt	511	林排长大概不知道，在你到部队来以前，我们四十九团驻守过很多地方，其中一个就是‘忠烈祠’，我们见过的先烈太多了。	“林排长大概不知道，在你到部队来以前，我们四十九团驻守过很多地方，其中一个就是‘忠烈祠’，我们见过的先烈太多了。”士官长叹了一口气。“先烈、先烈，他们活的时候在外面，死了以后都进来了；老兵、老兵，我们活的时候在里边，死了以后都出来了。”
3	004.第三部——1963（黄花岗52年后）.txt	511	先烈、先烈，他们活的时候在外面，死了以后都进来了；老兵、老兵，我们活的时候在里边，死了以后都出来了。	“林排长大概不知道，在你到部队来以前，我们四十九团驻守过很多地方，其中一个就是‘忠烈祠’，我们见过的先烈太多了。”士官长叹了一口气。“先烈、先烈，他们活的时候在外面，死了以后都进来了；老兵、老兵，我们活的时候在里边，死了以后都出来了。”
5	004.第三部——1963（黄花岗52年后）.txt	513	士官长啊，你李师科不服气是不是？	王排长噗嗤一笑。“士官长啊，你李师科不服气是不是？”
3	004.第三部——1963（黄花岗52年后）.txt	515	有点不服气。我和先烈们一样爱国，为了爱这个国，也不知死了多少次了。怪的是就是死不了。本来死就死了，‘该死卵朝天’。但就是卵不能朝天，并且啊，这传宗接代的工具，最后却断子绝孙，一辈子在军队里，不准结婚也不能结婚，断子绝孙了。	“有点不服气。我和先烈们一样爱国，为了爱这个国，也不知死了多少次了。怪的是就是死不了。本来死就死了，‘该死卵朝天’。但就是卵不能朝天，并且啊，这传宗接代的工具，最后却断子绝孙，一辈子在军队里，不准结婚也不能结婚，断子绝孙了。”
3	004.第三部——1963（黄花岗52年后）.txt	517	别人可以这么说，士官长你不能这么说。别忘了你被拉夫拉来前，在家乡有个可爱小女儿！你李师科没有断子绝孙，断子绝孙的是我们。	“别人可以这么说，士官长你不能这么说。别忘了你被拉夫拉来前，在家乡有个可爱小女儿！你李师科没有断子绝孙，断子绝孙的是我们。”王排长说着，发现林排长偷偷向他缩着摇手，在提醒他。
4	004.第三部——1963（黄花岗52年后）.txt	519	就算有吧，今天也不知道怎么样了。	士官长叹了一口气，低下头来，再抬起头来时候，眼圈红了。“就算有吧，今天也不知道怎么样了。”
4	004.第三部——1963（黄花岗52年后）.txt	521	士官长啊，别那么悲观。总有一天要回去的，大家还要见面的。	“士官长啊，别那么悲观。总有一天要回去的，大家还要见面的。”林排长安慰着。
3	004.第三部——1963（黄花岗52年后）.txt	523	见面，在哪里见面？在‘忠烈祠’见我牌位？我进不了‘忠烈祠’的，那是大人物的地方。我李师科算哪根葱？	“见面，在哪里见面？在‘忠烈祠’见我牌位？我进不了‘忠烈祠’的，那是大人物的地方。我李师科算哪根葱？”
3	004.第三部——1963（黄花岗52年后）.txt	525	算哪根葱？	“算哪根葱？”王排长又来了。“算你自己那根葱。你自己就是一根怪葱，说不定你自己有一个小庙，自己住进自己的‘忠烈祠’。大人物的地方不要你，有什么关系？‘此地不养爷，自有养爷处。’……”
3	004.第三部——1963（黄花岗52年后）.txt	525	算你自己那根葱。你自己就是一根怪葱，说不定你自己有一个小庙，自己住进自己的‘忠烈祠’。大人物的地方不要你，有什么关系？‘此地不养爷，自有养爷处。’……	“算哪根葱？”王排长又来了。“算你自己那根葱。你自己就是一根怪葱，说不定你自己有一个小庙，自己住进自己的‘忠烈祠’。大人物的地方不要你，有什么关系？‘此地不养爷，自有养爷处。’……”
6	004.第三部——1963（黄花岗52年后）.txt	527	匪谍呀！我们抓到一个匪谍了！	“匪谍呀！我们抓到一个匪谍了！”林排长笑着叫起来。“匪谍王宇刚才讲的那两句，不是抗战胜利后流传的口号吗？
3	004.第三部——1963（黄花岗52年后）.txt	539	你这死大学生！居然到军队里找共匪了。共匪还不要我们哪！我们跟着国民党上山下海，是反动分子哟，投八路，八路还不要我们哪！	“闭嘴！”王排长笑着叫着。“你这死大学生！居然到军队里找共匪了。共匪还不要我们哪！我们跟着国民党上山下海，是反动分子哟，投八路，八路还不要我们哪！”
3	004.第三部——1963（黄花岗52年后）.txt	541	我们有一次被共匪俘虏，女匪干热烈招待，劝我们留下来一起打国民党，我们不肯。她们就放我们回来，临走让我们大吃大喝，还送路费。最后说：‘你们回去后，国民党还是会把你们抓来当兵。下次在战场上见到我们，在瞄准时候，请瞄高一点。’	“王排长这话不对。”曹班长插进话来。曹班长是矮胖型的老兵，总是笑嘻嘻的，总喜欢戴着军帽，因为有个癞痢头。“我们有一次被共匪俘虏，女匪干热烈招待，劝我们留下来一起打国民党，我们不肯。她们就放我们回来，临走让我们大吃大喝，还送路费。最后说：‘你们回去后，国民党还是会把你们抓来当兵。下次在战场上见到我们，在瞄准时候，请瞄高一点。’”
5	004.第三部——1963（黄花岗52年后）.txt	543	啊，女匪干真会说话！	“啊，女匪干真会说话！”
8	004.第三部——1963（黄花岗52年后）.txt	545	所以呀，	“所以呀，”曹班长补上一句，“下次，如果还有下次的话，如果我又被俘虏了，至少我会投八路了。”
7	004.第三部——1963（黄花岗52年后）.txt	545	下次，如果还有下次的话，如果我又被俘虏了，至少我会投八路了。	“所以呀，”曹班长补上一句，“下次，如果还有下次的话，如果我又被俘虏了，至少我会投八路了。”
3	004.第三部——1963（黄花岗52年后）.txt	547	投了八路更好吗？	“投了八路更好吗？”
4	004.第三部——1963（黄花岗52年后）.txt	549	投了八路至少留在大陆啊，不会离乡背井来台湾了。	“投了八路至少留在大陆啊，不会离乡背井来台湾了。”
3	004.第三部——1963（黄花岗52年后）.txt	551	台湾也是中国的一部分啊！	“台湾也是中国的一部分啊！”
4	004.第三部——1963（黄花岗52年后）.txt	553	但台湾像个睾丸，总挂在外面，离我们山东老家、老鸡巴远了一点。	“但台湾像个睾丸，总挂在外面，离我们山东老家、老鸡巴远了一点。”曹班长说。
4	004.第三部——1963（黄花岗52年后）.txt	555	看看你班上的祁德武吧，你曹班长也许就不那么说了。	“看看你班上的祁德武吧，你曹班长也许就不那么说了。”
4	004.第三部——1963（黄花岗52年后）.txt	559	来，	“来，”王排长向祁德武招手，祁德武过来了。“祁德武，说说你从‘抗美援朝’到做‘反共义士’的经过。”
4	004.第三部——1963（黄花岗52年后）.txt	559	祁德武，说说你从‘抗美援朝’到做‘反共义士’的经过。	“来，”王排长向祁德武招手，祁德武过来了。“祁德武，说说你从‘抗美援朝’到做‘反共义士’的经过。”
4	004.第三部——1963（黄花岗52年后）.txt	563	来，说说看。	“来，说说看。”王排长催他。
4	004.第三部——1963（黄花岗52年后）.txt	567	祁德武是老实人，别为难他。	“祁德武是老实人，别为难他。”林排长说。
5	004.第三部——1963（黄花岗52年后）.txt	571	哈哈，要当汉奸早当啊！怎么抗战胜利后反倒当起汉奸来？	“哈哈，要当汉奸早当啊！怎么抗战胜利后反倒当起汉奸来？”
4	004.第三部——1963（黄花岗52年后）.txt	573	说得也是呀，谁知道呀，结果生平第一次当兵，就不小心当了伪海军、伪军。	“说得也是呀，谁知道呀，结果生平第一次当兵，就不小心当了伪海军、伪军。”
