score	file	line	text	context
3	006.1958年11月.txt	535	我始终把写作视为一座冰山，每个冰山的八分之七的体积都隐藏在水底下。你可以从你的作品里剔除你所知道的部分，这样只会增加你作品的分量，你省去的部分就好像冰山在水底下的部分，如果作家在他的小说里省略了他所不了解的东西，那么他的小说就会发生漏洞。	8.“我始终把写作视为一座冰山，每个冰山的八分之七的体积都隐藏在水底下。你可以从你的作品里剔除你所知道的部分，这样只会增加你作品的分量，你省去的部分就好像冰山在水底下的部分，如果作家在他的小说里省略了他所不了解的东西，那么他的小说就会发生漏洞。”
8	006.1958年11月.txt	543	说的是北平话，还有一点儿山东口音	一、上午10时在文学院草地上小坐，见胡适车来，因过与胡适谈天于文学院的拱门之下，他说：“李先生，你那长信我收到了，因为忙着搬家，所以没来得及回。”并问我府上，说我“说的是北平话，还有一点儿山东口音”。我告诉他我没去过山东，一直住在北平。又谈及敦煌卷中宋太宗三七〇〇多号离婚状等。他谈他刚写完给赵元任的祝寿论文，又加了一条补记，“昨晚3点才睡”。并约我星期天去他...
7	006.1958年11月.txt	543	李先生，你那长信我收到了，因为忙着搬家，所以没来得及回。	一、上午10时在文学院草地上小坐，见胡适车来，因过与胡适谈天于文学院的拱门之下，他说：“李先生，你那长信我收到了，因为忙着搬家，所以没来得及回。”并问我府上，说我“说的是北平话，还有一点儿山东口音”。我告诉他我没去过山东，一直住在北平。又谈及敦煌卷中宋太宗三七〇〇多号离婚状等。他谈他刚写完给赵元任的祝寿论文，又加了一条补记，“昨晚3点才睡”。并约我星期天去他...
3	006.1958年11月.txt	545	您气色比以前好多了！	我说：“您气色比以前好多了！”
5	006.1958年11月.txt	641	李敖最好了，最有趣味了！	七、张森与吴在刚言：“李敖最好了，最有趣味了！”
4	007.1958年12月.txt	13	故人隔千里，一宵来梦中。	五、昨晚大梦洁力，以在印度史堂上，印象极深刻，稍有老态，似又在其家，其父母怪她为什么回来？今日怀念之心很重，思画圣诞卡赠之。“故人隔千里，一宵来梦中。”甚怅怅。
3	007.1958年12月.txt	15	并不害羞，因为那时我已成了莎丽泰。……一直到导演叫‘卡特’，我才重新回到我自己，于是我便立刻抢上一件衣服围在身上了！	六、阿根廷的琳黛克丝儿在演《红袖掩情泪》时裸体，她说：“并不害羞，因为那时我已成了莎丽泰。……一直到导演叫‘卡特’，我才重新回到我自己，于是我便立刻抢上一件衣服围在身上了！”吾之观念已是如是化、欧洲人化，不再如过去之保守了！
6	007.1958年12月.txt	45	总之，从事呼拉圈运动，如果累到气喘如牛、肌肉酸痛的那种程度，那对任何人身体都是有害的。	对于呼拉圈运动可能引起疾病的争论，医师公会联合会理事长内科医师胡振华曾发表意见，认为任何一种运动如过于剧烈，则一定有弊害，呼拉圈运动也不会例外，他并吁请有内脏疾病者千万注意，不能使用呼拉圈过于激烈，有高血压症者应完全禁用。所以胡振华医师在此人们对呼拉圈运动兴趣高涨之际，表示他特别不赞成一种长达几小时旋转数千转不息的连续比赛性呼拉圈运动，他也希望一般家长们不要...
4	007.1958年12月.txt	127	李敖的可爱就在这里，他当了总统杀了人就会后悔。	三、前天耀祖言我：“李敖的可爱就在这里，他当了总统杀了人就会后悔。”
3	007.1958年12月.txt	147	不老	（适之先生曾提倡“不老”哲学，又是美国怕太太协会的会员，用这两点意思成此小词，敬贺他六十八岁的生辰。）
3	007.1958年12月.txt	177	是狗还是人？	一、我上车前想到：“是狗还是人？”“人间何处有真人？”在车上我觉得即使是些微的怀往之情，都是肉麻的、可耻的、恶心的，此念不可衰下去。过去虽有此类念头，然而是部分的、矛盾的，自今起而成百分之百的清一色的这类念头，别的都滚蛋！
3	007.1958年12月.txt	177	人间何处有真人？	一、我上车前想到：“是狗还是人？”“人间何处有真人？”在车上我觉得即使是些微的怀往之情，都是肉麻的、可耻的、恶心的，此念不可衰下去。过去虽有此类念头，然而是部分的、矛盾的，自今起而成百分之百的清一色的这类念头，别的都滚蛋！
3	007.1958年12月.txt	199	吾弟近来时运不佳，夫妻（未来的）破裂，生病，多亏你还有勇气活下去，且活得有声有色，令人佩服。	一、华民来信：“吾弟近来时运不佳，夫妻（未来的）破裂，生病，多亏你还有勇气活下去，且活得有声有色，令人佩服。”
6	007.1958年12月.txt	259	婚礼非改造不可！	二、五时半赴鹿鸣春参加世民婚礼，世民一边做新郎一边向我抱怨：“婚礼非改造不可！”后赴其新居促狭，恶作剧为读诗、脱鞋、捶腿、梳头、抱至床上接吻、点烟、送糖、捉弄新夫妇至十时半始归。张太太是我看到的最漂亮的台湾省人。
3	007.1958年12月.txt	293	瑞典的女孩子对于性教育，似乎是若无其事，她们并没有因实行性教育变为淫乱，或者这是因为她们认为性是和接吻一样自然的事，不过，影响也就在这个地方。	正如一个观察家所说：“瑞典的女孩子对于性教育，似乎是若无其事，她们并没有因实行性教育变为淫乱，或者这是因为她们认为性是和接吻一样自然的事，不过，影响也就在这个地方。”
4	007.1958年12月.txt	327	大学为自由研究学术之地，研究之方法亦各自由。	一、吴俊才为卡片事居然称道我，可“怪”也！（敖按：这件事情的经过是这样的：一天吴俊才先生要同学缴笔记，我因为从来不记笔记，实在缴不出来。我花了几个小时，写了三十五张卡片，“敷衍”上去，我在卡片前两张极力攻击记笔记。我说：“大学为自由研究学术之地，研究之方法亦各自由。”“累牍连篇千册一律之笔记实非必要。大学生之治学方法贵乎参考众书独立治学，不当株守笔记以应考试...
3	007.1958年12月.txt	327	累牍连篇千册一律之笔记实非必要。大学生之治学方法贵乎参考众书独立治学，不当株守笔记以应考试及先生审阅也！	一、吴俊才为卡片事居然称道我，可“怪”也！（敖按：这件事情的经过是这样的：一天吴俊才先生要同学缴笔记，我因为从来不记笔记，实在缴不出来。我花了几个小时，写了三十五张卡片，“敷衍”上去，我在卡片前两张极力攻击记笔记。我说：“大学为自由研究学术之地，研究之方法亦各自由。”“累牍连篇千册一律之笔记实非必要。大学生之治学方法贵乎参考众书独立治学，不当株守笔记以应考试...
5	007.1958年12月.txt	337	原来这Boobl也是有脑筋的！	及其率五百人攻克阿可德，复坚守之于法军之猛烈炮火之中，功成返英，尽偿父债，其父笑曰：“原来这Boobl也是有脑筋的！”
6	007.1958年12月.txt	339	逮哈斯丁斯（Warren Hastings）继克莱武而始为印度总督，采激进之征服政策。	Robert Clive再返印度时，解救了加尔各答之围。向达《印度现代史》说：“逮哈斯丁斯（Warren Hastings）继克莱武而始为印度总督，采激进之征服政策。”及Robert Clive之返国也，敌党攻击其在印度贪污发财，Robert Clive愤而成疾，于1774年11月以刃割血管而死，放翁诗言“老去人间毁誉轻”，Robert Clive有余恨矣。
4	007.1958年12月.txt	339	老去人间毁誉轻	Robert Clive再返印度时，解救了加尔各答之围。向达《印度现代史》说：“逮哈斯丁斯（Warren Hastings）继克莱武而始为印度总督，采激进之征服政策。”及Robert Clive之返国也，敌党攻击其在印度贪污发财，Robert Clive愤而成疾，于1774年11月以刃割血管而死，放翁诗言“老去人间毁誉轻”，Robert Clive有余恨矣。
4	007.1958年12月.txt	379	好男人不找她，坏男人中只有李敖好。	四、夜写出给Rosa的信四页。二日来颇念Rosa，每于梦寐之间不能忘之。周弘言：“好男人不找她，坏男人中只有李敖好。”
3	007.1958年12月.txt	443	永远是轻松的！	五、“永远是轻松的！”这是人间第一修养！为今日之大收割！它包括：