score	file	line	text	reasons	context
10	004.第三部——三十年后.txt	1603	我生命的一部分	known-pattern,trigger-context,chinese-compact	也许，我根本错怪了小葇，想想古诗人元遗山，想想他那看到一片荒坟的诗句：“焉知原上塚，不有当年吾。”这无异是说，在荒坟之中，可能有一个死者就是诗人自己。也许，根本不是“我生命的一部分”已随情人消亡，正相反的，在死去的情人眼中，消亡的我，是全部。黑色大理石板下的，不是孤单的小葇自己，还有一个死掉的我，深情的、永远的，相依在她身旁。
11	004.第三部——三十年后.txt	1603	焉知原上塚，不有当年吾。	known-pattern,trigger-context,punctuated	也许，我根本错怪了小葇，想想古诗人元遗山，想想他那看到一片荒坟的诗句：“焉知原上塚，不有当年吾。”这无异是说，在荒坟之中，可能有一个死者就是诗人自己。也许，根本不是“我生命的一部分”已随情人消亡，正相反的，在死去的情人眼中，消亡的我，是全部。黑色大理石板下的，不是孤单的小葇自己，还有一个死掉的我，深情的、永远的，相依在她身旁。
12	005.我写《上山·上山·爱》.txt	33	黄色其外，红色其中	known-pattern,trigger-context,punctuated,chinese-compact	事实上，如果硬要假以颜色，《上山·上山·爱》毋宁是一部“黄色其外，红色其中”的小说。红色象征“性”的激越和“思想”的激越，它的最大特色，就在把“形而上”和“形而下”合而为一。《易经》上说“形而上者谓之道，形而下者谓之器”，自来“黄色小说”，只是形而下的器官交合而已，不足以语形而上的大道，《上山·上山·爱》却开得未曾有之奇，以奇情奇文，颠倒阴阳，笑傲《易经》，成其不朽。
10	005.我写《上山·上山·爱》.txt	33	黄色小说	known-pattern,trigger-context,chinese-compact	事实上，如果硬要假以颜色，《上山·上山·爱》毋宁是一部“黄色其外，红色其中”的小说。红色象征“性”的激越和“思想”的激越，它的最大特色，就在把“形而上”和“形而下”合而为一。《易经》上说“形而上者谓之道，形而下者谓之器”，自来“黄色小说”，只是形而下的器官交合而已，不足以语形而上的大道，《上山·上山·爱》却开得未曾有之奇，以奇情奇文，颠倒阴阳，笑傲《易经》，成其不朽。
9	005.我写《上山·上山·爱》.txt	33	思想	known-pattern,trigger-context	事实上，如果硬要假以颜色，《上山·上山·爱》毋宁是一部“黄色其外，红色其中”的小说。红色象征“性”的激越和“思想”的激越，它的最大特色，就在把“形而上”和“形而下”合而为一。《易经》上说“形而上者谓之道，形而下者谓之器”，自来“黄色小说”，只是形而下的器官交合而已，不足以语形而上的大道，《上山·上山·爱》却开得未曾有之奇，以奇情奇文，颠倒阴阳，笑傲《易经》，成其不朽。
9	005.我写《上山·上山·爱》.txt	33	形而上	known-pattern,trigger-context	事实上，如果硬要假以颜色，《上山·上山·爱》毋宁是一部“黄色其外，红色其中”的小说。红色象征“性”的激越和“思想”的激越，它的最大特色，就在把“形而上”和“形而下”合而为一。《易经》上说“形而上者谓之道，形而下者谓之器”，自来“黄色小说”，只是形而下的器官交合而已，不足以语形而上的大道，《上山·上山·爱》却开得未曾有之奇，以奇情奇文，颠倒阴阳，笑傲《易经》，成其不朽。
12	005.我写《上山·上山·爱》.txt	33	形而上者谓之道，形而下者谓之器	known-pattern,trigger-context,punctuated,chinese-compact	事实上，如果硬要假以颜色，《上山·上山·爱》毋宁是一部“黄色其外，红色其中”的小说。红色象征“性”的激越和“思想”的激越，它的最大特色，就在把“形而上”和“形而下”合而为一。《易经》上说“形而上者谓之道，形而下者谓之器”，自来“黄色小说”，只是形而下的器官交合而已，不足以语形而上的大道，《上山·上山·爱》却开得未曾有之奇，以奇情奇文，颠倒阴阳，笑傲《易经》，成其不朽。
9	005.我写《上山·上山·爱》.txt	33	形而下	known-pattern,trigger-context	事实上，如果硬要假以颜色，《上山·上山·爱》毋宁是一部“黄色其外，红色其中”的小说。红色象征“性”的激越和“思想”的激越，它的最大特色，就在把“形而上”和“形而下”合而为一。《易经》上说“形而上者谓之道，形而下者谓之器”，自来“黄色小说”，只是形而下的器官交合而已，不足以语形而上的大道，《上山·上山·爱》却开得未曾有之奇，以奇情奇文，颠倒阴阳，笑傲《易经》，成其不朽。
9	005.我写《上山·上山·爱》.txt	33	性	known-pattern,trigger-context	事实上，如果硬要假以颜色，《上山·上山·爱》毋宁是一部“黄色其外，红色其中”的小说。红色象征“性”的激越和“思想”的激越，它的最大特色，就在把“形而上”和“形而下”合而为一。《易经》上说“形而上者谓之道，形而下者谓之器”，自来“黄色小说”，只是形而下的器官交合而已，不足以语形而上的大道，《上山·上山·爱》却开得未曾有之奇，以奇情奇文，颠倒阴阳，笑傲《易经》，成其不朽。
9	005.我写《上山·上山·爱》.txt	35	强虏	known-pattern,trigger-context	藏传佛教有“尸陀林主”（Masters of Sitavana），画面是男女骷髅，风月交叉，虽朽为枯骨，但仍能灭敌饮血，以显神通。若论真的“尸陀林主”，非此书莫属。《上山·上山·爱》是真正灭敌饮血的文学，“谈笑间，强虏灰飞烟灭。”“强虏”是谁，读者一看便知。本书虽为情爱秘籍、男女圣经，但是功夫深处，却是“思想挂帅”的智者、强者文学，不想再看娘娘腔文学作品的读者，何妨一读此书，大开眼界也。
10	005.我写《上山·上山·爱》.txt	35	尸陀林主	known-pattern,trigger-context,chinese-compact	藏传佛教有“尸陀林主”（Masters of Sitavana），画面是男女骷髅，风月交叉，虽朽为枯骨，但仍能灭敌饮血，以显神通。若论真的“尸陀林主”，非此书莫属。《上山·上山·爱》是真正灭敌饮血的文学，“谈笑间，强虏灰飞烟灭。”“强虏”是谁，读者一看便知。本书虽为情爱秘籍、男女圣经，但是功夫深处，却是“思想挂帅”的智者、强者文学，不想再看娘娘腔文学作品的读者，何妨一读此书，大开眼界也。
10	005.我写《上山·上山·爱》.txt	35	尸陀林主	known-pattern,trigger-context,chinese-compact	藏传佛教有“尸陀林主”（Masters of Sitavana），画面是男女骷髅，风月交叉，虽朽为枯骨，但仍能灭敌饮血，以显神通。若论真的“尸陀林主”，非此书莫属。《上山·上山·爱》是真正灭敌饮血的文学，“谈笑间，强虏灰飞烟灭。”“强虏”是谁，读者一看便知。本书虽为情爱秘籍、男女圣经，但是功夫深处，却是“思想挂帅”的智者、强者文学，不想再看娘娘腔文学作品的读者，何妨一读此书，大开眼界也。
10	005.我写《上山·上山·爱》.txt	35	思想挂帅	known-pattern,trigger-context,chinese-compact	藏传佛教有“尸陀林主”（Masters of Sitavana），画面是男女骷髅，风月交叉，虽朽为枯骨，但仍能灭敌饮血，以显神通。若论真的“尸陀林主”，非此书莫属。《上山·上山·爱》是真正灭敌饮血的文学，“谈笑间，强虏灰飞烟灭。”“强虏”是谁，读者一看便知。本书虽为情爱秘籍、男女圣经，但是功夫深处，却是“思想挂帅”的智者、强者文学，不想再看娘娘腔文学作品的读者，何妨一读此书，大开眼界也。
11	005.我写《上山·上山·爱》.txt	35	谈笑间，强虏灰飞烟灭。	known-pattern,trigger-context,punctuated	藏传佛教有“尸陀林主”（Masters of Sitavana），画面是男女骷髅，风月交叉，虽朽为枯骨，但仍能灭敌饮血，以显神通。若论真的“尸陀林主”，非此书莫属。《上山·上山·爱》是真正灭敌饮血的文学，“谈笑间，强虏灰飞烟灭。”“强虏”是谁，读者一看便知。本书虽为情爱秘籍、男女圣经，但是功夫深处，却是“思想挂帅”的智者、强者文学，不想再看娘娘腔文学作品的读者，何妨一读此书，大开眼界也。
