file	line	context
154.妖僧林云的同班.txt	3	妖僧林云同班有臧英年，在台中一中时，高我四班。今年八十三，虽老相毕露，但健康无比。我屈居八十，年龄后人，健康绝不后人。两人一见面就开玩笑：“总有一天，到你坟上去小便。”前一阵子，他的同班林云死了，林云在台中一中时还好好一个人，尚非妖僧。做妖僧后，可恶无比。真该到他坟上先来两泡尿啦！谈到林云，我要再啰唆一次：自来做神棍的，总得有点基本条件，长相就是其中之一。做...
158.一中的外省籍同学.txt	3	在台中一中外省籍同学中，高我二班今为世界级学者的李天培，是温柔敦厚的君子，与我通信最多，至今保存完整。他和弟弟李善培两人，随父亲李子宽老居士到台湾。老居士是老革命党，做过孙中山秘书，被蒋介石关过后归顺蒋介石，垂老主持中国佛教会，住在善导寺。我到台北念台大，一开始就借住善导寺。高我三班的张世民，是我参加演讲比赛认识的，我代表初中，他代表高中，后来变成好朋友。他...
159.我中学没毕业.txt	3	我在一九四九年暑假后进了台中一中，从初二念起一直念到高二，这四年间，我陆续读了许多课外书，由于年复一年在知识上“独与天地精神往来”，基本上，学校和同学是不能满足我的“境界”的，在内心深处，我与人颇为疏离，我有一种“知识上的傲慢”（intellectual arrogance），不大看得起人，尤其讨厌制式的学校生活。自愿休学在家后，最后以同等学力考上大学。所以...
160.没有乡愁.txt	3	我在台湾，本是时代与地方的交错，既然阴错阳差的浮海而至，也就随缘入化的凌云而活。对大陆，我并没有乡愁；对台湾，我也不曾寄旅。台湾只是我的工作所在，它是我的战场，“破碎的战场”，我对它非常习惯，习惯而遥远。遥远既是空间的，也是时间的。正因为有那种时空上的遥远，我素来讨厌中国人轻易乡愁的情绪，我早就说乡愁观念的基本成因，一个是农业社会的安土重迁；一个是古代交通的...
162.遇到严侨.txt	5	一九五一年到了，我十六岁。暑假后进了高一上甲。正好严侨教数学，这样他就正式成了我班上的老师。这时我在知识成长已经极为快速，在班上喜放厥辞，好争好辩，颇为张狂。当时班上同学很吃我不消，王文振甚至写匿名信丢在我书包里痛骂我；施启扬喜欢同我辩，但他实在很笨，又做少年老成状，令我总要用口舌修理他。由于我张狂好辩，在严侨课堂上，也就常常在数学以外，扯到别处去。严侨上课...
164.严侨偷渡来台.txt	3	在多次跟严侨的夜谈中，我约略知道了他的一些情况。他来台湾比较晚，并且是从福建偷渡上岸的，当时还带着严师母。他坐的船是最小的木船，他说船上只有埋在沙上的一个罗盘，扬帆过海，就过来了，言下不胜得意。到台湾后，他被发现，国特把他请去，问他你来台湾干什么？他说我来投奔自由；国特说你胡扯，你的爸爸在福州做共产党的市长，他那么前进，你怎么这么落伍？一般情形总是老一代跟国...
166.人人自危的白色恐怖.txt	3	当时的台中一中，像其他学校一样，不时有所谓共产党、匪谍被捕去。最令我心动的是当时女老师牟琴和她男友杨肇南老师的双双被捕。他们都是山东人，牟琴年轻艳丽，身材尤其肉感动人，令我们暗慕。一天夜里，他们都被捕去了，听说都是共产党、匪谍（多少年后，仿佛听说牟琴给放出来了，可是已被折磨得年华销尽了）；还有一位教数学的杨肖震老师（福建政和人，24岁），也被捕去（后来听说太...
168.我结识了钱穆.txt	3	共产党批判逃离他们统治的学者，共分两个型，一个是“胡适型”，一个是“钱穆型”。我对他们两位，都分别加以注意。但胡适远在美国，钱穆却因阴错阳差到了台湾台中，使我先结识了他。结识的原因，得力于同学徐武军。徐武军外号“日本和尚”，因为他爸爸是日本留学的，故有这一称呼。徐武军在台中一中，有点特权似的，原因是他忽来忽去、去了又来。后来才知道，原来他爸爸是徐复观，先举家...
170.钱穆给我的信.txt	5	昨奉来书，知君努力学问，与日俱进，若能持之有恒，继续不懈，将来必有成就，可喜可贺。学问之事，首贵有恒心，其次则防骄气，小有所成，志得意满，中道而止，虽有聪秀之质，犯此二病，终不能有远到之望，唯立志高远，始克免此。君尚在青年，向学伊始，故特以此相勉。能熟诵《庄》书，亦一佳事，然《论》《孟》尤为重要，须时时玩索，心体力行。盼先就《朱子集注》细细研读，勿以能读过为...
170.钱穆给我的信.txt	10	钱穆的信，用钢笔写得工工整整，足见此公主敬修养的一面。信中对一个18岁的青年人如此鼓励，固因我的好学引起他的注意，也实可看出他具有教育家的风度。信中说他要“按期邮寄”他在“某杂志”的《论语新解》连载，他言而有信，果然按期寄来（“某杂志”是香港《人生》杂志），使我对他益发感念。按说以钱穆对我的赏识，以我对他的感念，一般的读书人，很容易就会朝“变成钱穆的徒弟”路...
171.心里一直感念他.txt	3	与钱穆通讯后第三年（1955），我进了台大历史系。台大历史系是“胡适型”的地盘，对“钱穆型”是隐含排挤的。在胡适有生之年，钱穆未能成为中央研究院院士，我始终认为对钱穆不公道。钱穆的杂七杂八的理学怪说固不足论，但他在古典方面的朴学成就，却更该先入选成院士。
171.心里一直感念他.txt	11	回想我与钱穆的一段因缘，我的确完成了“一朝眉羽成，钻破亦在我”的阶段，可惜的是，钱穆本人，却越老越“自缠”得紧了。如今他过93岁生日，五代弟子，冠盖云集，人人称庆，我却别有志哀，——我为钱穆惜，他有做成真正“一代儒宗”的机会，可是他却做成个假的。历史上，真正“一代儒宗”是不会倒在统治者的怀里的！
173.吾爱真理甚于吾师.txt	3	王作荣跟李登辉火热时，曾流传一则笑话，保险公司对王作荣有三不保：“天灾不保、人祸不保、晚节不保。”但他后来迷途知返，跟李登辉搞翻了，追随我对李登辉口诛笔伐了。一九八八年七月六日《商业周刊》登，王作荣桃李满天下，可是他曾对家人说：“李敖是我眼中唯一的天才。”但他对我的直言，心存耿耿。他有一本书，叫《我志未酬》，我奇怪，身为监察院长高官，还不弹劾李登辉，还有何怨...
175.我勇于丧礼改革.txt	5	爸爸当时是台湾省立台中一中的国文科主任，因为在这个学校教了近六年的书，又在校外教补习，教过谭洁力等几十人，所以“桃李无算”。他是一个好教师，公祭时候，场面很大，自台中市市长、市议会议长以下，有两千人。这两千人，不但当时目击了李鼎彝先生走向了火葬，同时还目击李鼎彝先生的宝贝儿子李敖，表演了一次犯众怒的丧礼改革！那时我受了胡适的影响，坚持改革丧礼，按照传统，要烧...
178.重温旧梦就是破坏旧梦.txt	3	“重温旧梦就是破坏旧梦”，这是我的名言，我当然深信不疑。陆啸钊在一别半世纪后重返浙江，电约五十年前的青梅竹马老情人在当年相聚的青青河畔一晤，他先到达，远远的看到一龙钟老妇，满面风霜。彳亍而来，不是别人，来的正是秋水伊人也！陆啸钊回来告诉我，他当时的第一个反应就是拔腿想逃！我笑说：“你真自找苦吃，旧梦是那么好重温的！看来罗曼蒂克，其实胃口倒光，尤其是老情人，只...
179.国文差点不及格.txt	3	我是一九五五年二十岁进台大历史系一年级的。表面上如愿以偿，很快就大失所望。我看不起别人、不喜欢上课，连考试都懒得应付。大一时八门课，有三门不及格，甚至连国文都差点不及格。原来国文是国民党文人叶庆炳教的，第一次缴作文，虽在班上公开夸奖李敖的作文全班第一，可是我一直讨厌他，认为他没有学问却装腔作势，后来因为拒绝背书，叶庆炳声言给我不及格。他的老师——中文系的郑骞...
181.姚从吾.txt	3	胡适给我报告严侨的信，由姚从吾代转，乃因他们是师生关系，而姚从吾正好跟我也是师生关系。一九五八年，胡适来台，主动安排我和胡适见面的，就是姚从吾。历史系老师虽多，但跟我关系最深的，不是别的老师，而是他。姚从吾做过北大历史系主任。他拙于口才，讲话时先是张开奇厚的嘴唇，下颚乱动，满口乱牙翻滚，然后发音，我心想物理学上光比声快，此之谓也。他的声音中气十足，道地的河南...
181.姚从吾.txt	9	姚从吾老师待子甚严，他的儿子姚大湘，在台大地质系念书，在校园远远的看到老子走来，必绕道而过。四十年后，我在东吴大学教书时，姚大湘还来听过两堂课，送我一本《姚从吾先生纪念集》。纪念集中有合照，因我坐牢，不敢指出李敖的名字，别人人人有名有姓，只有我成了无名氏。白色恐怖下，学术界胆量如此！
182.我的毕业论文.txt	3	姚从吾跟我很有交情，他是我论文指导老师，也是胡适给我秘信的转信人，又找我做他的助理人员。我的毕业论文《夫妻同体主义下的宋代婚姻的无效撤销解消及其效力与手续》，姚从吾对这题目全无研究。他只能给我改一处笔误而已。我在论文第二章第四节“外姻而尊卑为婚”内，徽宗“政和八年”条下原注说：“政和只七年，洪迈此乃重和元年之误，是年为1118年。”姚从吾看了，加注说：“政和...
185.我就上了“贼船”.txt	3	给姚从吾做助理，除我以外，还有陶老三，就是陶晋生。陶晋生是陶希圣的儿子，在历史系比我高三班，他老子过去在北大教书，又是北大毕业生，和姚从吾有交情。姚从吾见我生计困难，认为陶希圣欠他的情，颇想把我介绍到陶希圣主持的“中华民国开国五十年文献编纂委员会”，暂时糊口。他把这意思告诉吴相湘，吴相湘极为赞成。因为他一直想拉我搞近代现代史，由于姚从吾是他的老师，挡在中间拉...
186.文献会.txt	5	1962年2月1日，我去文献会见陶希圣的时候，正是我在《文星》第52期发表《给谈中西文化的人看看病》的同一天。这篇文章里已点名攻击到陶希圣。在这篇文章发表前一个月，我在《文星》第51期发表《播种者胡适》，已先引起各界的重视，这种重视，是从《文星》第49期起发表《老年人和棒子》的一贯延续。姚从吾老师信中嘱咐我“若过于放肆，不但树敌太多，亦恐于工作有妨”；吴相湘...
189.历史系众师相.txt	13	另一教西洋史教授，叫杨绍震，学问极差，却又喜装腔作势、做洋绅士状。上他《西洋通史》课时，我常用假史料作弄他，他佯作知道，其实一无所知、也不可能有所知，因为从来没有那种史料。后来此人到东海大学去了，为了多赚一点钱，曾向校方哭诉，请求多发他津贴云，传为笑柄。
189.历史系众师相.txt	15	教《中国近代史》的李定一，我没选过他的课，他是书呆子，上课时说他一生只知道一位电影明星，名字叫做“玛丽‘梦莲’露”（Marilyn Monroe，译名应为“玛丽莲·梦露”）！其实这种有趣的孤陋寡闻也不止李定一，胡适亦然。胡适知道远在天边千万人所不知的神会和尚，却不知道近在眼前千万人皆知的大明星玛丽莲·梦露，引得人们大笑。
190.徐子明与沈刚伯.txt	3	历史系有一极顽固老教授，叫徐子明，痛恨胡适。他演讲时到处说：“我当年亲眼看见胡适一手把毛匪泽东提拔起来！”说时还用右手拇指食指交接，手心向下，手背向上一提，做提拔状。因为痛恨胡适，连带痛恨白话文，他说白话文是狗叫文。姚从吾问他：“既然白话文是狗叫文，你为什么口中讲白话？”他忿然答曰：“我跟狗说话，不能不狗叫！”
190.徐子明与沈刚伯.txt	5	当时胡适系的学阀们整他，把他开的选修课，故意排在其他必修课同一时间，以达到没学生选他的课的效果，让他自行了断。可是汪荣祖一个人跑去选了他的课，他虽只教一个学生，但夷然自得，气派不衰。他骂人，把“他妈的”发音成“塔马滴”，口音使然也。死前躺在病床，不想再活，乃自行拔管，大呼“吾去矣！”而亡。
201.帮孟大中伪造文书.txt	3	我一身傲骨、自命不凡，但在待人接物上，却从无满脸骄气，不但休休有容，并且乐于与人为善。我有个好朋友，物理系的孟大中。孟大中的父母早在印度离婚，离婚后他和弟弟都随父亲到台湾读书，母亲仍在印度。有一次聊天，我足智多谋，提到：如果离婚时，离婚证书上兄弟跟了母亲，那么兄弟两人即可视同侨生，不必当国民党的鬼兵了。孟大中听了，为之心动，希望我帮他假造一张离婚证书，我说可...
203.五十年是什么？.txt	11	不畏浮云遮望眼
203.五十年是什么？.txt	17	原来是胡适写给他的族弟的，原来他们都是绩溪胡家。这一家族，他们分别流亡到台湾岛上，但是，岛孤人不孤，在他乡，他们又重聚了。
203.五十年是什么？.txt	19	胡适写给“汉文弟”的，本来是王安石《登飞来峰》诗中的最后两句，全诗是——
203.五十年是什么？.txt	25	不畏浮云遮望眼，
203.五十年是什么？.txt	29	全诗把王安石因寄所托的伤心，挥洒无余。胡适以“胡笔徽墨”出之，也别具怀抱。我每事流连，允称眼福，仰止之情，不可掩也。
203.五十年是什么？.txt	31	五十年过去了。胡适早已墓草久宿；“胡开文”也被银行拍卖，倒店异乡；胡汉文退而卖水果、卖台湾玉以死，一代文物，俱成云烟。偶过重庆南路，浑忘当年曾有笔墨之庄于斯，既茫然无人指点旧迹，复惘然前尘不可复识，以浑忘出之，正所以结之也。
203.五十年是什么？.txt	33	二〇〇六年九月十八日办公室传来，有称胡适为大伯者，持文物求知于我。我笑说胡适在家为老幺，何来大伯之称？此公可疑，要查问清楚才好。隔天得知，说此公胡姓，自称持有胡适给他父亲的条幅与对联云云。我闻而好奇，乃电话此公，他自道胡适是他族伯，他家曾开笔墨庄。我问你老太爷是否“胡汉文”，他说正是，他奇怪我说得出他父亲名字。我说更奇怪的是我可以说出你手上收藏品的内容，当下...
203.五十年是什么？.txt	39	现已夜深，胡适墨迹下的王安石，安睡在我家的“最高层”里，“浮云”都不见了。五十年过去了，五十年是什么？五十年不是什么，它只是子夜中的无声欣喜、长夜里的一声叹息。
204.我与《自由中国》.txt	3	我做中学生时候，就对中国的思想家胡适有过很深的研究，我写过一篇《关于<胡适文存>》，陈世熙那时正在台大法学院办《这一代》，他看中了这篇文章，愿以胡适给他们杂志的题字——“为者常成，行者常至”来换，我同意了。不料台大训导当局在审稿时认为有问题，不准登，陈世熙就还了给我。过了两年，我已是大学生了，陆啸钊办《大学杂志》，他不在乎，遂拉去登。刊出后近一年，“罗”忽然...
204.我与《自由中国》.txt	5	一九五七年三月一日的《自由中国》第十六卷第五期上，登出这篇文章，改名《从读<胡适文存>说起》，雷震立刻写信给在美国的胡适，特别推荐这位对胡适有独到研究的专家，这是胡适后来告诉我的。这是我跟《自由中国》结缘之始。
205.《自由中国》十年.txt	3	回想《自由中国》杂志驰骋十年的特色，正在它单纯的讲了真话，它的主轴是提倡自由民主，千言万语在“与朝廷争胜”（这是当年苏东坡的“毛病”），真了不起。但我常常想，当《自由中国》被封杀后，影响一时的掌声歇后，平心而论，究竟这个杂志影响了谁？除了我李敖能够延续这一“与朝廷争胜”的风骨与干法外，它又影响了谁？我找来找去，实在找不出一个响当当的名字。其杂志存则义举，其杂...
207.打破了别人的梦.txt	3	有一次，雷震愤愤不平的向胡适说：“胡先生啊，我们《自由中国》讲了真话，我们指出‘反攻大陆’是不可能的事，为什么我们讲了真话，反倒被围剿？这公道吗？”胡适答道：“问题不在你们说了真话，问题在你们打破了别人的梦，打破了千千万万人共同的一个梦，即使那是个迷梦。你们打破了别人的梦，别人自然就恨你们了。”
207.打破了别人的梦.txt	5	这一对话很有醒世的作用。原来人间的问题有时不是你讲了真话那么单纯。雷震太单纯了、胡适太世故了。
208.所谓“中华台湾民主国”.txt	1	所谓“中华台湾民主国”
208.所谓“中华台湾民主国”.txt	3	又令人遗憾又莫名其妙的是，雷震在联合国赶出蒋政权后，居然在一九七二年一月提出所谓《救亡图存献议》，开宗明义宣称要改“中华民国”国号，从速宣布成立“中华台湾民主国”！“以求自保自全，并安抚台湾人，开创一个新局面”！他的怪论，一来显示出他的爱国，竟不过是爱小朝廷以求自保；另一方面，他虽非台独，却无异台独。难怪海外台独如获至宝，《台湾青年》第一七二号、《台独》第三...
209.选择了胡适.txt	1	选择了胡适
209.选择了胡适.txt	3	一九四九年我到台湾，最强烈的感觉是孤单与封闭，国民党疯狂杜绝了资讯，并用疯狂而严厉的手法，查禁了书刊。我没有任何导师、任何朋友，可以讨论。我从上海带来的一些书中，有《开明少年》等左派刊物，同学朱广诚借去看，立刻被他大哥下令还我，并转告我不要借这种书给他弟弟看。我完全落单了。左派思想断了线，难乎为继了。这时美国宣传品进来了。由美国新闻处大量而廉价输入了美国。国...
210.综论胡殷.txt	3	我在台大时，所佩服的在台湾的前辈人物，只是胡适、殷海光而已。我后来的发展，和他们比较起来，可这样说：胡适得其皮，殷海光得其肉，真正皮肉相连的，是硕果仅存的李敖。李敖的际遇比胡适、殷海光坏得多：第一，胡适、殷海光出道时，整个原野是大陆，李敖只剩下台湾；第二，胡适、殷海光有正当职业，并且是大学教授，李敖却一直被封杀；第三，胡适、殷海光赶上知识分子被尊敬的最后一代...
210.综论胡殷.txt	5	PLAYBOY：在思想上，你自承深受胡适和殷海光的影响，究竟影响在哪方面，是否对自由主义的坚持？
210.综论胡殷.txt	17	任何思想家都有胸襟希望后一代超过他们，龚定盦说“别有狂言谢时望”，我想，我这最后的狂言，就是我对他们最大的敬礼了。
211.足道与不足道.txt	3	扼要的说胡适在台，两事足道：一、为《自由中国》撑腰；二、表示反对蒋连任。殷海光在台，一事足道：在《自由中国》写文章。其他知识分子，就反极权而言，皆不足道。中国古话说唯“上智”与“下愚”最难移，意思是最聪明的与最笨的你最难改变他。知识分子在一般的印象中接近“上智”，但是这个岛的知识分子却无法这样接近，他们实际是知识上的“下愚”：他们除了跟着国民党一块儿呼吸外，...
213.孙玉华为我照裸照.txt	5	虽在军队，我仍展示出我又守原则、又粗犷、又狡猾的一面，我曾声言：“大丈夫要能软能硬、软中带硬、软硬兼施、能屈能伸、粗中有细，方能在军中混。而这种特质，正好就是鸡巴的特质。”为了加深这一特质，并为了展示入伍训练带给我的好身体，以及我对人袒裎相见的祢衡式坦白，洗澡时，我特别让孙玉华为我照了一张全身正面裸照。我还特别题诗一首，诗云：
221.两天走了九十二里.txt	3	到了第四连后十三天，就开始了移驻大行军，从高雄县仁武乡走到台南县新化那拔林。从五月十六日到十七日，两天走了九十二里。我一辈子也没快速走过这么远的路，要不是做了预备军官，哪能有如此磨练啊！走到第二天，看到有新兵边走边哭，因为几乎走得人无完脚，都生了泡。我只是皮鞋太不便，幸未生泡。我用尽了一切方法来支撑下去，唱歌、哼诗、拿出小册边走边读英文……老兵们还是有办法，...
223.“军中乐园”四万字.txt	3	三月七日我写下我第一次参观“军中乐园”的情况：参观“仁武特约茶室”，即所谓“军中乐园”者，排长所谓的“动物园”。外面弹子房，照片与号码，规则须知，喧哗，空气极劣，红灯，一半裸倚门无表情，一与兵谈，一搂兵，室中花床单，化妆台，乳罩相见，大腿外露，四十分钟（因为营妓连番接客，每次四十分钟，所以无暇穿衣服，每次完毕，出来打水时，只穿乳罩与内裤。）。炮术语：“空炸、...
227.见到真正台湾人.txt	3	十一月二十三日，我参加过“襄阳演习”，最大规模的演习。有机会接近屏东三地门的高山族。我在日记写道：“午后突来电话，立即撤往振兴，在日光与尘土的昏黄里，静默的过了这一程。在振兴沟中洗脚，沼中大便，未及晚饭，忽有特殊情况，竟得驰赴三地门，路甚直，二又二分之一飞驰，群山在望，右面丛山下层成一形，甚直长，抵堤边后即入市区，——所谓市区者，一条土街耳！见到很多高山族，...
231.红玫瑰.txt	29	但是梦幻压迫我，它逼我飘到六合以外的幻境，在那里，走来了她的幽灵，于是我们生活在一起，我们同看日出、看月华、看眨眼的繁星、看苍茫的云海；我们同听鸟语、听虫鸣、听晚风的呼啸、听阿瑞尔（Ariel）的歌声，我们在生死线外如醉如酲；在万花丛里长眠不醒，大千世界里再也没有别人，只有她和我；在她我眼中再也没有别人，只有玫瑰花。当里程碑像荒冢一般的林立，死亡的驿站终于出...
238.“四席小屋”.txt	5	一九六一年二月六日早上，我结束军队生涯，自澎湖搭军舰回高雄，旋即抵台中。15日北上，暂住温州街73号台大第一宿舍第四室，决心要找一间小屋，做为一个人能够清静的所在。这么多年来，我从没机会一个人有一间房，此番北上，一定要达成这一心愿。两天后，我租到新生南路3段60巷1号的陋巷小屋，只四个榻榻米大，矮得双手不能向上举，我订名为“四席小屋”。隔壁住着李善培，我们合...
240.逃难学.txt	3	“四席小屋”在台北陋巷里，对面住着陶泓，比我大几岁，是逃难来的。一天，施珂大哥同陶泓聊天，施珂说：“我过去逃难逃久了，全部家当一背就走。所以今天养成习惯：我的全部财产，只要一背就走那么多。”陶泓说：“这有什么稀奇！我的全部财产，只要一提就走那么多，我比你的习惯还要好！”我在旁边听了，忍不住苦笑，真的，一提就走的速度，的确高于一背就走；一提就走的重量，的确低于...
242.“碧潭山楼”.txt	3	所谓“碧潭山楼”，其实很简陋，不但通过陋巷，且要通过臭菜场与臭河沟，房子只是一间五个榻榻米大的小房，不过是钢骨水泥的，绝无鼠辈在头上奔驰，可谓一快。还有一个好处，就是有浴缸可和二房东陶苏保一家分用。我独自一人徜徉山水之间，或入夜泛舟碧潭，或看廉价电影一场，极得孤寂之乐。我在房门外挂的牌子是：
242.“碧潭山楼”.txt	9	一个丰富的工作天，写出信四，卡片寄给胡（胡适），看《武士妖后》，钉架子，改了一百本作文，晚接客，景（景新汉）鼓（陈鼓应）吴大中（原注：九年未见了！）少杰（张少杰）四人，十一时始归我所有，六小时写五千字。
243.胡适送我一千元.txt	1	胡适送我一千元
