score	file	line	text	context
3	086.读它一下“国父遗教”.txt	11	民主之国有政党，则能保持民权自由。……若无政党，则民权不能发达，不能维持国家，亦不能谋人民之幸福；民受其毒，国受其害。是故无政党之国，国家有腐败、民权有失败之患。	一、“民主之国有政党，则能保持民权自由。……若无政党，则民权不能发达，不能维持国家，亦不能谋人民之幸福；民受其毒，国受其害。是故无政党之国，国家有腐败、民权有失败之患。”
3	086.读它一下“国父遗教”.txt	13	今中华民国实行民权主义，可以巩固于千年万年，可保一致而不乱者，此亦靠乎政党。人民苟有见地，则由政党发表其意见于政府；政府不行，可以推倒之。	二、“今中华民国实行民权主义，可以巩固于千年万年，可保一致而不乱者，此亦靠乎政党。人民苟有见地，则由政党发表其意见于政府；政府不行，可以推倒之。”
7	086.读它一下“国父遗教”.txt	17	或曰党争为国之不祥事，此谬论也。盖党争为文明之争，能代流血之争也。	四、“或曰党争为国之不祥事，此谬论也。盖党争为文明之争，能代流血之争也。”
6	086.读它一下“国父遗教”.txt	21	将革命事业从头做起	孙中山这些话，都是政治常识。可是国民党自己，却“知易行难”于这些常识，它为了怕“争”，所以根本不允许有健康的反对“党”。而它答应的所谓组党自由，辛亥革命前答应的，不算了；一九一二年答应的，不算了；一九一三年答应的，不算了；一九二九年答应的，不算了；一九四七年答应的，不算了。中国人民眼巴巴的等了七八十年、等了五六十年、等了三四十年，等的结果竟永远是“非常时期”...
4	086.读它一下“国父遗教”.txt	21	国情不同	孙中山这些话，都是政治常识。可是国民党自己，却“知易行难”于这些常识，它为了怕“争”，所以根本不允许有健康的反对“党”。而它答应的所谓组党自由，辛亥革命前答应的，不算了；一九一二年答应的，不算了；一九一三年答应的，不算了；一九二九年答应的，不算了；一九四七年答应的，不算了。中国人民眼巴巴的等了七八十年、等了五六十年、等了三四十年，等的结果竟永远是“非常时期”...
4	086.读它一下“国父遗教”.txt	21	流血乃代政党之争	孙中山这些话，都是政治常识。可是国民党自己，却“知易行难”于这些常识，它为了怕“争”，所以根本不允许有健康的反对“党”。而它答应的所谓组党自由，辛亥革命前答应的，不算了；一九一二年答应的，不算了；一九一三年答应的，不算了；一九二九年答应的，不算了；一九四七年答应的，不算了。中国人民眼巴巴的等了七八十年、等了五六十年、等了三四十年，等的结果竟永远是“非常时期”...
3	086.读它一下“国父遗教”.txt	21	知易行难	孙中山这些话，都是政治常识。可是国民党自己，却“知易行难”于这些常识，它为了怕“争”，所以根本不允许有健康的反对“党”。而它答应的所谓组党自由，辛亥革命前答应的，不算了；一九一二年答应的，不算了；一九一三年答应的，不算了；一九二九年答应的，不算了；一九四七年答应的，不算了。中国人民眼巴巴的等了七八十年、等了五六十年、等了三四十年，等的结果竟永远是“非常时期”...
3	086.读它一下“国父遗教”.txt	21	非常时期	孙中山这些话，都是政治常识。可是国民党自己，却“知易行难”于这些常识，它为了怕“争”，所以根本不允许有健康的反对“党”。而它答应的所谓组党自由，辛亥革命前答应的，不算了；一九一二年答应的，不算了；一九一三年答应的，不算了；一九二九年答应的，不算了；一九四七年答应的，不算了。中国人民眼巴巴的等了七八十年、等了五六十年、等了三四十年，等的结果竟永远是“非常时期”...
3	086.读它一下“国父遗教”.txt	21	大敌当前	孙中山这些话，都是政治常识。可是国民党自己，却“知易行难”于这些常识，它为了怕“争”，所以根本不允许有健康的反对“党”。而它答应的所谓组党自由，辛亥革命前答应的，不算了；一九一二年答应的，不算了；一九一三年答应的，不算了；一九二九年答应的，不算了；一九四七年答应的，不算了。中国人民眼巴巴的等了七八十年、等了五六十年、等了三四十年，等的结果竟永远是“非常时期”...
3	086.读它一下“国父遗教”.txt	21	环境特殊	孙中山这些话，都是政治常识。可是国民党自己，却“知易行难”于这些常识，它为了怕“争”，所以根本不允许有健康的反对“党”。而它答应的所谓组党自由，辛亥革命前答应的，不算了；一九一二年答应的，不算了；一九一三年答应的，不算了；一九二九年答应的，不算了；一九四七年答应的，不算了。中国人民眼巴巴的等了七八十年、等了五六十年、等了三四十年，等的结果竟永远是“非常时期”...
4	087.黑牢忆趣.txt	7	李先生，这不是我们折磨你，是你自己的右手在使你的左手痛苦，所以不能恨我们。	二、我被刑求的项目中，有一项拶指。他们把三支原子笔夹在我左手四根手指中间，再强行用我的右手紧握四根手指。并对我说：“李先生，这不是我们折磨你，是你自己的右手在使你的左手痛苦，所以不能恨我们。”我笑笑，说：“我不恨你们，也不恨我的右手，我只恨原子笔。”
4	087.黑牢忆趣.txt	7	我不恨你们，也不恨我的右手，我只恨原子笔。	二、我被刑求的项目中，有一项拶指。他们把三支原子笔夹在我左手四根手指中间，再强行用我的右手紧握四根手指。并对我说：“李先生，这不是我们折磨你，是你自己的右手在使你的左手痛苦，所以不能恨我们。”我笑笑，说：“我不恨你们，也不恨我的右手，我只恨原子笔。”
4	087.黑牢忆趣.txt	9	没关系、没关系，英国国王乔治第一根本不会说英文呢，他是从欧洲大陆过去的，不会英文都能做英国皇帝，我李敖不会说台湾话却做上台独大员，又算什么啊！	三、我在警备总部荣膺五委员后，情治人员发现，我这台独大员，根本不会说台湾话，甚至“听莫”（听不懂）台湾话，如今成了“台独先烈”，未免滑稽。我跟他们开玩笑说：“没关系、没关系，英国国王乔治第一根本不会说英文呢，他是从欧洲大陆过去的，不会英文都能做英国皇帝，我李敖不会说台湾话却做上台独大员，又算什么啊！”
4	087.黑牢忆趣.txt	11	我是神仙、老虎、狗。	四、保安处看守所所长罗永黎上尉留小平头、两眼炯炯，令人生畏，可是跟我熟了，发现他人满好。有一次，他感慨地说：“我是神仙、老虎、狗。”我问他为什么？他说：“我一看到老婆，就是神仙；我一看到囚犯，就是老虎；我一看到长官，就是狗。”我听了哈哈大笑。他补充说：他真觉得他干了这么多年，其实只是国民党的一条狗！但他毕竟是假狗，看到真狗会害怕。国民党抓雷震那一天，他被派去...
4	087.黑牢忆趣.txt	11	我一看到老婆，就是神仙；我一看到囚犯，就是老虎；我一看到长官，就是狗。	四、保安处看守所所长罗永黎上尉留小平头、两眼炯炯，令人生畏，可是跟我熟了，发现他人满好。有一次，他感慨地说：“我是神仙、老虎、狗。”我问他为什么？他说：“我一看到老婆，就是神仙；我一看到囚犯，就是老虎；我一看到长官，就是狗。”我听了哈哈大笑。他补充说：他真觉得他干了这么多年，其实只是国民党的一条狗！但他毕竟是假狗，看到真狗会害怕。国民党抓雷震那一天，他被派去...
8	087.黑牢忆趣.txt	13	我给国民党做走狗做了这么多年，就是这种下场啊！	五、一九七二年间，我自保安处看守所移军法处看守所，住在第二房。第二房正对面是第十房，关的是调查局“匪谍”处长范子文。此公英国留学，相貌堂堂，气焰很大，被调查局局长——不懂ABC的沈之岳整，诬以“匪谍”之名，关了起来，不但把他关起来，连他的太太满素玉也关起来，太太就住楼上。范子文被关，自认不得活命，他的姐姐来看他，他双手抓住铁栏，大叫道：“我给国民党做走狗做了...
8	087.黑牢忆趣.txt	13	这不是杀生，这是打沈之岳！这是打沈之岳！	五、一九七二年间，我自保安处看守所移军法处看守所，住在第二房。第二房正对面是第十房，关的是调查局“匪谍”处长范子文。此公英国留学，相貌堂堂，气焰很大，被调查局局长——不懂ABC的沈之岳整，诬以“匪谍”之名，关了起来，不但把他关起来，连他的太太满素玉也关起来，太太就住楼上。范子文被关，自认不得活命，他的姐姐来看他，他双手抓住铁栏，大叫道：“我给国民党做走狗做了...
6	087.黑牢忆趣.txt	13	报应！报应！	五、一九七二年间，我自保安处看守所移军法处看守所，住在第二房。第二房正对面是第十房，关的是调查局“匪谍”处长范子文。此公英国留学，相貌堂堂，气焰很大，被调查局局长——不懂ABC的沈之岳整，诬以“匪谍”之名，关了起来，不但把他关起来，连他的太太满素玉也关起来，太太就住楼上。范子文被关，自认不得活命，他的姐姐来看他，他双手抓住铁栏，大叫道：“我给国民党做走狗做了...
6	087.黑牢忆趣.txt	13	有一和尚发愿，以身血斋蚊，少晚蚊虫甚多，痒痛难忍，用手左右乱打。旁人问说：‘老师既然斋蚊，因何又打他？’僧曰：‘他吃过又来吃，我所以打他。’	五、一九七二年间，我自保安处看守所移军法处看守所，住在第二房。第二房正对面是第十房，关的是调查局“匪谍”处长范子文。此公英国留学，相貌堂堂，气焰很大，被调查局局长——不懂ABC的沈之岳整，诬以“匪谍”之名，关了起来，不但把他关起来，连他的太太满素玉也关起来，太太就住楼上。范子文被关，自认不得活命，他的姐姐来看他，他双手抓住铁栏，大叫道：“我给国民党做走狗做了...
5	087.黑牢忆趣.txt	15	到底小林怎么带信出去的，难道不检查吗？	六、我成为台独分子，我的老同学谢聪敏是一个施展连环套的角色。他和魏廷朝先把我咬进牢里，使官方上当（其实情治人员乐得案子有李敖在内，因为可领破大案奖金）；然后在声势已壮之后、在海内外皆知李敖加入台独活动之后，再设法替李敖翻案，用李敖在文化界的声名，反衬出国民党在如何以冤狱迫害自由作家。这样一来，李敖可被黄鱼两吃，而国民党的害贤之名却又加倍。谢聪敏在牢中替李敖翻...
3	087.黑牢忆趣.txt	15	怎么不检查？还由所长罗永黎带人把小林脱光检查过呢。当时我以为信会被搜出来，可是一直没动静。后来我到日本，见到小林，问他，原来小林先把信藏在马桶与墙的夹缝里，脱光检查完毕后，临走前，他要求小个便，就趁小便之时，把信从夹缝中带了出来。	六、我成为台独分子，我的老同学谢聪敏是一个施展连环套的角色。他和魏廷朝先把我咬进牢里，使官方上当（其实情治人员乐得案子有李敖在内，因为可领破大案奖金）；然后在声势已壮之后、在海内外皆知李敖加入台独活动之后，再设法替李敖翻案，用李敖在文化界的声名，反衬出国民党在如何以冤狱迫害自由作家。这样一来，李敖可被黄鱼两吃，而国民党的害贤之名却又加倍。谢聪敏在牢中替李敖翻...
4	087.黑牢忆趣.txt	17	小意思、小意思。	七、信登在《纽约时报》后，官方追查，谢聪敏瞒过由小林带信的真相，反咬了一个班长陈留恨，说信是这班长带出的。陈留恨因此被捕，被拷打不已，直到最后查出不是班长而是小林，才真相大白。由于陈留恨对待囚犯极坏，谢聪敏这一乱咬，却也咬得人心大快。谢聪敏被罚带脚镣好几个月，最后取下脚镣时，班长们对他恭贺，他笑嘻嘻地说：“小意思、小意思。”
3	087.黑牢忆趣.txt	19	李先生，公民书中告诉我们，《宪法》第十四条‘人民有集会及结社之自由’，我以为那是真的，就想组党，结果就给抓进来了。	八、在军法看守所放封之际，碰到一个小叛乱犯。他是一名高中生，因想组党，被抓入笼。他大惑不解，向我说：“李先生，公民书中告诉我们，《宪法》第十四条‘人民有集会及结社之自由’，我以为那是真的，就想组党，结果就给抓进来了。”我听了，哈哈大笑。后来，他好像随遇而安，也甘于做叛乱犯了，有一天竟自谓：“我是天生革命家。”可是这位小革命家很怕鬼，夜里总是蒙头大睡。
3	087.黑牢忆趣.txt	21	致敬取消了！	九、在军法看守所，来了一批以成功大学学生为主的“成大共党案”。那些小鬼们从来没见过真共产党，坐在牢里，到处想找共产党前辈来师法。我说别天真了吧，牢里哪里还有什么真共产党！国民党整天抓到的，其实都是假共产党！他们不信，硬说李荆荪是，一房一房传话过去，向李荆荪致敬。后来发现李荆荪果然是假的，于是大呼负负，又一房一房传话过去：“致敬取消了！”弄得傻头傻脑的李荆荪糊...
5	087.黑牢忆趣.txt	23	你们这样对我们共产党，将来共产党从大陆来了，要剥你们皮啊！	十、“成大共产党”在调查局被刑求，有人大骂：“你们这样对我们共产党，将来共产党从大陆来了，要剥你们皮啊！”调查局干员说：“剥就剥，可是没来以前，老子们先剥了你的皮！”
5	087.黑牢忆趣.txt	23	剥就剥，可是没来以前，老子们先剥了你的皮！	十、“成大共产党”在调查局被刑求，有人大骂：“你们这样对我们共产党，将来共产党从大陆来了，要剥你们皮啊！”调查局干员说：“剥就剥，可是没来以前，老子们先剥了你的皮！”
4	087.黑牢忆趣.txt	25	枪毙的时候，我就穿它去。	十一、“成大共产党”领袖是蔡俊军，是一位率真勇敢的年轻人，后来与我成为好友，出狱后还打电话感谢我对他的照顾。有一次我送他一套睡衣，他那时被判死刑，穿着睡衣，带着脚镣对我说：“枪毙的时候，我就穿它去。”又指着胸前说：“子弹就从这儿打出来。”态度从容之至。后来死里逃生，改判无期，十五年后出狱。我的同案李政一曾和蔡俊军同房，他告诉我：“同房难友任何人的食品，蔡俊军...
3	087.黑牢忆趣.txt	25	同房难友任何人的食品，蔡俊军都会抓来就吃，连招呼都不先打一下。人问他为什么，他说：‘我们是共产党，你的就是我的，我要共你的产啊！’	十一、“成大共产党”领袖是蔡俊军，是一位率真勇敢的年轻人，后来与我成为好友，出狱后还打电话感谢我对他的照顾。有一次我送他一套睡衣，他那时被判死刑，穿着睡衣，带着脚镣对我说：“枪毙的时候，我就穿它去。”又指着胸前说：“子弹就从这儿打出来。”态度从容之至。后来死里逃生，改判无期，十五年后出狱。我的同案李政一曾和蔡俊军同房，他告诉我：“同房难友任何人的食品，蔡俊军...
5	087.黑牢忆趣.txt	27	既然没死，还是看李敖的书吧！	十二、“成大共产党”另一领袖吴荣元，也被判死刑，也是一位率真勇敢的年轻人。他被判死刑后，带着脚镣，等待枪毙，找来佛经看，以为解脱；后来改判无期，他把佛经一丢，说：“既然没死，还是看李敖的书吧！”
4	087.黑牢忆趣.txt	29	调查局，利嘎西郎（你家死人）！调查局，利嘎西郎！	十三、在黑牢中的人，无不恨调查局与警备总部，因为这两个衙门专门刑求以造冤狱。有一次，一个土头土脑的台湾人，被送到军法处看守所来，他余怒未消，把棉被卷成一团，坐在地上，一边捶棉被，一边大喊：“调查局，利嘎西郎（你家死人）！调查局，利嘎西郎！”旧派心理学家喜言“本能”者，凡遇无法解决的主题，辄以“本能”含糊带过，人戏以“毯子学说”（blanket theory）...
5	087.黑牢忆趣.txt	33	我是故意慢的，有工要留着慢慢做，做完了怎么办？	十五、在军法处看守所，我大部分时间关在两坪的独居房。有一次换房，因人太多，派进一个桃园大园的流氓同我暂住。此公叫许性德，我在看书，他大唱日本歌，我说你太吵了，你做一点工吧，他说没工可做。我看到马桶内外有多年累积的脏斑，我说你就洗马桶吧，他说好，洗了一阵，脏斑洗不下来，他说只有用刀刮才成，你有刀吗？我就把私做的一把代用刀——用垫鞋底的铁片磨成的——交给他，他很...
3	087.黑牢忆趣.txt	35	黄中国枕头底下藏着佛经呢！他所有的宝全押，是上天堂的投机分子。只恐怕上不了所有的天堂，反倒下了所有的地狱！	十六、有一段时间与人合住第十一房。有山东米商黄中国被判死刑，他是粗人，因赌博被人陷害成“匪谍”，以致冤死。还没执行前，荣工处的简任官胡炎汉劝他信耶稣，带他一起祷告。祷告完了，我在旁边大笑。胡炎汉问我笑什么？我偷偷开玩笑说：“黄中国枕头底下藏着佛经呢！他所有的宝全押，是上天堂的投机分子。只恐怕上不了所有的天堂，反倒下了所有的地狱！”黄中国的冤狱，我曾全力代他写...
5	087.黑牢忆趣.txt	37	什么意思嘛！人家只买一点军油，就把人家跟死刑犯关在一起，就这样吓人家，什么意思嘛！	十七、黄中国被枪毙之日，清早五点，第十一房的房门突然间被打开，黄中国正睡在门边，他一声哀呼，坐起来，向牢房另一角冲过去。可是，七八个禁子牢头冲进来，反铐他的两手、抓住他的头发、用布条缠住他的嘴巴，再用熟练的技巧，把他架出房门。当时睡在我右边的胡炎汉惊慌坐起，十指张开、两臂前举，大叫起来，一个班长讨厌他跟着叫，顺手拉了他一把，高叫：“还有你！”吓得胡炎汉缩成一...
3	087.黑牢忆趣.txt	37	还有你！	十七、黄中国被枪毙之日，清早五点，第十一房的房门突然间被打开，黄中国正睡在门边，他一声哀呼，坐起来，向牢房另一角冲过去。可是，七八个禁子牢头冲进来，反铐他的两手、抓住他的头发、用布条缠住他的嘴巴，再用熟练的技巧，把他架出房门。当时睡在我右边的胡炎汉惊慌坐起，十指张开、两臂前举，大叫起来，一个班长讨厌他跟着叫，顺手拉了他一把，高叫：“还有你！”吓得胡炎汉缩成一...
3	087.黑牢忆趣.txt	37	太可怕了！太可怕了！	十七、黄中国被枪毙之日，清早五点，第十一房的房门突然间被打开，黄中国正睡在门边，他一声哀呼，坐起来，向牢房另一角冲过去。可是，七八个禁子牢头冲进来，反铐他的两手、抓住他的头发、用布条缠住他的嘴巴，再用熟练的技巧，把他架出房门。当时睡在我右边的胡炎汉惊慌坐起，十指张开、两臂前举，大叫起来，一个班长讨厌他跟着叫，顺手拉了他一把，高叫：“还有你！”吓得胡炎汉缩成一...
4	088.钦佩陈定炎先生.txt	3	人心者，国家之命脉也。	明朝的吕坤写《呻吟语》，这是一部正人君子的教科书。他大声疾呼：“人心者，国家之命脉也。”正人心之道，对己而言，讲究修养，但修养不只是内省式的，而要外延式的，要在外做出功德与好事，才算正果。功德与好事，项目繁多，吕坤认为：“替人辩冤白谤，是人间第一天理。”人间有冤谤不得明，则是非颠倒、正义陵夷，人心又从何得正乎？
4	088.钦佩陈定炎先生.txt	3	替人辩冤白谤，是人间第一天理。	明朝的吕坤写《呻吟语》，这是一部正人君子的教科书。他大声疾呼：“人心者，国家之命脉也。”正人心之道，对己而言，讲究修养，但修养不只是内省式的，而要外延式的，要在外做出功德与好事，才算正果。功德与好事，项目繁多，吕坤认为：“替人辩冤白谤，是人间第一天理。”人间有冤谤不得明，则是非颠倒、正义陵夷，人心又从何得正乎？
8	088.钦佩陈定炎先生.txt	5	一经圣人手，议论安敢道？	我生平不做自了汉，好管闲事、好打抱不平、好扫他人瓦上霜，笔锋所及，不分大小、不论生死、不管亲疏，只要有是非颠倒、正义陵夷之事，我就要“干涉”。这种“干涉”，由于我的博学与锋利，渐渐汇为巨流。韩愈的诗说：“一经圣人手，议论安敢道？”我却“一经李敖手，议论就敢道”。议论之下，足令小人辟易、鼠辈丧胆、大奸巨恶无所遁形，使他们一干人等，生前死后皆不得安宁。
8	088.钦佩陈定炎先生.txt	5	一经李敖手，议论就敢道	我生平不做自了汉，好管闲事、好打抱不平、好扫他人瓦上霜，笔锋所及，不分大小、不论生死、不管亲疏，只要有是非颠倒、正义陵夷之事，我就要“干涉”。这种“干涉”，由于我的博学与锋利，渐渐汇为巨流。韩愈的诗说：“一经圣人手，议论安敢道？”我却“一经李敖手，议论就敢道”。议论之下，足令小人辟易、鼠辈丧胆、大奸巨恶无所遁形，使他们一干人等，生前死后皆不得安宁。
4	088.钦佩陈定炎先生.txt	11	陈炯明在广东已无立足之地，他失败下野，住到香港，这时他四十九岁。	我在文后结尾是：“陈炯明在广东已无立足之地，他失败下野，住到香港，这时他四十九岁。”且是被通缉之身。“一九三一年九一八事变后，他发表《敬告国人书》，并去上海，与章炳麟一同北上到天津，与段祺瑞北方军人共商救国方略。第二年再去天津。在天津时，日本人拉他合作，他说你们先还我东三省，否则没话说。这是他最后一次在奔走国事，无所成就，后以母亲生病，返回香港。1933年9...
3	088.钦佩陈定炎先生.txt	11	章炳麟《定威将军陈君墓志铭》说：‘君自覆两假政府（岑春煊一个、孙中山一个），有骁名，人莫敢近，卒落魄以死。余独伤其不幸，以恶名见蔑，故平其议而为之铭。’章炳麟也是革命元勋、也是最后被国民党‘以恶名见蔑’的‘不幸’人物，他在国民党迫害之中、在国民党众口铄金里，仍挺身为陈炯明说公道话，伟大的知识分子，不当如是乎？	我在文后结尾是：“陈炯明在广东已无立足之地，他失败下野，住到香港，这时他四十九岁。”且是被通缉之身。“一九三一年九一八事变后，他发表《敬告国人书》，并去上海，与章炳麟一同北上到天津，与段祺瑞北方军人共商救国方略。第二年再去天津。在天津时，日本人拉他合作，他说你们先还我东三省，否则没话说。这是他最后一次在奔走国事，无所成就，后以母亲生病，返回香港。1933年9...
7	088.钦佩陈定炎先生.txt	13	十八章，共二千八百多页，约一百三十万（英）字	《孙中山研究》出版后，远在美国的陈炯明的儿子陈定炎先生看到了，他写信给我，对当今之世，唯一挺身为陈炯明公开说公道话的中国人，有以联系。从陈定炎先生的信中，我得知这位四十年来，在美国求学就业的工程专家，四十年来，在“工作余暇”，曾一直矻矻不断的采集他父亲的种种资料，并且编成“十八章，共二千八百多页，约一百三十万（英）字”。他希望这些心血，能“俾学者求真考证之用...
