file	line	text
016.法制观念.txt	189	法官之量刑，竟把罪少者反判重，罪多者反判轻，显然难谓公平。不公平的现象，似是过度考虑到两造的年龄、地位等条件的结果。传统的习惯是：上了年纪的人拖住年轻人打官司，法官为了使前者面子上好看，总难免叫后者吃点亏。但有一点，我极感满意。即关于闽变叛国一事，法官已百分之百的判决了我“系维护历史之真实”。在判决书全文中，丝毫没有对胡秋原就闽变的翻案予以采信，这足见历史事实不能抹杀。我认为只要这个原则能维护，其他个人在枝节上受些缠讼和委屈，都是小意思。无论如何，把这些历史性的问题硬拖进法院里来裁决，总归是一种今古奇观，也是一种令人啼笑皆非的事。但我没办法，因为我究竟不是主动打官司的人。（《五点感慨》）
016.法制观念.txt	193	先看什么是“刑”。法学家们说刑是法律中的名目，却不知道刑远在法律之前就出现，同时远在法律之外逍遥着。我们看不到殷商的法律，却看到殷商的刑罚，我们现在用的字，像“执”字、像“囚”字、像“圉”字，都是甲骨文中吓人的字。“执”是用刑具抓人，“囚”是抓到人放在牢里，“圉”是放在牢里还挂上手铐脚镣。从原始的意义来说，刑不是法律的名目，而是无法无天的名目。后来法律出来，把刑开始文明分类，摩登的分法是：一、生命刑（死刑——电椅、绞架、枪毙），二、自由刑（徒刑、拘役、假释等），三、财产刑（罚金、易服劳役、没收），四、资格刑（褫夺公权）。以上四类，比起固有文化来，形式上人道，实质上有的也难说。例如古代的自由刑里有“流刑”，流刑是“摒诸四夷而不与同中国”，就比较意义上说，很像“驱逐出境”，是叫你捣乱鬼出境而不是“限制出境”。所以，复兴中华文化，若不是口号，就该复兴“流刑”，使流刑流行起来。（《“缇萦救父”表示了什么？》）
016.法制观念.txt	197	身体刑在执行方面，倒多少有今古之分。现代派偷偷摸摸，古典派却光天化日，光天化日到公然立法为之的程度。中国古代的身体刑，修理面极大，甚至在生命刑上也大做手脚，使死刑变得花样百出。古代法律上大致把刑分“墨”、“劓”、“刖”、“宫”、“大辟”五种，叫做“五刑”。前四种是纯身体刑，后一种是死刑（“大辟”）附加或不加身体刑。不加身体刑的，一般是斩（杀头），身首异处，一了百了。由于中国人忌讳身首异处，喜欢全尸，所以别开死面，死刑出了优待。优待又分“公优待”和“私优待”，公优待是赐死（绞死或强迫自杀、刎颈、服毒之类）；私优待是买通刽子手，把人头还给家人，找皮匠再和尸体缝在一起（这种皮匠，只缝三针，就可复原，是专门人才，不是普通修皮鞋的）。（《“缇萦救父”表示了什么？》）
016.法制观念.txt	201	五刑里面，“墨”刑是最轻的一种。墨刑是在受刑人脸上割出刺出字来，然后在伤口上揉进颜料，颜料是黑色的，所以叫做“墨”，也叫“黥”。它的作业，很像文身。墨刑最早说是蚩尤发明的，后来虞舜把它确定，放在五刑之首。它在古书中经常见到。在《庄子》里面，甚至编成故事，洗耳的许由挖苦意而子说：“唐尧既然用仁义给你施了墨刑，用是非给你施了劓刑，你怎么还能自在逍遥呢？”最后意而子说：“怎么知道老天爷不把我墨刑的伤、劓刑的伤补好呢？”可见墨刑已用到哲学的讨论上面。由于在古书中一再出现，可以想见它的普遍性、它的源远流长。
016.法制观念.txt	203	照《书经》的说法，统治者有错，下面人不能帮忙改正，要用墨刑来罚，这是一个有趣的标准，等于是专罚扶同为恶的小人的。其实这只是乌托邦的法律，若真的实行起来，任何统治者都要被脸上有字的人包围了。但在其他方面，墨刑在古代，动不动就来一下，是可以确信的。所谓“墨罪五百”，所谓“墨罚之属千”，都是明证。大将军英布年轻时就被墨刑过，大家都叫他“黥布”，墨刑的名流中，他考第一。秦朝太子犯了法，商鞅歉难把字刻在太子脸上，结果“黥其师”，老师倒了楣。（《“缇萦救父”表示了什么？》）
016.法制观念.txt	207	“劓”刑是割鼻子，也说是蚩尤发明的，反正蚩尤打了败仗，一切“好事”都算到他头上。劓刑是广义解释的，包括割耳朵。劓刑方面，所谓“劓罪五百”，所谓“夏有劓墨各千”，所谓“我乃劓殄之，无遗育”，所谓“又曰劓人，无或劓刵人”，可见此刑的普遍使用，就好像“违警罚法”似的。劓刑的外一章是割耳朵（刵），在《易经》中，有“何校灭耳，凶”的卦，“何校”是一种使耳朵跟人分家的刑具，何是背，校是枷，加起来，就是背在背上的一种枷，可以把耳朵“灭”掉，其“凶”可知。这种刑具的发明家认为：耳朵的用处在使人因听而聪明，犯罪的人，显然因不听而笨，所以，耳朵该罚。（《“缇萦救父”表示了什么？》）
016.法制观念.txt	211	五刑中排名第三的，是“刖”刑，也叫“剕”刑。是砍掉脚或脚趾（重刑砍右趾，轻刑砍左趾），当然还是蚩尤干的缺德事。它的最早名字是“膑”，后来被第一任司法行政部长皋陶给改了，但还通用。不但通用，并且像黥布一样，出来一位“孙膑”。他被老同学庞涓陷害，黥了面又砍去脚，他虽然最后得到了胜利，可是却失掉了名字，大家都叫他“孙膑”，谁也不知道他本名了。古人用刖刑整人，范围也不下于《违警罚法》，偷车的，刖；跳城墙的，刖；向统治者扯谎的，刖。《韩非子》记楚人和氏璧故事，和氏得到了宝玉，向统治者拍马屁，可是统治者不识货，先后被“刖其左足”又“刖其右足”。他哭的时候，人家还告诉他：“天下之刖者多矣！”可见这种整人法多普遍。《左传》、《晏子春秋》、《孔子家语》、《说苑》、《庄子》等古书里，到处都有刖的纪录，写不完的。我们现在说“踊跃”，不知道“踊”字就是被刖的人所穿的鞋，普通人穿的鞋叫履，古书里有“踊贵而履贱”的话，意思是说：没脚的，比有脚的流行，法法法法法，太黑暗了！（《“缇萦救父”表示了什么？》）
016.法制观念.txt	217	宫刑是仅次于死刑的重刑，这种刑，照《周礼》说法，是“男女不以义交者，其刑宫”。什么是“义交”呢？就是要合乎当时道德法律的性交。就是说，任何非法的性交，被发现了，就要割家伙。但这只是理论，因为古书中有大量的“不以义交”，公然为之以后，家伙依然健在。而《左传》里记楚子想割羊舌肸生殖器的故事，却明明和“义交”无关，而是政治问题。何况古书中明明有“夏刑宫辟五百”、“宫罪五百”、“宫刑之属三百”等话，宫刑使用的范围，自然绝不止于“不以义交”。（《“缇萦救父”表示了什么？》）
016.法制观念.txt	221	以上所说墨、劓、刖、宫四种肉刑，只是正统的、依法有据的、代表性的大刑，是刑五刑以内的。在这些以外，夹带的、附送的、巧立名目的、自我作古的、杠上开花的、何足道哉的、推陈出新的种种身体刑，也不知有多少。像鞭、杖、笞、拶、挺棍、夹棍、脑箍、竹签、掌嘴、断舌、背花、烙铁、灌鼻、钉指、一封书、鼠弹筝、拦马棍、燕儿飞、带根板、水釭杖、生树棍、磨骨钉、寸寸紧、穿耳鼻、割脚筋、立枷等等等等等等等等，以及叫都叫不出来的无名英刑，当然也都是肉刑的附录、肉刑的外一章、肉刑的第二辑。（《“缇萦救父”表示了什么？》）
016.法制观念.txt	225	用“私刑”来惩罚犯奸的女人，历来的例子太多了！一般中国的英雄好汉们，他们对付自己或别人戴绿帽子的难题，似乎不愿诉诸法律，他们宁愿亲自动手，以达到“一对人头落地，两腔鲜血冲天”的境界！在这个境界的追求中，武大郎是失败者，武松则是成功的英雄。这一类事件在历史、小说和传闻里，简直多得不得了，《元曲选》己集下里的《酷寒亭杂剧》就是一个典型的例子。
016.法制观念.txt	227	另一种规模较大的私刑是“宗族制裁”，所谓家法、族规是也。族人对“淫妇”的制裁似乎比正式的法律还普遍！单在《刑案汇览》中，我们就可以看到“奸妇”、“淫女”被“活埋”、“勒死”和“砍杀”的例子。（《纪翠绫该生在什么时候？》）
016.法制观念.txt	231	有一种叫“身体刑”或“体刑”或“肉刑”的，在摩登的法律条文中是禁止了，虽然事实上，全世界许多极权国家还日新月异的流行着。这里说日新月异，是说极权国家虽然在自由思想上大落其伍，但在专制道具上却超越前进，并且完全合乎最新的“科学方法”。从希特勒式的招供药丸，到斯大林式的浑身通电，这是古人们再也发明不出来的科学花样。何况还有现代的内科医生一旁伺候，保证可使任何人死去活来到极限境界而不致暴毙，这比古人修理专家动辄使人死去而不能活来的笨手笨脚，的确高明万分。何况“科学方法”还有不落痕迹的妙用，用之则行、舍之则藏，干净利落，证据完全没有，煞是厉害。《孟子》里说“威武不能屈”，《正气歌》里说“鼎镬甘如饴”，但把孟夫子交给希特勒，文天祥交给斯大林，老希老斯祭起“科学方法”修理老孟老文，不但文天祥可以把知道的都说出来，孟夫子还可以把不知道的也都说出来，外加检举文天祥是蒙古间谍！（《“缇萦救父”表示了什么？》）
016.法制观念.txt	245	这是何等荒谬！在左近无人之处，或一点点麻醉剂，就可以强奸女人而以和奸论罪！这是多么不合理！更荒唐的是：清律小注又说，虽具备上面四条件，最后若让强奸者达到了目的，仍以和奸论！这样说来，天下几乎无强奸情况而言了！我们不能想像，在我们这礼义之邦中，有多少可怜的女子在遭受暴行之后，竟又被目为淫妇而加以判刑！（《纪翠绫该生在什么时候？》）
017.批评中国知识分子.txt	7	早期知识分子的特色是“四体不勤，五谷不分”。既不屑为工农，又看不起商贾。他们的生活，经常要仰赖于威权者才能解决，或为所从之臣，或为被养之士。为五斗米折腰，自然难免。于是一切理想抱负，也都化为威权者的因变数。偶有不为五斗米折腰的人，退而归园田居，却也有将芜之田园、盈樽之老酒，供他傲啸山林，采菊篱下。且仗民间对知识分子的礼遇，到处可吃到不花钱的狗肉。更等而下之的，也可在扬州二十四桥白吃白嫖，“小红低唱我吹箫”，做红颜知己。今也不然，今日知识分子甚至连白吃白嫖的礼遇也得不到了，灯红酒绿之处，早无知识分子的份儿。又加上多年的战乱，知识分子最后退隐的将芜之田园也不知去向，连“大不了回家吃老米饭”的赌气话都不敢说，自己的胃跟威权者的威权成一直线，一点抗衡的余地都没有了。于是，一切什么“合则留，不合则去”、“难进而易退”等骨气，都免谈了。（《粗谈中国知识分子五病》）
017.批评中国知识分子.txt	11	中国知识分子是中国最可耻的一个阶级。这个阶级夹在统治者和老百姓之间，上下其手。他们之中不是没有特立独行的好货，可是只占千万分之一，其他都是“小人儒”。庸德之行，庸言之谨，读书不化，守旧而顽固。中国知识分子坚守他们在统治者和老百姓中间的夹层地位，误尽苍生。当特立独行的王安石搞变法，想直接受惠于老百姓的时候，文彦博站出来向皇帝说话了，他说：“陛下是同士大夫治天下，不是同老百姓治天下。”王安石想越过这批拦路虎，可是他碰到了绊脚石。
017.批评中国知识分子.txt	13	中国知识分子失败了。有两大方面的失败：一方面是品格上的，一方面是思想上的。思想上失败的特色是：他们很混、很糊涂、很笨。他们以知识为专业，结果却头脑不清、文章不行。这种特色不但使他们品格诸善莫做，并且扶同为恶而不自知；在思想上，也不能深入群众，影响普遍的中国人。他们写的东西，只能自我陶醉，或者给互相捧场的同流货色一起陶醉，实际上，实在不成东西。对绝大部分中国知识分子的作品，我看来看去，只是可怜的“小脚作品”。（《快看<独白下的传统>》）
017.批评中国知识分子.txt	19	在《论语》中有两句话：“一言而可以兴邦”、“一言而可以丧邦”。这两句话，十足说明了言论责任的重大。拿笔杆的人是子夜中的星火，他们引导市井小民，渡苦海而登彼岸。拿笔杆的人本身若愚昧失职，一定会带着市井小民乱兜圈子，七航妖岛的结果即使有幸生还，到头来也难免有千古失足之恨。（《论所有的宝全押》）
017.批评中国知识分子.txt	25	表面上看，司马光型和欧阳修型不同，其实从基本模式上看，两个小老头完全一样。他们争的，都是传统文化的解释权，看谁解释得好，使孔夫子和当今圣上高兴。打开《司马文正集》和《欧阳文忠集》，一对照，就看出他们竟那么像，像得你可以叫司马“修”，叫欧阳“光”，他们都是在传统板眼里一板一眼的顺民，他们两眼毕恭毕敬的向上看，一点也不敢荒腔走板。（《快看<独白下的传统>》）
017.批评中国知识分子.txt	31	这一现象，有着明显而深远的历史背景。中国知识分子的前身相当于古代的士、士大夫、士君子、君子、儒、书生。这一种人，在历史上的地位大致是：先得受教育的便利或特权，不当兵、不纳税、不种田、不做工，主持舆论（好一点的是“清议”），影响司法（坏一点的是“讼师”），进则中举应辟、做官行道（好一点的是“清官”，坏一点的是“巧宦”）；退而传经授徒，弄月吟风，“忍把浮名，换作浅斟低唱”。至于真正怀抱大智慧大原则而殉道如李卓吾者，毕竟极少。能做到独善其身，隐没山林，已经不错了。（《粗谈中国知识分子五病》）
017.批评中国知识分子.txt	35	造成中国知识分子特殊地位的基本原因有三：一是农业社会，二是威权局面，三是文字艰难。农业社会和威权局面，需要的是一种“知命”、“务本”、“保守”、“服从”的架构，这一架构不能全靠老子的板子或皇帝的斧钺，“马上得天下”并不能“马上治天下”，要想得而治之，就得下马请教书生，要书生制造抽象的架构去平衡、去控制。据说书生也有“马上”的时候，所谓“上马能击贼”之类。不过那时候，国不亡也差不多了。而该书生上马之前，照例总又“倚马”万言一番，恐怕万言未了，早已被贼所击，最后命短的自然“骂贼而死”；命大的只好“奈何从贼”了！
017.批评中国知识分子.txt	41	不论为王为寇，知识分子最后为威权者所乘则一。不论自古以还，其名位是“文学侍从之臣”、大学校长，或是什么物理学家、理财专家，或什么赋税改革家。有几个知识分子能逃掉不为威权者鹰犬之讥？或能逃掉不扶同为恶之讥？（《粗谈中国知识分子五病》）
017.批评中国知识分子.txt	45	中国人的爱国方式，太偏重在政权的转移与集中，对政权以外的爱国方式很少有人感兴趣，这是知识分子的大失败！新时代的知识分子们必须感到谈心性之学走权贵之门固属可笑，但是缩在研究机构里白首书帷也高明不了多少。我们实在可以换一个方式来爱国了，改良改良社会，研究研究农村，访问一下贩夫走卒或神医妓女，从而设法解决一两个实际的问题，这岂不是我们该做的事？在这种尺度下，晏阳初先生、吴基福先生、杨国枢先生，他们的实际、热情与睿智都可以代表我们知识分子光彩照人的一面，他们那些专家式的结论也都可以供给我们的民意代表做参考。（《修改<医师法>与废止中医》）
017.批评中国知识分子.txt	49	我不喜欢绝大多数在美国的中国人，他们明明是中国的逃兵，却回过头来，老是讲评作战。（《李语录》）
017.批评中国知识分子.txt	53	任何第一流的知识分子，他在形式上的条件，必须是反对型态的、批评型态的、异议型态的、你说东我就说西型态的。因为他深刻知道：在寻求真理、维护真理的过程中，从反对、批评、异议，你东我西来着眼，太重要了。尤其在一党独大众口一声的情势下，更该如此。想想看，当苏格拉底独自面对众口一声，敢于为十个将军辩护的时候：当伽利略独自面对众口一声，敢于提出地球转动学说的时候，如能有一个声音，从众口一声中脱声而出，转来支持他们，表达出反对、批评、异议、你东我西的声援，该是多么重要的事。因为在当时，苏格拉底和伽利略的唱反调都被抹杀过，但他们的反调，毕竟都是真理。真理从唱反调而来，真理的发扬光大，又有赖于第二个、第三个乃至第N个唱反调的人，前仆后继，薪尽火传。（《论唱反调》）
017.批评中国知识分子.txt	59	作为知识分子的，若不做第一个唱反调的，也不做第二个、第三个乃至第N个唱反调的，反倒正面为一党独大鼓吹，拍当政者马屁，甚至揣摩上意，想得马屁之先，为政府护航，这是最可耻的不务正业。（《论唱反调》）
017.批评中国知识分子.txt	63	当年孔老夫子早就有“我待贾者也”的感叹，并且一辈子凄凄惶惶，目的在得“用我者”的赏识。知识分子怀才得展是好的，可是为了一展长才，却不得不委身屈己，谋与既成势力合作，则是许多悲剧的起源。当然，许多知识分子也有他们自解的理由，有的说由于他的加入，虎可以谋其皮，既成势力可以改好；有的说他的工作性质有益国计民生，是科学性质、经济性质等等。殊不知他所得到的，竟多是得不偿失，多是间接巩固既成势力，多是悔不当初。中国知识分子并未普遍学到“不降其志，不辱其身”的本领，这种本领的基础，是能忍耐寂寞，能在必要时自毁——像“麝”一般的自毁，英雄宁无地用武，也不乱用武，也不降格用武。大盗尚且有道，又何况以卫道行道自命的知识分子？（《粗谈中国知识分子五病》）
017.批评中国知识分子.txt	67	中国知识分子受了几千年“忠君”思想的毒，对忠字的要求，十分普遍。普遍的结果，忠的范围甚至不限于对圣上，甚至对主子也不例外。但是中国知识分子对忠的标准太感情化了，以致不辨是非，跟愚夫愚妇一般，只是一味“愚忠”，而不崇尚理智的、大目标的尽忠。衡诸历史事实，改朝换代多自叛臣而来，改换以后历朝各代又都不乏有忠臣出现，此一忠，严格说来，乃是忠于叛、忠于一姓、忠于家族。可惜中国知识分子对这一点却总不深究，他们总是要急于找个从一而忠的对象，而不深究这个对象是否值得一忠？也不深究因这对象所发生的事件（如明朝皇帝的三案和南巡等）是否值得一忠？不但如此，威权者更灵巧的运用国字做招牌，诱使知识分子“精忠报国”，知识分子不深察，傻不鸡鸡的去卖命，他以为所卖命的对象是苦难的国家，因而做孤臣、做循吏，“鞠躬尽瘁，死而后已”。殊不知他们所应做的，该是理智的爱国主义者，而不是盲目的愚忠主义者和家族的忠仆！（《粗谈中国知识分子五病》）
017.批评中国知识分子.txt	71	中国知识分子的另一大病是他们在本行上的失职。知识分子本应在思想上做先导，提供远景，为国家决定趋向的。古代的有心人，早就标榜出“为天地立心，为生民立命，为往圣继绝学，为万世开太平”的伟大抱负。但这些过于抽象的目的，若想达成，还需要进一步的细腻思想和具体理论。可惜在这方面，传统的中国知识分子做得太糟太差。到了近代，知识分子受了日本及欧美的影响，一时眼花缭乱，再加上求功心切、时髦是尚，大家一窝蜂似的引进他们自以为是的欧美思想，再牵强附会上传统经典与思路，搅拌出一大堆大杂烩，惹得中国群众目的热而方法盲，教条林立，主义杂陈，闹得天翻地覆。而真正西方的理性、自由、民主、人权、容忍等德目与实绩，却未能在中国生根。可见从世界主流标准来看，中国知识分子是不够格的，他们淆于真知，不能做好思想的指向。（《粗谈中国知识分子五病》）
017.批评中国知识分子.txt	75	中国的知识分子最不能察觉自己与时代的关系，因而常常走上知识的歧路，无益世道，也无益实学。历来什么易数、骈文、律诗、八股、心性、理气、朴学、精神价值等等，都可以说是虚耗青春之学——“虚学”。虚学就是真知的反面，也是真知的绊脚石。中国知识分子不但搞虚学，竟还想用虚学来修身、齐家、治国、平天下，其不量力，已是十分明显。中国知识分子如果能够自省，应该察觉出什么是他们力之所及的，什么是他们虚学败事的。国力的元素很多，知识的力量只是其一，虚学闹来的知识，甚至没有力量可言。“救国救民”、“以天下为己任”有其限度，尤其当天下这么复杂的今天，更不是空头的“己任”，过分的责任感所能“救”得了的。一个大学教授的影响力，甚至比不上一个电影明星；一个活生生的哲学系研究生的说服力，甚至比不上一个死翘翘的不入流的小说家。这些事实，难道还不值得以虚学自傲的知识分子的反省吗？（《粗谈中国知识分子五病》）
017.批评中国知识分子.txt	79	古人实在不能了解中国，因为他们缺乏方法训练，笨头笨脑的。明末清初第一流的大学者顾炎武，他翻破了古书，找了一百六十二条证据来证明“服”字古音念“逼”，但他空忙了一场，他始终没弄清“逼”字到底怎么念，也不知道问问吃狗肉的老广怎么念。顾炎武如此误入歧途，劳而无功，而他却还算是第一流的经世致用的知识分子！又如清朝第一流的大学者俞正燮，他研究了中国文化好多年，竟下结论中国人肺有六叶，洋鬼子四叶；中国人心有七窍，洋鬼子四窍；中国人肝在心左边，洋鬼子肝在右边；中国人睾丸有两个，洋鬼子睾丸有四个。……并且，中国人信天主教的，是他内脏数目不全的缘故！俞正燮如此误入歧途，劳而无功，而他却还算是第一流的经世致用的知识分子！《快看<独白下的传统>》）
017.批评中国知识分子.txt	91	“唱高调”的结果是，中国人的精神开始分裂了，人格开始多边了，大家都学会了纸上写和口上说的是一套，实际做的又是另一套！（《“文化太保”谈梅毒》）
017.批评中国知识分子.txt	95	旧时代的知识分子们老是想从政治着手，靠着传统和既成势力，做着“得君行道”、“代圣人立言”的迷梦；新时代的知识分子们却不这样，他们封还了高官巨党，不怕孤独的走向社会改革的长途。在路的两边，他们散播真正西方的花种，花种名目是“科学”、“民主”、“现代化”。这些种子不来自东方，两千五百年的中国历史里不曾有它，一十五年的红色大陆里也不会有它，它的真正温床是在这大洋中的孤岛，它的真正花匠是我们这一代的孽子孤臣。两千五百年来从没有过的果实，我们要它从我们的手里连根长起。“悠然见南山”的季节还早着哩！现在的时候，只是播种与春耕。（《古老的中国民族呵！你该选择》）
