score	file	line	text	context
5	015.双枪少尉集、在那一连串苦斗的日子·1960年4月.txt	171	一信之成，数易其稿	很久没有写信给你了，想起你在第一封来信里所说的话，不觉有些歉然。这些日子里，我确实被许多“不速之事”占去不少的时间，不过我无意寻找任何借口，倒是有一点被你不幸而言中了，那便是：“一信之成，数易其稿”，而终不能成。说实在，我希望给你写很多信，很长和很好的信，我想，我所写给你的信件，极可能就是我此生全部的“作品”，因为时至今日，我对自己在未来究竟能在文学领域里获...
7	015.双枪少尉集、在那一连串苦斗的日子·1960年4月.txt	175	娶个黄脸婆娘，生儿子去也。	我希望在回来以后能有很大的改变，犹如凤山六月是我生活上的分水岭一样，把旧日的生活以及其他完全隔开，这种想法是可笑的，自己也不晓得是怎样会发生的，自然不会实现，实则改变很少，甚至于完全没有改变，然而也就算了，并不感到失望或者不快，反而在许多不如意的事上，生出许多连自己也惊讶其宽大的容忍和退让的思想。显然，过去几个月的生活对我发生了很大的作用，第一、我成熟了，第...
4	015.双枪少尉集、在那一连串苦斗的日子·1960年4月.txt	175	lust for life	我希望在回来以后能有很大的改变，犹如凤山六月是我生活上的分水岭一样，把旧日的生活以及其他完全隔开，这种想法是可笑的，自己也不晓得是怎样会发生的，自然不会实现，实则改变很少，甚至于完全没有改变，然而也就算了，并不感到失望或者不快，反而在许多不如意的事上，生出许多连自己也惊讶其宽大的容忍和退让的思想。显然，过去几个月的生活对我发生了很大的作用，第一、我成熟了，第...
3	015.双枪少尉集、在那一连串苦斗的日子·1960年4月.txt	175	没有出息	我希望在回来以后能有很大的改变，犹如凤山六月是我生活上的分水岭一样，把旧日的生活以及其他完全隔开，这种想法是可笑的，自己也不晓得是怎样会发生的，自然不会实现，实则改变很少，甚至于完全没有改变，然而也就算了，并不感到失望或者不快，反而在许多不如意的事上，生出许多连自己也惊讶其宽大的容忍和退让的思想。显然，过去几个月的生活对我发生了很大的作用，第一、我成熟了，第...
3	015.双枪少尉集、在那一连串苦斗的日子·1960年4月.txt	199	舒伯特党	三、舒伯特与贝多芬同住一起，以太崇拜，不肯浪费其时间，故终生只相聚一次而未交语，其于贝氏死后之翌年死，遗嘱葬于贝之坟旁。所谓“舒伯特党”（Schuberttian）乃一群与其流浪之独身汉，集合于酒楼，随地而眠。舒三十一岁死。留六百歌摇及十交响乐。未曾买得起过风琴、钢琴，一直是到咖啡店及朋友借用的。
4	015.双枪少尉集、在那一连串苦斗的日子·1960年4月.txt	203	You Smile Upon Your Friend Today	五、晚饭后与步岳谈了一阵往史，步岳说我永远是快乐外溢，绝对看不出有那么辛酸史。我口才实在愈来愈妙了。为步岳解诗，忽见A. E. Housman (1859-1936)之“You Smile Upon Your Friend Today”，喜而以五言古诗译之：
4	015.双枪少尉集、在那一连串苦斗的日子·1960年4月.txt	457	舜日尧天	“舜日尧天”云云，中国人为文总忘不了捧当代也。自“历史之望远镜”观之（缩小其间距离），刘铭传等人为“明奸”也，而郑成功等人又为“元奸”也，文天祥等人又为“后周奸”也，兴亡成败，烈士忠奸，均作如是观。
4	015.双枪少尉集、在那一连串苦斗的日子·1960年4月.txt	457	历史之望远镜	“舜日尧天”云云，中国人为文总忘不了捧当代也。自“历史之望远镜”观之（缩小其间距离），刘铭传等人为“明奸”也，而郑成功等人又为“元奸”也，文天祥等人又为“后周奸”也，兴亡成败，烈士忠奸，均作如是观。
3	015.双枪少尉集、在那一连串苦斗的日子·1960年4月.txt	457	明奸	“舜日尧天”云云，中国人为文总忘不了捧当代也。自“历史之望远镜”观之（缩小其间距离），刘铭传等人为“明奸”也，而郑成功等人又为“元奸”也，文天祥等人又为“后周奸”也，兴亡成败，烈士忠奸，均作如是观。
4	015.双枪少尉集、在那一连串苦斗的日子·1960年4月.txt	479	Ilerrore dei Barbari	四、看世界先生的《霸王贵妃》（“Ilerrore dei Barbari”）只得一句：
6	015.双枪少尉集、在那一连串苦斗的日子·1960年4月.txt	519	合众国际社美国伊利诺州香宾9日电：因讲授性学而被撤职的一位大学教授，今天在他的两位门徒结婚典礼中，担任男傧相，他否认是一个主张滥爱的人。高区教授系因劝告学生们在婚前发生性关系，而于周四被伊利诺大学解聘。其后，约有一千五百名学生携带标语在校园内游行，向学校当局抗议，声称高区教授的解聘乃学术自由的死亡。	一、今日《联合报》：“合众国际社美国伊利诺州香宾9日电：因讲授性学而被撤职的一位大学教授，今天在他的两位门徒结婚典礼中，担任男傧相，他否认是一个主张滥爱的人。高区教授系因劝告学生们在婚前发生性关系，而于周四被伊利诺大学解聘。其后，约有一千五百名学生携带标语在校园内游行，向学校当局抗议，声称高区教授的解聘乃学术自由的死亡。”
5	015.双枪少尉集、在那一连串苦斗的日子·1960年4月.txt	653	想陈琪吧？我也想，怎么办？	（一）华民信，彼已做行政官：“想陈琪吧？我也想，怎么办？”
4	015.双枪少尉集、在那一连串苦斗的日子·1960年4月.txt	655	什么都没有，只是这么个丑丫头。	（二）施珂信，自报纸撕下速写“杰克琳莎莎儿”丑像一张：“什么都没有，只是这么个丑丫头。”
4	015.双枪少尉集、在那一连串苦斗的日子·1960年4月.txt	661	……听到些关于你营地生活的苦闷，我们相信你会征服寂寞和时间的。	（五）之昂片：“……听到些关于你营地生活的苦闷，我们相信你会征服寂寞和时间的。”
5	015.双枪少尉集、在那一连串苦斗的日子·1960年4月.txt	709	我看你忙一天，这样忙不成的，机器也要加油、休息呵！	六、曹梓华：“我看你忙一天，这样忙不成的，机器也要加油、休息呵！”他说他用半小时脑，就头痛了。
4	015.双枪少尉集、在那一连串苦斗的日子·1960年4月.txt	735	我现已痛下决心，埋头准备留学考试，盼望你也不要放松。	五、华俊来一片，限时报之。来片说：“我现已痛下决心，埋头准备留学考试，盼望你也不要放松。”
5	015.双枪少尉集、在那一连串苦斗的日子·1960年4月.txt	737	小便入池，大便入坑	六、文藻、鸿基、武杰三位副排长搬来，夜大便时文藻说我真正做到了“小便入池，大便入坑”的地步。
3	015.双枪少尉集、在那一连串苦斗的日子·1960年4月.txt	801	你笑——贼笑——什么？	七、今日明琳言：美大使馆考试，女人不会可一笑，而我们男人就不行了，“你笑——贼笑——什么？”
4	015.双枪少尉集、在那一连串苦斗的日子·1960年4月.txt	845	别的教官讲课，我都要睡觉，只有你讲课，我最高兴听，一点也不困了。	今天又是我开讲“地雷与诡雷”之日，上下午各两小时，累得满身大汗，元气消耗不少，可是收获也很多——这些老兵好像对我很着迷，多次鼓掌欢迎李教官，他们欢迎这位满口“生殖器”、“私窑子”、“欢喜佛”、“王八兔子”的“老百姓”，四小时中讲到地雷的大概加起来不到半小时，其余的时间，全是节外生枝借题发挥：例如从“坑道战”一扯扯到曾国荃打金陵，转而扯到太平军与女人的小脚；从...
4	015.双枪少尉集、在那一连串苦斗的日子·1960年4月.txt	845	我在别的教官上课时都在下面偷看小说，可是你今天却害得我没看成——你讲得太好了。	今天又是我开讲“地雷与诡雷”之日，上下午各两小时，累得满身大汗，元气消耗不少，可是收获也很多——这些老兵好像对我很着迷，多次鼓掌欢迎李教官，他们欢迎这位满口“生殖器”、“私窑子”、“欢喜佛”、“王八兔子”的“老百姓”，四小时中讲到地雷的大概加起来不到半小时，其余的时间，全是节外生枝借题发挥：例如从“坑道战”一扯扯到曾国荃打金陵，转而扯到太平军与女人的小脚；从...
4	015.双枪少尉集、在那一连串苦斗的日子·1960年4月.txt	849	七侠五义的史观	这里讲课最大的困难是程度上太大的悬殊，许多词汇与语句完全不是他们所能领悟的。他们生理年龄都有点过老，可是心理年龄又太年轻了，所以一不小心，他们便“听没有懂”，许多有味的故事与幽默，我都不能说，因为我想象到他们的水准与了解力可怜到什么程度，尤其是满脑袋“七侠五义的史观”，更是难以“交通”的。
3	015.双枪少尉集、在那一连串苦斗的日子·1960年4月.txt	849	听没有懂	这里讲课最大的困难是程度上太大的悬殊，许多词汇与语句完全不是他们所能领悟的。他们生理年龄都有点过老，可是心理年龄又太年轻了，所以一不小心，他们便“听没有懂”，许多有味的故事与幽默，我都不能说，因为我想象到他们的水准与了解力可怜到什么程度，尤其是满脑袋“七侠五义的史观”，更是难以“交通”的。
3	015.双枪少尉集、在那一连串苦斗的日子·1960年4月.txt	935	灵通消息	昨晚镇京来访，问及你的通讯处，我说许久没有你的消息，可能你的通讯处又变了，果然不出我所料，不过他可能还会把信寄到你的老通讯处去。他服务的单位不错，本月初高检还曾乘飞机回台湾一趟。我自到差以来一直忙碌得很，白天工作，晚上还应副团长之请教他英文，自己自修的时间非常少，不过这一周来已稍闲些，应《大学生活》杂志社社长之请，替他们《现代思潮》专号上写了一篇文章，题为：...
4	015.双枪少尉集、在那一连串苦斗的日子·1960年4月.txt	961	前天看到莫宜春，新电的头发，好像比以前美了点。	六、老太寄来背心及书，六小姐寄来五十元，并说：“前天看到莫宜春，新电的头发，好像比以前美了点。”
5	015.双枪少尉集、在那一连串苦斗的日子·1960年4月.txt	985	不声不响，埋头苦干	十二、周排附说我“最标准”，“不声不响，埋头苦干”，“贵官真有一套，讲历史名字，一个个记得清清楚楚的。”
4	015.双枪少尉集、在那一连串苦斗的日子·1960年4月.txt	985	贵官真有一套，讲历史名字，一个个记得清清楚楚的。	十二、周排附说我“最标准”，“不声不响，埋头苦干”，“贵官真有一套，讲历史名字，一个个记得清清楚楚的。”
5	015.双枪少尉集、在那一连串苦斗的日子·1960年4月.txt	995	求自由，解束缚	三、养鸭子不用食物，吃茅房的蛆足够了。大便时见蛆之奋斗，忽想到“求自由，解束缚”亦为动物（乃至植物）之本能之一，最明显的例子是钻破茧的蚕，是一个解除束缚的最恰当的例子。
3	015.双枪少尉集、在那一连串苦斗的日子·1960年4月.txt	999	刚才我们讲到……	五、整个下午是斥候，少将及副师长来参观，大队长讲课，半道插入“刚才我们讲到……”云云，殊令人发噱。在田里跑来跑去，与老兵们谈。
5	015.双枪少尉集、在那一连串苦斗的日子·1960年4月.txt	1003	小事不愿做，大事做不了	七、夜珂来，请其吃凤梨花生等，珂言“小事不愿做，大事做不了”。
6	015.双枪少尉集、在那一连串苦斗的日子·1960年4月.txt	1013	炮后喷火的七五山炮	一、要好好复习一下七五（罗列所谓“炮后喷火的七五山炮”）及六〇炮，真出了洋相就糟了！这回该向张宏谋“学习”了。
6	016.在那一连串苦斗的日子·1960年5月.txt	29	你的故事还有好多没有讲哪！	一、今早夹道欢送的场面甚动人，也真是大场面！有的战士叫着说：“你的故事还有好多没有讲哪！”梓华要送我，我却之，端纪以车来，九仙、开云为我背物，皆满头大汗，心甚不忍，发薪后当表示一点小意思。
5	016.在那一连串苦斗的日子·1960年5月.txt	87	一屁股上都是人，要负责任的	八、晚饭后与谢镜清谈（“一屁股上都是人，要负责任的”），步岳谈，始洪来看我两次。
4	016.在那一连串苦斗的日子·1960年5月.txt	119	李敖有心人也，在意志里生活，周身是力量。	十四、彦增来信：“李敖有心人也，在意志里生活，周身是力量。”彦增赞我意志，新汉来两信（附其一于后）亦和之。马戈信（附后）说彦增“他很佩服你”，此点深念之。
3	016.在那一连串苦斗的日子·1960年5月.txt	139	那女人悄悄地回到后面去了	至于题目，是很伤脑筋的，我曾想用“说媒”、“婚事”等，都觉不如意，最后采用了《未完的交易》，我的意思是、我只要读者们知道，发生了这么一件事，究竟那些人（包括那女人在内）是在开玩笑，还是在谈正经事，我并不想表示意见，而要读者们去想了。虽然我在文中：“那女人悄悄地回到后面去了”，可是并未成定局，我不想肯定这件交易究竟成功了没有，这样，用这个题目，就会使全篇读完后...
3	016.在那一连串苦斗的日子·1960年5月.txt	173	要什么？	“要什么？”女孩子走到他们旁边问。
3	016.在那一连串苦斗的日子·1960年5月.txt	175	你们要什么？	“你们要什么？”穿夹克的人说，看看旁的人。
3	016.在那一连串苦斗的日子·1960年5月.txt	179	就是她吗？	“就是她吗？”一个背窗而坐的瘦子问。
4	016.在那一连串苦斗的日子·1960年5月.txt	185	是的，她很美。	“是的，她很美。”
5	016.在那一连串苦斗的日子·1960年5月.txt	187	她的身材很好，	“她的身材很好，”另一个人说。
4	016.在那一连串苦斗的日子·1960年5月.txt	189	是的，	“是的，”瘦子说。“十八吋！”他说，做了一个手势。
3	016.在那一连串苦斗的日子·1960年5月.txt	189	十八吋！	“是的，”瘦子说。“十八吋！”他说，做了一个手势。
3	016.在那一连串苦斗的日子·1960年5月.txt	195	她卖吗？	“她卖吗？”瘦子又问。他们笑得更厉害了。
5	016.在那一连串苦斗的日子·1960年5月.txt	197	我不知道，	“我不知道，”穿夹克的人说，“我不知道。”
5	016.在那一连串苦斗的日子·1960年5月.txt	201	我不知道，	“我不知道，”穿夹克的说，“她看起来很干净。”
3	016.在那一连串苦斗的日子·1960年5月.txt	205	你要她吗？	“你要她吗？”
4	016.在那一连串苦斗的日子·1960年5月.txt	207	嗯，她的腰很细。	“嗯，她的腰很细。”
3	016.在那一连串苦斗的日子·1960年5月.txt	211	你有办法吗？	“你有办法吗？”
5	016.在那一连串苦斗的日子·1960年5月.txt	213	我不知道，	“我不知道，”穿夹克的人说，“我不知道她是不是卖，可是我想，她一定要嫁人的。”
4	016.在那一连串苦斗的日子·1960年5月.txt	213	我不知道她是不是卖，可是我想，她一定要嫁人的。	“我不知道，”穿夹克的人说，“我不知道她是不是卖，可是我想，她一定要嫁人的。”
4	016.在那一连串苦斗的日子·1960年5月.txt	217	是的，你可以和她结婚。	“是的，你可以和她结婚。”
4	016.在那一连串苦斗的日子·1960年5月.txt	225	我不是开玩笑，我想她一定要嫁人的。	“我不是开玩笑，我想她一定要嫁人的。”
3	016.在那一连串苦斗的日子·1960年5月.txt	227	你想那是可能的吗？	“你想那是可能的吗？”
4	016.在那一连串苦斗的日子·1960年5月.txt	229	我不知道穿夹克的说，“可是我们可以试一试，我认识那女孩子的母亲。	“我不知道穿夹克的说，“可是我们可以试一试，我认识那女孩子的母亲。”
3	016.在那一连串苦斗的日子·1960年5月.txt	233	你的母亲在吗？ 	“你的母亲在吗？ ”穿夹克的人问。
5	016.在那一连串苦斗的日子·1960年5月.txt	243	我不是老板娘，	“我不是老板娘，”女人说，“我只是在这里做事。”
4	016.在那一连串苦斗的日子·1960年5月.txt	245	好，你不是老板娘，那没有什么关系。	“好，你不是老板娘，那没有什么关系。”他说，指着那个瘦子，“这是我的朋友，他姓张。”
4	016.在那一连串苦斗的日子·1960年5月.txt	245	这是我的朋友，他姓张。	“好，你不是老板娘，那没有什么关系。”他说，指着那个瘦子，“这是我的朋友，他姓张。”
3	016.在那一连串苦斗的日子·1960年5月.txt	247	那是你的女儿吗？	“那是你的女儿吗？”姓张的问。
4	016.在那一连串苦斗的日子·1960年5月.txt	249	是的，她是我的女儿。	“是的，她是我的女儿。”女人说。
4	016.在那一连串苦斗的日子·1960年5月.txt	251	我的朋友看上了你的女儿穿夹克的说，“他看上了她。是吗？	“我的朋友看上了你的女儿穿夹克的说，“他看上了她。是吗？”
5	016.在那一连串苦斗的日子·1960年5月.txt	255	许多人都看上了她，	“许多人都看上了她，”女人说，得意地笑着，“她很漂亮，是不是？”“是的，她很漂亮。”
5	016.在那一连串苦斗的日子·1960年5月.txt	255	她很漂亮，是不是？	“许多人都看上了她，”女人说，得意地笑着，“她很漂亮，是不是？”“是的，她很漂亮。”
4	016.在那一连串苦斗的日子·1960年5月.txt	255	是的，她很漂亮。	“许多人都看上了她，”女人说，得意地笑着，“她很漂亮，是不是？”“是的，她很漂亮。”
3	016.在那一连串苦斗的日子·1960年5月.txt	257	他结过婚？	“他结过婚？”女人又问。
3	016.在那一连串苦斗的日子·1960年5月.txt	259	你结过婚吗？	“你结过婚吗？”穿夹克的问。
4	016.在那一连串苦斗的日子·1960年5月.txt	261	没有，	“没有，”姓张的说，“我没有结过婚。”
4	016.在那一连串苦斗的日子·1960年5月.txt	263	是的，我知道，他没有结过婚。	“是的，我知道，他没有结过婚。”
5	016.在那一连串苦斗的日子·1960年5月.txt	265	很好，她是你的了，	“很好，她是你的了，”女人说，“你出五万块钱，我不再要别的。”她说：“是的，你拿五万块钱，她就是你的了，我不要别的，我喜欢简简单单的。”
4	016.在那一连串苦斗的日子·1960年5月.txt	265	你出五万块钱，我不再要别的。	“很好，她是你的了，”女人说，“你出五万块钱，我不再要别的。”她说：“是的，你拿五万块钱，她就是你的了，我不要别的，我喜欢简简单单的。”
4	016.在那一连串苦斗的日子·1960年5月.txt	265	是的，你拿五万块钱，她就是你的了，我不要别的，我喜欢简简单单的。	“很好，她是你的了，”女人说，“你出五万块钱，我不再要别的。”她说：“是的，你拿五万块钱，她就是你的了，我不要别的，我喜欢简简单单的。”
5	016.在那一连串苦斗的日子·1960年5月.txt	267	不算多，	“不算多，”穿夹克的人说，“五万块钱不算多，是吗？”
5	016.在那一连串苦斗的日子·1960年5月.txt	267	五万块钱不算多，是吗？	“不算多，”穿夹克的人说，“五万块钱不算多，是吗？”
4	016.在那一连串苦斗的日子·1960年5月.txt	269	是的，不算多。	“是的，不算多。”姓张的说。
4	016.在那一连串苦斗的日子·1960年5月.txt	271	我的朋友认为五万块钱不算多，可是他没有五万块钱。	“我的朋友认为五万块钱不算多，可是他没有五万块钱。”
5	016.在那一连串苦斗的日子·1960年5月.txt	273	她是我的亲生女儿，不是养女，你知道，	“她是我的亲生女儿，不是养女，你知道，”女人说，“我养了她十七年，而且，她很可爱、很会做事。”
4	016.在那一连串苦斗的日子·1960年5月.txt	273	我养了她十七年，而且，她很可爱、很会做事。	“她是我的亲生女儿，不是养女，你知道，”女人说，“我养了她十七年，而且，她很可爱、很会做事。”
5	016.在那一连串苦斗的日子·1960年5月.txt	275	我知道，	“我知道，”穿夹克的人说可是我的朋友没有五万块钱。”
5	016.在那一连串苦斗的日子·1960年5月.txt	277	让我想想看，	“让我想想看，”女人说，“让我想想看。”
5	016.在那一连串苦斗的日子·1960年5月.txt	279	你应该想一想，	“你应该想一想，”穿夹克的说，“我的朋友爱上了你的女儿，可是他没有五万块钱。”
4	016.在那一连串苦斗的日子·1960年5月.txt	279	我的朋友爱上了你的女儿，可是他没有五万块钱。	“你应该想一想，”穿夹克的说，“我的朋友爱上了你的女儿，可是他没有五万块钱。”
3	016.在那一连串苦斗的日子·1960年5月.txt	281	他读过书吗？ 	“他读过书吗？ ”女人问。
3	016.在那一连串苦斗的日子·1960年5月.txt	283	你读过书吗？	“你读过书吗？”
5	016.在那一连串苦斗的日子·1960年5月.txt	287	他读过书，	“他读过书，”穿夹克的说，“我的朋友读过书。”
5	016.在那一连串苦斗的日子·1960年5月.txt	289	那就好办了，	“那就好办了，”女人说：“我们都希望她能嫁个读书人，我们家里从来没有人读过书。”
4	016.在那一连串苦斗的日子·1960年5月.txt	289	我们都希望她能嫁个读书人，我们家里从来没有人读过书。	“那就好办了，”女人说：“我们都希望她能嫁个读书人，我们家里从来没有人读过书。”
4	016.在那一连串苦斗的日子·1960年5月.txt	291	我的朋友读过书，他读过两年。	“我的朋友读过书，他读过两年。”
4	016.在那一连串苦斗的日子·1960年5月.txt	295	是的，他读过国民学校。	“是的，他读过国民学校。”
3	016.在那一连串苦斗的日子·1960年5月.txt	297	你会记账吗？ 	“你会记账吗？ ”女人问。
4	016.在那一连串苦斗的日子·1960年5月.txt	299	我会，我可以读报纸，可以开一家小店铺当老板。	“我会，我可以读报纸，可以开一家小店铺当老板。”
4	016.在那一连串苦斗的日子·1960年5月.txt	301	好吧，我减少一万元。	“好吧，我减少一万元。”
3	016.在那一连串苦斗的日子·1960年5月.txt	303	你有四万块钱吗？	“那就只有四万块钱了。”穿夹克的人说，“你有四万块钱吗？”
5	016.在那一连串苦斗的日子·1960年5月.txt	305	我没有，	“我没有，”姓张的说，“可是我读过中学。”
5	016.在那一连串苦斗的日子·1960年5月.txt	307	那就是说，你可以到银行里去做职员？	“你读过中学？”女人说，“那就是说，你可以到银行里去做职员？”
3	016.在那一连串苦斗的日子·1960年5月.txt	307	你读过中学？	“你读过中学？”女人说，“那就是说，你可以到银行里去做职员？”
5	016.在那一连串苦斗的日子·1960年5月.txt	311	两万块，	“两万块，”女人说，“我只要你两万块，不能再少了。”
4	016.在那一连串苦斗的日子·1960年5月.txt	311	我只要你两万块，不能再少了。	“两万块，”女人说，“我只要你两万块，不能再少了。”
3	016.在那一连串苦斗的日子·1960年5月.txt	313	你要她吗？	“你要她吗？”穿夹克的问。
4	016.在那一连串苦斗的日子·1960年5月.txt	315	我要，可是我仍旧没有两万块钱。	“我要，可是我仍旧没有两万块钱。”
5	016.在那一连串苦斗的日子·1960年5月.txt	317	说实话，	“说实话，”穿夹克的人对那女人说，“我的朋友连两万元都没有，可是他却实实在在是一位医学院的毕业生！”
5	016.在那一连串苦斗的日子·1960年5月.txt	317	我的朋友连两万元都没有，可是他却实实在在是一位医学院的毕业生！	“说实话，”穿夹克的人对那女人说，“我的朋友连两万元都没有，可是他却实实在在是一位医学院的毕业生！”
3	016.在那一连串苦斗的日子·1960年5月.txt	319	你是说他是一位医生？	“你是说他是一位医生？”女人有些惊喜了。
