score	file	line	text	context
6	005.1959年5月.txt	117	这是神父吗？	三、下午与景、庄、陈作碧潭游，我大划船，技最高。人看我黑长袍，曰：“又一个神父。”与“这是神父吗？”
3	005.1959年5月.txt	117	又一个神父。	三、下午与景、庄、陈作碧潭游，我大划船，技最高。人看我黑长袍，曰：“又一个神父。”与“这是神父吗？”
4	005.1959年5月.txt	205	由你奸似鬼，喝了老娘洗脚水。	注：《水浒传》中孙二娘对武松说：“由你奸似鬼，喝了老娘洗脚水。”
5	005.1959年5月.txt	235	我也不是和尚或圣人，动动凡心有何不可？	（三）“我也不是和尚或圣人，动动凡心有何不可？”
3	005.1959年5月.txt	237	把握现在而不要有目的，高兴什么就干什么。失去现在乃是太可惜的事，将来是无法把握的，何必为将来事发狂？	（四）“把握现在而不要有目的，高兴什么就干什么。失去现在乃是太可惜的事，将来是无法把握的，何必为将来事发狂？”
4	005.1959年5月.txt	251	一个女人之爱一个男人，只是因为她不愿别人得到他。	四、美剧作家田纳西：“一个女人之爱一个男人，只是因为她不愿别人得到他。”
4	005.1959年5月.txt	269	冲你写的字，就该请客。	五、午前“蓝衣党”程徐王看我日记中自赞那一页，她们说：“冲你写的字，就该请客。”
7	005.1959年5月.txt	271	‘朋友沙子论’的倡导者,竟然是朋友中最热情、黏性最大的人	六、老马又来信谓“‘朋友沙子论’的倡导者,竟然是朋友中最热情、黏性最大的人”，此岂逻辑八股所谓“最冷酷和最热情的是最相近”也耶？
5	005.1959年5月.txt	271	最冷酷和最热情的是最相近	六、老马又来信谓“‘朋友沙子论’的倡导者,竟然是朋友中最热情、黏性最大的人”，此岂逻辑八股所谓“最冷酷和最热情的是最相近”也耶？
3	005.1959年5月.txt	303	此时彼落	二、夜4时叫赖、许二小鬼起床，我则开始睡，“此时彼落”一词，可得一新解。
3	005.1959年5月.txt	309	敖兄教正弟黄祝贵敬赠	二、夜黄祝贵送来《匈牙利的十月革命》，上写：“敖兄教正弟黄祝贵敬赠”。太客气了！
5	005.1959年5月.txt	377	勇于生、勇于死	一、艾克言杜勒斯“勇于生、勇于死”。
5	005.1959年5月.txt	387	我目前这种工作、这种态度和作风，是不是有助于我未来的大成就呢？	三、由于吴相湘找萧、王之事，想到我将来到底要变成一个什么样的一个人？一类人？以我的性情、才具、胆量，实在是一个介乎文学——学术——政治之间的人物，而我对我自己的期望，也是如此的，所以目前的我，实在应该时常反问：“我目前这种工作、这种态度和作风，是不是有助于我未来的大成就呢？”
4	006.1959年6月.txt	61	不能为竖子所欺	三、像古人那样“不能为竖子所欺”的态度极好，极可广而法之。
5	006.1959年6月.txt	73	男人有的还是好的，女人却全是坏的！	五、下午与彦增、祝泰、庄因看Cat on the Hot Tin Roof，坚拒彦增请我。看出来我说：“男人有的还是好的，女人却全是坏的！”
4	006.1959年6月.txt	95	之乎者也	〔本报讯〕由于受一位小姐委托征求伴侣，使妇联会副总干事吕锦花，这几日为自四面八方像雪片飞来的应征信件，弄得头昏脑胀。吕锦花已将所收到的好几百封应征信，分别交给这位应征的黄小姐。据悉：这许多应征信件中，包括大学助教、小学教员、大专学生、青年军官、民意代表、商人等都有。其中以公务员最多，还有一位邮局局长。有人信中附了近万字的自传，满纸“之乎者也”；有人热情的一开...
4	006.1959年6月.txt	95	亲爱的黄小姐	〔本报讯〕由于受一位小姐委托征求伴侣，使妇联会副总干事吕锦花，这几日为自四面八方像雪片飞来的应征信件，弄得头昏脑胀。吕锦花已将所收到的好几百封应征信，分别交给这位应征的黄小姐。据悉：这许多应征信件中，包括大学助教、小学教员、大专学生、青年军官、民意代表、商人等都有。其中以公务员最多，还有一位邮局局长。有人信中附了近万字的自传，满纸“之乎者也”；有人热情的一开...
4	006.1959年6月.txt	95	有大丈夫气概	〔本报讯〕由于受一位小姐委托征求伴侣，使妇联会副总干事吕锦花，这几日为自四面八方像雪片飞来的应征信件，弄得头昏脑胀。吕锦花已将所收到的好几百封应征信，分别交给这位应征的黄小姐。据悉：这许多应征信件中，包括大学助教、小学教员、大专学生、青年军官、民意代表、商人等都有。其中以公务员最多，还有一位邮局局长。有人信中附了近万字的自传，满纸“之乎者也”；有人热情的一开...
3	006.1959年6月.txt	97	吕锦花现在希望各方热情的男士，如果自认没有真要找太太的把握，还是不要再写信去了，因为目前应征的人太多，已使得这位黄小姐很感不好处理呢。	“吕锦花现在希望各方热情的男士，如果自认没有真要找太太的把握，还是不要再写信去了，因为目前应征的人太多，已使得这位黄小姐很感不好处理呢。”
4	006.1959年6月.txt	197	李敖太厉害了、可怕了，不敢惹他。	四、万国戏院前，显堂言与谭凝晖曾谈及我，谭言：“李敖太厉害了、可怕了，不敢惹他。”
6	006.1959年6月.txt	217	装出胡适的派头呀！	一、上午陈淑平为摄一影，Bonnie言：“装出胡适的派头呀！”
3	006.1959年6月.txt	223	样子好	一、中午三轮车夫马先生言其五十余岁，为清时人，看不惯洋派青年，最佩服我“样子好”，长衫保存固有文化云乎？
3	006.1959年6月.txt	249	为什么挡住不见？	三、十点半在T门口见Bonnie、黄、王、程。Bonnie问：“为什么挡住不见？”我说：“不敢看你们。”Bonnie送我一只李子，黄亦送一个，我索淑平拍的我的照片，程言照得很好。Bonnie等索我毕业照，她说她的18号给我。
4	006.1959年6月.txt	361	又开风气又为师	四、“又开风气又为师”。此周前旧句也。
3	006.1959年6月.txt	367	公文	二、夜写成“公文”及四句一韵打油诗卡片。
4	006.1959年6月.txt	373	张曼见索李敖二十四岁生日造像，1959年台大毕业前三日题以赠之。	一、“张曼见索李敖二十四岁生日造像，1959年台大毕业前三日题以赠之。”
7	006.1959年6月.txt	401	不对，她今天不像李丽华，而是李丽华今天像她。	二、Bonnie看见我穿黑长袍，叫我是“算命先生”，并说非常喜欢我送给她的诗。天中说她今天很像李丽华，我说：“不对，她今天不像李丽华，而是李丽华今天像她。”Bonnie听了我的“谄媚”，非常开心。她把她的妈妈、妹妹都介绍给我，并向我做了一个鬼脸。Bonnie今天最动人，Rosa以下皆不足论矣！Rosa穿高跟鞋极难看，Y笑极难看。
4	006.1959年6月.txt	401	算命先生	二、Bonnie看见我穿黑长袍，叫我是“算命先生”，并说非常喜欢我送给她的诗。天中说她今天很像李丽华，我说：“不对，她今天不像李丽华，而是李丽华今天像她。”Bonnie听了我的“谄媚”，非常开心。她把她的妈妈、妹妹都介绍给我，并向我做了一个鬼脸。Bonnie今天最动人，Rosa以下皆不足论矣！Rosa穿高跟鞋极难看，Y笑极难看。
8	006.1959年6月.txt	405	潇洒，样子好玩	四、傍晚6时本系先照相于校园，夏德仪仔细打量我的袍子，然后说：“你比我还顽固！”吴俊才言我文章及报告“写得好不错”，人“潇洒，样子好玩”。后集体坐校车赴玉楼东。查良钊致词言：“青山常在，绿水常流，他年相见，后会有期。”沈刚伯言黄兴叩头谢师而革老师之命。钱思亮又与我小谈。我开劳榦玩笑一次。今晚喝酒近十五杯。凤翰、维运把我送归。
7	006.1959年6月.txt	405	青山常在，绿水常流，他年相见，后会有期。	四、傍晚6时本系先照相于校园，夏德仪仔细打量我的袍子，然后说：“你比我还顽固！”吴俊才言我文章及报告“写得好不错”，人“潇洒，样子好玩”。后集体坐校车赴玉楼东。查良钊致词言：“青山常在，绿水常流，他年相见，后会有期。”沈刚伯言黄兴叩头谢师而革老师之命。钱思亮又与我小谈。我开劳榦玩笑一次。今晚喝酒近十五杯。凤翰、维运把我送归。
6	006.1959年6月.txt	405	你比我还顽固！	四、傍晚6时本系先照相于校园，夏德仪仔细打量我的袍子，然后说：“你比我还顽固！”吴俊才言我文章及报告“写得好不错”，人“潇洒，样子好玩”。后集体坐校车赴玉楼东。查良钊致词言：“青山常在，绿水常流，他年相见，后会有期。”沈刚伯言黄兴叩头谢师而革老师之命。钱思亮又与我小谈。我开劳榦玩笑一次。今晚喝酒近十五杯。凤翰、维运把我送归。
3	006.1959年6月.txt	405	写得好不错	四、傍晚6时本系先照相于校园，夏德仪仔细打量我的袍子，然后说：“你比我还顽固！”吴俊才言我文章及报告“写得好不错”，人“潇洒，样子好玩”。后集体坐校车赴玉楼东。查良钊致词言：“青山常在，绿水常流，他年相见，后会有期。”沈刚伯言黄兴叩头谢师而革老师之命。钱思亮又与我小谈。我开劳榦玩笑一次。今晚喝酒近十五杯。凤翰、维运把我送归。
7	006.1959年6月.txt	407	李敖，快分手了，以后恐怕很难见到了，我对你要说几句话，这些话可说是直言，是别人不肯说的，我生平最讨厌最恨没喝醉酒而装醉的人，就是你！	五、今晚谢师宴时，Bonnie走过来对我说：“李敖，快分手了，以后恐怕很难见到了，我对你要说几句话，这些话可说是直言，是别人不肯说的，我生平最讨厌最恨没喝醉酒而装醉的人，就是你！”
3	006.1959年6月.txt	483	李敖在这方面是教主	四、前两天华昌平说恋爱一道“李敖在这方面是教主”。
4	006.1959年6月.txt	485	我开始恨女人了，全部否定了，做一个好汉吧，没有女人（的生活）又算得了什么？	五、夜与马戈作弹子戏，并谈于新兴，深觉要有大野心、大英雄色彩，下午我曾写道：“我开始恨女人了，全部否定了，做一个好汉吧，没有女人（的生活）又算得了什么？”
3	006.1959年6月.txt	519	李敖考不取研究所！	一、听说李玄伯对人说：“李敖考不取研究所！”
4	006.1959年6月.txt	549	中国地质学会	四、地质系讲师张凤栖托启庆送我胡适演说稿《历史科学的方法》油印本一册。这是胡适在1958年4月26日在台北“中国地质学会”1958年度年会的演说记录，也是我在大学第一次听胡适演说。演说后，姚从吾特别为我介绍，胡适立约我去聊聊。当天我们就在钱思亮家里，大聊一阵。
3	007.1959年7月.txt	7	大凡处世，当有几分担当，不可每为外事所动……要达观、要坚强，尤当练习在任何心绪下皆不志衰气沮。	二、勉华俊信：“大凡处世，当有几分担当，不可每为外事所动……要达观、要坚强，尤当练习在任何心绪下皆不志衰气沮。”如是每日皆无留牍甚好。
3	007.1959年7月.txt	13	打击宪法上保护的自由的基本	〔合众国际社华盛顿29日电〕美国最高法院宣告纽约对《查泰莱夫人之恋人》一影片之禁演为无效。它说：该州“打击宪法上保护的自由的基本”。
3	007.1959年7月.txt	15	纽约所已作的……是因为该影片倡导一项见解——即在某种情形下的通奸，可能是正当的行为——而禁止该片之上演。但是宪法第一修正案的基本保证，是对倡导见解的自由而作的。	法官史徒华代表该法院说：“纽约所已作的……是因为该影片倡导一项见解——即在某种情形下的通奸，可能是正当的行为——而禁止该片之上演。但是宪法第一修正案的基本保证，是对倡导见解的自由而作的。”
4	007.1959年7月.txt	205	君若在何不寄余生	七、老马下午来，作绝联：“君若在何不寄余生”。此联双关语实无法续也。
3	007.1959年7月.txt	207	感激驰驱所以报知遇之隆	八、孔明那种“感激驰驱所以报知遇之隆”的精神。
4	007.1959年7月.txt	313	有的朋友认识他可有可无；有的朋友认识他就是一种不幸。	三、与英善言：“有的朋友认识他可有可无；有的朋友认识他就是一种不幸。”
3	007.1959年7月.txt	361	他看中你了！	二、赴善导寺，子宽先生三次返室送书六册，善培说：“他看中你了！”
4	007.1959年7月.txt	391	你把你的资料供给我，我要写一篇关于研究你的论文。	二、华昌平说：“你把你的资料供给我，我要写一篇关于研究你的论文。”
5	009.给钱思亮校长的一封公开信.txt	9	因为学校腐化，不高兴再念，而自动休学	离开台大后，外面传说我是因为骂学校而被开除的，我每听到这类说法，就立刻加以解释，我不但说我是“因为学校腐化，不高兴再念，而自动休学”，并且还指出：“钱思亮、沈刚伯诸君还没有那样坏或有那样胆量——敢开除李敖。他们曾警告两个私下里写信建议的学生，却不敢碰一下我这个公开写文章攻击他们的学生——这就是他们的公平和胆量！”
3	009.给钱思亮校长的一封公开信.txt	9	钱思亮、沈刚伯诸君还没有那样坏或有那样胆量——敢开除李敖。他们曾警告两个私下里写信建议的学生，却不敢碰一下我这个公开写文章攻击他们的学生——这就是他们的公平和胆量！	离开台大后，外面传说我是因为骂学校而被开除的，我每听到这类说法，就立刻加以解释，我不但说我是“因为学校腐化，不高兴再念，而自动休学”，并且还指出：“钱思亮、沈刚伯诸君还没有那样坏或有那样胆量——敢开除李敖。他们曾警告两个私下里写信建议的学生，却不敢碰一下我这个公开写文章攻击他们的学生——这就是他们的公平和胆量！”
4	009.给钱思亮校长的一封公开信.txt	31	校外人士	看了这封所谓“敬复”的信，我才完完全全明白：我的母校的确公然的在帮助“校外人士”打击自己学生——的确明目张胆的作了愚蠢而阴险的伪证！