file	line	context
019.“道统”梦碎.txt	21	现在国家到了这样危急的情况，我们用什么方法可以把它挽救过来，完成我们的革命，使中华民族复兴起来呢？我很简单忠实的说，只有大家相信三民主义，而且要实行三民主义，就可挽救危亡。因此，我们要问：三民主义是怎样发生出来的？它的思想之渊源以及它的根本精神是在什么地方？简单的讲一句，它的思想渊源，就是继承中国从古以来——尧、舜、禹、汤、文、武、周公、孔子一脉相承所流传下来的道统，它的根本精神，就是要用中华民族固有的精神来领导革命，复兴民族。关于这一点，在从前共产党时代，共产党必当这句话是一种封建思想，且以把总理为偶像化这点来批评我们，殊不知共产党别有鬼胎，所最怕的就在此点。我记得总理与苏俄代表见面时，当时他第一句话，就问总理：“你的革命哲学的基础是什么？”总理回答说：“我们中国有一个传统的精神，就是尧、舜、禹、汤、文、武、周公、孔子所遗传下的固有道统，我就是继承这尧、舜、禹、汤、文、武、周公、孔子以来的道统，这就是中国民族固有的精神。”我们政治学校的学生，是总理的信徒、是革命党的正统，我们要明白这个道理，这就是三民主义所从而发源的——三民主义即尧、舜、禹、汤、文、武、周公、孔子所留传的大道，亦就是中国政治、伦理、哲学的基础，就是要以中国...
019.“道统”梦碎.txt	23	两年以后蒋介石这段话，出现了两个最令我们注意的不同：第一、原来没有道统的字眼，现在出现了；第二、原来说“自尧、舜、禹、汤、文、武、周公、孔子而绝”，但是现在不提“而绝”了。
019.“道统”梦碎.txt	27	但是我们还要知道，总理绝不是凭空创造出来的，这个三民主义是有所本的，其渊源所自，早在总理以前，与我中华民族之历史的生命同流发展，不过到了总理手里，才拿这个东西重新整理，构成一部完善的思想体系，就叫三民主义。这个主义虽是最新的，而其本质和基本精神之所在，却完全是由我们历史文化的正统，历数千年一直传下来的。这个意思，总理在生时已经自己说明过的，我们只要将总理对苏俄代表马林所讲几句话，复按一下，就可以明白我们总理的学问、总理的思想、总理的道德和总理的革命主义，完全继承中国五千年来历史文化的正统。当时苏俄代表问总理：“你革命的哲学基础的出发点，在什么地方？你的革命主义由什么地方发生出来的？”总理当时告诉他：“我们中国有一个立国的精神，有一个自尧、舜、禹、汤、文、武、周公、孔子数千年来历圣相传的正统思想，这个就是我们中华民族的道统；我的革命思想、革命主义，就是从这个道统遗传下来的。我现在就是要继承我们中华民族的道统，就是要继续发扬我们中华民族历代祖宗遗传下来的正统精神。”大家由总理这一段话，就可以明白我们总理的三民主义的基本精神，就是中国固有历史文化的结晶，和民族美德的遗传，亦即是民族的精神，和国家的灵魂之所在。现在我们革命，就是要复...
019.“道统”梦碎.txt	31	我们更要知道，总理的基本思想，渊源于中国正统的政治思想和伦理思想。总理既认定了“民生”为历史的中心，便根据这个思想，指出我国固有的“天下为公”的思想，为改造社会的基本法则，与实行革命的最高理想。因为人类的生存最大保障，是在全体的生存，不在部分的或个人的发展。总理继承了中国固有的正统思想，认定利他是革命的本务，仁爱是救世的基本，利他和仁爱的极则，无过于天下为公。这张表上“民生哲学”下面这个“公”字，就是天下为公的“公”字。《礼记》礼运篇说：“大道之行也，天下为公，选贤与能，讲信修睦。故人不独亲其亲，不独子其子，使老有所终、壮有所用、幼有所长、矜寡孤独废疾者皆有所养，男有分，女有归。货恶其弃于地也，不必藏于己；力恶其不出于身也，不必为己。是故谋闭而不兴，盗窃乱赃而不作，故外户而不闭，是谓大同。”这实在是我们中国一种最完美、最高尚的政治思想和伦理思想，总理生平遇到什么人请他题字的时候，一提笔总是写这几句话。可以说，这几句话，就是总理在实行革命中的最高理想。惟其如此，所以他创造的三民主义，是以民生哲学为基础，是以人类全体幸福为依归，而终结理想，是“世界大同”。我记得民国十年，总理在桂林，共产党第三国际有个代表马林（瑞典人）曾经问过他...
019.“道统”梦碎.txt	33	这段话跟蒋介石最早的引文，最令我们注意的不同是：原引“国父”说的“尧、舜、禹、汤、文、武、周公、孔子而绝”，现在不但不提“而绝”了，并且出现了“相继不绝”的字样！
019.“道统”梦碎.txt	37	马林居桂林三日，两次晋谒先生。并建议改组国民党与中国共产党合作。先生未予具体答覆。马林问先生曰：“先生革命之基础为何？”先生答曰：“中国有一道统，尧、舜、禹、汤、文、武、周公、孔子相继不绝。余之思想基础，即承此道统，而发扬光大耳。”马林不解其意，再询先生，先生所答者依然如此。
020.“学统”梦碎.txt	3	自来搞政治的人和搞学术的人，是两种人。搞政治的人不碰学术，有的是没工夫；有的是刘邦式的“安事诗书”（翻成白话：“谁他妈的要看书呢！”），看不起学术；有的是心存敬意，敬而远之；有的却是附庸风雅。最后一种最要命，因为一附庸风雅，就会对学术亲自去碰，一碰学术就完了。
020.“学统”梦碎.txt	5	中国传统中“政统”和“学统”大体成双轨演化着，搞政治的人不太附庸风雅，国民党在打天下的时候，也是如此。国民党至多只是控制学术机构，但不敢控制学术，也无此妄想。但到台湾以后，地小人稠，闲来无事，居然殃及学术，研究院、研究所、研究中心、大学等等，纷纷渗入了党团与党棍，他们也要写论文了、也要办学报了、也要召开或参加学术会议了，但天知道这是什么“学术”！几十年来，学术已是一片焚琴煮鹤的大锅炒！学术何辜！呜呼学术！
020.“学统”梦碎.txt	11	谈“学统”，为什么要提徐复观呢？因为他是撮合此道最热心的人。国民党搞“学统”，最早见于中山大学、中央大学、政治大学，虽然志在夺权，但还知所收敛。到台湾后，就大动手脚了，演化出台湾社会中没有了“学格”。
021.《宪法》梦碎.txt	3	国民党自称是革命政党，它革人的命，定了三阶段，即所谓军政、训政、宪政。国民党北伐过后，结束军政，自1929年3月27日宣布开始训政，同年6月15日又宣布“训政时期规定为6年，至民国二十四年完成”。换句话说，就是1935年3月27日结束训政。但是，到了1935年3月27日以后，国民党却训上瘾来了，不肯结束一党专政。于是，“党外无党”的度量又延续下来——国民党说了不算了！
021.《宪法》梦碎.txt	19	所谓遁甲术，就是有一种高人，不论你怎么用绳子捆他、用索子锁他，他都能口中念念有词，使绳索尽解，然后脱身而出。你的绳索，对他完全没有作用。他还是他，你以为你整住了他，其实全没这回事，他是不受你整的——他是高人！
021.《宪法》梦碎.txt	45	这种滑稽，就活像一个人移情别恋，但怕背弃妻别娶的恶名，于是就另讨姨太太一样。讨姨太太的好处是不背恶名于发妻元配，名义上尊重大老婆，骨子里却是架空大老婆。国民党所谓不修宪，却去订临时条款，无异把宪法大老婆化。而帮助国民党订临时条款、修临时条款的人，无异就是帮国民党讨姨太太的皮条客了，这还用说吗？
021.《宪法》梦碎.txt	61	由此可见，修临时条款的原因，是“违宪行为”非所乐见，但既然国民党御用大法官兼宪法学者都承认临时条款乃“实质意义之宪法”、乃“我国之战时宪法”，则在逻辑上与事实上，“有损宪法尊严”，也就怎么也赖不掉了。临时条款是个什么东西、修临时条款用意何在，也就大家哑口了。所谓哑口，一方面是“哑巴吃黄连──有苦说不出”；一方面是“哑巴吃元宵──心里有数”，呜呼《宪法》，就如此这般了！
023.“遗教”梦碎.txt	3	《中华民国宪法》劈头就说“依据孙中山先生创立中华民国之遗教”，“制定本宪法”，但是搬出“本宪法”与遗教一对照，便发现抵触丛生。乍看起来，定章分节，全是遗教的外壳，从第3章国民大会，到第11章地方制度，无一不《五权宪法》也；但实际上，从第3章国民大会起，就大干一票，只师遗教之词、而不师其意了。第25条先打了国民大会职权的折扣、第27条又剥夺了国民大会一大部分政权、第28条、第29条使国大代表6年开会一次，无从行使政权、参与中央政事。到了第4章总统，从第35条到第52条，共有18条，但是除了第44条总统得召集各院院长会商解决争执外，其他17条，全部与遗教不相干。第5章至第9章五院出现了，在行政院部分，第55条：“行政院院长由总统提名，经立法院同意任命之。”但按《五权宪法》，任命五院院长之同意权，在国民大会，根本不在立法院或其他各院；第56条：“行政院副院长、各部会首长及不管部会之政务委员，由行政院院长提请总统任命之。”但按《建国大纲》，任命这些官吏之选举权，在国民大会，根本不在行政院院长或总统手中。第57条：“行政院依左列规定，对立法院负责。”则是内阁制了，根本不是五院制。在立法院部分，第62条、第65条、第66条、第68条、第...
024.“政体”梦碎.txt	21	牺牲“内阁制”来夺权，此道不止国民党的李登辉，也不止于民进党的邱义仁。所谓《宪法》学者李鸿禧之流，皆曲学阿世，露出了尾巴，这个岛大法荡然，正坐此辈。拿“总统制”、“内阁制”的“政体”开玩笑，祸延子孙矣。
025.“民主”梦碎.txt	7	民进党在政党属性上，我们看来看去，看不出它的“反革命”反在哪里。党章也、党旗也、党徽也、中央党部也、县市党部也、乡镇市区党部也、特种党部也、中央执委会也、党主席也、中央执行委员也、中央常务执行委员也、中央评委会也、中央评议委员也、中央常务评议委员也、入党介绍人也、填表也、宣誓也、缴纳党费也、颁发党证也、全国党员代表大会也、县市党员大会也、乡镇市区党员大会也、中央党部秘书长副秘书长也、本党内规也、纪律及仲裁也、警告也、公开谴责也、留党察看也、开除党籍（除名）也……种种种种，无一不是乙式政党的模子，并且青出于蓝之。试看英美式民主政党政治中，参加政党，乃人民参政权的一种，任何政党无权限制人民加入它，但民进党入党条件却门槛在兹：入党要党中大亨介绍、工作委员引进，久而久之，其结果可想而知，一方面陷入封闭性而不能成其大，一方面助长山头性、人头性而适见其小。美国人想要成为民主党员或共和党员或其他党党员，只消有同一政治理想，就可以自认是哪党党员，除了登记一下，并无其他条件，正所谓“我欲党，斯党至矣！”这种柔性政党的良法美意，岂不正值得民进党去学？但民进党却缺乏开党气象，一开始就小鼻子小眼，露了相。台湾几十年没有一个反对党，如今好不容易有了一...
026.“党争”梦碎.txt	23	民进党占了大便宜。原来国民党大员戴传贤，早在1944年就说过：“周朝的天下是800年，国民党至少要掌握政权1000年！”人们虽已等了七八十年、五六十年、三四十年，可是用1000年一减，即使寿比800岁的彭祖、寿比930岁的亚当（Adam）、寿比950岁的拉麦（Lamech）、寿比969岁的玛士撒拉（Methuselah），也还是空等一场，到头来还是要听《秋水伊人》之歌，与国民党周旋不已！
027.民进党为国民党护航的一个例子.txt	15	李委员敖：主席、各位列席官员、各位同仁。本席要先向主席表达我的基本立场。中国有一句古话：“豺狼当道，安问狐狸？”真正的大问题没有解决，解决小问题是没有意义的。我讲过，为什么卖房子、卖地，基本上就是为了军购。因为钱不够，要把钱给美国人。基本问题在这个地方。基本问题不解决，预算统统冻结。我要逐条反对，统统反对！
027.民进党为国民党护航的一个例子.txt	33	李委员敖：主席、各位列席官员、各位同仁。本席认为必须厘清基本形态，孟子曾经说过医生喜欢把人看活，而卖棺材者总是喜欢人家死亡，职业绝对会影响人的想法和性格，本席认为，今天问题并不在于总政治作战局这位将军要记小过或记大过，这位职业军人目前在国防部总政治作战局服务，请问全世界有哪个民主国家的国防部设立总政治作战部或总政治作战局？都没有，只有共产国家才设立类似的单位，国民党学共产党政治作战的形态，在国防部下设立总政治作战部，目前缩小为总政治作战局，过去这个单位一向跟着政策走，浇你冷水，扯你后腿、和你捣蛋，它们之所以能在这个圈子里做这些事情，就是因为他们有预算，所以可以搞鬼。今天并非罚钱或记过就能解决问题，而是应该删除这笔预算，我们固然可以修改国防部组织法以消灭总政治作战局，可是太麻烦了，我们可以利用TKO的方法，亦即打拳时技术击倒对方，例如打击对方眼睛，由医生诊断并认定这位选手不能出赛，比赛就自然停止。我们审查预算时，可以让总政治作战局如同监察院一样自然消灭，本席认为这个问题应以这个方式处理，而不仅是记过而已。这个单位消失后，方才部长认为军人不该发生的问题就不会发生了，当年美国没有总政治作战部，麦克阿瑟（MacArthur）亲口宣布...
028.“脱党”梦碎.txt	15	唐纵仍劝我归队！临行时又重复的加上一句。但我一直不肯填表，不料唐纵叫人找到中日文化经济协会干事刘子英，暗中替我填表送去了……刘子英填表我并不知道，迨接到党部通知谓我之归队已奉总裁核准，嘱我去领新党证，我相应不理，未去领党证。不料，《自由中国》半月刊于四十三年12月16日出版的一期上，登载了余燕人等一篇《抢救教育危机》的读者投书，指责今日中学生负担太重，因为读课外的东西太多了，如《三民主义》、《总理遗教》、《总统训词》，青年救国团发下来的必读的各种小册子，还加上救国团随时指定的各种活动，使学生疲于奔命，希望教育当局减少学生的课外作业和课外活动……该读者投书发表后的12月，即民国四十三年12月28日，由蒋中正所主持的《宣传会报》上，曾和汪精卫在对日抗战时期做过“汉奸”的陶希圣（现任国民党中央委员兼立法院委员）竟挑剔的说：“《自由中国》杂志越来越不像话了，现在连学校里读《三民主义》、《总理遗教》和《总统训词》都要反对！”蒋中正一闻此言，即勃然大怒，立说“开除雷震党籍”。唐纵意欲息事宁人，谓“雷震还未登记”，蒋氏还加上一句说“未登记也要开除”，于是，大家窃笑蒋中正语无伦次。唐纵回到中央党部后，遂用“注销”的方法，把我的党籍注销了。
029.“书呆子”梦碎.txt	7	蒋介石将军后来统率国民革命军。其组织系模仿苏联的红军，由党代表灌输以政治教育以及主义的训练。许多党代表都是受过训练的共产党员。在此种情形下，共产党及共产主义始能对国民党的军官及士官，发挥其影响力。未来的重要共产党领袖，如毛泽东、周恩来、林祖涵（林伯渠）等在当时的政府及军队中，均占有重要的地位。这些共产党员协助组织群众，负责宣传，并对军官及士兵灌输主义，莫斯科的训练中心——列宁大学、东方劳工大学及以后的中山大学，则以训练有素的青年派回担任党内及军中的工作。
029.“书呆子”梦碎.txt	15	胡适的“为中国建立一个不靠武装的第二大政党”的劝告，共产党是听不进去也不相信的，他们说他们若没有“这几条烂枪”，他们早就被国民党打得稀巴烂了，国民党是不允许他们“和平奋斗”的。说的确是实情。胡适后来回忆这封电报，自嘲的说：“在理想主义澎湃的那些日子里，我跟国内政治和国际政治的生手们同样的天真……竟天真到打了一封长的电报到重庆，以便转交给我从前的学生毛泽东！”最后胡适清楚知道，在国民党统治之下，美国杰斐逊（节福生）路线或英国工党路线，是绝对不可能的，“和平奋斗”的政党政治，在中国毕竟是教科书上的词汇！
030.“大儒”也梦碎.txt	7	回想《自由中国》杂志驰骋十年的特色，正在它单纯的讲了真话，它的主轴是提倡自由民主，千言万语在“与朝廷争胜”（这是当年苏东坡的“毛病”），真了不起。但我常常想，当《自由中国》被封杀后，影响一时的掌声歇后，平心而论，究竟这个杂志影响了谁？除了我李敖能够延续这一“与朝廷争胜”的风骨与干法外，它又影响了谁？我找来找去，实在找不出一个响当当的名字。其杂志存则义举，其杂志亡则义息，不是吗？看看施启扬，他当年和我一样都是为《自由中国》写文章的大学生，唯一不同是我用真名“李敖”，他用笔名“扬正民”，在雷震死后问世的日记中，我们甚至看到施启扬与雷震“暗通款曲”的细节。可是一朝《自由中国》没了、雷震坐牢了，我们看到的施启扬，却是卖身投靠国民党的无耻文人了。《自由中国》提倡的自由民主开明法治，和“与朝廷争胜”的种种，早都被它的作者施启扬忘得一干二净了。究竟这个杂志影响了谁？我终于看到倒行逆“施”的范例了。
030.“大儒”也梦碎.txt	9	马君武诗说“文字收功日，千秋革命潮”，但在《自由中国》杂志上，我看不到。在《自由中国》后，我也办过杂志，但究竟影响了谁？看来看去，原来答案是我自己。我深切感到“文字收功”的局限，“反革命”（这里不遵守国共的狭义用法）的势力太大了，最后最突出的，只是“与朝廷争胜”的那股精神而已。是精神胜利，其他的赢面，毕竟又迟缓又可怜。
030.“大儒”也梦碎.txt	11	胡适在《自由中国》茶话会上致词说：我们不要妄自菲薄，我们也是有权有势的人，只是那种权势不是世俗的武力与财力。他的观点令人心神一畅。但是，毕竟时代已变得越来越不“匹夫而为百世师、一言而为天下法”了。蒋廷黻预告说：他们那一代的知识分子是中国有影响力的最后一代知识分子。从许多面上观察，蒋廷黻说得也是。知识分子的确越来越小化、越专家化了。这个世界已经罕见“大儒”了、已经浪淘尽千古风流“大儒”了。
031.“小党”梦碎.txt	9	“训政”是清朝西太后用的名词，国民党用这种字眼，真是好有一比。国民党在1928年10月3日通过了《国民政府组织法》，同时通过了六条《训政纲领》，以为这个组织法的依据。陈茹玄在《增订中国宪法史》里，曾说这个《国民政府组织法》下“国民政府之组织，非合议制，实大近独裁制”，是“合议其形式而独裁其精神”的。陈茹玄是国民党大员，他这种说法，悍然表示了国民党是独裁的。既然独裁，一切就没有道理好说。在“党外无党”的独裁下，自然一切其他的党，就统统在怪胎之列，而要予以打掉。
032.“小党”又梦碎.txt	5	张君劢在上海自己有一所大学，叫“国立政治大学”，1927年国民党进入上海后，把他的大学没收，并在日后办了国民党的“国立政治大学”。张君劢在1928年办《新路杂志》，每期印3000份，用特种邮寄方法（夹在其他书报中，分散处理），寄出租界。国民党为了给他颜色看，由上海警备司令部派人化装成强盗，在1929年端午节前几天，把他绑票，关在司令部附近小屋中。20天后，予以修理后释放，从此腿部成伤，终生不良于行。
032.“小党”又梦碎.txt	7	张君劢遭到的迫害，另有在言论方面的和职业方面的。在言论方面，他写《政治学ABC》，广告一出，上海特区法院院长吴经熊就要查封世界书局；他翻译的拉斯基（Laski）《政治典范》（A Grammar of Politics），商务印书馆王云五坚持改名“张士林”才肯出版。1934年12月26日国民党在北平烧书12819册，其中3100册都是张君劢编的。在职业方面，国民党逼他离开燕京大学，又逼他离开中山大学。离开中山大学前，校长邹鲁说某方面要行暗杀，请他小心。张君劢的因义受难，困顿一至于此！
034.“黑猫”梦碎，“白猫”也梦碎.txt	9	问题是以老三自居，自居久了，容易真有点老三的懦相。清朝的封疆大吏还在无奈之余，提出“中学为体，西学为用”。老三是“西学为用”的高手，但在“中学为体”上，却一路苍白与空白。最后“作戏无法、搬出菩萨”，全世界到处设立起“孔菩萨学院”，其实，在美帝“软实力”的排山倒海下，这种学院只是撒钱而已，变成了具体而不微的、放大了几千倍的“蒋经国基金会”，讨好洋鬼子和假洋鬼子。偶尔有战绩足述：美国国会图书馆原来白纸黑字邀请函，请李敖在2011年9月莅馆演说的，但是马里兰大学的“孔菩萨学院”闻风而至，重金压迫国会图书馆，对李敖背诺，要求李敖在演说中不要颠覆辛亥革命史、不得批评孙中山。于是，李敖拒绝去了，一切大功告成，共产党以为他们捧孔扬孙划出了公约数，他们太天真了。为了示好，无神论的共产党大员都向妈祖上香了，有用吗？孔菩萨早都说过了：“非其鬼而祭之，谄也。”
036.“军阀”梦碎.txt	3	“北洋军阀”时代，他们虽然仍不乏糊涂、昏庸之处，但他们的度量，尤其对在野的国民党的度量，却是令人回味的。以他们对国民党员蔡元培为例：蔡元培当“北洋军阀”统治下的北京大学校长，自1916年12月26日，到1926年7月8日，前后10年之久，其间历经“北洋军阀”大总统5人、“北洋军阀”临时执政1人、“北洋军阀”摄政2人、“北洋军阀”内阁总理30人。“北洋军阀”，照后来国民党宣传家所描写的，既然都是“张大帅”型的坏蛋，他们为什么这样大度优容国民党呢？“北洋军阀”当年太笨，还没学会组党专政，所以他们没有党，自然没有党外人士，国民党当年是被迫害阶级，他们相当于党外人士，可是因为别人没有党，当时的党外人士该叫党内人士。“北洋军阀”自己10年间争权夺利、走马换将，可是不论怎么争夺、怎么走换，他们居然让党内人士负责他们的教育、负责他们的大学，这种“张大帅”，不是太不小气了吗？后来的国民党宣传家，整天那样小气的丑化“北洋军阀”，这不太不公道了吗？
036.“军阀”梦碎.txt	5	“北洋军阀”不止在教育上、大学上对国民党有度量，在其他方面，也是如此。国民党明明知道在法统上，北洋政府是中央政府，是为世界各国所承认的政府，但却在南方自己成立了另一个边区政府，整天骂中央；但是“北洋军阀”呢？却从来没骂过国民党是“叛乱团体”，也没认真讨伐过这个“叛乱团体”，也没搞出过什么《惩治叛乱条例》来法办任何国民党，也没禁止国民党在中央政府所在地出入境，也没禁止国民党在中央政府所在地办报、办杂志，也没军法大审或司法小审过任何国民党……这种“张大帅”，不是也太不小气了吗？后来的国民党宣传家，整天那样小气的丑化“北洋军阀”，这不太不公道了吗？
