file	line	score	tags	quotes	text
048.神父的性生活.txt	73	7	proverb|quote|literary_people|political_context		当我做了纪念以后，也许也提醒了他们。他们纪念胡适来不及了，怎么办？就纪念另外一个在胡适死了以后，做过中央研究院院长的一个老国民党，他的名字叫做王世杰，做过国民党的外交部部长，也做过总统府秘书长。然后我们看到报上就说出来看到没有，《中央日报》登这照片，这是李远哲，这是林毓生一个外省人的院士，在我看起来是个骗子，为什么是骗子？我讲给大家听，他那个时候在台大的时候历史系比我高一届，他跟殷海光整天搞什么方法学。我就笑殷海光，我说你们整天搞的那个方法学，你们这些东西有钢骨，没有水泥。你们谈的什么科学方法，你们不念书不念古书，也不念中国书，你们谈什么中国思想史？有钢骨，没有水泥。那么林毓生，还有个张灏，现都变成院士了。跟着殷海光搞方法学。林毓生作预备军官的时候，我是第八期的，他第七期的，一去了以后，就开始在军中的刊物里面写文章，用科学方法来证明领袖蒋介石伟大人格的形成！这篇文章被当时和他一起来受训的同班同学马宏祥就拿到了，就寄给我。我就拿给殷海光看，我说殷老师你看看，你在台大培养的所谓自由主义者，培养了你们这些科学方法，几个月到了凤山，他们就开始拍蒋介石马屁，用科学方法来证明总统领袖的伟大人格的形成。我说你们丢不丢人啊？殷海光听了之后脸都红了，觉得真可恶，你们这些人你这些学生怎么这样子没有骨气！
049.陈水扁扮张天师.txt	29	7	poem|proverb|political_context		李敖大哥大。我继续讲阿扁扮张天师。大家看过一本小说叫做《孩子的大玩偶》，小孩子都有玩偶。今天阿扁有两个玩偶，你们知道吗？他极右边一个玩偶，极左边一个玩偶。他的道具，极左边是什么？就是大家不知不觉，不是有意的，当然我们是反对他！可是做了他的道具。刚才我说过，昨天阿扁在讲演的时候，门口站了一百多位的这些爱国者，他们抗议，向阿扁抗议，他们代表中国统一的一个讯号来抗议。那么阿扁就当场利用他们，说代表台湾的自由民主，你可以看到他们。所以他们变成阿扁的一个宣传台湾自由民主的反面教材。那么这些人这样做了之后，为什么呢？因为你们站在极左边，所以在整个的政治光谱里面，你们等于保护了阿扁，把他向中间来挤。你们极左边，他就不在左边了，不是吗？同样的在极右边我们看到台联，凡是那种激烈的台独色彩言论，或者本土化的言论，民进党讲不出口的，阿扁讲不出口的，都由台联替他说出来。
049.陈水扁扮张天师.txt	61	7	poem|proverb|political_context		大家看看我第三个题目叫做李敖国文秀。我给大家秀一段，就是我写了一首打油诗给赵怡也就是赵宁的妈妈，赵老太太。给她什么意思？大家看这首诗，是什么意思？我李敖展示、显配我的国文程度和我的幽默感。给大家上一课，看看这国文应该怎么学，应该怎么样表达，大家看看中文应该怎样玩。我现在念给大家听，正本还没有给她。标题叫做——赵母杨觉苑老太太八十寿诗：赵老太太，八十一笑；元极之舞，西安起跳；回想当年，别有怀抱；陆官下海，带起军帽。您的家族，忠党爱国；您的志愿，从吾所好。您的贵党，全面杠龟；您的革命，一一退票。您的人生；云淡风轻；您的潇洒，江湖笑傲。您的个性，好义急公；您的儿女，个个姓赵。您的小孩，一女四男；您的少爷，一半被告。您的文采，高过业余；您的歌声，低回环绕。您的身世，遇党不淑；您的高明，不出所料。您的前生，王母成精；您的未来，伟大不掉。您的过去，百感交集；您的今天，面面俱到。别人出口，万寿无疆；李敖张嘴，另有一套。您的长寿，百岁起码；您的老命，阎王不要。赵宁、赵怡原告李敖贺于台湾2002年3月18号。
050.谴责总统兼任党主席.txt	11	7	poem|proverb|political_context		李敖大哥大。今天我讲的第一个题目是——谴责民进党的夫妻档。民进党中有一对夫妻档，他们都是立法委员，我今天谴责他们夫妻两个人，这两个人一个人的名字叫做张俊宏，另外一个人的名字叫做许荣淑。他们两个人都是民进党的立法委员，为什么谴责他们？先谈谈谴责这个男的、公的张俊宏。今天的报纸上我们看到张俊宏昨天有消息出现，他说民进党党主席之争，谢长廷且战且走，话没讲死。可是张俊宏评论改造，党乱国乱。然后我们可以看到民进党立委张俊宏昨天下午表示，民进党的结构不稳定，党乱带动国乱，因此民进党需要彻底的改造，让民进党脱胎换骨，因此张俊宏支持民进党主席谢长廷的改造构想，也期待能够顺利的完成联署。
050.谴责总统兼任党主席.txt	47	7	poem|proverb|political_context		今天口口声声大家说二二八时候骂陈仪，就是因为陈仪打了电报给蒋介石，我们台湾控制不了了，赶紧派兵来，蒋介石就派来了27师，不是吗？今天不这样解释的吗？大家看到没有，历史就这样重演，当年在清朝就发生这个事情，赶紧派部队来，我们要杀人了，杀高山族。这就是那个笑话了。说是以前在中国，就中国大陆和苏联关系好的时候，中国的统治者毛泽东打了一封电报给苏联的统治者叫做赫鲁晓夫，说你赶紧给我们粮食，你是我的友邦，我们没饭吃了。结果赫鲁晓夫就打回电报给毛泽东，说我们没有粮食给你，我们苏联自己不够吃，所以请你们把裤腰带给勒紧，勒紧裤腰带，这样表示不饿。勒紧裤带可也！结果赫鲁晓夫就收到毛泽东的第二个电报，说你没有送粮食过来，请你送裤腰带来，什么原因？我们裤腰带也没有，穷的要死也没有，我们好来勒紧我们的裤子。这是笑话了！
051.我以你血买明天.txt	33	7	poem|proverb|political_context		李敖大哥大。我讲今天的第二个题目叫做我以你血买明天。为什么要买明天？因为有的人为了他在台湾的统治地位，为了他的面子，他要打肿脸充胖子。打肿脸充胖子你可以打你自己，可是不是！他打的是我们人民，用我们人民的税捐给他自己撑腰。今天我们在《中国时报》里面，在这公布的资料里面我们就看得很清楚，《中国时报》第一版谈到了刘冠军的泄密，国安局奉天、当阳专案大曝光。
052.陈水扁和李登辉谎言大对决.txt	47	7	poem|proverb|political_context		李敖大哥大。我继续讲第二个题目叫做放兔子战斗。我们跟别人战斗的时候，用动物来比喻的时候，我们都放出来老虎、放出来狼狗、放出来走狗或放出来老鹰，来跟你战斗。从来没说放出来一个兔子，来跟你们战斗的。可是今天我们发生了一个奇怪的现象，有人口口声声要战斗，可释放出来的战斗工具是兔子。大家注意到陈水扁做的除夕谈话，大家注意，我李敖怎么解读！陈水扁除夕谈话全文，他后面讲到了：2月1号新内阁正式就位，我深切期许他们是一个战斗内阁。然后目的就是要战斗，同时我们准备好了，我们来了。就是陈水扁期许游锡堃内阁，然后向人民宣誓的，我们是战斗内阁组成了，我们准备好了，我们来了。结果来了什么？战斗内阁里面来个兔子，所以我们昨天看到了宗才怡辞职声明里面说她是一个误闯丛林世界的兔子。天哪！你要搞战斗，并且这是个丛林世界。你要搞出狮子、老虎、蟒蛇、狼或者是苍鹰来战斗，怎么跑出来兔子？冒出来兔子？兔子怎么战斗呢？
053.台湾混蛋举例.txt	43	7	poem|proverb|political_context		我告诉大家，为什么我今天这个题目叫做台湾混蛋举例？就是我们很多人脑筋里混蛋，所以就把这事情搞乱了。今天搜查《壹周刊》或者警告《中国时报》的，大家知道什么罪状吗？刑法109条。什么意思？外患罪。大家看看我拿在手里《六法全书》，刑法109条：泄露或交付关于中华民国国防秘密的文书。注意国防，看到没有？换句话说，什么是国防秘密？国防秘密，我们在整个的刑法里面，整个的外患罪条款里面第二章，外患罪条款里面第103条，你引起外国跟我们开战端。第104条，你把中华民国的领土领域给外国人占领的。然后第105条，他说你帮着外国人打仗的，执役在这军队服务的。然后第106条，你自己把国内的军事上的利益供给了外国的。看到没有？第一，他有个敌国；第二，是军事上。
055.谈92共识.txt	53	7	poem|proverb|political_context		李敖大哥大。我今天讲的第三个题目很奇怪，叫做被公熊强奸的母猫。什么原因？大家在被公熊强奸的母猫这一句句子里面，大家看到有两个字，就一个熊，一个猫。大家都知道有一个动物很珍贵的，只有在中国才有，就是熊猫。这个熊猫到了台湾以后被夏元瑜老先生给改名叫猫熊，所以台湾就叫猫熊，可是我们在大陆和整个的华人地区，人家继续叫熊猫。为什么你李敖要谈到熊猫？我从来没有见过熊猫，可是当我看到一个人的照片的时候，我就想到她是一个好像被公熊强奸过的母猫，所杂交出来的一个造型，我讲这话是玩笑性的。什么人？就是《联合报》《民生报》《欧洲日报》的真正老板，就是真正《联合报》的老板王惕吾生下来的大姐大就是王效兰。我就这个感觉，你们看她造型，你不觉得她是个好好好怪的造型吗？这个造型我所描写的是不是有点贴切？当然我承认很不礼貌。可是最奇怪的，她这个造型现在去卖香水，我请问这个香水谁还敢来买？
055.谈92共识.txt	67	7	poem|proverb|political_context		像过去袁世凯一样，三个部长不听他的话，他就整三个部长的次长，把你们关起来给你看，听不听话？吓坏了，听话。所以我认为这里面有一个秘密交换的条件，或者一个莫可言状的、说不清楚的压力，使郝龙斌这么优秀的人，这样子对不起新党逃掉了！而新党从谢启大以下，居然还赞美他、拥抱他、惜别他、送花给他，而不是谴责他，这是什么共犯结构啊？我感到好怪异。所以《联合报》的问题我觉得也发生在这里了。阿扁真伟大，他的势力无孔不入，把你们这些外省人的这些集团也好，个人也罢，一个一个消灭。阿扁最后的遗憾是消灭不了一个伟大的人，他的名字叫做李敖。广告过后，开放CALL IN。
056.国民两党私通内幕.txt	43	7	proverb|quote|western|political_context		我举个例子，在莎士比亚的剧本里面有一个剧本叫做凯撒，就一般我们说这凯撒大帝，事实上凯撒没有在罗马做皇帝，可一般的翻译都说这凯撒大帝。凯撒大帝最后被行刺的时候，被刺以前他是带着军队回到罗马当一个胜利者的时候，所有人民在欢呼他。在人群里面忽然有一个声音就喊着凯撒，凯撒就看这个人是个算命先生，这个人说当心3月15号，凯撒听到了以后就点点头。到了3月15号凯撒就进入国会的时候，在那个台阶上面又看到算命先生，凯撒就对他很友善的笑了一下，就是说今天就是3月15号。那意思就是说你警告我，你算命先生讲话不灵吗嘛！你说3月15号，现在就是3月15号，可是算命先生讲了一句话，他说今天还没有过去。3月15号还没有过去，现在还是3月15号，凯撒一进入国会就被刺了。被刺的时候大家拿刀子扎的时候，每个人都是小刀、小匕首，凯撒也拔出小刀来跟他抵抗。这个时候忽然看到他的亲信叫布鲁塔斯，也拿刀过来杀他，凯撒心碎了。我讲过，就好像苏志诚也跑来杀李登辉一样，谁都可以杀李登辉。那么李登辉看到苏志诚也来杀他，或者现在看到了黄主文也来杀他，这还得了吗？心碎了，凯撒就不抵抗了，因为你也来杀我，我就不抵抗了。
056.国民两党私通内幕.txt	65	7	poem|proverb|political_context		第三个题目比较简单，叫做杠上开花花飞花。我们打牌的时候打麻将，最后杠上开花。杠上开花花非花。为什么？我们看到吕秀莲在讲什么话？吕秀莲说这次我们加入了WTO，什么起点？起点是我们就可以加入世界卫生组织，然后就进入联合国。吕秀莲不这样讲吗？陈水扁也这样讲，我们现在看着就慢慢迈向联合国。为什么呢？他骗我们。不错，你现在加入了WTO。可WTO跟进入联合国完全是不同境界的需求。你世界卫生组织也进不去，为什么？那是联合国的附属机构，怎么办？我们要进联合国，进得去吗？进不去。为什么呢？我们说中华民国进不去，换个名字换成台湾，我们台湾加入联合国，因为现在整个台独分子都说中华民国被赶出来了，我们用台湾加入加进去。可是你台湾进的去吗？台湾新的国家加入的话，先要经过安全理事会五个常任理事国的通过，那里面他们每个国家都有否决权。请问握有否决权的中华人民共和国，它会通过吗？
056.国民两党私通内幕.txt	67	7	poem|proverb|political_context		所以今天说加入联合国来口号的人都是骗我们的人，他们想用WTO做杠上开花，错了！杠就是杠，杠上开不了花。这就是我今天这第三个题目重要的一个思想给大家看。然后我告诉大家一个问题，中国古代一个句子叫做视民如伤。什么意思？就是我保护人民的，像保护一个受伤的小孩子，这样子保护人民。为什么？这句话我们现在把它扩大来解释，就是我们看到的人民，我们可能把它搞伤、使他受伤。什么受伤？就是加入WTO可能使我们受伤了，什么原因？当年我们申请加入的时候，那个理由和当时的经济情况，那个优势台湾没有了。今天我们要加入的时候就硬撑进去了，所以先造成10万人的失业。
057.国民党民进党系出同源.txt	35	7	poem|proverb|political_context		李敖大哥大。我继续讲三党的蜗牛合作。在1988年，新党里面出了一个奇怪的理论，由十个人出面，他们提倡一中两国。这十个人的名字请大家看叫做曲兆祥，姚立明、郝龙斌、朱惠良、赖来焜、李炳南、李新、纪欣、费鸿泰、邓家基，他们十位新党公职人员提出来叫做一中两国的理论。在这十位以外，郁慕明也公开表示一中两国没有错。这个是非常严重的一件事情，所以当时李庆华、许历农、冯沪祥他们出来以后，很激烈的、义正词严说新党要搞一中两国，根本违背了一个中国的精神。结果就把这十人小组的也包括郁慕明他们这方面的理论给推翻了，给压下去了。可是这个理论在李登辉身上借尸还魂了，就变成了一个修正版，叫做两国论。一中两国是新党的构想，新党的十人小组加郁慕明的构想，被李登辉偷去以后就变成了两国论。
057.国民党民进党系出同源.txt	43	7	poem|proverb|political_context		我今天第二个题目叫做白嫖与白看。什么叫白嫖与白看？有的人到妓院去搞了妓女不给钱，叫白嫖。什么叫做白看？他是看，他是嫖的一种，可是用看的方法。大家记不记得，前几年美国一个最有名的传教士，忽然在电视上面用一个痛苦的表情来忏悔，说他做了错事。为什么做了错事？因为他搞了很多钱，可是他喜欢搞妓女，这个妓女就把他出卖了，妓女就说传教士把我叫到旅馆里去，叫到什么房间里去，他从来不发生性行为，可是他希望给他做很多的表演动作给他看。这照片是可以公布的，大家看没有关系，不会被新闻局查禁的。这就是妓女她表演的，她说我们这位有名的传教士要看我在床上镜头，然后又说要看这种镜头，看到没有？然后又要看这种镜头，反正这种要看。就是我给你看，可是你给我钱。可是如果这个传教士看了这些女孩以后，他虽然跟她不发生性行为，可是他不给她钱，就变成什么？变成白看，不给钱来看。
058.李登辉下台原因.txt	41	7	poem|classical|political_context		各位你们知道吗？李登辉那么在乎中央党部一些乌合之众，管你是姓连的或者姓宋的，或者是什么姓谢的，我管你啊！老子才不在乎，不下台。可是美国人开口，他下台了，这就是整个的真相。所以我们现在发生了解读问题，当时这个案子出来以后，我们可以看到李登辉的太太曾文惠去告了冯沪祥、告了谢启大，不是吗？请大家看看谢启大给我的信：李大师您好！有关第一夫人曾文惠女士出国疑云，前慨蒙义助（那么义气的帮助我，什么帮助？我提供资讯、提供资料、提供证人给她），今特传上本人办公室联系方式如下，希于贵节目中公开呼吁握有曾文惠女士出入境相关证据或曾亲眼目睹曾文惠女士出入境的民众，能尽速与我们联系。看到没有？谢启大谨上，这是89年4月12号的信。我们再看这是谢启大的亲笔字。
061.媒婆要上床.txt	11	7	poem|proverb|political_context		李敖大哥大。今天我从一个题目开始，这个题目叫做媒婆要上床。首先我跟大家看一个今天晚上《劲晚报》的一个消息：形势比人强，宋楚瑜为王建煊站台。看到没有？我们可以看到这个题目，可以看到今天的新闻画面，我们看得很清楚，亲民党的主席为新党的人站台。可是我总觉得这个现象是被逼出来的，不是一个很自然的现象。为什么被逼出来的？因为新党的王建煊在参选台北县县长的时候，在登记的时候，他要求登记是国民党、亲民党、新党三个党的共同推荐。黄石城他所主持的中央选举委员会，违法不给他这样登记。所以王建煊居然就丧失了自己新党的立场，在登记栏里面空白，就是不敢也不愿意登记他的新党身份，那么他的身份就是等于妾身未分明，很复杂了。然后他们就做了一个重要的宣传，就是我既然是三党候选人，所以我要求亲民党给我站台，这通不通呢？严格讲是不通的。因为你们是政党政治，党有党的立场，不能够这样搅成一团的，现在就搅成一团。
061.媒婆要上床.txt	27	7	poem|classical|political_context		看到今天19号的《中央日报》不得了：连战号召同志打拼，国民党欢迎回娘家。什么是娘家？国民党就是你新党娘家，就是亲民党的娘家。然后我们再看剪报：连战宴请新党的时候，谢启大有回娘家的感觉。乖乖，新党把国民党当娘家，国民党也以娘家自居。今天已经讲出来了，那么现在就是国民党联合新党，逼亲民党你回来，因为这是你的娘家。然后宋楚瑜助选的时候，老兵出现了，包围宋楚瑜，我们也要回国民党。好了，现在告诉各位回国民党什么结果？先告诉你，宋楚瑜回国民党了，国民党在今年90年的7月29号，在第16次全国代表大会第15次的修正，修正什么？修正它的党章。党章里面有一条，什么呢？就是你宋楚瑜回来，老子们把你掐得死死的，你不能做中央常务委员，你不能够做党主席，你回来白回来，你是个普通党员。为了宋楚瑜特别定了这么一条，大家要知道这条什么内容吗？知道宋楚瑜回去以后在国民党里没有任何作用，为什么呢？把你掐死了。定了这么一条专门对付宋楚瑜的，等你回来。宋楚瑜能回去吗？这条什么内容？等一下广告过后，我念给大家听。
061.媒婆要上床.txt	39	7	proverb|quote|literary_people|political_context		大家记不记得，过去有一位名教授叫做梁实秋，他跟我讲了一句话，那时候梁实秋的老朋友叫叶公超，是国民党的外交部长，后来被蒋介石搞下来，搞下来以后，叶公超就要回到大学教书，梁实秋就跟我讲说：叶公超教不久的。为什么教不久？他说他在官场里面坐的太久了，做到外交部长。我们这些教授是坐冷板凳的，可是板凳我们一连坐了几十年，板凳被我们坐热了，所以我们可以继续坐在板凳上面。可是做官的人回来他坐不住板凳，因为板凳对他太凉了。
061.媒婆要上床.txt	41	7	poem|proverb|political_context		为什么要有宋楚瑜他的板凳？你真正搞一个球队的时候，有的人不能上场比赛，他是预备球员，他在旁边。你坐在板凳上不行啊！我怎么可以呢？我要出来选台北县县长，你不给我选不行。今天就这个局面出现了，所以宋楚瑜把话说得不清楚，他也不敢说清楚，意思就是说搞团队的话就有人要靠边站，有人要坐板凳，有人要泡沫化。为什么要泡沫化？新党会抗议，为什么要泡沫化？对不起，你的身份就是泡沫化的身份。什么原因呢？大家记不记得英国的一个有名的文豪叫做卡莱尔，他一本书里面我们贴了一张，我们叫藏书票，像邮票一样大，譬如说我李敖藏书贴了一张我特色的藏书票贴在书上面。英国文豪卡莱尔他的藏出票上面画了一只蜡烛，蜡烛在燃烧，然后下面一句话：我燃烧才有用。为什么燃烧才有用？我不燃烧就不能释放光明，可是我燃烧就把我自己消灭掉了。对不对？春蚕到死丝方尽，蜡炬成灰泪始干。蜡炬成灰了，什么原因？我把我自己牺牲了，可是我会把光明给别人。就好像印度的诗人泰戈尔所说的，他说别忘了拿灯光的人，拿蜡烛的人，他给了你光明，他自己站在黑暗里。为什么呢？自我牺牲！
062.我才是专家.txt	17	7	poem|proverb|political_context		大家看到没有，我李敖多么尊重言论自由。当新党的党主席谢启大这样子骂我的时候，我把她的话请朋友把它打字打下来。现在我替大家替她宣传，并且把画面展示给大家看，证明什么呢？谢启大你的宣传力量不够，你骂李敖的力量不够。现在我帮你宣传，你骂李敖是狗什么，我现在做成文字，帮大家宣传。就是说结论一、你李敖是狗；二、没有一句话是事实。事实是这个样子吗？所以我今天还愿意给大家上一课，今天这个资料我摆的满桌子都是。大家可以看看，我满桌子都是资料，干什么呢？证明一个题目，就今天的题目叫做我才是专家。
062.我才是专家.txt	31	7	proverb|quote|literary_people|political_context		宋朝有四个有名的，就叫做苏黄米蔡，苏轼、黄庭坚、米芾、蔡襄，有人说蔡京，这四个人是宋朝的宋四家，有名的书法家，其中有一个米就是米芾。这是日本人印的《米芾集》。米芾他就说虽然他写的字最好，宋朝的朱熹、朱子就说宋朝人的书法，米芾第一。米芾字写的最好，也会画。可是他自己讲他的鉴赏，就是他鉴定艺术品的能力天下第一，他以鉴赏能力最高来自豪。同样的，后来死在台湾的也有一个专家，这个人叫做张大千。大家看张大千，这个是张大千的姨太太，我告诉你，张大千的姨太太身上、肩膀上面很多伤，什么伤呢？就是被张大千咬的。张大千发泄性欲的时候要咬他的姨太太。所以因为姨太太肩膀上都是伤，这是题外话，艺术家们有很多怪的行为。张大千大家都知道他是有名的艺术家，可是张大千讲了一段话非常动人，我讲给大家听，他说：我艺术家没有错，可是我告诉你，画山，我画不过张三；画水，画不过李四；画花鸟虫鱼，我画不过王五。可是，请注意，鉴赏古代的文物、鉴赏书画的真假，五百年来，我第一。什么原因？没人能跟我比，干什么？这东西真假好坏，一看就知道。
