score	file	line	text	context
7	065.呜呼胡适专家！.txt	3	胡适写信给周鲠生，公开发表于《独立评论》	台大历史系教授张忠栋，《在动乱中坚持民主的胡适》讲稿（1986年2月25-27日）中，用的是“蒋委员长与汪精卫于民国二十三年11月27日发表一则通电”的次序，这是与史法不合的。汪精卫当时排名明明在前，如今崇蒋抑汪，当然不对。又说“胡适写信给周鲠生，公开发表于《独立评论》”云云，更是大错。《独立评论》创刊于1932年5月22日，停刊于1937年7月25日，共出...
6	065.呜呼胡适专家！.txt	3	选自《独立时论》文稿（三十七年2月1日北平出版）。此文当时报章杂志转载极多。后收入《胡适的时论一集》（三十七年北平六艺书局出版），《我们必须选择我们的方向》（1950年台北自由中国社出版）。	台大历史系教授张忠栋，《在动乱中坚持民主的胡适》讲稿（1986年2月25-27日）中，用的是“蒋委员长与汪精卫于民国二十三年11月27日发表一则通电”的次序，这是与史法不合的。汪精卫当时排名明明在前，如今崇蒋抑汪，当然不对。又说“胡适写信给周鲠生，公开发表于《独立评论》”云云，更是大错。《独立评论》创刊于1932年5月22日，停刊于1937年7月25日，共出...
5	065.呜呼胡适专家！.txt	3	蒋委员长与汪精卫于民国二十三年11月27日发表一则通电	台大历史系教授张忠栋，《在动乱中坚持民主的胡适》讲稿（1986年2月25-27日）中，用的是“蒋委员长与汪精卫于民国二十三年11月27日发表一则通电”的次序，这是与史法不合的。汪精卫当时排名明明在前，如今崇蒋抑汪，当然不对。又说“胡适写信给周鲠生，公开发表于《独立评论》”云云，更是大错。《独立评论》创刊于1932年5月22日，停刊于1937年7月25日，共出...
4	066.借死人骗活人.txt	3	借死人骗活人	四月六日《中国时报》登共产党那边的消息，说：“昨天，中共主动在北平召开了‘天安门事件’十周年的纪念大会，……今年是文化大革命发起的二十周年，也是周恩来死亡、‘天安门事件’、‘唐山大地震’、毛泽东死亡、‘四人帮’被逮、华国锋政变‘登基’、文化大革命结束十周年，在这一连串的大日子中，难免激发人们的沉思，尤其是中共既没有回答去年学生提出的问题，又没有解决物价飞涨造...
3	066.借死人骗活人.txt	3	慈湖谒陵	四月六日《中国时报》登共产党那边的消息，说：“昨天，中共主动在北平召开了‘天安门事件’十周年的纪念大会，……今年是文化大革命发起的二十周年，也是周恩来死亡、‘天安门事件’、‘唐山大地震’、毛泽东死亡、‘四人帮’被逮、华国锋政变‘登基’、文化大革命结束十周年，在这一连串的大日子中，难免激发人们的沉思，尤其是中共既没有回答去年学生提出的问题，又没有解决物价飞涨造...
4	067.戒严四十年？.txt	3	戒严令不是实行多久的问题，而是该不该实行的问题，该实行，三十年要实行，四十年也要实行！	1949年5月19日，国民党在这一天起在台湾实施戒严。最近，郑南榕发起“五一九绿色行动”，来纪念这个“台湾戒严日”。在菲律宾“黄色运动”成功的今日，这一行动，当然别有意义。回想1982年10月15日，孙运璿在立法院答复许荣淑，居然说：“戒严令不是实行多久的问题，而是该不该实行的问题，该实行，三十年要实行，四十年也要实行！”这种悍然无耻的心态，真是千古所无。不...
4	068.收音机何辜？电视机何辜？.txt	3	自天子以至庶人	3月28日国民党《中央日报》载：三十九岁的工厂职工接瑞华，酒后观看电视连续剧，不知何故突然捣毁电视机，凌晨被家人发现上吊自杀断气命绝，其妻抚尸恸哭，悲伤逾恒云云。使我联想到蒋介石当年从广播中听到李宗仁当选副总统时，曾捣毁收音机；徐复观从电视中看到梁容若著书得奖时，曾捣毁电视机。可见“自天子以至庶人”，虽口诵圣人“不迁怒”之训，但动起手脚，却都性好此道也。只是...
5	069.“视弃天下，犹弃敝屣也！”.txt	1	视弃天下，犹弃敝屣也！	“视弃天下，犹弃敝屣也！”
8	069.“视弃天下，犹弃敝屣也！”.txt	3	视弃天下，犹弃敝屣也！	菲律宾祸国者马科斯夫人，3月5日在美国接受访问，答复她遗留在菲律宾三千双鞋子的事。她说：“我不相信那里有三千双鞋子。那是我财产的全部，我从不丢弃任何东西，即使是坏掉的拖鞋和高跟鞋，我不是浪费的人，这些鞋子是过去近二十一年中留下的。”真是奇论也！从不丢弃任何东西，就可大量买进任何东西而不构成浪费么？孟子说：“视弃天下，犹弃敝屣也！”如今马夫人总算“天下”与“敝...
6	069.“视弃天下，犹弃敝屣也！”.txt	3	我不相信那里有三千双鞋子。那是我财产的全部，我从不丢弃任何东西，即使是坏掉的拖鞋和高跟鞋，我不是浪费的人，这些鞋子是过去近二十一年中留下的。	菲律宾祸国者马科斯夫人，3月5日在美国接受访问，答复她遗留在菲律宾三千双鞋子的事。她说：“我不相信那里有三千双鞋子。那是我财产的全部，我从不丢弃任何东西，即使是坏掉的拖鞋和高跟鞋，我不是浪费的人，这些鞋子是过去近二十一年中留下的。”真是奇论也！从不丢弃任何东西，就可大量买进任何东西而不构成浪费么？孟子说：“视弃天下，犹弃敝屣也！”如今马夫人总算“天下”与“敝...
3	069.“视弃天下，犹弃敝屣也！”.txt	3	天下	菲律宾祸国者马科斯夫人，3月5日在美国接受访问，答复她遗留在菲律宾三千双鞋子的事。她说：“我不相信那里有三千双鞋子。那是我财产的全部，我从不丢弃任何东西，即使是坏掉的拖鞋和高跟鞋，我不是浪费的人，这些鞋子是过去近二十一年中留下的。”真是奇论也！从不丢弃任何东西，就可大量买进任何东西而不构成浪费么？孟子说：“视弃天下，犹弃敝屣也！”如今马夫人总算“天下”与“敝...
3	070.黄炎培记蒋介石暗杀事.txt	5	我民元，病卧广慈医院，1日傍晚，蒋介石来谈，临行说：‘我们今晚将做一件大事。’夜半，忽闻枪声，别室陶焕卿中枪死了。	辛亥革命写完了吗？还有一件事，我不能不附录在这里。辛亥11月25日夜，革命大领袖之一陶成章号焕卿在上海广慈医院被刺死，刺客为谁？怎样刺杀？很有人说是陈其美命蒋介石刺死的。各种记载，大都推给他人，脱卸自己。无论如何，从整个革命说来，总是一件很大不幸的事。我是认真写日记的。根据我的日记：1927年6月3日，上海澄衷中学校校长浙江人曹慕管和我漫谈。曹说：“我民元，...
3	070.黄炎培记蒋介石暗杀事.txt	5	陈其美嘱蒋介石行刺陶焕卿，蒋雇光复会叛徒王竹卿执行。焕卿以为竹卿是自己的人，请他入室，就被刺死。光复会终于又刺杀了王竹卿。	辛亥革命写完了吗？还有一件事，我不能不附录在这里。辛亥11月25日夜，革命大领袖之一陶成章号焕卿在上海广慈医院被刺死，刺客为谁？怎样刺杀？很有人说是陈其美命蒋介石刺死的。各种记载，大都推给他人，脱卸自己。无论如何，从整个革命说来，总是一件很大不幸的事。我是认真写日记的。根据我的日记：1927年6月3日，上海澄衷中学校校长浙江人曹慕管和我漫谈。曹说：“我民元，...
3	070.黄炎培记蒋介石暗杀事.txt	7	爱国主义、民主主义、人道主义、反封建主义，许多同志为了实现这些理想，不惜牺牲生命，是大大可敬的。太可惜的是发现了若干人枪口不对外而对内。这些从革命全局说来，到底是很大很大的损失。	黄炎培感慨说：“爱国主义、民主主义、人道主义、反封建主义，许多同志为了实现这些理想，不惜牺牲生命，是大大可敬的。太可惜的是发现了若干人枪口不对外而对内。这些从革命全局说来，到底是很大很大的损失。”真是沉痛之言。（1986年4月8日）
3	073.扫把星看扫把星.txt	3	五十二颗星	报载观测哈雷彗星不仅在民间造成一股热潮，更引起国军将领们的浓厚兴趣，据悉，3月19日，就有多位国军将领加起来共有“五十二颗星”群集联勤鹅銮鼻活动中心，专程赶去一睹哈雷彗星景象，场面甚为壮观。可惜的是，当活动中心主任正为将领们简报哈雷彗星时，屋外却下了一场大雨，浓云密布，遮盖了哈雷彗星，以致将领们乘兴而来却败兴而归云云。
7	074.计程车司机与李敖.txt	3	支持你，不收车资。	坐计程车，司机一声不响。下车后拒收车资，只说：“支持你，不收车资。”我强把车资留在座位上。这位司机先生真可记，他看出乘客是李某人，可是不说一句好奇的话，真是木讷近仁者矣。（1986年4月27日）
3	075.外交部次长关镛的丑陋.txt	17	敢怒不敢挺身的职员	这一文件，一来可以看到国民党外交部高层人员的腐败，一来可以看到“敢怒不敢挺身的职员”的不平。（1986年5月1日）
7	076.国民党的外交.txt	3	外交是用最好的方法，做出并说出最脏的事。	西方俗话说：“外交是用最好的方法，做出并说出最脏的事。”（Diplomacy is to do and say the nastiest thing in the nicest way．）这种俗话，乃是洞彻外交通则而来。这种外交通则，传统的中国人并不太懂。传统的中国人，只懂得“万国衣冠拜冕流”、只懂得“夷狄进入中国则中国之”。但是中国人不懂得万一万国不肯拜冕...
7	076.国民党的外交.txt	3	用最‘坏’的方法，做出并说出最脏的事。	西方俗话说：“外交是用最好的方法，做出并说出最脏的事。”（Diplomacy is to do and say the nastiest thing in the nicest way．）这种俗话，乃是洞彻外交通则而来。这种外交通则，传统的中国人并不太懂。传统的中国人，只懂得“万国衣冠拜冕流”、只懂得“夷狄进入中国则中国之”。但是中国人不懂得万一万国不肯拜冕...
6	076.国民党的外交.txt	3	夷狄进入中国则中国之	西方俗话说：“外交是用最好的方法，做出并说出最脏的事。”（Diplomacy is to do and say the nastiest thing in the nicest way．）这种俗话，乃是洞彻外交通则而来。这种外交通则，传统的中国人并不太懂。传统的中国人，只懂得“万国衣冠拜冕流”、只懂得“夷狄进入中国则中国之”。但是中国人不懂得万一万国不肯拜冕...
4	076.国民党的外交.txt	3	万国衣冠拜冕流	西方俗话说：“外交是用最好的方法，做出并说出最脏的事。”（Diplomacy is to do and say the nastiest thing in the nicest way．）这种俗话，乃是洞彻外交通则而来。这种外交通则，传统的中国人并不太懂。传统的中国人，只懂得“万国衣冠拜冕流”、只懂得“夷狄进入中国则中国之”。但是中国人不懂得万一万国不肯拜冕...
3	076.国民党的外交.txt	3	人质	西方俗话说：“外交是用最好的方法，做出并说出最脏的事。”（Diplomacy is to do and say the nastiest thing in the nicest way．）这种俗话，乃是洞彻外交通则而来。这种外交通则，传统的中国人并不太懂。传统的中国人，只懂得“万国衣冠拜冕流”、只懂得“夷狄进入中国则中国之”。但是中国人不懂得万一万国不肯拜冕...
3	076.国民党的外交.txt	3	片板不许入海	西方俗话说：“外交是用最好的方法，做出并说出最脏的事。”（Diplomacy is to do and say the nastiest thing in the nicest way．）这种俗话，乃是洞彻外交通则而来。这种外交通则，传统的中国人并不太懂。传统的中国人，只懂得“万国衣冠拜冕流”、只懂得“夷狄进入中国则中国之”。但是中国人不懂得万一万国不肯拜冕...
3	077.先烈家属下场.txt	3	黄花岗七十二烈士，福建省十九人。最出名的是林觉民，他的孙子和我小学同学。意映我也见过。只知道抗战时全家饿死。在方声涛做福建省长时，这些烈士家属定下由省府供养的例子，后来国民党就不太履行，经常欠付，到了抗战，就中断了。	午与王小痴谈。小痴说：“黄花岗七十二烈士，福建省十九人。最出名的是林觉民，他的孙子和我小学同学。意映我也见过。只知道抗战时全家饿死。在方声涛做福建省长时，这些烈士家属定下由省府供养的例子，后来国民党就不太履行，经常欠付，到了抗战，就中断了。”由此可见，同志无情如此，革命先烈尚可为哉？（1986年7月2日）
5	078.党外助选下场.txt	9	狡兔死，走狗烹	讵知，在台端虽败犹荣的县长选战结束后，台端在三重市成立的北县服务处里，竟不时传出本人曾侵吞台端“老师太捐款拾万元”的不实言论（上事有多位人士在台端服务处亲耳听闻可为证），恶意中伤本人，使不明就里者误信为真实，令本人蒙冤不清。现今党外伦理道义之沦落已极，为免相互攻讦争执，予人笑柄而削减内部实力，本人原思养晦于自宅，背黑锅不思澄清，牺牲自我以成全台端之一世英名；...
3	079.我就是神、吾就是高人.txt	7	冥冥中似有神助或高人指点	这段话甚逗。我写文章，真希望“冥冥中似有神助或高人指点”，问题是何方神圣能助我呢？哪来高人来指点我呢？事实上，我就是神、吾就是高人也！（1986年9月9日）
7	080.五十年前的批语.txt	5	核阅所呈，一则曰畏难，再则曰要钱，远之不如岳武穆，近之不如拿破仑，所请不准。	某路局一员司，因承办某项公事，颇难着手，须增加经费方可集事，乃上签呈于上官，历述此事之困难，及应增加费用之理由。签上，上官批曰：“核阅所呈，一则曰畏难，再则曰要钱，远之不如岳武穆，近之不如拿破仑，所请不准。”盖以武穆有“文官不爱钱”，及拿翁有“吾之字典中无难字”之语，遂如此引用也。
4	080.五十年前的批语.txt	5	文官不爱钱	某路局一员司，因承办某项公事，颇难着手，须增加经费方可集事，乃上签呈于上官，历述此事之困难，及应增加费用之理由。签上，上官批曰：“核阅所呈，一则曰畏难，再则曰要钱，远之不如岳武穆，近之不如拿破仑，所请不准。”盖以武穆有“文官不爱钱”，及拿翁有“吾之字典中无难字”之语，遂如此引用也。
4	080.五十年前的批语.txt	5	吾之字典中无难字	某路局一员司，因承办某项公事，颇难着手，须增加经费方可集事，乃上签呈于上官，历述此事之困难，及应增加费用之理由。签上，上官批曰：“核阅所呈，一则曰畏难，再则曰要钱，远之不如岳武穆，近之不如拿破仑，所请不准。”盖以武穆有“文官不爱钱”，及拿翁有“吾之字典中无难字”之语，遂如此引用也。
3	081.日历在我眼中全是黑字.txt	5	近来作何消遣？	工作——我这行的工作——对我从来就是快乐，因此，我实在不懂人家问我“近来作何消遣？”我根本不觉得有什么好消遣的、需要消遣的。
3	085.捣乱七要件.txt	3	要如何去破坏一个团体？	1936年2月27日，王正廷在厦门演说，题目是：“要如何去破坏一个团体？”方法有七：一、开会不到；二、每到必迟；三、到会不发言；四、散会后发不负责的批评；五、选举必争；六、争到手了又不负责；七、争不到手便宣告退会。这七点高招，前四点国民党最拿手；后四点党外最行家。（1986年10月7日）
3	091.工专长寿·台大短命.txt	3	校失求诸小	台北工专今日庆祝建校七十五周年，显然是从日治时代创校起算的。但是台湾大学的建校算法却邪门得很。它明明建校在1928年（若从医学部起算，且可追溯到民国前十二年之台湾总督府医学校），却被拦腰剪断，硬从1945年抗战胜利接收台北帝国大学算起，真是太没道理了。比较起来，台北工专是小学校，反倒可以不被注意，得保前史。此所谓“校失求诸小”也。（1986年11月1日）
8	094.“泪阑干”与“倚阑干”.txt	3	岂知重得兮入长安，叹息欲绝兮泪阑干	阑干在古典文学里有两个用法，一个是“泪阑干”的用法，一个是“倚阑干”的用法。前者的阑干是“纵横”的意思，所以蔡琰《胡笳十八拍》中说“岂知重得兮入长安，叹息欲绝兮泪阑干”，就是指泪流满面；后者的阑干是“栏杆”的意思，所以李白《清平调》中说“解释春风无限恨，沉香亭北倚阑干”，就是指倚栏寄怀。这两个用法本是分开的，如果有美人焉，要一边泪流满面一边倚栏寄怀，那就阑干...
8	094.“泪阑干”与“倚阑干”.txt	3	解释春风无限恨，沉香亭北倚阑干	阑干在古典文学里有两个用法，一个是“泪阑干”的用法，一个是“倚阑干”的用法。前者的阑干是“纵横”的意思，所以蔡琰《胡笳十八拍》中说“岂知重得兮入长安，叹息欲绝兮泪阑干”，就是指泪流满面；后者的阑干是“栏杆”的意思，所以李白《清平调》中说“解释春风无限恨，沉香亭北倚阑干”，就是指倚栏寄怀。这两个用法本是分开的，如果有美人焉，要一边泪流满面一边倚栏寄怀，那就阑干...
6	096.广告成问题吗？.txt	3	经济部高级官员指出，我国在中美烟酒谈判的计价方面让步，是换取美国烟酒进口商的广告数量，这显示政府宁可收入减少，也不放弃保障国民健康的原则。	这次国民党政府和它“美国爸爸”订中美烟酒协议，五次谈判下来，丧权辱己，丢人之至。今天国民党《中央日报》登：“经济部高级官员指出，我国在中美烟酒谈判的计价方面让步，是换取美国烟酒进口商的广告数量，这显示政府宁可收入减少，也不放弃保障国民健康的原则。”“这位官员承认：最初美方同意的公卖利益比现在协议的数字高；但是要求不能有广告方面的限制，我方担心在强力促销下，会...
6	096.广告成问题吗？.txt	3	这位官员承认：最初美方同意的公卖利益比现在协议的数字高；但是要求不能有广告方面的限制，我方担心在强力促销下，会使青少年吸烟人口大增，因此坚持不能大作广告，经反复磋商，双方各让一步。	这次国民党政府和它“美国爸爸”订中美烟酒协议，五次谈判下来，丧权辱己，丢人之至。今天国民党《中央日报》登：“经济部高级官员指出，我国在中美烟酒谈判的计价方面让步，是换取美国烟酒进口商的广告数量，这显示政府宁可收入减少，也不放弃保障国民健康的原则。”“这位官员承认：最初美方同意的公卖利益比现在协议的数字高；但是要求不能有广告方面的限制，我方担心在强力促销下，会...
4	096.广告成问题吗？.txt	3	美国爸爸	这次国民党政府和它“美国爸爸”订中美烟酒协议，五次谈判下来，丧权辱己，丢人之至。今天国民党《中央日报》登：“经济部高级官员指出，我国在中美烟酒谈判的计价方面让步，是换取美国烟酒进口商的广告数量，这显示政府宁可收入减少，也不放弃保障国民健康的原则。”“这位官员承认：最初美方同意的公卖利益比现在协议的数字高；但是要求不能有广告方面的限制，我方担心在强力促销下，会...
4	096.广告成问题吗？.txt	3	家里光棍	这次国民党政府和它“美国爸爸”订中美烟酒协议，五次谈判下来，丧权辱己，丢人之至。今天国民党《中央日报》登：“经济部高级官员指出，我国在中美烟酒谈判的计价方面让步，是换取美国烟酒进口商的广告数量，这显示政府宁可收入减少，也不放弃保障国民健康的原则。”“这位官员承认：最初美方同意的公卖利益比现在协议的数字高；但是要求不能有广告方面的限制，我方担心在强力促销下，会...
3	096.广告成问题吗？.txt	3	计价方面让步	这次国民党政府和它“美国爸爸”订中美烟酒协议，五次谈判下来，丧权辱己，丢人之至。今天国民党《中央日报》登：“经济部高级官员指出，我国在中美烟酒谈判的计价方面让步，是换取美国烟酒进口商的广告数量，这显示政府宁可收入减少，也不放弃保障国民健康的原则。”“这位官员承认：最初美方同意的公卖利益比现在协议的数字高；但是要求不能有广告方面的限制，我方担心在强力促销下，会...
8	097.民进党绝非佳兆也.txt	3	不预义谋，又无功于天下	唐朝玄武门之变，李世民的哥哥李建成、弟弟李元吉都被杀。唐高祖问左右意见，萧瑀、陈叔达说：“建成、元吉本不预义谋，又无功于天下。”无功如此，竟想夺权，自然招祸。今天的所谓民进党新贵，大都也是“不预义谋，又无功于天下”的党外投机者，这种人篡夺党外正统，一如当年蒋介石篡夺国民党正统，对党而言，绝非佳兆也。（1986年12月9日）
7	097.民进党绝非佳兆也.txt	3	建成、元吉本不预义谋，又无功于天下。	唐朝玄武门之变，李世民的哥哥李建成、弟弟李元吉都被杀。唐高祖问左右意见，萧瑀、陈叔达说：“建成、元吉本不预义谋，又无功于天下。”无功如此，竟想夺权，自然招祸。今天的所谓民进党新贵，大都也是“不预义谋，又无功于天下”的党外投机者，这种人篡夺党外正统，一如当年蒋介石篡夺国民党正统，对党而言，绝非佳兆也。（1986年12月9日）
7	099.只要前三名还算客气的呢！.txt	3	天下才一石，曹子建独占八斗，我独得一斗，天下共分一斗。	1979年6月，远景出版社沈登恩为我印《独白下的传统》。我在扉页里自我歌颂，说：“五十年来和五百年内，中国人写白话文的前三名是李敖，李敖，李敖，嘴巴上骂我吹牛的人，心里都为我供了牌位。”——这几句“复出题辞”，看过的人，震于气魄者固多，骂我吹牛者亦不少。殊不知《释常谈》中记谢灵运的话，比我还吹得凶。谢灵运说：“天下才一石，曹子建独占八斗，我独得一斗，天下共分...
6	099.只要前三名还算客气的呢！.txt	3	五十年来和五百年内，中国人写白话文的前三名是李敖，李敖，李敖，嘴巴上骂我吹牛的人，心里都为我供了牌位。	1979年6月，远景出版社沈登恩为我印《独白下的传统》。我在扉页里自我歌颂，说：“五十年来和五百年内，中国人写白话文的前三名是李敖，李敖，李敖，嘴巴上骂我吹牛的人，心里都为我供了牌位。”——这几句“复出题辞”，看过的人，震于气魄者固多，骂我吹牛者亦不少。殊不知《释常谈》中记谢灵运的话，比我还吹得凶。谢灵运说：“天下才一石，曹子建独占八斗，我独得一斗，天下共分...
3	099.只要前三名还算客气的呢！.txt	3	复出题辞	1979年6月，远景出版社沈登恩为我印《独白下的传统》。我在扉页里自我歌颂，说：“五十年来和五百年内，中国人写白话文的前三名是李敖，李敖，李敖，嘴巴上骂我吹牛的人，心里都为我供了牌位。”——这几句“复出题辞”，看过的人，震于气魄者固多，骂我吹牛者亦不少。殊不知《释常谈》中记谢灵运的话，比我还吹得凶。谢灵运说：“天下才一石，曹子建独占八斗，我独得一斗，天下共分...
5	101.“知彼知己，量敌为计”.txt	1	知彼知己，量敌为计	“知彼知己，量敌为计”
5	101.“知彼知己，量敌为计”.txt	3	知彼知己，量敌为计	《梦溪笔谈·权智》写韩信知兵，善于“知彼知己，量敌为计”，最为精采：
8	101.“知彼知己，量敌为计”.txt	5	知彼知己，量敌为计	韩信袭赵，先使万人背水阵，乃建大将旗鼓，出井陉口，与赵人大战，佯败，弃旗鼓，走水上。军背水而阵，已是危道，又弃旗鼓而趋之，此必败势也。而信用之者，陈余老将，不以必败之势邀之，不能致也。信自知才过余，乃敢用此耳。向使余小黠于信，信岂得不败？此所谓“知彼知己，量敌为计”。后之人不量敌势，袭信之迹，决败无疑。汉五年，楚、汉决势于垓下，信将三十万自当之，孔将军居左，...
