score	file	line	text	context
5	《波波颂》目录.txt	55	平生之志，不在温饱	052.“平生之志，不在温饱”
6	《波波颂》自序.txt	9	叫花子吃死蟹——只只好	不过，读者有所不知的是：自来所谓选集，都是选好的，不选坏的，所以选出来的，往往比落选的要好。但我李敖的选集则不然。我的文章，不论说理、不论叙情、不论纵迹大纲、不论情怀小样，都有上海人所谓“叫花子吃死蟹——只只好”的味道，而是篇篇都好的。既然篇篇都好，自然就无所谓选。而所谓选，其实与奖券开出的号码无异。对财迷而言，固有射倖之快；但对阿拉伯数字而言，并无雀屏之喜...
7	001.对自然要自然.txt	7	你是从土而出的，你本是尘土，仍要归于尘土。	自然对人的意义，应该只有两点：第一点，自然本身是变化无穷的壮观，不论是朝晖夕阴，不论是暴雨明霞，不论是飞絮满天或落叶满地……种种奇景，都值得人在恬静中或快乐中赏心悦目。第二点，自然应带给人对宇宙的远大看法，物换星移，时序代谢……都是使人了解宇宙真相的凭借。西方的诗人从一粒沙中看世界，从一朵花中看天国；东方的诗人从长江中看逝者如斯，从明月中看盈虚者如彼……这种...
6	001.对自然要自然.txt	7	自己乃是不断的在死亡中	自然对人的意义，应该只有两点：第一点，自然本身是变化无穷的壮观，不论是朝晖夕阴，不论是暴雨明霞，不论是飞絮满天或落叶满地……种种奇景，都值得人在恬静中或快乐中赏心悦目。第二点，自然应带给人对宇宙的远大看法，物换星移，时序代谢……都是使人了解宇宙真相的凭借。西方的诗人从一粒沙中看世界，从一朵花中看天国；东方的诗人从长江中看逝者如斯，从明月中看盈虚者如彼……这种...
4	001.对自然要自然.txt	7	让自然做你的老师	自然对人的意义，应该只有两点：第一点，自然本身是变化无穷的壮观，不论是朝晖夕阴，不论是暴雨明霞，不论是飞絮满天或落叶满地……种种奇景，都值得人在恬静中或快乐中赏心悦目。第二点，自然应带给人对宇宙的远大看法，物换星移，时序代谢……都是使人了解宇宙真相的凭借。西方的诗人从一粒沙中看世界，从一朵花中看天国；东方的诗人从长江中看逝者如斯，从明月中看盈虚者如彼……这种...
3	001.对自然要自然.txt	7	氮化循环	自然对人的意义，应该只有两点：第一点，自然本身是变化无穷的壮观，不论是朝晖夕阴，不论是暴雨明霞，不论是飞絮满天或落叶满地……种种奇景，都值得人在恬静中或快乐中赏心悦目。第二点，自然应带给人对宇宙的远大看法，物换星移，时序代谢……都是使人了解宇宙真相的凭借。西方的诗人从一粒沙中看世界，从一朵花中看天国；东方的诗人从长江中看逝者如斯，从明月中看盈虚者如彼……这种...
5	004.用冰冷表现洁白.txt	3	假如人的品德能像雪那样的洁白，心地不像雪那么冰冷该有多好	二十五年没见过雪，这次久别重逢，你的感觉自然是深刻动人的。你说“假如人的品德能像雪那样的洁白，心地不像雪那么冰冷该有多好”，但你有没有注意到，有些洁白，却正用冰冷来表现？
3	005.朋友的没落.txt	5	大夫无私交	古人说“大夫无私交”，只讲公益的人，几乎不需要私人的友谊，至少不需要较亲近的私人友谊。可以进你家门的朋友，一定会知道太多没有必要知道的，而会在有意无意之间，把你出卖。敌人永远不会出卖你，因为他知道你太少。所以敌人有一个长处——他不会使你伤心。
7	009.“显性伪君子”和“隐性伪君子”.txt	3	伪君子生着一张总主教的脸，却有着一颗磨坊主人的心。	耶稣虽然爱人，但对一种人却痛恨不已，这种人，就是“伪君子”。在《新约》中，我们可以一再看到耶稣痛恨这种人的话。伪君子的问题，对人类说来，是个又老又大的问题。希腊谚语说：“伪君子生着一张总主教的脸，却有着一颗磨坊主人的心。”如果一个人没有总主教的脸，只有磨坊主人的脸，加上磨坊主人的心，这种人，不算伪君子。只有戴上总主教的面具的，才算伪君子。伪君子的可恶，不在他...
3	009.“显性伪君子”和“隐性伪君子”.txt	3	伪君子	耶稣虽然爱人，但对一种人却痛恨不已，这种人，就是“伪君子”。在《新约》中，我们可以一再看到耶稣痛恨这种人的话。伪君子的问题，对人类说来，是个又老又大的问题。希腊谚语说：“伪君子生着一张总主教的脸，却有着一颗磨坊主人的心。”如果一个人没有总主教的脸，只有磨坊主人的脸，加上磨坊主人的心，这种人，不算伪君子。只有戴上总主教的面具的，才算伪君子。伪君子的可恶，不在他...
3	009.“显性伪君子”和“隐性伪君子”.txt	3	真小人	耶稣虽然爱人，但对一种人却痛恨不已，这种人，就是“伪君子”。在《新约》中，我们可以一再看到耶稣痛恨这种人的话。伪君子的问题，对人类说来，是个又老又大的问题。希腊谚语说：“伪君子生着一张总主教的脸，却有着一颗磨坊主人的心。”如果一个人没有总主教的脸，只有磨坊主人的脸，加上磨坊主人的心，这种人，不算伪君子。只有戴上总主教的面具的，才算伪君子。伪君子的可恶，不在他...
5	009.“显性伪君子”和“隐性伪君子”.txt	7	你不是清教徒呀！你怎么不上去打，上去保护我们呀！ 	第一个故事是和富兰克林有关的。富兰克林说清教徒从欧洲坐船去美洲，半路上碰到海盗，清教徒是反对战争的，所以不肯打，他们纷纷跑到船舱里，听甲板上打来打去。这时候，忽然一个仆人也从甲板上下来了，清教徒们一起骂他说：“你不是清教徒呀！你怎么不上去打，上去保护我们呀！ ”
8	009.“显性伪君子”和“隐性伪君子”.txt	11	大概我通奸被人捉，都不会挨这么多的骂吧？	第三个故事是和我自己有关的。萧孟能把他白手起家的发妻抛弃，把十五户房地都过户给别的女人，要跟发妻离婚。我认为感情有变化，要离婚，也是人之常情。但夫妻一起赚的钱，总不能由丈夫一个人独吞，至少该分太太一半，但萧太太始终分不到。后来穷得给人做下女，每月挣八千元糊口。我气不过，要主持正义，陪她去找萧孟能理论，这就是国民党新闻界大加渲染的“捉奸案”。国民党新闻界和所谓...
8	009.“显性伪君子”和“隐性伪君子”.txt	11	大概我跑去献花，才能符合他们的正义标准吧？	第三个故事是和我自己有关的。萧孟能把他白手起家的发妻抛弃，把十五户房地都过户给别的女人，要跟发妻离婚。我认为感情有变化，要离婚，也是人之常情。但夫妻一起赚的钱，总不能由丈夫一个人独吞，至少该分太太一半，但萧太太始终分不到。后来穷得给人做下女，每月挣八千元糊口。我气不过，要主持正义，陪她去找萧孟能理论，这就是国民党新闻界大加渲染的“捉奸案”。国民党新闻界和所谓...
4	009.“显性伪君子”和“隐性伪君子”.txt	11	正义之士	第三个故事是和我自己有关的。萧孟能把他白手起家的发妻抛弃，把十五户房地都过户给别的女人，要跟发妻离婚。我认为感情有变化，要离婚，也是人之常情。但夫妻一起赚的钱，总不能由丈夫一个人独吞，至少该分太太一半，但萧太太始终分不到。后来穷得给人做下女，每月挣八千元糊口。我气不过，要主持正义，陪她去找萧孟能理论，这就是国民党新闻界大加渲染的“捉奸案”。国民党新闻界和所谓...
3	009.“显性伪君子”和“隐性伪君子”.txt	11	正义	第三个故事是和我自己有关的。萧孟能把他白手起家的发妻抛弃，把十五户房地都过户给别的女人，要跟发妻离婚。我认为感情有变化，要离婚，也是人之常情。但夫妻一起赚的钱，总不能由丈夫一个人独吞，至少该分太太一半，但萧太太始终分不到。后来穷得给人做下女，每月挣八千元糊口。我气不过，要主持正义，陪她去找萧孟能理论，这就是国民党新闻界大加渲染的“捉奸案”。国民党新闻界和所谓...
5	009.“显性伪君子”和“隐性伪君子”.txt	13	李敖，你这不要脸的爱情骗子，你离婚为什么不付赡养费？希望不良分子杀掉你！	第四个故事也是和我自己有关的。我离婚后，接到一张明信片，上面写：“李敖，你这不要脸的爱情骗子，你离婚为什么不付赡养费？希望不良分子杀掉你！”下面是匿名的——这种品级的“正义之士”总是匿名的，只写“一群主持正义的人同启”。奇怪吧？他们主持正义，为什么不亲自动手来杀我呢？为什么要他们看不起的“不良分子”来动手呢？
3	009.“显性伪君子”和“隐性伪君子”.txt	13	一群主持正义的人同启	第四个故事也是和我自己有关的。我离婚后，接到一张明信片，上面写：“李敖，你这不要脸的爱情骗子，你离婚为什么不付赡养费？希望不良分子杀掉你！”下面是匿名的——这种品级的“正义之士”总是匿名的，只写“一群主持正义的人同启”。奇怪吧？他们主持正义，为什么不亲自动手来杀我呢？为什么要他们看不起的“不良分子”来动手呢？
8	009.“显性伪君子”和“隐性伪君子”.txt	17	见其生不忍见其死；闻其声，不忍食其肉	另一种伪君子，伪得比较消极，是以躲避的方法行其伪善的。《孟子》里说“君子远庖厨”（君子要躲屠宰场、厨房远一点），为的是，看到动物被宰割，君子会“见其生不忍见其死；闻其声，不忍食其肉”。这样一来，岂不倒了胃口？君子既然不能不吃鸡鸭鱼肉，所以庖厨就不得不远了，这是一种变形的伪善。前一阵子国民党新闻界大登谢东闵参观鹿茸工厂，看到一条条鹿被锯角取血的惨状，说谢东闵表...
4	009.“显性伪君子”和“隐性伪君子”.txt	17	君子远庖厨	另一种伪君子，伪得比较消极，是以躲避的方法行其伪善的。《孟子》里说“君子远庖厨”（君子要躲屠宰场、厨房远一点），为的是，看到动物被宰割，君子会“见其生不忍见其死；闻其声，不忍食其肉”。这样一来，岂不倒了胃口？君子既然不能不吃鸡鸭鱼肉，所以庖厨就不得不远了，这是一种变形的伪善。前一阵子国民党新闻界大登谢东闵参观鹿茸工厂，看到一条条鹿被锯角取血的惨状，说谢东闵表...
5	009.“显性伪君子”和“隐性伪君子”.txt	23	你有十块钱，为什么不捐给红十字会呢？	与这种德性相对的，是一种“花枝招展”的影歌星派，他们最喜欢搞慈善演唱会，叫别人捐钱义卖，自己却带着星妈一毛不拔。这种以“文化美容”为号召的人，整天打着慈善的招牌作秀，真是伪中之尤。一个笑话说：小茵的爸爸问小茵：“你有十块钱，为什么不捐给红十字会呢？”小茵答道：“我本来想捐的，可是由卖冰淇淋的去捐，不更好吗？”我每次看到脸这样美的，心这样丑，我就想到小茵和她的...
5	009.“显性伪君子”和“隐性伪君子”.txt	23	我本来想捐的，可是由卖冰淇淋的去捐，不更好吗？	与这种德性相对的，是一种“花枝招展”的影歌星派，他们最喜欢搞慈善演唱会，叫别人捐钱义卖，自己却带着星妈一毛不拔。这种以“文化美容”为号召的人，整天打着慈善的招牌作秀，真是伪中之尤。一个笑话说：小茵的爸爸问小茵：“你有十块钱，为什么不捐给红十字会呢？”小茵答道：“我本来想捐的，可是由卖冰淇淋的去捐，不更好吗？”我每次看到脸这样美的，心这样丑，我就想到小茵和她的...
4	010.“三毛式伪善”和“金庸式伪善”.txt	3	有一位作家很仰慕李先生，我也请她来了，就是三毛。	有一次，皇冠的平鑫涛请我吃饭，由皇冠的几位同仁作陪，我到了以后，平鑫涛说：“有一位作家很仰慕李先生，我也请她来了，就是三毛。”于是他把三毛介绍了给我。
6	010.“三毛式伪善”和“金庸式伪善”.txt	5	不是个喜欢把自己落在框子里去说话的人	三毛很友善，但我对她印象欠佳。三毛说她：“不是个喜欢把自己落在框子里去说话的人”，我看却正好相反，我看她整天在兜她的框框，这个框框就是她那个一再重复的爱情故事，其中有白虎星式的克夫、白云乡式的逃世、白血病式的国际路线，和白开水式的泛滥感情。如果三毛是个美人，也许她可以以不断的风流余韵传世，因为这算是美人的特权，但三毛显然不是，所以，她的“美丽的”爱情故事，是...
4	010.“三毛式伪善”和“金庸式伪善”.txt	5	悲泣的爱神	三毛很友善，但我对她印象欠佳。三毛说她：“不是个喜欢把自己落在框子里去说话的人”，我看却正好相反，我看她整天在兜她的框框，这个框框就是她那个一再重复的爱情故事，其中有白虎星式的克夫、白云乡式的逃世、白血病式的国际路线，和白开水式的泛滥感情。如果三毛是个美人，也许她可以以不断的风流余韵传世，因为这算是美人的特权，但三毛显然不是，所以，她的“美丽的”爱情故事，是...
6	010.“三毛式伪善”和“金庸式伪善”.txt	7	你说你帮助黄沙中的黑人，你为什么不帮助黑暗中的黄人？你自己的同胞更需要你的帮助啊！舍近而求远，去亲而就疏，这可有点不对劲吧？并且，史怀哲不会又帮助黑人，又在加那利群岛留下别墅和‘外汇存底’吧？你怎么解释你的财产呢？	比起琼瑶来，三毛其实是琼瑶的一个变种。琼瑶的主题是花草月亮淡淡的哀愁，三毛则是花草月亮淡淡的哀愁之外，又加上一大把黄沙。而三毛的毛病，就出在这大把黄沙上。三毛的黄沙里有所谓“燃烧是我不灭的爱”，她跟我说：她去非洲沙漠，是要帮助那些黄沙中的黑人，他们需要她的帮助。她是基督徒，她佩服去非洲的史怀哲，所以，她也去非洲了。我说：“你说你帮助黄沙中的黑人，你为什么不帮...
4	010.“三毛式伪善”和“金庸式伪善”.txt	7	燃烧是我不灭的爱	比起琼瑶来，三毛其实是琼瑶的一个变种。琼瑶的主题是花草月亮淡淡的哀愁，三毛则是花草月亮淡淡的哀愁之外，又加上一大把黄沙。而三毛的毛病，就出在这大把黄沙上。三毛的黄沙里有所谓“燃烧是我不灭的爱”，她跟我说：她去非洲沙漠，是要帮助那些黄沙中的黑人，他们需要她的帮助。她是基督徒，她佩服去非洲的史怀哲，所以，她也去非洲了。我说：“你说你帮助黄沙中的黑人，你为什么不帮...
4	010.“三毛式伪善”和“金庸式伪善”.txt	9	三毛式伪善	三毛听了我的话，有点窘，她答复不出来。她当然答复不出来，为什么？因为三毛所谓帮助黄沙中的黑人，其实是一种“秀”，其性质与影歌星等慈善演唱并无不同，他们做“秀”的成分大于一切，你绝不能认真。比如说，你真的信三毛是基督徒吗？她在关庙下跪求签，这是哪一门子的基督徒呢？她迷信星相命运之学，这又是哪一门子的基督徒呢……所以，三毛的言行，无非白虎星式的克夫，白云乡式的逃...
6	010.“三毛式伪善”和“金庸式伪善”.txt	11	佛经里讲‘七法财’‘七圣财’‘七德财’，虽然《报恩经》《未曾有因缘经》《宝积经》《长阿含经》《中阿含经》等等所说的有点出入，但大体上，无不以舍弃财产为要件。所谓‘舍离一切，而无染着’，所谓‘随求给施，无所吝惜’。你有这么多的财产在身边，你说你是虔诚的佛教徒，你怎么解释你的财产呢？	“三毛式伪善”，比起另一种伪善来，还算是小焉者也。另一种伪善是金庸式的。金庸为国民党捧场，跑到台湾来。有一天晚上到我家，一谈八小时。我责备他不该参加什么“国建会”，自失他过去的立场。他说他参加，也说了不少批评的话。我说这是不够的、得不偿失的、小骂大帮忙的，你参加这种会，真教人失望。接着谈到他写的武侠，我说胡适之说武侠小说“下流”，我有同感。我是不看武侠的，以...
4	010.“三毛式伪善”和“金庸式伪善”.txt	11	三毛式伪善	“三毛式伪善”，比起另一种伪善来，还算是小焉者也。另一种伪善是金庸式的。金庸为国民党捧场，跑到台湾来。有一天晚上到我家，一谈八小时。我责备他不该参加什么“国建会”，自失他过去的立场。他说他参加，也说了不少批评的话。我说这是不够的、得不偿失的、小骂大帮忙的，你参加这种会，真教人失望。接着谈到他写的武侠，我说胡适之说武侠小说“下流”，我有同感。我是不看武侠的，以...
3	010.“三毛式伪善”和“金庸式伪善”.txt	11	国建会	“三毛式伪善”，比起另一种伪善来，还算是小焉者也。另一种伪善是金庸式的。金庸为国民党捧场，跑到台湾来。有一天晚上到我家，一谈八小时。我责备他不该参加什么“国建会”，自失他过去的立场。他说他参加，也说了不少批评的话。我说这是不够的、得不偿失的、小骂大帮忙的，你参加这种会，真教人失望。接着谈到他写的武侠，我说胡适之说武侠小说“下流”，我有同感。我是不看武侠的，以...
4	010.“三毛式伪善”和“金庸式伪善”.txt	13	金庸式伪善	金庸听了我的话，有点窘，他答复不出来。他当然答复不出来，为什么？因为金庸所谓信佛，其实是一种“选择法”，凡是对他有利的，他就信；对他不利的，他就佯装不见，其性质，与善男信女并无不同，自私的成分大于一切，你绝不能认真。他是伪善的，这种伪善，自成一家，可叫做“金庸式伪善”。
3	010.“三毛式伪善”和“金庸式伪善”.txt	15	没有仆人能侍奉两个主人：不是恨这个，就得爱那个；不是重这个，就得轻那个。你不能同时侍奉上帝，又侍奉财神。	《新约》里说：“没有仆人能侍奉两个主人：不是恨这个，就得爱那个；不是重这个，就得轻那个。你不能同时侍奉上帝，又侍奉财神。”
5	011.呜呼新女性.txt	5	有好条件的女人，下场都悲惨	因为不知天高地厚，所以即使在自我毁灭时，她们还在神气活现，还在招待记者，还在自以为“择善固执”“替天行道”“大义灭亲”……结果呢，全世界没人能够吃得消她，但她绝不自知，绝不自己检讨检讨，反倒觉得全世界都对不起她。最后，当红颜老去，当掌声已歇，当她那点作秀式的程度被淘汰、被厌倦，最后自然是“红颜薄命”的下场。古话说“红颜薄命”，现在时代变了，女人抬头了，这四个...
3	011.呜呼新女性.txt	11	维多利亚女王！	英国维多利亚女王做了女王，自然难免骄气。一天晚上敲房门，丈夫Albert问是谁，她神气的说：“维多利亚女王！”Albert不理她，直到她小心的说：“Your wife, Albert!”（你的太太，阿尔伯特！）门才开了。作为一个女人，不论自己有多少分好条件，如果不能明辨自己的立场，不能清楚自己是老几，老是想争自己人的风，老是想打倒她不该打倒也打不倒的对象，这...
5	011.呜呼新女性.txt	19	你们看，不管男人怎么捣蛋，我达到了今天的成就！	她们再也不来和我商谈，忽视我、对付我。我写好《斯人》，把书稿寄给《女士杂志》，她们回说：“我们没有兴趣出版。”我就这样被放逐了。这样很好，反正我也不愿意和“宗教狂”扯上关系。这是又一种的宗教狂热，妇解分子真正要我做的是站起来疾声高呼：“你们看，不管男人怎么捣蛋，我达到了今天的成就！”我的意思是，我正巧是个反面的例子。如果要挑出几个当代成功妇女的典型，你一定得...
4	011.呜呼新女性.txt	19	不对，不是这样的。身为女人对我的事业有帮助，很有帮助！	她们再也不来和我商谈，忽视我、对付我。我写好《斯人》，把书稿寄给《女士杂志》，她们回说：“我们没有兴趣出版。”我就这样被放逐了。这样很好，反正我也不愿意和“宗教狂”扯上关系。这是又一种的宗教狂热，妇解分子真正要我做的是站起来疾声高呼：“你们看，不管男人怎么捣蛋，我达到了今天的成就！”我的意思是，我正巧是个反面的例子。如果要挑出几个当代成功妇女的典型，你一定得...
8	011.呜呼新女性.txt	21	不对，发生这种事不是因为你是女人，是因为你不行！	有两件事对我很有好处——生为女人和出身贫穷，使我一直鞭策自己努力向前。我曾说过，假使我的名字是奥瑞安诺，是个男人而且是马尔波若公爵的儿子，现在很可能只是个他妈的白痴，因为没有什么可奋斗的。而且，具有我这种气质，作为女人要比男人制造更多新闻，如果是奥瑞安诺写这些访问和书，一定不会像现在这么快变得这么有名。所以，显然是作为女人比较有利，这惹恼了妇解分子。我讨厌她...
5	011.呜呼新女性.txt	21	因为我是女人才发生这种事。	有两件事对我很有好处——生为女人和出身贫穷，使我一直鞭策自己努力向前。我曾说过，假使我的名字是奥瑞安诺，是个男人而且是马尔波若公爵的儿子，现在很可能只是个他妈的白痴，因为没有什么可奋斗的。而且，具有我这种气质，作为女人要比男人制造更多新闻，如果是奥瑞安诺写这些访问和书，一定不会像现在这么快变得这么有名。所以，显然是作为女人比较有利，这惹恼了妇解分子。我讨厌她...
3	011.呜呼新女性.txt	23	因为我是女人才发生这种事	但是，“新女性”有几个了解到这一关键呢？今日以“新女性”为号召的人，她们整天吃男人、喝男人、花男人的钱、戴男人的玉、坐男人的车、抄男人的文章出书。结果却不知天高地厚、不辨亲疏与是非，反过头来，与男人虚荣争胜，或以伪证方式“大义灭亲”，争自己人的风，然后哭诉“因为我是女人才发生这种事”，这不是令人恶心的卑鄙小人吗？
7	011.呜呼新女性.txt	27	女人有好条件都不会处理，不如没好条件。	中国的谚语说“女子无才便是德”，意大利的谚语说A learned woman is twice a fool.（有学问的女人是双料愚人），如果不做古典的解释，这两段谚语倒真是“新女性”的写照与警告，翻成现代语言，该是“女人没有好条件才不是混蛋”，“女人有好条件都不会处理，不如没好条件。”看了那么多的混蛋“新女性”，我真愈来愈凝固了我的这种偏见。
6	011.呜呼新女性.txt	27	女人没有好条件才不是混蛋	中国的谚语说“女子无才便是德”，意大利的谚语说A learned woman is twice a fool.（有学问的女人是双料愚人），如果不做古典的解释，这两段谚语倒真是“新女性”的写照与警告，翻成现代语言，该是“女人没有好条件才不是混蛋”，“女人有好条件都不会处理，不如没好条件。”看了那么多的混蛋“新女性”，我真愈来愈凝固了我的这种偏见。
4	011.呜呼新女性.txt	27	女子无才便是德	中国的谚语说“女子无才便是德”，意大利的谚语说A learned woman is twice a fool.（有学问的女人是双料愚人），如果不做古典的解释，这两段谚语倒真是“新女性”的写照与警告，翻成现代语言，该是“女人没有好条件才不是混蛋”，“女人有好条件都不会处理，不如没好条件。”看了那么多的混蛋“新女性”，我真愈来愈凝固了我的这种偏见。
3	011.呜呼新女性.txt	27	新女性	中国的谚语说“女子无才便是德”，意大利的谚语说A learned woman is twice a fool.（有学问的女人是双料愚人），如果不做古典的解释，这两段谚语倒真是“新女性”的写照与警告，翻成现代语言，该是“女人没有好条件才不是混蛋”，“女人有好条件都不会处理，不如没好条件。”看了那么多的混蛋“新女性”，我真愈来愈凝固了我的这种偏见。
