score	file	line	text	context
3	025.昭陵六骏.txt	105	我错了吗？	“我错了吗？”
3	025.昭陵六骏.txt	107	你没有错，只是实际上，可能你叫的是My God！由上帝代你表达要叫出的一切。只是那种情况发生时，一片混乱，上帝是指什么，也就难说了。	“你没有错，只是实际上，可能你叫的是My God！由上帝代你表达要叫出的一切。只是那种情况发生时，一片混乱，上帝是指什么，也就难说了。”
3	025.昭陵六骏.txt	111	别忘了你是我的模特儿。我常常提醒我也别忘了。我常常想到你是模特儿式‘演出’、是make-believe，甚至是pretend to be SEVENTEEN。	“别忘了你是我的模特儿。我常常提醒我也别忘了。我常常想到你是模特儿式‘演出’、是make-believe，甚至是pretend to be SEVENTEEN。”
3	025.昭陵六骏.txt	115	没错，正是十七岁。但那是你的十七岁，不是我的十七岁。所以呀，十七岁的模特儿是听命行事的，在扮演我的十七岁时候，难免跟你自己的十七岁不一致，所以那时候，你要逢场作戏，engage in merry-making occasionally，当然，也可能不是merry-making，而是merry haha，或是merry hell，谁知道呢？	“没错，正是十七岁。但那是你的十七岁，不是我的十七岁。所以呀，十七岁的模特儿是听命行事的，在扮演我的十七岁时候，难免跟你自己的十七岁不一致，所以那时候，你要逢场作戏，engage in merry-making occasionally，当然，也可能不是merry-making，而是merry haha，或是merry hell，谁知道呢？”
7	025.昭陵六骏.txt	117	看来做模特儿的下场很复杂，复杂得像这六匹马。	“看来做模特儿的下场很复杂，复杂得像这六匹马。”朱仑朝马指点着。“六匹马子。”她补了一句。
3	025.昭陵六骏.txt	117	六匹马子。	“看来做模特儿的下场很复杂，复杂得像这六匹马。”朱仑朝马指点着。“六匹马子。”她补了一句。
3	025.昭陵六骏.txt	119	你十七岁的语言——‘马子’，你知道它在简明字典以外的意义吗？马子在中文里指一件用品，是什么？	“你十七岁的语言——‘马子’，你知道它在简明字典以外的意义吗？马子在中文里指一件用品，是什么？”
3	025.昭陵六骏.txt	121	是什么？	“是什么？”
3	025.昭陵六骏.txt	123	是一件给男人排泄的容器，就是俗称的夜壶。它在中国汉朝时一直叫‘虎子’，到了唐朝，骑过昭陵六骏的那位唐太宗叫李世民，他的祖父叫李虎，‘虎子’犯了忌讳，就把‘虎子’改为‘马子’了。所以呀，今天年轻人把女朋友叫作‘马子’，不知道‘马子’是那么写实的服务用品，多有趣呀。	“是一件给男人排泄的容器，就是俗称的夜壶。它在中国汉朝时一直叫‘虎子’，到了唐朝，骑过昭陵六骏的那位唐太宗叫李世民，他的祖父叫李虎，‘虎子’犯了忌讳，就把‘虎子’改为‘马子’了。所以呀，今天年轻人把女朋友叫作‘马子’，不知道‘马子’是那么写实的服务用品，多有趣呀。”
6	025.昭陵六骏.txt	127	所以呀，要不倒楣，博学多么重要。博学就不会马马虎虎，年轻人知道唐太宗这些，马马虎虎，是马是虎，都随皇上决定，该多么郁卒啊。十七岁以为自己在反叛，很屌、很跩、很smart或什么，其实啊，都是些小傻瓜儿、都被要玩他们的人给玩了，并且从古人开始，像唐太宗。	“所以呀，要不倒楣，博学多么重要。博学就不会马马虎虎，年轻人知道唐太宗这些，马马虎虎，是马是虎，都随皇上决定，该多么郁卒啊。十七岁以为自己在反叛，很屌、很跩、很smart或什么，其实啊，都是些小傻瓜儿、都被要玩他们的人给玩了，并且从古人开始，像唐太宗。”
3	025.昭陵六骏.txt	129	你说得很毒辣。但你能避免吗？一，你也有过十七岁；二，他的‘昭陵六骏’就在你墙上。你身上的唐太宗，一只虎六匹马，比十七岁的还多呢。	“你说得很毒辣。但你能避免吗？一，你也有过十七岁；二，他的‘昭陵六骏’就在你墙上。你身上的唐太宗，一只虎六匹马，比十七岁的还多呢。”
3	025.昭陵六骏.txt	131	真会说话啊，你这可爱的十七岁。你说得都有道理，但别忘了我有一个焦点是什么，那就是从‘昭陵六骏’可以反对美国，伸张民族大义，唐太宗为我所用，他的六匹马，六匹怪名的阿拉伯马，都是我反美的道具，请别忘了这一焦点。	“真会说话啊，你这可爱的十七岁。你说得都有道理，但别忘了我有一个焦点是什么，那就是从‘昭陵六骏’可以反对美国，伸张民族大义，唐太宗为我所用，他的六匹马，六匹怪名的阿拉伯马，都是我反美的道具，请别忘了这一焦点。”
3	025.昭陵六骏.txt	133	我不会忘，唐太宗的爷爷，李虎，和六匹马：‘飒露紫’、‘拳毛騧’、‘白蹄乌’、‘特勒骠’、‘什伐赤’，和‘青骓’。	“我不会忘，唐太宗的爷爷，李虎，和六匹马：‘飒露紫’、‘拳毛騧’、‘白蹄乌’、‘特勒骠’、‘什伐赤’，和‘青骓’。”
3	025.昭陵六骏.txt	135	什么？你立刻记得这六个难记的怪名字？	“什么？你立刻记得这六个难记的怪名字？”
4	025.昭陵六骏.txt	139	你是神童、神‘马子’？	“你是神童、神‘马子’？”
3	025.昭陵六骏.txt	141	谁说我不是？尤其，你大师说我是，我一定是。我刚才看到‘昭陵六骏’下的小字说明，就立刻会记得。说看到，不够准确，说扫描到吧。	“谁说我不是？尤其，你大师说我是，我一定是。我刚才看到‘昭陵六骏’下的小字说明，就立刻会记得。说看到，不够准确，说扫描到吧。”
3	025.昭陵六骏.txt	143	你这种速学速记的本领，除了神童、神‘马子’的神通外，有后天的训练吗？像是速读、快速记忆之类？	“你这种速学速记的本领，除了神童、神‘马子’的神通外，有后天的训练吗？像是速读、快速记忆之类？”
3	025.昭陵六骏.txt	145	没有，也不需要。因为，因为我是神童，可是太电脑了一点，就说我是电脑神童吧！谁又知道我是不是？也许只有电脑知道我是，谁又知道呢？	“没有，也不需要。因为，因为我是神童，可是太电脑了一点，就说我是电脑神童吧！谁又知道我是不是？也许只有电脑知道我是，谁又知道呢？”
3	026.白鲸.txt	3	说我大名鼎鼎，其实与我同时代的人们只知道我一部分，就好像与Herman Melville（梅尔维尔）同时代的人们只知道他一部分一样。他写的Moby Dick《白鲸记》小说，在他生前并没被看好；他写的Billy Budd《比利·巴德》小说，死后在他书桌上发现，死后三十三年才出版。他死得很寂寞，报上的一小块讣文说他最好的小说是Taipi（泰皮），真是小看他了。	我告诉朱仑，“说我大名鼎鼎，其实与我同时代的人们只知道我一部分，就好像与Herman Melville（梅尔维尔）同时代的人们只知道他一部分一样。他写的Moby Dick《白鲸记》小说，在他生前并没被看好；他写的Billy Budd《比利·巴德》小说，死后在他书桌上发现，死后三十三年才出版。他死得很寂寞，报上的一小块讣文说他最好的小说是Taipi（泰皮），真...
4	026.白鲸.txt	5	Taipi这小说，听来好像Taipei（台北）。	“Taipi这小说，听来好像Taipei（台北）。”
3	026.白鲸.txt	7	是啊，Melville最好的部分，与他同时代的人不知道。只有他在‘台北’那部分被人知道。	“是啊，Melville最好的部分，与他同时代的人不知道。只有他在‘台北’那部分被人知道。”
4	026.白鲸.txt	9	正像大师，在‘台北’的那部分。	“正像大师，在‘台北’的那部分。”
4	026.白鲸.txt	11	问题是Melville只跟食人族Typees（泰皮族）住了四个月，我却一住五十年。	“问题是Melville只跟食人族Typees（泰皮族）住了四个月，我却一住五十年。”
4	026.白鲸.txt	13	Melville死后一个多世纪，他总算得到全面的公道。你看白鲸故事都上了电影了。	“Melville死后一个多世纪，他总算得到全面的公道。你看白鲸故事都上了电影了。”
3	026.白鲸.txt	15	但白鲸人物也进了咖啡馆了。星巴克不是Starbucks吗？Starbuck不正是小说里面那大副吗？多么动人的人物，大副一直反对Ahab（亚哈）船长对白鲸复仇，最后看到船长在白鲸身上，死犹向他们招手，大副决定一起身殉了，多么动人的人物，他不为船长的目的而死，却为船长的精神而死。	“但白鲸人物也进了咖啡馆了。星巴克不是Starbucks吗？Starbuck不正是小说里面那大副吗？多么动人的人物，大副一直反对Ahab（亚哈）船长对白鲸复仇，最后看到船长在白鲸身上，死犹向他们招手，大副决定一起身殉了，多么动人的人物，他不为船长的目的而死，却为船长的精神而死。”
4	026.白鲸.txt	17	我觉得我背得出那一段，那大副呼吁船长不要再发疯那一段：“Oh！Ahab,	“我觉得我背得出那一段，那大副呼吁船长不要再发疯那一段：“Oh！Ahab,” cried Starbuck, “not too late is it, even now, the third day, to desist. See！Moby Dick seeks thee not. It is thou, thou, that madly seekest h...
3	026.白鲸.txt	19	你背得出来，你这小神童，你什么事都干得出来！我已经见怪不怪。我谈到Starbuck，他的精神多么动人，会跟疯子做疯的事。但对疯子而言，又未必能用疯狂来概括他。Ahab船长的信念是复仇，复仇有时候是一种伟大的情操，《白鲸记》写活了这一点，只是敌人是白鲸而已。	“你背得出来，你这小神童，你什么事都干得出来！我已经见怪不怪。我谈到Starbuck，他的精神多么动人，会跟疯子做疯的事。但对疯子而言，又未必能用疯狂来概括他。Ahab船长的信念是复仇，复仇有时候是一种伟大的情操，《白鲸记》写活了这一点，只是敌人是白鲸而已。”
3	026.白鲸.txt	21	跟白鲸作战与跟风车作战有太大的不同吗？	“跟白鲸作战与跟风车作战有太大的不同吗？”
4	026.白鲸.txt	23	Moby Dick seeks thee not. It is thou, thou, that madly seekest him！	“问题问得好，可是要问Don Quixote（唐吉诃德），老唐如果转移战场到海上，他不跟白鲸对干才怪呢。这都是人类的大脑问题。星巴克大副，和那老唐的忠诚追随者，也都是大脑问题，他们窃取他们领导的大脑而冲昏了自己的，用下洋泾浜英文，该是Picking their leader's brains turn their's。至于白鲸呢，它的大脑有九点二公斤，虽然和...
4	027.从忘情到坐姿.txt	3	该忘、不该忘，这是哲学问题。	“该忘、不该忘，这是哲学问题。”我说。
5	027.从忘情到坐姿.txt	5	在你的哲学里，你会忘掉我吗？	“在你的哲学里，你会忘掉我吗？”朱仑问。
4	027.从忘情到坐姿.txt	7	我跟你的关系，什么都记得，不管它有没有发生。	“我跟你的关系，什么都记得，不管它有没有发生。”
4	027.从忘情到坐姿.txt	9	你的哲学，真博大思精、真可爱。	“你的哲学，真博大思精、真可爱。”
4	027.从忘情到坐姿.txt	13	对知识，我记得越多越好；对人们，我忘得越快越好。只记得情，才是最聪明的，别的全忘掉。	“对知识，我记得越多越好；对人们，我忘得越快越好。只记得情，才是最聪明的，别的全忘掉。”朱仑对着夕阳，一个人在说着。
5	027.从忘情到坐姿.txt	17	举个例，像——	“举个例，像——”
7	027.从忘情到坐姿.txt	19	像那些连像样的情书都写不上几句的中学生，语文程度差到只会写‘火星文’的。	“像那些连像样的情书都写不上几句的中学生，语文程度差到只会写‘火星文’的。”
3	027.从忘情到坐姿.txt	21	有例外吗？	“有例外吗？”
3	027.从忘情到坐姿.txt	25	调查局有鉴定的程度吗？	“调查局有鉴定的程度吗？”
4	027.从忘情到坐姿.txt	27	鉴定他们，不需要程度。	“鉴定他们，不需要程度。”
4	027.从忘情到坐姿.txt	29	听来‘太上忘情’的境界，很酷吧？	“听来‘太上忘情’的境界，很酷吧？”
3	027.从忘情到坐姿.txt	31	更酷的是‘太上忘情’的姿式。古代哲学家庄子宣扬‘坐忘’，定义是‘堕身体，黜聪明，离形去知’，坐在那里，显出境界。	“更酷的是‘太上忘情’的姿式。古代哲学家庄子宣扬‘坐忘’，定义是‘堕身体，黜聪明，离形去知’，坐在那里，显出境界。”
4	027.从忘情到坐姿.txt	35	你有那么好的境界，当然可以。告诉你一个秘密吧，是和你谈话的秘密。要听吗？	“你有那么好的境界，当然可以。告诉你一个秘密吧，是和你谈话的秘密。要听吗？”
4	027.从忘情到坐姿.txt	37	要听极了，我老是秘密的喜欢秘密，我是一个人的CIA。	“要听极了，我老是秘密的喜欢秘密，我是一个人的CIA。”
4	027.从忘情到坐姿.txt	39	我和你不一样，我也是一个人，但是听告解的神父，听到的秘密，不比CIA少。	“我和你不一样，我也是一个人，但是听告解的神父，听到的秘密，不比CIA少。”
4	027.从忘情到坐姿.txt	41	你这位神父，说说你的秘密看。	“你这位神父，说说你的秘密看。”
3	027.从忘情到坐姿.txt	43	我的秘密是，跟你谈话，是一种惊喜、一种享受。一开始我很苦恼，奇怪你为什么知道那么多，后来查也查不出来，我就学着见怪不怪了、我不再追究了、我‘原谅’你了。	“我的秘密是，跟你谈话，是一种惊喜、一种享受。一开始我很苦恼，奇怪你为什么知道那么多，后来查也查不出来，我就学着见怪不怪了、我不再追究了、我‘原谅’你了。”
3	027.从忘情到坐姿.txt	47	一点都没说错，是‘原谅’。你大概不知道，我是又渊博又高傲的人，没有什么人能够跟得上我的谈话，但是，自从你出现以后，你使我不再‘落单’了，世界上，居然有个天才的十七岁，可以跟我‘坐而论道’了。所以我说，跟你谈话，是一种惊喜、一种享受。	“一点都没说错，是‘原谅’。你大概不知道，我是又渊博又高傲的人，没有什么人能够跟得上我的谈话，但是，自从你出现以后，你使我不再‘落单’了，世界上，居然有个天才的十七岁，可以跟我‘坐而论道’了。所以我说，跟你谈话，是一种惊喜、一种享受。”
5	027.从忘情到坐姿.txt	49	惊喜、享受，只在谈话方面吗？	朱仑恶作剧的眨了两下眼睛。“惊喜、享受，只在谈话方面吗？”
3	027.从忘情到坐姿.txt	51	当然不止。有比谈话更严重的，可是，我太聪明了，我不做不聪明的事了。聪明提醒我，‘坐而论道’是好的，改变了坐的姿式，就要想想了。	我笑着。“当然不止。有比谈话更严重的，可是，我太聪明了，我不做不聪明的事了。聪明提醒我，‘坐而论道’是好的，改变了坐的姿式，就要想想了。”
4	027.从忘情到坐姿.txt	53	渊博的大师啊，你忘了印度那本经典之作中的‘坐姿’耶！	朱仑恶作剧的瞪着我。“渊博的大师啊，你忘了印度那本经典之作中的‘坐姿’耶！”
4	027.从忘情到坐姿.txt	55	你才十七岁，你懂得什么叫‘坐姿’！	我笑起来。“你才十七岁，你懂得什么叫‘坐姿’！”
4	027.从忘情到坐姿.txt	57	我很好奇而已，我会虚拟，虚拟和你做。	“我很好奇而已，我会虚拟，虚拟和你做。”
3	027.从忘情到坐姿.txt	61	假的。你知道，我不需要那些。不过，如果你喜欢，你只要用‘演出’的理由，你可以看到漂亮十七岁的‘性服务’。	“假的。你知道，我不需要那些。不过，如果你喜欢，你只要用‘演出’的理由，你可以看到漂亮十七岁的‘性服务’。”
3	027.从忘情到坐姿.txt	65	我知道你喜欢和我——	“我知道你喜欢和我——”
7	027.从忘情到坐姿.txt	67	我知道你知道。可是，我说过，我非常聪明。	“我知道你知道。可是，我说过，我非常聪明。”
3	027.从忘情到坐姿.txt	69	你一生为有机会做却没做而后悔过吗？	“你一生为有机会做却没做而后悔过吗？”
4	027.从忘情到坐姿.txt	71	十年以后，我会想到一个可爱的女孩子问过这个问题。	“十年以后，我会想到一个可爱的女孩子问过这个问题。”
4	027.从忘情到坐姿.txt	73	那时候，我恐怕早就不在了。	“那时候，我恐怕早就不在了。”
3	027.从忘情到坐姿.txt	75	你不是二十七岁吗？	“你不是二十七岁吗？”
3	027.从忘情到坐姿.txt	77	我想我该永远十七岁，我像吃了仙丹化的agglutinin（凝集素）而血球破坏，但我凝集在十七岁，要后悔的聪明人，不必等到十年后。	“我想我该永远十七岁，我像吃了仙丹化的agglutinin（凝集素）而血球破坏，但我凝集在十七岁，要后悔的聪明人，不必等到十年后。”
4	027.从忘情到坐姿.txt	81	我要‘演出’吗？十七岁的坐姿，演给十八岁以上的人看。	“我要‘演出’吗？十七岁的坐姿，演给十八岁以上的人看。”
4	027.从忘情到坐姿.txt	83	如果要‘演出’，我要把镜子遮起来，因为十八岁以下的不能看。	“如果要‘演出’，我要把镜子遮起来，因为十八岁以下的不能看。”
4	027.从忘情到坐姿.txt	85	可是，我很想看我‘演出’得好不好。	“可是，我很想看我‘演出’得好不好。”
4	027.从忘情到坐姿.txt	87	你只要看我的表情，就知道多么成功。	“你只要看我的表情，就知道多么成功。”
3	027.从忘情到坐姿.txt	93	你脱衣服吗？	“你脱衣服吗？”
4	027.从忘情到坐姿.txt	95	我吗？我很想很想，但是不太好。十七岁一个人凭空‘演出’坐姿，才显出真正的演技。	“我吗？我很想很想，但是不太好。十七岁一个人凭空‘演出’坐姿，才显出真正的演技。”
3	027.从忘情到坐姿.txt	97	你好像在回避什么？	“你好像在回避什么？”
3	027.从忘情到坐姿.txt	99	我避免超出自我控制的极限。一超过那极限，我一定会强奸你，我要保留不被我强奸的你，和那种不达到最高点的微妙关系。	“我避免超出自我控制的极限。一超过那极限，我一定会强奸你，我要保留不被我强奸的你，和那种不达到最高点的微妙关系。”
4	027.从忘情到坐姿.txt	101	你好聪明，你好有自制力，并且，你好为难，你会不会怀疑你爱上了十七岁。	“你好聪明，你好有自制力，并且，你好为难，你会不会怀疑你爱上了十七岁。”
3	027.从忘情到坐姿.txt	103	我爱上十七岁，所以我守紧和十七岁的关系，就是不爱上十七岁。我会推迟一切，直到她变成十八岁。那时她太老了，于是情人再见。	“我爱上十七岁，所以我守紧和十七岁的关系，就是不爱上十七岁。我会推迟一切，直到她变成十八岁。那时她太老了，于是情人再见。”
4	027.从忘情到坐姿.txt	105	听你这样说，可以看出你多么不当真。	朱仑笑起来。“听你这样说，可以看出你多么不当真。”
3	027.从忘情到坐姿.txt	107	你错了，我是当真的。正因为当真，你和我之间才有余、才保留、才有那么多憧憬与远景，不是吗？想想看，你赤裸坐姿在我的赤裸上，是多么动人的画面，我多么向往。可是，为什么我要自制，因为——	“你错了，我是当真的。正因为当真，你和我之间才有余、才保留、才有那么多憧憬与远景，不是吗？想想看，你赤裸坐姿在我的赤裸上，是多么动人的画面，我多么向往。可是，为什么我要自制，因为——”
3	027.从忘情到坐姿.txt	111	因为十七岁没有太多的自制力。世界会变得疯狂。然后，美好会下滑，不再那么美好了。我不喜欢下滑的感觉。除非你坐在上面，永远不下来。	“因为十七岁没有太多的自制力。世界会变得疯狂。然后，美好会下滑，不再那么美好了。我不喜欢下滑的感觉。除非你坐在上面，永远不下来。”
3	027.从忘情到坐姿.txt	113	看吧，这就是‘太上忘情’式的讲话方式！between laughter and tears。	“看吧，这就是‘太上忘情’式的讲话方式！between laughter and tears。”
3	027.从忘情到坐姿.txt	115	想想看，between在坐姿之间的，也是这两样呢。太上可以忘情，但别忘了留下记录。但是，没有记录记下有没有坐姿，只有记忆记得有脱下的衣服。忘情是什么？对十七岁说来，十七岁只有笑声，没有泪痕。	“想想看，between在坐姿之间的，也是这两样呢。太上可以忘情，但别忘了留下记录。但是，没有记录记下有没有坐姿，只有记忆记得有脱下的衣服。忘情是什么？对十七岁说来，十七岁只有笑声，没有泪痕。”
4	027.从忘情到坐姿.txt	117	看来‘坐忘’了半天，结局除了笑声，一无所有，不是吗？	“看来‘坐忘’了半天，结局除了笑声，一无所有，不是吗？”
4	027.从忘情到坐姿.txt	119	有一个太珍贵的画面，你给忘了。	“有一个太珍贵的画面，你给忘了。”
3	027.从忘情到坐姿.txt	121	什么画面？	“什么画面？”
5	027.从忘情到坐姿.txt	125	照你所说，真是迷人的画面，可是要对比、要反衬，你要做吗？	“照你所说，真是迷人的画面，可是要对比、要反衬，你要做吗？”
4	027.从忘情到坐姿.txt	127	我觉得我六十七年来活的最大价值，是衬出了你。	“我觉得我六十七年来活的最大价值，是衬出了你。”
5	027.从忘情到坐姿.txt	129	我们会做出这种事，并留下这种画面吗？	“我们会做出这种事，并留下这种画面吗？”
4	027.从忘情到坐姿.txt	131	如果有一天，有这种画面留下来了，你的问题，便有了答案了。	“如果有一天，有这种画面留下来了，你的问题，便有了答案了。”
4	028.智者的虚拟第四号.txt	7	女人只要三维就好了，不是吗？我喜欢你三维，我最喜欢你小小的奶、小小的屁股，唯我独尊，你有我眼里最维的三维，你还要几维？	“女人只要三维就好了，不是吗？我喜欢你三维，我最喜欢你小小的奶、小小的屁股，唯我独尊，你有我眼里最维的三维，你还要几维？”
3	028.智者的虚拟第四号.txt	9	我一维也不要，我要古典的翻译，要‘度’字，‘三维空间’该回到‘三度空间’，‘四维空间’该回到‘四度空间’，我们用‘度’字，好不好？	“我一维也不要，我要古典的翻译，要‘度’字，‘三维空间’该回到‘三度空间’，‘四维空间’该回到‘四度空间’，我们用‘度’字，好不好？”
6	028.智者的虚拟第四号.txt	11	‘度’字最好。‘春风一度’‘春风几度’，多么诗意，如果春风一维、春风几维，显然就不好了。所以，我们要像维权一样‘维度’。	“好。”我附和着。“‘度’字最好。‘春风一度’‘春风几度’，多么诗意，如果春风一维、春风几维，显然就不好了。所以，我们要像维权一样‘维度’。”
4	028.智者的虚拟第四号.txt	13	既然改用‘度’字，那你喜欢我几度？	“既然改用‘度’字，那你喜欢我几度？”
4	028.智者的虚拟第四号.txt	15	‘梦里寻他千百度’，我喜欢你千百度。	“‘梦里寻他千百度’，我喜欢你千百度。”
5	028.智者的虚拟第四号.txt	17	那，你喜欢自己几度？	“那，你喜欢自己几度？”
3	028.智者的虚拟第四号.txt	23	当然没有，所以我才喜欢。真的有，就烦死了。并且，荒淫无度也太累了。所以呀，我会看一点好的A片，让那些狗男女帮我荒淫无度。	“当然没有，所以我才喜欢。真的有，就烦死了。并且，荒淫无度也太累了。所以呀，我会看一点好的A片，让那些狗男女帮我荒淫无度。”
3	028.智者的虚拟第四号.txt	25	荒淫无度要那么多别人吧？	“荒淫无度要那么多别人吧？”
3	028.智者的虚拟第四号.txt	27	当然要。从中国宫延之内的酒池肉林，到外国庙堂之上的O-R-G-Y，都是一大票人在群交的。	“当然要。从中国宫延之内的酒池肉林，到外国庙堂之上的O-R-G-Y，都是一大票人在群交的。”
3	028.智者的虚拟第四号.txt	41	只有两个人？	“只有两个人？”
4	028.智者的虚拟第四号.txt	43	表面上两个，但镜子里就不止两个了。	“表面上两个，但镜子里就不止两个了。”
