score	file	line	text	context
4	011.蜚蠊之夜.txt	323	那我们一起来写，你拿笔，我握住你的手，一起来写，让中文在我们手里。来，你坐在我左边。	“那我们一起来写，你拿笔，我握住你的手，一起来写，让中文在我们手里。来，你坐在我左边。”
6	011.蜚蠊之夜.txt	333	全诗写的都是漂亮的蜉蝣，漂亮而忧伤，因为它不知身归何处。尤其第三段，说‘蜉蝣掘阅’，掘阅就是掘穴，就是小蜉蝣掘穴而出，化为成年的白色羽翼，像麻织的白衣，白得像雪，但是，它一出来，便一片忧伤，因为，它四顾茫然，不知身归何处。	“全诗写的都是漂亮的蜉蝣，漂亮而忧伤，因为它不知身归何处。尤其第三段，说‘蜉蝣掘阅’，掘阅就是掘穴，就是小蜉蝣掘穴而出，化为成年的白色羽翼，像麻织的白衣，白得像雪，但是，它一出来，便一片忧伤，因为，它四顾茫然，不知身归何处。”
4	011.蜚蠊之夜.txt	335	知道死在眼前，却不知道身归何处。	“知道死在眼前，却不知道身归何处。”朱仑补充。
4	011.蜚蠊之夜.txt	337	死在眼前是时间问题，身归何处是空间问题，时间太紧迫了，逼它想到空间。	“死在眼前是时间问题，身归何处是空间问题，时间太紧迫了，逼它想到空间。”
8	011.蜚蠊之夜.txt	341	我常常想，	“我常常想，”朱仑说，“对中国活八百岁的彭祖说来，或对西方活九百六十九岁的Methuselah（玛士撒拉）说来，人类的寿命，其实和蜉蝣相差不多。我想到蜉蝣，就想到十七岁的我。sweet seventeen，甜蜜的十七岁，正在它没有成年而又离成年那么近。像蜉蝣，多么神奇，它在成年以前，可以成长三年，但一成年，它就在几个小时内，交尾而后死亡，正所谓朝生暮死。如果...
4	011.蜚蠊之夜.txt	343	恐怕你要问上帝，或者苏东坡。	“恐怕你要问上帝，或者苏东坡。”
4	011.蜚蠊之夜.txt	345	上帝说可以，只要我死在十七岁。这样就避免一十八岁就朝生暮死了。	“上帝说可以，只要我死在十七岁。这样就避免一十八岁就朝生暮死了。”
3	011.蜚蠊之夜.txt	347	你没问苏东坡？	“你没问苏东坡？”
4	011.蜚蠊之夜.txt	351	朱仑啊，你真是幽默。这点像美国人。	“朱仑啊，你真是幽默。这点像美国人。”
3	011.蜚蠊之夜.txt	353	上帝说得也未尝不对。如果一成年那天就朝生暮死，倒不如死在头一天。死得年轻、死得漂亮、死得还有一点悲怆，因为‘伤逝’总是用在早亡时候。	“上帝说得也未尝不对。如果一成年那天就朝生暮死，倒不如死在头一天。死得年轻、死得漂亮、死得还有一点悲怆，因为‘伤逝’总是用在早亡时候。”
7	011.蜚蠊之夜.txt	355	想不到你对蜉蝣如此诗意。特别诗意的一点是，交尾而后死亡。	“想不到你对蜉蝣如此诗意。特别诗意的一点是，交尾而后死亡。”
6	011.蜚蠊之夜.txt	357	我不是专指蜉蝣。但蜉蝣成年以后的生命，正是中国庄子‘方生方死’的哲学，比喻随生随灭，死生无常，而对蜉蝣说来，全部过程，一天了事。这种干脆，不能不说有哲理在，说有诗意，也随人高兴。何况蜉蝣还进了中国最早的诗集呢。证明了一定诗意十足，不是吗？	“我不是专指蜉蝣。但蜉蝣成年以后的生命，正是中国庄子‘方生方死’的哲学，比喻随生随灭，死生无常，而对蜉蝣说来，全部过程，一天了事。这种干脆，不能不说有哲理在，说有诗意，也随人高兴。何况蜉蝣还进了中国最早的诗集呢。证明了一定诗意十足，不是吗？”
5	011.蜚蠊之夜.txt	361	为什么你立刻同意，说是？	“为什么你立刻同意，说是？”
3	011.蜚蠊之夜.txt	367	我的动物朋友有两类，一类朝生暮死，像蜉蝣；另一类偷生怕死，像蜚蠊，刚才被我杀了。它们都有漂亮的名字。	“我的动物朋友有两类，一类朝生暮死，像蜉蝣；另一类偷生怕死，像蜚蠊，刚才被我杀了。它们都有漂亮的名字。”
3	011.蜚蠊之夜.txt	369	朱仑这名字不漂亮吗？	“朱仑这名字不漂亮吗？”
3	011.蜚蠊之夜.txt	373	朱仑是你第三类动物朋友吗？	“朱仑是你第三类动物朋友吗？”
3	011.蜚蠊之夜.txt	377	要考虑多久呢？	“要考虑多久呢？”
4	011.蜚蠊之夜.txt	381	别忘了每秒钟都有几百万细胞在死掉、别忘了同时有几百万细胞在出生，考虑得太久了，做朋友的我已经不是那个我了，怎么办？	“别忘了每秒钟都有几百万细胞在死掉、别忘了同时有几百万细胞在出生，考虑得太久了，做朋友的我已经不是那个我了，怎么办？”
3	011.蜚蠊之夜.txt	387	变心没关系，重要的是脑是原来的。比起每秒钟死掉的细胞而言，脑细胞的新陈交替算是唯一例外。我一出世时，已经有了一生中数目最多的脑细胞，老去的和折损的部分，不停的死去，永远得不到补充。不过，我原有的储备脑细胞实在太多，多到我不觉得有此损失了。	“变心没关系，重要的是脑是原来的。比起每秒钟死掉的细胞而言，脑细胞的新陈交替算是唯一例外。我一出世时，已经有了一生中数目最多的脑细胞，老去的和折损的部分，不停的死去，永远得不到补充。不过，我原有的储备脑细胞实在太多，多到我不觉得有此损失了。”
7	011.蜚蠊之夜.txt	391	你译得又快又好，你可以到联合国吃他们。	“你译得又快又好，你可以到联合国吃他们。”
7	011.蜚蠊之夜.txt	393	我的联合国就在这里，我吃我阿姨。	“我的联合国就在这里，我吃我阿姨。”
3	011.蜚蠊之夜.txt	395	我好羡慕你，我在你的年纪，那是个穷困的时代，我没阿姨好吃，只吃我自己。我穷极了，唯一不穷的，是我大脑中的脑细胞。	“我好羡慕你，我在你的年纪，那是个穷困的时代，我没阿姨好吃，只吃我自己。我穷极了，唯一不穷的，是我大脑中的脑细胞。”
3	011.蜚蠊之夜.txt	397	你的脑细胞，一定有特异功能，帮你形成了大头脑。外面都赞美你有大头脑。我有一个怪念头，有精子银行，难道不该有脑细胞银行吗？如果能开发出你大师脑细胞银行成品，大量生产，科学植入，该多么有趣！你以为呢？	“你的脑细胞，一定有特异功能，帮你形成了大头脑。外面都赞美你有大头脑。我有一个怪念头，有精子银行，难道不该有脑细胞银行吗？如果能开发出你大师脑细胞银行成品，大量生产，科学植入，该多么有趣！你以为呢？”
3	011.蜚蠊之夜.txt	399	我看还是开大师精子银行好。至少我供应起来，比较方便。你的怪念头，请锁定我的腰部以下比较好。	“我看还是开大师精子银行好。至少我供应起来，比较方便。你的怪念头，请锁定我的腰部以下比较好。”
4	011.蜚蠊之夜.txt	401	外面的资讯，显然不完整，他们太注意你的大头脑了。	朱仑笑起来。“外面的资讯，显然不完整，他们太注意你的大头脑了。”
4	011.蜚蠊之夜.txt	403	过分向上看，这是我恨人类的原因之一。	“过分向上看，这是我恨人类的原因之一。”我笑着补充。
4	011.蜚蠊之夜.txt	405	世界这么大，也许有一天，有人证明你的全面性伟大。	“世界这么大，也许有一天，有人证明你的全面性伟大。”
3	011.蜚蠊之夜.txt	409	你现在的情人们呢？	“你现在的情人们呢？”
3	011.蜚蠊之夜.txt	411	这方面，我没有了，我的人生已朝向不同的境界，此中一个重要的因素，就是年龄。年龄没使我‘不能’，却使我‘不想’，我尚有能力做什么，但是不想再做了。	“这方面，我没有了，我的人生已朝向不同的境界，此中一个重要的因素，就是年龄。年龄没使我‘不能’，却使我‘不想’，我尚有能力做什么，但是不想再做了。”
4	011.蜚蠊之夜.txt	413	你这些话，太消极了，你会打击了十七岁的人。	“你这些话，太消极了，你会打击了十七岁的人。”
4	011.蜚蠊之夜.txt	415	十七岁有十七岁的世界、新世界、brand-new世界。	“十七岁有十七岁的世界、新世界、brand-new世界。”
3	011.蜚蠊之夜.txt	417	你的世界呢？	“你的世界呢？”
3	011.蜚蠊之夜.txt	419	我的世界已经老去，并且，更清楚的是，我承认它已老去。现在，也不早了，我想我该回到你邻居的家里了，很高兴看到你的生日蜡烛，一支不吹熄的蜡烛。	“我的世界已经老去，并且，更清楚的是，我承认它已老去。现在，也不早了，我想我该回到你邻居的家里了，很高兴看到你的生日蜡烛，一支不吹熄的蜡烛。”我站起来。
3	011.蜚蠊之夜.txt	421	很高兴你陪了我十七岁，感谢你今晚来搭救我。并且，很荣幸认识你这位大名鼎鼎的邻居。今晚，如果没有第二支蜚蠊出现，你可以安心睡觉了。	有点勉强的，朱仑也站起来。“很高兴你陪了我十七岁，感谢你今晚来搭救我。并且，很荣幸认识你这位大名鼎鼎的邻居。今晚，如果没有第二支蜚蠊出现，你可以安心睡觉了。”
5	011.蜚蠊之夜.txt	423	今天送货的纸箱里，只送来一只吗？	“今天送货的纸箱里，只送来一只吗？”我故作惊奇。
3	011.蜚蠊之夜.txt	425	什么？难道还有吗？	“什么？难道还有吗？”她紧张起来。
4	011.蜚蠊之夜.txt	427	悲观的说，没有了。有了随时叫我。不论多么晚。	“悲观的说，没有了。有了随时叫我。不论多么晚。”
5	012.蜚蠊后夜.txt	21	如果没有第二只蜚蠊，	一阵沉默以后，我小声说：“如果没有第二只蜚蠊，”我顿了一下，“我想我该回去了。”
5	012.蜚蠊后夜.txt	23	不知道有没有，	“不知道有没有，”她也小声说，“没有也许就是有、有就是没有。”
4	012.蜚蠊后夜.txt	23	没有也许就是有、有就是没有。	“不知道有没有，”她也小声说，“没有也许就是有、有就是没有。”
6	012.蜚蠊后夜.txt	25	你好会说出哲学家的话，更会做出哲学家做不出来的事。又是那个Alexander，他去拜访希腊哲学家Diogenes（狄阿杰尼斯），Diogenes躺在木桶里，眼里根本没有国王，国王Alexander问这哲学家可有效劳之处，哲学家说别挡住我阳光可也。Alexander感慨之下，说了那句话。你一定知道那句话。	“你好会说出哲学家的话，更会做出哲学家做不出来的事。又是那个Alexander，他去拜访希腊哲学家Diogenes（狄阿杰尼斯），Diogenes躺在木桶里，眼里根本没有国王，国王Alexander问这哲学家可有效劳之处，哲学家说别挡住我阳光可也。Alexander感慨之下，说了那句话。你一定知道那句话。”
4	012.蜚蠊后夜.txt	29	你真是神童，你什么都知道。	“你真是神童，你什么都知道。”
3	012.蜚蠊后夜.txt	33	还是哲学家Diogenes啊，他可以光天化日之下，当街做你刚刚为我做的，多哲学啊！我必须告诉你，被你做，我感到十分光荣。人家是那样做的哲学家，我是被你做过后，变成哲学家。	“还是哲学家Diogenes啊，他可以光天化日之下，当街做你刚刚为我做的，多哲学啊！我必须告诉你，被你做，我感到十分光荣。人家是那样做的哲学家，我是被你做过后，变成哲学家。”
4	012.蜚蠊后夜.txt	35	今晚除了死了一只来自冰河期的蜚蠊，应该什么事都没发生。	“今晚除了死了一只来自冰河期的蜚蠊，应该什么事都没发生。”
3	012.蜚蠊后夜.txt	37	什么都是虚拟的？	“什么都是虚拟的？”
3	012.蜚蠊后夜.txt	51	She became the mistress of the sculptor Praxiteles, who supposedly used her as the model for his Cnidian Aphrodite. 她变成希腊爱与美女神的造型，也就是罗马的Venus、维纳斯。	“She became the mistress of the sculptor Praxiteles, who supposedly used her as the model for his Cnidian Aphrodite. 她变成希腊爱与美女神的造型，也就是罗马的Venus、维纳斯。”
3	012.蜚蠊后夜.txt	53	穿着睡袍的？	“穿着睡袍的？”
3	012.蜚蠊后夜.txt	55	只有在解开时才是吧？	“只有在解开时才是吧？”
4	012.蜚蠊后夜.txt	57	你几岁？你去美国学校念十一年级，该是seventeen？	“你几岁？你去美国学校念十一年级，该是seventeen？”
4	012.蜚蠊后夜.txt	63	是一种奇怪的拿到，用我的手，而不是用你的手。我觉得挫折，因为，	“是一种奇怪的拿到，用我的手，而不是用你的手。我觉得挫折，因为，”她摇摇头，“因为，因为你知道。”
4	012.蜚蠊后夜.txt	63	因为，因为你知道。	“是一种奇怪的拿到，用我的手，而不是用你的手。我觉得挫折，因为，”她摇摇头，“因为，因为你知道。”
3	012.蜚蠊后夜.txt	67	你知道什么？	“你知道什么？”
4	012.蜚蠊后夜.txt	73	我太聪明了，我不可能不知道。我和你一样聪明。所以我知道。	“我太聪明了，我不可能不知道。我和你一样聪明。所以我知道。”
5	012.蜚蠊后夜.txt	75	说说看，你知道什么？	“说说看，你知道什么？”
3	012.蜚蠊后夜.txt	77	好吧，说说看，我知道你觉得挫折，因为从我进门到现在，都没碰过你。我只替你扎上腰带而已。相对的，你碰到我的部分，可太十七岁了。	“好吧，说说看，我知道你觉得挫折，因为从我进门到现在，都没碰过你。我只替你扎上腰带而已。相对的，你碰到我的部分，可太十七岁了。”
4	012.蜚蠊后夜.txt	79	应该你说得对吧？对十七岁，你做得似乎太少了。	“应该你说得对吧？对十七岁，你做得似乎太少了。”
4	012.蜚蠊后夜.txt	83	也许你带来的寒冷，比你冲走的多。我觉得我没有吸引力使你放开你自己。	“也许你带来的寒冷，比你冲走的多。我觉得我没有吸引力使你放开你自己。”
3	012.蜚蠊后夜.txt	85	你已经做到了只有你才能做到的事，我一定非常非常喜欢了你，所以，我才那样无法拒绝。让你看到我的失控和狼狈。让你看到那种情况下真的我。	“你已经做到了只有你才能做到的事，我一定非常非常喜欢了你，所以，我才那样无法拒绝。让你看到我的失控和狼狈。让你看到那种情况下真的我。”
3	012.蜚蠊后夜.txt	87	你不愿让我看到？	“你不愿让我看到？”
4	012.蜚蠊后夜.txt	89	那个我跟我太不一致了，你知道，我是一个相当理性的人。而那个我太不理性了。	“那个我跟我太不一致了，你知道，我是一个相当理性的人。而那个我太不理性了。”
3	012.蜚蠊后夜.txt	91	理性那么重要吗？	“理性那么重要吗？”
4	012.蜚蠊后夜.txt	93	不重要的话，现在你已经不在客厅了。	“不重要的话，现在你已经不在客厅了。”
3	012.蜚蠊后夜.txt	95	那种结果你不喜欢吗？	“那种结果你不喜欢吗？”
4	012.蜚蠊后夜.txt	99	所以，你认为的一种境界是虽然没上床，也可说上过床了。是不是？	“所以，你认为的一种境界是虽然没上床，也可说上过床了。是不是？”
4	012.蜚蠊后夜.txt	101	好像是，又好像不是。	我微笑。“好像是，又好像不是。”
5	012.蜚蠊后夜.txt	103	如果今天晚上我没有那样为你做，你回到房里后，会自己做吗？	“如果今天晚上我没有那样为你做，你回到房里后，会自己做吗？”
3	012.蜚蠊后夜.txt	107	为什么会？	“为什么会？”
4	012.蜚蠊后夜.txt	109	因为我今天晚上见到了你，这么漂亮可爱的十七岁，我会因想你而自己做。	“因为我今天晚上见到了你，这么漂亮可爱的十七岁，我会因想你而自己做。”
3	012.蜚蠊后夜.txt	111	你会为我而做？	“你会为我而做？”
4	012.蜚蠊后夜.txt	121	柔细的手，它除了为男人‘性服务’，也写中国字吗？你们美国学校的。	“柔细的手，它除了为男人‘性服务’，也写中国字吗？你们美国学校的。”
4	012.蜚蠊后夜.txt	123	会偷偷写，并且用钢笔。	“会偷偷写，并且用钢笔。”
3	012.蜚蠊后夜.txt	125	中国字在英文里总是用Chinese characters，表示中国字有它的特色。你用钢笔，钢笔和中国毛笔一样，也写出它的特色。我好好奇，可以看到你用钢笔写的中国字吗？	“中国字在英文里总是用Chinese characters，表示中国字有它的特色。你用钢笔，钢笔和中国毛笔一样，也写出它的特色。我好好奇，可以看到你用钢笔写的中国字吗？”
4	012.蜚蠊后夜.txt	127	我想我会给你看。也许，这是你看到最后的十七岁的人的钢笔字，我们不流行用钢笔了。	“真的要看吗？”她眼睛一亮。“我想我会给你看。也许，这是你看到最后的十七岁的人的钢笔字，我们不流行用钢笔了。”
3	012.蜚蠊后夜.txt	127	真的要看吗？	“真的要看吗？”她眼睛一亮。“我想我会给你看。也许，这是你看到最后的十七岁的人的钢笔字，我们不流行用钢笔了。”
4	012.蜚蠊后夜.txt	129	我能理解，所以我才那么好奇。	“我能理解，所以我才那么好奇。”
7	012.蜚蠊后夜.txt	131	今天下午，正好写了几行，算是一首诗吧。我去拿来给你看。	“今天下午，正好写了几行，算是一首诗吧。我去拿来给你看。”
4	012.蜚蠊后夜.txt	161	我只用一个镜框，把它挂在我家墙上。	“我不想做任何赞美。”我故意冷冷的说。“我只用一个镜框，把它挂在我家墙上。”
5	012.蜚蠊后夜.txt	163	可是、可是，	她惊喜的笑起来。“可是、可是，”她有点急，“可是，这张纸好像没说送给你。”
4	012.蜚蠊后夜.txt	163	可是，这张纸好像没说送给你。	她惊喜的笑起来。“可是、可是，”她有点急，“可是，这张纸好像没说送给你。”
4	012.蜚蠊后夜.txt	165	这张纸的确没说，可是上帝说了。上帝说：‘爱你的邻居，把那张纸给他。’	“这张纸的确没说，可是上帝说了。上帝说：‘爱你的邻居，把那张纸给他。’”
3	012.蜚蠊后夜.txt	167	那你要挂在你家哪里？	她在笑，在有点无奈的笑。“那你要挂在你家哪里？”
6	012.蜚蠊后夜.txt	173	你们美国人真有幽默感。你的诗是悲怆的，但你能借幽默松动一点悲怆，又多么可爱、多么高段的哲学！这叫什么？叫‘悲欣交集’，是公元前八百年希腊诗人灵感下的smiling through her tears，纯粹的悲哀并不完整，要欣喜随着它。	我笑起来。“你们美国人真有幽默感。你的诗是悲怆的，但你能借幽默松动一点悲怆，又多么可爱、多么高段的哲学！这叫什么？叫‘悲欣交集’，是公元前八百年希腊诗人灵感下的smiling through her tears，纯粹的悲哀并不完整，要欣喜随着它。”
3	012.蜚蠊后夜.txt	175	包括死亡？	“包括死亡？”
3	012.蜚蠊后夜.txt	179	包括离别？	“包括离别？”
3	012.蜚蠊后夜.txt	187	也许明天，就在八个小时以后，‘当我不是我，你不是你……我们都会忘掉。’忘掉了这一晚上，忘掉我做过的、你被我做过的一切。你还‘欣喜’吗？	“也许明天，就在八个小时以后，‘当我不是我，你不是你……我们都会忘掉。’忘掉了这一晚上，忘掉我做过的、你被我做过的一切。你还‘欣喜’吗？”
4	012.蜚蠊后夜.txt	191	可是我也许会，我十七岁，是最健忘的年纪。	“可是我也许会，我十七岁，是最健忘的年纪。”
3	012.蜚蠊后夜.txt	195	为什么？	“为什么？”
4	012.蜚蠊后夜.txt	197	因为在你忘掉我的前一分钟，我会先忘掉你。	“因为在你忘掉我的前一分钟，我会先忘掉你。”
4	012.蜚蠊后夜.txt	199	怎么可以这样？我的手，为你那样过。	“怎么可以这样？我的手，为你那样过。”
4	012.蜚蠊后夜.txt	201	它会永远记得你，可是我会先一分钟忘掉。	“它会永远记得你，可是我会先一分钟忘掉。”
3	012.蜚蠊后夜.txt	203	为什么它记得我？	“为什么它记得我？”
5	012.蜚蠊后夜.txt	207	忘掉你，却只记得它，合理吗？	“忘掉你，却只记得它，合理吗？”
5	012.蜚蠊后夜.txt	211	那我可以想到它的时候，到这房子里，看它、只看它吗？	“那我可以想到它的时候，到这房子里，看它、只看它吗？”
4	012.蜚蠊后夜.txt	213	可以，你可以完全陌生我，单独喜欢它。	“可以，你可以完全陌生我，单独喜欢它。”
3	012.蜚蠊后夜.txt	219	我色情狂？	“我色情狂？”
3	012.蜚蠊后夜.txt	223	为什么说我色情狂？	“为什么说我色情狂？”
4	012.蜚蠊后夜.txt	225	因为你只想那勃起的局部，却忘了勃起的全身。	“因为你只想那勃起的局部，却忘了勃起的全身。”
3	012.蜚蠊后夜.txt	227	你说你全身都在勃起？	“你说你全身都在勃起？”
4	012.蜚蠊后夜.txt	229	当然，我生气勃勃、也野心勃勃，我勃得很呢。	“当然，我生气勃勃、也野心勃勃，我勃得很呢。”
4	012.蜚蠊后夜.txt	231	那我不忘记你了。看到你，可以看到那么多勃。	“那我不忘记你了。看到你，可以看到那么多勃。”
4	012.蜚蠊后夜.txt	233	那你更色情狂了，并且是大号的。	“那你更色情狂了，并且是大号的。”
4	012.蜚蠊后夜.txt	235	你的话，也会令我勃，我会勃然大怒。	“你的话，也会令我勃，我会勃然大怒。”
5	012.蜚蠊后夜.txt	239	你说得对，	“你说得对，”她恢复了不笑的自己，“借幽默松动一点悲怆。但是，不论我们怎么保有笑容，我们都不笑掉悲怆，悲怆只能忘掉，不能笑掉。”
3	012.蜚蠊后夜.txt	239	借幽默松动一点悲怆。但是，不论我们怎么保有笑容，我们都不笑掉悲怆，悲怆只能忘掉，不能笑掉。	“你说得对，”她恢复了不笑的自己，“借幽默松动一点悲怆。但是，不论我们怎么保有笑容，我们都不笑掉悲怆，悲怆只能忘掉，不能笑掉。”
4	012.蜚蠊后夜.txt	241	真的如此吗？也许我们能做到记得，却笑着假装忘掉。	“真的如此吗？也许我们能做到记得，却笑着假装忘掉。”
4	012.蜚蠊后夜.txt	243	也许，	“也许，”十七岁犹豫了一下，“有一天你看到我，我就是那种假装。”
4	012.蜚蠊后夜.txt	243	有一天你看到我，我就是那种假装。	“也许，”十七岁犹豫了一下，“有一天你看到我，我就是那种假装。”
4	012.蜚蠊后夜.txt	245	当十七岁，你的真相就是你的假装。	“当十七岁，你的真相就是你的假装。”
3	012.蜚蠊后夜.txt	249	有的，有许多时候，但不太确定。唯一确定的是你握住它的时候，你看到我无法假装的真相，我看到你——	“有的，有许多时候，但不太确定。唯一确定的是你握住它的时候，你看到我无法假装的真相，我看到你——”我停了。
3	012.蜚蠊后夜.txt	251	看到我什么？	“看到我什么？”
4	012.蜚蠊后夜.txt	253	看到你的真相就是假装。真相是你不到十八岁，假装你已经十八岁。	“看到你的真相就是假装。真相是你不到十八岁，假装你已经十八岁。”
4	012.蜚蠊后夜.txt	257	是不是十八岁，不那么关键。你知道真的答案，请告诉我。请你说出来。	“是不是十八岁，不那么关键。你知道真的答案，请告诉我。请你说出来。”
4	012.蜚蠊后夜.txt	259	真相是你喜欢它，假装是你显得很冷静。	“真相是你喜欢它，假装是你显得很冷静。”
3	012.蜚蠊后夜.txt	267	你点了点头，我知道你的body language，你在说：真的我喜欢它，我承认，我是十七岁的色情狂。	“你点了点头，我知道你的body language，你在说：真的我喜欢它，我承认，我是十七岁的色情狂。”
3	013.模特儿约定.txt	5	三天来，台北这边承你大师照料，非常感谢。我的外甥女说她没事，所以一直没来麻烦你。我问她对大师的印象，她说她从来没见过你，只是久仰你的大名。说来也好奇怪，从你搬进来，已经快一个月了，做了快一个月邻居，居然没见过面。哪天我带外甥女来拜会大师。	“三天来，台北这边承你大师照料，非常感谢。我的外甥女说她没事，所以一直没来麻烦你。我问她对大师的印象，她说她从来没见过你，只是久仰你的大名。说来也好奇怪，从你搬进来，已经快一个月了，做了快一个月邻居，居然没见过面。哪天我带外甥女来拜会大师。”
