score	file	line	text	context
5	001.9月19日神州文化之旅第一天.txt	15	第一次坐飞机，到底感觉如何？	记者：“第一次坐飞机，到底感觉如何？”
4	001.9月19日神州文化之旅第一天.txt	17	置生死于度外，感觉蛮愉快的，尤其航空公司照顾我很好。	李敖：“置生死于度外，感觉蛮愉快的，尤其航空公司照顾我很好。”
4	001.9月19日神州文化之旅第一天.txt	19	我们曾经听到您开玩笑地说，如果在飞机上遇到乱流，您会抱着空中小姐，今天曾经经历过一波乱流，当时您的感觉如何？会想抱空中小姐吗？	记者：“我们曾经听到您开玩笑地说，如果在飞机上遇到乱流，您会抱着空中小姐，今天曾经经历过一波乱流，当时您的感觉如何？会想抱空中小姐吗？”
3	001.9月19日神州文化之旅第一天.txt	21	会，我是会想抱，很可惜，她是基督教徒，所以万一出事的话，她会上天堂，我会下地狱，因为我不相信基督教。	李敖：“会，我是会想抱，很可惜，她是基督教徒，所以万一出事的话，她会上天堂，我会下地狱，因为我不相信基督教。”
5	001.9月19日神州文化之旅第一天.txt	23	您将回到中国大陆，请问您现在心中的感觉？	记者：“您将回到中国大陆，请问您现在心中的感觉？”
6	001.9月19日神州文化之旅第一天.txt	25	我的感觉就是说，都是中国嘛，所以我从中国东南的一个岛上，回到西北，过去中国有一首诗叫作“孔雀东南飞	李敖：“我的感觉就是说，都是中国嘛，所以我从中国东南的一个岛上，回到西北，过去中国有一首诗叫作“孔雀东南飞”，为什么叫东南飞呢，因为有一首古诗叫作西北有高楼，所以不能向西北飞，今天孔雀终于向西北飞了，孔雀不但是孔雀，并且变成了凤凰。”
3	001.9月19日神州文化之旅第一天.txt	91	北京大排场接机，李敖赚足面子。大陆中央警卫局出动十几位保镖严加戒备，甚至和记者爆发冲突。机场的保安工作，迎接李敖一个人相当于一个政党访问团。	19日下午5点左右，李敖和儿子在刘长乐等人的陪同下到达首都机场。台湾东森电视台称：“北京大排场接机，李敖赚足面子。大陆中央警卫局出动十几位保镖严加戒备，甚至和记者爆发冲突。机场的保安工作，迎接李敖一个人相当于一个政党访问团。”“十几位中央警卫局的保镖人高马大，一个一个都是狠角色，身上黑墨镜、黑西装、身高起码180公分，为了李敖抵达机场的秩序维持，管制超级严格...
3	001.9月19日神州文化之旅第一天.txt	91	十几位中央警卫局的保镖人高马大，一个一个都是狠角色，身上黑墨镜、黑西装、身高起码180公分，为了李敖抵达机场的秩序维持，管制超级严格，大批媒体记者也被赶得火气大了起来，保镖和记者爆发了冲突。	19日下午5点左右，李敖和儿子在刘长乐等人的陪同下到达首都机场。台湾东森电视台称：“北京大排场接机，李敖赚足面子。大陆中央警卫局出动十几位保镖严加戒备，甚至和记者爆发冲突。机场的保安工作，迎接李敖一个人相当于一个政党访问团。”“十几位中央警卫局的保镖人高马大，一个一个都是狠角色，身上黑墨镜、黑西装、身高起码180公分，为了李敖抵达机场的秩序维持，管制超级严格...
4	001.9月19日神州文化之旅第一天.txt	95	眼睛时刻都是那样晶莹的一扫，洋溢着一片精明、智慧与危险的闪光，口是咬得紧紧地，象征着一股力量，果决而有力，气永远沉得住！	100多位记者把机场记者会现场挤得满满当当。怕冷的李敖此时脱去了黑色大衣，穿一件米色西装，戴着从不摘下的“有色眼镜”，脸上的表情像他自己书中描写的一样：“眼睛时刻都是那样晶莹的一扫，洋溢着一片精明、智慧与危险的闪光，口是咬得紧紧地，象征着一股力量，果决而有力，气永远沉得住！”
6	001.9月19日神州文化之旅第一天.txt	101	各位北京人！你们好……	第二句：“各位北京人！你们好……”
5	001.9月19日神州文化之旅第一天.txt	127	有勇气，但缺乏责任	李文之母王尚勤是“台大”农经系的“系花”。李敖与她在1962年相识。李敖与王尚勤的哥哥王尚义是好朋友，王尚义促成李敖认识了王尚勤。但他没想到妹妹会和李敖谈起恋爱来，其间他曾力劝妹妹不要陷得太深。王尚义认为，李敖“有勇气，但缺乏责任”。但王尚勤已深陷其中，不能自拔。
3	001.9月19日神州文化之旅第一天.txt	135	如果一个人生命的起点是另一个终点的话，李敖与我刚好在不同的起点与终点上擦肩而过。就像那年在去南港的公路车上相撞一样。那时是开始，现在是结束，这也算是一种缘分吧！	对于这段刻骨铭心的恋情，王尚勤下了一个注脚：“如果一个人生命的起点是另一个终点的话，李敖与我刚好在不同的起点与终点上擦肩而过。就像那年在去南港的公路车上相撞一样。那时是开始，现在是结束，这也算是一种缘分吧！”
4	001.9月19日神州文化之旅第一天.txt	147	Daddy, Welcome to my home.（爸爸，欢迎来到我家。）	李文住在一座高层公寓里，穿过曲折的过道，李敖看到了自己的女儿。李文白皙清秀，但眉宇间却有一些自负和倔强。女儿一拉开门，就对爸爸说：“Daddy, Welcome to my home.（爸爸，欢迎来到我家。）”然后上来拥抱了自己的老爸三秒钟。
4	001.9月19日神州文化之旅第一天.txt	153	我就说你会摇头吧，你不相信。	然后就是要求李敖套上鞋套，才准他走进家门。李文带着老敖在家里参观，在一间房子里，看到女儿斥资血拼的200多双鞋子，做父亲的只有摇头。李文说，“我就说你会摇头吧，你不相信。”李敖则回敬道：打倒美国人（李文为美国籍）！
4	001.9月19日神州文化之旅第一天.txt	155	我不能说她错，她甚至是对的，但是，用这种方法表达是要付出代价的。	对于李文动辄维权，并且与邻居吵架一事，李敖笑称，这是美国式的生活态度，按照中国式的生活方式，是不会跟邻居有这么尖锐冲突的，“我不能说她错，她甚至是对的，但是，用这种方法表达是要付出代价的。”李敖向记者们表白说：我在台湾名誉不好，100%我负责任；我在北京名誉不好，有一半要李文负责任。
3	001.9月19日神州文化之旅第一天.txt	159	因为她成长的过程中，我正在坐牢，我觉得对她没有很好的照顾。对不起她的唯一方法就是给钱。	离开前，李敖从衬衣兜里掏出一个厚厚的牛皮纸信封给女儿。李文欢呼说，一看信封的形状就知道是美金。因为人民币比较宽，而且比这个厚。李敖对记者说，“因为她成长的过程中，我正在坐牢，我觉得对她没有很好的照顾。对不起她的唯一方法就是给钱。”有记者当场要求李文打开信封数钱，李文和李敖都笑而不答。
3	001.9月19日神州文化之旅第一天.txt	165	我和爸爸在一起像朋友而不像父女，今天很多人看到我们两个在一起的情形都傻了眼了，平时我们都是狠角色，可今天两人就是互相开玩笑，像老朋友的样子。所以当李敖和李文在一起的时候，你会看到李敖的另一面，也会看到李文的另一面。	李文答道：“我和爸爸在一起像朋友而不像父女，今天很多人看到我们两个在一起的情形都傻了眼了，平时我们都是狠角色，可今天两人就是互相开玩笑，像老朋友的样子。所以当李敖和李文在一起的时候，你会看到李敖的另一面，也会看到李文的另一面。”
4	002.9月20日神州文化之旅第二天.txt	47	小时候来过，记忆中没有这么多。这里收藏非常丰富，现在更了解它了。	上午9点50分，李敖在故宫太和殿前现身。在闪光灯不停地闪烁中，李敖拉着儿子，站定在北京的中轴线上照了相。有记者问，故宫与儿时看到的有何不同？李敖说：“小时候来过，记忆中没有这么多。这里收藏非常丰富，现在更了解它了。”李敖回忆，1925年10月10日故宫博物院建立后不久，他曾来玩过，那时候的门票是一块大洋，和当时人们的生活水平相比，门票价格显得比较高。“我小时...
4	002.9月20日神州文化之旅第二天.txt	47	我小时候来故宫的时候，太和殿门前的地砖缝里都长着长长的青草。	上午9点50分，李敖在故宫太和殿前现身。在闪光灯不停地闪烁中，李敖拉着儿子，站定在北京的中轴线上照了相。有记者问，故宫与儿时看到的有何不同？李敖说：“小时候来过，记忆中没有这么多。这里收藏非常丰富，现在更了解它了。”李敖回忆，1925年10月10日故宫博物院建立后不久，他曾来玩过，那时候的门票是一块大洋，和当时人们的生活水平相比，门票价格显得比较高。“我小时...
3	002.9月20日神州文化之旅第二天.txt	117	这幅字画对故宫来讲不是什么宝贝，故宫里乾隆的字很多，但这是我的一点心意。对这幅字来说，也是回家了，因为它本来就是宫里的东西。	李敖说，“这幅字画对故宫来讲不是什么宝贝，故宫里乾隆的字很多，但这是我的一点心意。对这幅字来说，也是回家了，因为它本来就是宫里的东西。”
4	002.9月20日神州文化之旅第二天.txt	119	收藏来源就不便公开了，就像美国中央情报局的消息来源不能公开一样。	有记者追问李敖此字画的来源，他开玩笑地说：“收藏来源就不便公开了，就像美国中央情报局的消息来源不能公开一样。”他还说，捐字画是天人格斗，内心挣扎后的决定。决心一下，人就轻松了。他故意大声问，“这里面怎么没看到李敖的名字？”
3	002.9月20日神州文化之旅第二天.txt	119	这里面怎么没看到李敖的名字？	有记者追问李敖此字画的来源，他开玩笑地说：“收藏来源就不便公开了，就像美国中央情报局的消息来源不能公开一样。”他还说，捐字画是天人格斗，内心挣扎后的决定。决心一下，人就轻松了。他故意大声问，“这里面怎么没看到李敖的名字？”
8	002.9月20日神州文化之旅第二天.txt	167	我对以前对故宫的评论，表示忏悔！	李敖故宫参访行程大约3个小时。负责为他进行文物解说的故宫博物院古书画部副主任金运昌对记者说：“李敖的日常谈吐与他在文章或者电视节目里表现出来的锋芒毕露不一样，我觉得他是一个谦和的长者。而且，他显然是文物方面的行家，相关知识非常渊博，令人钦佩。”而李敖的回应则是一句让人印象深刻的话：“我对以前对故宫的评论，表示忏悔！”
6	002.9月20日神州文化之旅第二天.txt	167	李敖的日常谈吐与他在文章或者电视节目里表现出来的锋芒毕露不一样，我觉得他是一个谦和的长者。而且，他显然是文物方面的行家，相关知识非常渊博，令人钦佩。	李敖故宫参访行程大约3个小时。负责为他进行文物解说的故宫博物院古书画部副主任金运昌对记者说：“李敖的日常谈吐与他在文章或者电视节目里表现出来的锋芒毕露不一样，我觉得他是一个谦和的长者。而且，他显然是文物方面的行家，相关知识非常渊博，令人钦佩。”而李敖的回应则是一句让人印象深刻的话：“我对以前对故宫的评论，表示忏悔！”
5	002.9月20日神州文化之旅第二天.txt	187	跟着大师跑，全靠两只脚	一派是“凤凰派”，人数不多，可以紧贴李敖身旁，自由出入禁地；一派是“麻雀派”，人数不少，“跟着大师跑，全靠两只脚”。晨报记者不幸也是“麻雀派”。当李敖在天安门上挥手的时候，本人只能在金水桥上挥手，也算是和李敖遥相呼应。
3	002.9月20日神州文化之旅第二天.txt	203	没有出息	公元七世纪的唐朝诗人宋之问是大诗人，也是心理学家，寥寥十字，就把离家游子归乡时，生怕旧梦被现实粉碎，又知道现实定将粉碎旧梦的心理，刻画得入木三分。而此时车上的李敖只把脸贴近车窗，张望着，虽然脸上的表情故作轻松，还是可以看出他是有意识地克制自己。他说过，他是个老式的男人，喜欢那种大男人的感觉，认为乡情、眼泪，都是软弱的表现，“没有出息”。
3	002.9月20日神州文化之旅第二天.txt	211	欢迎大学长回来！	然而，这一切都不重要了，重要的是一个美丽的小女生——手捧鲜花，用脆生生怯生生的声音喊道：“欢迎大学长回来！”其余的小学生则边行礼边说，学长好！李敖则答：学弟学妹好。开始，李敖还回头对刘长乐说，怎么样，这感觉连战能比吗？但是，很快，孩子们的小手和问候就使他百感交集。记者问，这样的场面让你想到了什么？李敖答：我是与过去的我握手。
4	002.9月20日神州文化之旅第二天.txt	221	抗日战争胜利前一年，我在这个教室。	李敖径直走向院子右侧一间教室，“抗日战争胜利前一年，我在这个教室。”环顾四周，他说，阔多了。
4	002.9月20日神州文化之旅第二天.txt	223	不敢坐，这儿是老师的位置，我是小学生。	正在上课的老师请他在讲台前坐下，他说，“不敢坐，这儿是老师的位置，我是小学生。”
8	002.9月20日神州文化之旅第二天.txt	229	为者长成，行者长至	“你们现在还用粉笔吗？我们那时用的是真正的黑板，你们现在用的黑板已改成了墨绿色。”李敖对孩子们说，我上学时，不仅你们没出生，连你们的父母也没有出生。我看到你们，就好像看到了过去的我。他走到黑板前，挥手写下《晏子春秋》里的名句——“为者长成，行者长至”。
7	002.9月20日神州文化之旅第二天.txt	229	你们现在还用粉笔吗？我们那时用的是真正的黑板，你们现在用的黑板已改成了墨绿色。	“你们现在还用粉笔吗？我们那时用的是真正的黑板，你们现在用的黑板已改成了墨绿色。”李敖对孩子们说，我上学时，不仅你们没出生，连你们的父母也没有出生。我看到你们，就好像看到了过去的我。他走到黑板前，挥手写下《晏子春秋》里的名句——“为者长成，行者长至”。
7	002.9月20日神州文化之旅第二天.txt	233	虽有智慧，不如乘势；虽有镃基，不如待时。	李敖又走进了五年级二班的教室时，学生们正在上语文课，李敖兴之所至，又给学生们上了一课，他写下“虽有智慧，不如乘势；虽有镃基，不如待时。”然后细心地在旁边注上语出孟子。
5	002.9月20日神州文化之旅第二天.txt	237	那只是单相思，我这边恋了半天，人家都还不知道！	其实，李敖走进这个教室还有更深一层的意思，这里是当年李敖与他的“初恋”张敏英一起就读的教室。当记者问及“初恋”，睹物思情的李敖却面露尴尬，连声说，“那只是单相思，我这边恋了半天，人家都还不知道！”到大陆之前，他曾经侧面打听一个叫张敏英的北京小女孩。但始终都没答案。最近，有报道说，张敏英已找到，但其家人不希望家庭受到任何影响。在写于一九八一年的自传里，这位桀骜...
4	002.9月20日神州文化之旅第二天.txt	245	我上学的时候，冬天大家轮着生火，一替一天，自己从家里带柴火和煤球。	后院有间教室是学校的画室。也有孩子在上课。李敖说，给孩子们打个招呼，走了进去。在这里，他想起了自己学画的经历：“图画课上，我总是画汽车，女老师很欣赏我画的汽车。我对汽车的印象，是在太原建立的，那时很少小朋友像我这样“现代化”过，他们要画，大都画洋车，就是人力车。”李敖特别问了孩子们冬天怎么取暖。看到屋里的暖气片，他很感慨：“我上学的时候，冬天大家轮着生火，一...
3	002.9月20日神州文化之旅第二天.txt	245	图画课上，我总是画汽车，女老师很欣赏我画的汽车。我对汽车的印象，是在太原建立的，那时很少小朋友像我这样“现代化	后院有间教室是学校的画室。也有孩子在上课。李敖说，给孩子们打个招呼，走了进去。在这里，他想起了自己学画的经历：“图画课上，我总是画汽车，女老师很欣赏我画的汽车。我对汽车的印象，是在太原建立的，那时很少小朋友像我这样“现代化”过，他们要画，大都画洋车，就是人力车。”李敖特别问了孩子们冬天怎么取暖。看到屋里的暖气片，他很感慨：“我上学的时候，冬天大家轮着生火，一...
3	002.9月20日神州文化之旅第二天.txt	245	生火时候，要在院子里，早晨零下几度，在院子里生火，左生不着，右生不着，两手就冻成红萝卜，要跺着脚，放在嘴边用热气呵个不停才成。用这种炉子，在续煤的时候，可不能偷懒，若是续上煤球，偷懒不端到屋外，或还冒着蓝火苗就给请了进来，大家就有煤气中毒的危险，用北京话，这叫‘煤熏着了’，被害人轻则到院子里吃西北风透气，灌酸菜汤；重则一命呜呼。	后院有间教室是学校的画室。也有孩子在上课。李敖说，给孩子们打个招呼，走了进去。在这里，他想起了自己学画的经历：“图画课上，我总是画汽车，女老师很欣赏我画的汽车。我对汽车的印象，是在太原建立的，那时很少小朋友像我这样“现代化”过，他们要画，大都画洋车，就是人力车。”李敖特别问了孩子们冬天怎么取暖。看到屋里的暖气片，他很感慨：“我上学的时候，冬天大家轮着生火，一...
7	002.9月20日神州文化之旅第二天.txt	263	往事如烟，永远新鲜；前程似锦，气象万千。	李敖原定在新鲜胡同小学拜访半个小时，最终却停留了50多分钟。李敖曾问校长田瑞琴，学校的历史档案还有吗？田校长说，从我来到学校后就没有见过。李敖说，我觉得应该恢复，梁实秋也是这个学校的嘛。还有历任的校长、老师，都应该记下来。小学生们把自己制作的图画、剪纸、报帖等送给了李敖。大学长则把自己的著作《北京法源寺》送给母校作为留念，并特意对田校长说，这是三本，你可以“...
3	002.9月20日神州文化之旅第二天.txt	267	我把我的爱送给了母校！	众人大笑，挥手作别。临走，李敖特意打开车窗，向不能进入学校的大批记者拱手致意，问及送何物给母校时，李敖答：“我把我的爱送给了母校！”
4	002.9月20日神州文化之旅第二天.txt	271	妈妈，您的学生李敖来看您了。	手捧鲜花的李敖走进鲁荣坤老师家的时候，86岁的鲁老已因帕金森症无法说话。前去打前站的记者说，鲁老师如果见到李敖时眼睛能亮一下就不错了。鲁荣坤的两个女儿付敏、付惠一边对李敖说：“欢迎你来北京”，一边大声地对母亲说：“妈妈，您的学生李敖来看您了。”两位女儿特意强调了李敖二字。但是，鲁老师脸上没有什么表情，眼睛甚至也没有亮上一下。她的女儿解释说：“她心里还知道，但...
4	002.9月20日神州文化之旅第二天.txt	271	她心里还知道，但是脸上的表情不太丰富。	手捧鲜花的李敖走进鲁荣坤老师家的时候，86岁的鲁老已因帕金森症无法说话。前去打前站的记者说，鲁老师如果见到李敖时眼睛能亮一下就不错了。鲁荣坤的两个女儿付敏、付惠一边对李敖说：“欢迎你来北京”，一边大声地对母亲说：“妈妈，您的学生李敖来看您了。”两位女儿特意强调了李敖二字。但是，鲁老师脸上没有什么表情，眼睛甚至也没有亮上一下。她的女儿解释说：“她心里还知道，但...
4	002.9月20日神州文化之旅第二天.txt	271	我是李敖，我来看您。	手捧鲜花的李敖走进鲁荣坤老师家的时候，86岁的鲁老已因帕金森症无法说话。前去打前站的记者说，鲁老师如果见到李敖时眼睛能亮一下就不错了。鲁荣坤的两个女儿付敏、付惠一边对李敖说：“欢迎你来北京”，一边大声地对母亲说：“妈妈，您的学生李敖来看您了。”两位女儿特意强调了李敖二字。但是，鲁老师脸上没有什么表情，眼睛甚至也没有亮上一下。她的女儿解释说：“她心里还知道，但...
4	002.9月20日神州文化之旅第二天.txt	271	没关系，没关系，你握吧。	手捧鲜花的李敖走进鲁荣坤老师家的时候，86岁的鲁老已因帕金森症无法说话。前去打前站的记者说，鲁老师如果见到李敖时眼睛能亮一下就不错了。鲁荣坤的两个女儿付敏、付惠一边对李敖说：“欢迎你来北京”，一边大声地对母亲说：“妈妈，您的学生李敖来看您了。”两位女儿特意强调了李敖二字。但是，鲁老师脸上没有什么表情，眼睛甚至也没有亮上一下。她的女儿解释说：“她心里还知道，但...
3	002.9月20日神州文化之旅第二天.txt	271	我能握她的手吗？	手捧鲜花的李敖走进鲁荣坤老师家的时候，86岁的鲁老已因帕金森症无法说话。前去打前站的记者说，鲁老师如果见到李敖时眼睛能亮一下就不错了。鲁荣坤的两个女儿付敏、付惠一边对李敖说：“欢迎你来北京”，一边大声地对母亲说：“妈妈，您的学生李敖来看您了。”两位女儿特意强调了李敖二字。但是，鲁老师脸上没有什么表情，眼睛甚至也没有亮上一下。她的女儿解释说：“她心里还知道，但...
4	002.9月20日神州文化之旅第二天.txt	275	当时我妈妈特别高兴，有那种桃李满天下的感觉。	就在前一天，敬业的记者们已经把鲁老师家能采访的人都访了，鲁老师的女儿告诉记者，1993年春节，六七位李敖当年的同学前来拜访鲁老师，并把李敖托同学捎回的礼物——一只制作精良的牛皮钱夹送给她时，鲁老师才逐渐回忆起当年的学生李敖。“当时我妈妈特别高兴，有那种桃李满天下的感觉。”鲁老师特别珍惜这个钱夹，一直装在盒子里珍藏着。事隔12年后，这只钱夹看起来仍崭新如初。
4	002.9月20日神州文化之旅第二天.txt	279	我妈妈五〇年才结婚，我们都是五十年代出生的。	女儿说：“我妈妈五〇年才结婚，我们都是五十年代出生的。”
4	002.9月20日神州文化之旅第二天.txt	281	这是一个小红包，是美金。	李敖从衣兜里掏出一个红包递给鲁老师的大女儿付敏。付敏把红包塞到老人的手里，大声地说，这是学生送给您的。李敖说：“这是一个小红包，是美金。”据知情人透露，内有1000美金。鲁老师的女儿拿出礼品回赠李敖：这是一家报社帮她们制作的鲁老师年轻时的一张发黄的照片，照片上的鲁老师年轻而美丽。李敖说：她教我时就是这个样子。
5	002.9月20日神州文化之旅第二天.txt	283	意短情长，允称佳作	其实，李敖心中还有一个秘密，就是想见另一位老师王恒庆。他回忆说，王恒庆老师跟我们同学感情极好，但有一次被我们气得赌气不教了，走出教室，我跑出去，把她迎面推了回来。王恒庆老师是我小学时代最怀念的老师。我小时候，长得“真人不露相”，面目慈祥，同学们给我起外号，叫“老太太”，王恒庆老师也这样跟着叫，她能和学生打成一片，由此可见。王恒庆老师生小孩时候，她的哥哥来代课...
3	003.9月21日神州文化之旅第三天.txt	27	反求诸己	从郑成功的例子到胡适的例子，大家想想看，就是我们当自己被困扰的时候，我们如何能够解开。自由主义最重要的第一个层面是你心灵能不能解放。如果你心灵是郑成功式的，那你就困死了。所以我认为心灵开放是重要的。真正的自由主义者没有人想做，因为太痛苦了，因为太难了，要有很高的文化水平才能做自由主义者，自由主义这一部分叫作“反求诸己”。
