file	line	context
003.“逸豫适足亡身”吗？.txt	75	提高青年国文程度，需要从多方面做起，做长时期努力。首须改进中学和大专的国文教学方式，指导学生读活书、重理解，并鼓励涉猎课外读物，以养成读书兴趣，从而在汲取知识中能热爱民族文化。每一位大中学生，亦应扬弃狭隘的实用主义，多多练习写作，以陶冶性情，增强表达能力。只要阅读愈多，就会积理日富，视野广阔；只要勤于写作，就会熟能生巧，运用自如，言之有物，斐然成章。几位国学名家最近在一次语文会议中，主张“加重大学联招国文科作文分数之比例”，是一项很好的建议，并可推行于专科及高中联招。如能在中学时期开始，加强国文教育，规定必须达到某种水平，尤为普遍提高学生国文程度切实可行的办法。（《中央日报》社论一九七九年七月二十七日）
003.“逸豫适足亡身”吗？.txt	79	断章取义的大学联考作文题目（刘福增）
003.“逸豫适足亡身”吗？.txt	83	许久以来，大学作文考题的命题者总是雄心勃勃，不但要求学生个个成为古文大家，还要学生穿“圣人贤哲”的大礼服。殊不知那些大而不当的题目，实在经不起逻辑的考验。本文作者是一位大学逻辑学教授，今年的作文题显然难逃他的“法眼”。
003.“逸豫适足亡身”吗？.txt	85	今年（六十八）大学联考的作文题目是：“忧劳所以兴国，逸豫适足亡身”。据报纸的报导，教育部长朱汇森称赞这个题目出得很恰当，而且具有时代意义。其他一些教育官员，譬如，台大校长阎振兴、政大校长欧阳勋、台北市立第一女子中学校长邓玉祥，也发表过类似的评断。这个题目是不是真的出得“恰当”，而且“具有时代意义”呢？
003.“逸豫适足亡身”吗？.txt	89	在没有回答这个问题以前，先让我们看看这些年来，大学联考曾经出过的一些作文题目：
003.“逸豫适足亡身”吗？.txt	91	一、六十三年：荀子云：“吾尝终日而思矣，不如须臾之所学也”试申其义。
003.“逸豫适足亡身”吗？.txt	93	二、六十四年：曾文正公云：“风俗之厚薄，系乎一二人心所向”试申其义。
003.“逸豫适足亡身”吗？.txt	109	前举六十六年和六十七年的两个题目，可以说是“论宇提示类”的题目。所谓论宇，就是讨论的领域。论宇提示类的题目，只标出撰文者需要讨论的是哪一个领域的东西。至于在这个领域内撰文者需要讨论什么，可由他自己“自行”决定。这也就是说，论宇提示类的题目，只规定讨论的范围，而没有规定特定的讨论持题，撰文者可自行决定特定的讨论持题。
003.“逸豫适足亡身”吗？.txt	113	不论是哪一类的作文题目，一个“好的”题目的必要条件之一，是题目的字面意义或语意（meaning）要明白容易懂。考作文的主要目的，不是要考“国学能力”或“词句解释能力”，而是要考“作文能力”，所谓作文能力，是指用文字去表达思想和感情等的能力。这两种能力，并没有必然的关联，一个词句解释能力很好的人，作文能力未必很好。一个因词句解释能力而读不懂古文的人，可能写一手好的白话文。
003.“逸豫适足亡身”吗？.txt	115	对一个不懂中文或中文能力很差的哈佛大学文学或哲学教授来说，他的中文词句解释能力，不是没有就是很差。现在假定我们出一中文作文题目“人性的光辉”，要考他的作文能力——一般的作文能力（也就是他可以用任何他喜欢的语言来写这个题目）。那么，他不是无从下笔，就是可能错解题意，而写出文不对题的文章（注意，考试的时候，不准问题意）。
003.“逸豫适足亡身”吗？.txt	121	现在，让我们回来看看今年大学联考作文题目“忧劳所以兴国，逸豫适足亡身”。
003.“逸豫适足亡身”吗？.txt	123	首先，这个题目的字面意义，虽然不是非常难读难懂，但是，也绝非易读易懂。“忧劳”的明确意思是什么？“逸豫”的意义又是什么？连我这个在大学教了十几年书，而也写过不少东西的人，都无法一下子明确地了解这两个词语的字面意义，相信一般高中毕业生也不会好得多。这两个词语绝不是常用词语。又这里的“亡身”一词，也令人十分困惑。是当“死亡”讲呢？还是当诸如“身败名裂”讲呢？从字面来说，“亡身”当然是死亡，但是什么事情那么要不得得要使人死亡呢？如果当身败名裂讲，又何必用“亡身”而要人绕弯子呢？我这样一推敲，恐怕十分钟已过，那还剩下多少时间可用来构思写作呢？
003.“逸豫适足亡身”吗？.txt	127	我们在前面说过，这是一个持题论护的题目。那就是说，题目本身已经揭示某一个主张或事理。做题目的人，必须去辩护支持这个主张或事理，是成立的、有道理的。
003.“逸豫适足亡身”吗？.txt	133	那么，上述题目的主张是什么呢？我们姑且解释为是：忧虑辛劳可以振兴国家，舒适安乐充分可以使人灭亡。这个主张有没有道理呢？我的回答是：原语句在原系络里讲，是有道理的，但经大学联考命题先生修改，拿来在今天的台湾来讲，是没什么道理的。拿一个没道理的主张，要考生去辩护，更没有道理了。
003.“逸豫适足亡身”吗？.txt	135	我们知道，这个题目是抽录自欧阳修《五代史伶官传序》。根据《古文观止》，原句是“忧劳可以兴国，逸豫可以忘身”。原句与考题有两个不同的地方。一个是原句第二个“可以”被修改为“适足”。另一个地方是“忘身”被改为“亡身”。我们假定“亡”与“忘”通用好了。那就是“忘身”和“亡身”都是死亡的意思。但是“可以”和“适足”却有很不同的逻辑意义。当甲“可以”（may）发生乙时，有甲未必有乙。但是，当甲“适足”（suffieient）发生乙时，有甲必定有乙。
003.“逸豫适足亡身”吗？.txt	143	现在我们要问的是，大学联考的命题和选题人员的心目中，要考生把这个题目对什么时空和人身讲呢？在时空方面，显然是要就当前的台湾来讲的。在人身方面呢？料命题和选题人员的意思，不会（也不敢）是要就上位者来说的。姑且就假定是对上位者来说吧。那么，这个题目显然是无的放矢的。因为尽管在当前台湾，政治上还有许多不能令人满意的地方，但是，相信没有人会指摘说，我们今天有权的上位者，不忧劳而逸豫。因此，就这个时空人身来说，这个题目并没有什么“时代意义”。
003.“逸豫适足亡身”吗？.txt	165	朱部长的这段评断，是一种无思虑的泛论。第一、这个作文题目，并不是出自魏征的《谏太宗十思疏》，而是出自欧阳修的《五代史伶官传序》。同时，后者也没有被选在现行高中国文课本中。第二、我深信，朱部长并不知道这是一个持题论护的题目。这种题目已定下“结论”，考生需要做的，主要是提出种种理由和证据，来支持这个结论。这与展布个人的奋斗、报国的抱负无关，也与考生修养心性无关。这个题目的正确作法是，考生要拿出自己的知识和经验，根据严密的逻辑推理，以达到题目规定的结论。这不是表达个人感情、志愿和抱负的题目。
004.中国小姐新论.txt	25	错在提议者所根据的理由。亚里士多德说美是上帝的礼物，人类发明选美，不过摆出礼物而已，赏心悦目，快然自足，没有别的，也无须有别的。美本身就有“原始的完整性”（primitive integrity），选美本身就有它自己的意义，不必被也不该被“政治挂帅”。想用中国小姐搞“统战”、表示“进步”的学人，应该问问自己：这种动不动就“一切为政治”、“政治领导一切”的毛病，是不知不觉跟谁学的？罗素从苏联回来，说他吃不消共产主义的一点是：共产主义事事都要为政治服务，学人们怎么这点分寸还弄不明白？想用中国小姐搞“统战”、表示“进步”，可曾想到未在枝节上得好处，已先在根本上——“政治挂帅”上开了倒车？你们的书，念到哪儿去了？
004.中国小姐新论.txt	51	不管别人怎么说，我想我最知道这个问题的真正答案。我知道虽然我很喜欢你，可是我们的所谓“恋爱”呵，并未开始。没开始的原因之一，大概就是你跟《中华日报》记者所说的“李敖没有追求过”罢？
004.中国小姐新论.txt	53	我生平见过不少可爱的女孩，也恋过不少次爱，并且直到现在为止，还“尘缘未了”“艳事频传”，大概你也听说过。对可爱的女孩子，我“追求”过，但是我不“追求”得太吃力。一般情形是，我会主动date或“布下蜘蛛网”，不过都是以一次为限。再漂亮动人的女人，我也没有耐心（或脸皮）去“进攻”第二次，——在爱情沙场上，我像是一个只会打冲锋的人。
005.罗斯福路该改名罗斯祸路.txt	3	你不喜欢一个人，比如说李敖，你可以骂他，但不论怎么骂，你骂的话，大都是形容词，不是名词，你骂李敖“他妈的”，“他妈的”是形容词，“他妈的”并不等于李敖，别人问起，你必得补足被骂的人的名字，别人才明白，不然反会误会，以为你不是骂李敖，而是骂他菜做得难吃，而给你一拳。
005.罗斯福路该改名罗斯祸路.txt	5	于是，你进步了，你上当学乖，改用名词骂人，你学会用“王八蛋”骂李敖，王八蛋是名词，至少骂的对象是人，不是菜。但王八蛋李敖，只有你知道，别人不知道，你每次得解释这王八蛋不是别人，就是李敖，这样不但麻烦，仍旧引起误会，因为你无法预先声明别人不是王八蛋，你在别人面前一声明，别人又给你一拳。
005.罗斯福路该改名罗斯祸路.txt	7	如果你挨了揍，却在口舌上占了别人的便宜，也算不白挨，糟糕的是，你可能没占到便宜，反大吃其亏。当年王照讨论注音符号，在会议上跟吴敬恒冲突，大骂吴敬恒“王八蛋”，吴敬恒嬉皮笑脸，回敬一句：“小弟不姓王。”可见，用王八蛋骂人，虽然用的是名词，还是易滋流弊，至少姓王的不行。
005.罗斯福路该改名罗斯祸路.txt	9	最后，聪明人到底想出好方法来了。好方法是：要想确定被骂的人非李敖莫属，非得在“李敖”这个专有名词上打主意不可，要把骂的字眼嵌进这小子的名字里去，才能坚固、才能如君所愿。这种好方法，叫做“改名学”，就是“老子改你小子名字的学问”。
005.罗斯福路该改名罗斯祸路.txt	15	说到这里，说的都是自己自愿改名的范例，实在无甚稀奇。一个人自愿改名，一定愈改愈好，绝不会把坏字眼坏词儿嵌到自己名里去，这就是说，一个人不会神经到自己在名字里骂自己，要骂，也得由别人来骂、来改。所以，“改名学”的真义，不指自己改名字，而是“老子改你小子名字”，改得你恶名昭彰，才使人心大快。
005.罗斯福路该改名罗斯祸路.txt	25	梁武帝弟子正德跑到北魏去了，后来又跑回来，梁武帝不高兴了，认为他背叛了自己，就改他姓为“背”字，以为警告。又有豫章王跑到北魏；梁武帝把豫章王的儿子改姓“悖”，报复他老子的悖逆行为。唐玄宗（李隆基）时候，太平公主造反，窦怀贞畏罪跳河自杀，被改姓“毒”字。又有玄宗同宗李晋被宰掉，从此取消他姓李，改姓“厉”。这种方法，是用一个跟这小子身份接近的坏字，加在他头上，可叫“姓相近法”。
006.重要不重要与不重要重要.txt	13	勃朗宁诗里写一位老兄认为全世界以烂泥巴最重要，乍看起来，不可思议；但布雷克能从一粒沙里看到世界，柯尔律治能从一粒沙里看到宇宙，可见一把烂泥巴也大有奇趣。这样看来，怀疑别人“胡为乎泥中”，在没弄清重要性以前，最好别先否定。因为这把烂泥巴，可能对他特别重要。
006.重要不重要与不重要重要.txt	15	又如古话说“敝帚千金”，你会奇怪，一把烂扫把有什么稀奇，值得这样标价。但同样的，在没弄清重要性以前，最好别先否定——因为这把烂扫把，可能对他特别重要。
006.重要不重要与不重要重要.txt	17	上面这些话，都是指当事人在正常处境下的看法。如果处境一旦剧变，他的主观，也可以量变加质变。一个人正常处境下认为黄金重要，但在荒年时候，他可以“千金易谷”，在战乱时候，他可以“黄金如粪土”。看了莎士比亚《理查三世》剧本的，看到第五幕第四场，国王高喊：“一匹马！一匹马！我以江山换一匹马！”（ A horse! a horse! my kingdom for a horse!）就知道一个人在重要不重要之间，会有多大的转变、多大的无法预知。
006.重要不重要与不重要重要.txt	31	中国古话说：“为政不在多言。”为政的职业是力行，力行“多言”者的意见，舆论的职业就是多言，多言就是人权、民主与求真，只有透过舆论的检讨，为政才能落实生根。为政不必高高在上指导舆论，而该与舆论认同，跟低低在下者顺流而下，这才是第一流。
007.张小兰冤在哪儿？.txt	3	歌星张小兰到法院告郑其正，说郑其正强奸，从床上挣扎到法庭上。最后，郑其正交给张小兰一份“致歉书”，对其人不正之“不轨行为”，表示歉意，当庭成立和解。
007.张小兰冤在哪儿？.txt	23	由于乱加道德判断，紧跟着就产生第二道“糊涂情绪”，就是乱用“动机观点”。“动机观点”在伦理学上属于“动机派”（motivism），这派走火入魔，判断一件事，不看事的本身，反倒追踪虚无缥缈的动机，用动机来决定一切。孟轲说：“乃若其情，则可以为善矣，乃所谓善也。”俞正燮直指孟轲说的“情”，就是“事之实也”，无异指动机就是事实，一切要看你存心如何：存心好，哪怕是为了恶，也“虽恶不罚”；存心不好，就便是为了善，也“虽善不赏”。这样不看后果，全凭究其心迹的测量术，一发而不可收拾，就会变得舍不该舍之末，而逐不该逐之本，以为人在这种本上下功夫，就可得到正果。这真是胡扯！王阳明说：“至善只是此心纯乎天理之极便是”，他全错了！善绝非一颗善心，便可了事。善必须实践，必须把钱掏出来、把血输出来、把弱小扶起来、把坏蛋打在地上，才叫善；反过来说想”掏钱、“准备”输血、“计划”抑强扶弱，都不叫做善。你动机好，没用，动机是最自欺欺人的借口，17世纪的西方哲人就看出这点，所以他们点破——“善意铺成了到地狱之路”（Hell is paved with good intentions）。这就是说，有善意而无善行，照样下地狱，阎王老爷可不承认光说不练。
007.张小兰冤在哪儿？.txt	25	西方哲人这种警觉，中国人显然跟不上。中国的老底子是“诛意”或“诛心”，是春秋笔法的“君子诛意不诛事”，是追究心意，不追究事实。结果呢，中国“日存万善念、日诵千善言”的好人最多，但好事最少。原来好人只要正心诚意就已足、只要问心无愧就已足、只要诵经念佛就已足，好人无须在事实上做多少好事，好事只在念头上做，就大功告成！——这种把动机当成事实的“动机观点”，就是第二道“糊涂情绪”。
008.“舒而脱脱兮！”.txt	3	中国人历来都号召读经，读经的内容起码是四书五经。因为经书中有许多玄妙的词句，所以后人的解释，也就见仁见智，众说纷纭。经书中最有味儿的是《诗经》，关于《诗经》的解释，因为各执一词，所以闹出来一句成语，叫“诗无达诂”。翻成白话，就是“诗没有固定的解释”。阿猫说诗的意思该如此如此，阿狗却说诗的意思该这般这般，其实诗的真义如何，阿猫和阿狗可能全对，也可能全不对，而该是阿牛阿马对。
008.“舒而脱脱兮！”.txt	5	《诗经》中“国风”里有首“野有死麕”，写一个“有女怀春，吉士诱之”的故事。里头有两句是：
008.“舒而脱脱兮！”.txt	11	这两句诗，不管从古到今，老夫子们是如何解释，但在我看来，却正好移做描写近代西方的一种新文明，叫做——“脱衣舞”。
008.“舒而脱脱兮！”.txt	13	所谓“脱衣舞”三个字，在中国卫道夫子们看起来，真是一种怪结合。中国古书中有“脱衣”两字，见《国语》中的齐语“脱衣就功”；古书中也有“舞”一字，见《礼记》中的乐记“舞动其容”。在古书中所看到的中国舞蹈（用时髦的说法，所谓“民族舞”），大致分开，可有两类；一类是“穿衣服的”，一类是“不穿衣服的”。前者不必细说，从“文始舞”、“武始舞”，直到跟娇滴滴杨贵妃有关的“霓裳羽衣舞”，都属于“穿衣服的”。古书如《书经》中所谓的“舞衣”、李白诗中所谓的“舞衫”，都反证了穿衣属实。至于后者“不穿衣服的”，公元5世纪时南朝宋前废帝刘子业、明帝刘彧，乃至6世纪时陈后主、陈叔宝等，都有叫宫女这样一丝不挂的记录。以上这两类古舞，其性质，非全穿即全脱，并无先穿后脱或一脱再脱如今天之脱衣舞者，故说脱衣舞，乃纯粹西方鬼子之玩艺而与中国传统文化无与，并不为过。
008.“舒而脱脱兮！”.txt	17	脱衣舞的正式名称叫“拨来撕克”（burlesque），简称burlesk，它的原始意义是“讽刺性或滑稽性的诗文图画”，引申而为“滑稽表演”。跟这个字演变出来的字如：
008.“舒而脱脱兮！”.txt	45	拨来撕克滑稽表演，到公元17世纪，就在法国流行；18世纪，又在英国流行；19世纪，美国开始推陈出新。首先这种表演只放在节目中的穿插（interlude）地位，由穿紧身衣服的女人出场，进而演变到所谓“小埃及人”（Little Egypt）式的肚皮舞，深受各界欢迎。到了20世纪初年（1909），百老汇出现哥伦比亚戏院，是为第一所拨来撕克戏场（the first burlesque theatre），当时主持的是查理·霍华德（Charlie Howard）的“纽约巴黎歌舞团”（Follies of New York and Paris）。歌舞演员安娜·赫尔德（Anna Held）在一个偶然的情形下，一条衣带松了，她连忙边掩边跳，窘态与羞态毕露，不料却大受观众激赏，报以掌声不绝。这下子触动老板的灵机。进而发现脱中有道，于是脱风斯起。
008.“舒而脱脱兮！”.txt	47	美国拨来撕克之父，一般都指明斯基（Harold Minsky）而言，明斯基兄弟皆精此道。但真正噱头最多的，当推歌舞大王齐格菲尔德（Florenz Ziegfeld）。齐格菲尔德一生提拔美女成名无数，花样之多，令人观止，举凡牛奶洗澡、胸围标准等等，都是他的“发明”，“齐格菲尔德歌舞团”（Ziegfeld Follies）在刚做歌舞表演的时候，表演女郎只不过飞起裙子，露到吊袜带为止，但在当时，已足够成石破天惊。原来当时女人的基本服装包括内衣、胸衣、外胸衣、瘦裤、窄裙、衬裙、落地长裙、高领……效果是三围不见，块肉遁形。所以，若有女人飞起裙子，把吊袜带露出来给男人看，自然是石破天惊的大事。
008.“舒而脱脱兮！”.txt	67	……Striptease，无以译之，译之曰“剥引”。剥者“剥猪猡”之剥，引者“引人入胜”之引。……剥引二者不过是基本动作，只能算是“大腿”而不成其为“戏”。实际上你花了三毛五至一元的门票，所得绝不止此，起码也要看满一个历时二时的节目。这节目包含还有什么呢？虽说有突梯滑稽的丑角出来插科打诨；有红男绿女的歌者登台引吭高歌；有成班舞姬现身乱跳乱扭；有些大腿戏院，甚至加映古董影片。循环放映，用以拖长时间，可是观众之意，当然不在这些夹七杂八的花样，有时弄得太繁了，反倒令人坐立不安，望眼欲穿。
008.“舒而脱脱兮！”.txt	73	一阵掌声紫光一闪，出来一位浓妆艳抹的尤物。观众屏气敛息。全神贯注。我们的巴黎菲菲（道地美国土产犹太种，原籍纽约城布鲁克林区，白金发乃是peroxide化学作用）先没精打采地唱两段歌曲，唱的是什么？孙子知道！一曲甫罢，乐班声音加紧，菲菲开始绕场巡回，有时一步一趋，算是舞蹈，有时念念有词，算是唱歌。观众性急，坐在椅子边，头向前伸。三五位卷起衬衫袖子的音乐师，大吹大擂，已把那只调子翻来覆去奏了三遍。忽然，说时迟，那时快，菲菲已把一只袖子扯掉。再转两转，又去了一只。再哼两声，裙子居然褪下……音乐班内的铜鼓咚咚，打得震天价响，观众们瞪起眼睛，张起嘴来。可是菲菲走到台角，扯起丝绒幕掩身，回头一笑而入。台下拼命鼓掌顿足，唿哨乌叫。
008.“舒而脱脱兮！”.txt	83	在高先生生花妙笔底下这门生花妙舞的大学问里，有史以来，最表演得出神入化的，则是跟明斯基与齐格菲尔德都有关系的吉普赛李玫瑰（Gypsy Rose Lee）。吉普赛李玫瑰生于1914年，父亲是一个小记者，在她四岁时跟母亲离了婚。后来她的母亲带着她们姐妹，跑到好莱坞去闯江湖，以她两姐妹都姿色不凡、歌舞出众，终被她们打出了天下。
008.“舒而脱脱兮！”.txt	101	法国以外，英国也是一个尚脱之国。过路问禁，约翰老牛也自有伊的特殊规格。例如英国观众不准用望远镜；又如裸体可以，但既裸则不可扭腰摆臀，扭腰摆臀则有警察管。这种作风，是把人钉在欣赏人体美上，比较冷静得多。英国是美国的祖宗，美国是英国的孙子，孙子为之疯狂的场面，祖宗却常常处之以礼貌性鼓掌，大体说来，这也是国民性不同。刘崎先生自伦敦大学研究归来，写了一本《留学散记》，里头有—段说：
008.“舒而脱脱兮！”.txt	119	正因为脱衣舞这一行愈来愈专精化、学术化，所以以其难能，人们渐觉其可贵，从事此道的女郎，大家也不敢再轻视她。美国的大学女生，客串或专业做脱衣舞女的，大有其人，甚至脱衣舞竞选总统者有之，整天闹抗议者亦有之。1964年莱丝丽卡侬（Leslie Caron）主演的一部电影《随伊所欲》（Promise Her Anything），片中因雇用普通女孩客串脱衣舞女，就曾遭到脱衣舞女的脱衣抗议，抗议口号是：“《随伊所欲》对脱衣艺术工作者不公平。”（Promise Her Anything Unfair To Striptease Artists.）此道娘儿的声势，于此可见！
009.过早的答案.txt	3	这几个月来，我很少发表文章，尤其在半年前辞去《文星》杂志的编务，更惹得外面谣言纷来，其中最凸出的一项谣言是：“李敖被抓起来了！”
009.过早的答案.txt	9	我举一个“玩的漂亮”的例子。在《文星》第八十一期中，我把苏雪林（化名碧屏）的《评<胡适评传>》登出来，让她把我骂得狗血喷头，并且不予即时反驳，以示雅量。苏雪林化名而来，是一把暗刀，这把暗刀，玩的漂亮之至。可是还有更漂亮的，在去年9月6号，在国民党党报《中央日报》上，来了一段名叫《谤书》的短评，利用苏雪林的暗刀，来“杀”李敖，说我的《胡适评传》是“谤书”，说：“这样一部书，若是如此一册一册出版，而无人提出异议，可以说是士林之耻。我们今日愿以这篇短文，表示异议。”
009.过早的答案.txt	13	这把大刀，在登出这篇短评的前四天，又登出一篇所谓《保全台大的名誉》的短评，也是对李敖而发的，里面公然主张绳我以法，后两段说：
009.过早的答案.txt	15	……不肖的学生亦间有之。如某杂志最近几个月，连续刊载某毕业生诬蔑台大的文章，判师毁友，极尽其架空造谣刻薄恶毒之能事。台大在校师生以及海外师友看见此种文章，至少感觉其为母校之羞，无可容忍。
