id,book,chapter,source_file,line_start,line_end,quote_text,category,source_or_origin,summary,notes
LAYWUS-001,阳痿美国,扉幕——JOHN-JOHN开场白,001.扉幕——JOHN-JOHN开场白.txt,7,7,挺纵不收,中医古籍术语,《薛己医按》,说明 priapism 时引用中医古籍中的病名术语。,
LAYWUS-002,阳痿美国,扉幕——JOHN-JOHN开场白,001.扉幕——JOHN-JOHN开场白.txt,9,9,强阳不倒,中医古籍术语,陈士铎《石室秘录》,接《薛己医按》术语，列出《石室秘录》中的白话化说法。,
LAYWUS-003,阳痿美国,扉幕——JOHN-JOHN开场白,001.扉幕——JOHN-JOHN开场白.txt,11,11,阴茎坚长而精自出也,中医古籍解释,中医关于“强中”的解释,辨析强中与阴茎异常勃起时引古医书语。,
LAYWUS-004,阳痿美国,扉幕——JOHN-JOHN开场白,001.扉幕——JOHN-JOHN开场白.txt,11,11,常发虚阳，不交精出,中医古籍解释,中医关于“强中”的解释,继续解释强中的古医书用语。,
LAYWUS-005,阳痿美国,扉幕——JOHN-JOHN开场白,001.扉幕——JOHN-JOHN开场白.txt,31,33,"别再杀飞蛾和蝴蝶了，
最后审判近在眼前了。",译诗,李敖译 William Blake《Auguries of Innocence》诗句,开场以布莱克诗句引出最后审判意象。,
LAYWUS-006,阳痿美国,扉幕——JOHN-JOHN开场白,001.扉幕——JOHN-JOHN开场白.txt,35,37,"Kill not the Moth nor Butterfly，
For the Last Judgment draweth nigh.",英文诗句,William Blake《Auguries of Innocence》,同一布莱克诗句的英文原文。,
LAYWUS-007,阳痿美国,序幕——最后审判,002.序幕——最后审判.txt,47,47,I shall never believe that God plays dice with the world.我绝不相信上帝会对世人掷骰子。,科学格言,Albert Einstein 语意,借“上帝不掷骰子”语意回应最后审判的宗教场景。,
LAYWUS-008,阳痿美国,序幕——最后审判,002.序幕——最后审判.txt,83,87,"We Believe in Divine Judgment
God is not only the Creator but he is also the Judge of all the earth.
All men and nations stand before His judgment bar.",基督教信条,We Believe in Divine Judgment,摘出关于上帝创造与审判的英文信条。,
LAYWUS-009,阳痿美国,序幕——最后审判,002.序幕——最后审判.txt,167,167,死后有报，纤毫受之,佛教语,佛教因果报应语,说明佛教也有死后审判观念时引用。,
LAYWUS-010,阳痿美国,序幕——最后审判,002.序幕——最后审判.txt,167,167,莫轻小恶，以为无罪,佛教劝诫语,佛教因果劝诫语,说明小恶亦会受审判时引用。,
LAYWUS-011,阳痿美国,序幕——最后审判,002.序幕——最后审判.txt,201,201,"我又看见一个白色的大宝座，和坐在上面的那位……我又看见死了的人，无论大小，都站在宝座前。案卷都展开了，还有另一卷，就是生命册，也展开了。死了的人都凭着这些案卷所记载的，照着他们所行的受审判。（Then I saw a great white throne and him who was seated on it... And I saw the dead, great and small, standing before the throne, and books were opened. Then another book was opened, which is the book of life. And the dead were judged by what was written in the books, according to what they had done.）",圣经引文,《新约·启示录》第20章11-13节,上帝李背诵启示录白色大宝座审判段落。,
LAYWUS-012,阳痿美国,序幕——最后审判,002.序幕——最后审判.txt,215,215,父不审判人，却已经把审判的权柄完全交给子。,圣经引文,《约翰福音》第5章第22节,解释审判权柄交给子的经文。,
LAYWUS-013,阳痿美国,序幕——最后审判,002.序幕——最后审判.txt,215,215,The Father judges no one，but has given all judgment to the Son.,圣经英译,John 5:22,同一《约翰福音》经文英译。,
LAYWUS-014,阳痿美国,序幕——最后审判,002.序幕——最后审判.txt,219,219,约翰不敢看坐在上面的，所以无从描述。,宗教注释,周联华牧师解释《启示录》,引用周联华牧师对启示录宝座上那位不可描述的解释。,校对补入：宗教注释，不属政治语录。
LAYWUS-015,阳痿美国,第1幕——审判华盛顿,003.第1幕——审判华盛顿.txt,125,125,皇帝轮流做，今年到我家,古典小说俗语,《西游记》孙悟空语,借孙悟空名句说明轮值上帝的戏剧设定。,
LAYWUS-016,阳痿美国,第1幕——审判华盛顿,003.第1幕——审判华盛顿.txt,155,155,Je me presse de rire de tout，de peur d'être obligé d'en pleurer.,法文名言,Beaumarchais 语,用博马舍名言说明“快笑以防哭”。,
LAYWUS-017,阳痿美国,第1幕——审判华盛顿,003.第1幕——审判华盛顿.txt,155,155,I quickly laugh at everything，for fear of having to cry.,英文译句,Beaumarchais 语英译,同一博马舍名言的英文译句。,
LAYWUS-018,阳痿美国,第1幕——审判华盛顿,003.第1幕——审判华盛顿.txt,155,155,快笑以防哭,译语格言,Beaumarchais 语中译,李敖概括博马舍名言的中文译法。,
LAYWUS-019,阳痿美国,第1幕——审判华盛顿,003.第1幕——审判华盛顿.txt,205,205,Father，I cannot tell a lie，I did it with my little hatchet,文学轶事引文,Mark Twain “Mark Twain as George Washington”,考证华盛顿砍樱桃树传说时列出马克吐温版本。,
LAYWUS-020,阳痿美国,第1幕——审判华盛顿,003.第1幕——审判华盛顿.txt,205,205,I can't tell a lie，Pa；you know I can't tell a lie. I did cut it with my hatchet,传记轶事引文,M. L. Weems《Life of George Washington》,列出威姆斯传记中砍樱桃树故事的版本。,
LAYWUS-021,阳痿美国,第1幕——审判华盛顿,003.第1幕——审判华盛顿.txt,213,213,当事实在你一边，辩论事实；当法律在你一边，辩论法律；两者都不在你一边，就大呼小叫。,律师谚语,田纳西州律师名言,以律师谚语形容辩论策略。,
LAYWUS-022,阳痿美国,第1幕——审判华盛顿,003.第1幕——审判华盛顿.txt,213,213,When you have the facts on your side，argue the facts. When you have the law on your side，argue the law. When you have neither，holler.,英文法律谚语,Tennessee lawyer saying,同一律师谚语英文原文。,
LAYWUS-023,阳痿美国,第1幕——审判华盛顿,003.第1幕——审判华盛顿.txt,265,265,你可以欺骗所有人于暂时，你可以欺骗少数人于永久，但你不能欺骗所有人于永久,英文格言译文,You can fool all the people some of the time...,补收一条一般性欺骗格言；虽托名林肯，但非总统政策、演说或政治口号。,校对补入；保留为一般格言。
LAYWUS-024,阳痿美国,第1幕——审判华盛顿,003.第1幕——审判华盛顿.txt,265,265,You can fool all the people some of the time，and some of the people all the time，but you cannot fool all the people all of the time.,英文格言,常见托名 Lincoln 的格言,同一欺骗格言的英文原文。,校对补入；保留为一般格言。
LAYWUS-025,阳痿美国,第1幕——审判华盛顿,003.第1幕——审判华盛顿.txt,295,295,Et maiores vestros et posteros cogitate.,拉丁文古典引文,Tacitus《Agricola》,指出小亚当斯演说句可溯源至塔西佗。,
LAYWUS-026,阳痿美国,第1幕——审判华盛顿,003.第1幕——审判华盛顿.txt,295,295,Think of your forefathers and posterity.,古典引文英译,Tacitus《Agricola》英译,同一塔西佗句子的英译。,
LAYWUS-027,阳痿美国,第1幕——审判华盛顿,003.第1幕——审判华盛顿.txt,295,295,想想你们的前辈和后代。,古典引文中译,Tacitus《Agricola》中译,同一塔西佗句子的中文译法。,
LAYWUS-028,阳痿美国,第2幕——审判亚当斯,004.第2幕——审判亚当斯.txt,15,15,猫也可以一视国王,英文谚语译文,A cat may look at a king,亚当斯以英谚说明卑微者也可直视权威。,
LAYWUS-029,阳痿美国,第2幕——审判亚当斯,004.第2幕——审判亚当斯.txt,15,15,A cat may look at a king.,英文谚语,English proverb,同一英谚原文。,
LAYWUS-030,阳痿美国,第2幕——审判亚当斯,004.第2幕——审判亚当斯.txt,17,17,A cat may look at a Chinese God.,改写英谚,李敖化用 A cat may look at a king,把英谚改写进中国上帝的戏剧场景。,
LAYWUS-031,阳痿美国,第8幕——审判范布伦,010.第8幕——审判范布伦.txt,63,63,我觉得很难为情，你教育我们的青年人，而我们却盗印你的书。有朝一日，我们会有比较完善的法律，也许你们会采用我们的法律。,书信引文,R. W. Emerson 致 Thomas Carlyle 信,引用爱默生谈美国盗印英书时的歉意。,
LAYWUS-032,阳痿美国,第8幕——审判范布伦,010.第8幕——审判范布伦.txt,63,63,总该先给人家一点输入英国原版的时间。,书信引文,R. W. Emerson 致 Thomas Carlyle 信,补收爱默生同信中谈暂缓盗印的句子。,校对补入：版权书信语境，不属政治语录。
LAYWUS-033,阳痿美国,第8幕——审判范布伦,010.第8幕——审判范布伦.txt,63,63,大哥莫话小弟,中国俗语,传统俗语,用来说明英国与美国在盗印问题上前科相似的俗语。,校对补入。
LAYWUS-034,阳痿美国,第8幕——审判范布伦,010.第8幕——审判范布伦.txt,75,75,"You have undertaken to cheat me. I won't sue you, for the law is too slow. I'll ruin you.",企业家轶事名言,Cornelius Vanderbilt 语,引用范得比尔特关于法律太慢的强硬名言。,
LAYWUS-035,阳痿美国,第8幕——审判范布伦,010.第8幕——审判范布伦.txt,75,75,你耍老子，老子不告你，打官司太慢了，老子做掉你。,译语,李敖译 Cornelius Vanderbilt 语,同一范得比尔特名言的中文译意。,
LAYWUS-036,阳痿美国,第10幕——审判泰勒,012.第10幕——审判泰勒.txt,65,65,"They have sown the wind, and they shall reap the whirlwind.",圣经引文,《何西阿书》8:7,用圣经语形容恶行招致更大后果。,
LAYWUS-037,阳痿美国,第10幕——审判泰勒,012.第10幕——审判泰勒.txt,65,65,作恶之报，果大于因。,圣经译意,李敖译《何西阿书》8:7语意,同一句圣经语的中文概括。,
LAYWUS-038,阳痿美国,第16幕——审判林肯,018.第16幕——审判林肯.txt,17,17,"There are cases of praise which could not be expected, and of reproach when the parties have been seeking to be perfect.",孟子英译,《孟子》“有不虞之誉，有求全之毁”英译,用孟子语说明林肯身后的赞毁。,
LAYWUS-039,阳痿美国,第16幕——审判林肯,018.第16幕——审判林肯.txt,17,17,有不虞之誉，有求全之毁,孟子名句,《孟子》,同一句孟子原文。,
LAYWUS-040,阳痿美国,第18幕——审判格兰特,020.第18幕——审判格兰特.txt,89,89,"Tom said to himself that it was not such a hollow world, after all. He had discovered a great law of human action, without knowing it-namely, that in order to make a man or a boy covet a thing, it is only necessary to make the thing difficult to attain. If he had been a great and wise philosopher, like the writer of this book, he would now have comprehended that Work consists of whatever a body is obliged to do and that Play consists of whatever a body is not obliged to do…（汤姆自言自语道：“世界可不是盖的。”他无意中对人类行为发现了一个伟大原则，这原则是没人知道的，就是：要一个人或一个小孩追求某件东西，唯一的妙计，就是使这件东西难以得到。假若他是一个伟大而聪明的哲学家——如本书作者，他一定知道工作是人人不得不做的，而游戏是人人可以不做的……）",文学引文,Mark Twain《The Adventures of Tom Sawyer》,引用汤姆索亚粉刷墙壁故事中关于工作与游戏的结论。,
LAYWUS-041,阳痿美国,第24幕——审判麦金莱,026.第24幕——审判麦金莱.txt,45,45,吃人不吐骨头,中国俗语,传统俗语,形容侵夺彻底时引用。,
LAYWUS-042,阳痿美国,第25幕——审判老罗斯福,027.第25幕——审判老罗斯福.txt,85,85,每个婚礼中的新娘，每个丧礼中的死者,英文俗语译文,"the bride at every wedding, the corpse at every funeral",用俗语形容总想成为焦点的人。,
LAYWUS-043,阳痿美国,第25幕——审判老罗斯福,027.第25幕——审判老罗斯福.txt,85,85,the bride at every wedding，the corpse at every funeral,英文俗语,English saying,同一俗语英文原文。,
LAYWUS-044,阳痿美国,第33幕——审判艾森豪威尔,035.第33幕——审判艾森豪威尔.txt,131,131,道高一尺，魔高一丈,中国古话,传统成语/俗语,讨论攻防升级时引用古话。,
LAYWUS-045,阳痿美国,第33幕——审判艾森豪威尔,035.第33幕——审判艾森豪威尔.txt,131,131,The law is strong，but the outlaws are ten times stronger,谚语英译,“道高一尺，魔高一丈”英译,同一句古话的英文译意。,
LAYWUS-046,阳痿美国,第33幕——审判艾森豪威尔,035.第33幕——审判艾森豪威尔.txt,131,131,死猪不怕开水烫,中国俗语,传统俗语,说明极端弱势者已无可再惧时引用。,
LAYWUS-047,阳痿美国,第33幕——审判艾森豪威尔,035.第33幕——审判艾森豪威尔.txt,131,131,以小击大,成语,传统成语,列举不对称对抗相关成语。,
LAYWUS-048,阳痿美国,第33幕——审判艾森豪威尔,035.第33幕——审判艾森豪威尔.txt,131,131,以弱击强,成语,传统成语,列举不对称对抗相关成语。,
LAYWUS-049,阳痿美国,第33幕——审判艾森豪威尔,035.第33幕——审判艾森豪威尔.txt,131,131,以逸待劳,成语,传统成语,列举不对称对抗相关成语。,
LAYWUS-050,阳痿美国,第33幕——审判艾森豪威尔,035.第33幕——审判艾森豪威尔.txt,131,131,以不变应万变,成语,传统成语,列举不对称对抗相关成语。,
LAYWUS-051,阳痿美国,第36幕——审判尼克松,038.第36幕——审判尼克松.txt,151,151,债多不愁,中国俗语,传统俗语,谈长期逆差时引用俗语。,
LAYWUS-052,阳痿美国,第40幕——审判老布什,042.第40幕——审判老布什.txt,155,155,"If you pick us, do we not bleed ？If you tickle us ,do we not laugh？If you poison us, do we not die？ And if you wrong us , shall we not revenge？",莎士比亚引文,Shakespeare《The Merchant of Venice》Shylock 台词,引用夏洛克台词说明被伤害者也有同样人性。,
LAYWUS-053,阳痿美国,第40幕——审判老布什,042.第40幕——审判老布什.txt,155,155,你若刺我们一下，我们能不流血吗？你若搔我们的痒，我们能不笑吗？你若朝我们下毒，我们能不死吗？你若欺负我们，我们能不报仇吗？,译文,李敖译 Shakespeare 夏洛克台词,同一莎士比亚台词的中文译意。,
LAYWUS-054,阳痿美国,第41幕——审判克林顿,043.第41幕——审判克林顿.txt,127,127,Life is like a box of chocolates. You never know what you're gonna get.,电影台词,《Forrest Gump》,引《阿甘正传》台词说明不确定性。,
LAYWUS-055,阳痿美国,第41幕——审判克林顿,043.第41幕——审判克林顿.txt,161,161,America is a country of young men.,文学人物语,R. W. Emerson 语,引用爱默生关于美国年轻性的说法。,
LAYWUS-056,阳痿美国,第42幕——审判小布什,044.第42幕——审判小布什.txt,49,49,Caesar is above grammar.,历史轶语,Frederick the Great 与 Voltaire 相关轶语,以“恺撒凌驾文法”嘲讽文法错误。,
LAYWUS-057,阳痿美国,第42幕——审判小布什,044.第42幕——审判小布什.txt,49,49,恺撒凌驾文法之上。,译文,李敖译 Caesar is above grammar,同一历史轶语的中文译法。,
LAYWUS-058,阳痿美国,第42幕——审判小布什,044.第42幕——审判小布什.txt,283,283,你来攻击我，是靠着刀枪和铜戟。我来攻击你，是靠着万军之耶和华的名……耶和华使人得胜，不是用刀用枪。,圣经引文,《旧约·撒母耳记》戴维与歌利亚故事,引用戴维对歌利亚的话说明强弱悬殊下的取胜叙事。,
LAYWUS-059,阳痿美国,第42幕——审判小布什,044.第42幕——审判小布什.txt,443,443,视死如归,成语,传统成语,形容不惧死亡时引用。,
LAYWUS-060,阳痿美国,第42幕——审判小布什,044.第42幕——审判小布什.txt,443,443,face death as a home coming,成语英译,“视死如归”英译,同一成语的英文译意。,
LAYWUS-061,阳痿美国,第42幕——审判小布什,044.第42幕——审判小布什.txt,443,443,汤誓曰：‘时日害丧？予及女（汝）偕亡。’,古典引文,《尚书·汤誓》,引用汤誓中与日同亡的古典句。,
LAYWUS-062,阳痿美国,第42幕——审判小布什,044.第42幕——审判小布什.txt,443,443,O sun，when wilt thou expire？We will die together with thee.,古典引文英译,《尚书·汤誓》英译,同一汤誓句的英文译法。,
LAYWUS-063,阳痿美国,第42幕——审判小布什,044.第42幕——审判小布什.txt,543,543,一朝被蛇咬，十年怕井绳。,中国谚语,传统谚语,说明受惊后长期恐惧时引用。,
LAYWUS-064,阳痿美国,第42幕——审判小布什,044.第42幕——审判小布什.txt,543,543,杯弓蛇影,成语典故,传统成语,同段中用来形容疑惧过度。,
LAYWUS-065,阳痿美国,第42幕——审判小布什,044.第42幕——审判小布什.txt,589,589,In contemporary Christian theology there is a growing tendency to describe hell as a state rather than a place.,神学引文,当代基督教神学说法,说明地狱作为状态而非处所的神学解释。,
LAYWUS-066,阳痿美国,第42幕——审判小布什,044.第42幕——审判小布什.txt,589,589,当代基督教神学逐渐认为地狱是一种状态而非处所。,译文,李敖译当代基督教神学说法,同一神学引文的中文译意。,
LAYWUS-067,阳痿美国,第42幕——审判小布什,044.第42幕——审判小布什.txt,595,595,地狱即自身,哲学译语,T. S. Eliot 语意,尾声前以艾略特地狱观作对照。,
LAYWUS-068,阳痿美国,第42幕——审判小布什,044.第42幕——审判小布什.txt,595,595,Hell is oneself.,哲学引文,T. S. Eliot 语意,同一艾略特地狱观英文。,
LAYWUS-069,阳痿美国,第42幕——审判小布什,044.第42幕——审判小布什.txt,595,595,地狱即他人,哲学译语,Jean-Paul Sartre《Huis clos》语意,引用萨特名句作对照。,
LAYWUS-070,阳痿美国,第42幕——审判小布什,044.第42幕——审判小布什.txt,595,595,L'Enfer，c'est les Autres. Hell is other people.,哲学引文,Jean-Paul Sartre《Huis clos》,同一萨特名句的法文与英文。,
LAYWUS-071,阳痿美国,第43幕——审判奥巴马,045.第43幕——审判奥巴马.txt,47,47,我又看见一个白色的大宝座，和坐在上面的那位。从他面前天地都逃避，再无可见之处了。我又看见死了的人，无论大小，都站在宝座前，案卷都展开了，还有另一卷，就是生命册，也展开了。死了的人都凭着这些案卷所记载的，照着他们所行的受审判。于是海交出其中的死人、死亡和阴间也交出其中的死人，他们都照各人所行的受审判。,圣经引文,《新约·启示录》第20章,终幕前再次引用白色大宝座审判段落。,
LAYWUS-072,阳痿美国,尾幕——JOHN-JOHN收尾,046.尾幕——JOHN-JOHN收尾.txt,11,25,"Before the morning's dawn，the Eagle call'd the Vulture，
The Raven call'd the Hawk. I heard them from my forests，
Saying：“Let us go up far，for soon I smell upon the wind，
A terror coming from the South.”The Eagle and Hawk fled away
At dawn，and ere the sun arose，the Raven and Vulture follow'd.
Let us flee also to the North. They fled. The Sons of Men
Saw them depart in dismal droves. The trumpets sounded loud，
And all the Sons of Eternity descended into Beulah.",英文诗句,William Blake《The Last Judgement》,尾幕引用布莱克长诗《最后审判》的最后八行。,
LAYWUS-073,阳痿美国,尾幕——JOHN-JOHN收尾,046.尾幕——JOHN-JOHN收尾.txt,27,35,"南风栗冽，闻风迫追。
众禽交语，吾侪北归。
日之出矣，无待熹微。
人子以目，号角鼓吹。
彼国永堕，来生成灰。",译诗,李敖译 William Blake《The Last Judgement》,同一布莱克诗段的中文译文。,
